channel_title,no_of_vids,trending_date,title,category_id,publish_time,views,likes,dislikes,comment_count,comments_disabled
Galileo,200,17.14.11,Mehr als nur Marktschreier? Ein eigener Stand auf dem Markt | Galileo | ProSieben,24,2017-11-13T17:30:01.000Z,23834,643,29,111,False
Ruhrpottwache,185,17.14.11,Kind in Zeitung entdeckt: Durchtriebene Bandenarbeit | Die Ruhrpottwache | SAT.1 TV,24,2017-11-13T12:00:03.000Z,52673,1041,27,86,False
ĞĞ½Ğ°Ñ‚Ğ¾Ğ»Ğ¸Ğ¹ Ğ¨Ğ°Ñ€Ğ¸Ğ¹,182,17.14.11,Ğ¯Ñ†ĞµĞ½ÑĞº. ĞĞ•Ğ¿Ğ¾Ğ¿ÑƒĞ»Ğ¸ÑÑ‚. Ğ’ĞµÑ€Ğ½ÑƒĞ»ÑÑ,23,2017-11-13T10:54:46.000Z,419835,27738,656,4681,False
Auf Streife,180,17.14.11,Wir haben Hunger! - Kinder bitten auf der StraÃŸe um Geld | Auf Streife - Berlin | SAT.1 TV,24,2017-11-12T16:30:00.000Z,112372,2984,83,328,False
Ã‡ukur,180,17.14.11,CÌ§ukur 4. BÃ¶lÃ¼m,22,2017-11-13T20:52:13.000Z,35166,2387,125,494,False
atv,179,17.14.11,EÅŸkÄ±ya DÃ¼nyaya HÃ¼kÃ¼mdar Olmaz 80. BÃ¶lÃ¼m FragmanÄ± - atv,24,2017-11-12T17:50:30.000Z,716243,2981,170,302,False
Promiflash,172,17.14.11,Julienco: Darum hat er Bibi noch keinen Antrag gemacht!,24,2017-11-13T15:00:13.000Z,210688,5580,287,300,False
JP Performance,159,17.14.11,JP Performance -  Quetschen wir den Japaner mal aus ! | Lexus RC-F,2,2017-11-13T10:30:01.000Z,465883,19928,216,1240,False
SÃ¶z Dizi,140,17.15.11,SÃ¶z | 21.BÃ¶lÃ¼m,1,2017-11-14T00:39:50.000Z,2420770,26899,1686,3621,False
The Daily Show with Trevor Noah,140,17.15.11,How the Right Politicized Roy Moore's Sexual Misconduct Allegations: The Daily Show,23,2017-11-14T04:30:00.000Z,1059267,21327,476,2119,False
AdÄ±nÄ± Sen Koy,134,17.15.11,AdÄ±nÄ± Sen Koy 217. BÃ¶lÃ¼m,22,2017-11-14T16:01:03.000Z,166146,1497,187,240,False
Klinik am SÃ¼dring,133,17.14.11,Knochenbruch bei Geburt | Klinik am SÃ¼dring | SAT.1 TV,24,2017-11-12T12:30:00.000Z,319115,4755,121,498,False
Ğ Ğ¾ÑÑĞ¸Ñ 24,131,17.14.11,Ğ’ĞµÑÑ‚Ğ¸ Ğ½ĞµĞ´ĞµĞ»Ğ¸ Ñ Ğ”Ğ¼Ğ¸Ñ‚Ñ€Ğ¸ĞµĞ¼ ĞšĞ¸ÑĞµĞ»Ñ‘Ğ²Ñ‹Ğ¼ Ğ¾Ñ‚ 12.11.17,25,2017-11-12T15:38:50.000Z,302436,1893,1631,1519,False
VikatanTV,130,17.14.11,"Priyamanaval Episode 863, 13/11/17",24,2017-11-13T17:00:05.000Z,226795,1634,433,251,False
Made My Day,130,17.14.11,6 Dinge die du niemals im Fitnessstudio machen solltest!,24,2017-11-12T12:30:00.000Z,292988,10442,1015,473,False
Esra Erol'da,127,17.14.11,Ä°smini vermek istemeyen izleyicilerin iddialarÄ± canlÄ± yayÄ±nda! - Esra Erol'da 13 KasÄ±m 2017,24,2017-11-13T15:52:13.000Z,16147,45,11,1,False
Sallys Welt,126,17.16.11,Knusprige WaffelrÃ¶llchen / Zimtrollen / crunchy Cinnamon Rolls,26,2017-11-15T10:00:00.000Z,66712,2875,75,178,False
The Late Show with Stephen Colbert,126,17.15.11,Kim Jong-Un Hurt President Trump's 'Old' Feelings,24,2017-11-14T08:35:01.000Z,1025278,14065,593,1825,False
Beni Affet,125,17.14.11,Beni Affet 1253. BÃ¶lÃ¼m,1,2017-11-13T14:18:16.000Z,123529,1370,180,255,False
World Wide Wohnzimmer,123,17.14.11,"Ist Katja Krasavice deine Konkurrentin, du Bumsluder? | Micaela SchÃ¤fer im Hater-Interview",24,2017-11-12T16:00:01.000Z,148357,9073,291,795,False
Berlin - Tag & Nacht,120,17.13.12,Berlin - Tag & Nacht - Macht Kim wieder den gleichen Fehler? #1584 - RTL II,24,2017-12-12T19:00:00.000Z,85652,3273,124,479,False
Troom Troom De,118,17.18.11,15 BASTELN LIFE HACKS UND DIYs FÃœR DIE SCHULE,26,2017-11-17T13:00:02.000Z,178414,3998,290,247,False
Ä°stanbullu Gelin,118,17.14.11,IÌ‡stanbullu Gelin 25. BoÌˆluÌˆm Fragman,22,2017-11-13T19:01:57.000Z,191639,2120,65,263,False
KuchenTV,117,17.14.11,SchÃ¼lerin zeigt MitschÃ¼ler wegen schwarzen Humor an - Kuchen Talks #254,24,2017-11-10T17:00:02.000Z,349871,24873,9270,10501,False
ZDF,117,17.14.11,"Mikrometer, um 1900 - Bares fÃ¼r Rares vom 13.11.2017 | ZDF",24,2017-11-13T12:30:00.000Z,5853,26,4,16,False
LUKE! Die Woche und ich,116,17.14.11,Kinder ferngesteuert im Kiosk! Erwachsene abzocken - LUKE! Die Woche und ich | SAT.1,23,2017-11-12T22:30:01.000Z,797196,53576,302,1278,False
Jay & Arya,114,17.14.11,3 unbekannte Gesichter von Film/Serien-Charakteren (die wir enthÃ¼llen!),22,2017-11-13T18:09:55.000Z,181660,17998,169,554,False
Goal Deutschland,113,17.14.11,Furia Roja zu stark fÃ¼r Costa Rica: Spanien - Costa Rica 5:0 Highlights | Testspiel | DAZN,17,2017-11-12T09:46:24.000Z,258207,5116,66,296,False
Bodyformus,113,17.14.11,Kanaken auf der Klassenfahrt,23,2017-11-13T11:59:04.000Z,308683,35704,578,1398,False
Elhiwar Ettounsi,111,17.15.11,Omour Jedia S02 Episode 10 14-11-2017 Partie 02,24,2017-11-14T21:20:56.000Z,52920,291,47,57,False
Elli Schramm,110,17.14.11,Kleiner Gute Nacht GruÃŸ fÃ¼r dich ğŸŒ™ mit lieben GrÃ¼ÃŸen von mir ğŸ’—,24,2017-11-13T17:20:47.000Z,6177,0,0,73,False
HerrNewstime,108,17.14.11,Dagi Bee wird Heiraten | Coldmirror bekommt Ehrenpreis | YouTube Trends,24,2017-11-12T16:33:18.000Z,228574,11349,990,1049,False
Brotatos,108,17.14.11,RUNDLAUF FUÃŸBALL CHALLENGE + BESTRAFUNG !!,24,2017-11-13T14:03:32.000Z,111328,10692,115,548,False
Acunn.com,108,18.14.02,Survivor | 3.BÃ¶lÃ¼m | Turabi - Hakan tartÄ±ÅŸmasÄ±nÄ±n montajsÄ±z gÃ¶rÃ¼ntÃ¼leri TV'DE YOK!,24,2018-02-13T18:59:16.000Z,185279,1328,193,630,False
Leckerschmecker,104,17.25.11,Marzipan Kirsch Tiramisu - Rezept fÃ¼r eine fruchtige Variante des italienischen Dessert Klassikers,26,2017-11-24T17:30:01.000Z,5882,131,0,5,False
Zadruga Official,104,17.17.11,Zadruga - Miljan i Marko se potukli - 15.11.2017.,24,2017-11-16T12:11:05.000Z,278403,315,136,487,False
WALULIS,100,17.14.11,Legenden: So wird dein Ruhm unsterblich - Fame Academy | WALULIS,1,2017-11-13T15:06:12.000Z,62418,4749,44,425,False
REACT,100,17.14.11,DO COLLEGE KIDS KNOW 80s MUSIC? #8 (REACT: Do They Know It?),24,2017-11-12T20:00:01.000Z,549374,16832,248,3579,False
Philip DeFranco,99,17.15.11,"Huge IGN Failure Exposed, Why Zoella Is Being Called a Scammer, and EA Comes Under Fire...",24,2017-11-14T22:35:58.000Z,971117,50402,1526,10834,False
Ch3Thailand,99,17.14.11,à¸šà¹ˆà¸§à¸‡à¸šà¸£à¸£à¸ˆà¸–à¸£à¸“à¹Œ BuangBunjathorn EP.5 à¸•à¸­à¸™à¸—à¸µà¹ˆ 3/9 | 13-11-60 | Ch3Thailand,24,2017-11-13T17:00:07.000Z,22275,104,7,15,False
Kick11,99,17.16.11,Ballon dâ€™Or Gewinner geleakt! Zlatan zur WM in Russland? | KickNews,17,2017-11-15T14:00:03.000Z,160771,8302,169,2360,False
Late Night with Seth Meyers,98,17.15.11,Allegations Mount Against Roy Moore; Trump Cozies Up to Putin: A Closer Look,23,2017-11-14T02:09:55.000Z,1503131,20618,607,2676,False
Die Autodoktoren - offizieller Kanal,96,17.15.11,1 Tag in Holgers Werkstatt - Teil 3 | Ein einfacher SchlieÃŸzylinder wird zum Arbeitszeitfresser,2,2017-11-14T12:46:37.000Z,64352,2153,42,291,False
KenFM,94,17.16.11,KenFM im GesprÃ¤ch mit: Manfred Spitzer (Cyberkrank!),24,2017-11-14T17:45:53.000Z,30053,928,42,250,False
RadaanMedia,93,17.14.11,à®µà®¾à®£à®¿ à®°à®¾à®£à®¿ - VAANI RANI -  Episode 1416 - 13/11/2017,24,2017-11-13T16:30:01.000Z,170707,1152,178,166,False
Duymayan KalmasÄ±n,93,17.21.11,Duymayan KalmasÄ±n - 20 KasÄ±m 2017,22,2017-11-20T12:31:25.000Z,19709,67,23,39,False
MÃ¼ge AnlÄ± ile TatlÄ± Sert,93,17.14.11,Ahmet BaÅŸbahar telefon baÄŸlantÄ±sÄ±nda - MÃ¼ge AnlÄ± Ä°le TatlÄ± Sert 13 KasÄ±m,24,2017-11-13T10:12:49.000Z,17498,47,5,5,False
Rocket Beans TV,93,17.14.11,Das dritte Geschlecht und Dreier | Almost Daily #317,24,2017-11-11T20:00:02.000Z,34791,1595,284,502,False
GameStar,92,17.14.11,Negativ-Rekord fÃ¼r Battlefront 2 - EntschÃ¤digung fÃ¼r Age of Empires - News,20,2017-11-13T15:22:37.000Z,82380,4209,64,740,False
#Mentale Zuflucht,92,17.14.11,15 Mythen - die du nicht mehr glauben solltest!,24,2017-11-12T14:00:04.000Z,48679,2085,143,147,False
PietSmiet,91,17.16.11,Sind wir wie RTL? |Â Gute Frage Special PPP #12,24,2017-11-15T19:05:00.000Z,85878,6476,103,534,False
Sen Anlat Karadeniz,91,18.25.01,Sen Anlat Karadeniz 1.BÃ¶lÃ¼m,24,2018-01-24T19:31:31.000Z,124920,4705,117,724,False
Elif Dizisi,89,17.15.11,Elif 602. BÃ¶lÃ¼m | Season 4 Episode 42,24,2017-11-14T18:30:03.000Z,33135,232,35,31,False
CreepyPastaPunch,89,17.06.12,Schon wieder sagen die Simpsons die Zukunft voraus! Oder etwa doch nicht?,24,2017-12-05T15:30:00.000Z,47148,4024,166,527,False
FBE,87,17.14.11,YOUTUBERS REACT TO TOP 10 TWITTER ACCOUNTS OF ALL TIME,24,2017-11-12T22:00:01.000Z,960747,31810,669,5335,False
WWE,86,17.15.11,"Triple H returns to join Team Raw at Survivor Series: Raw, Nov. 13, 2017",17,2017-11-14T04:28:30.000Z,2455165,47921,2236,8112,False
PewDiePie,85,17.18.11,WE ARE ALL GOING TO D1E.,15,2017-11-16T17:53:31.000Z,2244679,174921,3035,20544,False
Gesundheitsblatt,85,17.14.11,Lege eine Zitrone mit Salz auf einen Teller und schau was passiert!,26,2017-11-13T17:00:04.000Z,15737,730,114,56,False
5-Minute Crafts,85,17.14.11,26 SIMPLE WAYS TO SPEED UP YOUR EVERYDAY ROUTINE,26,2017-11-13T16:30:00.000Z,803400,15545,1130,955,False
FailArmy,85,17.14.11,The Best 29 Fall Fails: FailArmy Hall of Fame (November 2017),23,2017-11-12T15:30:01.000Z,1128693,20073,1330,1320,False
Fazilet HanÄ±m ve KÄ±zlarÄ±,83,17.14.11,Fazilet HanÄ±m ve KÄ±zlarÄ± 22. BÃ¶lÃ¼m,22,2017-11-11T21:07:02.000Z,935983,6553,720,1267,False
BeÅŸiktaÅŸ KÃ¼ltÃ¼r Merkezi (BKM),83,17.16.11,GÃ¼ldÃ¼r GÃ¼ldÃ¼r Show 158. BÃ¶lÃ¼m Full HD Tek ParÃ§a,23,2017-11-15T21:00:07.000Z,59166,304,39,106,False
DAZN Premier League,82,17.20.11,Ibrahimovic-Comeback und Matchwinner Pogba: Manchester United - Newcastle 4:1 | EPL | DAZN,17,2017-11-19T09:20:27.000Z,435483,7362,235,224,False
NEO MAGAZIN ROYALE,82,17.17.11,Heute im Neo Magazin Investigative: Unternehmen Reichspark | NEO MAGAZIN ROYALE,24,2017-11-16T10:21:30.000Z,68851,2328,39,218,False
Good Mythical Morning,80,17.14.11,Google Translate Interview w/ Craig Robinson,24,2017-11-13T11:00:01.000Z,269764,8850,264,678,False
CinemaSins,79,17.15.11,Everything Wrong With Wonder Woman In 14 Minutes Or Less,1,2017-11-14T17:00:07.000Z,1032547,34751,1305,7375,False
The Tonight Show Starring Jimmy Fallon,79,17.15.11,Jimmy Fallon Pays Tribute to His Mother Gloria,23,2017-11-14T04:55:24.000Z,1611093,58474,837,3294,False
2Bough,78,17.14.11,Rezo & Kelly MissesVlog - 18 SONGS (Sing-off) / Ich bewerte MUSIK von YOUTUBERN,24,2017-11-12T19:46:23.000Z,106067,10189,119,1069,False
TopWelt,78,17.14.11,10 Unglaubliche Entdeckungen in der Antarktis!,24,2017-11-11T17:00:08.000Z,165276,4085,197,292,False
Hey Aaron!!!,78,17.21.11,Kleine Kinder verjagen und Timo stalken!,24,2017-11-20T13:00:02.000Z,97304,3963,1159,333,False
Yeni Gelin,78,17.14.11,Yeni Gelin 24. BÃ¶lÃ¼m,22,2017-11-11T21:16:45.000Z,419325,3574,258,555,False
HDMONA NEBARIT,78,17.19.11,New Eritrean Series Movie : áŠ£á‹¨áˆ°á‰¥   -  Aye-Seb -- Part-one  -- 2017,24,2017-11-18T15:48:57.000Z,80799,2484,39,227,False
Johnny Hand,77,17.14.11,Experimente - Was passiert mit Mais im GlÃ¤tteisen?,24,2017-11-12T08:00:01.000Z,161786,15354,872,4294,False
Show TV,77,17.14.11,Kalp AtÄ±ÅŸÄ± 20.BÃ¶lÃ¼m 1.Fragman,1,2017-11-12T19:07:44.000Z,1480455,12265,522,1927,False
Sturm der Liebe Official,75,17.14.11,Folge 2808: Angst vor Beatrice | Sturm der Liebe,24,2017-11-13T14:10:02.000Z,48016,787,26,184,False
SET India,74,18.04.01,"Crime Patrol - Ep 883 - Full Episode - 31st December, 2017",24,2018-01-02T17:27:04.000Z,208914,1026,132,114,False
MaroWeltShow,74,17.30.11,Ù‡Ø°Ø§ Ù‡Ùˆ Weihnachtsgeld Ø±Ø§ØªØ¨ Ù…Ø¬Ø§Ù†ÙŠ ØªØ­ØµÙ„ Ø¹Ù„ÙŠÙ‡ Ø¹Ù†Ø¯ Ù†Ù‡Ø§ÙŠØ© ÙƒÙ„ Ø³Ù†Ø© Ù‡Ø¯ÙŠØ© ÙÙŠ Ø£Ù„Ù…Ø§Ù†ÙŠØ§,22,2017-11-29T08:30:01.000Z,29032,2407,81,536,False
TheEllenShow,73,17.16.11,Kim Kardashian Lets Gender of Third Child Slip,24,2017-11-15T14:00:02.000Z,1559003,29898,884,1838,False
Klengan,73,17.14.11,Klengan deckt Bibis groÃŸes Geheimnis auf,24,2017-11-12T17:00:02.000Z,109194,10498,112,478,False
Comment Awards,72,17.10.12,Comment Awards v5,22,2017-12-09T19:00:02.000Z,253224,7432,257,1220,False
Jimmy Kimmel Live,72,17.15.11,Mean Tweets â€“ Jimmy Kimmel Edition,23,2017-11-14T08:30:01.000Z,2765121,35530,1705,2388,False
KÃ¶ln 50667 - Clips,72,17.24.11,Ollie FLIEGT AUF - VORSCHAU vom 24.11 | KÃ¶ln 506677,24,2017-11-23T18:33:36.000Z,28541,189,3,7,False
BILD FUSSBALL,71,17.20.11,Werder Bremen - Hannover 96 4:0 / Max Kruse mit Tor-Hattrick,17,2017-11-19T23:00:00.000Z,40588,1234,48,201,False
Sky Sport HD,71,17.22.11,Borussia Dortmund - Tottenham Hotspur | Highlights Champions League 2017/18 - 5. Spieltag,17,2017-11-21T23:06:25.000Z,203855,4004,139,0,True
ungespielt,70,17.15.11,Unge REAGIERT auf Kochen mit Tanzverbot! | ungeklickt,24,2017-11-14T15:18:09.000Z,249219,11699,3298,1288,False
TRT 1,69,17.17.11,DiriliÅŸ ErtuÄŸrul 95. BÃ¶lÃ¼m - ErtuÄŸrul Bey'in Alpleri ile KavuÅŸmasÄ±,24,2017-11-15T20:18:05.000Z,781498,0,0,0,True
Nadine Breitenstein,69,17.16.11,Spiegelblick 16. bis 22. November 2017,22,2017-11-15T19:43:15.000Z,5556,203,12,0,True
KinoCheck,69,17.17.11,THE KILLING OF A SACRED DEER Trailer German Deutsch (2017),24,2017-11-15T08:59:59.000Z,21778,424,23,25,False
Daily Dose Of Internet,68,18.04.02,What Happens When You Sing To A Bird,24,2018-02-03T17:08:56.000Z,581952,24343,483,3986,False
Lets-Bastel,68,17.14.11,Lets Bastel News #64 | News rund um den Kanal,24,2017-11-13T18:00:02.000Z,13690,595,148,562,False
Phil Laude,68,17.14.11,Wenn die Freundin anruft... GIRLFRIEND VOICE!,1,2017-11-12T17:00:01.000Z,286684,27188,435,943,False
Itsin TV,67,17.14.11,Dschungelcamp 2018: Diese Stars sind dabei!,24,2017-11-13T11:30:00.000Z,7683,140,8,21,False
TRT Televizyon,67,17.17.11,DiriliÅŸ ErtuÄŸrul 96.BÃ¶lÃ¼m FragmanÄ±,1,2017-11-15T21:09:05.000Z,375631,1895,102,0,True
Zvezde Granda,67,17.14.11,Zvezde Granda - Cela emisija 06 - ZG 2017/18 - 11.11.2017.,24,2017-11-12T00:02:41.000Z,496192,1503,443,1020,False
Freshtorge,67,17.26.11,Party Ride - Christmas Edition!!!,23,2017-11-25T13:00:02.000Z,218653,28609,275,2054,False
BangerChannel,66,17.14.11,Kollegah & Farid Bang âœ–ï¸ 180.000â‚¬ SHOPPING-TOUR âœ–ï¸,24,2017-11-11T16:12:55.000Z,721888,45981,914,4074,False
DAZN Bundesliga,65,17.21.11,Abwehrfehler stÃ¼rzen BVB weiter in Krise: Stuttgart - Dortmund 2:1 | Highlights | Bundesliga | DAZN,17,2017-11-19T23:00:02.000Z,344097,4651,162,679,False
Deutschland sucht den Superstar,65,17.30.12,Deutschlands Stimmwunder sind wieder zu allem bereit | DSDS ab 03.01.2018,24,2017-12-29T15:45:46.000Z,36783,145,6,10,False
Ufak Tefek Cinayetler,65,17.15.11,Ufak Tefek Cinayetler 5. BoÌˆluÌˆm Fragman,22,2017-11-14T20:06:56.000Z,339639,2583,53,245,False
RTV KLAN,65,17.14.11,E diela shqiptare - Ka nje mesazh per ty - Pjesa 1! (12 nentor 2017),24,2017-11-12T15:57:36.000Z,185548,654,150,45,False
Comedy Central UK,65,17.15.11,Donald Trump's Twitter Feud With Kim Jong Un | The Daily Show,23,2017-11-14T12:43:17.000Z,219940,2924,170,369,False
SÃ¶ylemezsem Olmaz,63,17.15.11,Åok iddia! Yeliz YeÅŸilmen'i eÅŸi aldattÄ± mÄ±?,22,2017-11-14T09:36:37.000Z,34081,65,29,55,False
Slivki Show DE,63,17.19.11,Das neue Haus fÃ¼r die Ameisen,24,2017-11-18T13:34:43.000Z,207632,15142,236,798,False
Julien Bam,63,17.14.11,Julien Bam reagiert auf HATE Kommentare (zum aller ersten Mal),24,2017-11-11T11:00:02.000Z,1186759,134977,5704,18549,False
HSM2k2,63,17.16.11,Hitzige Debatte im Landtag von Schleswig-Holstein - Nach AfD-Antrag zum Thema Obdachlosigkeit,25,2017-11-15T14:52:27.000Z,3395,114,0,50,False
MLG Highlights,62,17.18.11,Golden State Warriors vs Boston Celtics Full Game Highlights / Week 5 / 2017 NBA Season,17,2017-11-17T03:47:03.000Z,3158597,19584,995,7573,False
GRIP - Das Motormagazin,62,17.16.11,Gewinne einen VW Bulli T2!,2,2017-11-15T13:30:01.000Z,20409,985,21,88,False
Rap Check Deutschrap,62,17.15.11,ENO rastet komplett aus auf der BÃ¼hne | UnverschÃ¤mte Fans bespucken CAPO & ENO auf der BÃ¼hne,22,2017-11-14T12:03:11.000Z,46889,1927,69,202,False
CNN,62,17.14.12,Jake Tapper fact checks Roy Moore spokesman,25,2017-12-12T22:23:40.000Z,963043,8520,238,1730,False
Binging with Babish,62,17.15.11,Binging with Babish: Harry Potter Special,24,2017-11-14T15:18:53.000Z,853635,43655,213,2252,False
Verstehen Sie SpaÃŸ?,62,17.19.11,Joyce Ilg als verrÃ¼ckte Kassiererin | Verstehen Sie SpaÃŸ?,24,2017-11-18T10:00:02.000Z,177590,4941,291,403,False
Linus Tech Tips,61,17.14.11,IS GPU MINING STILL PROFITABLE? - Mining Adventure Part 1,28,2017-11-12T20:00:20.000Z,786155,37126,895,6091,False
Kliemannsland,61,17.14.11,Tietzer returns â€“ Treckerrennen 2 / Kann Fynn ihn endlich zerstÃ¶ren? | Kliemannsland,1,2017-11-12T12:00:07.000Z,149163,5452,97,280,False
Volksentscheid in Deutschland,60,17.16.11,Und wieder ein Beweis die AfD lÃ¤sst sich nicht verbiegen mit Alice Weidel,25,2017-11-15T16:53:56.000Z,4122,538,6,70,False
Sturm der Liebe,60,18.21.03,Folge 2884: Der Werbeclip | Sturm der Liebe,24,2018-03-20T14:10:02.000Z,53459,841,40,249,False
Liebscher & Bracht | Die Schmerzspezialisten,60,17.14.11,Diese Schlafposition solltest Du unbedingt vermeiden! | Liebscher & Bracht,17,2017-11-12T09:00:05.000Z,109571,4357,303,357,False
FOX,59,17.12.12,Bizim Hikaye 14. BÃ¶lÃ¼m 1. TanÄ±tÄ±mÄ±,24,2017-12-11T17:06:30.000Z,251173,2178,66,164,False
Siyah Ä°nci,59,17.14.11,Siyah IÌ‡nci 8. BoÌˆluÌˆm 2. Fragman,22,2017-11-13T20:04:40.000Z,194768,3706,78,234,False
rewinside,59,17.21.11,Rewi REAGIERT auf Propa OPA reagiert auf rewi regiert auf opa reagiert auf opa,20,2017-11-20T17:45:16.000Z,160106,23384,393,1124,False
Promy.news,59,18.30.01,ApoRed stÃ¼rmt mit neuem Song die Trends! So hÃ¶rt sich Billo an!,25,2018-01-29T14:00:05.000Z,19358,342,73,43,False
TIME 4 SPORT,59,17.15.11,Italien VS Schweden 0-0 (Alle Highlights) Italien scheitert in WM Qualifikation Playoff 2017,22,2017-11-13T22:08:29.000Z,102715,388,52,277,False
ConCrafter | LUCA,59,17.25.11,FuÃŸball Challenge im STADION ğŸ˜³ğŸ˜±,24,2017-11-24T16:25:23.000Z,153190,14717,391,1176,False
MSNBC,58,17.14.11,Barnicle: World Leaders Are Laughing At The US | Morning Joe | MSNBC,25,2017-11-13T14:53:22.000Z,200264,2947,317,2321,False
KanalD,58,17.17.11,Siyah Beyaz AÅŸk 6. BÃ¶lÃ¼m FragmanÄ±,24,2017-11-16T15:57:29.000Z,504592,7672,94,1094,False
Gronkh,58,17.18.11,FIFA 18 âš½ï¸ 029: Auftakt zum ENDSPURT!,20,2017-11-17T17:00:04.000Z,52397,3172,61,214,False
Rote Rosen Official,58,17.14.11,Folge 2544: Als Baby vertauscht | Rote Rosen,24,2017-11-13T13:10:02.000Z,7153,88,10,17,False
The Late Late Show with James Corden,57,17.16.11,P!nk Carpool Karaoke,24,2017-11-15T06:42:14.000Z,3621389,141682,1289,8127,False
Kanal D Romania,56,17.15.11,Te vreau langa mine! (14.11.2017) - Editie COMPLETA,24,2017-11-14T14:21:06.000Z,16156,79,15,59,False
JERYKO,56,17.24.11,"5 Rollen, die niemand spielen wollte, die aber wahre Meisterwerke wurden!",24,2017-11-23T13:02:47.000Z,92181,3482,92,137,False
Geniale Tricks,56,17.20.11,"10 Punkte, in denen sich kluge von dummen Menschen unterscheiden",26,2017-11-19T08:00:00.000Z,24641,387,617,171,False
PrankBrosTV,56,17.14.11,DER ZIMTIGSTE DRINK DER WELT !!! | PrankBrosTV,24,2017-11-13T19:30:00.000Z,100607,8822,289,2673,False
RT Deutsch,55,17.16.11,Farage: Wie viele Abgeordnete hier im EU-Parlament haben Geld von George Soros erhalten?,25,2017-11-15T09:40:50.000Z,10062,571,4,120,False
MrWissen2go,55,17.16.11,Was Trump bisher geleistet hat,27,2017-11-15T13:30:01.000Z,153729,7784,276,1711,False
tagesschau,54,17.14.11,"tagesschau 20:00 Uhr, 12.11.2017",25,2017-11-12T19:52:26.000Z,8596,111,15,19,False
Nate Zoobe,53,17.15.11,"Verbringe viel Zeit mit lieben MenschenğŸ’–Zeige es ihnen, dass sie dir am Herzen ğŸ’–liegenâ˜˜",1,2017-11-14T06:33:03.000Z,16158,0,0,135,False
SchrangTV,53,17.15.11,Talkgast enthÃ¼llt inszenierte ZDF-Show,25,2017-11-13T16:15:17.000Z,104154,2374,324,664,False
Dahoam is Dahoam,53,17.17.11,Folge 2016: Zunder in der staden Zeit (Dahoam is Dahoam v. 21.11.),24,2017-11-16T17:00:03.000Z,10182,124,9,7,False
AlexiBexi,53,17.20.11,Die SEXIESTE Grafikkarte der Welt! - Star Wars Titan Xp,24,2017-11-19T18:41:20.000Z,196298,18190,333,1628,False
Jumanji TM,53,17.18.11,Experiment - Was richtet eine Metall Wurfkarte an einer Wassermelone an?,24,2017-11-17T14:45:02.000Z,117167,4043,668,672,False
ĞĞ»ĞµĞºÑĞµĞ¹ ĞĞ°Ğ²Ğ°Ğ»ÑŒĞ½Ñ‹Ğ¹,52,17.15.11,ĞšĞ°Ğº Ğ¼Ñ‹ Ğ´Ğ»Ñ Ğ£ÑĞ¼Ğ°Ğ½Ğ¾Ğ²Ğ° Ğ°ĞºÑ†Ğ¸Ğ¸ Ğ¤ĞµĞ¹ÑĞ±ÑƒĞºĞ° Ğ¿Ğ¾ĞºÑƒĞ¿Ğ°Ğ»Ğ¸,29,2017-11-14T11:53:49.000Z,807276,113895,43153,16719,False
Der Volkslehrer,52,18.04.01,"Eine Stippvisite in das weltoffene, vielfÃ¤ltige und tolerante Flensburg",22,2018-01-03T11:06:45.000Z,3446,199,1,73,False
dagilp_lbh,52,17.15.11,11 NEUE FAKTEN Ã¼ber Gellert GRINDELWALD,24,2017-11-14T15:00:09.000Z,13563,1861,5,367,False
Flowers By Schouten,51,17.16.11,ADVENTSKRANZ - WINTERWALD MIT SPECIAL EFFECT + GEWINNSPIEL,26,2017-11-15T18:00:24.000Z,11080,863,21,174,False
Faktastisch,51,17.14.11,Die meistgesehenen Musikvideos von deutschen YouTubern,24,2017-11-12T12:34:07.000Z,149444,7810,902,1784,False
extra 3,51,17.17.11,Extra 3 vom 15.11.2017 | extra 3 | NDR,23,2017-11-16T07:32:59.000Z,71471,1520,91,216,False
CrispyRob,50,17.17.11,"Ich esse ALLES mit flÃ¼ssigem KÃ„SE ! (DÃ¶ner,Donuts,Eis)",24,2017-11-16T17:41:14.000Z,144843,12894,190,1114,False
Bahtiyar Ã–lmez,50,17.19.11,Bahtiyar Ã–lmez 2. BÃ¶lÃ¼m,24,2017-11-18T20:53:25.000Z,39728,492,22,87,False
AfghanstarToloTV,49,17.17.11,ÙØµÙ„ Ø³ÛŒØ²Ø¯Ù‡Ù… Ø³ØªØ§Ø±Ù‡ Ø§ÙØºØ§Ù† - Ú¯Ø²ÛŒÙ†Ø´ Ù‡Ø±Ø§Øª / Afghan Star Season 13 - Herat Auditions,24,2017-11-16T10:41:32.000Z,20945,252,21,62,False
MySpassde,49,17.14.11,Torsten StrÃ¤ter: Die neue Achse des BÃ¶sens - Blasentee - NightWash,24,2017-11-12T16:00:03.000Z,17747,583,20,14,False
Cennet'in GÃ¶zyaÅŸlarÄ±,48,17.14.11,Cennet'in GÃ¶zyaÅŸlarÄ± 8. BÃ¶lÃ¼m,24,2017-11-12T21:36:05.000Z,272456,1585,225,201,False
AJ+ ÙƒØ¨Ø±ÙŠØª,48,17.17.11,Ø§Ù„Ø³Ù„ÙŠØ· Ø§Ù„Ø¥Ø®Ø¨Ø§Ø±ÙŠ -  Ù†Ù‡Ø§ÙŠØ© Ø¥ÙŠØ±Ø§Ù† | Ø§Ù„Ø­Ù„Ù‚Ø© (17) Ø§Ù„Ù…ÙˆØ³Ù… Ø§Ù„Ø±Ø§Ø¨Ø¹,24,2017-11-16T19:00:04.000Z,105840,8508,624,971,False
KÃ¶ln 50667,48,17.29.12,Gruber kÃ¼sst Jule!!! KÃ¶ln50667,22,2017-12-28T17:25:55.000Z,46735,303,25,11,False
phoenix,48,17.21.11,Statement der AfD zum Scheitern der SondierungsgesprÃ¤che am 20.11.17,25,2017-11-20T09:27:38.000Z,45247,602,264,0,True
BuzzFeedVideo,48,17.19.11,"$1,977 Japanese Grapes",22,2017-11-18T19:00:31.000Z,1135585,39608,533,2436,False
MasterChef Greece,48,18.21.01,MasterChef â€“ 2Î¿Ï‚ ÎšÏÎºÎ»Î¿Ï‚ â€“ Î•Ï€ÎµÎ¹ÏƒÏŒÎ´Î¹Î¿ 6,20,2018-01-19T21:00:01.000Z,251913,1465,108,793,False
Screen Junkies,47,17.15.11,Honest Trailers - Batman Forever,1,2017-11-14T18:00:01.000Z,829132,25110,316,3428,False
Sorrow TV,47,17.22.11,r/oldpeoplefacebook Top Posts of All Time [4],22,2017-11-21T21:00:02.000Z,154261,9078,92,1464,False
Sergeant Meinungsfrei,47,17.14.12,Migranten klagen Ã¼ber die enorme Belastung und den Stress,25,2017-12-13T10:55:14.000Z,15711,849,69,376,False
SPORT1,47,17.14.11,Jupp Heynckes rÃ¤t FC Bayern zu Knaller-Transfer | SPORT1 TRANSFERMARKT,17,2017-11-13T14:52:57.000Z,66652,1509,30,180,False
focus nachrichten,46,17.09.12,Michael Schumacher: Bitterer Abschied! Familie zieht radikale Konsequenz,25,2017-12-08T18:49:19.000Z,2839,6,3,3,False
LastWeekTonight,46,17.14.11,The Trump Presidency: Last Week Tonight with John Oliver (HBO),24,2017-11-13T07:30:00.000Z,2418783,97190,6146,12703,False
CollegeHumor,46,17.21.11,Disarming Conversational Land Mines,23,2017-11-20T18:30:01.000Z,353570,20145,488,977,False
Clixoom Science & Fiction,45,17.14.11,Skyrmionen - Die Computerrevolution? - Clixoom Science & Fiction,28,2017-11-13T13:00:01.000Z,32984,2164,35,295,False
385idÃ©al,45,17.17.11,Nimo - ZOEY (Handypreview),10,2017-11-16T21:26:22.000Z,36381,4522,125,316,False
Shalom Entertainment,45,17.14.11,New Eritrean film Dama (á‹³áˆ›)  part 13 Shalom Entertainment  2017,22,2017-11-11T17:21:54.000Z,260199,4833,302,860,False
ZDF heute-show,45,17.14.11,Lutz van der Horst trifft auf Impfverweigerer | heute-show vom 10.11.2017,23,2017-11-10T23:02:57.000Z,222162,5166,495,1370,False
Beas Rezepte und Ideen,45,17.22.11,SpritzgebÃ¤ck Rezept | Ohne Fleischwolf mit Spritzbeutel | Keks-Klassiker backen,26,2017-11-21T17:29:05.000Z,6239,458,9,139,False
GEDANKENtanken,44,17.16.11,Die 4 TodsÃ¼nden fÃ¼r Beziehungen // Dr. Stefan FrÃ¤drich,27,2017-11-14T14:46:35.000Z,19122,500,37,41,False
Dude Perfect,44,17.21.11,Water Bottle Flip 2 | Dude Perfect,17,2017-11-20T23:00:24.000Z,3914524,218320,3066,19437,False
Starzip.de,44,17.14.11,Bibis Beauty Palace Ã¤ndert ihren Kanal komplett!,22,2017-11-12T11:44:57.000Z,165137,2806,278,218,False
Mr. White,44,17.14.11,Surviving Evil 6 - Neu - 2017 HD,20,2017-11-13T10:50:50.000Z,4069,74,3,20,False
Germany's next Topmodel,44,17.14.11,Leticias Heulkrampf nach Brendas Abschiedsbotschaft | Germany's next Topmodel 2017 | ProSieben,24,2017-11-13T11:30:00.000Z,69704,2062,26,120,False
SG Dynamo Dresden e.V.,44,17.18.11,14. Spieltag | SGD - FCK | Pressekonferenz vor dem Spiel,17,2017-11-17T14:52:06.000Z,3897,76,0,0,True
Sportschau,43,17.15.11,Deutschland gegen Frankreich - die Tore | Sportschau,17,2017-11-14T22:06:40.000Z,129193,2147,43,362,False
Exatlon Romania,43,18.30.01,Exatlon Romania (29.01.) - Faimosii au nominalizat! Cine sunt cei 3 care risca sa plece? Ep 14,24,2018-01-29T21:03:09.000Z,26477,265,33,154,False
PanArmenian TV,43,17.15.11,"Õ†Õ¼Õ¡Õ¶ Õ°Õ¡Õ¿Õ«Õ¯, ÕÕ¥Ö€Õ«Õ¡ 47 / Pomegranate seed / Nran hatik",1,2017-11-14T18:30:01.000Z,93486,306,89,72,False
CHECKER WELT,43,17.15.11,Der Pferde-Check | Reportage fÃ¼r Kinder | Checker Can,27,2017-11-14T15:05:20.000Z,4222,52,3,9,False
Ultralativ,43,17.14.11,Schauriger_Geist.png - Thumbnail der Woche,27,2017-11-12T13:00:00.000Z,93628,7924,118,308,False
AMARIN TVHD,42,17.23.12,à¸—à¸¸à¸šà¹‚à¸•à¹Šà¸°à¸‚à¹ˆà¸²à¸§:à¸§à¸´à¸à¸à¸²à¸“â€œà¸«à¸¡à¸­à¸›à¸­â€à¹‚à¸œà¸¥à¹ˆà¸šà¸­à¸à¸à¸²à¸•à¸´ à¸«à¸™à¸—à¸²à¸‡à¸¡à¸·à¸”à¸¡à¸´à¸”-à¸à¸µà¹ˆà¸Šà¸²à¸¢ à¸­à¸¶à¹‰à¸‡ â€œà¹€à¸à¹ˆà¸‡â€à¸à¸¹à¸”à¹ƒà¸ªà¹ˆà¸«à¸™à¹‰à¸² à¸ªà¸´à¹‰à¸™à¸£à¸±à¸à¸™à¹‰à¸­à¸‡ 21/12/60,25,2017-12-22T18:16:21.000Z,173289,641,92,429,False
The Film Theorists,42,17.01.12,How South Park Avoided CENSORSHIP! | Did You Know Movies,1,2017-11-30T20:03:14.000Z,306917,11727,366,700,False
FeelFIFA,42,17.17.11,FIFA 18 : F8TAL SQUAD BUILDER BATTLE ğŸ”¥ğŸ”¥,20,2017-11-16T19:00:14.000Z,107520,13119,210,531,False
Attessia TV,42,17.16.11,L'EMISSION - Ø§Ù„Ø­Ù„Ù‚Ø© 11 Ø§Ù„Ø¬Ø²Ø¡ Ø§Ù„Ø£ÙˆÙ„,24,2017-11-15T20:42:50.000Z,70493,584,125,111,False
CaseyNeistat,42,17.14.11,WE WANT TO TALK ABOUT OUR MARRIAGE,22,2017-11-13T17:13:01.000Z,748374,57532,2966,15954,False
Circus HalliGalli,42,17.17.11,Flugzeug Prank - Teil 2 | #ThrowbackThursday | Circus HalliGalli | ProSieben,24,2017-11-16T15:00:10.000Z,157879,4885,109,196,False
MythenAkte,40,17.27.11,DAS ist in Ã–sterreich & Deutschland legal - 10 gruselige & unheimliche Fakten | MythenAkte,24,2017-11-26T16:23:32.000Z,22394,1841,115,250,False
KanatsÄ±z KuÅŸlar,40,17.17.11,KanatsÄ±z KuÅŸlar 23. BÃ¶lÃ¼m FragmanÄ±,24,2017-11-16T21:30:01.000Z,80140,682,32,75,False
IDJVideos.TV,40,17.16.11,TANJA SAVIC FEAT. CORONA X RIMSKI - OCI BOJE VISKIJA (OFFICIAL VIDEO),24,2017-11-14T15:00:02.000Z,560192,16149,5101,945,False
Payitaht AbdÃ¼lhamid,40,17.19.11,Payitaht AbdÃ¼lhamid 25.bÃ¶lÃ¼m (HD),1,2017-11-17T20:50:30.000Z,188963,1446,100,303,False
NFL,40,17.14.11,Patriots vs. Broncos | NFL Week 10 Game Highlights,17,2017-11-13T05:45:26.000Z,725042,6620,294,1283,False
Younes Jones,40,17.20.11,DER ANPASSUNGSFÃ„HIGE â® Younes jones,23,2017-11-19T10:00:01.000Z,314255,20880,705,1159,False
RTL2,40,17.15.11,Berlin - Tag & Nacht - Kim rÃ¤cht sich bei ihren Peinigern! #1564 - RTL II,24,2017-11-14T19:00:01.000Z,266628,6285,162,783,False
LifeisPainTv,39,17.18.11,PA Sports - Paco Ramirez (prod. by Joznez) Sicario LP Exclusive,24,2017-11-16T17:16:05.000Z,154782,9855,401,707,False
Quasir - Alternative Fakten,39,17.21.11,JAMAIKA GESCHEITERT - UND NUN?,24,2017-11-20T14:23:48.000Z,8315,601,11,143,False
Hagen Grell,39,17.30.11,Ich bin zurÃ¼ck! #YoutubeSperre,22,2017-11-28T05:53:32.000Z,22507,2929,102,677,False
MGR PRODUCTION,39,18.05.03,Ø§Ù„Ø­Ù„Ù‚Ø© Ø§Ù„Ø«Ø§Ù†ÙŠØ© Ø¹Ø´Ø± 12 - Ù…Ø³Ù„Ø³Ù„ Ø§Ù„Ø¨ÙŠØª Ø§Ù„ÙƒØ¨ÙŠØ±|Episode 12 -Al-Beet Al-Kebeer,24,2018-03-04T17:36:07.000Z,374679,2379,220,558,False
Hiphop.de,39,17.07.12,"Das groÃŸe JBG 3-Interview: Kollegah & Farid Bang Ã¼ber Beef, Frieden & Punchlines #waslos",24,2017-12-06T15:50:04.000Z,233405,10310,282,1860,False
KÃ¶ln 50667 - QuitRndm,39,17.14.11,Ben treibt Krumme GeschÃ¤fte? ğŸ¤¦ğŸ˜² | KÃ¶ln 50667,22,2017-11-13T17:42:46.000Z,24103,238,6,4,False
Nabrana Productions,39,17.30.12,New Eritrean Drama 2018 Nabrana Part 20,24,2017-12-29T11:00:07.000Z,163570,3986,179,378,False
Ğ²Ğ”ÑƒĞ´ÑŒ,38,17.06.12,ĞÑ€Ñ‚ĞµĞ¼Ğ¸Ğ¹ Ğ›ĞµĞ±ĞµĞ´ĞµĞ² - Ğ¼Ğ°Ğ³Ğ¸ÑÑ‚Ñ€ Ğ¼Ğ°Ñ‚Ğ° Ğ¸ Ğ¾Ñ‚ĞµÑ† 10 Ğ´ĞµÑ‚ĞµĞ¹ / Ğ²Ğ”ÑƒĞ´ÑŒ,22,2017-12-05T06:57:20.000Z,1297631,67061,6693,12497,False
Colors TV,38,17.15.11,Shakti - 13th November 2017 - à¤¶à¤•à¥à¤¤à¤¿ - Full Episode,24,2017-11-13T19:32:44.000Z,192826,976,189,103,False
The Slow Mo Guys,38,17.15.11,Slow Mo Katana Sword - 4K - The Slow Mo Guys,24,2017-11-14T18:31:20.000Z,1529652,63996,896,4697,False
Der Heider,38,17.07.12,Danke fÃ¼r alles! FF3 Recap Trailer,24,2017-12-06T16:00:03.000Z,35989,4320,31,202,False
Vox,38,17.14.11,Why the rise of the robots wonâ€™t mean the end of work,25,2017-11-13T13:45:16.000Z,256426,12656,1363,2368,False
PlanetKanax,37,17.14.11,ARAB Lifestyle | mit Bodyformus,23,2017-11-13T11:59:43.000Z,99988,6397,298,429,False
coldmirror,37,17.24.11,Kacke Ã¼bersetzte Filmtitel,1,2017-11-23T15:30:01.000Z,241598,33262,387,1359,False
ItsMarvin,37,17.20.11,LOST PLACE : Brust und Nasen OP ? - SchÃ¶nheits-Klinik im Wald entdeckt ! | ItsMarvin,22,2017-11-19T16:00:01.000Z,28491,1503,12,191,False
ZDFsport,37,17.23.11,RSC Anderlecht - FC Bayern MÃ¼nchenÂ 1:2 (0:0)Â |Â UEFA ChampionsÂ LeagueÂ - ZDF,17,2017-11-22T21:52:07.000Z,59290,902,30,130,False
dmc Ø¯Ø±Ø§Ù…Ø§,37,17.29.11,Ù…Ø³Ù„Ø³Ù„ Ø§Ù„Ø·ÙˆÙØ§Ù† - Ø§Ù„Ø­Ù„Ù‚Ø© Ø§Ù„Ø«Ù„Ø§Ø«ÙˆÙ† - The Flood Episode 30,24,2017-11-28T19:36:05.000Z,415611,2763,217,819,False
UnknownreelMachine,37,17.14.11,Unschlagbares Gebot bei Bares fÃ¼r Rares,22,2017-11-10T22:09:00.000Z,73586,185,90,30,False
willi0816,37,17.07.12,Keine Gnade fÃ¼r AndrÃ© | Berlin Tag & Nacht #1581,22,2017-12-06T19:17:29.000Z,3014,73,0,1,False
Troom Troom,36,17.14.11,12 Weird Ways To Sneak Food Into Class / Back To School Pranks,26,2017-11-12T15:00:05.000Z,3153224,28451,2285,3312,False
TEAM KUKU,36,17.16.12,KING KHALIL - KRIMINELL (PROD. The Cratez),10,2017-12-15T09:49:35.000Z,267256,31340,1144,1501,False
NDR Doku,36,17.17.11,Marzipan: LÃ¼becks sÃ¼ÃŸe Versuchung | Wie geht das? | NDR,22,2017-11-15T14:22:49.000Z,47421,525,23,61,False
Mois,36,18.13.01,Live Reaktion - FLER feat. FARID BANG âœ–ï¸AMG âœ–ï¸â–º Bewertung & Analyse [ official Video ],22,2018-01-12T00:56:30.000Z,43907,2969,131,361,False
Alena TV,36,17.14.11,Alena TV -Tesfit Abraha - Dgul Hiyab - Part  4 - (á‹µáŒ‰áˆ áˆ…á‹«á‰¥ áˆ«á‰¥á‹“á‹­ áŠ­á‹áˆ)- New Eritrean Movie 2017,24,2017-11-12T21:09:54.000Z,174130,4565,292,621,False
Tilo Jung,36,18.26.01,24. Januar 2018 - Sehenswerte Bundespressekonferenz (RegPK),25,2018-01-24T17:52:34.000Z,22966,474,21,266,False
Acces Direct,36,17.21.11,"Copiii fÄƒrÄƒ pÄƒrinÈ›i, Ã®n prag de despÄƒrÈ›ire! StelicÄƒ: Mami È™i tati mi-au zis sÄƒ nu-i las",24,2017-11-20T16:53:08.000Z,14318,106,6,26,False
Ufo361,36,17.17.11,Ufo361 - TIFFANY (prod. von AT Beatz) [Official HD Video],24,2017-11-16T23:00:01.000Z,182494,36857,1636,3677,False
Paluten,35,17.16.12,PlÃ¤tzchen backen,20,2017-12-15T13:27:26.000Z,156641,15008,283,2129,False
Markus Lanz Fanclub,35,17.24.11,Markus Lanz vom 22. November 2017 Â© ZDF,24,2017-11-23T09:32:39.000Z,14038,79,34,62,False
Verborgene Geheimnisse TV,35,17.10.12,Ãœberdimensionales Objekt mit Unbekannter Technologie Hergestellt,1,2017-12-09T10:50:11.000Z,7895,284,16,70,False
Das schaffst du nie!,35,17.22.12,Challenge: NO THUMBS Challenge - Weihnachtsedition || Das schaffst du nie!,1,2017-12-21T14:02:40.000Z,202927,8278,192,953,False
Oliver Janich,35,17.15.11,"Sigmar Gabriel, die Anstalt & die neoliberale WeltverschwÃ¶rung der Mont PÃ¨lerin Society",23,2017-11-13T08:23:27.000Z,25684,891,189,0,True
Epoch Times Deutsch,35,17.23.11,Junge Union fordert â€sofortigen RÃ¼cktrittâ€œ von Kanzlerin Merkel,25,2017-11-22T17:21:54.000Z,2083,144,0,67,False
"Urknall, Weltall und das Leben",35,17.25.11,Allgemeine RelativitÃ¤tstheorie â€¢ Ã„quivalenzprinzip â€¢ KrÃ¼mmung â€¢ AzS (17) | Josef M. GaÃŸner,28,2017-11-24T18:00:01.000Z,6142,375,3,155,False
RTK,35,17.21.11,Ã‡ka ka Shpija - Sezoni 4 episodi 4,24,2017-11-20T20:01:11.000Z,86011,662,64,0,True
Christian Bischoff,35,17.17.11,Wie du MASSIVE ERGEBNISSE erzielst,22,2017-11-16T17:00:05.000Z,5013,569,6,26,False
EvaMarbachVerlag,35,17.18.11,Slime: RÃ¼ckwÃ¤rts-Slime,26,2017-11-17T12:00:04.000Z,39180,1087,82,159,False
Ø´Ø§Ù… Ø§Ù„Ø§ØµÙŠÙ„,35,17.03.12,Ø§Ù„Ø±Ø§Ø­Ø© Ø¨Ø§Ø§Ù„ÙØ³ØªÙ‚ Ø§Ù„Ø­Ù„Ø¨ÙŠ,22,2017-12-02T19:01:47.000Z,27939,3675,43,1820,False
Jarow,34,17.14.11,HÃ¶re NICHT diese Sprachnachricht an.. (WIRKLICH NICHT!),24,2017-11-11T20:55:29.000Z,373833,21320,2901,1839,False
FifaGaming,34,17.14.11,88+ ICON WALKOUT im PACK OPENING BATTLE vs. WAKEZ!! ğŸ’ğŸ”¥ğŸ’ Fifa 18 Ultimate Team Deutsch,20,2017-11-12T09:02:47.000Z,117991,6530,387,350,False
TutorialsGerman,34,17.21.11,JÃ¼rgen Trittin (GrÃ¼ne) zum Ende von Jamaika,25,2017-11-20T00:39:29.000Z,30309,69,106,146,False
DIY Inspiration - kreative Ideen zum Selbermachen,34,17.19.11,"Candy Challenge DIY Inspiration WEIHNACHTEN | Eva & Kathi essen Lebkuchen, Spekulatius, Dominosteine",26,2017-11-18T08:00:01.000Z,8744,491,24,118,False
NuoViso.TV,34,17.24.11,Die Merkel Propaganda (kompletter Film),25,2017-11-23T10:16:11.000Z,6830,362,10,67,False
COMPACTTV,34,17.17.11,Deutsche Helden â€“ Unser VermÃ¤chtnis aus 2000 Jahren,25,2017-11-16T09:54:35.000Z,4778,363,10,79,False
Ğ¢ĞµĞ»ĞµĞºĞ°Ğ½Ğ°Ğ» Ğ¡Ğ¢Ğ‘,34,18.31.01,ĞĞ´ĞµÑ€Ğ¶Ğ¸Ğ¼Ğ°Ñ â€“ Ğ¡Ğ»ĞµĞ´ÑÑ‚Ğ²Ğ¸Ğµ Ğ²ĞµĞ´ÑƒÑ‚ ÑĞºÑÑ‚Ñ€Ğ°ÑĞµĞ½ÑÑ‹ 2018. Ğ’Ñ‹Ğ¿ÑƒÑĞº 4 Ğ¾Ñ‚ 29.01.18,24,2018-01-29T20:56:08.000Z,41428,333,82,104,False
proownez,33,17.14.11,FIFA 18: EXTREME TEAM ROTATE CHALLENGE ğŸ˜±ğŸ˜±,20,2017-11-13T18:17:09.000Z,94891,7741,131,478,False
Videoplanet,33,17.15.11,"Der Wert des Kreuzes kommt vom ALTER! - pÃ¤pstlich, um 1780 (BfR)",27,2017-11-13T12:00:05.000Z,45140,171,37,84,False
Jon Olsson,33,17.16.11,MY NEW 800 HP G500 4x4 TESTED TO THE LIMIT! | VLOGÂ² 107,22,2017-11-14T21:34:35.000Z,457171,20542,378,1638,False
Generation Sonnenschein,33,17.17.11,10 psychologische Tricks mit denen du Gewicht verlieren wirst,26,2017-11-16T16:30:01.000Z,6204,350,11,54,False
å¤§åŠ‡ç¨æ’­,33,17.14.11,çŒåœº | Game Of Hunting 14ã€TVç‰ˆã€‘ï¼ˆèƒ¡æ­Œã€å¼µå˜‰è­¯ã€ç¥–å³°ç­‰ä¸»æ¼”ï¼‰,1,2017-11-13T16:00:02.000Z,48796,99,19,73,False
Jo Conrad,33,17.24.11,Bewusst-Mix vor Tagesenergie 110,29,2017-11-23T10:15:04.000Z,11388,298,40,128,False
Christoph HÃ¶rstel,33,17.15.11,Zur aktuellen Rufmordkampagne im Internet wg. Neue Mitte,25,2017-11-13T18:13:32.000Z,31971,0,0,108,False
Florian Mennen,33,17.18.11,KuÌˆhlschrank Challenge | Erdnussbutter Lasagne | Florian Mennen,26,2017-11-17T17:00:17.000Z,15619,1398,23,249,False
MrRevillz,33,18.07.04,Seeb feat. Dagny - Drink About,10,2018-04-06T10:45:36.000Z,44066,932,26,52,False
iUmor,33,17.14.11,"Veronica Gheorghe, topul celor amuzante bancuri despre bÄƒrbaÈ›i:â€MÄƒ face sÄƒ mÄƒ simt ca o gonflabilÄƒ",24,2017-11-12T21:39:35.000Z,250875,2582,222,249,False
Simon's Cat,33,17.17.11,DIY - Simon's Cat  | NEW BLACK & WHITE!,15,2017-11-16T15:03:23.000Z,178977,14355,87,429,False
Tasvir Gostar Pasargad,33,17.21.12,Karegare sadeh full movie || ÙÛŒÙ„Ù… Ú©Ø§Ø±Ú¯Ø± Ø³Ø§Ø¯Ù‡ Ù†ÛŒØ§Ø²Ù…Ù†Ø¯ÛŒÙ… - Ú©Ø§Ù…Ù„,24,2017-12-20T12:00:04.000Z,36829,424,42,86,False
KMNGANG,33,17.09.12,AZET - GJYNAH prod. by Lucry (Official 4K Video),24,2017-12-08T12:00:05.000Z,1132010,102739,8360,13118,False
Top Channel Albania,33,17.14.11,"Portokalli, 12 Nentor 2017 - Nasi dhe Fotinia (Humbja ne qendren tregetare)",23,2017-11-13T13:33:26.000Z,55547,376,20,16,False
Malternativ,33,17.17.11,Wie gesund ist Tanzverbot's ErnÃ¤hrung? | Der Selbstversuch,24,2017-11-16T17:39:19.000Z,50011,4876,226,437,False
Knallerfrauen,32,17.14.11,Terror-Kind [subtitled] | Knallerfrauen mit Martina Hill,24,2017-11-13T15:00:04.000Z,39986,1701,34,55,False
Åevkat Yerimdar,32,17.14.11,Åevkat Yerimdar 25. BÃ¶lÃ¼m,22,2017-11-11T16:44:10.000Z,220911,1567,188,149,False
sturmderliebe99,32,17.14.11,Sturm der Liebe Vorschau fÃ¼r Folge 2809 -  2813,24,2017-11-12T20:36:13.000Z,17361,60,5,9,False
WELT,32,18.19.01,Sturmtief: Friederike bringt OrkanbÃ¶en nach Deutschland,25,2018-01-17T22:14:28.000Z,29405,143,9,10,False
The Game Theorists,32,17.27.11,Game Theory: Gaming is BROKEN! ...What Comes Next?,20,2017-11-26T19:05:15.000Z,1166010,59218,2764,9259,False
eKartenwelt.de,32,17.06.12,GrÃ¼ÃŸe zum Nikolaus,26,2017-12-05T08:08:14.000Z,4610,0,0,0,True
Dumm TÃ¼ch,32,17.14.11,Was braucht man wirklich am Auto damit es fÃ¤hrt? | Dumm TÃ¼ch,24,2017-11-11T10:30:00.000Z,281497,11041,348,610,False
Info Kanal,32,17.22.11,HÃ¶rt mal wie Marietta Slomka mit Christian Lindner umgeht ! Muss das sein?,22,2017-11-21T09:06:35.000Z,67910,808,201,778,False
Fozi Mozi,32,17.09.12,ÙÙˆØ²ÙŠ Ù…ÙˆØ²ÙŠ ÙˆØªÙˆØªÙŠ - Ø¹Ù…Ùˆ Ø§Ù„Ø­Ø±Ø§Ù…ÙŠ - Thief at the door,24,2017-12-08T05:00:02.000Z,875952,5782,1082,394,False
DasEngelOrakel,32,17.14.11,Engel 11:11 Portal Orakel fÃ¼r die Woche vom 13. bis 19.November 2017,1,2017-11-12T09:33:38.000Z,13363,336,20,36,False
Kalk Gidelim,31,18.08.01,Kalk Gidelim 8. BÃ¶lÃ¼m,1,2018-01-06T20:37:34.000Z,72003,0,0,48,False
Y-Kollektiv,31,17.17.11,Kampf um Wohnraum - Gentrifizierung in Berlin I Y-Kollektiv Dokumentation,25,2017-11-16T14:31:05.000Z,26371,1160,74,571,False
Silvia W-K,31,17.23.11,Weihnachtstorte / feine Lebkuchentorte,22,2017-11-22T05:21:57.000Z,12602,800,15,135,False
Top News,31,17.14.11,Verliert Inka Bause wegen Narumol ihren Job?,25,2017-11-12T15:19:29.000Z,27935,39,134,1,False
taff,31,17.14.11,Der EXTREME Alltag eines TATORTREINIGERS | taff | ProSieben,24,2017-11-13T18:00:03.000Z,68284,1926,33,210,False
annawhispers ASMR,31,17.20.11,"ASMR Sanfter MIKROFONTEST â™¡ Zoom H5 â™¡ Whisper Rambling, Mic Tapping & Brushing in German/Deutsch",24,2017-11-19T18:00:29.000Z,14548,1027,19,278,False
Joe Show - Ø¬Ùˆ Ø´Ùˆ,31,17.17.11,Ø¬Ùˆ Ø´Ùˆâ”‚Ø§Ù„Ù…ÙˆØ³Ù… Ø§Ù„Ø«Ø§Ù†ÙŠâ”‚Ø§Ù„Ø­Ù„Ù‚Ø© 18â”‚Ø§Ù„Ø±Ø¦ÙŠØ³ Ø§Ù„ÙÙŠÙˆØªØ´Ø±ÙˆÙ„ÙˆØ¬ÙŠ,23,2017-11-16T19:59:21.000Z,242933,7751,384,1102,False
ApeCrimeTV,31,17.14.11,Geschenk an meine Freundin,24,2017-11-12T17:48:15.000Z,294983,18037,615,843,False
Sturm der Liebeâ™¥,31,17.20.11,Sturm der Liebe Vorschau fÃ¼r Folge 2813 - 2817,22,2017-11-19T11:00:02.000Z,15493,109,6,18,False
Borussia MÃ¶nchengladbach,31,17.17.11,Pressekonferenz vor Berlin,17,2017-11-16T12:34:06.000Z,5317,176,3,17,False
The Graham Norton Show,31,17.15.11,Jason Momoa Shows Off His Aquaman Quindent | The Graham Norton Show,24,2017-11-14T12:13:35.000Z,391049,5939,106,385,False
Freie Propaganda,30,17.29.11,AfD entlarvt SPD-Masseneinwanderungs-Programm - 22.11.2017,25,2017-11-28T12:35:36.000Z,14594,765,212,345,False
æ¹–å—å«è§†èŠ’æœTVå®˜æ–¹é¢‘é“ China HunanTV Official Channel,30,18.13.01,ã€ENG SUBå®Œæ•´ç‰ˆã€‘ã€Šæ­Œæ‰‹2018ã€‹ç¬¬1æœŸ 20180112 ç»“å®å§Jessie Jéš†é‡ç™»å ´ï¼æ±ªå³°åŠ²çˆ†å¼€å”±è¶…ç‡ƒæ‘‡æ»šé£ å¼ éŸ¶æ¶µã€Šæ¢¦é‡ŒèŠ±ã€‹ä»™æ°”é£˜é£˜ The Singer 2 EP1ã€æ¹–å—å«è§†å®˜æ–¹ç‰ˆã€‘,24,2018-01-12T14:59:54.000Z,240336,1526,165,1880,False
PULS Reportage,30,17.23.11,Abgelaufene Lebensmittel: Wie lange sind sie wirklich essbar? || PULS Reportage,26,2017-11-22T14:00:00.000Z,49748,1728,18,535,False
ApeCrime,30,17.14.11,The Shower Song,24,2017-11-12T17:31:42.000Z,254226,32405,2117,1665,False
KSI,30,17.26.12,KSI VS BIG SHAQ ft Asznee,24,2017-12-25T15:02:38.000Z,3461583,227847,6341,13624,False
B&K Highlight,30,17.18.11,Schluss mit dem Theater - BTN #1566,24,2017-11-16T18:38:03.000Z,52892,356,15,12,False
N24,30,17.15.11,Unfassbares GlÃ¼ck: Junge beinah von LKW Ã¼berfahren,25,2017-11-14T10:42:12.000Z,3900,122,2,16,False
Tim Latka,30,17.14.11,FIFA 18: YEES! MEIN DRITTES 40-0 I DIE LETZTEN 10 SPIELE! ğŸ˜ğŸ˜,20,2017-11-13T12:01:31.000Z,72337,4065,41,270,False
BILD,30,18.21.01,Deso Dogg ist tot - ISIS verÃ¶ffentlicht Foto von deutschem Rapper,25,2018-01-19T08:30:01.000Z,39781,377,36,170,False
O Sa Mire,30,17.14.11,O Sa Mire - Episodi 117,24,2017-11-12T23:21:01.000Z,207724,1216,142,180,False
Robert Hofmann,30,17.17.11,JUSTICE LEAGUE Kritik Review (2017),24,2017-11-15T09:00:01.000Z,49255,1893,52,266,False
Bizim Hikaye,30,17.18.11,Bizim Hikaye 10. BÃ¶lÃ¼m - Tek ParÃ§a - Full BÃ¶lÃ¼m,1,2017-11-17T07:00:02.000Z,623047,6232,396,1137,False
TV Promos,29,17.06.12,Supergirl 3x10 Promo Legion of Superheroes (HD) Season 3 Episode 10 Promo,24,2017-12-05T02:01:48.000Z,162212,1413,23,473,False
ĞŸĞµÑ€Ğ²Ñ‹Ğ¹ ĞºĞ°Ğ½Ğ°Ğ»,29,17.20.11,ĞŸÑ€Ğ¾Ğ¶ĞµĞºÑ‚Ğ¾Ñ€Ğ¿ĞµÑ€Ğ¸ÑÑ…Ğ¸Ğ»Ñ‚Ğ¾Ğ½ - Ğ’Ñ‹Ğ¿ÑƒÑĞº Ğ¾Ñ‚Â 18.11.2017,43,2017-11-19T06:45:36.000Z,471975,7771,1356,646,False
ALPHA KENAN,29,17.21.12,"ğŸ”´ ALTER ERRATEN - Rapper Edition | CHALLENGE (unmÃ¶glich!!!) ğŸ”´ Bonez MC, Azet, Capital Bra...",24,2017-12-20T18:01:20.000Z,52407,2646,226,1898,False
thairath,29,17.22.11,à¸™à¸£.à¹€à¸•à¸£à¸µà¸¢à¸¡à¸—à¸«à¸²à¸£à¹€à¸ªà¸µà¸¢à¸Šà¸µà¸§à¸´à¸• à¸­à¸§à¸±à¸¢à¸§à¸°à¸ à¸²à¸¢à¹ƒà¸™à¸«à¸²à¸¢! | à¸Šà¸¹à¸§à¸´à¸—à¸¢à¹Œ à¸•à¸µà¹à¸ªà¸à¸«à¸™à¹‰à¸² | 21 à¸.à¸¢. 60,25,2017-11-21T15:23:05.000Z,264930,2034,243,1666,False
1000PS - die starke Motorradseite im Internet,29,17.17.11,"Indian Neuheiten 2018 - Scout FTR1200, Scout Sixty, Springfield Dark Horse, Roadmaster Elite",2,2017-11-16T11:00:03.000Z,7366,161,9,27,False
FORMULA 1,29,17.14.11,2017 Brazil Grand Prix: Race Highlights,17,2017-11-12T22:05:07.000Z,758492,11936,160,1472,False
Kontra K,29,17.14.11,Fatal & Rico Feat. Kontra K - Ich lass die Jungs nicht allein (Official Video),10,2017-11-12T16:59:16.000Z,238274,18408,716,881,False
spiegeltv,29,17.16.11,Robert Mugabe im PortrÃ¤t: Vom HoffnungstrÃ¤ger zum Despoten,25,2017-11-15T12:39:19.000Z,7798,47,4,17,False
Deutsch Rap,29,17.02.12,Kollegah und die Schornsteinfeger,10,2017-12-01T17:39:29.000Z,1638,56,5,3,False
Rote Rosen,29,18.21.03,Folge 2615: Akute Verliebtheit | Rote Rosen,24,2018-03-20T13:10:03.000Z,9718,91,5,9,False
kamikadzedead,29,18.31.01,Ğ›ĞĞ’Ğ ĞĞ’ Ğ˜ ĞŸĞ•Ğ¡ĞšĞĞ’ ĞŸĞĞ” ĞĞĞ’Ğ«ĞœĞ˜ Ğ¡ĞĞĞšĞ¦Ğ˜Ğ¯ĞœĞ˜ Ğ¡Ğ¨Ğ,23,2018-01-30T09:03:04.000Z,330336,48003,4899,11434,False
Philipp Konter - Konterholz,29,17.29.11,Ein Drechselfutter einfach SELBER bauen || So geht's || Philipp Konter,27,2017-11-28T14:55:08.000Z,6077,240,6,37,False
Ciks TV,29,18.16.02,GÃ¶z YaÅŸLarÄ± SeL OLdu ! Sanat DÃ¼nyasÄ± Yasta / Nuray HafiftaÅŸ...,24,2018-02-15T13:05:10.000Z,27694,70,20,8,False
The View,29,17.01.12,Trump Tweets Anti-Muslim Videos | The View,25,2017-11-30T16:30:22.000Z,152358,1771,181,1273,False
h3h3Productions,29,17.17.12,It's Time To Stop Ajit Pai,24,2017-12-16T20:00:37.000Z,1951981,225429,10129,27999,False
inscope21,28,17.14.11,Sing zu Ende! | Gesangseinlagen vom Feinsten | inscope21,24,2017-11-13T17:08:49.000Z,252786,35885,230,1539,False
Master Your Mind,28,17.21.12,TOP 5 BÃœCHER Ã¼ber BEZIEHUNGEN | Master Your Mind,22,2017-12-20T19:12:16.000Z,12558,1900,10,220,False
Sma Al Fan Production International Ø³Ù…Ø§ Ø§Ù„ÙÙ† Ø§Ù„Ø¯ÙˆÙ„ÙŠØ© Ù„Ù„Ø¥Ù†ØªØ§Ø¬,28,18.18.05,Ù…Ø³Ù„Ø³Ù„ ÙÙˆØ¶Ù‰ Ø§Ù„Ø­Ù„Ù‚Ø© 1 Ø§Ù„Ø£ÙˆÙ„Ù‰  | Ø³Ù„ÙˆÙ… Ø­Ø¯Ø§Ø¯ Ùˆ Ø§Ù…Ø§Ø±Ø§Øª Ø±Ø²Ù‚,22,2018-05-17T20:00:05.000Z,76857,1426,44,150,False
diefilmfabrik,28,17.14.11,Neue STAR WARS-Trilogie geplant | KEVIN SPACEY aus Film entfernt | DISNEY kauft 20th Century Fox?,1,2017-11-13T16:00:06.000Z,31154,2107,29,444,False
consumer,28,17.14.11,John Oliver - Season 4 Finale,23,2017-11-13T08:00:56.000Z,159192,3701,44,234,False
AlHayah TV Network,28,18.18.05,Ù…Ø³Ù„Ø³Ù„ Ø£ÙŠÙˆØ¨ | Ø§Ù„Ù†Ø¬Ù… Ù…ØµØ·ÙÙŠ Ø´Ø¹Ø¨Ø§Ù† â€“ Ø§Ù„Ø­Ù„Ù‚Ø© Ø§Ù„Ø£ÙˆÙ„Ù‰ (Ù¡),25,2018-05-17T02:52:04.000Z,1510385,15371,855,1825,False
netd mÃ¼zik,28,18.03.02,Mabel Matiz - Ã–yle Kolaysa,10,2018-02-02T09:00:03.000Z,695655,34930,1002,4534,False
Daniel Abt,28,17.15.11,Das erste Video mit meinem VATER! | Daniel Abt,2,2017-11-14T13:33:51.000Z,64249,5498,37,201,False
WorkpointOfficial,28,17.24.11,THE MASK SINGER à¸«à¸™à¹‰à¸²à¸à¸²à¸à¸™à¸±à¸à¸£à¹‰à¸­à¸‡ 3 | EP.10 | Group D | 23 à¸.à¸¢. 60 Full HD,24,2017-11-23T15:12:39.000Z,821192,5019,513,2131,False
ĞĞ¾Ğ²Ğ¸Ğ½Ğ¸Ñ‚Ğµ Ğ½Ğ° NOVA,28,17.21.11,ĞĞ¾Ğ²Ğ¸Ğ½Ğ¸Ñ‚Ğµ Ğ½Ğ° NOVA (20.11.2017 - Ñ†ĞµĞ½Ñ‚Ñ€Ğ°Ğ»Ğ½Ğ° ĞµĞ¼Ğ¸ÑĞ¸Ñ),25,2017-11-20T17:52:37.000Z,9858,46,13,8,False
extra goal,28,17.03.12,Ù…Ù„Ø®Øµ Ù…Ø¨Ø§Ø±Ø§Ù‡ Ù„Ù€ ÙŠÙÙ€ Ø±Ø¨Ù€ ÙˆÙ„ ÙˆØ¨Ù€ Ø±Ø§ÙŠÙ€ ØªÙ€ ÙˆÙ† 5-1 - ØªØ£Ù„Ù‚ Ù…Ù€ Ø­Ù€ Ù…Ø¯ ØµÙ€ Ù„Ø§Ø­ - Ø§Ù„Ø¯ÙˆØ±ÙŠ Ø§Ù„Ø§Ù†Ø¬Ù„ÙŠØ²ÙŠ,17,2017-12-02T16:55:19.000Z,831290,6073,563,219,False
Magnum Productions,28,18.18.05,Awalem Khafeya Series - Ep 01 -  | Ø¹Ø§Ø¯Ù„ Ø¥Ù…Ø§Ù… - HD Ù…Ø³Ù„Ø³Ù„ Ø¹ÙˆØ§Ù„Ù… Ø®ÙÙŠØ© - Ø§Ù„Ø­Ù„Ù‚Ø© 1 Ø§Ù„Ø£ÙˆÙ„Ù‰,24,2018-05-17T20:51:21.000Z,512884,5801,344,544,False
Shoof Drama | Ø´ÙˆÙ Ø¯Ø±Ø§Ù…Ø§,28,18.18.05,Ù…Ø³Ù„Ø³Ù„ Ø±ÙˆØ²Ù†Ø§ Ø§Ù„Ø­Ù„Ù‚Ø© 1,22,2018-05-17T10:30:01.000Z,119569,1622,127,250,False
rezo,28,17.14.11,18 SONGS mit Kelly MissesVlog (Sing-off),24,2017-11-12T13:10:36.000Z,822213,100684,2467,10244,False
Golden Line for TV Production and Distribution,28,18.18.05,Ù…Ø³Ù„Ø³Ù„ Ù‡Ø§Ø±ÙˆÙ† Ø§Ù„Ø±Ø´ÙŠØ¯ Ù€ Ø§Ù„Ø­Ù„Ù‚Ø© 1 Ø§Ù„Ø£ÙˆÙ„Ù‰ ÙƒØ§Ù…Ù„Ø© HD | Haron Al Rashed,22,2018-05-17T20:00:03.000Z,55862,1399,51,263,False
RTL,27,18.03.01,GZSZ Making-of | Brand im Mauerwerk,24,2018-01-02T07:30:08.000Z,5178,137,6,5,False
H3 Podcast,27,17.19.11,H3 Podcast #39 - Post Malone,24,2017-11-18T20:10:42.000Z,555519,30697,550,5820,False
Hello World,27,17.23.11,Fulminante Rede von Alice Weidel im Bundestag: AfD fordert Klage gegen EZB-Programm (21.11.2017),22,2017-11-21T16:31:03.000Z,79379,1267,1429,995,False
Ğ ÑƒÑÑĞºĞ¸Ğµ ÑĞµÑ€Ğ¸Ğ°Ğ»Ñ‹,27,17.15.11,ĞœĞ¾Ñ€Ğ¾Ğ·Ğ¾Ğ²Ğ° (2017). 3 ÑĞµÑ€Ğ¸Ñ. ĞŸĞ°Ñ€Ğ°ÑˆÑÑ‚Ğ¸ÑÑ‚ / Ğ”ĞµÑ‚ĞµĞºÑ‚Ğ¸Ğ² @ Ğ ÑƒÑÑĞºĞ¸Ğµ ÑĞµÑ€Ğ¸Ğ°Ğ»Ñ‹,1,2017-11-14T12:00:02.000Z,42371,92,21,4,False
Horst LÃ¼ning,27,18.02.01,"EMS-Training - Grundlagen zur Elektro Muskel Stimulation, Reizstrom",27,2018-01-01T16:00:02.000Z,3985,112,28,56,False
Channel Awesome,27,17.17.11,Bangarang - Nostalgia Critic,24,2017-11-15T23:00:00.000Z,400148,18713,320,2142,False
Terra X Lesch & Co,27,17.17.11,Harald Lesch beantwortet Fragen von Studenten | Harald Lesch,28,2017-11-15T14:00:06.000Z,63151,4375,39,398,False
n'Kosove Show,27,17.14.11,"n'Kosove Show - Ragip Begaj, Aida DocÌ§i, Ue Ue Show",23,2017-11-12T19:30:00.000Z,201637,403,50,0,True
Gelin Evi,27,17.29.11,Gelin Evi 432.BÃ¶lÃ¼m | 28 KasÄ±m 2017,24,2017-11-28T12:03:50.000Z,20512,91,20,18,False
STARTVSTAR,27,17.05.12,Siyah Ä°nci 11. BÃ¶lÃ¼m 2. TanÄ±tÄ±m!,24,2017-12-04T20:17:28.000Z,169818,1222,49,48,False
Felixba,27,17.21.11,OnePlus 5T: Endlich empfehlenswert! - felixba,28,2017-11-20T14:00:01.000Z,65717,3573,97,638,False
SavaÅŸÃ§Ä±,27,17.14.11,SavaÅŸÃ§Ä± 20. BÃ¶lÃ¼m,22,2017-11-12T21:14:55.000Z,142715,1396,113,149,False
Netflix,27,17.26.11,Black Mirror - Arkangel | Official Trailer [HD] | Netflix,24,2017-11-25T14:30:01.000Z,823882,13276,561,1735,False
SootHouse,26,18.17.01,Furry Roleplaying Forums [Feat. Internet Historian],23,2018-01-16T18:55:58.000Z,169522,12057,116,3446,False
TopZehn,26,17.20.12,"10 Film-Vorhersagen, die nicht eintrafen!",27,2017-12-19T14:30:01.000Z,61418,2306,115,240,False
BULLSHIT TV,26,17.03.12,"STUDENTEN, DIE JEDER KENNT",24,2017-11-29T15:00:04.000Z,235750,15342,156,556,False
AÅŸk ve Mavi,26,17.25.11,AÅŸk ve Mavi 43.BÃ¶lÃ¼m FragmanÄ±,1,2017-11-24T21:18:14.000Z,48099,717,26,110,False
Danergy,26,17.10.12,"13 Youtube Songs Mashup (Shirin David, IBLALI, Apored, EMRAH,...)",10,2017-12-09T17:30:03.000Z,236557,32706,977,2198,False
Stephan Wiesner,26,17.26.11,ZIELFOTO-Magazin Retrospektive,22,2017-11-25T10:13:33.000Z,7293,598,11,107,False
Ro Dar Ro [Family Feud Afghanistan],26,17.15.11,Ro Dar Ro (Family Feud) Ghafori VS Haq Parast - Ep.120 / Ø±Ùˆ Ø¯Ø± Ø±Ùˆ - ØºÙÙˆØ±ÛŒ Ø¯Ø± Ù…Ù‚Ø§Ø¨Ù„ Ø­Ù‚ Ù¾Ø±Ø³Øª,22,2017-11-14T15:59:52.000Z,18112,192,12,316,False
Welt im Wandel.TV,26,17.15.11,Dr. RÃ¼diger Dahlke spricht Klartext - 5 Minuten die Du gesehen haben musst!,27,2017-11-14T17:00:07.000Z,5440,242,19,20,False
FC Bayern MÃ¼nchen,26,17.08.12,Pantomime w/ Robert Lewandowski | FC Bayern Xmas Advent Calendar #7,17,2017-12-07T09:26:31.000Z,12892,631,6,103,False
Proximity,26,17.10.12,Axwell /\ Ingrosso - Dreamer (ft. Trevor Guthrie) [Lyric Video],24,2017-12-08T21:11:10.000Z,889955,17752,462,968,False
TopPersian MixTV,26,17.25.12,Ø³Ø±ÛŒØ§Ù„ ØºÙ†Ú†Ù‡ Ù‡Ø§ÛŒ Ø²Ø®Ù…ÛŒ Ù‚Ø³Ù…Øª 55 (Serial ghonche haye zakhmi (HD,22,2017-12-24T09:28:11.000Z,20027,325,11,60,False
Felix von der Laden,26,17.20.11,Ihr mÃ¼sst mir helfen! (izzi vs. Felix Challenge),19,2017-11-19T14:00:04.000Z,201089,12924,525,1247,False
DramaAlert,26,17.14.11,Jake Paul Says Alissa Violet CHEATED with LOGAN PAUL! #DramaAlert Team 10 vs  Martinez Twins!,25,2017-11-13T07:37:51.000Z,1309699,103754,4613,12143,False
Andys Werkstatt,26,17.15.11,Wie geht das? Undercover Jig von Wolfcraft richtig nutzen,24,2017-11-14T18:00:02.000Z,4033,226,10,61,False
KadÄ±n,26,17.16.11,KadÄ±n 4. BÃ¶lÃ¼m - Tek ParÃ§a - Full BÃ¶lÃ¼m,1,2017-11-15T06:30:00.000Z,211320,1738,138,358,False
Marshmello,26,18.10.02,Marshmello & Anne-Marie - FRIENDS (Lyric Video) *OFFICIAL FRIENDZONE ANTHEM*,10,2018-02-09T04:41:39.000Z,1685073,184897,2067,13193,False
Jayo Truth,26,17.14.11,Jayo Truth - á‹á‹µá‹µáˆ­ ááˆ‰á‹­ áŠ­áŠ¥áˆˆá‰µ #5 - Eritrean Talent Show 2017,24,2017-11-12T17:47:49.000Z,57574,3335,77,580,False
Cashkurs.com,26,17.17.11,Dirk MÃ¼ller - Horror! UN verzichtet auf Verbot autonom tÃ¶tender Waffen,25,2017-11-15T13:26:50.000Z,34653,1226,23,0,True
iKnowReview,26,17.03.12,Pixel Killer? OnePlus 5T Review!,28,2017-12-02T09:00:00.000Z,35561,2222,39,442,False
Lucas the Spider,26,17.02.12,Lucas the Spider - Its Cold Outside,1,2017-12-01T04:42:42.000Z,401601,36268,211,4927,False
Koch ma!,26,17.24.11,ErklÃ¤r ma! Zora â€“ Vom Lehrling zum KÃ¼chenboss | Koch ma!,1,2017-11-22T15:56:09.000Z,28905,1028,32,75,False
Show Ana Haber,26,17.17.11,"Freni patladÄ±, kimseye Ã§aktÄ±rmadÄ±!",25,2017-11-16T08:10:43.000Z,255232,2326,163,370,False
EndzeitreporterMcM,26,17.20.11,EndzeitreporterMcM vs Pierre Vogel â¤ Der wahre Jesus,29,2017-11-19T10:56:34.000Z,6551,404,25,343,False
justin,25,17.14.12,ğŸ”¥ FEUER ESKALIERT !! | FASHION DUELL 4,22,2017-12-13T14:00:06.000Z,53061,5167,109,372,False
Die MÃ¼ffelstÃ¼cke,25,17.05.12,Tiramisu das alte Meerschweinchen - TÃ¼rchen 4 | Die MÃ¼ffelstÃ¼cke,22,2017-12-04T15:30:00.000Z,11697,1508,8,500,False
â€¢ KÃ¶ln 50667 â€¢ Videos â€¢,25,18.29.04,So wird Lina NIE die Wahrheit herausfindenğŸ˜¡ | KÃ¶ln 50667,22,2018-04-27T15:58:35.000Z,25579,140,11,1,False
KsFreakWhatElse,25,17.20.11,"Monica Bellucci - 15 Deutsch-Rap-Songs Mashup (BAUSA, RIN, UFO361, LUCIANO, ...)",10,2017-11-19T17:30:00.000Z,355343,60213,2923,5206,False
KÃ–LN 50667 - NEWS,25,18.30.01,Marc BOXT Jan !!! | KÃ¶ln 50667 HD+,1,2018-01-29T19:56:59.000Z,1923,25,0,0,False
MBC GROUP,25,18.19.05,Ù…Ø³Ù„Ø³Ù„ Ø§Ù„Ù‡ÙŠØ¨Ø© - Ø¬Ø¨Ù„ Ù…Ø§ Ø¨ÙŠØªÙ‡Ø¯Ø¯.. Ù…Ù†ØªÙ‡ÙŠØ©,24,2018-05-17T19:46:03.000Z,467597,4305,236,385,False
CrazyRussianHacker,25,17.14.11,5 Ice Cream Gadgets put to the Test,28,2017-11-12T21:50:37.000Z,817732,23663,778,3432,False
Imke Riedebusch,25,17.18.11,Edle AdventskraÌˆnze,26,2017-11-17T14:20:27.000Z,13649,428,20,32,False
Berlin Tag & Nacht Vorschau und mehr,25,17.02.12,Jacky zerstÃ¶rt die Wg von Nik!!Paula verliebt in Joe??Berlin Tag&Nacht Vorschau *1577*,22,2017-11-30T19:15:31.000Z,5387,39,0,0,False
Nollywoodpicturestv,25,17.18.11,Zenith of Hatred Season 2 - Ken Erics 2017 Latest Nigerian Nollywood Movie Full HD,24,2017-11-17T07:45:39.000Z,33647,397,14,293,False
TANZVERBOT,25,17.14.11,KOCHEN mit TANZVERBOT |  - 001#,26,2017-11-13T19:00:11.000Z,121928,16467,650,3492,False
FilmSelect,25,17.14.11,NEUE KINO TRAILER 2017 (German Deutsch) KW 46,24,2017-11-12T12:00:01.000Z,83889,787,51,40,False
NoHandGaming,25,17.19.11,FIFA 18: 40 x 81+ SPIELER SETS PACK BATTLE vs TISI SCHUBECH ğŸ”¥âš¡,20,2017-11-18T10:00:04.000Z,133803,12081,180,3125,False
AdlerssonReview,25,17.14.11,SA4 - NEUE DEUTSCHE QUELLE (LTD. Boxset) UNBOXING,10,2017-11-12T19:49:15.000Z,92278,4527,147,495,False
Britain's Got Talent,25,18.15.04,Marc Spelmann gets the first Golden Buzzer of 2018 | Auditions Week 1 | Britainâ€™s Got Talent 2018,24,2018-04-14T19:53:33.000Z,727663,34104,547,0,True
Music Relaxing,25,17.31.12,Love Songs Piano Music Cover - A Very Magical And Beautiful Music - The Melodies Are Fantastic!,10,2017-12-30T06:00:01.000Z,203374,493,119,25,False
Arabische StraÃŸe - Ø´Ø§Ø±Ø¹ Ø§Ù„Ø¹Ø±Ø¨,25,17.16.12,Ù…Ø¹Ù„ÙˆÙ…Ø§Øª Ù…Ù…ØªØ¹Ø© - Ù†Ø¹ÙŠÙ…Ø§Ù‹ - INTERESSANTES - Wie aus dem Ei gepellt,27,2017-12-15T11:13:17.000Z,5682,714,5,65,False
GOLAZO TV,25,17.20.11,Atletico Madrid vs Real Madrid 0-0 - Extended Match Highlights - La Liga 18/11/2017 HD,17,2017-11-18T21:53:10.000Z,2029829,9322,764,2385,False
NicK FX,25,17.28.11,Die Drei Fragezeichen ??? | 108 - Die sieben Tore (VOLLE VERSION) (DEUTSCH),22,2017-11-26T09:59:16.000Z,31531,304,40,9,False
Ø¥ÙŠÙ…Ø§Ø± Ø§Ù„Ø´Ø§Ù… Ù„Ù„Ø¥Ù†ØªØ§Ø¬ Ø§Ù„ÙÙ†ÙŠ Emar Al Sham,25,18.21.05,Ù…Ø³Ù„Ø³Ù„ Ø§Ù„ÙˆØ§Ù‚ ÙˆØ§Ù‚ Ø§Ù„Ø­Ù„Ù‚Ø© 1 Ø§Ù„Ø§ÙˆÙ„Ù‰ | Ø§Ù„Ø®Ø±ÙŠØ·Ø© - Ø±Ø´ÙŠØ¯ Ø¹Ø³Ø§Ù Ùˆ Ø¨Ø§Ø³Ù… ÙŠØ§Ø®ÙˆØ± | El Waq waq,24,2018-05-20T21:00:01.000Z,57440,1125,38,201,False
FrÃ¼hstÃ¼cksfernsehen,25,17.20.11,SO gibt es den PERFEKTEN KINDERGEBURTSTAG unter 100 â‚¬ | SAT.1 FrÃ¼hstÃ¼cksfernsehen | TV,24,2017-11-19T07:00:00.000Z,9357,245,32,95,False
Check the Celeb,25,17.27.12,SHIRIN DAVID & Rapper PA SPORTS zusammen? | Die Antwort Ã¼ber die LiebesgerÃ¼chte zu SHIRIN DAVID,22,2017-12-25T15:44:52.000Z,79473,1283,161,185,False
RapAmMittwochTV,24,17.25.11,"RAP AM MITTWOCH KÃ–LN: 03.11.17 Halbfinale feat. JI-ZI, VYRUS, JOLLE, TRIPLEBEAT (3/4)",24,2017-11-24T17:36:40.000Z,34174,1266,28,236,False
ĞŸÑ€ÑĞ¼Ğ¾Ğ¹ ÑÑ„Ğ¸Ñ€,24,17.03.12,Ğ ÑƒĞºĞ¸-Ğ±Ğ°Ğ·ÑƒĞºĞ¸: Ğ Ğ°Ğ´Ğ¸ ÑĞ»Ğ°Ğ²Ñ‹ Ğ² Ğ¸Ğ½Ñ‚ĞµÑ€Ğ½ĞµÑ‚Ğµ. ĞĞ½Ğ´Ñ€ĞµĞ¹ ĞœĞ°Ğ»Ğ°Ñ…Ğ¾Ğ². ĞŸÑ€ÑĞ¼Ğ¾Ğ¹ ÑÑ„Ğ¸Ñ€ Ğ¾Ñ‚ 01.12.17,24,2017-12-01T15:00:06.000Z,457377,3017,1420,2076,False
asmr zeitgeist,24,17.18.12,Tingle Bells ASMR | Christmas Triggers & Zeitgeist Cap Giveaway,24,2017-12-17T21:08:03.000Z,51019,3445,43,634,False
MBC THE VOICE KIDS,24,17.10.12,Ø§Ù„Ø­Ù„Ù‚Ø© Ø§Ù„Ø«Ø§Ù†ÙŠØ© â€“ Ù…Ø±Ø­Ù„Ø© Ø§Ù„ØµÙˆØª ÙˆØ¨Ø³ â€“ Ù…Ø­Ù…Ø¯ Ø§Ù„Ø¨Ù†Ø¯ÙŠ,1,2017-12-09T19:29:32.000Z,301383,4517,164,948,False
WORLDSTARHIPHOP,24,18.16.01,6IX9INE Feat. Fetty Wap & A Boogie â€œKEKEâ€ (WSHH Exclusive - Official Music Video),10,2018-01-14T20:00:35.000Z,3248447,160931,7255,18551,False
WDR Doku,24,17.18.11,Zwillinge - wie finden sie einen Partner? | WDR Doku,24,2017-11-17T08:29:56.000Z,15237,164,6,39,False
RabenmÃ¼tter,24,17.21.11,Wo ist mein Kind? | RabenmÃ¼tter | SAT.1,24,2017-11-20T15:00:03.000Z,10619,513,7,20,False
Team Coco,24,17.14.12,James Franco Answers The Disaster Artist Phone Number  - CONAN on TBS,23,2017-12-13T03:18:19.000Z,190959,4203,37,273,False
unsympathischTV,24,17.24.12,WEIHNACHTSLIEDER ERRATEN MIT MEINER SCHWESTER | crewzember,24,2017-12-23T17:00:04.000Z,261668,25724,137,615,False
AFRICAFILMStv,24,17.20.11,La Reine Blanche - saison 2 - Ã©pisode 88,1,2017-11-19T11:15:32.000Z,29113,446,18,249,False
Celebridades News,24,17.30.12,Helene Fischer: schockierender Betrugs-Skandal!,25,2017-12-29T11:07:38.000Z,6398,13,26,0,False
Mark Wiens,24,17.11.12,"Thai Street Food Michelin Star - GIANT CRAB OMELET at Jay Fai (à¸£à¹‰à¸²à¸™à¹€à¸ˆà¹Šà¹„à¸) in Bangkok,  Thailand!",19,2017-12-10T13:00:09.000Z,242392,10166,272,1106,False
Dolunay,24,17.14.11,Dolunay 19. BÃ¶lÃ¼m,22,2017-11-12T21:06:19.000Z,685202,5472,528,463,False
SPACE FROGS,24,17.11.12,"Na, Neugierig? - Ehrliche Werbung",24,2017-12-10T13:35:07.000Z,265654,56654,175,994,False
The Real Life Guys,23,17.21.11,SCHWEBENDES SCHLAUCHBOOT vs 150km/h Rennkart! | Crash mit unserem Hovercraft,22,2017-11-20T15:08:46.000Z,184284,9816,158,681,False
Full Frontal with Samantha Bee,23,17.17.11,"We Can All Do Better Than Roy Moore | November 15, 2017 Act 1 | Full Frontal on TBS",22,2017-11-16T07:00:04.000Z,397983,5666,1682,1306,False
TOLOTV,23,17.18.11,Ù‚Ø§Ø¨ Ú¯ÙØªÚ¯Ùˆ - Ù‚Ø³Ù…Øª Ø¯Ùˆ ØµØ¯ Ùˆ Ø¨ÛŒØ³Øª Ùˆ Ù¾Ù†Ø¬Ù… / Qabe Goftogo - Episode. 225,24,2017-11-17T15:23:41.000Z,19279,267,12,69,False
TOLGSHOW,23,18.07.01,TOLGSHOW 2. BÃ¶lÃ¼m,24,2018-01-06T21:43:24.000Z,238003,9243,258,888,False
Avlu,23,18.30.03,Avlu 1. BÃ¶lÃ¼m,22,2018-03-29T21:24:46.000Z,18807,697,27,190,False
Unbox Therapy,23,17.16.11,The Most Insane Workstation + Gaming Setup,28,2017-11-15T17:29:08.000Z,1279800,75008,1266,11658,False
ADINI SEN KOY ASK_ZEHOM_AÄ°LESÄ°,23,17.25.11,AdÄ±nÄ± Sen Koy 226-227.bÃ¶lÃ¼m fragmanÄ±ğŸ˜²ğŸ˜²ğŸ˜²,22,2017-11-24T16:04:17.000Z,83775,565,14,120,False
Borussia Dortmund,23,17.02.12,"Your favourite roommate? | One more question, Roman Weidenfeller! | BVB",17,2017-12-01T11:31:25.000Z,4485,247,1,14,False
AdamThomasMoran,23,17.18.11,+100500 - ĞŸĞµÑ€ĞµĞ´Ñ‘Ñ€Ğ³Ğ¸Ğ²Ğ°Ğ½Ğ¸Ğµ ĞĞ° ĞŸĞµÑ€Ğ²Ğ¾Ğ¼,23,2017-11-17T15:15:57.000Z,992182,109363,3794,36390,False
Egyptian Arts Group,23,18.18.05,Ù…Ø³Ù„Ø³Ù„ Ø±Ø­ÙŠÙ… - Ø§Ù„Ø­Ù„Ù‚Ø© 1 ( Ø§Ù„Ø£ÙˆÙ„Ù‰ ) - Ø¨Ø·ÙˆÙ„Ø© ÙŠØ§Ø³Ø± Ø¬Ù„Ø§Ù„ - Rahim Series Episode 01,24,2018-05-16T22:55:15.000Z,781097,8263,432,924,False
RAF Camora,23,17.20.11,RAF Camora - ANTHRAZIT R.R.- SNIPPET Nr. 1- (VÃ–: 15.12.2017),24,2017-11-19T11:55:38.000Z,126065,11016,45,1081,False
Neuste.news,23,18.08.02,Die Halle fÃ¼llte sich in Minuten - So werden die SchaumlÃ¶schanlagen getestet!,25,2018-02-07T18:00:04.000Z,21916,769,19,120,False
UchoPrezesa,23,17.17.11,Ucho Prezesa odc. 25 - Gniazdo bocianie,1,2017-11-16T07:00:00.000Z,529158,7517,525,607,False
Sidemen,23,18.15.01,"LOGAN PAUL, KSI VS JOE WELLER FIGHT, SIDEMEN DISS TRACKS",24,2018-01-14T18:00:02.000Z,1156524,95666,1172,8464,False
Sport im Osten,22,17.23.11,Ausschreitungen Ã¼berschatten Leipziger Derby | Sport im Osten | MDR,17,2017-11-22T18:06:59.000Z,4377,36,5,4,False
Berlin Tag & Nacht / KÃ¶ln 50667,22,17.29.12,Jan rÃ¤cht sich an Holly ğŸ˜±ğŸ˜¥ğŸ™„   KÃ¶ln 50667,22,2017-12-28T17:16:30.000Z,22508,126,3,13,False
jacksfilms,22,17.16.11,"You, but in emojis. (YIAY #375)",23,2017-11-15T20:00:02.000Z,808317,49439,254,54943,False
Minotheras,22,17.19.11,"Umstrittener GrÃ¼ner: Boris Palmer Ã¼ber Jamaika, Asyl & die AfD | Markus Lanz 16.11.2017",25,2017-11-17T10:02:09.000Z,14885,208,25,269,False
Seda Sayan'la,22,18.09.01,Seda Sayan'la 1.BÃ¶lÃ¼m 2.KÄ±sÄ±m | 8 Ocak 2018,24,2018-01-08T17:09:58.000Z,28000,107,79,40,False
Enes Batur,22,17.30.12,Enes Batur : Hayal Mi GerÃ§ek Mi ? - Fragman,24,2017-12-29T18:46:56.000Z,1812333,184586,10430,40687,False
Me Zemer Te Hapur,22,17.15.11,Plas sherri ne emision/ 53-vjeÃ§ari kercenon kunatin: Me gjej dashnoret e motres ose te zhduka,24,2017-11-14T07:57:42.000Z,42343,139,41,74,False
Matt Stonie,22,17.19.11,"GIANT Ramen Challenge (vs Morgan) (3,000,000 Sub Video!)",24,2017-11-17T22:26:42.000Z,1280763,54022,586,4521,False
Achgut.Pogo,22,17.14.11,Denunziantentum heiÃŸt jetzt Zivilcourage,25,2017-11-13T14:03:52.000Z,6051,526,8,58,False
Berlin Tag & Nacht - KÃ¶ln 50667,22,17.29.11,Kim wird vor ihren Eltern versteckt!!! | Berlin Tag & Nacht #1574,24,2017-11-28T19:05:52.000Z,21794,124,3,1,False
MBC The Voice,22,18.11.02,#MBCTheVoice - Ù…Ø±Ø­Ù„Ø© Ø§Ù„ØµÙˆØª ÙˆØ¨Ø³ - Ø¹Ø¨Ù‘ÙˆØ¯ Ø£ØºÙˆØ¨,24,2018-02-10T20:15:19.000Z,302418,1680,138,94,False
à¹‚à¸«à¸™à¸à¸£à¸°à¹à¸ª (Hone-Krasae) Official,22,17.28.11,à¸¡à¸²à¸•à¸²à¸¡à¸™à¸±à¸”! à¸­à¸±à¸ˆà¸‰à¸£à¸´à¸¢à¸° à¸—à¸§à¸‡à¹€à¸‡à¸´à¸™ 1 à¸¥à¹‰à¸²à¸™ à¸¡à¸²à¸£à¹Œà¸„ à¸à¸´à¸—à¸šà¸¹à¸¥ à¸à¸£à¸“à¸µà¸„à¸£à¸¹à¸ˆà¸­à¸¡à¸—à¸£à¸±à¸à¸¢à¹Œ | EP.95 | 27 à¸.à¸¢. 60 | à¹‚à¸«à¸™à¸à¸£à¸°à¹à¸ª,24,2017-11-27T16:34:51.000Z,208488,1159,141,3115,False
ĞĞ¢Ğ’,22,17.20.11,Â«ĞĞ¾Ğ²Ñ‹Ğµ Ñ€ÑƒÑÑĞºĞ¸Ğµ ÑĞµĞ½ÑĞ°Ñ†Ğ¸Ğ¸Â»: Â«Ğ—Ğ°ÑĞ²Ğ»ĞµĞ½Ğ¸Ğµ ÑÑ‹Ğ½Ğ° Ğ”Ğ¶Ğ¸Ğ³Ğ°Ñ€Ñ…Ğ°Ğ½ÑĞ½Ğ°Â»,25,2017-11-19T09:14:15.000Z,125923,626,198,843,False
Pandorya,22,17.14.11,SIMULACRA #06 - Taylor: FREUND oder FEIND? â— Let's Play Simulacra,20,2017-11-13T18:00:02.000Z,12667,1074,4,125,False
Gannikus.com,22,17.14.11,"News - Rich Pianas Autopsiebericht verÃ¶ffentlicht, Hardgainer Song, Sophia Thiel Body Update",17,2017-11-12T17:39:09.000Z,30907,1766,81,311,False
Bundeswehr Exclusive,22,17.14.11,Gao bei Nacht | MALI | Folge 18,22,2017-11-13T15:59:51.000Z,62733,2450,85,245,False
Einfach Thermomix,22,17.17.11,"Die BESTEN Thermomix AnfÃ¤nger Tipps, wenn der Thermomix NEU ist",26,2017-11-16T17:00:00.000Z,7505,136,15,11,False
ĞšĞ°Ğ»Ğ½Ğ¸Ğ½Ğ° ĞĞ°Ñ‚Ğ°Ğ»ÑŒÑ,22,18.12.01,"ĞŸĞ¾Ğ¿ÑƒĞ»ÑÑ€Ğ½Ñ‹Ğ¹ Ğ¡Ğ£ĞŸ, ĞºĞ¾Ñ‚Ğ¾Ñ€Ñ‹Ğ¹ ÑĞ²Ğ¾Ğ´Ğ¸Ñ‚ Ğ²ÑĞµÑ… Ñ Ğ£Ğ¼Ğ°!",22,2018-01-11T15:24:32.000Z,69674,7130,71,218,False
Ğ›Ğ¸Ğ³Ğ° Ğ¡Ğ¼ĞµÑ…Ğ°,22,17.25.11,Ğ—Ğ²ĞµĞ·Ğ´Ğ½Ñ‹Ğ¹ Ñ‡Ğ°Ñ - Ğ¤Ğ¸Ğ½Ğ°Ğ» Ğ›Ğ¸Ğ³Ğ¸ Ğ¡Ğ¼ĞµÑ…Ğ° Ğ¾Ñ‚ 24.11.2017,23,2017-11-24T20:11:51.000Z,216957,5102,451,1525,False
Antje Sophia,22,17.19.11,Jamaika und AuflÃ¶sung des Bundestages - KnotenÃ¶serin - erfÃ¼llte Prophetie und Einblicke,22,2017-11-18T11:00:44.000Z,8622,436,26,82,False
TipTapTube,22,17.11.12,GROÃŸE PS4 Advents Verlosung  ğŸ˜ Wir ziehen den Gewinner ğŸ  TipTapTube ğŸ˜,24,2017-12-10T19:26:31.000Z,27758,2506,73,2429,False
Kelly MissesVlog,22,17.25.12,Ein Weihnachtslied! Kelly komponiert Kommentare,24,2017-12-24T11:02:11.000Z,105118,17660,393,1677,False
BodyKiss,21,17.22.11,Draw My Life â™¡ BodyKiss,17,2017-11-21T13:58:10.000Z,26860,3051,33,154,False
"Guten Morgen, Internet!",21,17.24.11,SCHMERZ oder SEGEN? | Das groÃŸe LEIDEN beim Schokoladen Roulette!,24,2017-11-23T05:30:00.000Z,25969,1819,17,100,False
Kurzgesagt â€“ In a Nutshell,21,17.17.11,Emergence â€“ How Stupid Things Become Smart Together,27,2017-11-16T15:01:58.000Z,1164713,88543,742,6750,False
TeddyComedy,21,17.14.11,Antoine leiht Auto von ErnÃ¤hrungsberaterin,23,2017-11-12T11:53:45.000Z,369173,16953,570,611,False
AdÄ±: Zehra,21,18.25.02,AdÄ±: Zehra 1. BÃ¶lÃ¼m,22,2018-02-24T19:51:54.000Z,8226,242,7,32,False
Selbstversorger Rigotti,21,17.17.11,Wiese mÃ¤hen: Mit Traktor und MÃ¤hwerk,24,2017-11-15T15:33:35.000Z,31138,1308,51,394,False
secureteam10,21,18.07.01,STRANGE Things Happening In Ecuador..,28,2018-01-06T10:18:14.000Z,356098,11036,510,3794,False
GrÃ¼nwald Freitagscomedy,21,17.15.11,WM-Aus fÃ¼r Italien gegen Schweden | GrÃ¼nwald Freitagscomedy,24,2017-11-14T09:55:26.000Z,11146,171,32,19,False
BodyFood,21,17.20.11,One Pot Gericht - Gnocchi schnell zubereiten - 15 Minuten Essen ohne Schnitt,24,2017-11-19T07:22:39.000Z,7597,515,7,25,False
Anna Chi DE,21,17.15.11,FrÃ¼chteschleim selber machen,24,2017-11-14T12:00:24.000Z,6934,344,16,76,False
Forti,21,18.06.01,Er legte einen Schlauch um sein Haus und alle lachten Ã¼ber ihn. Doch dann passierte was HEFTIGES...,22,2018-01-05T09:13:58.000Z,6294,281,9,22,False
BakeClub,21,18.05.01,Donauwellen-Gugelhupf mit CheesecakefÃ¼llung | BakeClub,26,2018-01-04T16:00:02.000Z,8235,567,4,26,False
Eurovision Song Contest,21,18.09.03,Jessica Mauboy - #We Got Love - Australia - Official Music Video - Eurovision 2018,24,2018-03-08T13:01:00.000Z,135627,5027,1293,1659,False
DekoideenReich,21,17.27.11,DIY - Weihnachtsdeko mit Sterneffekt - Folie | Winterlandschaft mit Reh | Gewinnspiel AuflÃ¶sung,26,2017-11-26T07:00:02.000Z,19574,931,23,44,False
Mudi,21,18.10.02,Mudi - Hasret [Offizielles Video],10,2018-02-09T17:00:00.000Z,102705,16363,114,1146,False
Fard,20,17.16.12,FARD - 100 TERRORBARS  (official Video),24,2017-12-15T13:56:47.000Z,216219,24019,700,1921,False
Real Time with Bill Maher,20,17.19.11,"Trump Nukes, Panama Papers, 2018 Democrats | Overtime with Bill Maher (HBO)",1,2017-11-18T05:53:10.000Z,258437,3040,242,1024,False
Zvezde Granda Specijal,20,17.14.11,Zvezde Granda - Specijal 06 - 2017/2018 - (TV Prva 12.11.2017.),24,2017-11-12T17:00:01.000Z,62713,169,35,35,False
HerÅŸey Dahil,20,17.14.11,"OÄŸlu 3 YÄ±l Ã–nce Ã–ldÃ¼, Bir GÃ¼n Bir Ã‡ocuk KapÄ±yÄ± Ã‡aldÄ± ve Anne Benim Dedi.",24,2017-11-13T15:32:55.000Z,133157,2793,209,501,False
Robert Franz,20,18.01.01,Robert Franz: Anklage wegen Kurpfuscherei Ã„rztekammer Steiermark,29,2017-12-31T13:47:16.000Z,8202,1022,12,137,False
Only Afghan,20,17.21.12,Ù…ÙˆØ§ÙÙ‚Øª Ø¯Ø§Ú©ØªØ± Ø¹Ø¨Ø¯Ø§Ù„Ù„Ù‡ Ø¨Ø§ ØªØµÙ…ÛŒÙ… Ø­Ú©ÙˆÙ…Øª Ø¯Ø±Ù…ÙˆØ±Ø¯ Ù¾Ø²ÛŒØ±Ø´ Ø§Ø³ØªØ¹ÙØ§ÛŒ Ø¹Ø·Ø§ Ù…Ø­Ù…Ø¯ Ù†ÙˆØ±,22,2017-12-20T15:53:14.000Z,13924,123,18,64,False
Marodi TV SÃ©nÃ©gal,20,17.26.11,Pod et Marichou - Saison 2 - Episode 55,24,2017-11-25T20:31:52.000Z,330529,4252,533,2112,False
Seda ve UÄŸur'la,20,17.15.11,Seda ve UÄŸur'la 47.BÃ¶lÃ¼m 2.KÄ±sÄ±m | 14 KasÄ±m 2017,24,2017-11-14T15:56:29.000Z,26245,73,42,40,False
ZEMENTV,20,17.13.12,ï¼ˆá‹˜áˆ˜áŠ• ï¼‰ZEMEN Part 72,24,2017-12-12T18:00:19.000Z,160649,3608,173,1635,False
ĞœĞ°ÑÑ‚ĞµÑ€Ğ¨ĞµÑ„,20,17.16.11,ĞœĞ°ÑÑ‚ĞµÑ€Ğ¨ĞµÑ„. Ğ¡ĞµĞ·Ğ¾Ğ½ 7. Ğ’Ñ‹Ğ¿ÑƒÑĞº 23. Ğ§Ğ°ÑÑ‚ÑŒ 5 Ğ¸Ğ· 5 Ğ¾Ñ‚ 14.11.2017,24,2017-11-14T23:28:14.000Z,76162,312,39,115,False
SMGä¸Šæµ·ç”µè§†å°å®˜æ–¹é¢‘é“ SMG Shanghai TV Official Channel,20,17.18.11,ã€Fullã€‘ã€Šæé™æŒ‘æˆ˜IIIã€‹ç¬¬12æœŸ20171117ï¼šå­™çº¢é›·å¼ è‰ºå…´å›å¿†æ€ é»„æ¸¤åŒ–èº«æ¸¸å®¢æ‹ç…§ä¸åœ Go Fighting S3 EP.12ã€ä¸œæ–¹å«è§†å®˜æ–¹é«˜æ¸…ã€‘,24,2017-11-17T17:01:24.000Z,215746,1206,60,618,False
Warner Bros. Pictures,20,17.17.11,RAMPAGE - OFFICIAL TRAILER 1 [HD],24,2017-11-16T21:15:08.000Z,2585193,40778,3499,8834,False
Comedy & Satire im Ersten,20,17.19.11,F-Promis sozialvertrÃ¤glich entsorgen | Nuhr im Ersten,24,2017-11-17T10:25:45.000Z,34010,225,43,47,False
GermanLetsPlay,20,17.14.11,Das auf dem Bild ist ein netter Mario! â˜† Skribbl.io,20,2017-11-11T17:37:12.000Z,265269,15488,272,655,False
Mercedes-Benz Deutschland,20,17.04.12,JP Performance und Matthias Malmedie in den heiligen Hallen von Mercedes-Benz,2,2017-12-03T10:00:02.000Z,294317,12028,204,816,False
nigahiga,20,17.14.11,I Dare You: GOING BALD!?,24,2017-11-12T18:01:41.000Z,2095828,132239,1989,17518,False
DRUCK - Die Serie,20,18.21.03,Herzlich Willkommen - DRUCK - Tag 2,1,2018-03-20T10:51:01.000Z,3689,268,4,34,False
Live From Earth,20,17.23.12,Yung Hurn - GGGut (Official Video) (prod. Stickle),24,2017-12-22T18:30:36.000Z,148887,16258,1833,1495,False
HATICE MAZI,20,17.19.12,AnalÄ± KÄ±zlÄ± Ã‡orba Tarifi | Hatice MazÄ± ile Yemek Tarifleri,26,2017-12-18T16:11:22.000Z,33570,1337,56,238,False
CBCDrama,20,18.18.05,Ù…Ø³Ù„Ø³Ù„ Ø§Ù„ÙˆØµÙŠØ© |  Ø§Ù„Ø­Ù„Ù‚Ø© Ø§Ù„Ø£ÙˆÙ„Ù‰ |  AL Wasseya Episode 01,24,2018-05-17T18:08:14.000Z,196918,2303,136,218,False
Wanted Adventure,20,17.14.11,BREAKFAST: Differences in Germany & USA,22,2017-11-12T08:00:00.000Z,37034,1764,41,492,False
Kalbimdeki Deniz,20,17.20.11,Kalbimdeki Deniz 45. BÃ¶lÃ¼m,22,2017-11-18T21:28:56.000Z,144675,1101,164,294,False
Azzlackz,20,17.17.11,Azzi Memo - AMG 2 ft. Eno (prod. von SOTT & TG) [Official HD Video],10,2017-11-16T22:59:31.000Z,124492,18587,575,1071,False
Marvel Entertainment,20,17.29.11,Avengers: Infinity War Trailer Tease,24,2017-11-28T17:09:22.000Z,3111226,127079,12403,18233,False
TVision,19,18.18.05,Ù…Ø³Ù„Ø³Ù„ Ø£Ø¨Ùˆ Ø¹Ù…Ø± Ø§Ù„Ù…ØµØ±ÙŠ - Ø§Ù„Ø­Ù„Ù‚Ø© Ø§Ù„Ø£ÙˆÙ„Ù‰ | Ø£Ø­Ù…Ø¯ Ø¹Ø² | Abou Omar Elmasry - Eps 1,24,2018-05-17T20:00:00.000Z,130861,1919,85,452,False
KÃ¶ln50667 - Daily,19,18.08.03,Freddy FLIEGT RAUS!! aka. Cousin | KÃ¶ln50667,22,2018-03-07T18:40:56.000Z,7161,47,6,2,False
SPACE RADIO,19,17.23.12,Warum bin ich nicht Alpha?! - Rick kommentiert,22,2017-12-22T16:07:34.000Z,130816,15815,134,1062,False
BuzzFeedBlue,19,17.26.11,The Mysterious Disappearance of Roanoke Colony,22,2017-11-24T23:00:41.000Z,1771121,68143,885,12707,False
CanBroke,19,17.03.12,CanBroke | Controller kaputt wegen FIFA 18 | Broke2L1 #4,24,2017-12-02T09:00:02.000Z,122133,16366,393,4102,False
Stil AvcÄ±larÄ±,19,17.21.11,Stil AvcÄ±larÄ± 16. BÃ¶lÃ¼m,24,2017-11-20T12:17:53.000Z,18099,164,25,61,False
First We Feast,19,17.08.12,Logic Solves a Rubik's Cube While Eating Spicy Wings | Hot Ones,26,2017-12-07T16:03:12.000Z,1458368,109703,1903,13669,False
RobBubble,19,17.23.11,YouTube DEUTSCHLAND Rewind 2017,23,2017-11-22T19:22:14.000Z,53961,9000,145,333,False
Jens Rabe,19,17.15.11,Buy & Hold - Funktioniert das noch?,27,2017-11-14T15:00:01.000Z,4527,231,4,34,False
Lil Lano,19,18.31.01,Lil Lano - FALSCHEN SUPREME Pt.2 (prod.by BennyBoominğŸ˜) [Official HD Video],24,2018-01-28T19:15:08.000Z,611142,12546,72237,18266,False
neuland.tips,19,17.26.11,"News zu WhatsApp, Harry Potter GO, YouTube, Instagram, Snapchat",26,2017-11-25T09:00:06.000Z,54563,3222,39,244,False
PC-WELT,19,17.17.11,Gaming-PC fÃ¼r 600â‚¬? Was taugt der ALDI-PC Medion Akoya P56000?,28,2017-11-16T14:39:13.000Z,70618,3168,101,1253,False
AUTO BILD,19,17.29.11,Zukunftsaussicht: Mercedes A-Klasse (2018) Details/ErklÃ¤rung,2,2017-11-28T08:00:01.000Z,10192,188,23,38,False
Oliver Flesch,19,18.07.01,Polizist packt aus: â€Silvester war alles NOCH viel schlimmer!â€œ,25,2018-01-05T09:15:07.000Z,50643,2251,212,0,True
JuliensBlogBattle,19,18.24.04,JBB 2018 | RICHJER vs. SLY | BEWERTUNG,24,2018-04-23T12:00:01.000Z,291422,28052,2383,5062,False
Bon AppÃ©tit,19,18.12.01,Kids Try 100 Years of the Most Expensive Foods | Bon AppÃ©tit,24,2018-01-10T18:31:07.000Z,372902,5969,808,1314,False
freekickerz,19,17.20.11,ULTIMATE FOOTBALL CHALLENGE vs FC Schalke Pro Footballer,17,2017-11-19T13:00:02.000Z,244496,11053,144,369,False
Ah Nice,19,17.25.11,5 ARTEN VON RAPPERN (Teil 2) mit DANERGY,24,2017-11-24T15:53:44.000Z,67512,8636,115,1202,False
Star Wars Clips Deutsch,19,17.18.11,Star Wars The Clone Wars Die - Verschwundenen Teil 2,22,2017-11-17T17:35:56.000Z,4112,49,2,0,False
LaLiga Santander,19,17.20.11,Resumen de AtlÃ©tico de Madrid vs Real Madrid (0-0),17,2017-11-18T23:00:00.000Z,400462,2602,288,251,False
NÃ¤htinchen,19,17.25.11,Winterloop Extra - NÃ¤hanleitung fÃ¼r AnfÃ¤nger - OHNE Schnittmuster - NÃ¤htinchen,22,2017-11-24T15:28:48.000Z,4286,576,2,29,False
Yuvamdaki DÃ¼ÅŸman,19,18.27.01,Yuvamdaki DÃ¼ÅŸman 1.BÃ¶lÃ¼m,1,2018-01-25T21:30:01.000Z,233249,2456,184,476,False
faz,19,18.02.01,Kim Jong Un: Amerika kann uns nicht den Krieg erklÃ¤ren,25,2018-01-01T13:59:35.000Z,5035,17,8,9,False
Speed Shop Kenya,19,18.28.01,Heino aus Africa....Der Arsch meiner Helden,22,2018-01-27T12:03:13.000Z,4743,350,10,53,False
Markiplier,19,17.30.11,TROLLS IN THE TREES | Unforgiving: A Northern Hymn - Part 1,20,2017-11-29T16:01:28.000Z,457485,26515,190,4414,False
LYE.tv,19,17.18.11,LYE.tv - Fshaye Ghirmay - Dhri Tselam | á‹µáˆ•áˆª áŒ¸áˆ‹áˆ - Part 2 - New Eritrean Movies 2017,24,2017-11-17T16:00:03.000Z,80956,2433,52,276,False
manototv,19,17.03.12,Ø´Ø¹Ø± ÛŒØ§Ø¯Øª Ù†Ø±Ù‡ - Ù‚Ø³Ù…Øª Û² / Sher Yadet Nare Ep02,24,2017-12-01T18:30:01.000Z,81416,420,65,98,False
SOBOLEV,19,17.03.12,ĞĞĞ’ĞĞ¯ Ğ¨Ğ£Ğ Ğ«Ğ“Ğ˜ĞĞ / Ğ‘Ğ›ĞĞ“Ğ•Ğ ĞĞ’ Ğ¡ĞĞ–ĞĞ®Ğ¢ Ğ’ Ğ¢Ğ®Ğ Ğ¬ĞœĞ£,22,2017-12-02T13:34:34.000Z,1700236,181194,5180,12691,False
Albasheer Show - Ø§Ù„Ø¨Ø´ÙŠØ± Ø´Ùˆ,19,18.31.03,Ø§Ù„Ø¨Ø´ÙŠØ± Ø´Ùˆ Ø§ÙƒØ³ - Albasheershow X / Ø§Ù„Ø­Ù„Ù‚Ø© 1 - Ø±Ø§Ø¬Ø¹Ù„Ù‡Ù…,24,2018-03-30T19:34:15.000Z,405549,55325,808,13806,False
Tommy TV,19,17.15.11,Wie man bunte Waffeln zum essen selber macht,24,2017-11-14T13:10:44.000Z,13977,1287,46,212,False
1LIVE,19,17.16.11,Felix Lobrecht: Talent | 1LIVE Generation Gag,24,2017-11-15T18:00:06.000Z,13381,772,15,11,False
20th Century Fox,19,17.16.11,Deadpoolâ€™s â€œWet on Wetâ€ Teaser,1,2017-11-15T14:01:03.000Z,3979891,151850,2378,8079,False
oblomoff,19,17.09.12,Ğ¡Ñ‚ĞµĞºĞ»ÑÑˆĞºĞ° Ğ’ĞœĞ•Ğ¡Ğ¢Ğ Ğ¡ĞĞ£Ğ¡Ğ... Ğ¡Ğ»Ğ°Ğ²Ğ½Ñ‹Ğ¹ ĞĞ±Ğ·Ğ¾Ñ€. ĞĞ°Ñ‡Ğ°Ğ»Ğ¸ Ğ·Ğ° Ğ·Ğ´Ñ€Ğ°Ğ²Ğ¸Ğµ..,24,2017-12-08T09:13:51.000Z,766451,44267,5968,6030,False
FardadFarahzad,19,18.01.01,Ø§ÙˆÙ„ÛŒÙ† Ø¨Ø®Ø´ Ø®Ø¨Ø±ÛŒ Ø´Ù†Ø¨Ù‡ Û¹ Ø¯ÛŒ Û±Û³Û¹Û¶ Ø§Ø² Ø¨ÛŒâ€ŒØ¨ÛŒâ€ŒØ³ÛŒ ÙØ§Ø±Ø³ÛŒ,25,2017-12-30T14:15:33.000Z,84759,565,84,130,False
Emrah,19,18.12.02,6 Omas probieren zum 1. Mal SHISHA !,10,2018-02-11T17:00:02.000Z,609420,42160,3208,3897,False
Will Smith,18,18.02.03,Getting Hit with a 120mph Tennis Serve SUCKS! | Will Smith Vlogs,24,2018-03-01T19:45:37.000Z,147490,13601,44,1722,False
GamerBrother,18,17.17.11,FIFA 18: F8TAL ICON Maradona #01 - Koksnase legt los ğŸ”¥ğŸ”¥,20,2017-11-16T15:00:03.000Z,198241,19570,200,20684,False
Michael Bully Herbig,18,17.17.11,Winnetou - Spurensuche - bullyparade â€“ TV-Comedyshow / 1999,24,2017-11-16T14:30:01.000Z,3511,310,0,13,False
RP ONLINE â€“ Wir sind NRW!,18,17.16.11,Im KreiÃŸsaal: Hochschwangere tanzt vor Geburt zu Shakira,25,2017-11-15T14:16:56.000Z,6761,8,0,0,False
SENSITIVA UNIVERSE,18,17.25.11,Das SENSITIVA UNIVERSEÂ® Orakel Beruf & Finanzen | JahresÃ¼berblick 2018 fÃ¼r alle 12 Sternzeichen â™¥,22,2017-11-24T16:19:50.000Z,4605,0,0,0,True
EminemVEVO,18,17.14.11,Eminem - Walk On Water (Audio) ft. BeyoncÃ©,10,2017-11-10T17:00:03.000Z,17158579,787424,43420,125882,False
Globus,18,17.25.11,NEU: Rotweinkuchen | Backen mit Globus & Sallys Welt #43,22,2017-11-24T14:00:01.000Z,9546,317,19,19,False
5-MINUTEN TRICKS,18,18.09.03,"17 LECKERE 1 MINUTEN REZEPTE, DIE DICH WOW SAGEN LASSEN",26,2018-03-08T11:00:01.000Z,8936,164,11,13,False
Blossom,18,18.18.01,SUPER COOL WINTER LIFE HACKS AND CRAFTS and MORE by Blossom,26,2018-01-17T11:21:00.000Z,960014,17741,731,468,False
ninotakutv,18,17.16.11,Sword Art Online Exklusiv-News â”‚Tokyo Ghoul Season 3 â”‚AOT Staffel 3 - Ninotaku Anime News #132,1,2017-11-15T15:00:07.000Z,50925,3684,65,770,False
Ğ¡Ñ‚ÑƒĞ´Ğ¸Ñ ĞšĞ²Ğ°Ñ€Ñ‚Ğ°Ğ» 95 Online,18,17.14.11,ĞŸĞ¾Ğ»Ğ½Ñ‹Ğ¹ Ğ²Ñ‹Ğ¿ÑƒÑĞº ĞĞ¾Ğ²Ğ¾Ğ³Ğ¾ Ğ’ĞµÑ‡ĞµÑ€Ğ½ĞµĞ³Ğ¾ ĞšĞ²Ğ°Ñ€Ñ‚Ğ°Ğ»Ğ° 2017 Ğ¾Ñ‚ 11 Ğ½Ğ¾ÑĞ±Ñ€Ñ,23,2017-11-11T21:20:22.000Z,542113,4241,426,439,False
Vegan ist ungesund,18,17.15.11,Die schnellste KÃœRBISSUPPE der Welt!,22,2017-11-14T10:01:36.000Z,5508,824,4,65,False
ÄÃ”NG TÃ‚Y PROMOTION OFFICIAL,18,17.21.11,Sau Ãnh HÃ o Quang | Táº­p 8 FULL: Thá»§y TiÃªn tá»«ng muá»‘n giáº£i nghá»‡ vÃ¬ bá»‹ tung áº£nh nÃ³ng (20/11/2017),24,2017-11-20T15:01:38.000Z,692772,4998,400,1506,False
LoL Esports,18,18.18.01,AFS vs. KT - SKT vs. ROX | Week 1 Day 2 | LCK Spring (2018),20,2018-01-17T19:01:51.000Z,1005389,5491,295,122,False
Berlin Tag und Nacht & KÃ¶ln 50667 â€” Clips,18,18.03.02,LEA flirtet mit AYDIN!!?? ğŸ˜—ğŸ¤” | KÃ¶ln 50667,22,2018-02-01T17:43:45.000Z,28621,200,33,15,False
Celeb Interview,18,17.14.11,Outlander Episode 3x09 Jamie And Claire Hot Scene On The Board,1,2017-11-12T15:17:24.000Z,36503,264,4,8,False
Ø§Ù„Ù‚Ù†Ø§Ø© Ø§Ù„Ø±Ø³Ù…ÙŠØ© Ù„Ù„ÙÙ†Ø§Ù†Ø© Ø²ÙŠÙ†Ø© Ø¨Ø§Ø±Ø§ÙÙŠ,18,18.21.05,Ù…Ø³Ù„Ø³Ù„ ÙˆØ±Ø¯Ø© Ø´Ø§Ù…ÙŠØ©   _ Ø§Ø¨ØªÙ‡Ø§Ù„ Ø®Ø§Ù†Ù… ØªÙ‡Ø¯Ø¯ ÙˆØ±Ø¯Ø© ÙÙŠ Ø­Ù…Ø§Ù… Ø§Ù„Ø³ÙˆÙ‚ !  _ Ø²ÙŠÙ†Ø© Ø¨Ø§Ø±Ø§ÙÙŠ   _ Ø³Ù„Ø§ÙØ© Ù…Ø¹Ù…Ø§Ø±   _ Ù†Ø§Ø¯ÙŠÙ†,22,2018-05-20T09:30:00.000Z,57657,402,23,47,False
TeamEvil,18,18.15.02,Real Madrid spioniert Neymar aus !,17,2018-02-14T14:14:16.000Z,30670,2239,72,296,False
Roh Vegan am Limit,18,17.14.11,Was dir niemand Ã¼ber Silicium sagt,22,2017-11-13T14:57:21.000Z,5099,981,5,176,False
Chefi la cuÈ›ite,18,18.17.04,"Nu are nevoie de faimÄƒ, cÄƒci are ani buni de televiziune Ã®n spate! Roxana Gabor, la Chefi la CuÈ›ite",24,2018-04-16T18:19:49.000Z,21585,97,16,12,False
Simon Desue,18,18.13.01,Endlich..,24,2018-01-12T17:26:05.000Z,187747,17361,8700,14221,False
MrTrashpack,18,17.19.12,Tanzverbot kommt in die Charts? - DieLochis gehen GOLD in Deutschland - WuzzUp!?,24,2017-12-18T20:18:23.000Z,34424,2591,176,207,False
Leon Lovelock,18,17.27.11,LOVELOCK VS. BODYFORMUS ğŸ˜¤ || FITNESS CHALLENGE ğŸ’ªğŸ¾ - Leon Lovelock,24,2017-11-26T11:00:03.000Z,71802,7077,124,404,False
Onefootball Deutschland,18,18.15.02,HSV: 2. Liga - Todesurteil oder endlich Zeit fÃ¼r den Umbruch?,17,2018-02-14T16:58:40.000Z,30190,1963,54,488,False
Frei.Wild,18,17.17.11,Frei.Wild - Antiwillkommen  [Offizielles Video],10,2017-11-16T19:01:57.000Z,89159,7877,661,564,False
Brave Wilderness,18,17.25.11,STUNG by a WARRIOR WASP!,15,2017-11-24T12:00:03.000Z,2693637,129049,1486,34224,False
GERMANIA,18,17.14.12,HAZE | GERMANIA,22,2017-12-13T14:00:02.000Z,29173,1849,35,266,False
"Berlin Tag & Nacht,KÃ¶ln 50667 Vorschau",18,18.03.03,Vorschau 5.3.18 Berlin Tag&Nacht,22,2018-03-02T19:14:59.000Z,4803,52,4,1,False
League of Legends,18,17.01.12,Varus: As We Fall [OFFICIAL MUSIC VIDEO] | League of Legends Music,20,2017-11-30T15:21:18.000Z,1294885,69684,3292,8910,False
Rapid Highlights,18,18.04.01,"Portland Trail Blazers vs Cleveland Cavaliers - Full Game Highlights Jan 2, 2018 NBA Season 2017-18",17,2018-01-03T02:32:19.000Z,605094,2029,148,405,False
Pavel Kaplun,18,17.18.11,Foto Challenge Wien: Schlechtwetter,27,2017-11-17T13:00:05.000Z,6079,368,28,37,False
VizioniLibonia,18,17.23.11,Shyhrete & Engjellusha - Nuse Kosovare (Official 2018),24,2017-11-22T19:00:02.000Z,136780,1960,95,172,False
Blackout,18,17.12.12,Ich fahre wieder Motorrad!,2,2017-12-10T12:00:03.000Z,120036,10003,398,1593,False
GReeeN,18,17.26.12,GReeeN - Weihnachtssong (Rappae Cover SIDO) Beat prod.by VenenomalO,24,2017-12-24T16:45:53.000Z,95291,8366,262,396,False
Wissenswert,18,18.10.02,Dieser Mann hackte sich in die Videoscreens des Times Square - Wie geht das?,22,2018-02-09T16:17:41.000Z,5355,473,24,52,False
one31,18,17.14.11,à¹€à¸˜à¸­à¸„à¸·à¸­à¸à¸£à¸«à¸¡à¸¥à¸´à¸‚à¸´à¸• | EP.13 (2/6)  | 13 à¸.à¸¢. 60 | one31,24,2017-11-13T14:51:22.000Z,363046,1375,70,166,False
TopGermanCharts,18,17.02.12,TOP 20 SINGLE CHARTS - 1. DEZEMBER 2017,24,2017-12-01T15:00:05.000Z,5741,285,9,32,False
AntsCanada,18,17.17.12,ANTS VS. ALIEN MOLD,15,2017-12-16T13:00:03.000Z,313681,17565,324,4799,False
SpaceX,18,17.16.12,CRS-13 Hosted Webcast,28,2017-12-15T16:35:18.000Z,472573,13690,406,1355,False
â€¢ KÃ¶ln 50667 â€¢ Clips â€¢,17,18.03.04,Patrick startet seinen Plan!ğŸ˜¡ğŸ˜± | KÃ¶ln 50667,22,2018-03-30T16:02:46.000Z,7896,51,3,1,False
Slime Fun,17,17.18.12,Family Stories - Ich hasse meine Eltern (10),22,2017-12-17T10:13:03.000Z,252348,2540,293,389,False
FÃ¼r Gerechtigkeit,17,17.03.12,02.12.2017 Bundesparteitag der AfD PhÃ¤nomenale Rede von Doris Sayn von Wittgenstein,22,2017-12-02T17:50:31.000Z,4976,96,18,29,False
GartengemÃ¼sekiosk,17,17.20.11,Garten im November ğŸ¥• Selbstversorgung im Winter mit WurzelgemÃ¼se â„ï¸ Adventskalender DIY,26,2017-11-19T07:00:01.000Z,4357,415,5,105,False
Die Selbstversorger Familie,17,17.05.12,Ziegenstall bauen: Designerpforte und Krippe aus SperrmÃ¼ll,22,2017-12-04T12:16:01.000Z,3344,322,7,187,False
Simplicissimus,17,17.14.11,"Was passiert, wenn man Kommentaren einen Daumen nach unten gibt?",24,2017-11-12T17:29:21.000Z,57829,7028,185,467,False
Ğ£Ñ€Ğ°Ğ»ÑŒÑĞºĞ¸Ğµ ĞŸĞµĞ»ÑŒĞ¼ĞµĞ½Ğ¸,17,17.26.12,Ğ¢Ğ¾Ğ¿ 10 Ğ²Ğ¸Ğ´ĞµĞ¾ 2017 Ğ³Ğ¾Ğ´Ğ° - Ğ£Ñ€Ğ°Ğ»ÑŒÑĞºĞ¸Ğµ ĞŸĞµĞ»ÑŒĞ¼ĞµĞ½Ğ¸,23,2017-12-25T15:32:31.000Z,109429,2013,140,170,False
Ed Sheeran,17,17.14.11,Ed Sheeran - Perfect (Official Music Video),10,2017-11-09T11:04:14.000Z,33523622,1634127,21082,85067,False
Kevin Wolter,17,18.03.04,Ich habe mich infiziert!,17,2018-04-02T17:49:42.000Z,55837,2564,90,273,False
Martin Guerrero - WWE News,17,17.14.11,"Austin Aries spricht Ã¼ber WWE Abgang, Paige Comeback & wieder Single | WWE NEWS 81/2017",24,2017-11-13T17:00:03.000Z,17306,1263,27,182,False
PTXofficial,17,17.28.11,[OFFICIAL VIDEO] Deck The Halls - Pentatonix,10,2017-11-27T15:00:54.000Z,849365,63175,1465,7191,False
Hartmut Conrad,17,17.18.11,Griechenland-Reise  Peloponnes Teil 4,19,2017-11-17T10:00:03.000Z,3923,613,6,16,False
Gong Bao,17,17.24.12,Ehrliche Weihnachten | Gong Bao,24,2017-12-23T17:17:32.000Z,30592,4688,12,268,False
Sierra Kidd,17,17.21.11,Sierra Kidd - Rest In Peace Tour in KÃ¶ln #01,24,2017-11-20T17:00:07.000Z,9871,1098,11,122,False
HeyMoritz,17,17.03.12,So wird EIS in der EISDIELE gemacht! (Geheimnis gefilmt!) -DailyVlog 99,24,2017-12-01T20:46:31.000Z,41660,3305,84,960,False
AresPromo,17,17.11.12,The Walking Dead 8x08 Ending Scene Carl was bitten Season 8 Episode 8 HD How It's Gotta Be,24,2017-12-11T03:40:15.000Z,90508,0,0,1136,False
Ğ‘Ğ¸Ñ‚Ğ²Ğ° ĞµĞºÑÑ‚Ñ€Ğ°ÑĞµĞ½ÑÑ–Ğ²,17,17.05.12,Ğ‘Ğ¸Ñ‚Ğ²Ğ° ÑĞºÑÑ‚Ñ€Ğ°ÑĞµĞ½ÑĞ¾Ğ². Ğ¡ĞµĞ·Ğ¾Ğ½ 17. Ğ’Ñ‹Ğ¿ÑƒÑĞº 10 Ğ¾Ñ‚ 03.12.2017,24,2017-12-03T22:53:25.000Z,68708,383,132,254,False
shafie ayar,17,17.02.12,392 - shafie ayar Muhaqiq,22,2017-12-01T16:39:50.000Z,22822,706,71,311,False
Universal Pictures,17,17.09.12,Jurassic World: Fallen Kingdom - Official Trailer [HD],24,2017-12-08T01:44:25.000Z,18184886,399206,17473,58902,False
LOL Network,17,18.10.02,Kevin Hart on Blake Griffin Not Playing for OKC | Cold as Balls | Laugh Out Loud Network,23,2018-02-09T15:30:01.000Z,2751847,46082,965,2695,False
Selena,17,17.01.12,"Selena, Leyla'ya verdiÄŸi sihir'i geri alÄ±yor",24,2017-11-30T13:30:00.000Z,136574,942,80,126,False
Carsten Zeck,17,17.22.11,Temperatursturz - Welsansitz im Herbst | www.zeck-fishing.com,17,2017-11-21T11:37:19.000Z,4080,198,7,61,False
KÃ¶ln 50667 - DerRndm,17,17.19.11,Elli leiht sich Geld von Lina.. ğŸ’°ğŸ˜² | KÃ¶ln 50667,27,2017-11-18T12:38:53.000Z,12622,94,78,16,False
MircoAufAchse - Truck TV Amerika,17,17.15.11,Ausladen in Winnipeg - Truck TV Amerika #111,22,2017-11-14T17:00:00.000Z,2539,598,5,85,False
ĞŸĞ¾Ğ»Ğ¸Ñ‚Ğ¸ĞºĞ° ÑĞµĞ³Ğ¾Ğ´Ğ½Ñ: Ğ Ğ¾ÑÑĞ¸Ñ Ğ¡Ğ¨Ğ Ğ£ĞºÑ€Ğ°Ğ¸Ğ½Ğ°,17,17.26.12,Ğ—Ğ° Ğ“Ñ€ÑƒĞ´Ğ¸Ğ½Ğ¸Ğ½Ğ° ÑÑ‚Ğ°Ğ½Ğ¾Ğ²Ğ¸Ñ‚ÑÑ Ğ¡Ğ¢Ğ ĞĞ¨ĞĞ! Ğ”Ğ¾Ñ€Ğ¾Ğ³Ğ¸Ğµ Ğ”Ğ Ğ£Ğ—Ğ¬Ğ¯ ĞŸÑƒÑ‚Ğ¸Ğ½Ğ° Ğ´Ğ¾Ğ»Ğ¶Ğ½Ñ‹ Ğ¿Ğ¾Ğ´ĞµÑˆĞµĞ²ĞµÑ‚ÑŒ! Ğ¡Ğ˜Ğ›Ğ¬ĞĞĞ• Ğ¸Ğ½Ñ‚ĞµÑ€Ğ²ÑŒÑ!,25,2017-12-25T17:12:32.000Z,150556,3538,470,2276,False
Ramadan Al Aoula TV,17,18.21.05,Ø³ÙˆØ­Ù„ÙŠÙØ© - Souhlifa - Ep 3,24,2018-05-20T00:14:05.000Z,1339920,0,0,989,False
Nickelodeon Deutschland,17,17.20.11,Die Thundermans â€“ schneller als der Blitz,24,2017-11-19T10:30:00.000Z,9938,274,7,9,False
Ô±Õ¦Õ¡Õ¿Õ¸Ö‚Õ©ÕµÕ¸Ö‚Õ¶,16,18.17.04,Ô¼Ô±ÕÕÔ±Ô¾ Ô»ÕÔ±ÕÔ»ÕƒÔ±Ô¿ Õ”Ô±Õ‚Ô±Õ”Ô» ÕÔ±ÕÔ²ÔµÕ Õ€Ô±ÕÕÔ±Ô¾Õ†ÔµÕÕˆÕ’Õ„,25,2018-04-16T00:52:08.000Z,1097109,8535,1108,1,False
SID,16,17.27.11,Watzke zur BVB-Krise: MÃ¼ssen alles auf den PrÃ¼fstand stellen,17,2017-11-26T17:19:31.000Z,2588,13,6,3,False
Der Selbstversorgerkanal,16,17.15.12,Ab in den Knast ? Anzeige gegen den Selbstversorgerkanal.,22,2017-12-13T07:34:46.000Z,33333,3635,90,469,False
TMZ,16,18.04.01,Danielle Bregoli Rejects Logan Paul's Apologies Over Suicide/Hanging Video | TMZ,24,2018-01-03T16:00:04.000Z,1300016,35263,8263,12362,False
Doug DeMuro,16,17.28.11,"The Spyker C8 Is the Quirkiest $250,000 Exotic Car in History",2,2017-11-27T17:00:48.000Z,705169,21050,532,5784,False
Jetimat e Ballkanit,16,18.01.04,Halil Kastrati - Biri Im (Official Video) | JETIMAT E BALLKANIT,22,2018-03-31T17:00:01.000Z,65185,2737,11,201,False
SatChitAnandaORG,16,18.12.01,Tagesenergie Spezial mit alexanders Antwort zur eigentlich 111.,29,2018-01-11T13:48:57.000Z,23126,476,336,0,True
Thompson`s Studio,16,18.14.04,Die Drei Fragezeichen - Der unsichtbare Gegner Folge 38 HÃ¶rspiel,24,2018-04-12T22:40:31.000Z,11354,101,9,19,False
Logan Paul Vlogs,16,17.14.11,THE LOGANG MADE HISTORY. LOL. AGAIN.,24,2017-11-12T20:19:24.000Z,4477587,292837,4123,36391,False
Guardian News,16,17.28.11,Meghan Markle and Prince Harryâ€™s first TV interview in full,25,2017-11-27T18:44:27.000Z,472470,1807,140,983,False
Das Supertalent,16,17.16.11,Das Supertalent 2017 | Folge 10 am 18.11.2017 bei RTL und online bei TV NOW,24,2017-11-15T12:24:03.000Z,11129,274,13,17,False
Tasty,16,18.02.02,Homemade Vs. Restaurant Pizza,26,2018-02-01T17:00:26.000Z,304573,8842,317,560,False
NickiTV,16,17.30.11,GroÃŸer Hund hilft kleinem KÃ¤tzchen/Big dog help little kitten,2,2017-11-28T16:13:52.000Z,12862,120,6,5,False
Gibi ASMR,16,17.30.12,Gibi ASMR Official Store! [Whispered Announcement],24,2017-12-29T22:44:33.000Z,85139,6521,125,1192,False
Ohrinsel,16,18.19.01,Das musste jetzt einfach mal gesagt werden ;-),24,2018-01-18T18:29:43.000Z,2567,406,6,65,False
ChainsmokersVEVO,16,18.18.01,The Chainsmokers - Sick Boy,10,2018-01-17T15:00:02.000Z,1448694,135017,4843,12116,False
ExplosmEntertainment,16,17.15.11,Shower - Cyanide & Happiness Minis,23,2017-11-14T18:30:00.000Z,680801,36910,938,1510,False
Lia & Alfi,16,17.15.11,Lia & Alfi - Jump and Run mit Mama + E-Stil,15,2017-11-14T13:00:02.000Z,43410,3426,41,192,False
GoldRain,16,17.19.12,KÃ¶ln 50667 - Schrotti & Elli holen sich BenÂ´s Geld von Aydin,24,2017-12-18T18:15:49.000Z,43949,328,9,9,False
OUTERLIMITS-LYKOS TEAM HELLAS,16,18.04.05,Î¤Î¿ Ï„Î­Î»Î¿Ï‚ Ï„Î·Ï‚ 54Î·Ï‚ Î¼Î­ÏÎ±Ï‚ ÏƒÏ„Î¿ Power Of Love 3/5/18,24,2018-05-03T14:41:08.000Z,122784,379,65,159,False
Cut,16,17.15.11,People Guess Who is White In a Group of People - Lineup,24,2017-11-14T13:00:00.000Z,459497,14281,1860,3764,False
herman-unterwegs.de,16,18.05.01,Von der Algarve ins portugisische Hinterland - Wir erkunden die erste Piste,2,2018-01-04T16:16:14.000Z,4307,278,10,69,False
Team RING POLICE,16,18.27.01,Das UFO ist da!,2,2018-01-26T11:00:03.000Z,95721,4096,46,266,False
Shpendiboy,16,17.03.12,"EINE FRAGE KEINE ANTWORT | MIT KSFREAK,INSCOPE,SASCHA,KRAPPI & PETER  | Crewzember",24,2017-12-02T17:00:07.000Z,77095,6756,268,155,False
ĞŸÑƒÑÑ‚ÑŒ Ğ³Ğ¾Ğ²Ğ¾Ñ€ÑÑ‚,16,17.01.12,ĞŸÑƒÑÑ‚ÑŒ Ğ³Ğ¾Ğ²Ğ¾Ñ€ÑÑ‚ - Ğ Ğ°Ğ·Ğ²Ğ¾Ğ´ Ğ³Ğ¾Ğ´Ğ°: Ğ’Ğ¸Ñ‚Ğ°Ğ»Ğ¸Ğ½Ğ° Ğ±ĞµÑ€ĞµĞ¼ĞµĞ½Ğ½Ğ°? Ğ’Ñ‹Ğ¿ÑƒÑĞº Ğ¾Ñ‚Â 29.11.2017,43,2017-11-30T07:07:21.000Z,83773,257,287,651,False
SAB TV,16,18.10.05,"Taarak Mehta Ka Ooltah Chashmah - Ep 2461 - Full Episode - 7th May, 2018",24,2018-05-09T13:37:28.000Z,91526,1224,82,209,False
Coin Trend,16,17.20.12,â›ˆ15801$ Bitcoin Sturz & Bitcoin CashğŸ˜± Explosion + Dash & EOS,26,2017-12-20T03:20:46.000Z,1081,48,5,18,False
VERRÃœCKTEN LAB,16,17.15.12,"Die 10 GrÃ¶ÃŸten und Tiefsten LÃ¶cher, die je von Menschen Gegraben Wurden",22,2017-12-14T13:25:02.000Z,4010,77,5,9,False
Game Two,16,17.10.12,HeiÃŸ oder ScheiÃŸ: Berufs-Simulatoren auf dem PrÃ¼fstand | Game Two #50,20,2017-12-09T11:00:00.000Z,72268,4273,147,441,False
Hypnotize Entertainment,16,18.04.02,DARDAN X LUCIANO - AIRMAX GEGEN KOPF (prod. by Leryk Prod.),10,2018-02-03T14:00:05.000Z,295232,33767,1072,1693,False
Anja Mertens,16,17.23.11,Mein Traum wird wahr! Solido & ich beim FILM,15,2017-11-22T16:57:37.000Z,24015,1788,15,128,False
Vinist News,16,17.14.11,Michael Schumacher: Dramatisches Statement von seiner Frau!,24,2017-11-12T18:25:53.000Z,18681,29,420,21,False
WiadomoÅ›ci ze Åšwiata,16,17.18.11,Teleexpress (17:00) TVP 17.11.2017,25,2017-11-17T16:18:50.000Z,15255,105,12,7,False
Inaa 144,16,17.07.12,Berlin Tag und Nacht - VORSCHAU fÃ¼r 7.12.2017,22,2017-12-06T19:05:37.000Z,2114,14,0,0,False
Deko Kitchen â€“ SchÃ¶ne Deko selber machen | Esther Straub,16,17.18.11,DIY: hÃ¼bsche Weihnachtsdeko mit Sterneneffekt [How to] Deko Kitchen,26,2017-11-17T16:30:03.000Z,11444,584,18,18,False
The Isi Life,16,17.20.11,"Baby Update - 6. + 7. Monat - Chaos, Durchschlafen?, Zahnen",22,2017-11-19T11:00:04.000Z,11794,371,19,90,False
Swar Shuaib,16,18.04.02,#Ø³ÙˆØ§Ø±_Ø´Ø¹ÙŠØ¨ | Ù‡Ù„ Ø§Ù„Ù…Ø§Ø¶ÙŠ Ø¬Ù…ÙŠÙ„ØŸ,24,2018-02-03T17:30:20.000Z,664835,67294,5655,7020,False
The King of Random,16,17.08.12,What Does Cake Batter Do In A Vacuum Chamber?,27,2017-12-07T15:00:00.000Z,538214,12085,914,4689,False
ATA Media,16,18.09.01,New Eritrean Drama 2018 Kampala (áŠ«áˆá“áˆ‹) Episode 1-  ATA Media,10,2018-01-08T17:32:36.000Z,77833,3849,115,477,False
BUNTE TV,16,18.20.04,Ex-GNTM-Finalistin - Ist das noch gesund? Bei diesem Magerfoto sorgen sich die Fans,24,2018-04-16T15:35:56.000Z,14673,51,13,8,False
GLOBAL UNDERGROUND NEWS,15,17.21.11,Jamaika geplatzt: Wie geht es weiter? mit Oliver Janich im GesprÃ¤ch,22,2017-11-20T18:19:11.000Z,5019,193,27,80,False
EinfachPeter,15,17.02.12,CREWZEMBER GEHT LOS | crewzember,24,2017-12-01T17:00:09.000Z,28435,3619,42,133,False
Shabake Khanda,15,17.10.12,Ø´Ø¨Ú©Ù‡ Ø®Ù†Ø¯Ù‡ - ÙØµÙ„ Ø³ÙˆÙ… - Ù‚Ø³Ù…Øª Ú†Ù‡Ù„ Ùˆ Ù†Ù‡Ù… / Shabake Khanda - Season 3 - Episode 49,22,2017-12-08T16:25:50.000Z,71928,944,23,300,False
Wissensmanufaktur,15,17.19.12,"Eva Herman: Glyphosat und die Menschheit, ein ungleicher Kampf",25,2017-12-18T12:06:08.000Z,8003,715,9,96,False
HowToBasic,15,17.18.11,How To Make a Breakfast Pizza,26,2017-11-17T17:59:03.000Z,574332,49587,1913,5298,False
Adventure Buddy,15,17.26.11,LOST PLACES | ALARM AUSGELÃ–ST | Die MÃ¶belfabrik im MILLIONEN WERT,24,2017-11-25T08:00:02.000Z,49364,1518,472,439,False
Station B1,15,18.21.03,Warum schlÃ¤gt sie ihre Bettnachbarin? | Station B1 - KinderÃ¤rzte mit Herz,22,2018-03-07T14:00:05.000Z,10871,198,8,17,False
Eurosport,15,18.29.01,Roger Federer v Marin ÄŒiliÄ‡ Highlights | Australian Open 2018 Final | Eurosport,17,2018-01-28T14:23:57.000Z,32085,208,11,48,False
Premium Sintesi,15,17.24.12,Real Madrid vs Barcelona 0-3 - All Goals & Highlights - 23/12/2017 HD,17,2017-12-23T13:56:33.000Z,3826984,42076,2595,3657,False
Eunique,15,18.02.01,Becoming Eunique â–º REALITY SHOW TRAILER â—„ [ Ab dem 14.01.2018 - jeden Sonntag ],10,2018-01-01T14:59:34.000Z,29103,2385,27,139,False
Der Keller,15,17.18.11,FIFA 18 | F8TAL ICON RONALDINHO #01 - Er stiehlt RONALDINHO die Show ğŸ˜±,20,2017-11-17T13:00:05.000Z,84276,11341,47,7128,False
Hamburger Morgenpost,15,17.19.12,Neue Polizei-Videos verÃ¶ffentlicht: So heftig war der G20-Gipfel in Hamburg wirklich,24,2017-12-18T17:14:05.000Z,10099,15,4,0,True
Junge Freiheit Verlag,15,17.15.11,Ein Blick in die neue AfD-Fraktion - Christian Vollradt trifft Alice Weidel,25,2017-11-13T10:06:08.000Z,32534,899,110,373,False
Yemekteyiz,15,17.23.11,Yemekteyiz 58. BÃ¶lÃ¼m - CanlÄ± YayÄ±nÄ±,24,2017-11-22T13:04:40.000Z,30008,90,30,53,False
Cute Life Hacks DE,15,17.24.12,10 BESTEN SCHLEIM REZEPTE!!! ğŸ˜± Eisberg Slime! Perlenslime! Durchsichtiger Slime! Slime Ohne Kleber!,26,2017-12-23T09:30:03.000Z,83689,4684,179,793,False
justintimberlakeVEVO,15,18.03.01,Justin Timberlake - INTRODUCING MAN OF THE WOODS,10,2018-01-02T15:00:04.000Z,725305,21236,1053,2861,False
Sizzle Brothers,15,17.09.12,Hands ON: Napoleon Kugelgrill vs.  Weber Kugelgrill,22,2017-12-08T11:00:05.000Z,5400,211,10,79,False
MrMatador,15,18.12.01,Barcelona vs Celta Vigo 5-0 -Â All Goals & Highlights â—Â 11/01/2018 HD (First Half),17,2018-01-11T21:18:01.000Z,484639,5777,442,552,False
Zeo,15,17.21.11,Gott wÃ¼rfelt nicht nur einmal - Teaser,24,2017-11-20T17:00:00.000Z,43649,10507,41,2277,False
CookBakery,15,17.20.11,KÃ¤sekuchen mit Mandarinen - Faule Weiber Kuchen / Quarkkuchen,22,2017-11-19T09:00:00.000Z,10760,729,16,33,False
Kafalar,15,17.02.12,EZGÄ° MOLA'NIN KÃ–LESÄ° OLMAK ( KRAL & VEZÄ°R ),24,2017-12-01T15:00:04.000Z,788821,64144,2230,3717,False
Mission Money,15,18.04.01,Florian Homm im Interview: Darum droht der schlimmste Crash aller Zeiten! // Mission Money,27,2018-01-03T09:43:15.000Z,9235,287,25,141,False
DoktorFroid,15,17.22.11,Das beste XBox One X Event mit den besten Boiiiis! [#Werbung],20,2017-11-20T15:00:02.000Z,29517,2267,125,266,False
KINOFABRIKA,15,17.25.11,"Ğ¡ĞµĞºÑ€ĞµÑ‚ Ğ½ĞµĞ¿Ñ€Ğ¸ÑÑ‚ÑƒĞ¿Ğ½Ğ¾Ğ¹ ĞºÑ€Ğ°ÑĞ°Ğ²Ğ¸Ñ†Ñ‹ (2017). 2 ÑĞµÑ€Ğ¸Ñ. ĞœĞµĞ»Ğ¾Ğ´Ñ€Ğ°Ğ¼Ğ°, Ğ½Ğ¾Ğ²Ğ¸Ğ½ĞºĞ°.",1,2017-11-24T15:57:39.000Z,64188,0,0,34,False
DIEN QUAN Comedy / HÃ i,15,17.23.11,"ThÃ¡ch thá»©c danh hÃ i 4 | táº­p 1 full: Tráº¥n ThÃ nh, TrÆ°á»ng Giang cÆ°á»i rung gháº¿ vá»›i anh xe Ã´m cá»±c cháº¥t",24,2017-11-22T14:36:46.000Z,1097806,7771,674,2740,False
Ğ Ğ¾ÑÑĞ¸Ñ 1,15,17.19.12,ĞœĞ¾Ğ»Ğ¾Ğ´Ğ¾Ğ¹ Ğ»ÑĞ±Ğ¾Ğ²Ğ½Ğ¸Ğº Ğ²Ğ´Ğ¾Ğ²Ñ‹ ĞŸĞµÑ‚Ñ€ĞµĞ½ĞºĞ¾ Ğ¾Ğ±ÑŠÑĞ²Ğ¸Ğ» ÑĞµĞ±Ñ Ğ¾Ñ‚Ñ†Ğ¾Ğ¼ Ğ´Ğ¾Ñ‡ĞµÑ€Ğ¸ Ğ°Ñ€Ñ‚Ğ¸ÑÑ‚Ğ°. ĞœĞ°Ğ»Ğ°Ñ…Ğ¾Ğ². ĞŸÑ€ÑĞ¼Ğ¾Ğ¹ ÑÑ„Ğ¸Ñ€ 18.12.17,24,2017-12-18T14:56:37.000Z,112437,311,151,479,False
Hayatta Her Åey Var,15,17.14.11,Hayattta Her Åey Var 13 KasÄ±m 2017,22,2017-11-13T12:12:31.000Z,41376,809,64,73,False
Sascha LKW FahrnÃ¼nftig,15,17.26.11,Sascha auf LKW-Tour #214 (Vom Standstreifenraser und ErlkÃ¶nigbus),2,2017-11-25T07:41:17.000Z,31146,2007,38,229,False
Digster OnFleek,15,17.09.12,Seit Eminem berÃ¼hmt ist... | KURZBIOGRAPHIE (2) | Der Biograph,24,2017-12-08T12:00:04.000Z,27485,1808,17,137,False
Beyaz Show,15,17.21.11,Beyaz Show- ÃœÃ§ gÃ¼n otel odasÄ± temizleyen Ã¼nlÃ¼ kim?,23,2017-11-20T10:30:01.000Z,284348,2097,81,201,False
SPOX,15,17.15.11,Grazie Gigi! Buffon verkÃ¼ndet unter TrÃ¤nen seinen RÃ¼cktritt | Italien - Schweden | Interview | DAZN,17,2017-11-13T23:09:02.000Z,107238,1926,55,437,False
Zain Jordan,15,18.18.05,ÙˆØ·Ù† Ø¹ ÙˆØªØ± | Ø§Ù„Ø­Ù„Ù‚Ø© Ø§Ù„Ø£ÙˆÙ„Ù‰: Ø§Ù„Ø¹Ø§Ø¯Ø§Øª,17,2018-05-17T17:00:03.000Z,231326,6766,217,734,False
Ochii din umbra,15,17.15.11,"Ochii din umbra (12.11.2017) -Parintii uitati de copii! O poveste socanta! Sez 15, Ep 12, Partea III",22,2017-11-14T14:28:06.000Z,42019,191,24,34,False
GoalKEEPERz,15,17.14.11,FuÃŸballchallenge GEGEN MEINE FREUNDIN (+Arschbolzen),17,2017-11-12T12:00:06.000Z,167162,15451,423,617,False
Witz vom Olli,15,17.17.11,GlÃ¼cklich verheiratet - 92/17,24,2017-11-16T06:51:42.000Z,29072,565,35,26,False
Shayan Garcia,15,17.28.11,AAR Vlog Frankfurt | Capo | Shayan Garcia,23,2017-11-27T15:28:58.000Z,25707,2048,17,130,False
SpongeBOZZ,15,18.07.04,Sun Diego - Eloah prod. by Digital Drama,24,2018-04-06T16:56:41.000Z,348291,54176,2165,10336,False
Soy Lunita,15,17.15.11,Soy Luna 2 - Luna will das Matteo sie in Ruhe lÃ¤sst (Folge 57),1,2017-11-14T19:22:11.000Z,2164,79,0,4,False
DIEN QUAN Entertainment / Giáº£i TrÃ­,15,17.19.11,"Giá»ng áº£i giá»ng ai 2 | táº­p 7 full: Thu Thá»§y, Æ¯ng HoÃ ng PhÃºc thá»a thuáº­n ngáº§m lÃ m Tráº¥n ThÃ nh tÃ¡ há»a",24,2017-11-18T13:15:13.000Z,1828173,9404,1030,3444,False
TV Strassensound,15,17.23.11,FLER FLIZZY INTERVIEW mit JALIL & REMOE gefÃ¼hrt von Davud - TV Strassensound,24,2017-11-22T16:33:50.000Z,95019,3274,120,824,False
Its Lion,15,17.12.12,WIE VIEL IST DEIN OUTFIT WERT ?ğŸ”¥ RICH EDITION ğŸ’¸ğŸ’° | STREET UMFRAGE | Its Lion,24,2017-12-10T14:00:02.000Z,28604,715,57,109,False
Kalp AtÄ±ÅŸÄ±,15,17.19.11,Kalp AtÄ±ÅŸÄ± 20. BÃ¶lÃ¼m - Tek ParÃ§a - Full BÃ¶lÃ¼m,1,2017-11-18T08:35:53.000Z,437143,6510,326,904,False
- æ¬¢è¿è®¢é˜… -æµ™æ±Ÿå«è§†ã€å¥”è·‘å§ã€‘å®˜æ–¹é¢‘é“,15,18.15.04,ã€EP.1ã€‘è·‘ç”·å›¢çƒ­è¡€å›å½’ ç«Ÿåœ¨ç»´ä¹Ÿçº³é­é‡â€œå²ä¸Šæœ€éš¾æŒ‘æˆ˜â€ é¹¿æ™—å½¢è±¡åå¡Œè¢«å“ä¸¢é­‚ å­¦éœ¸é‚“è¶…å¤§é£šè‹±è¯­æƒŠçˆ†è”åˆå›½ ã€Šå¥”è·‘å§2ã€‹ 20180413 Keep Running S2 [ æµ™æ±Ÿå«è§†å®˜æ–¹HD ],24,2018-04-13T16:48:40.000Z,939331,10198,1678,3788,False
1TV Kabul ØªÙ„ÙˆÛŒØ²ÛŒÙˆÙ† ÛŒÚ©,15,18.01.01,Hashye Khabar.30.12.2017 Ø­Ø§Ø´ÛŒÙ‡ Ø®Ø¨Ø±: Ø¢ÛŒØ§ Ø¹Ø·Ø§Ù…Ø­Ù…Ø¯ Ù†ÙˆØ± Ø§Ø² Ø¨Ù„Ø® Ú©Ù†Ø§Ø± Ù…ÛŒâ€ŒØ±ÙˆØ¯ØŸ,25,2017-12-31T04:46:43.000Z,22430,183,22,45,False
FaxxenTV,15,18.01.01,1 TAG LANG KING mit DIENER |  FaxxenTV,24,2017-12-31T11:00:44.000Z,83313,7781,259,469,False
Kitchen Nightmares,15,17.19.11,Gordon is Served â€œThe Weirdest Pizza Iâ€™ve Ever Seen!â€ | Kitchen Nightmares,24,2017-11-18T17:00:00.000Z,794755,13428,258,1859,False
ibighit,15,17.17.11,BTS (ë°©íƒ„ì†Œë…„ë‹¨) 'MIC Drop (Steve Aoki Remix)' Official Teaser,10,2017-11-16T15:00:05.000Z,3483755,789761,2840,72376,False
Interesting Facts DE,15,17.15.11,Die 10 Besten Polizeiautos der Welt,22,2017-11-14T14:22:23.000Z,4378,87,18,14,False
BBC Radio 1,15,17.14.12,Ed Sheeran & Anne-Marie - Fairytale Of New York in the Live Lounge,10,2017-12-12T16:30:33.000Z,680524,20144,1350,1307,False
GEazyMusicVEVO,15,17.02.12,G-Eazy & Halsey - Him & I (Official Video),10,2017-12-01T16:15:00.000Z,1554273,146688,1600,7305,False
HeartBeat,15,18.07.03,Gute Nacht GruÃŸ fÃ¼r dich. Gute Nacht und schlaf schÃ¶n ;o),24,2018-03-06T16:30:01.000Z,4380,116,9,42,False
Love Island Australia,15,18.30.05,'I want to kiss you so bad'Â | Love Island Australia 2018,24,2018-05-29T11:41:21.000Z,302960,1605,79,0,True
Instrumental Music Romantic,15,17.30.11,Most Popular Violin Covers of Popular Songs 2018 || Best Instrumental Violin Covers 2018,22,2017-11-28T16:00:05.000Z,238257,418,99,15,False
WIRED,15,17.22.11,Stranger Things Cast Answer the Web's Most Searched Questions | WIRED,24,2017-11-21T17:00:22.000Z,5670852,262505,3453,16321,False
chess24,14,18.11.03,Round 1 - 2018 FIDE Berlin Candidates - Live Commentary,20,2018-03-10T21:23:41.000Z,192018,793,313,21,False
MalumaVEVO,14,17.09.12,Maluma - CorazÃ³n (Official Video) ft. Nego do Borel,10,2017-12-08T11:00:01.000Z,3675189,282259,9635,18966,False
Tommys lehrreiche Lehrfilme,14,17.19.11,Strikes / Reuploads / Backup-Kanal - Infovideo,28,2017-11-17T17:17:29.000Z,41848,3831,17,185,False
ĞšÑ€Ğ°ÑĞ½Ñ‹Ğ¹ ĞºĞ²Ğ°Ğ´Ñ€Ğ°Ñ‚,14,17.08.12,Ğ”Ğ°Ğ²Ğ°Ğ¹ Ğ¿Ğ¾Ğ¶ĞµĞ½Ğ¸Ğ¼ÑÑ! ĞœĞ¾Ğ»Ğ¾Ğ´Ğ¾Ğ¹ Ğ²Ğ´Ğ¾Ğ²ĞµÑ†. Ğ’Ñ‹Ğ¿ÑƒÑĞº Ğ¾Ñ‚ 07.12.2017,24,2017-12-07T13:38:00.000Z,35050,121,33,92,False
ICH FIND SCHLAGER TOLL!,14,18.14.01,KLUBBB3 - Ein Tattoo fÃ¼r die Ewigkeit,10,2018-01-13T21:00:03.000Z,11164,687,21,35,False
Polsat,14,17.28.11,XXII Rybnicka JesieÅ„ Kabaretowa - Kabaret Czesuaf,24,2017-11-27T19:08:20.000Z,56518,283,45,8,False
KiKA von ARD und ZDF,14,18.02.03,Schloss Einstein - 901. Folge | Mehr auf KiKA.de,24,2018-03-01T14:30:00.000Z,19992,368,8,30,False
Cinema Strikes Back,14,18.21.01,Das ist CINEMA STRIKES BACK!,1,2018-01-20T09:00:00.000Z,54196,5593,47,874,False
ARTEde,14,18.19.03,Japan: Tod durch zuviel Arbeit - ARTE Reportage,25,2018-03-16T14:30:36.000Z,16245,140,8,63,False
LeFloid,14,18.14.01,Ist dieser Pullover rassistisch?...und der vielleicht dÃ¼mmste Zeitungsartikel ever...,24,2018-01-10T18:00:11.000Z,554120,53550,1306,8738,False
KendrickLamarVEVO,14,17.23.12,Kendrick Lamar - LOVE. ft. Zacari,10,2017-12-22T05:00:05.000Z,4410367,358569,4900,26089,False
Sony Pictures Entertainment,14,18.06.01,SLENDER MAN - Official Trailer (HD),24,2018-01-03T16:00:17.000Z,4290425,77143,19170,26472,False
DieLochis,14,17.21.12,Wenn Ich Du WÃ¤re... (mit Hammer bedroht!) - aufm Weihnachtsmarkt I Die Lochis,24,2017-12-20T15:03:17.000Z,49799,6995,112,708,False
Marques Brownlee,14,17.17.11,Top 5 OnePlus 5T Features!,28,2017-11-16T17:36:14.000Z,1117997,50950,760,5525,False
DRN Deutsch-Rap-News,14,18.31.03,Nach Bushido-Eklat | ARAFAT von diesen Mann ERSETZT?! | A. Rammo | Remmo-Clan,24,2018-03-30T16:25:21.000Z,67068,362,138,237,False
Netzkino,14,17.03.12,"Golden Winter 2 (Weihnachtsfilme Deutsch ganzer Film, ganze Filme, Weihnachtsfilm komplett) *HD*",1,2017-12-02T19:00:01.000Z,3985,118,5,26,False
Bosshaft TV,14,17.20.11,Kollegah & Farid Bang âœ–ï¸ DIE SHERIFFS VOM BIERKÃ–NIG âœ–ï¸,24,2017-11-19T20:04:37.000Z,196879,13111,233,1136,False
unge,14,18.04.03,In dieses Land werde ich AUSWANDERN!  | unge,24,2018-03-03T14:42:15.000Z,88951,4640,894,1940,False
Malwanne,14,17.03.12,Wie schmeckt der Butterkuchen aus Bibi und Tina?,24,2017-12-02T10:00:05.000Z,171984,15691,264,1013,False
marktcheck,14,17.30.11,Marktcheck checkt ALDI - die XXL-Version,26,2017-11-28T19:30:01.000Z,16388,306,26,84,False
Domics,14,17.24.11,Neighbours [Part 1],23,2017-11-23T21:24:45.000Z,748262,66081,394,5531,False
PAYY TV,14,17.08.12,PAYY FEAT. NATE57 & REMOE - NUR BARGELD [ OFFICIAL VIDEO ] (Prod. by Remoe),10,2017-12-07T17:00:07.000Z,100904,8005,207,591,False
Erichsen,14,17.21.12,Diese AKTIEN im Januar kaufen?,27,2017-12-20T17:00:06.000Z,3209,125,9,16,False
Knallerkerle,14,18.22.01,DÃ¼ngen fÃ¼r Profis | Knallerkerle | SAT.1 TV,23,2018-01-21T15:30:02.000Z,4365,194,2,7,False
Leo Kast,14,18.08.02,MTB Cross Country Tour auf Lanzarote | Green Team Guide Mathias Rosenberg | Bikeurlaub | UMLK #70,17,2018-02-07T05:30:01.000Z,10985,571,11,93,False
Dr. Hamed Esnaashari,14,17.15.12,"News und Prognosen: Ethereum, Ripple, Bitcoin, Bitcoin Cash, IOTA",25,2017-12-14T13:57:37.000Z,4309,171,5,20,False
thisisnoizy,14,17.23.11,Noizy ft Ledri - Dje & Sot,24,2017-11-22T10:51:26.000Z,964571,35051,2362,2690,False
maudado,14,17.27.11,Schneckchen Alarm ã€ŒFast Daily Vlogã€,20,2017-11-26T17:21:22.000Z,66699,9960,27,803,False
HARDGAINER CREW,14,17.14.11,Bodybuilder bekommen Platzwunden - Paintball Challenge!!,17,2017-11-13T20:10:36.000Z,31500,3122,28,192,False
FaceRig Talking Tom Ginger Angela,14,17.03.12,Dir wÃ¼nsche ich schÃ¶nen 1. Advent Ein WeihnachtsgruÃŸ fÃ¼r Dich Weihnachten Christmas FaceRig deutsch,1,2017-12-01T21:00:00.000Z,75469,500,69,0,False
Comedy Club,14,17.03.12,"ĞšĞ°Ğ¼ĞµĞ´Ğ¸ ĞšĞ»Ğ°Ğ±, 13 ÑĞµĞ·Ğ¾Ğ½, 41 Ğ²Ñ‹Ğ¿ÑƒÑĞº (24.11.2017)",24,2017-12-02T15:59:40.000Z,15148,84,33,6,False
Star Wars Stories | Deutsch,14,17.14.11,Darth Maul's erstes Jedi-Opfer! [Legends],1,2017-11-12T12:00:02.000Z,54598,3861,10,284,False
Primitive Technology,14,17.25.11,Primitive Technology: New area starting from scratch,22,2017-11-24T21:03:09.000Z,1783347,111683,747,12315,False
kicker,14,18.21.01,Die Aubameyang-Debatte,17,2018-01-20T14:37:18.000Z,7729,79,10,14,False
LindenstraÃŸe,14,18.05.02,Ganze Folge 1660 Timos LÃ¼ge vom 04.02. #Lindenstrasse,24,2018-02-04T18:30:00.000Z,4232,56,13,32,False
Vip Nachrichten,14,18.24.05,Prinz Harry und Meghan Markle: Darum war die Queen schlecht gelaunt,25,2018-05-22T19:52:11.000Z,29463,37,219,42,False
ANNAS und PAULAS TIERE,14,17.18.11,Hund | Reportage fÃ¼r Kinder | Anna und die Haustiere,27,2017-11-17T12:47:59.000Z,11393,238,6,35,False
Disneyâ€¢Pixar,14,17.19.11,Incredibles 2 Official Teaser Trailer,1,2017-11-18T15:43:11.000Z,4746854,157937,2072,23205,False
RubbelkÃ¶nig,14,17.26.11,Rubbellos Challenge #4 - KÃ¶nigÂ´s letzte Chance?,24,2017-11-24T15:33:26.000Z,13944,925,19,164,False
Wakez,13,17.14.11,Die nÃ¤chste ICON GEZOGEN ğŸ’ğŸ¤‘ğŸ˜ FIFA 18 Eine weitere ICONE im PACK OPENING BATTLE ğŸ˜± Wakez,20,2017-11-12T09:01:35.000Z,202641,19386,652,836,False
JONAS,13,18.02.01,KANALTRAILER 2018 - JONAS,24,2018-01-01T15:00:05.000Z,123773,17868,161,709,False
ĞÑ„Ğ¸Ñ†Ğ¸Ğ°Ğ»ÑŒĞ½Ñ‹Ğ¹ ĞºĞ°Ğ½Ğ°Ğ» ĞšĞ’Ğ,13,17.14.11,ĞšĞ’Ğ 2017 Ğ’Ñ‹ÑÑˆĞ°Ñ Ğ»Ğ¸Ğ³Ğ° Ğ’Ñ‚Ğ¾Ñ€Ğ°Ñ 1/2 (12.11.2017) Ğ˜Ğ“Ğ Ğ Ğ¦Ğ•Ğ›Ğ˜ĞšĞĞœ Full HD,23,2017-11-12T22:00:03.000Z,442228,3194,5985,3218,False
Behdad TV,13,17.28.12,"BEST Songs 2017 Mashup - New Year Special! (Bausa, Capital Bra - Nana, Post Malone, 187 - MillionÃ¤r)",10,2017-12-27T13:00:00.000Z,58349,5938,202,616,False
Ù†Ø§Ø±ÙŠØ² I NAEIS,13,18.28.03,Ù…Ù„Ø®Øµ Ù…Ø¨Ø§Ø±Ø§Ø© Ø§Ø³Ø¨Ø§Ù†ÙŠØ§ ÙˆØ§Ù„Ø§Ø±Ø¬Ù†ØªÙŠÙ† 6-1 - Ø§ÙŠØ³ÙƒÙˆ ÙŠØ¯Ù…Ø± Ø§Ù„Ø§Ø±Ø¬Ù†ØªÙŠÙ† Ø¨Ù‡Ø§ØªØ±ÙŠÙƒ - Ù…Ø¨Ø§Ø±Ø§Ø© ÙˆØ¯ÙŠØ© Ù†Ø§Ø±ÙŠØ©,22,2018-03-27T21:21:26.000Z,517797,4932,367,666,False
Intro TV,13,17.15.11,WIRD ALEX WIEDER SPIELSÃœCHTIG ? (KÃ–LN 50667) | IntroTV,22,2017-11-13T17:20:00.000Z,39732,224,13,9,False
