channel_title,no_of_vids,trending_date,title,category_id,publish_time,views,likes,dislikes,comment_count,comments_disabled
2MinNews ПОДПИШИСЬ!,5,17.15.11,ХАБИБ ПРОТИВ ТОНИ НА UFC219! ХАБИБ ВЫЙДЕТ НА ЗАМЕНУ КОНОРУ МАКГРЕГОРУ! ОФФИЦИАЛЬНО,17,2017-11-14T18:07:46.000Z,26980,403,99,70,False
Samsung YouTube TV,5,17.23.12,Феликс Бондарев  | RSAC - Держи меня за руку (ft. Шура Кузнецова) | Samsung YouTube TV | (12+),28,2017-12-22T04:33:35.000Z,94267,3968,437,200,False
XATO TV,5,17.20.11,4 ЁШЛИ КИЗНИ Онаси ФОХИШАЛИК Килгани РОСТМИ,22,2017-11-19T14:30:00.000Z,38468,960,100,614,False
QOYIL UZ,5,18.09.01,' Келин Шарманда Бўлди! Кайнотасига Тухмат Килган Экан,1,2018-01-08T05:43:46.000Z,138235,595,465,0,True
Quad Theory,5,18.24.04,"LIVE Serzh Sargsyan RESIGNED! Սերժ Սարգսյանը հրաժարական է տվել. April 23, 2018",25,2018-04-23T17:36:29.000Z,67691,576,41,18,False
Новости спорта 8NewsRu,5,17.29.11,Что на самом деле происходит с «Салаватом»? Хоккейная неделя с Алексеем Шевченко #16,22,2017-11-28T10:48:24.000Z,4099,96,2,7,False
ВОТ ТАК,5,18.19.03,Президентские выборы в России 2018. Специальный выпуск Вот так,25,2018-03-18T19:22:51.000Z,74965,333,286,45,False
Спортивный Новости Спорта,5,18.21.01,Мхитарян попрощался с МЮ. Гвардиола поздравил Санчеса и Арсенал. Коутиньо не получит 7 номер.,17,2018-01-20T09:55:21.000Z,16276,185,13,18,False
iKnow Channel,5,18.01.06,С 1970 года он собирал монеты и спустя 45 лет НЕ ПОВЕРИЛ услышанному,27,2018-05-31T13:15:00.000Z,196762,4220,309,846,False
ЛЕДИ БАГ И СУПЕР-КОТ - Россия,5,17.18.11,Леди Баг и Супер-Кот: Тайны – Вебизод 1 | «Двойная жизнь Маринет» (Канал Disney),1,2017-11-17T22:49:08.000Z,17982,2983,77,0,True
GURYEV TIME,5,18.04.02,МУРАТ ГАССИЕВ vs ЮНИЕР ДОРТИКОС (ОБЗОР БОЯ WBSS)!,17,2018-02-04T00:53:09.000Z,14325,350,42,117,False
Морфик,5,17.16.12,12 КРУТЕЙШИХ ФОКУСОВ! ПОПРОБУЙ НЕ ЗАЛИПНИ ЧЕЛЛЕНДЖ #17,20,2017-12-15T13:01:25.000Z,22025,557,32,63,False
Маш Милаш,5,17.17.11,"ТИМУР РОДРИГЕЗ - про РЭП, ЮРИЯ ДУДЬ и МАРТИРОСЯНА, Comedy Club",22,2017-11-16T18:05:36.000Z,26019,1871,119,126,False
Всероссийский конкурс юных талантов Синяя птица,5,17.20.11,"Ляйсян Золотарева. Народный башкирский эпос «Урал-батыр», башкирская народная песня «Поющий журавл…",24,2017-11-19T15:58:25.000Z,4265,153,2,23,False
Natalie Kisel,5,17.03.12,"DIY ЕДИНОРОГИ: Декор, KAWAII Вещи Своими Руками/Натали Кисель",26,2017-12-02T13:04:43.000Z,79455,8850,199,2262,False
GoodMax,5,17.05.12,ПОПАДИ ПОД ДРОП ЧЕЛЛЕНДЖ vs. ЛАКЕР,22,2017-12-04T15:05:52.000Z,90278,11675,321,541,False
Концептуал ТВ,5,17.30.11,Зачем народ заставляют каяться. Евгений Спицын,25,2017-11-29T16:44:43.000Z,4299,276,7,41,False
Anna Chi DIY,5,18.30.04,ОГРОМНЫЙ IPHONE X СКВИШИ АНТИСТРЕСС | DIY IPHONE X SQUISHY,24,2018-04-29T07:00:16.000Z,423301,21428,615,3325,False
Настоящие Новости,5,18.10.02,Настоящие Новости  Дагестана Сегодня 9 февраля 2018 г,22,2018-02-09T16:00:03.000Z,12358,47,17,11,False
Около Pit_Stop,5,18.03.02,"Ксюмобиль всё, Индиан - развод, мопед под клиента, глушитель тихо смеялся в сторонке",2,2018-02-02T20:23:56.000Z,20040,1279,51,268,False
Евгений Мураев,4,17.17.11,"Евгений Мураев в «Большом вечере» на телеканале NewsOne, 15.11.17",25,2017-11-15T21:36:35.000Z,45090,604,32,210,False
Авто Скрежет 2.0,4,18.03.03,Торопыги и Водятлы 80 уровня! ( часть 80 ) Идиоты за рулем!,22,2018-03-02T07:14:51.000Z,8861,205,17,33,False
MoranDays,4,18.25.01,Moran Day 163 - Голубые Горы (Австралия),19,2018-01-24T17:10:56.000Z,54569,5800,133,564,False
ДРУГОЕ МНЕНИЕ,4,17.23.11,Ксения Собчак Интервью на Эхо Москвы 22 ноября 2017,29,2017-11-22T16:29:03.000Z,6911,103,20,155,False
Матвей Ганапольский,4,18.25.04,"О статусе Фейгина, русских в Латвии и состоянии Telegram / Ganapolsky Feedback / 24.04.18",25,2018-04-24T21:08:24.000Z,11047,666,341,188,False
PrasDniK TV,4,18.01.03,С первым днем весны!  Весенний приветик тебе от меня! Начало весны!,22,2018-02-28T14:29:39.000Z,10885,119,6,50,False
КУРС ДОЛЛАРА / КУРС РУБЛЯ Максим Журавлёв,4,18.21.02,"Курс доллара прогноз Курс Рубля прогноз на 21 февраля, 2018 г. (доллар-рубль, Нефть)",22,2018-02-21T04:00:10.000Z,571,61,5,12,False
Управляемый хаос. Чемпионат мира по футболу 2018,4,18.01.06,Сборная России опять облажалась. Сколько можно?,17,2018-05-31T17:55:01.000Z,38087,2050,57,450,False
Sony Pictures Entertainment,4,18.24.04,VENOM - Official Trailer (HD),24,2018-04-24T03:45:03.000Z,2358881,220631,5949,29526,False
FitStars LIFE,4,18.02.05,Блуд и Вовк перестали ругаться матом?!,22,2018-05-01T16:50:55.000Z,13904,896,15,38,False
ISLAM. TV,4,17.19.12,КТО ИЗ ВАС СЕГОДНЯ ВОШЕЛ В РАЙ?,22,2017-12-19T04:00:01.000Z,1992,200,2,20,False
Мадам Ирма,4,18.27.01,"КОРОЧЕ ГОВОРЯ, МЫ ОСТАЛИСЬ БЕЗ ДЕНЕГ | Мадам Ирма",24,2018-01-26T15:30:15.000Z,13206,1683,41,434,False
Olga Filimonova,4,18.26.01,ЧТО БЫЛО - ЧТО БУДЕТ Таро-гадание про любовь,22,2018-01-25T18:54:22.000Z,7729,711,35,142,False
Скрытый Пул,4,18.12.03,🔥ПАПИЧ КОММЕНТИРУЕТ VP vs VGJ! ХУЛИ ТАК ИЗИ В ФИНАЛЕ?!,20,2018-03-11T20:31:07.000Z,56010,1265,88,115,False
Каха и Серго,4,18.30.05,Каха - Кто здесь массажист?,22,2018-05-29T16:55:22.000Z,26108,1188,19,42,False
Телеканал 1+1,4,18.22.02,За три дні до кохання. 3 серія,1,2018-02-21T20:00:00.000Z,37604,319,59,45,False
Stars Instagram,4,17.16.11,Ольга Бузова Быть Мне с Ромой Гриценко или Нет?,22,2017-11-15T09:41:09.000Z,16285,58,20,26,False
Marshmello,4,18.13.02,Marshmello x Lil Peep - Spotlight (Official Music Video),10,2018-02-12T14:00:00.000Z,1427962,264994,4757,23195,False
MrUnfiny,4,18.12.03,ПОДПИСЧИКИ ПОМОГАЮТ СТРОИТЬ ПОДЗЕМНЫЙ ГОРОД! СТРИМ #3!,20,2018-03-11T21:16:49.000Z,60119,3227,108,31,False
CRISP,4,17.12.12,ШАГАЕТ ПО ВОЗДУХУ / Invisible Box Challenge,22,2017-12-11T15:23:59.000Z,117459,17048,2365,2154,False
Coffi Channel,4,17.03.12,COFFI - JUST A PRANK BRO ( КЛИП НА 3.000.000 ПОДПИСЧИКОВ ),20,2017-12-02T14:59:49.000Z,407491,78775,3456,14623,False
Blogger Money,4,18.12.01,ШУРЫГИНА прокомментировала освобождение Сергея Семёнова | РЕАКЦИЯ ШУРЫГИНОЙ,22,2018-01-10T18:55:34.000Z,300699,1628,5048,363,False
archecave,4,18.04.02,Зюганов и Грудинин. Митинг За социальную справедливость Москва. 03.02.2018,22,2018-02-03T16:08:21.000Z,28958,1488,5309,583,False
Андрей Скутерец,4,18.04.02,ДРОЧЕСКОП #4 делаем мини-байк красивым / сиденье из скейта и покраска рамы,2,2018-02-03T10:28:00.000Z,124295,5288,109,554,False
Не будь инертным | НБИ,4,18.18.02,Воспитательная работа с охраной и Безопасником😀,29,2018-02-17T15:00:35.000Z,6607,448,29,161,False
Сибдепо в Кузбассе,4,18.26.03,Очевидцы: в Кемерове пожарные потушили возгорание в ТРЦ «Зимняя вишня»,1,2018-03-25T17:17:26.000Z,88064,340,2294,639,False
Каниет Жыргалбеков,4,17.26.11,ЭКСКЛЮЗИВ! УРМАТ НЕЛЯ ЭФИРДЕН УРУШУП КЕТЕ ЖАЗДАП...СОЗСУЗ КОР! КЕЧКИ БИШКЕК,24,2017-11-25T15:00:03.000Z,40943,495,66,221,False
HBO,4,18.05.02,Westworld Season 2 | Official Super Bowl Ad | HBO,1,2018-02-05T02:01:07.000Z,2337600,10753,441,908,False
Xan Шемахинец,4,17.04.12,В Грузии арестовали азербаджанцев-людей Лоту Гули,25,2017-12-03T15:39:51.000Z,6210,21,5,1,False
acoolfifa,4,17.01.12,FIFA 18 - БИТВА СОСТАВОВ #4 С KEFIR - SANE 86,20,2017-11-30T12:00:00.000Z,139594,12787,143,541,False
Виталина Таро,4,17.24.11,ТАРО. Онлайн гадание. Что между нами происходит?! Будем ли мы вместе?!,22,2017-11-23T17:58:33.000Z,4285,349,15,73,False
Секреты рукоделия Татьяны Лозовской,4,17.23.11,"Что нового? [Я пират, наконец то купила карту, вышила и оформила подарочный набор]",26,2017-11-22T08:27:31.000Z,8320,682,14,87,False
DSIDE BAND,4,18.10.02,Творческий путь в новом амплуа — продолжение | Сериалити DSIDE BAND |  4 серия,10,2018-02-10T03:57:30.000Z,18717,1859,26,437,False
Арт видео,4,18.15.02,"За Грудинина 45% россиян, кремль осознал фатальную ошибку",19,2018-02-15T01:11:33.000Z,1800,755,35,283,False
Bugungi KUN,4,18.18.02,"БУНИСИ ДАХШАТ! РОССИЯДАГИЛАР ЭХТИЁТ БЎЛИНГ,БУ ЖУДА ЁМОН ХАБАР.",1,2018-02-16T16:56:09.000Z,165483,541,182,249,False
Mega Family SONG,4,17.19.12,"Серебряный бор 9-10 серия ( Сериал, Мелодрама )",1,2017-12-18T13:07:48.000Z,109385,158,77,23,False
Beats4U - TYPE BEATS & RAP INSTRUMENTALS,4,18.02.01,DRAKE x CHRIS BROWN TYPE BEAT | ► R&B Instrumental 2018 - R&B Beat | Chris Brown Type Beat 2018,10,2018-01-01T17:03:44.000Z,42685,232,47,23,False
Garage54 LIFE,4,17.29.11,"АКПП с ТОЛКАЧА, ЗАВЕДЕТСЯ или НЕТ?",2,2017-11-28T11:58:19.000Z,117382,3243,425,339,False
Anna Yakimenko,4,18.18.02,"Старомодные брюки, обувь и аксессуары в гардеробе.",26,2018-02-17T17:48:00.000Z,22587,2606,95,209,False
NOSFERATU,4,18.29.01,Истории на ночь - Как я сходил в бар,24,2018-01-28T16:55:21.000Z,13282,1131,19,122,False
Svetlana Bisyarina,4,17.22.11,ПОКУПКИ ЕДЫ НА МЕСЯЦ ✔ НОЯБРЬ  ✔ СКОЛЬКО Я ТРАЧУ? #светланабисярина,22,2017-11-21T13:09:31.000Z,9647,549,19,86,False
Shamanenok,4,17.17.12,ИГРАЕМ ОТБОРОЧНЫЕ НА МАЙЛ ТУРНИР!!! (БЕЗ МАТА).PLAYERUNKNOWN'S BATTLEGROUNDS | PUBG | ПАБГ | ПУБГ |,20,2017-12-15T23:18:47.000Z,80525,4626,981,13,False
EASYVISION,4,18.07.05,ПРАНК: ДЕВУШКА САДИТСЯ НА ПАРНЕЙ В МЕТРО,22,2018-05-06T10:23:12.000Z,76365,4100,153,628,False
The Only One Channel 2,4,17.27.11,Итоги недели с Ирадой Зейналовой. 26.11.2017г.,24,2017-11-26T10:44:27.000Z,20243,112,21,29,False
Факт,4,18.05.01,СРОЧНО!!! Сирийцы накрыли мощным минометным огнем российскую военную базу Хмеймим,25,2018-01-04T10:33:52.000Z,17179,133,70,240,False
ЛЮБарская,4,17.31.12,ШОУ ПАРЕНЬ ОДЕВАЕТ МЕНЯ В... / РУСЛАН УСАЧЕВ/1 серия,22,2017-12-30T09:19:12.000Z,84733,9588,188,612,False
Alunika Dobrovolski,4,18.03.01,"Полезные привычки, которые приведут вас к здоровью!",27,2018-01-02T09:40:22.000Z,13543,1144,17,99,False
DJEric,4,18.05.01,Лучшая Музыка 2018 ♫ Зарубежные песни Хиты ♫ Популярная Музыка 2018,10,2018-01-04T08:00:01.000Z,33256,223,26,11,False
Альтернативная История Причерноморья и Кавказа,4,18.27.02,"Тайна Глины, засыпавшей города - Раскрыта. #AISPIK #aispik #айспик",22,2018-02-26T20:09:35.000Z,3801,324,13,74,False
Junior Eurovision Song Contest,4,17.23.11,RUSSIA 🇷🇺 - EXCLUSIVE REHEARSAL FOOTAGE - POLINA BOGUSEVICH - WINGS - JUNIOR EUROVISION 2017,24,2017-11-22T11:17:48.000Z,17592,850,131,382,False
Ольга Гладкова-ТАРО,4,17.25.12,Что же сегодня ты чувствуешь ко мне?,22,2017-12-24T15:09:41.000Z,9756,450,22,98,False
ФЕДЕРАЛЬНОЕ АГЕНТСТВО НОВОСТЕЙ,4,18.05.02,Кандидат: Самое главное из недели участников предвыборной гонки,28,2018-02-04T20:00:01.000Z,123569,57,860,422,False
Алексей Казаков,4,18.14.02,Керлингистка Брызгалова сводит с ума весь мир // Алексей Казаков,22,2018-02-13T18:33:13.000Z,43329,1294,185,311,False
PokerMatch FanPage,4,17.24.11,Победитель в автобусе,22,2017-11-23T17:35:39.000Z,108102,83,218,217,False
СМИ России 24,4,18.20.01,Что на самом деле думает Грудинин о мигрантах,22,2018-01-19T15:19:59.000Z,196366,606,4437,1306,False
АДЕКВАТ ТВ,4,18.03.01,Пионтковский - В ШТАБЕ ПУТИНА ИСТЕРИКА!,22,2018-01-02T15:26:54.000Z,47333,640,170,297,False
Ольга Брукман,4,17.11.12,🗽США🎈СКАНДАЛ🎈 ОТВАЛИТЕ ОТ МЕНЯ НЕУДАЧНИКИ🎈 РЕАЛИЗУЙТЕСЬ БЕЗ МЕНЯ И МОИХ ИДЕЙ,22,2017-12-10T15:50:25.000Z,11278,556,303,0,True
bonapp,4,18.28.01,Торт Монстрик мохнатый и веселый,22,2018-01-27T17:53:16.000Z,9293,1240,15,129,False
Dude Perfect,4,18.20.02,Football vs Soccer Trick Shots | Dude Perfect,17,2018-02-19T22:56:12.000Z,4151801,279562,2495,28691,False
TE100STERON,4,17.28.11,TE100STERON#ХЗ: jaguar xjr x 308,22,2017-11-27T05:49:26.000Z,70116,598,87,95,False
Евгений Цапков MotoStream,4,17.20.12,Сколько времени мотоцикл сможет работать в полный газ?,2,2017-12-19T07:57:36.000Z,116050,6672,309,739,False
ОруTV,4,17.15.12,Муж нетрадиционной ориентации возвращается к жене и реп реклама от Минипанков,23,2017-12-14T09:02:55.000Z,18269,124,24,0,False
МИР НАИЗНАНКУ,4,17.18.11,"Секрет долголетия японцев и охота на змею. Япония. Мир наизнанку - 10 серия, 9 сезон",19,2017-11-17T07:00:01.000Z,93185,2807,77,393,False
KG Live,4,18.16.03,АЯЛЫМ ДОСУМ МЕНЕН ЖАТЫП ЖYРYПТYР (болгон окуя) // Сезим сырлары,10,2018-03-15T18:34:22.000Z,19845,119,36,170,False
missAnnsh,4,17.07.12,11 ЛУЧШИХ ЛАЙФХАКОВ для девушек #missAnnsh,26,2017-12-06T15:20:40.000Z,20110,2133,30,1111,False
ToukaN,4,18.13.01,Ростислав Ищенко 12.01.2018 . Время Х для Украины.,28,2018-01-12T07:30:00.000Z,19352,103,9,48,False
Kasper Show,4,17.22.11,Смена почетного караула в Эстонии и в Москве. Сравнение,10,2017-11-21T13:49:22.000Z,6577,236,15,69,False
Max Car,4,18.26.03,Пожар трц Зимняя вишня Кемерово,22,2018-03-25T21:46:57.000Z,103440,241,178,274,False
СаваИгнатич,4,17.24.12,СаваИгнатич Новый год,10,2017-12-23T07:00:27.000Z,90710,1522,561,220,False
Longines Watches,4,17.26.12,Best wishes from the Longines Ambassadors of Elegance,26,2017-12-24T15:30:01.000Z,33367,299,25,18,False
Юрий Болдырев. Канал единомышленников,4,18.14.01,Ю. Болдырев. Грудинин - миллиардер: 20000% лжи (встреча  доверенных лиц Грудинина 13.01.18),25,2018-01-13T13:17:08.000Z,4811,426,18,254,False
Vip Чечня,4,17.15.11,в Чечне с третьего этажа торгового центра упал ребенок,22,2017-11-14T11:54:29.000Z,4412,11,4,5,False
Дмитрий Машков,4,18.16.04,НОВЫЙ HYUNDAI SONATA 2.4 ОБЗОР. ПРОВАЛ В ПРОДАЖАХ! ПОЧЕМУ ЕГО КУПИЛ ВЛАДЕЛЕЦ?,2,2018-04-15T16:11:50.000Z,38622,1348,113,554,False
Мегаплан - Двигатель бизнеса,4,17.24.11,"Канбан от Мегаплана. Доска визуальных карточек, которая сделает продажи прозрачными.",27,2017-11-23T07:02:03.000Z,52617,51,203,33,False
mad rebel,4,17.24.12,Белое солнце пустыни!,22,2017-12-23T09:08:30.000Z,227556,408,6671,593,False
Menua Harutyunyan,4,18.12.05,Վարչապետ Նիկոլ Փաշինյանը ոստիկանությանը ներկայացրեց նոր ոստիկանապետին,25,2018-05-11T10:04:47.000Z,251341,2438,211,351,False
НУДЯТИНКА .ТВ,4,18.26.02,Россия - Германия голы 25.02.2018 Олимпиада 2018,22,2018-02-25T07:17:02.000Z,143699,845,343,438,False
Всё по Маслу,4,18.08.01,"Всё по маслу... Ребята, очень важно!!!",22,2018-01-07T17:28:32.000Z,229237,27576,851,1472,False
Эдуард Давидович Ходос,4,18.13.03,Мобилизационный призыв: скачал и вбросил! Новости Хазарского каганата от Э. Ходоса №29 от 12.03.18,25,2018-03-12T11:28:43.000Z,14952,871,12,217,False
Классные Тут,4,18.01.02,"ДОРТИКОС - КОГДА Я НОКАУТИРУЮ ГАССИЕВА, ВСЕ РОССИЯНЕ ЗАГОВОРЯТ ПО-ИСПАНСКИ / ИНТЕРВЬЮ",17,2018-01-30T13:01:27.000Z,16502,90,49,167,False
Газета Кемерова,4,18.27.03,Видео с камеры наблюдения Зимняя Вишня Кемерово,25,2018-03-26T11:13:01.000Z,30123,36,2,37,False
Xəbər Var,4,18.07.04,Xəbər var: Mehriban Əliyeva yoxa çıxıb - Axtarışlar davam edir (06.04.2018),22,2018-04-06T16:00:13.000Z,67737,1438,92,377,False
YouDo,4,17.28.11,Бизнес на травке | Создатель фермы микрозелени о своем необычном бизнесе и помощниках c YouDo,29,2017-11-27T05:58:32.000Z,77004,1118,135,93,False
KanalD,4,17.01.12,Siyah Beyaz Aşk 8. Bölüm Fragmanı,24,2017-11-30T11:54:51.000Z,882933,13649,189,3424,False
Ka-Re Production,4,18.25.01,Ka-Re Prod... POLOVINA / ПРЕМЬЕРА /2018,10,2018-01-24T16:59:25.000Z,12465,1419,13,138,False
Nikita Morozov,4,17.16.12,ТИПЫ ЛЮДЕЙ ЗИМОЙ / НА НОВЫЙ ГОД,24,2017-12-15T13:07:21.000Z,102152,15206,181,1727,False
ORJEUNESSE,4,18.03.05,ДТП Бухой сотрудник МВС Corvette Харьков  РЕПОСТ,2,2018-05-02T01:42:21.000Z,259459,29224,384,1388,False
Главные Новости,4,18.02.03,МАКСИМ ШЕВЧЕНКО: ЯДЕРНОЕ ПОСЛАНИЕ ПУТИНА АМЕРИКАНЦАМ!  ТАЙНЫЙ СМЫСЛ!,25,2018-03-01T22:00:00.000Z,2852,342,5,52,False
l1zzka,4,17.27.12,эх видео бы снять,24,2017-12-26T19:24:10.000Z,35386,6622,175,367,False
10klass,4,18.13.01,Сергей Семёнов и Диана Шурыгина на Прямом Эфире!,22,2018-01-12T12:38:39.000Z,28689,88,40,17,False
CaucasianKnot,4,18.15.01,Первое требование в череде извинений перед Кадыровым,25,2018-01-13T17:52:03.000Z,116700,524,171,483,False
Kids CrazyShow,4,18.17.03,"Взбесившийся подъемник Эвакуация туристов Адская Канатная дорога в Гудаури, Грузия 16 марта 2018 ося",24,2018-03-16T18:45:44.000Z,23315,70,28,46,False
Руслан Кузнецов,4,18.18.03,KUZNETSOV - ПОСЛЕДНЯЯ ПЕСНЯ (memory video),22,2018-03-17T10:00:08.000Z,1132141,166874,1643,22018,False
ФИЛЬМЫ КОТОРЫЕ СТОИТ ПОСМОТРЕТЬ,4,18.25.03,ФИЛЬМ НА РЕАЛЬНЫХ СОБЫТИЯХ Выбор Грейси фильм драма,1,2018-03-24T09:44:14.000Z,48001,376,32,49,False
Русский сериал,4,17.24.11,Большие деньги 7-8 серия (2017) Мелодрама криминал фильм сериал,1,2017-11-23T13:29:34.000Z,5892,10,2,1,False
Russian Films 6k,4,17.22.11,"ДОЛГОЖДАННАЯ ПРЕМЬЕРА 2017 [ ЧЕРНЫЙ ОЛИГАРХ ] Русские мелодрамы 2017, сериалы 2017,",22,2017-11-21T11:41:30.000Z,102964,221,91,24,False
Karina Arakelyan,4,18.13.03,МЕНЯ ПЫТАЛИСЬ СОБЛАЗНИТЬ!! МОЙ ПЕРВЫЙ РАЗ В LIKE!,24,2018-03-12T11:33:28.000Z,66622,4778,337,1169,False
Голос Европы,4,18.24.03,Скрипаль: Английское гениальное доказательство,25,2018-03-23T12:10:05.000Z,67645,1567,167,472,False
Yury MMA,4,18.15.01,КАКОВ МАНХУФ В ЯРОСТИ?,17,2018-01-14T21:37:29.000Z,5339,77,18,10,False
ФАКУЛЬТЕТ ЮМОРА,4,18.21.03,ЛУЧШИЕ ПРИКОЛЫ 2018 МАРТ #2 | ЛУЧШАЯ ПОДБОРКА | ТОПОВЫЕ ПРИКОЛЫ,22,2018-03-20T09:16:29.000Z,12008,191,16,47,False
КУРКУМА,4,17.14.11,ТОП 5 САМЫХ ЖУТКИХ МЕСТ НА ЗЕМЛЕ,24,2017-11-13T05:11:56.000Z,66129,1182,64,30,False
MixNews-TV,4,18.15.04,Этой ночью началась новая эпоха...,25,2018-04-14T10:08:16.000Z,361974,5361,4360,2354,False
YanGo,4,17.04.12,ЧТО Я НИКОГДА НЕ НАДЕНУ? МОИ СТИЛЬНЫЕ НЕТ! **пародия**,24,2017-12-03T08:09:40.000Z,467037,54793,3188,4886,False
TheWarpath,4,17.20.12,СТРИМ 🔴 НАРЯЖАЕМ ЁЛКУ В ПРЯМОМ ЭФИРЕ С КАТЕЙ И ОТВЕЧАЕМ НА ВОПРОСЫ,20,2017-12-19T21:11:38.000Z,123454,18612,267,468,False
Максим Леонардович,4,17.08.12,Особое мнение Максима Шевченко 07.12.2017,25,2017-12-07T22:24:03.000Z,3678,118,13,36,False
Хайп News,4,17.28.11,"ХайпNews#60: ВАДА и МОК «обокрали» русских олимпийцев. Трамп не «человек года». С праздником, Мамы!",22,2017-11-27T07:03:56.000Z,73939,2083,680,217,False
Елена Дзык,4,17.30.11,ВРАЧИ СОШЛИ С УМА ЛЕЧАТ МУЖИКОВ ОТ МОЛОЧНИЦЫ ДОЗА ПРЕВЫШЕНА В 270 РАЗ!,26,2017-11-29T15:32:53.000Z,13225,876,30,92,False
voltNik,4,18.29.01,НЕ ЗНАЕТЕ ЧТО ВЫБРАТЬ? ВИДЕОРЕГИСТРАТОР НА AMBARELLA A12! JUNSUN H030,28,2018-01-29T02:00:01.000Z,1861,164,13,12,False
розовый вечер,4,18.08.03,"С 8 марта поздравляем Самых Милых, Любимых и Красивых!",10,2018-03-07T17:00:21.000Z,23153,119,4,3,False
Страна.ua,4,17.06.12,Как Саакашвили вытаскивали из машины СБУ,25,2017-12-05T11:56:06.000Z,554419,4611,913,4264,False
Алексей AlexStitch,4,17.30.11,Вышитые новогодние украшения,26,2017-11-29T16:51:01.000Z,4891,632,4,96,False
Физика от Побединского,4,17.09.12,Будет ли АРМАГЕДДОН в реальности?,28,2017-12-08T13:46:03.000Z,79830,11343,91,527,False
REVOLUTION in Russia 5 november 2017,4,17.15.12,Навальный ответил Путину за бегающего Саакашвили,25,2017-12-14T18:27:45.000Z,78910,2304,2608,767,False
FootObzor HD,4,17.08.12,PEAЛ COCЬEДAД - 3EHИT. ОБЗОР МАТЧА. 07.12.2017,17,2017-12-07T22:31:00.000Z,63243,384,60,51,False
Lega Play,4,18.13.03,PLAYERUNKNOWN'S BATTLEGROUNDS - 6 ТОП-1 НА ЭТОМ СТРИМЕ!! КИБЕРДЕДЫ ПРОТИВ ВСЕХ!!,20,2018-03-12T16:20:38.000Z,56321,3897,201,29,False
Готовим вкусно cook delicious food,4,17.15.12,Как украсить торт. Выравнивание торта очень подробно. Готовим крем для торта и выравнивания,22,2017-12-15T04:00:00.000Z,2223,245,2,43,False
Света КЕМЕР,4,17.17.12,Двойка в школе ОЖИДАНИЕ и РЕАЛЬНОСТЬ,22,2017-12-17T05:30:00.000Z,19512,2056,115,303,False
Все тайное становится ЯВНЫМ,4,17.05.12,Шувалов наносит новый страшный удар по России,25,2017-12-04T11:15:13.000Z,8836,230,10,68,False
Jimmy Kimmel Live,4,17.15.11,WORLD PREMIERE TRAILER – Jimmy Kimmel’s The Terrific Ten,23,2017-11-14T06:56:13.000Z,864242,20686,273,980,False
Georgy Pranks,4,18.15.03,"Чувак, я тр*хнул её маму! / Странные Разговоры Пранк",23,2018-03-14T13:34:58.000Z,77453,9626,130,1062,False
Дмитрий Шилов,4,17.19.12,Украсил Каток во дворе за 100 000 рублей,22,2017-12-18T07:28:39.000Z,98054,4769,1024,991,False
