channel_title,no_of_vids,trending_date,title,category_id,publish_time,views,likes,dislikes,comment_count,comments_disabled
Анатолий Шарий,197,17.14.11,Яценюк. НЕпопулист. Вернулся,23,2017-11-13T10:54:46.000Z,419835,27738,656,4681,False
Эхо Москвы,184,17.15.11,Особое мнение / Евгения Альбац // 14.11.17,25,2017-11-14T16:52:41.000Z,49670,930,85,157,False
Модные Практики с Паукште Ириной Михайловной,169,17.14.11,Экскурсия в прошлое Полный обзор пальто 1962 года Интересная модель пальто с высоким воротником,26,2017-11-13T17:00:01.000Z,14028,972,12,122,False
Wylsacom,167,17.15.11,Иммерсивный обзор iPhone X - 14 ноября в 20:00 по МСК,28,2017-11-14T20:50:11.000Z,886496,70814,4486,421,False
kamikadzedead,159,17.14.11,ЗАЧЕМ ПУТИН ПОЙДЕТ НА ВЫБОРЫ?,23,2017-11-13T11:48:14.000Z,210181,34370,26569,5828,False
Россия 24,159,17.14.11,60 минут по горячим следам (дневной выпуск в 13:00) от 13.11.17,24,2017-11-13T11:04:43.000Z,157093,778,469,577,False
След - новый сезон,155,17.14.11,След - Опека,1,2017-11-13T09:00:01.000Z,22000,78,11,10,False
Калнина Наталья,155,17.15.11,Рваный Пирог за пару минут. Удиви себя насколько это просто и Вкусно!,22,2017-11-14T16:28:43.000Z,49278,4265,68,116,False
PanArmenian TV,152,17.14.11,"Նռան հատիկ, Սերիա 46 / Pomegranate seed / Nran hatik",1,2017-11-13T18:30:01.000Z,54031,227,35,72,False
Трум Трум,144,17.14.11,12 лайфхаков с термоклеем для хендмейда,26,2017-11-12T08:00:02.000Z,2109573,39671,2899,5662,False
Конец близок или свидетели финансового апокалипсиса,140,17.14.11,Аркадий Бабченко - Персонально Ваш... 13.11.17,29,2017-11-13T13:04:22.000Z,12324,272,16,55,False
НТВ,138,17.14.11,Первая передача. Выпуск от 12 ноября 2017 года,2,2017-11-12T08:20:41.000Z,107385,612,227,197,False
Xəzər Media,136,17.19.11,"5də5 - Üzeyir Mehdizadə, Əlibəy Məmmədli (ELÇİLİK)  17.11.2017",24,2017-11-18T16:46:46.000Z,36504,707,62,226,False
DaiFiveTop,135,17.14.11,ЗАБЫТЫЕ ЗВЁЗДЫ 2000-ЫХ,24,2017-11-13T16:05:57.000Z,191348,10679,762,790,False
Yoll,132,17.16.11,Филин Ёль ничего не делает. Кот Мурлок ничего не делает. Жуколица в квакварии.,15,2017-11-15T18:44:48.000Z,21671,2334,10,215,False
Акыркы Кабарлар - Санжар Калматай,132,17.14.11,Срочно!  Бабанов фракция лидерлигинен кетти | Акыркы Кабарлар,22,2017-11-13T13:34:08.000Z,21724,142,29,175,False
telblog.net,130,17.14.11,FIFA — До Того Как Стала Известна!,24,2017-11-13T15:58:24.000Z,103824,6336,191,576,False
Лайки Соловьева Ю.В.,129,17.19.11,ЩЕНКИ  УЖЕ ПЫТАЮТСЯ ИГРАТЬ!!!,15,2017-11-18T15:19:52.000Z,5553,533,1,30,False
Первый канал,126,17.14.11,Прожекторперисхилтон - Выпуск от 11.11.2017,43,2017-11-11T21:14:30.000Z,658403,10368,1284,809,False
Русские сериалы,124,17.14.11,Морозова (2017). 1 серия. Ничего личного / Детектив @ Русские сериалы,1,2017-11-13T12:00:01.000Z,42381,128,26,12,False
Aleksandr Semchenko,124,17.27.11,Порошенко сболтнул об антиПутинском мятеже и наврал о голодоморе,23,2017-11-26T04:31:59.000Z,69668,2919,113,887,False
oblomoff,120,17.15.11,Друже пытается делать САМСУ В ТАНДЫРЕ! До успеха далеко....,24,2017-11-14T08:53:17.000Z,616177,27172,2127,3213,False
Saveliy Ad,120,17.15.11,Привет из Никополя Сумасшедший дом,22,2017-11-14T09:35:32.000Z,34026,1157,135,373,False
Sasha Sotnik,119,17.14.11,МОСКВИЧИ: МЕЖДУ ПРОТЕСТОМ И ТЕРПЕНИЕМ...,25,2017-11-13T16:00:03.000Z,56614,5298,86,835,False
Уральские Пельмени,117,17.14.11,Теща и морячок - По тещьему велению - Уральские Пельмени (2017),23,2017-11-12T15:00:04.000Z,237457,2957,353,195,False
Xəzər Film,112,17.14.11,İMTAHAN serialı - ANONS 42-ci seriya,1,2017-11-13T15:06:40.000Z,20744,349,9,92,False
Alex Boyko,108,17.16.11,Что если положить муравьям пенопластовые шарики? Реакция муравьев. Формикарий.,22,2017-11-15T10:00:01.000Z,368485,10478,641,1813,False
Мастерская Настроения,104,17.15.11,"7 ЖЕСТОВ, КОТОРЫЕ ЛУЧШЕ НЕ ПОКАЗЫВАТЬ В ДРУГИХ СТРАНАХ",24,2017-11-14T07:07:22.000Z,373430,18889,623,1098,False
Вечерний Ургант,104,17.17.11,Вечерний Ургант - Летиция Каста/Laetitia Casta и Такаси Мураками/ 村上. 892 выпуск от 16.11.2017,43,2017-11-16T22:05:40.000Z,19057,350,24,55,False
Max Maximov,104,17.19.11,Наркоманская ДЕТСКАЯ азбука!!! ЛЮТАЯ КНИГА!!!,24,2017-11-18T08:27:04.000Z,59651,2431,120,206,False
БЕРИ И ДЕЛАЙ,102,17.28.12,"18 СУМАСШЕДШИХ ПОДЕЛОК, КОТОРЫЕ ВЫ ОБЯЗАНЫ УВИДЕТЬ",26,2017-12-27T17:00:03.000Z,13766,270,36,33,False
Красный квадрат,102,17.14.11,Давай поженимся! Неудачно женатый. Выпуск от 13.11.2017,24,2017-11-13T14:00:04.000Z,17800,51,15,23,False
Алексей Навальный,102,17.15.11,Как мы для Усманова акции Фейсбука покупали,29,2017-11-14T11:53:49.000Z,807276,113898,43154,16719,False
Om TV,99,17.14.11,отоБРАТСКИЙ ПОЛУОСТРОВ,25,2017-11-13T13:39:17.000Z,117399,11781,304,1209,False
Ольга Матвей,98,17.14.11,"Ольга Матвей | Пирог на ФАНТЕ  Очень Высокий, а Какой Вкусный:) | FANTA CAKE | FANTAKUCHEN",22,2017-11-13T17:00:01.000Z,32014,2806,115,189,False
Урожайный огород,98,17.14.11,ВОЛШЕБНАЯ ПОДКОРМКА ДЛЯ ВСЕХ РАСТЕНИЙ!ВСЁ РАСТЕТ КАК НА ДРОЖЖАХ!,22,2017-11-13T15:01:20.000Z,12116,786,23,43,False
Матч ТВ,98,17.19.11,18.11.2017г. Краснодар - Спартак - 1:4. Обзор матча,17,2017-11-18T15:47:07.000Z,225126,2757,169,661,False
Вечер с Владимиром Соловьевым,97,17.14.11,Воскресный Вечер с Владимиром Соловьевым от 12.11.17,25,2017-11-13T02:49:37.000Z,159579,1352,403,661,False
Россия 1,97,17.14.11,Трейлер. Андрей Малахов. Прямой эфир от 13.11.17,29,2017-11-13T13:44:43.000Z,9920,15,4,0,False
Çukur,96,17.14.11,Çukur 4. Bölüm Ön İzleme,22,2017-11-13T14:59:10.000Z,419872,3365,175,585,False
Трум Трум СЕЛЕКТ,95,17.25.12,16 лайфхаков для ногтей и маникюра,26,2017-12-24T11:00:04.000Z,65520,3242,180,633,False
Трансформатор,94,17.16.11,Откровения Кати. Как открыть свою сыроварню. Бизнес на трендах.,22,2017-11-15T16:04:00.000Z,121289,7891,511,1239,False
Вкусная минутка,92,17.15.11,Салат Мимоза  Вкусный Слоеный салат на Новогодний стол,22,2017-11-14T10:52:19.000Z,24684,1849,33,94,False
Радио Свобода,92,17.14.11,Кандидат Путин,25,2017-11-13T17:06:24.000Z,25375,604,123,0,True
Dmitry Puchkov,92,17.14.11,Клим Жуков про сериалы Троцкий и Демон революции,1,2017-11-13T13:08:54.000Z,101402,6304,249,863,False
Итальянцы by Kuzno Productions,92,17.14.11,Итальянцы VS русская народная медицина,24,2017-11-13T17:22:55.000Z,105116,9780,93,1184,False
Мой мир,92,17.18.11,2 отрывок  к 23 серии Госпожа Фазилет и ее дочери  2017,1,2017-11-17T16:17:18.000Z,15755,124,2,17,False
KisabacLusamutner,91,17.14.11,Kisabac Lusamutner eter 13.11.17 Ushagnac Kaper,29,2017-11-13T17:34:04.000Z,18434,72,14,0,True
Жалбырак ТВ,91,17.14.11,КҮНБҮГҮН/ Бабанов РАЖдын лидерлигинен алынды,25,2017-11-13T15:28:17.000Z,35648,251,64,145,False
TimOn ChaveS,90,17.14.11,ЭКСПЕРИМЕНТ: РЕАКЦИЯ РЫБКИ на ВАКУУМ,28,2017-11-13T13:00:07.000Z,306619,39229,2207,4049,False
Гараж 54,89,17.14.11,Сколько МОЖНО ПРОЕХАТЬ на СТАРТЕРЕ?,2,2017-11-13T11:00:06.000Z,229809,8606,545,1164,False
24 SOAT TV,87,17.18.11,ДЕПОРТАЦИЯ ГА УЗГАРТИРИШ || ИЗМЕНЯТСЯ ПРАВИЛА ДЕПОРТАЦИИ,25,2017-11-17T08:02:50.000Z,66746,884,137,160,False
Умные люди,87,17.16.11,Александр Невзоров - ОГOPЧУ! CБЫBAЮТСЯ XУДШИЕ OЖИДAHИЯ...,22,2017-11-14T15:53:56.000Z,63162,767,139,412,False
AcademeG,87,17.17.11,ОБЗОР для ТВОЕЙ МАМКИ,2,2017-11-16T17:00:43.000Z,455564,23002,12094,2751,False
Политика сегодня: Россия США Украина,86,17.23.11,Умер Дмитрий Хворостовский. Редкое интервью каналу Россия 1,25,2017-11-22T09:39:20.000Z,63356,552,38,164,False
Навальный LIVE,86,17.14.11,Нападения на полицейских и большое турне Навального по России,25,2017-11-13T07:07:07.000Z,23345,2870,2494,688,False
Adını Sen Koy,85,17.15.11,Adını Sen Koy 217. Bölüm,22,2017-11-14T16:01:03.000Z,166146,1497,187,240,False
Новости на Первом Канале,84,17.15.11,У границ России. Время покажет. Выпуск от 13.11.2017,25,2017-11-13T17:32:55.000Z,61305,269,116,0,True
SokoL[off] TV,84,17.15.11,10 Загадок ЗВЁЗДНЫХ ВОЙН [ТОПот Сокола],1,2017-11-14T15:13:10.000Z,185303,14896,788,1143,False
Школа Таро. Консультации Golden Charm,83,17.15.11,НАМЕРЕНИЯ ЗАГАДАННОГО ЧЕЛОВЕКА ВО ОТНОШЕНИИ ВАС СЕЙЧАС/ ГАДАНИЕ ОНЛАЙН/ 4 расклада/ Школа Таро,22,2017-11-14T17:00:01.000Z,8373,429,23,29,False
Народовластие,81,17.09.12,ПЛОХИЕ НОВОСТИ в 21.00 8/12/17,29,2017-12-08T20:51:39.000Z,12047,2378,3238,223,False
Новости 24/365,81,17.20.11,СЕРГЕЙ ЛАВРОВ PA3ΗΟCИΤ УКΡАИΗУ- «3AБИΡAЙΤΕ ΗИЩИΧ И УБΟГИΧ CEБE» — 19.11.2017,25,2017-11-19T11:28:54.000Z,17216,179,20,48,False
ATV Cinema,79,17.15.11,Ögey ana (38-ci bölüm),1,2017-11-14T18:00:03.000Z,24929,358,35,136,False
Покашеварим,78,17.20.11,Доставка ресторана Бакинский бульвар | Где мои соусы и лаваш???,24,2017-11-19T05:00:01.000Z,86749,2723,405,350,False
atv,78,17.15.11,Senin lider seçilmeni sağlayabilirim! - Eşkıya Dünyaya Hükümdar Olmaz 80. Bölüm,24,2017-11-14T19:37:28.000Z,110212,241,30,13,False
2DROTS,77,17.14.11,МЯЧ ИЗ МАГНИТОВ НЕВЕРОЯТНЫЙ ЧЕЛЛЕНДЖ,20,2017-11-13T14:38:47.000Z,285049,25939,446,987,False
Room Factory,77,17.16.11,"Короче говоря, лотерейный билет",23,2017-11-15T16:05:41.000Z,715628,52663,697,1342,False
Ozodivideo,77,17.24.11,Дарди дили як зани танфурӯш: “Мардонро ҷарима накунед”,25,2017-11-22T08:37:18.000Z,94087,1280,344,0,True
Во саду ли в огороде,77,17.15.11,Какие Томаты Я Больше Не Буду Сажать! Семена Томатов.,26,2017-11-14T14:51:17.000Z,40269,1653,132,471,False
RapNews,76,17.14.11,KIZARU VS FACE И PHARAOH | ПОПЕРЕЧНЫЙ VS ПАНИН | ATL | ХЛЕБ #RapNews 238,24,2017-11-13T14:56:10.000Z,132061,4934,335,714,False
КИНОКРИТИКА,75,17.14.11,Убийство в Восточном экспрессе – ПРИТОРНЫЙ ФАРС (обзор фильма),1,2017-11-13T16:31:27.000Z,44339,3038,499,361,False
TheRelizzz / Дата Выхода,75,17.14.11,УЖАС!!! Омерзительная ПРАВДА о внуке Пугачевой ШОКИРОВАЛА всю страну!!! Новости #TheRelizzz,1,2017-11-13T17:14:00.000Z,30142,25,91,17,False
Пусть говорят,74,17.15.11,Пусть говорят - Специальный выпуск. В новом доме. Исповедь Армена Джигарханяна. Выпуск от 13.11.2017,43,2017-11-14T09:13:45.000Z,173466,551,316,596,False
ЮТУБЕР,73,17.16.11,ДЕВОЧКА ИЗ ЛАЙК ТВ ШОУ ОБОГНАЛА PewDiePie ПО ПОДПИСЧИКАМ,22,2017-11-15T19:13:29.000Z,232724,14065,1578,1268,False
Прямой эфир,73,17.15.11,Цымбалюк-Романовская не захватывала театр. Андрей Малахов. Прямой эфир от 14.11.17,24,2017-11-14T15:16:34.000Z,9904,19,9,10,False
Татьяна Бугрий,70,17.14.11,Дизайн ногтей Градиент/Гелевая Лепка 3D дизайн/ Аппаратный маникюр/ Самый красивый МАНИКЮР,22,2017-11-13T09:56:51.000Z,39637,3613,24,132,False
AdMe.ru - Сайт о творчестве,70,17.22.11,"Ешьте Чеснок Каждый День и Смотрите, Что с Вами Случится",24,2017-11-21T00:47:13.000Z,155616,6811,152,289,False
Готовим с Ириной Хлебниковой,70,17.14.11,Слоеный Салат Изумрудный с Киви и Курицей,26,2017-11-13T13:34:33.000Z,25610,2248,36,110,False
Подборки Army Home,70,17.12.12,"ПРИКОЛЫ 2017 Декабрь #5 ЭТО РОССИЯ, ДЕТКА! РУССКИЕ ПРИКОЛЫ | Эту страну не победить!",23,2017-12-11T16:02:43.000Z,41627,328,117,46,False
Borsch,69,17.17.11,Рёбра барбекю в домашних условиях | Нереальная вкуснямба,24,2017-11-16T18:25:59.000Z,37979,3443,89,598,False
iKakProsto2,69,17.14.11,800 000 рублей за рекламу и абсурдный Razer.,28,2017-11-13T14:26:08.000Z,35984,6634,2474,925,False
Юрий Хованский,69,17.14.11,ТОР: РАГНАРЁК [Ржака от Marvel],24,2017-11-13T07:03:51.000Z,136087,7843,1232,808,False
ПОЯСНИ ЗА MMA,68,17.11.12,СЛОВА ВАСИЛИЯ ЛОМАЧЕНКО ПОСЛЕ БОЯ С РИГОНДО! ЖЕСТЬ !,17,2017-12-10T05:11:46.000Z,121656,1633,286,354,False
Грильков,67,17.16.11,"Потрачено: ФАРШ (Мираторг, Рестория, Окей)",26,2017-11-15T07:22:07.000Z,50360,4254,114,543,False
Вести FM,67,17.14.11,"Путин ближе Трампу, чем собственные безумцы * Железная логика с Михеевым (13.11.17)",25,2017-11-13T12:31:36.000Z,4553,85,3,2,False
Сила Слова,67,17.15.11,60 минут 13.11.2017 │Вечерний выпуск│,25,2017-11-13T18:40:48.000Z,83554,228,94,255,False
БОЛЬШАЯ ПОЛИТИКА,66,17.14.11,Bpemя nokaжeт 13.11.2017 (ПРОДОЛЖЕНИЕ) Отношения Ykpaunы и России?!,22,2017-11-13T13:37:07.000Z,14518,47,15,42,False
БАРМАЛЕЙКА,64,17.14.11,"ОКРУЖЕНИЕ ПУТИНА УСТАЛО ОТ ЦАРЯ, ПОРА МЕНЯТЬ",25,2017-11-12T09:32:14.000Z,102205,3180,248,758,False
CheAnD TV - Андрей Чехменок,64,17.14.11,Инвалид хочет себе П0РНО звезду ► Половинки ► Ваня на коляске ► #1,1,2017-11-13T15:59:45.000Z,73050,5480,295,596,False
This is Хорошо,63,17.24.11,Atlas: Восстание машин,23,2017-11-24T04:00:01.000Z,83560,8065,293,509,False
Alexander Palienko,63,17.14.11,Готовность умереть и жить 10000 лет. Александр Палиенко.,22,2017-11-13T09:30:38.000Z,19934,1517,36,107,False
Veniamin Nikora,63,17.14.11,СЕГОДНЯ – НЕОБЫЧНЫЙ ДЕНЬ. УТРО с ВЕНИАМИНОМ. 13 НОЯБРЯ,29,2017-11-13T07:11:26.000Z,23293,967,54,175,False
Ellena Galant,62,17.14.11,"9 {НЕОБЫЧНЫХ} ЗИМНИХ АКССЕСУАРОВ, КОТОРЫЕ СОГРЕЮТ И РАЗУКРАСЯТ ЗИМНИЙ СТИЛЬ",22,2017-11-13T04:30:00.000Z,36396,2600,73,157,False
LudaEasyCook Позитивная Кухня,62,17.22.11,ЭФФЕКТНАЯ ОВОЩНАЯ ЗАКУСКА К НОВОГОДНЕМУ СТОЛУ ВКУСНО И ПРОСТО!!! | EASY CUCUMBER APPETIZERS,22,2017-11-21T13:30:01.000Z,32928,2312,50,99,False
ТРК НТС,61,17.17.11,#Жаңылыктар / 16.11.17 НТС / Күндүзгү чыгарылыш - 15.00 / #Кыргызстан,25,2017-11-16T09:44:26.000Z,80043,286,108,111,False
versusbattleru,61,17.14.11,АНОНС / Versus Fresh Blood 4: Война Стилей,24,2017-11-12T17:50:31.000Z,733936,47964,2545,3901,False
VOVA KESS,61,17.17.11,ФЕЙС УНИЖАЕТ МАРЬЯНУ РО?! УМЕР РЭПЕР ЛИЛ ПИП / Lil Peep | КОМКОВ ПРОСИТ ПРОЩЕНИЯ,24,2017-11-16T16:04:03.000Z,109738,6365,168,789,False
Дизель Студио,60,17.16.11,Подборка приколов за октябрь - самое смешные приколы из Дизель шоу | Дизель cтудио Украина,23,2017-11-15T16:26:04.000Z,29129,381,48,27,False
Таня Карацуба Сеид-Бурхан,60,17.20.11,АНГЕЛЫ ПОЯВИЛИСЬ В НЕБЕ,29,2017-11-19T18:58:28.000Z,3151,0,0,40,False
iVideos,59,17.18.11,Рэмпейдж — Русский трейлер (2018),1,2017-11-17T05:00:01.000Z,210084,6446,447,557,False
Алена Митрофанова,58,17.18.11,Сочное Мясное блюдо к празднику! Новогодний рецепт!,22,2017-11-17T06:34:57.000Z,29816,2789,28,152,False
Политика и Геополитика,58,17.16.11,"Место встречи 15.11.17 Отношения Ykpaunы, России и 3anaдa?!",22,2017-11-15T18:27:53.000Z,9260,38,13,42,False
Столото,58,17.19.11,Столото представляет | Русское лото тираж №1206 от 19.11.17,24,2017-11-19T04:27:27.000Z,6013,36,26,16,False
Реальный футбол,58,17.15.11,"РОССИЯ - ИСПАНИЯ: ЧТО ЭТО БЫЛО??? ОБЗОР МАТЧА, ГОЛЫ",17,2017-11-15T01:43:48.000Z,132928,6271,603,495,False
Независимый Эксперт,57,17.18.11,ВАЛЫЫЫЫЫЫ! ПРИЕХАЛИ!!!  -АнтиПыЧ#39,22,2017-11-17T09:50:31.000Z,77493,2873,124,304,False
Дима Масленников,57,17.18.11,Светящийся ЛЁД - Проверка Странных лайфхаков!,24,2017-11-17T13:48:55.000Z,590807,52433,2074,14596,False
вДудь,55,17.06.12,Артемий Лебедев - магистр мата и отец 10 детей / вДудь,22,2017-12-05T06:57:20.000Z,1297631,67063,6693,12497,False
Оштв Каналы,55,17.14.11,Сайт кабар 13.11.2017 | Түрмөдө намаз окуганы үчүн жыныстык мүчөсүнө кайнак суу куйган,25,2017-11-13T12:02:42.000Z,28321,78,65,44,False
Кузьма,55,17.07.12,ПЕСНЯ ПРО КАБАНА,23,2017-12-06T12:44:08.000Z,274950,54894,1390,3314,False
ILYA STREKAL,54,17.15.11,КАК ПРАВИЛЬНО ГОНЯТЬ НА БМВ / BMW M4 vs BMW M2,2,2017-11-14T14:34:28.000Z,173862,7902,1024,891,False
"САД, ОГОРОД,СВОИМИ РУКАМИ",54,17.19.11,КАК ВЫБРАТЬ ТОРФЯНОЙ СУБСТРАТ.,29,2017-11-18T12:11:54.000Z,4488,521,4,23,False
КЛИККЛАК,54,17.26.11,ТРЭШ ЛОТО: ВОКРУГ СВЕТА - ДИКИЙ ЗАПАД,23,2017-11-25T15:01:53.000Z,1143146,107466,5453,4371,False
Ольга Уютный уголок,53,17.17.11,Салат Объедашка на Новый год и не только.,22,2017-11-16T03:03:58.000Z,30917,1809,65,165,False
JoRick Revazov,53,17.15.11,BMW 220 вторая серия и Розыгрыш iPhone X!! Может ли она дрифтить? Броня и новые диски.,2,2017-11-14T15:48:01.000Z,272169,15795,1144,1412,False
ЗВЕЗДНЫЕ НОВОСТИ,53,17.17.11,Тарасов не общается с дочкой из-за Анастасии Костенко,22,2017-11-16T11:40:20.000Z,6960,14,28,8,False
BozbashPictures,52,17.18.11,Bozbash Pictures Qayıdış Yeni (16.11.2017),24,2017-11-16T20:01:34.000Z,188973,3921,276,477,False
Дима Гордей,52,17.04.12,ЗА ЧТО МНЕ ДАЛИ ПО ЛИЦУ. Травма коленки,17,2017-12-03T16:01:23.000Z,457088,42787,917,2413,False
Что если,52,17.18.11,"ЧТО, ЕСЛИ весь МИР В ОГНЕ",24,2017-11-17T10:51:25.000Z,564315,29569,978,1838,False
ПолитЭксперт,52,17.15.11,Михаил Соколов Андрей Пионтковский - Каков план Путина? ... Радио Свобода 13.11.2017,22,2017-11-13T17:12:09.000Z,49573,853,64,241,False
АКАДЕМИЯ ПОРЯДОЧНЫХ ПАРНЕЙ,51,17.14.11,ТОП 10 ЗАЕДАЮЩИХ ПЕСЕН ОСЕНИ 2017,10,2017-11-13T17:00:01.000Z,61881,4627,197,492,False
Е. М. Реальная Оппозиция,51,17.16.11,СР0ЧН0Е ЗАЯВЛЕНИЕ Мин0Б0Р0НЫ PФ - 16.11.2017!!! В0Т ЭТ0 П0В0Р0Т!!! Сергей Шойгу,25,2017-11-14T22:02:09.000Z,118574,420,121,69,False
Непредсказуемая Предопределенность,50,17.17.11,Валентин Катасонов 15.11.2017,22,2017-11-15T19:14:30.000Z,33463,415,21,166,False
Миша Яковлев Кировск,50,17.14.11,Ответ ксенону. Как они так и мы.,2,2017-11-13T09:49:31.000Z,82382,3542,904,795,False
Афиша,50,17.17.11,"Узнать за 10 секунд | MARKUL угадывает треки ЛСП, T-Fest, Yanix, Oxxxymiron и еще 31 хит",10,2017-11-16T07:30:00.000Z,889400,35441,1298,5107,False
PewDiePie,50,17.24.11,MEME REVIEW: Stolen Bike Meme,23,2017-11-23T17:51:12.000Z,1294899,139606,2040,14323,False
Официальный канал КВН,49,17.14.11,КВН 2017 Высшая лига Вторая 1/2 (12.11.2017) ИГРА ЦЕЛИКОМ Full HD,23,2017-11-12T22:00:03.000Z,442228,3194,5985,3218,False
Россия - Украина,49,18.14.01,Скандал в ЦИК: Грудинин запутался в своих богатствах,25,2018-01-12T20:30:01.000Z,92560,926,1191,1927,False
Гена Острецов,49,17.14.11,Интересные  новости  № 263 / 17,22,2017-11-13T13:25:53.000Z,8864,737,15,36,False
День ТВ,49,17.15.11,Александр Дугин. Химеры и чудовища выходят из тени,25,2017-11-14T11:18:01.000Z,11430,392,30,146,False
Эра Водолея,49,17.15.11,Притча про свое и чужое,27,2017-11-14T17:27:30.000Z,7659,519,11,22,False
MOGOL TV,49,17.14.11,САМЫЙ КОРОТКИЙ ТЕСТ НА ИНТЕЛЛЕКТ! ОТВЕТЬ НА 3 ВОПРОСА,22,2017-11-13T14:42:09.000Z,85162,5746,606,2234,False
Тимур Сидельников,49,17.16.11,Apple Airpods или Sony WF-1000x? Сравнение,22,2017-11-15T11:00:03.000Z,181498,5937,1315,939,False
Телеканал Дождь,48,17.01.12,Медведев о фильме Навального «Он вам не Димон»: «Обормоты и проходимцы»,29,2017-11-30T15:29:16.000Z,123502,3695,842,1421,False
KINOKOS,48,17.16.11,Все киногрехи  Телохранитель киллера,24,2017-11-15T12:06:38.000Z,98299,5056,361,536,False
Cut The Crap,48,17.17.11,КИНОВСЕЛЕННАЯ DCEU ОТ НАЧАЛА И ДО ЛИГИ СПРАВЕДЛИВОСТИ | ПЕРЕСКАЗ ФИЛЬМОВ DC,1,2017-11-16T16:01:43.000Z,158779,11215,326,384,False
REVOLUTION in Russia,48,18.04.01,"Ходорковский открыл правду о том, кто главный в Кремле",25,2018-01-03T07:09:14.000Z,56666,903,98,286,False
Лиса Рулит,48,17.14.11,10-летний японец нагибает ТАЗы?,2,2017-11-13T08:02:46.000Z,122061,3134,413,679,False
SOBOLEV,48,17.20.11,СОБОЛЕВ НА ВЕЧЕРНИЙ УРГАНТ / ЭЛДЖЕЙ ЗАБЛОКИРОВАЛ РОЗОВОЕ ВИНО,22,2017-11-19T15:57:39.000Z,1379936,118797,6376,7464,False
Chuck_review,47,17.16.11,Лига Справедливости — Приятная х*йня [Коротенько],1,2017-11-15T19:03:35.000Z,115122,9630,431,522,False
JUSTFUN,47,17.04.12,"ПАРА НАШЛА СКРЫТЫЙ СЕЙФ В СВОЁМ ДОМЕ, ТО ЧТО ОНИ ТАМ ОБНАРУЖИЛИ ПОРАЖАЕТ",24,2017-12-03T15:18:55.000Z,10988,188,21,10,False
ИЛЬДАР АВТО-ПОДБОР,47,17.14.11,Неожиданная встреча с подписчиком,2,2017-11-13T16:48:44.000Z,362255,13776,874,1331,False
ЗДРАВЫЕ МЫСЛИ,47,17.19.11,ЗАГОВОР ЗА СПИНОЙ ПУТИНА РАСКРЫТ (19.11.2017),22,2017-11-18T07:30:01.000Z,98569,667,101,404,False
PolitRussia,47,17.18.11,Европа жестко троллит Киев (Руслан Осташко),25,2017-11-17T16:12:20.000Z,38029,2731,38,169,False
TOP TIP TOP MMA,47,17.04.12,ФРАНСИС НГАННУ ПРОТИВ АЛИСТАРА ОВЕРИМА! ПОЛНЫЙ ОБЗОР БОЯ!,17,2017-12-03T05:59:50.000Z,89492,1708,55,606,False
Ксения Собчак,46,17.16.11,Собчак о миллионе полицейских и пытках «Звонком Путину»,25,2017-11-14T17:20:40.000Z,109002,2808,1101,882,False
RizaNovaUZ,46,17.26.11,Janob Rasul - 2017-yilgi konsert dasturi | Жаноб Расул - 2017-йилги концерт дастури,10,2017-11-25T09:39:28.000Z,67165,1521,107,304,False
Ազատություն,46,17.06.12,Գեներալ Բաղմանյանն ազատվել է ԶՈւ Գլխավոր շտաբի պետի տեղակալի պաշտոնից,25,2017-12-05T16:15:39.000Z,6642,50,4,7,False
Masha Create,46,17.15.11,Маникюр звездное небо! Считаем звезды в космосе на ногтях  Дизайн ногтей гель лаком LEO,22,2017-11-14T23:30:34.000Z,7222,870,20,19,False
KINOFABRIKA,46,17.19.11,"Беги, не оглядывайся! (2017). 1 серия. Мелодрама, премьера.",1,2017-11-18T16:30:00.000Z,38431,0,0,23,False
Научпок,46,17.17.11,Можно ли доверять СВОИМ ВОСПОМИНАНИЯМ?— Научпок,28,2017-11-16T13:05:44.000Z,140316,9454,227,489,False
SlivkiShow,46,17.26.11,6 ЛАЙФХАКОВ от SLIVKI SHOW,24,2017-11-25T08:38:49.000Z,2591759,131799,14752,9740,False
RED21,46,17.20.11,Как стать крутым Видеоблоггером № 1,23,2017-11-19T10:56:08.000Z,312576,25606,3910,4456,False
NEWSONE,46,18.19.01,"Червоненко: я надеялся на США, но они перестали нас понимать и хотят взять в ручное управление 18.01",25,2018-01-18T21:25:23.000Z,12775,221,57,182,False
UZBEK TV,45,17.06.12,ШАВКАТ МИРЗИЁЕВ МАТБУОТ АНЖУМАНИДА ҲАММАНИ ҚОЙИЛ ҚОЛДИРДИ,1,2017-12-05T12:06:22.000Z,37536,378,28,131,False
DUNYO TV,45,18.11.03,Хамза Умаров унинг фарзандлари хам актёр булишганми,24,2018-03-10T18:21:11.000Z,4440,104,2,14,False
Студия ДжоШизо,45,17.18.11,Ностальгирующий Критик - Бэнгарэнг,22,2017-11-17T16:55:32.000Z,34823,2943,63,81,False
Я - ТОРТодел!,44,17.14.11,⭐Собираем двухъярусный кремовый торт⭐- Я - ТОРТодел!,22,2017-11-13T09:00:46.000Z,16408,1053,48,128,False
Жекич Дубровский,44,17.22.11,НЕРЕАЛЬНО КРУТОЙ ТЮНИНГ за 4 тыс.р. Оторвало колесо,2,2017-11-21T15:02:48.000Z,413644,21574,1460,3631,False
Эдуард Адамян,44,18.07.01,В Беларуси на съемной квартире,22,2018-01-06T12:48:23.000Z,25280,1573,63,870,False
Kommentarii,43,17.24.11,Пенсионерам могут выплатить ЕДВ в размере 10 000 рублей,27,2017-11-23T16:19:26.000Z,10051,137,14,19,False
GRANDENIKO VLOG,43,17.20.11,ГОТОВИМ С МАМОЙ ОБЕД,22,2017-11-19T12:52:19.000Z,10423,579,52,122,False
Игорь Негода,43,17.19.11,Реактивный самолет - краш аэродрома и запуск ракет с борта,28,2017-11-18T12:49:30.000Z,119726,20565,152,2448,False
Максим Шелков,43,17.16.11,Пежо - Автохлам или автомобиль? ч.3 - ФИНАЛ,2,2017-11-15T15:43:57.000Z,164247,8410,295,708,False
Söz Dizi,43,17.21.11,Söz | 22.Bölüm,1,2017-11-20T21:14:17.000Z,263217,7651,501,1122,False
МЁD,43,17.15.11,"Что, если тупость была бы преступлением?",23,2017-11-14T14:29:50.000Z,352235,29932,674,1008,False
LAПIN,42,17.20.11,15 НЕУДАЧ НА ВЕЛОСИПЕДЕ,24,2017-11-19T14:25:01.000Z,122474,10657,654,1191,False
Телеканал СТБ,42,17.27.11,Школьница забеременела от 25-летнего насильника-армянина — Один за всех — 26.11.2017,24,2017-11-26T22:26:03.000Z,21130,255,69,270,False
Tasty food,42,17.15.11,"Рецепт НАСТОЯЩИХ ДРАНИКОВ Без Муки и Яиц! Этот вкус не передать словами, ПОПРОБУЙТЕ!",22,2017-11-14T10:34:36.000Z,41246,2454,53,95,False
Fox Uz,42,17.14.11,Хар куни Оч Қоринга Чеснок  Есангиз Мўъжизани Кўрасиз,22,2017-11-13T16:12:46.000Z,32720,934,27,59,False
Sokolovsky!,42,17.17.11,"ЛАРИН ПРОХОДИТ ДЕТЕКТОР ЛЖИ / Versus, Джарахов, чайлдфри и любовь",24,2017-11-16T16:05:25.000Z,157651,16596,1611,1248,False
112 Украина,42,17.18.11,"Дмитрий Гордон, журналист, в Вечернем прайме телеканала 112 Украина, 16.11.2017 (Часть 2)",25,2017-11-16T20:17:44.000Z,36509,192,121,279,False
ASK Turk,42,17.24.11,Adini Sen Koy / Ты назови 224 Серия (русские субтитры),1,2017-11-24T03:00:01.000Z,12653,111,35,42,False
Яковлев Миша,41,17.24.11,Как мы Ауди S6 перевозили. Делать и делать.,2,2017-11-23T08:57:39.000Z,124777,7583,228,644,False
EvoNeon FIFA,41,17.17.11,"365 ДНЕЙ НА YOUTUBE. ДРУЗЬЯ, ДЕНЬГИ, ЛОЖЬ",22,2017-11-16T13:04:47.000Z,120079,15136,156,1209,False
Все по полочкам,41,17.15.11,ПРОНЬКО. Резкий рост банкротств предприятий в России 13.11.17,22,2017-11-13T17:07:21.000Z,30965,747,27,184,False
Alex Vikodinov,41,17.23.12,"50 ВЕЩЕЙ С ALIEXPRESS, ОТ КОТОРЫХ ТЫ ОФИГЕЕШЬ / ЛУЧШЕЕ С АЛИЭКСПРЕСС + КОНКУРС",24,2017-12-22T14:00:05.000Z,28072,2283,65,1192,False
Black & White Team,40,17.15.11,Lexus LX570 СМЕРТЬ МОТОРА. Лолы больше НЕТ.,2,2017-11-14T14:24:56.000Z,456449,18465,1462,3051,False
GopherVid,40,17.17.11,КАК СДЕЛАТЬ КУБИЧЕСКОЕ ЯЙЦО - DIY,28,2017-11-16T17:09:18.000Z,50083,2683,170,367,False
Константин Ответственный X,40,17.02.12,Волкова опять арестовали на 30 суток 1.12.2017,22,2017-12-01T13:53:29.000Z,2579,135,8,91,False
Евгений Ройзман,40,17.19.11,Посмотрел Матильду. Картина за $ 450 000 000. Законы арт-рынка.,22,2017-11-17T16:54:01.000Z,42845,3951,103,424,False
RT на русском,40,17.02.12,Финальная жеребьёвка ЧМ-2018 — спецэфир RT,25,2017-12-01T16:51:02.000Z,45123,299,85,36,False
Нейромир-ТВ,40,17.18.11,Юрий Болдырев в Политкафе ч.1,25,2017-11-17T08:03:37.000Z,13750,770,48,381,False
Антиплатон,40,17.19.12,ПАВЕЛ ГРУДИНИН - ЧЕ МНЕ ЕГО БОЯТСЯ!,25,2017-12-18T14:34:05.000Z,57553,5097,40,773,False
TRT 1,40,17.16.11,Diriliş Ertuğrul 96.Bölüm Tanıtımı,24,2017-11-15T20:35:07.000Z,133748,0,0,0,True
UzbekFilmsHD,40,17.15.11,Gazini bos Jamshid (o'zbek film) | Газини бос Жамшид (узбекфильм),1,2017-11-14T14:07:59.000Z,172364,2081,568,526,False
Семья в деревне!,40,17.15.11,✅ПЛАНЫ на ближайшее время // Как быть с Рыжухой // И всё таки мы туда съездим,22,2017-11-14T16:25:06.000Z,28033,1825,39,194,False
Видео от SoLiDa,40,17.18.11,=Обзор ИРП= АМЕРИКАНСКИЙ сухпай. Что едят в USA армии. MRE №1,24,2017-11-17T13:36:59.000Z,271648,15441,718,1719,False
Yuliya Small,39,17.16.11,ЛЕДЕНЦЫ на палочке ☆ ВКУС из ДЕТСТВА ☆ Леденцовая фабрика,26,2017-11-15T11:27:10.000Z,12050,1186,7,96,False
tophype,39,17.20.11,7 ОТЛИЧИЙ ШКОЛ В РАЗНЫХ СТРАНАХ МИРА,24,2017-11-19T12:17:45.000Z,285638,15601,320,2551,False
Акыркы Жанылыктар,39,17.26.12,Актриса Алиша Диа жолдошу менен ажырашып кеттиби?,25,2017-12-25T12:19:33.000Z,14383,46,13,19,False
Реальная журналистика,39,17.07.12,ПУТИНСКАЯ СТАБИЛЬНОСТЬ: нищета VS зомбоящик,25,2017-12-06T07:59:44.000Z,58686,6796,90,840,False
Орел и Решка,39,17.19.11,Бездомные коты и достопримечательности Рима! Орёл и Решка. Перезагрузка,19,2017-11-18T13:58:24.000Z,9211,325,14,31,False
Super Tamashalar,39,17.05.12,Москвада Аскар Акаевди Алмаз Шаршенович эмес Алмаз Шаадаев бетинен өөп кайтты,23,2017-12-04T10:38:04.000Z,27561,357,67,159,False
Евгений Ширманов,38,17.15.11,Департамент судей Краснодарского края. Тротуар для пешеходов? Часть 1,2,2017-11-14T16:00:09.000Z,71039,6886,145,1076,False
Ridddle,38,17.19.11,НАСТОЯЩИЕ ПРЕДЕЛЫ ЖИЗНИ ЧЕЛОВЕКА,24,2017-11-17T12:07:02.000Z,352819,26699,1055,2126,False
Siberian Beard,38,17.15.11,Топ 5 Японческих Тачек за 300 тысяч рублей,2,2017-11-14T11:35:18.000Z,115617,13268,282,658,False
kinomiraru,38,17.14.11,Все грехи фильма Звёздные войны: Эпизод 1 – Скрытая угроза - Часть 2,1,2017-11-13T18:27:25.000Z,50269,4229,150,398,False
Tema Flex,38,17.21.11,"О ЧЁМ ЧИТАЛ LIL PEEP? Он не умер, пока мы помним его.",24,2017-11-20T18:17:51.000Z,110378,8909,404,878,False
NEWES RU,38,17.15.11,Новости на 5*тв канал 14.11.2017 Последний Выпуск 14.11.17,25,2017-11-14T02:45:27.000Z,59687,120,41,14,False
AcademeG DailyStream,38,17.14.11,Разведка маршрута под новые серии.,15,2017-11-12T20:40:36.000Z,305745,12160,954,721,False
Kuplinov ► Play,37,17.15.11,РЕСТЛЕР МОЕЙ МЕЧТЫ,20,2017-11-14T12:00:05.000Z,165033,9704,381,721,False
"Ай, Как Просто!",37,17.14.11,Такой только у меня и у Ларри Кинга.,28,2017-11-13T17:21:04.000Z,56513,5668,305,579,False
Максим Шевченко,37,17.23.11,Арест Керимова - атака на Россию,25,2017-11-21T19:52:36.000Z,33652,586,468,625,False
Юлик,37,17.14.11,ХАЙП КЭМП - СВОЙ СРЕДИ ЧУЖИХ,24,2017-11-13T16:11:31.000Z,424596,49854,714,2944,False
Волшебная Россия,37,17.14.11,Путин Рассказал всем когда на Руси жить хорошо станет ждем 2018 Смотреть всем,22,2017-11-12T10:38:13.000Z,80179,3046,347,991,False
Наши пушистые друзья,37,17.14.11,"Грибники нашли в лесу собаку, которая угодила в охотничью удавку…",15,2017-11-13T13:38:38.000Z,19652,690,9,28,False
Karabas Channel,37,17.29.12,Как Порошенко опозорился на обмене военнопленных,22,2017-12-28T19:50:26.000Z,102276,3815,531,907,False
Алексей Столяров,37,17.15.11,ЖИМ 100 КГ НА 100 РАЗ - СТОЛЯРОВ И ВОЙТЕНКО ПОБЕДИЛИ / ВСЯ ПРАВДА,17,2017-11-14T11:02:40.000Z,209391,18309,1500,1119,False
Корпорация Зла,37,17.28.11,Приколы с котами - ТОПовая подборка!,23,2017-11-27T15:22:01.000Z,86434,3861,256,193,False
Майни,37,17.14.11,ДОБРЯК - ASSASSIN'S CREED ORIGINS - МУЛЬТ ОБЗОР (Dobryak) | Реакция,20,2017-11-13T14:00:01.000Z,35358,1749,72,166,False
Alex&Milana,37,17.17.11,КОКОСОВЫЙ торт РАФАЭЛЛО / НЕРЕАЛЬНО ВКУСНЫЙ!!! / Raffaello Coconut Cake,22,2017-11-15T22:35:50.000Z,34050,2054,45,140,False
varlamov,36,17.29.11,"Вышний Волочёк: город, который повернул не туда",19,2017-11-27T12:03:20.000Z,41216,1738,77,530,False
Дом 2 с Глорией Рай,36,17.14.11,ДОМ 2 НОВОСТИ раньше эфира! (19.11.2017) 19 ноября 2017,22,2017-11-13T16:42:03.000Z,18445,100,36,9,False
Live Today,36,17.26.11,"МУЧАЮ АНТИСТРЕССЫ УТЮГОМ, ЕНОТОМ, БЛЕНДЕРОМ и др  с сайта Gearbest",24,2017-11-25T07:30:00.000Z,60530,3807,100,1028,False
СТС,36,17.14.11,Шоу Успех | Выпуск 2,1,2017-11-13T15:30:03.000Z,23316,699,160,217,False
Галина Мительман,36,17.17.11,Госпожа Фазилет - 2 фраг к 23 серии ОЗВУЧКA,22,2017-11-16T12:27:33.000Z,22602,234,13,64,False
Big Russian Boss Show,36,17.20.11,Big Russian Boss Show #36 | Пошлая Молли,24,2017-11-18T12:10:09.000Z,554346,33124,8771,3881,False
ТО Gazgolder,36,17.21.12,Баста - Папа What's Up,10,2017-12-20T10:58:10.000Z,546133,37311,3813,1949,False
tanya leto,36,17.22.11,Самый бюджетный РЕМОНТ СТАРОГО ПОЛА.,22,2017-11-21T05:09:51.000Z,26324,2523,34,1206,False
Nikolay B.,36,17.10.12,Самое весёлое поздравление с Новым 2018 годом!!!,10,2017-12-10T03:24:17.000Z,4912,328,12,21,False
Телеканал ТНТ,35,17.24.11,Stand Up - Нурлан Сабуров о провинциальном роддоме,24,2017-11-22T13:29:32.000Z,65092,1103,62,28,False
NEWS,35,17.22.11,Переговоры Путина и Башара Асада в Сочи,25,2017-11-21T07:28:45.000Z,13156,0,0,60,False
Best VIDEOS Лучшее видео,35,17.20.11,BEST CUBE # 200,23,2017-11-19T16:34:54.000Z,87921,2929,245,305,False
AdamThomasMoran,35,17.18.11,+100500 - Передёргивание На Первом,23,2017-11-17T15:15:57.000Z,992183,109366,3794,36390,False
Настоящее Время,35,17.30.11,Березники: жизнь в ожидании провала | НЕИЗВЕСТНАЯ РОССИЯ,29,2017-11-28T12:30:01.000Z,83840,3553,107,895,False
ДИЗЕЛЬ ШОУ - ЮМОР ICTV - Официальный канал,35,17.30.11,МУЖ И ЖЕНА - СЕМЕЙНЫЕ ПРИКОЛЫ на отдыхе – Дизель Шоу лучшее | ЮМОР ICTV,23,2017-11-29T17:00:08.000Z,42561,445,38,32,False
НОВОСТИ ЭКОНОМИКИ,35,18.26.01,ПАВЕЛ ГРУДИНИН ПРЕСС-КОНФЕРЕНЦИЯ В САМАРЕ ДОСТАЛОСЬ ВСЕМ (25.01.2018) СМОТРИТЕ НЕ ПОЖАЛЕЕТЕ,22,2018-01-25T09:05:00.000Z,77597,3118,5202,1339,False
Поззи,35,17.04.12,МОЗГУ КОНЕЦ!,24,2017-12-03T18:47:35.000Z,55937,3728,103,698,False
Tanya StreLove,35,17.18.11,"7 ЛайфХаков, которые изменят жизнь девушек  BEAUTY LIFE HACKS  Tanya StreLove",26,2017-11-17T16:32:59.000Z,156937,11376,228,511,False
1in.am LIVE,34,18.16.04,Փաշինյանը փաստացի հայտարարում է՝ Հայաստանում ինստիտուցիոնալ ընդդիմությունը ճանապարհ չունի,24,2018-04-15T20:12:01.000Z,10142,49,38,22,False
Parfenon,34,18.20.02,"Парфенон #1: Леонид Парфенов о дагестанском деле, Берлине, Башлачеве и Березовском",22,2018-02-19T11:56:11.000Z,190079,23306,2098,2625,False
Darya Kamalova,34,17.14.11,ЧТО НАДЕТЬ НА НОВЫЙ ГОД | 15 ЛУЧШИХ ГОТОВЫХ ОБРАЗОВ НА ЛЮБОЙ КОШЕЛЕК | ПРАЗДНИЧНЫЕ НАРЯДЫ,22,2017-11-13T06:51:24.000Z,36807,2488,87,159,False
Виталий Островский,34,17.22.11,КАК ПОХУДЕТЬ! Гормоны. Бессонница.,22,2017-11-21T12:03:19.000Z,5890,458,7,73,False
Антон Воротников,34,17.18.11,"Я думаю, этот автомобиль вам понравится!)",2,2017-11-17T15:53:47.000Z,189281,13829,921,1051,False
Сергей Будков,34,17.02.12,Разбор Разведданных. Разделение на классы...30.11.2017 гг,22,2017-12-01T05:38:18.000Z,8850,431,14,51,False
BEST of MMA,34,17.16.11,Роган и Шауб о бое Хабиба против Барбозы и Фергюсона [RUS],17,2017-11-15T09:25:33.000Z,18106,39,2,3,False
ДА НИЛ,34,17.26.11,САМЫЙ ВАТНЫЙ КЛИП ШКОЛЬНИКОВ... (Песня о Путине Дядя Вова Мы С Тобой реакция),24,2017-11-25T14:12:47.000Z,42643,5545,314,564,False
100%,34,17.19.11,"Крымчанка из Херсона: Украинцы уже поняли, почему мы выбрали Россию",25,2017-11-17T17:30:00.000Z,37578,304,27,187,False
Е. М.RealOp. Новости Сегодня,34,18.03.04,ГОВОРИТ МОСКВА!!! 03.04.2018 - РАЗГРОМНАЯ РЕЧЬ ЗЮГАНОВА по РОССИИ и ВЛАСТИ,25,2018-04-02T21:03:29.000Z,6746,0,0,24,False
Durel,34,17.17.11,Даня Кашин подстригся | Новая стрижка D.K. Inc.,22,2017-11-16T11:15:49.000Z,11877,607,12,60,False
ДоЗа СчАсТьЯ,34,17.05.12,ЧЕМ ОНИ ЗАНИМАЮТСЯ В ШКОЛЕ НОЧЬЮ? stop motion / стоп моушен,26,2017-12-04T15:26:06.000Z,44802,2956,83,1309,False
Utopia Show,33,17.15.11,А ТЫ ДОСТОИН? Тор с НАУЧНОЙ точки зрения,28,2017-11-14T14:38:51.000Z,303064,47783,465,3887,False
Кик Обзор,33,17.14.11,"Самое крупное поглощение. Что заменит Face ID? Microsoft Спасает 3,5мм Джек и другие новости!",28,2017-11-13T15:14:10.000Z,112171,7662,182,317,False
SuperCrastan,33,17.15.11,Стабилизация древесины. Первые шаги.,28,2017-11-14T15:37:56.000Z,303369,29607,396,687,False
Asekose am,33,18.18.02,"Հայտնի ռեմբո-լաչառներից մինչև անհայտ ահաբեկիչներ,քյառթու փոքրիկ երգիչից մինչև վաստակավոր յաիսնիցաներ",25,2018-02-17T18:36:35.000Z,11936,89,13,29,False
Топовый Пинск,33,18.01.01,"КОРОЧЕ ГОВОРЯ, НОВЫЙ ГОД",26,2017-12-31T07:00:03.000Z,44697,2794,86,972,False
ИККЕРО,33,18.24.02,"КОРОЧЕ ГОВОРЯ, Я ПОЛУЧИЛ ПЯТЕРКУ [От первого лица]",22,2018-02-23T11:09:50.000Z,234998,8783,607,4747,False
1 782 987 подписчиков,33,18.09.01,Ей Говорили- Давай НАГИБАЙСЯ!! Она Наклонялась НА РАБОТЕ и СОХРАНЯЛА МОЛОДОСТЬ! Секрет молодости.,23,2018-01-08T14:30:01.000Z,49046,1397,16,47,False
DegraTube,33,17.27.11,ТРЕНДЫ ЮТУБА (ЗА 1 МИНУТУ),23,2017-11-26T15:03:13.000Z,137354,19157,692,898,False
Daniel Boy,33,18.19.02,ЭКСКУРСИЯ!!,22,2018-02-18T14:27:58.000Z,16093,1314,210,379,False
MORGENSHTERN,33,17.20.11,LIL PUMP - ТРЕК и КЛИП за 5 МИНУТ! [#ИзиРеп] / SONG and MUSIC VIDEO for 5 MINUTES! (Eng Subs),24,2017-11-19T18:00:02.000Z,279740,35404,1146,3741,False
В гостях у Елены,33,17.14.11,САЛАТ РУССКАЯ КРАСАВИЦА.НОВОГОДНИЙ СТОЛ 2018 год.,26,2017-11-13T14:10:46.000Z,9168,430,67,46,False
НЕ ПЕРВЫЙ КАНАЛ,33,17.18.12,Павел Грудинин: Вся страна уже в истерике...(пресс- конференция Путина),25,2017-12-17T11:21:11.000Z,104976,5132,141,1000,False
Video Star,33,17.03.12,"Такой фильм еще нужно поискать! БЕДНАЯ LIZ Русские мелодрамы 2017 новинки hd, сериалы 2017",1,2017-12-02T18:13:22.000Z,24086,150,27,15,False
МастерШеф,33,17.15.11,МастерШеф. Сезон 7. Выпуск 23. Часть 2 из 5 от 14.11.2017,24,2017-11-14T22:50:43.000Z,14425,86,8,24,False
Factor tv,33,18.17.04,«Քայլ արա՝ մերժիր Սերժին» օր 4․ պայքարը թևակոխում է վճռորոշ փուլ. LIVE,25,2018-04-16T17:25:08.000Z,115871,1160,120,91,False
ArmLur.аm,33,18.17.02,"Զարուհին փառք էր, էդի ավելի ռեմբո էր. Սեյրան Սարոյան",25,2018-02-16T07:23:53.000Z,105920,1227,88,0,True
Andro-news.com,32,17.17.11,ЭТО OnePlus 5T - смартфон который мы НЕ Заслуживаем!,28,2017-11-16T18:43:13.000Z,41615,2410,111,259,False
Аналитика Мира,32,17.24.11,США Будут Валить Рубль в Декабре-Январе. Любые деньги будут отдавать за валюту - Валентин Катасонов,25,2017-11-22T09:26:04.000Z,66249,1016,82,304,False
Садовый Мир,32,17.30.11,Супер ягода для здоровья  Калина красная,26,2017-11-29T13:33:05.000Z,5808,382,10,65,False
"Rogandar NEWs - Новости, факты, события",32,17.07.12,Они смеялись над  «Адмиралом Кузнецовым»: F-35 начал рассыпаться в воздухе,29,2017-12-05T20:44:02.000Z,291757,1627,276,586,False
Студия Квартал 95 Online,32,17.24.11,Владимир Зеленский: Накипело!,23,2017-11-23T14:59:55.000Z,599289,58984,2877,7968,False
molodejjtv,32,17.14.11,Ивановы Ивановы - комедийный сериал HD - 16 и 17 серии,23,2017-11-13T18:00:46.000Z,55601,512,18,52,False
BULLSEYE,32,17.15.11,Обновление. Паркур. Баланс оружия - PUBG PLAYERUNKNOWN'S BATTLEGROUNDS,20,2017-11-14T11:43:09.000Z,79164,3303,183,1,False
Clickoncar,32,17.15.11,Чем Рио Х Лайн ХУЖЕ Веста Кросс? KIA Rio X line 2018 ПЕРВЫЙ тест драйв и обзор,2,2017-11-14T16:17:55.000Z,60989,2376,273,542,False
Andrey Antonov MMA,32,17.11.12,"ФОРМА ХАБИБА ЗА 20 ДНЕЙ ДО БОЯ, ФЕРГЮСОН НАТОЧИЛ ЛОКТИ, ВАЛЕНТИНА ШЕВЧЕНКО СЛЕДУЮЩИЙ БОЙ",17,2017-12-10T17:16:32.000Z,40019,787,38,101,False
Говорить Україна,32,17.13.12,Четверо малышей из покинутого общежития (полный выпуск) | Говорить Україна,22,2017-12-12T22:03:52.000Z,17545,139,30,171,False
Bulkin,32,17.12.12,НОВЫЙ ПРОЕКТ! ЗИМНИЙ ДРИФТ КОРЧ! ИЖ ОДА!,2,2017-12-11T13:44:30.000Z,140079,19504,190,8199,False
Аксиома,32,17.07.12,Рычаги давления очень мощные - Ультиматум для олигархов [06/12/2017],29,2017-12-06T01:17:21.000Z,38018,1308,54,245,False
Светлана Чернова,31,17.02.12,Рёшти с Сельдью и Горчичным  Крем-Соусом.Отличная Закуска для Праздничного Стола.,26,2017-12-01T18:08:19.000Z,10334,1236,35,71,False
German *El Classico*,31,17.18.11,РОНАЛДУ В ПАКЕ ЗА 7500 / Ronaldo in a pack fifa 18,22,2017-11-17T14:39:26.000Z,185177,18106,173,815,False
Уголок Акра,31,17.01.12,БЛОГЕРЫ ПРОТИВ РОССИИ-24: Репортаж о ВИНИШКО-ТЯН!,24,2017-11-30T14:08:56.000Z,261710,25279,854,1848,False
Lily Milashka,31,18.03.01,Поздравляю с Рождественским Сочельником!,22,2018-01-03T04:00:00.000Z,3591,384,12,18,False
Body Mania,31,17.14.11,Турникмен против Химика. Жим 100 кг на 100 раз!,17,2017-11-13T10:30:05.000Z,345569,16751,769,2630,False
netstalkers,31,17.17.11,ФАБРИКА ТРОЛЛЕЙ НА САВУШКИНА 55 [netstalkers],24,2017-11-16T14:22:59.000Z,62338,10047,5111,692,False
Красавица и Чудовище Официальный канал,31,17.09.12,ЗАЛЕЗЛА НЕ ТУДА [Красавица и Чудовище](Выпуск 118),23,2017-12-07T13:57:24.000Z,439735,23347,939,1172,False
Россия,31,17.14.11,Задорнов ПРОЩАЛЬНОЕ последнее Видео  Оказывается он знал и,25,2017-11-13T08:42:10.000Z,52419,2099,80,227,False
STAR NEWS,31,18.28.01,РАССКАЗАЛА ВСЮ ПРАВДУ О ВЫБОРАХ и сняла свою кандидатуру с выборов! ВЫБОРЫ 2018! Россия,25,2018-01-27T15:40:04.000Z,55291,3501,2160,1871,False
KREOSAN,31,17.24.11,✅На что способен Электро-Велосипед! 🚴 Все плюсы и минусы👍 Уникальные возможности Вело-Байка,28,2017-11-23T14:04:25.000Z,324471,19132,561,2479,False
Armenian Public TV,31,18.25.02,Եկեք հասկանանք. Ուզում եմ հայտնի լինել,25,2018-02-23T20:12:55.000Z,108883,678,143,0,True
World of Tanks. Официальный видеоканал,31,17.17.11,Проведи свой Гамбит!,20,2017-11-16T13:52:04.000Z,93665,2321,492,238,False
DIAWANTED,31,17.26.11,Опасные Соседи ● Русский Дубляж,1,2017-11-25T10:27:40.000Z,60157,3353,43,199,False
Руслан Усачев,31,17.18.11,Новый зашквар BLACK STAR // Cмерть LIL PEEP // Битва за Розовое Вино,24,2017-11-17T14:26:12.000Z,512821,56159,3806,2137,False
Палата 6,30,17.04.12,ТОП-6 САМЫХ ЗАЕДАЮЩИХ ПЕСЕН 2017,23,2017-12-03T15:08:29.000Z,67031,8174,341,1417,False
ПОЛИТИКА ПЛЮС,30,17.18.11,Pocтиcлaв Ищeнкo - Paзгoвop Пyтинa c лидepaми ЛHP и ДHP: чтo зa этим кpoeтcя? (политика) 17.11.17 г.,22,2017-11-17T08:18:45.000Z,19426,262,19,75,False
BlackSerj Production / BSP Studio,30,17.15.11,"КЕННЕТ БРАНА, ДЖОННИ ДЕПП, ДЖУДИ ДЕНЧ, МИШЕЛЬ ПФАЙФФЕР, ДЖОШ ГАД [s22e06] | ШОУ ГРЭМА НОРТОНА",23,2017-11-14T14:31:13.000Z,21737,1638,9,133,False
Qewbite,30,17.19.11,НОВАЯ КОРОБКА MARVEL из США!,24,2017-11-18T17:04:18.000Z,85387,9226,87,872,False
КОТЫ ЮТУБЕРЫ,30,17.04.12,8 ЖУТКИХ ВЕЩЕЙ РАЗРЕШЕННЫХ В ПРОШЛОМ [Белый кот],24,2017-12-03T12:14:41.000Z,33738,2325,50,246,False
Кинокомпания «Русское»,30,17.25.11,▶️ Склифосовский 6 сезон (Склиф 6) - Выпуск 2 - За кадром,1,2017-11-24T12:00:03.000Z,6454,217,4,29,False
Дом 2 Новости с Микой,30,17.15.11,ДОМ 2 НОВОСТИ 15 ноября 2017 (Эфир 15.11.2017),22,2017-11-14T12:52:21.000Z,35871,133,27,27,False
Шокирующие новости,30,17.18.11,Жена родила Андрею Малахова сына,25,2017-11-17T06:55:57.000Z,54767,368,30,34,False
MOUNT SHOW,30,17.15.11,Приключения Трампа и Медведева в Маниле. Доня и Димон - братья навек. MOUNT SHOW #118,23,2017-11-14T17:00:55.000Z,138119,16517,217,827,False
Данила Поперечный,30,17.25.11,🎙 Я ЗАБИЛ НА YOUTUBE?,23,2017-11-24T10:21:03.000Z,571809,52821,1836,1937,False
ДВИЖНОВ,30,18.12.01,СЕРГЕЙ СЕМЕНОВ ВЫШЕЛ ИЗ ТЮРЬМЫ. ЧТО ЖДЕТ ШУРЫГИНУ?,22,2018-01-10T13:45:25.000Z,1095560,20104,6137,3074,False
GOALNET,30,17.08.12,Кто НА САМОМ ДЕЛЕ заслужил ЗОЛОТОЙ МЯЧ?! Лучший футболист 2017 года это...,17,2017-12-07T17:41:59.000Z,73005,5469,519,962,False
EugeneSagaz,30,17.21.11,ДЕТИШКИ НА ТОВАРНЯКЕ,20,2017-11-20T16:34:06.000Z,102921,7503,247,1328,False
Реакции стримеров,30,17.20.11,Даня Кашин смотрит: Lil peep - ГЕЛИК (prod. smokeasac),22,2017-11-19T18:00:29.000Z,16606,452,112,0,True
Большой тест-драйв,29,17.14.11,ШЕСТЬДЕСЯТ РАЗ КУ!/INFINITI Q60/БОЛЬШОЙ ТЕСТ ДРАЙВ,2,2017-11-13T14:15:10.000Z,56044,1973,186,213,False
Военное телевидение,29,17.18.11,"Русское оружие будущего: на море, на суше, в воздухе (17.11.2017)",27,2017-11-17T16:00:37.000Z,8178,80,12,11,False
Ольга Шарий,29,18.20.03,Солнечное затмение Путина,25,2018-03-19T06:03:16.000Z,103109,12130,120,2288,False
Карина Таро,29,17.19.11,Онлайн гадание ЧТО ДУМАЕТ? ЧТО НА СЕРДЦЕ? ЧТО БУДЕТ? ЧЕГО ХОЧЕТ? ЧЕГО БОИТСЯ? ЧТО С НИМ?,22,2017-11-18T20:07:49.000Z,5217,380,15,58,False
Прыжки в воду,29,17.17.11,МАША МАЕВА ПРОТИВ ВЫШКИ | Прыжки в воду с огромной высоты,17,2017-11-16T14:00:02.000Z,138089,15896,94,758,False
Время-вперёд!,29,17.14.11,В России создан новый процессор. И не только (Время-вперёд! #267),25,2017-11-12T18:04:40.000Z,96057,7098,156,1682,False
ЛАРИН,29,17.19.11,ВИДЕООБРАЩЕНИЕ К ПАВЛУ ДУРОВУ (#пашавыручай),29,2017-11-18T10:41:08.000Z,276927,34416,1653,3741,False
Sen Anlat Karadeniz,29,18.26.01,Sen Anlat Karadeniz 1.Bölüm,24,2018-01-24T19:31:31.000Z,807356,15309,788,2118,False
ShovShuv,28,18.26.01,ШОШИЛИНЧ ХАБАР!ЎЗБЕКЛАРНИ ХУДОНИ ЎЗИ АСРАБ КОЛДИ.,24,2018-01-25T15:30:40.000Z,17121,93,10,35,False
StopXam,28,17.30.11,СтопХам - Мисс Ноябрь,2,2017-11-29T10:23:58.000Z,351127,15309,1402,2343,False
ПРИЯТНЫЙ ИЛЬДАР,28,17.28.11,5 ЛУЧШИХ КАНАЛОВ НА ЮТУБЕ,22,2017-11-27T15:56:39.000Z,301275,27712,943,5677,False
Elli Di,28,17.26.11,Ночь в Доме Из Пленки НА ДЕРЕВЕ АЛИСА СЛЕДИТ ЗА МНОЙ 24 часа | Elli Di,24,2017-11-25T08:03:31.000Z,938470,38071,3108,8559,False
TV Center,28,17.19.11,Яков Кедми. Право знать!,29,2017-11-18T21:00:00.000Z,6678,253,13,65,False
It's Mamix,28,17.23.12,ЮТУБ ПРИСЛАЛ МНЕ НЕОБЫЧНУЮ КНОПКУ С КОЛОЙ ВНУТРИ!,22,2017-12-22T14:37:05.000Z,414961,49730,2202,1556,False
Super.kg,28,17.14.11,Улан Саляновду атайын буюртма менен өлтүрүшкөн деп ойлоп жатабыз дейт туугандары,22,2017-11-13T11:23:47.000Z,38937,138,38,106,False
Black Horse,28,17.17.12,ПРАВДА vs ЛОЖЬ: ЭКЗАМЕН,23,2017-12-16T15:59:11.000Z,356699,22192,486,429,False
GlebaTV,28,17.14.11,"Американцы Слушают Русскую Музыку #36 MIYAGI, JAH KHALIB, КОРЖ, FACE, L'ONE, KIZARU, Т. Раут, VERSUS",24,2017-11-13T12:06:09.000Z,101081,4937,453,1140,False
vJOBivay,28,17.14.11,БОЛЕ ЧУДЕС / ЛЮТЫЙ КОКТЕЙЛЬ / 3 СЕРИЯ,24,2017-11-12T13:15:52.000Z,202600,10121,697,761,False
oSporte TV,28,17.16.11,КТО КРУЧЕ | Мбаппе vs Дембеле,17,2017-11-15T17:00:00.000Z,113195,8021,203,1315,False
vogorode.pro,28,17.22.11,АКТИВНАЯ МУЛЬЧА КАК ПОВЫСИТЬ ПЛОДОРОДИЕ часть2,22,2017-11-21T13:30:00.000Z,6005,278,5,68,False
НОВОСТИ HD,28,17.16.11,Утренние Новости РЕН ТВ 16.11.2017 Последний выпуск 16.11.17,25,2017-11-16T01:29:35.000Z,25636,71,57,18,False
Сергей Михеев,28,17.15.11,Сергей Михеев. Железная логика. Полный эфир Вести FM 13.11.17,25,2017-11-13T17:48:02.000Z,31327,787,30,125,False
ДальнобойTV,28,17.18.12,ВСЕРОССИЙСКАЯ ЗАБАСТОВКА ДАЛЬНОБОЙЩИКОВ.НЕТ ПЛАТОНУ!17.12.17,25,2017-12-17T18:01:05.000Z,3214,398,4,50,False
Юлия Crazy Nails,27,17.18.11,Рисуем СИМВОЛ 2018 года/Новогодний пёсик на ноготках /Пришли мои любимые гель лаки,22,2017-11-17T07:00:01.000Z,16619,1980,13,91,False
Адыл Акжол уулу,27,17.18.11,"Анжеликанын уф, уф дей бергени кимди чарчатты?",29,2017-11-17T11:46:44.000Z,7953,23,20,22,False
SOLO,27,17.24.11,ЖАНЫ КЫРГЫЗ КИНО 2017 / БАЖАРИКИ / КИНОКОМЕДИЯ / full HD,24,2017-11-23T05:40:59.000Z,64549,1002,90,297,False
Денис Чужой,27,17.15.11,100-летие Революции | Класс народа,23,2017-11-14T09:35:19.000Z,36487,4580,108,338,False
Poleznoe TV,27,18.03.03,КОПЕЕЧНОЕ СУПЕР СРЕДСТВО КОТОРОЕ ОЧИСТИТ ЛЮБУЮ ПОВЕРХНОСТЬ,26,2018-03-03T04:00:01.000Z,1336,156,2,4,False
Хочу ПожратьTV,27,17.19.11,ЖЕСТЬ !!!!  4 ГОРШКА ОТВРАТИТЕЛЬНОЙ ЕДЫ / ОБЛЕВАЛИСЬ ВСЕ !!!,22,2017-11-18T19:54:50.000Z,38960,4321,1167,888,False
Неновости,27,17.25.11,Стыдный семейный танец и руки-базуки,25,2017-11-24T13:43:42.000Z,117702,10555,695,623,False
Андрей Тиртха,27,18.03.02,"Запретное устройство, для перемещения во времени и пространстве человек поделился секретом.",22,2018-02-02T23:28:28.000Z,3037,255,70,201,False
ШОУ ЛАКЕРА,27,17.22.11,СУПЕР ЛОНГШОТ ЧЕЛЛЕНДЖ vs. EVONEON | РЕВАНШ,22,2017-11-21T12:00:02.000Z,111641,6830,78,295,False
LoveAliexpress,27,17.15.11,ALIEXPRESS УДАЧНЫЕ ЗАКАЗЫ,22,2017-11-14T08:45:01.000Z,28854,1617,30,94,False
Follow Me,27,18.02.01,Настя уезжает НАВСЕГДА!!,22,2018-01-02T02:54:55.000Z,5154,582,24,176,False
Новости Проекта,27,17.14.11,Дом 2 новости 14 ноября 2017 (14.11.2017) Раньше эфира,24,2017-11-13T16:39:19.000Z,5534,36,8,5,False
ДНЕВНИК ХАЧА,27,17.15.11,Как живет Овечкин в США.  Сергей Полонский после тюрьмы.,22,2017-11-14T15:35:21.000Z,760233,44008,11827,5703,False
Sergey KuvaevJP,26,17.08.12,Мана познакомила меня со своей девушкой? Начало истории Мидори,22,2017-12-08T04:59:57.000Z,20115,2121,115,377,False
RilShow,26,17.19.11,ПОДАРОК ЮТУБЕРУ! Как сделать подарочный набор YouTube! Мультик! Нубик Стив! Желейный медведь.,22,2017-11-18T06:19:07.000Z,64357,1972,73,307,False
USARMENIA,26,17.07.12,MEXRAMIS 291,22,2017-12-06T16:32:01.000Z,28786,74,8,1,False
Alla Kovalchyk,26,17.16.11,ПЕЧЕНЬЕ ПЕРСИКИ,22,2017-11-15T14:19:09.000Z,11601,455,45,58,False
Глас народа,26,18.08.01,✔ Новые производства России №5. Декабрь 2017,29,2018-01-07T10:26:45.000Z,8064,199,13,73,False
AlexGyver,26,17.24.11,Монитор железа ПК + автоматический реобас своими руками!,28,2017-11-23T14:45:34.000Z,71566,7889,126,761,False
vlad pergler,26,17.16.11,Интервью Сергея Бобровского (15.11.17) после игры с «Монреаль Канадиенс»...,17,2017-11-15T07:00:06.000Z,5321,124,0,7,False
МЯЧ Production,26,17.29.11,Сколько зарабатывают футболисты Реала? | Эффект Бабла #1,17,2017-11-28T16:01:33.000Z,3310,368,2,74,False
"Знакомьтесь, Боб",26,17.17.11,Боб открывает магазин,1,2017-11-16T14:43:23.000Z,511595,39185,1723,4468,False
Аналитика и Политика,26,17.25.11,Пионтковский Ну что Путин  Все приехали,22,2017-11-24T18:21:40.000Z,19660,383,33,87,False
Druzhko Show,26,17.14.11,Биржа Мемов #29. Большой выпуск,22,2017-11-13T17:32:11.000Z,330043,43841,2244,2977,False
Сыендук,26,17.21.12,"ВЫМЫШЛЕННАЯ ЕДА, КОТОРУЮ ХОЧЕТСЯ ПОПРОБОВАТЬ | Сыендук",24,2017-12-20T13:57:12.000Z,949178,78954,1663,5526,False
Костя Павлов,26,17.23.11,Маленькая машина VS БОЛЬШАЯ на чем быстрей с Александр Муратаев,24,2017-11-22T11:40:22.000Z,365525,11709,1003,1210,False
OffroadSPB,26,17.20.11,Уаз на 42 колёсах и порталах. Коваши целиком (часть 2),2,2017-11-19T10:54:42.000Z,98245,4340,102,280,False
EvgeniNEWS,26,17.18.11,"Недостроенная ТЭЦ в Крыму проблем с электроэнергией  не вызовет, Россия обеспечит Крым полностью.",25,2017-11-17T13:15:40.000Z,5437,90,20,54,False
Трудности Многодетной Семьи в Сибири,26,17.23.11,Все за столом\\Вася чистит снег\\Петюня очень серьёзный\\,22,2017-11-22T16:02:14.000Z,10947,491,57,186,False
LOUD SOUND,25,17.15.11,"Конец света, который ждали. Apocalypse by Alphard",2,2017-11-14T13:07:59.000Z,75970,4233,66,394,False
zona 71,25,18.26.01,Умерла ЗОЛУШКА - Людмила Сенчина,29,2018-01-25T11:11:30.000Z,18583,0,0,32,False
Fantom,25,17.22.11,ОБЗОР ХХХ ФИЛЬМА УЖАСОВ | Fantom,1,2017-11-21T13:10:27.000Z,135323,14141,762,761,False
"R G D NEWs - Новости, факты, события",25,18.10.03,"США резко поумнели, узнав о новом русском оружии",29,2018-03-09T13:52:38.000Z,103505,876,150,315,False
Авто Страсть,25,17.27.11,Новые Записи с Видеорегистратора за 26.11.2017 VIDEO № 782,2,2017-11-26T16:48:59.000Z,34485,1679,47,281,False
ДЕНИС ОПТИМИССТЕР,25,17.31.12,ХУДШИЙ ФИЛЬМ ПРО РОЖДЕСТВО GRUMPY CAT  [МУВИТОН],22,2017-12-30T13:21:51.000Z,22995,2694,139,173,False
МУЗ-ТВ,25,17.14.11,«Новая Фабрика Звезд». Десятый отчетный концерт от 11 ноября 2017,10,2017-11-13T09:11:47.000Z,89293,881,91,577,False
Константин Семин,25,17.19.11,Африканский вариант. Константин Сёмин «АгитПроп» 18.11.2017,22,2017-11-18T06:03:27.000Z,68392,3181,92,313,False
Milenia Кулинарные Pецепты,25,17.29.11,Быстрый Завтрак. Находка для Лентяев.ОЧЕНЬ ВКУСНО!,22,2017-11-29T03:13:51.000Z,4033,372,33,17,False
Красная Линия,25,17.28.12,Почему Грудинин? (26.12.2017),25,2017-12-26T20:49:15.000Z,28598,750,64,644,False
JaneFox,24,18.19.02,САМОЕ СМЕШНОЕ ВИДЕО В МИРЕ | ПОПРОБУЙ НЕ ЗАСМЕЯТЬСЯ С ВОДОЙ ВО РТУ ЧЕЛЛЕНДЖ,24,2018-02-18T17:54:10.000Z,106621,7499,237,728,False
Это не Диалоги О Рыбалке,24,17.27.11,Рыбалка.Налим и снова мороз..26.11.2017г,26,2017-11-26T12:55:48.000Z,49021,3043,62,441,False
Alexander Nevzorov,24,17.16.12,Паноптикум из студии Nevzorov.tv от 14.12.17,25,2017-12-14T17:36:05.000Z,42182,1088,132,178,False
YangiKulgu,24,17.17.11,Hojiboy Tojiboyev - Armiyada General ishlaydi lekin Ded va Denbil deganlari ishlamas ekan,23,2017-11-16T13:26:20.000Z,24824,251,20,12,False
РЕН ТВ. Новости,24,17.13.12,В Подмосковье изверг отрубил руки жене топором,25,2017-12-12T14:38:29.000Z,38757,137,109,306,False
Meduza,24,17.21.11,Сборка Lego Technic в прямом эфире,26,2017-11-20T23:22:51.000Z,26975,666,43,8,False
ЮТУБ  ТРЕНДЫ,24,17.17.12,"УГАДАЙ ЮТУБЕРА ПО ПЕСНЕ / Даня Кашин, Хованский, Почему Марьяна Ро Мега-звезда?",24,2017-12-16T14:28:03.000Z,144439,19588,369,5682,False
DIPT,24,17.14.11,5 антиЛАЙФХАКОВ без которых жизнь невозможна!,22,2017-11-13T15:49:05.000Z,148974,5434,5247,1612,False
livecorner,24,18.24.01,"Астана, где это? Трамп технично перехитрил обиженного Назарбаева / Елбасы",25,2018-01-23T07:52:12.000Z,97922,283,154,419,False
windy31,24,17.14.11,НЕ НУЖНО БЫЛО НАХОДИТЬ ЭТОТ ТЕЛЕФОН... - Simulacra,20,2017-11-12T16:48:51.000Z,261968,15171,300,3299,False
Nasty Crown,24,18.21.04,ТИПЫ СЛАЙМЕРОВ,22,2018-04-20T16:16:29.000Z,26657,1692,96,405,False
D.K. Inc.,24,17.30.11,МИЛЛИОН ЛЮДЕЙ АККАПЕЛЬНО (Post Malone x 21 Savage– rockstar  cover),10,2017-11-29T10:00:00.000Z,717271,170110,2399,10461,False
Шамов Дмитрий,24,17.17.11,Япония VS Россия. ЯПОНСКИЕ ШКОЛЫ. В чем отличия и что нужно перенять. Проблемы образования,22,2017-11-16T08:17:45.000Z,50168,5948,140,1401,False
Rozetked,24,17.21.11,Xiaomi Mi Band 2 vs «умные» часы,28,2017-11-20T18:54:11.000Z,85140,4388,412,547,False
Gena Miller,24,17.17.11,90 + РЕЙТИНГ | Я ЕГО ПОЙМАЛ !,20,2017-11-16T12:42:26.000Z,195118,15080,329,1158,False
Культас,24,17.16.11,ЛИГА СПРАВЕДЛИВОСТИ ВРОДЕ КАК ДАЖЕ НОРМ (почти),1,2017-11-15T14:32:00.000Z,54857,5030,328,293,False
Denis Igonin,23,17.18.11,11 ЛУЧШИХ ПРАНКОВ НАД БРАТУХАМИ И СЕСТРУХАМИ / ДЛЯ ШКОЛЫ / ШКОЛЬНЫЕ ЛАЙФХАКИ + КОНКУРС,19,2017-11-17T14:29:14.000Z,160184,5774,404,2562,False
Я В ШОКЕ!,23,17.12.12,"ОН КУПИЛ СЕБЕ АВТОМОБИЛЬ И ОБНАРУЖИЛ ДЕФЕКТ В ДВЕРИ. УВИДЕВ, ЧТО НАХОДИТСЯ ВНУТРИ, МУЖИК ОСТОЛБЕНЕЛ!",27,2017-12-11T00:16:01.000Z,154355,976,134,176,False
KTV,23,17.17.11,Непосредственно Каха -- ТРЕЙЛЕР 4 сезон 5 серия,23,2017-11-16T14:39:05.000Z,87165,3240,43,124,False
Sergey Stilov,23,17.17.11,Учимся Дрифту. Слишком близко. #АльтезаЖиви,2,2017-11-16T22:33:38.000Z,30291,3603,48,449,False
serial,23,17.14.11,Ивановы Ивановы - 17 серия - комедийный сериал HD,24,2017-11-13T18:00:03.000Z,317094,6433,158,532,False
Движение,23,17.14.11,Вектор Движения №155 Разведка без боя,2,2017-11-13T11:46:52.000Z,63472,3969,231,425,False
КОМАНДА А,23,17.25.11,КУПИЛИ 2 МАШИНЫ НА КОМАНДУ А! Бэкстэйдж Свидания. Афоня Влюбился,22,2017-11-24T08:42:02.000Z,529722,38539,1304,2223,False
Голос країни,23,17.20.11,"Кристина Жуковская Ой ти, жаворонку – выбор вслепую – Голос. Дети 4 сезон",10,2017-11-19T19:56:31.000Z,47715,920,21,90,False
OneTwo,23,17.25.11,"КОРОЧЕ ГОВОРЯ, Я В СССР",23,2017-11-24T12:00:02.000Z,519300,37666,1538,2951,False
Dobryak,23,17.20.11,Wolfenstein II: The New Colossus - МУЛЬТ ОБЗОР,1,2017-11-19T06:53:08.000Z,462375,41170,662,1876,False
Высокое Напряжение,23,17.18.11,Жириновский о разводе Джигарханяна с Цимбалюк!!!,25,2017-11-17T03:09:17.000Z,54951,248,35,65,False
Твой Футбол,23,18.04.01,"КОУТИНЬО УХОДИТ НЕ УХОДИТ В БАРСУ, РОНАЛДУ ВЕРНЁТСЯ В МАНЧЕСТЕР 10/1 | СВЕЖИЕ ТРАНСФЕРЫ ЗИМА 2018",17,2018-01-03T13:00:04.000Z,69751,3086,101,1418,False
Bilasizmi?,23,18.09.01,08.01.2018 Шавкат Мирзиёев Ҳафтанинг энг муҳим хабарлари Ўзбекистон Янгиликлар Хамма Курсин!,22,2018-01-08T06:22:56.000Z,73153,555,49,31,False
101 Kыргызстан,23,17.14.12,НУРЛАН НАСИП УЙУНДО ЖАНА АЙЫЛДА ТОЙДО,22,2017-12-13T05:49:37.000Z,34426,217,27,74,False
Постскриптум с Алексеем Пушковым,23,17.19.11,Постскриптум (18.02.2017),27,2017-11-18T13:22:05.000Z,132715,1376,170,644,False
TIP TOP TV,23,17.14.11,ИКЕА🎄 НОВЫЙ ГОД 2018❤ НОВИНКИ НОЯБРЬ IKEA❤ТИП ТОП ТВ,22,2017-11-13T09:57:27.000Z,14622,503,36,64,False
True Gym,23,17.08.12,Емельяненко бьет только мешков / Бой Олейник vs Емельяненко,17,2017-12-07T11:35:37.000Z,70345,1464,122,280,False
Виндяй,23,17.14.11,ЗАСМЕЯЛСЯ - ПРОИГРАЛ - ПОПРОБУЙ НЕ ЗАСМЕЯТЬСЯ! ТЕСТ НА ПСИХИКУ НЕ ЗАСМЕЙСЯ ЧЕЛЛЕНДЖ,22,2017-11-12T17:47:09.000Z,539625,24904,3205,3803,False
Angela Pearl,23,17.16.11,ОВЕН- ГОРОСКОП на ДЕКАБРЬ 🎄2017 года от Angela Pearl.,22,2017-11-15T13:11:36.000Z,17798,707,17,103,False
Лена Алена,23,17.26.11,ДОМ-2 СВАДЬБА ЕВГЕНИЯ КУЗИНА И АЛЕКСАНДРЫ АРТЕМОВОЙ-Самые интересные видео и фото,22,2017-11-24T21:30:48.000Z,68606,365,191,76,False
Smetana TV,23,17.23.11,Парни пробуют ЭКОНОМИТЬ НА ОДЕЖДЕ ☑️,24,2017-11-22T13:20:21.000Z,140054,14570,76,635,False
Тихий Барин,23,17.21.12,"Российский сюр. Тихо шифером шурша, крыша едет...",25,2017-12-21T01:49:46.000Z,2992,505,3,138,False
The Люди,23,17.15.12,"KIZARU: Пуля в горле застряла после выстрела / О выдвижении Путина, Собчак и ложках Кокаина",22,2017-12-14T21:28:26.000Z,103751,5943,655,816,False
Гурам Нармания,22,17.30.11,ВАЛЕРИЯ feat FACE (Старые песни в новом исполнении),22,2017-11-29T13:42:09.000Z,31820,10031,297,907,False
Андрей Тюняев,22,17.20.11,Конца света не будет: планета Нибиру - вымысел,22,2017-11-19T12:30:26.000Z,4844,170,3,36,False
Игорь Прокопенко,22,17.18.11,Самые шокирующие гипотезы с Игорем Прокопенко. Выпуск от 17.11.2017. Солнце вышло из-за ели!(HD),22,2017-11-17T11:14:48.000Z,11781,45,9,4,False
Лучшее из Сети,22,17.19.11,Наташу Королеву назвали старухой и выгнали на пенсию!,24,2017-11-18T19:02:22.000Z,9614,37,10,8,False
LaLiga Santander,22,18.08.01,Resumen de RC Celta vs Real Madrid (2-2),17,2018-01-08T00:18:47.000Z,133607,1071,146,79,False
BadComedian,22,17.11.12,[BadComedian] - Крым (#ФильмНаш),23,2017-12-10T08:45:06.000Z,2376157,285477,3847,28355,False
The Best Voices,22,17.30.11,Второе зрение 1-2 серия (2017) Детектив фильм сериал,10,2017-11-29T13:09:04.000Z,29938,64,27,9,False
ТЕМНАЯ СТОРОНА 2.0,22,18.08.01,ЛУЧШИЕ ПРИКОЛЫ 2018 Январь ржака до слез угар видео прикол - ПРИКОЛЮХА # 100,23,2018-01-07T13:00:04.000Z,21229,617,84,129,False
Mr. Moment,22,17.05.12,"Он жить-то будет? А то как же команде, да без талисмана. Мстители: Эра Альтрона. 2015.",1,2017-12-04T15:33:08.000Z,49011,1196,25,53,False
Чикен Карри,22,17.08.12,ЛИГА ПЛОХИХ ШУТОК #1 | L'One x Гудков,23,2017-12-07T07:00:01.000Z,164856,6567,2365,517,False
NewsamChannel,22,17.21.11,Սերգեյ Լավրովն այցելել է Ծիծեռնակաբերդ,25,2017-11-20T15:15:19.000Z,5079,0,0,0,True
Деревенская жизнь на хуторе. Дневник казачки.,22,17.18.11,ЖАРКОЕ  ПУПОЧКИ  в  ГОРШОЧКЕ,22,2017-11-17T13:48:44.000Z,3731,247,11,58,False
КАЛЯН86,22,17.20.11,Запуск УАЗа после долгого простоя ) Ремонт ПЖД КАМАЗ .КАЛЯН86 ),22,2017-11-19T08:41:49.000Z,67743,2518,75,191,False
Новий Канал,22,17.27.11,Топ-модель по-украински. Выпуск 13. 24.11.2017,24,2017-11-26T17:00:07.000Z,355259,6392,673,2432,False
EvRosTV,22,17.17.11,"ИНОСТРАНЦЫ СЛУШАЮТ РУССКУЮ МУЗЫКУ (FACE, KIZARU, OXXXYMIRON, MIYAGI, T-FEST, БАСТА)",24,2017-11-16T10:05:03.000Z,246253,10751,720,1148,False
SPORT - LIFE (обзоры спортивных игр),22,17.19.11,Леганес - Барселона ОБЗОР МАТЧА HD.18.11.17.,22,2017-11-18T17:10:46.000Z,88300,986,50,131,False
O'ZBEKCHA GAP,22,18.14.01,Бузилиб Кетган Кизини Улдириб Кумиб Ташлади,22,2018-01-13T07:35:42.000Z,136581,574,340,625,False
Гражданская Оборона,21,17.26.12,📌НАВАЛЬНЫЙ: оглашение результатов заявления на участие в выборах! Прямая трансляция,25,2017-12-25T15:17:34.000Z,97394,2331,820,343,False
Лара Логинова-Таро,21,17.28.11,Как долго я тебя ждала.,27,2017-11-27T12:46:47.000Z,7486,428,23,270,False
Secret TV,21,17.15.11,Загадки человечества. 85 выпуск (14.11.2017) HD,24,2017-11-14T15:18:54.000Z,7036,46,5,1,False
Сергей Алексашенко,21,17.29.12,Подводим итоги,25,2017-12-29T01:30:45.000Z,6054,361,2,53,False
mosshow,21,18.22.01,Трагедия с внуком Аллы боль не унять #mosshow,1,2018-01-21T11:48:52.000Z,25767,0,0,14,False
BersReview,21,17.03.12,"Кукольный Дайджест #43: ПЕРВАЯ БАРБИ В ХИДЖАБЕ! Новое лицо Челси, новинки Monster High, Barbie,обзор",26,2017-12-01T23:14:02.000Z,419524,16231,287,2030,False
Москва 24,21,17.28.11,Церемония прощания с Хворостовским проходит в КЗ имени Чайковского в Москве,25,2017-11-27T08:51:21.000Z,23264,42,12,22,False
ABRACADABRA TV,21,17.05.12,СЪЕЛ BLACK STAR BURGER - МЕГАБУРГЕР от ТИМАТИ за 5 МИНУТ,22,2017-12-04T12:14:12.000Z,61111,2810,851,1244,False
Лига Смеха,21,17.25.11,Звездный час - Финал Лиги Смеха от 24.11.2017,23,2017-11-24T20:11:51.000Z,216957,5102,451,1525,False
ПОТУСТОРОННИЕ,21,18.28.01,Вызов Духов - Вампир! Он Реальный! Вызов Вампира Потусторонние,22,2018-01-27T07:46:47.000Z,60371,4465,272,1380,False
Новости СВЕРХДЕРЖАВЫ,21,18.12.01,Путина никто не поддержал,22,2018-01-11T14:11:49.000Z,69766,4932,275,1184,False
DANIK,21,17.16.12,"КОРОЧЕ ГОВОРЯ, ПОЛУЧИЛ ДВОЙКУ",23,2017-12-15T11:00:09.000Z,68511,2526,326,1138,False
Король ММА,21,17.15.11,18 Летний Русский Боец Продолжает Шокировать,17,2017-11-14T12:00:01.000Z,158234,0,0,434,False
ОЛЕЖЭ,21,18.14.02,|Как снимали| Ольга Бузова - Мало половин,23,2018-02-12T16:02:08.000Z,96328,5296,145,551,False
Мартеллиада,21,17.27.11,Ультимативно не растерялся - [Бумага],23,2017-11-26T09:42:49.000Z,276587,31699,681,1605,False
PastaTV - инстаграм вайны,21,17.29.11,"Новые Инста Вайны [Выпуск 35] Лев Шагинян, яжемать, Юфрейм, Абрамова Лилия, Андрей Глазунов",24,2017-11-28T11:34:28.000Z,4577,106,7,8,False
Записи стримов Куплинова,21,18.15.03,"НА ТВИЧЕ СТРИМ, ТЫ ОПЯТЬ ОПОЗДАЕШЬ, ЕСЛИ НЕ ПОТОРОПИШЬСЯ",20,2018-03-14T14:39:01.000Z,33668,4848,24,450,False
a1plusnews,21,18.17.04,16.04. Live,25,2018-04-16T19:16:51.000Z,176929,1061,68,0,False
Александр Северный,21,18.01.01,✳️ ЧУБАЙСА ОБOКРAЛИ. ИЗ ДОМА ВЫНЕСЛИ 13 ТЕЛЕВИЗОРОВ И ... || Делягин | Грудинин Путин Медведев,22,2017-12-31T04:00:02.000Z,20055,267,80,171,False
PRO Hockey,21,18.04.02,"Columbus Blue Jackets vs New York Islanders – Feb. 03, 2018 | Game Highlights | NHL 2017/18 . Обзор",17,2018-02-04T04:44:34.000Z,935,17,1,3,False
Евгений Кулик • Оfficial Сhannel,21,17.09.12,Артхаус Когда твоя девушка любит пазлы(#ЕвгенийКулик),23,2017-12-08T13:06:11.000Z,70242,4878,521,206,False
Fazilet Hanım ve Kızları,21,17.19.11,Fazilet Hanım ve Kızları 23. Bölüm,22,2017-11-18T21:06:25.000Z,232804,3022,254,1051,False
Телеканал 360,21,17.16.11,Воспитательница в Томской области пыталась насильно накормить ребенка,25,2017-11-14T11:17:59.000Z,57128,100,287,306,False
C Иринкой HD_TV,21,18.03.01,Новости утренние на 5/TV 02.01.2018 Выпуск 02.01.18,25,2018-01-02T04:27:12.000Z,46050,66,24,35,False
YOUNG,20,18.12.02,"КОРОЧЕ ГОВОРЯ, 14 ФЕВРАЛЯ",23,2018-02-11T09:22:20.000Z,63411,5211,175,572,False
"Это Россия, детка",20,17.20.12,Живая Россия - Бионический глаз,22,2017-12-19T10:01:22.000Z,131843,5088,429,275,False
Мастерская историй,20,17.18.11,СТРАШНЫЕ ИСТОРИИ - ТРИ СТРАШИЛКИ НА НОЧЬ [ДЕРЕВЕНСКИЕ ИСТОРИИ],22,2017-11-17T16:00:02.000Z,4697,363,9,31,False
Фальшивый Критик,20,17.09.12,Треш Обзор Фильма Заклятие 2,1,2017-12-08T14:01:38.000Z,71275,6262,154,627,False
Анекдоты от Алексеевича,20,17.22.11,Анекдот про дырку. Угар и юмор.,23,2017-11-21T14:14:03.000Z,67429,1454,101,70,False
TheNafig,20,17.16.11,Игра трендов (Переозвучка) (спойлеры из сериала),23,2017-11-15T09:44:16.000Z,286234,32661,966,1616,False
Штаб Коммандера,20,17.26.11,ЛУЧШЕ ЧЕМ ЭМОДЖИ МУВИ??? || ТАЙНА КОКО ОТ ПИКСАР,1,2017-11-25T12:09:31.000Z,70534,7270,178,422,False
О главном,20,18.31.01,Иностранцы не сдержались: «Русские испортили ОИ своим отсутствием»,25,2018-01-30T08:00:01.000Z,48173,402,30,145,False
Антон ЛАВ,20,17.04.12,ВЫИГРАЛ iPhone X в ПЕНАЛЬТИ CHALLENGE!?😱,24,2017-12-03T11:01:26.000Z,91606,4584,206,501,False
Кухня (сериал),20,17.16.11,Смотри новые серии финального сезона «Отеля Элеон» 17 ноября на START.ru,1,2017-11-15T15:00:08.000Z,47925,858,79,109,False
Новости РУ,20,17.16.11,КЕДМИ ЕВРОПА МАСКИ СОРВАНЫ! СЕНСАЦИОННЫЙ МАТЕРИАЛ 16 11 2017,22,2017-11-15T13:11:57.000Z,21367,100,16,45,False
Woodmark,20,17.15.11,Обзор на плохое - Сериал Счастливы вместе,43,2017-11-14T16:04:18.000Z,45354,4567,262,1124,False
TRT Televizyon,20,17.28.12,Diriliş Ertuğrul 101.Bölüm Fragmanı,1,2017-12-27T20:47:58.000Z,118762,694,18,0,True
TerlKabot channel,20,17.01.12,ТРЕШ ОБЗОР фильма Особь [инопланетная нимфетка],1,2017-11-30T15:59:33.000Z,96307,15758,133,953,False
Платье - терапия,20,17.03.12,Обзор ткани из интернет-магазина Измира,26,2017-12-02T14:59:58.000Z,8003,473,14,140,False
РОЙ ТВ,20,17.26.11,"Кандидат национал патриотов – против «сирийского кандидата» (И.Стрелков, Ю.Болдырев, М.Калашников)",25,2017-11-24T15:55:06.000Z,42140,786,178,958,False
ТАБЛЕТКА для Памяти .,20,18.02.01,"КОММЕНТАРИИ ИНОСТРАНЦЕВ О РОССИИ, ПЕРЕВОД 37 ЧАСТЬ АМЕРИКАНЦЫ О РОССИИ Новогодний обзор",24,2017-12-31T16:12:51.000Z,55208,4961,91,369,False
VITDIV SHOW,20,18.04.03,НАБОР LIL PEEP / Лил Пип Awful Things BOX,22,2018-03-03T18:23:54.000Z,18354,1802,124,488,False
ZO'R TV,20,17.12.12,The Cover Up (2-mavsum) 12-soni (Shoxrux),24,2017-12-11T12:16:18.000Z,62652,1543,84,385,False
SupeR MasteR,20,17.14.11,Полнолуние 19-Серия! Лайк!,1,2017-11-13T06:10:47.000Z,56884,751,78,77,False
Пятое Измерение,19,17.30.11,Деньги могут приходить к вам легко,27,2017-11-29T17:15:22.000Z,9148,695,17,47,False
В ПЕРВЫЙ РАЗ,19,17.05.12,"Александр Ревва: Реакция на  Элджей & Feduk, Хлеб, АК-47, Клик Клак и Big Russian Boss",22,2017-12-04T11:51:08.000Z,61310,1249,378,141,False
SNAIL MOMENTS,19,17.20.11,⭐ [SNAILKICK] СМОТРИТ ТРЕНДЫ 18.11.17,24,2017-11-18T18:44:14.000Z,13773,345,23,47,False
ПОТРАЧЕНО,19,17.15.11,Сорвало башню | ПОТРАЧЕНО,23,2017-11-14T09:54:41.000Z,101191,3792,231,292,False
Pressa kg,19,18.16.04,Сооронбай Жээнбековдун учакта жүргүнчүлөр менен бара жаткан тасмасы тарады,25,2018-04-14T19:46:47.000Z,98349,1641,49,364,False
Azattyk,19,17.26.11,Отунбаева: Жээнбеков өз жолун тандашы керек,25,2017-11-25T09:18:07.000Z,53465,478,116,453,False
Звезды шоу-бизнес и Дом2 Мнения о доме2,19,17.06.12,Ольга Бузова не может купить квартиру и что её связывает с Лепсом. Последние новости шоу-бизнеса,22,2017-12-05T17:59:47.000Z,2798,43,3,3,False
ChebuRussiaTV,19,17.14.11,ЖЕСТКИЕ ПРЯТКИ В ОСОБНЯКЕ | СОБОЛЕВ И МУРАТАЕВ,29,2017-11-12T12:19:20.000Z,747459,94626,1737,1777,False
UKRLIFE.TV,19,17.16.11,"Энрике Менендес: В Украине нет политических сил, защищающих интересы Донбасса",22,2017-11-15T12:14:50.000Z,4908,167,22,111,False
Stand-Up Club #1,19,17.18.11,Порараз Бирацца в Казани,23,2017-11-16T18:36:47.000Z,23585,1806,24,202,False
sotavision,19,17.24.12,Павел Грудинин ответил безумному единороссу,25,2017-12-23T15:39:34.000Z,85324,4553,92,1635,False
ВкусноПросто иПолезно,19,17.28.12,5 Самых Вкусных и НЕдорогих Салатов К Новому Году. Обалденные Салаты на Праздничный Стол,22,2017-12-27T05:17:36.000Z,46030,1195,48,29,False
Соболев Илья,19,17.25.11,СОБОЛЕВ ИЛЬЯ - СОБОЛЕВ ИЛЬЯ ПРОТИВ НИКОЛАЯ СОБОЛЕВА,23,2017-11-24T07:58:13.000Z,60163,6229,768,583,False
Саранча,19,17.18.11,АШАН / Садитесь в тележку покатаю по Ашану :) 16.11.2017,22,2017-11-17T06:00:00.000Z,10726,259,80,56,False
iling show,19,18.05.01,"BATON. Занизь УАЗ, или сдохни в попытках.",2,2018-01-04T10:06:45.000Z,62569,3372,291,367,False
Зуби МузЗайка,19,17.26.11,С Днём Матери! Красивое поздравление на праздник день матери ZOOBE Муз Зайка,22,2017-11-25T14:00:01.000Z,36467,665,63,37,False
ТИЛЭКС,19,17.24.12,"Элджей, KIZARU, Face, БАСТА, АК-47, ЛСП и другие переделывают POST MALONE - ROCKSTAR (ft. 21 Savage)",22,2017-12-23T11:39:10.000Z,177470,22119,2295,1087,False
Alisa DIY,19,17.01.12,ЛИЗУН СВОИМИ РУКАМИ ПРОТИВ СЛАЙМ ИЗ МАГАЗИНА |НОВЫЙ РЕЦЕПТ ЛИЗУНА |КАНАЛ С ЛИЗУНАМИ |Alisa DIY slime,24,2017-11-30T14:23:17.000Z,78360,6459,318,3108,False
Siyah İnci,19,17.17.11,Siyah İnci 8. Bölüm,22,2017-11-16T20:48:16.000Z,201587,2883,234,322,False
Top Five,18,17.14.11,10 СЛУЧАЕВ МОМЕНТАЛЬНОЙ КАРМЫ,24,2017-11-13T16:00:17.000Z,116081,8739,235,327,False
Про животных и не только!!!,18,18.04.01,"Он подъехал к кофейне и выпустил из машины собаку, делая вид, что не знает её!",19,2018-01-03T11:43:58.000Z,7297,299,9,28,False
itpedia,18,17.12.12,МОЯ ЛУЧШАЯ ПОКУПКА - DJI Mavic PRO,28,2017-12-11T13:18:19.000Z,483246,54683,1475,3723,False
RADIO TAPOK,18,17.09.12,Rammstein - Links 2 3 4 (Cover на русском | RADIO TAPOK | Кавер),10,2017-12-08T19:10:21.000Z,87605,17452,238,1450,False
ND Production,18,17.14.12,Пародия на MANS NOT HOT - BIG SHAQ (The Ting Go Skrra),10,2017-12-13T18:10:55.000Z,94594,10302,1501,588,False
Masha Zoom,18,18.22.02,ШАР LOL PETS И РАСКАЛЕННЫЙ НОЖ В 1000 ГРАДУСОВ ЭКСПЕРИМЕНТ УНИЧТОЖАЮ ШАР ЛОЛ ПЕТС LOL ПИТОМЦЫ,24,2018-02-21T12:00:03.000Z,25920,982,188,349,False
Удивительные Факты,18,17.03.12,"Все, что произойдет до 2050 года",29,2017-12-02T08:01:13.000Z,133379,3604,264,555,False
ADINI SEN KOY ASK_ZEHOM_AİLESİ,18,17.25.11,Adını Sen Koy 226-227.bölüm fragmanı😲😲😲,22,2017-11-24T16:04:17.000Z,83775,565,14,120,False
Thoisoi,18,17.19.11,Ксенон - САМЫЙ ЯРКИЙ ГАЗ НА ЗЕМЛЕ!,27,2017-11-18T11:00:46.000Z,142024,9034,150,346,False
Макс Брандт,18,17.15.11,"МАКС +100500 ОТКРЫЛ РЕСТОРАН / ЧЕСТНЫЙ ОБЗОР / СОРЯН, МАКСОН",24,2017-11-14T10:53:56.000Z,205319,10183,521,741,False
Nastya Tyman,18,17.19.11,Массовое ДТП во Владивостоке выпал первый снег,2,2017-11-18T11:09:56.000Z,98398,3703,187,1187,False
GAZ,18,17.24.11,ТЕСТЫ ОХРАННИКОВ МИЛЛИАРДЕРОВ,24,2017-11-23T16:00:09.000Z,27375,721,69,37,False
Svetoy Enot,18,18.05.01,Что ждет Путинскую систему в 2018 году,29,2018-01-05T03:00:01.000Z,2385,178,8,59,False
elena864,18,17.15.11,50 САМЫХ ПОПУЛЯРНЫХ ПОМАД MAC НА ГУБАХ + КОНКУРС,26,2017-11-14T14:06:50.000Z,33165,2871,93,229,False
NHL,18,18.29.01,Nikita Kucherov scores No Shot goal to complete All-Star Game hat trick,17,2018-01-28T23:35:27.000Z,21094,604,8,75,False
Satyr,18,17.16.11,BIG RUSSIAN BOSS. ПАРОДИЯ #14,23,2017-11-15T16:53:03.000Z,327697,42684,2081,2732,False
Elli Di Pets,18,17.16.11,ИДУ К ПОДПИСЧИКАМ ОТДАЮ УЛИТКИ ОТ ЭЛЛИ | Elli Di Pets,15,2017-11-15T11:00:06.000Z,452895,23207,418,19231,False
THE MIR,18,17.26.12,Как Порошенко с Турчиновым на Рождество колядовали,25,2017-12-25T18:23:24.000Z,35900,1778,52,479,False
Zenit Football Club,18,17.21.11,Андрей Аршавин на «Зенит-ТВ»: «Золото-2007 стоит для меня на первом месте»,17,2017-11-20T08:37:26.000Z,21988,656,13,63,False
Ikotika,18,17.19.11,ТИЗЕР [Плохбастер Шоу] (feat. IKOTIKA) Звездные Войны: Скрытая Угроза,23,2017-11-18T11:03:32.000Z,17462,2437,56,172,False
Звездный Капитан,18,17.14.11,"Всё о гигантах из фильма Конг: Остров Черепа (виды, биология, способности)",24,2017-11-13T07:00:00.000Z,119602,7469,96,434,False
AcademeG 2nd CH,18,17.23.11,Неожиданно прекрасный Лиссабон.,22,2017-11-22T17:54:50.000Z,88472,6881,632,531,False
News 7,18,17.02.12,"Три дня, девять километров – и Дания не у дел",25,2017-12-01T08:12:43.000Z,11258,115,3,21,False
SHOW NEWS,18,17.17.11,45-летний Малахов впервые стал отцом !,24,2017-11-16T23:11:13.000Z,23738,645,37,100,False
Margarita Muradova,18,17.21.11,КАК ПОДОБРАТЬ ОБУВЬ ПОД ОДЕЖДУ ЗИМОЙ? ЧТО С ЧЕМ СОЧЕТАЕТСЯ?,26,2017-11-20T05:00:00.000Z,45500,2231,126,443,False
Alena Pogrebnyak / RobinaHoodina,18,17.20.11,СТИЛЬНЫЕ УЖАСЫ + Мои кошмарные фото (часть 2),26,2017-11-19T22:31:04.000Z,22034,1499,139,266,False
ДОМ В ДЕРЕВНЕ,18,17.07.12,Нашёл ТАЙНУЮ комнату! Даже бывший хозяин не знал о ней...,22,2017-12-06T10:40:32.000Z,42222,1062,78,299,False
Denis МЕХАНИК,18,17.27.11,"Автомобильные ХИТРОСТИ, такие лайфхаки вы еще не знали!!",2,2017-11-26T06:13:58.000Z,77895,6623,178,222,False
ТОПЛЕС,18,17.14.11,ЗАМОРОЗКА ЧЕЛОВЕКА + 1 К БЕССМЕРТИЮ — ТОПЛЕС,28,2017-11-12T17:19:59.000Z,1131851,78692,2427,4114,False
Быть Или,18,17.08.12,Сравниваем МИЛЛИАРДЕРОВ РФ и США | Быть Или,29,2017-12-07T10:00:14.000Z,233220,53911,34484,18397,False
Хомки,18,17.04.12,Вечер наших хомячков. Пиратик пропал,15,2017-12-03T17:16:28.000Z,63226,3214,76,1684,False
TOP NEWS: Новости шоу-бизнеса,18,17.10.12,"ЖИЗНЬ ЗВЕЗДНЫХ БЛИЗНЕЦОВ ЛИЗЫ И ГАРРИ ГАЛКИНЫХ: Распорядок дня, питание...",22,2017-12-09T13:31:12.000Z,17940,190,19,15,False
Jove,17,17.27.12,КРОВЬ ИЗ УШЕЙ? ● Новая музыка World Of Tanks!,20,2017-12-26T17:02:46.000Z,147126,9699,1329,1658,False
Домовой TV,17,18.16.03,"🔴Мужчина увидел кота на заборе, подойдя поближе он ужаснулся!",15,2018-03-15T06:59:57.000Z,29286,936,14,102,False
Nik V.,17,18.21.02,Вот это песня!!! Послушайте!!!,10,2018-02-21T02:51:38.000Z,5065,316,10,22,False
Ткачёв Проповеди Православие,17,17.15.11,ЗАЧЕМ всё ЭТО надо? Ткачёв Андрей,27,2017-11-14T08:35:44.000Z,10577,202,8,11,False
#SLOVOSPB PRODUCTION,17,17.14.11,РВАТЬ НА БИТАХ - 495 SQUAD Х CODEKIEV (МЛЕЧНЫЙ / ВАРАБ Х GIGA1 / MARUL),24,2017-11-12T11:59:47.000Z,540442,31477,1668,3522,False
VSRAP Digest,17,17.14.11,ATL —  ЛЮБИМЫЙ РЭПЕР ТВОИХ ЛЮБИМЫХ РЭПЕРОВ #vsrap,10,2017-11-13T17:30:44.000Z,78074,6005,156,390,False
STAVR,17,17.14.11,КТО СТАНЕТ ЧЕМПИОНОМ РОССИИ?,17,2017-11-13T15:00:02.000Z,132772,12053,262,873,False
Инстаграм Лучшее,17,18.09.02,Инстаграм Вайны Новинки [Выпуск 287] Подборка Вайны Недели,23,2018-02-09T06:22:32.000Z,1987,263,6,27,False
NewsOne,17,17.16.11,Джангиров: контролируемые США антикоррупционные органы – это кнут для туземных элит 15.11.17,25,2017-11-15T15:52:46.000Z,6788,274,8,100,False
TRUE,17,17.25.11,Навальный про радиоактивное облако над Россией и молчание властей про это,23,2017-11-23T19:01:15.000Z,81123,3945,3144,759,False
КиноТВ,17,18.17.04,"ПРЕМЬЕРА 2018 ВЫНЕСЛА ТРЕНДЫ - Симптом счастья / Русские мелодрамы 2018 новинки, фильмы 2018 HD",22,2018-04-16T14:36:08.000Z,77544,155,73,27,False
Afinka DIY,17,17.18.11,5 очень быстрых и простых рецептов печенья / Проверяю рецепты из интернета / Фудхаки 🐞 Afinka,26,2017-11-17T13:01:13.000Z,313512,35070,378,2725,False
Eurovision Song Contest,17,18.12.03,Julia Samoylova - I Won't Break - Russia - Official Music Video - Eurovision 2018,24,2018-03-11T19:35:37.000Z,166631,4663,4307,2522,False
PRO Hi-Tech,17,17.09.12,"Titan V вышел, теперь ждем GeForce Volta / Ampere",28,2017-12-08T17:37:40.000Z,38713,3858,48,461,False
VSRAP,17,18.03.02,BOOKER x MOZEE MONTANA - КАЖДЫЙ ДЕНЬ [Prod. by Cloudlight x Xvbirow],24,2018-02-02T12:00:03.000Z,135125,7959,1852,558,False
Екатерина Шульман,17,17.22.11,Проект закона о конституционном собрании и предвыборная турбулентность,22,2017-11-21T00:07:31.000Z,36055,1600,50,247,False
Русские в Германии Germany live-tv,17,18.29.01,🔴СМОТРЕТЬ ВСЕМ ! Путин поставил в тупик Международный олимпийский комитет !,25,2018-01-28T07:00:01.000Z,92782,1176,402,411,False
Denis Rem,17,17.16.11,Обзор нового Audi RS5 2017,2,2017-11-15T15:44:03.000Z,128421,5977,269,458,False
Ваш Первый Канал,17,17.23.11,СРОЧНЫЕ НОВОСТИ! Умер Дмитрий Хворостовский! Подробности смерти!,25,2017-11-22T08:51:08.000Z,24323,122,15,72,False
СТРЕКОЗА,17,17.16.11,Сын Спартака Мишулина предоставил доказательства родства.,29,2017-11-15T17:09:50.000Z,40753,153,29,58,False
zasuverenitet,17,17.17.11,Закон о СМИ-иностранных агентах. Путин извинился перед народом? Евгений Федоров 15.11.17,29,2017-11-16T15:58:54.000Z,5464,212,14,209,False
ddKaba,17,17.17.11,Где живет Леонидыч? Едем за тюнячкой.,17,2017-11-16T22:02:55.000Z,25819,3381,37,1212,False
ХЛЕБ,17,17.18.11,ХЛЕБ - Плачу на техно,10,2017-11-17T18:19:20.000Z,424052,45855,2023,2124,False
SportObzor HD,17,17.15.11,POCCИЯ - ИCПAHИЯ. ПОДРОБНЫЙ OБ3OP MATЧA. 14.11.2017 (HD),17,2017-11-14T20:51:07.000Z,233336,1546,182,551,False
Ксюша Лебедева,17,17.15.11,ВСЕ О МОИХ ЕЛОЧКАХ!!!( 2 часть))Декор на НГ! На Рождество!,22,2017-11-14T12:47:30.000Z,6283,444,7,71,False
Фонд Концептуальных Технологий,17,17.23.11,Вопрос-Ответ Пякин В. В. от 20 ноября 2017 г.,25,2017-11-21T15:22:37.000Z,53646,1071,25,276,False
Искусство харизмы,17,17.17.11,"5 Способов Быть Уверенным, Настойчивым и Энергичным",22,2017-11-16T15:00:00.000Z,20432,1637,83,130,False
Zёбра,17,17.14.11,Многообещающий пистолет с интегрированным глушителем | Разрушительное ранчо | Перевод Zёбры,24,2017-11-13T06:49:42.000Z,129867,10906,70,526,False
Show TV,17,18.14.01,Çukur 12.Bölüm 2.Fragman,1,2018-01-13T17:35:10.000Z,114300,1070,45,121,False
TUMAN KG,17,18.28.04,"АСЕЛЬ КАЙНЕНЕСИН КОРУП,НУРЛАН МЕНЕН МОЩНЫЙ БИЙЛЕДИ,ОТО КЫЗЫДЫ",22,2018-04-27T16:03:12.000Z,145951,1592,171,337,False
Dalbek,17,18.14.01,Все грехи и ляпы аниме Тетрадь смерти (часть 3 из 7),1,2018-01-13T13:26:51.000Z,12187,1341,17,189,False
1.1TV,17,17.24.12,Эл Эмне Дейт? \ 3 сезон \ 1 ВЫПУСК,23,2017-12-23T15:00:03.000Z,59669,2232,64,433,False
/ zaRRubin \,17,17.14.11,AUDI RS4 ИЛИ RS6? #ОДЕРЖИМЫЕ,2,2017-11-13T16:19:13.000Z,100674,8969,134,565,False
ЭфайШоу,17,18.18.04,ДОЧЬ МИЛЛИОНЕРА ОТКАЗАЛА ВЫХОДИТЬ ЗА БЕДНЯКА. И ВОТ ЧТО ОН СДЕЛАЛ!..,24,2018-04-17T12:09:12.000Z,31085,2113,56,78,False
HiMan,17,17.06.12,"СДЕЛАЛ АВТОМАТ ДЛЯ КОНФЕТ ( СКИТЛС, M&M's, ТИК ТАК, ФРУТЕЛЛА )",22,2017-12-05T14:10:33.000Z,550749,23465,686,3598,False
ROBIN,16,17.22.11,"Экспресс Сегодня № 342, Дальше смотрите № 343",22,2017-11-21T13:29:43.000Z,4417,449,3,21,False
Acunn.com,16,18.29.04,"Acun Ilıcalı, Turabi'nin cezasını açıkladı! | 57. Bölüm | Survivor 2018",24,2018-04-28T21:19:30.000Z,622250,7026,2053,3686,False
Время Футбола,16,17.06.12,БАРСЕЛОНА - СПОРТИНГ | ОБЗОР МАТЧА | ЛУЧШИЕ МОМЕНТЫ 5.12.17,17,2017-12-05T22:07:27.000Z,21469,142,10,13,False
Anastasiya Shuchalina,16,17.20.11,"Таро-Прогноз с 20-30 ноября 2017г. Карьера, отношения, здоровье! Таролог Наталья Качанова",1,2017-11-19T10:32:08.000Z,5626,237,20,19,False
ЕГОР,16,17.27.11,ТАЙНА ЗАСТОЯ YOUTUBE feat. ANOIR,23,2017-11-26T16:08:41.000Z,98226,18191,276,1109,False
Царьград ТВ,16,17.02.12,Правда Делягина №10. На вопросы отвечает доктор экономических наук Михаил Делягин,25,2017-12-01T18:13:54.000Z,2728,232,13,43,False
Alan Enileev,16,17.02.12,ВСТРЕЧА С ЛЕГЕНДОЙ – КЕН БЛОК И ЕГО FORD FIESTA! GYMKHANA В АФРИКЕ. ПРОЕЗД С TERRY GRANT. KEN BLOCK.,2,2017-12-01T07:12:13.000Z,91216,2748,172,131,False
А ты знал?,16,18.13.02,"Основные ПРАВИЛА по выращиванию рассады,  главные ОШИБКИ",22,2018-02-12T12:21:07.000Z,4643,480,10,2,False
Виталий Орехов,16,17.18.11,АВТОРАЗБОРКИ let's play,22,2017-11-17T15:05:55.000Z,180668,17901,1495,1282,False
Umeloe TV,16,17.23.11,"Я Такого Не Ожидал! Удивительно, на что способна Вафельница!",26,2017-11-22T13:59:35.000Z,63974,3409,85,250,False
МАКСИМ ФАДЕЕВ,16,17.18.11,SEREBRO  - SECRET (Новая Эра. Тизер нового состава),10,2017-11-17T09:00:55.000Z,248180,5677,476,423,False
ДЗЕРЖИНСКИЙ,16,17.12.12,УБОГИЙ КЛИП МАРЬЯНА РО - МЕГА-ЗВЕЗДА [ОБЗОР И РЕАКЦИЯ] \ УКУСИЛ FACE?,24,2017-12-11T19:23:31.000Z,50070,4107,636,500,False
Fedor Comix,16,17.25.12,"Рик и Морти - ЗАСТАВКА, ПОЛНАЯ ВЕРСИЯ (Мульт-Коллаб)",1,2017-12-24T15:55:04.000Z,147932,25379,401,2778,False
140 BPM BATTLE,16,17.04.12,140 BPM BATTLE: EDIK_KINGSTA X ISLA DE MUERTA,10,2017-12-03T13:39:44.000Z,242119,18941,1401,3978,False
TheRelizzz / STUDIO,16,18.07.05,"Незнакомец СКАЗАЛ 8-летней девочке, чтобы она пошла с ним. Ответ малышки спас ей жизнь #TheRelizzz",29,2018-05-06T11:00:00.000Z,24258,228,16,5,False
60 минут,16,17.29.11,60 минут. Киев действует втайне от ОБСЕ: кого коснется закон О прощении? От 27.11.17,25,2017-11-27T17:57:09.000Z,60840,420,142,551,False
ВПИСКА,16,17.05.12,"Вписка и Жак Энтони: конфликт с Boulevard Depo, клип за 2 миллиона, кто его настоящий отец",22,2017-12-04T08:00:10.000Z,110573,6044,251,950,False
1) Алексей Земсков (zems.pro),16,18.06.01,САМЫЕ ТУПЫЕ РЕШЕНИЯ В РЕМОНТЕ 2003-2018,27,2018-01-05T19:13:42.000Z,55451,3707,470,392,False
Morana Battory,16,17.18.11,Я попала в ролик к Соболеву / Ответка Коле Соболеву [некто не пришел на фан встречу],23,2017-11-17T20:16:14.000Z,36281,5237,1188,993,False
Реакции Братишкина,16,18.12.03,Братишкин смотрит: Трум Трум -10 пранков и лайфхаков для школы / Как пронести гаджеты в школу,22,2018-03-11T16:57:46.000Z,45894,1189,80,236,False
Ник Черников,16,17.17.12,RAVANNA - Всего Лишь Сон (OFFICIAL VIDEO),24,2017-12-16T15:57:39.000Z,286541,14478,2312,1200,False
РИА Новости,16,17.11.12,Две гробницы возрастом около 3500 лет были найдены в городе Луксор (Египет),29,2017-12-10T11:19:31.000Z,4636,18,2,2,False
Ольга Папсуева,16,18.14.01,"КАК НАКРЫТЬ ШИКАРНЫЙ СТОЛ ЗА 5 МИНУТ, КОГДА ГОСТИ НА ПОРОГЕ",22,2018-01-13T16:17:18.000Z,6541,352,22,36,False
Дмитрий ПОТАПЕНКО,16,17.20.11,Дмитрий ПОТАПЕНКО - Новости недели: У государства нет денег на пенсии?!,29,2017-11-19T06:00:01.000Z,83368,5523,91,726,False
МАРМАЖ,16,17.27.12,МАРМАЖ: ГЕНИЙ МАТЕМАТИКИ,1,2017-12-26T20:38:49.000Z,39383,6296,37,331,False
oxxxymironofficial,16,17.16.11,OXXXYMIRON - ОЛИМПИЙСКИЙ TEASER by ALT PAX,10,2017-11-16T05:41:13.000Z,39654,4350,60,216,False
Русское Кино,16,17.03.12,"ЭТОТ ФИЛЬМ СТОИТ УВИДЕТЬ! Сестренка (2017) Русские мелодрамы, новинки",1,2017-12-02T16:00:56.000Z,69157,162,47,15,False
TaLaNT TV SaGyNbAeV,16,18.04.04,Атамбаев сен бүттүң эми кет жогол| ЭРКЕКЧЕ СҮЙЛӨДҮ| Акыркы кабарлар 03.04.18,22,2018-04-03T10:15:13.000Z,122683,2179,199,594,False
Биржа Мемов,16,17.26.12,Новогодняя Биржа Мемов: Вассерман. Агния Огонёк. Дискотека Авария.,22,2017-12-25T18:01:41.000Z,62658,12204,393,910,False
Алексей Знаков,16,17.24.11,НИКОГДА Не Делай ЭТО в Соцсетях! (Если Не Хочешь Проблем),22,2017-11-23T10:31:51.000Z,224336,12080,738,930,False
Den Schmalz,16,17.27.11,Трусики - МЕЖДУ НОГ (НОВЫЙ КЛИП) prod. by ProoVY,10,2017-11-26T15:00:03.000Z,21960,2773,383,289,False
ДНЕВНИК ЕВРЕЯ,16,18.20.03,БОМЖ ОБЕД ЗА 8 РУБЛЕЙ САМЫЙ ДЕШЁВЫЙ ОБЕД В РОССИИ И НА YouTube,22,2018-03-19T12:56:46.000Z,51334,3429,205,1063,False
История Леонида Млечина,16,18.23.01,Банионис и КГБ. В кино и в жизни,22,2018-01-22T17:08:40.000Z,5756,371,6,23,False
ТВ Таджикистан,16,17.21.11,Ахбори ВКД - Сипар (20.11.2017),25,2017-11-20T14:54:53.000Z,40123,199,53,21,False
О Главном TV,16,18.08.01,Гадание на картах. О КОМ ОН ДУМАЕТ СЕЙЧАС♤♡◇♧,26,2018-01-07T14:19:21.000Z,6957,206,14,25,False
MARVEL Россия,16,17.30.11,Мстители: Война бесконечности – тизер-трейлер,24,2017-11-29T13:26:52.000Z,2538435,109010,2028,12998,False
Территория Непознанного,16,17.02.12,У моряков волосы зашевелились на голове.НЛО.Призраки моря.Документальный,22,2017-12-01T19:06:56.000Z,20152,93,19,6,False
BlackStarTV,16,17.02.12,"L'ONE feat. Nel - Хоккеисты (премьера клипа, 2017)",10,2017-12-01T08:00:22.000Z,200053,9400,5049,1019,False
DSC OFF,15,18.05.03,Баста ненавидит BMW? Мотор и подвеска на 600+ л.с. Волгу,24,2018-03-05T06:57:25.000Z,31951,3602,173,543,False
Татьяна Рева,15,17.25.11,НОВИНКИ в моей косметичке✦Парфюм и косметика+КОНКУРС! ТАТЬЯНА РЕВА,26,2017-11-24T10:44:52.000Z,8883,504,15,83,False
HeyHelen ASMR,15,18.26.03,[RU/ENG] Праздничный стрим с котиками АСМР,22,2018-03-25T22:08:15.000Z,13066,564,21,5,False
Alexander Polulyakh,15,17.14.11,Это устройство точно пригодится в домашнем хозяйстве(Хайджек),28,2017-11-13T13:48:13.000Z,148595,7504,450,665,False
Cennet'in Gözyaşları,15,17.27.11,Özlem'den Cengiz'e tehdit! - Cennet'in Gözyaşları 10. Bölüm,24,2017-11-26T19:06:12.000Z,13914,95,2,5,False
ZAMONA UZ tv,15,17.14.11,ХАЖДАГИ ИЛОН ВОКЕАСИ таъсирли ривоят,22,2017-11-13T17:07:00.000Z,14915,603,6,21,False
Склад Чайки,15,17.19.11,Склад Чайки №87: Интервью с Полонским. Продолжение.,22,2017-11-18T19:45:28.000Z,100519,5134,3455,692,False
Vilsa777,15,17.16.11,Таро-прогноз по кармическим кодам на ДЕКАБРЬ-2017 со ВСТУПЛЕНИЕМ,22,2017-11-15T09:55:39.000Z,8419,553,26,61,False
PavlikPavlik,15,17.15.12,Я СЛЕЖУ ЗА ТОБОЙ ПРАНК / ПОДПИСЧИК МАНЬЯК СЛИЛ СЕКРЕТНЫЕ ФОТО АНАНАСТЕНЬКИ / СКОРЕЕ СМОТРИТЕ ИХ,24,2017-12-14T17:29:26.000Z,75591,6234,150,3363,False
Иван Kilin 125rus,15,18.21.02,"Авторынок2018, обвал цен, новый привоз, что творится?",2,2018-02-20T09:11:47.000Z,79662,2056,137,584,False
Владимир Бучко,15,18.15.01,Паника в Кремле. Свержение режима Путина?,25,2018-01-14T15:34:59.000Z,94826,2617,2012,518,False
NHL.COM/RU,15,18.04.02,КОЛАМБУС БЛЮ ДЖЕКЕТС - НЬЮ ЙОРК АЙЛЕНДЕРЗ,17,2018-02-04T04:44:20.000Z,944,21,2,4,False
ItsMyNail_дизайн ногтей,15,17.16.11,❄ ЗИМНЯЯ ВИШНЯ на ногтях ❄ ЗИМНИЙ дизайн ногтей ❄ Дизайн ногтей гель лаком ❄ Nail Design Shellac ❄,22,2017-11-15T15:44:45.000Z,5453,990,5,23,False
Духовный Маяк,15,17.17.11,Протоиерей Владимир Головин. Ответы на вопросы от 11.11.2017 г.,22,2017-11-16T13:58:21.000Z,5334,237,7,3,False
А поговорить?,15,17.30.12,"Тина Канделаки о Дуде, Млечном, Собчак и как управлять сотней мужчин // А поговорить?..",22,2017-12-29T13:00:04.000Z,38952,761,179,188,False
Чудо техники,15,17.23.12,Быстрый обзор | Samsung Galaxy A8 и A8+,28,2017-12-22T14:48:57.000Z,76784,4271,229,569,False
Смотрим TV с Брагиной,15,18.15.01,ДОМ 2 закрывается?,22,2018-01-14T13:27:39.000Z,9875,72,16,23,False
Nickelodeon Россия,15,17.18.11,Черепашки-ниндзя | 1 сезон 11 серия | Nickelodeon Россия,24,2017-11-17T16:00:04.000Z,84883,1254,73,190,False
Дастархан - вкусные рецепты,15,18.09.02,ПАХЛАВА БЕЗ ЗАМОРОЧЕК ☆ Очень простой рецепт ☆ Быстрая пахлава ☆ Ленивая пахлава ☆ Турецкая пахлава,26,2018-02-09T05:54:16.000Z,3969,726,2,58,False
Anny Magic,15,17.31.12,Я РОЖУ РЕБЕНКА или УСЫНОВЛЮ в НОВОМ ГОДУ ВОПРОС ОТВЕТ Anny Magic,24,2017-12-30T10:50:47.000Z,386878,35255,623,12907,False
Jane Rog,15,17.19.11,ВАМ ПОНРАВИТСЯ! ~ КРУТАЯ СУББОТА ♥ Моя неделя,22,2017-11-18T09:00:02.000Z,15069,1100,5,159,False
shok.uz,15,17.08.12,Дилноза Кубаева ва Озодбек Назарбеков ўртасидаги мухаббат ростми?,24,2017-12-07T14:34:43.000Z,33945,437,43,197,False
sonar2050.org,15,17.25.12,Кто загнал Украину в ловушку?,28,2017-12-24T17:25:22.000Z,93282,1533,149,587,False
TJ,15,17.28.12,Ахбори Точикистон(27.12.2017)Москва: Иштироки Э.Рахмон дар чаласаи ИДМ,25,2017-12-27T13:22:44.000Z,41196,271,68,63,False
İstanbullu Gelin,15,17.25.11,Istanbullu Gelin 26. Bölüm,22,2017-11-24T20:46:09.000Z,264341,2779,258,501,False
мой канал,15,17.18.11,"Алина Загитова. Гран при Франции, КП",22,2017-11-17T14:48:17.000Z,28746,228,30,119,False
ЮМОР ICTV - Официальный канал,15,18.25.04,Как пара собирается на пикник – Дизель Шоу | ЮМОР ICTV,23,2018-04-24T09:36:16.000Z,16639,215,9,12,False
АлоЯ Вера,15,18.13.03,ПРИЗРАК В МОЕМ ДОМЕ ЖУТКАЯ РЕАКЦИЯ КОШКИ МИСТИКА | АлоЯ Вера,24,2018-03-12T11:34:39.000Z,93659,4078,168,2933,False
HYPE CAMP,15,17.20.11,"HYPE CAMP // ИГРА НА ВЫБЫВАНИЕ #3 // Катя Клэп, ЯнГо, Anny May, Артем К, Даня Комков",22,2017-11-19T11:00:02.000Z,444399,19415,6477,4881,False
РУСЬ ПРАВОСЛАВНАЯ,15,17.12.12,КОСМИЧЕСКАЯ НЕМОЩЬ РУССКИХ РАКЕТ | космодром восточный неудачный запуск ракеты россии 19 спутников,25,2017-12-11T20:25:30.000Z,4716,293,9,42,False
Merjvac Merjvac,15,17.28.11,Merjvace 407 anons 11 29 17/Մերժվածը 407 անոնս հայերեն/мержвац 407 индийский,22,2017-11-27T19:26:53.000Z,47147,219,11,17,False
Virtus.pro,15,17.28.11,"Solo about #ANTIHYPE, meeting Snax and playing against teammates",20,2017-11-27T10:34:22.000Z,52985,1775,13,87,False
LOBODA,15,17.04.12,LOBODA - Парень [AUDIO],10,2017-12-03T07:02:59.000Z,166188,4416,1165,322,False
Alina Charova,15,18.06.02,КАК КРАСИВО ПОЛУЧАТЬСЯ НА СЕЛФИ | ЛАЙФХАКИ МОДЕЛЕЙ ДЛЯ ФОТО,22,2018-02-05T17:24:44.000Z,14962,1267,39,108,False
The Voice Kids Russia/Голос Дети,15,18.01.02,Интервью с Наставником. Пелагея - Голос.Дети - Сезон 5,24,2018-01-31T11:06:04.000Z,8741,404,7,65,False
BORYMAN TV,15,18.20.01,НЕ ПРИХОДИ ЗАВТРА В ШКОЛУ - БУДЕТ МЯСО! ПОДРОСТКИ УСТРОИЛИ БОЙНЮ В ШКОЛЕ УЛАН-УДЭ!,24,2018-01-19T10:30:28.000Z,12189,441,19,124,False
SNAILKICK,15,17.28.11,#ГОЛОВНЫЕМЮСЛИ: Про синтол и iPhone X,22,2017-11-27T13:53:04.000Z,575183,59096,1646,3649,False
КРИМИНАЛЬНАЯ РОССИЯ,15,18.02.01,ПУТИН ОПОЗОРИЛСЯ НА НОВЫЙ ГОД,23,2018-01-01T21:01:53.000Z,74003,1066,637,470,False
Абрам TV,15,18.31.01,Toyota Mark 2 АВТОХЛАМ или все ОК?!! Ремонт Тойота Марк 2!,2,2018-01-30T12:00:00.000Z,50430,2938,135,462,False
FailArmy,15,17.17.11,A Boatload of Fails: Throwback Fails (November 2017) | FailArmy,23,2017-11-16T14:30:01.000Z,736556,14610,852,708,False
Anton S,15,17.29.11,МУКБАНГ! Лосось и креветки. Как уехать в Норвегию? И зачем это вам надо?,22,2017-11-28T10:01:51.000Z,21994,1610,35,555,False
Рассмеши Комика - Официальный Канал,15,17.19.11,Новый Рассмеши Комика 2017 - 14 сезон - выпуск #11,23,2017-11-18T17:30:03.000Z,52810,544,48,77,False
FUT MAGAZINE,15,18.05.01,"РОНАЛДУ ПОЛУЧИЛ ТРИ ЗАПРОСА НА ТРАНСФЕР, ЛИВЕРПУЛЬ СУДИТСЯ С NIKE, ЛЕМАР ЗАМЕНИТ КОУТИНЬО!",17,2018-01-04T14:37:35.000Z,46978,1703,56,1507,False
Короче Говоря,15,18.16.03,Кто популярнее Грудинин или Путин ?  За 3 дня до выборов Рейтинги кандидатов. Выборы президента 2018,22,2018-03-15T14:10:26.000Z,54417,0,0,1147,False
NataLime,15,17.30.11,Нормальные Люди VS Я ДВА ТИПА ЛЮДЕЙ Нормальные и Я,22,2017-11-29T13:13:49.000Z,175649,10610,203,12080,False
Глеб Волин,14,17.11.12,Россия будет банкротить МОК,25,2017-12-10T07:08:49.000Z,77333,549,129,302,False
Pro-Service Live,14,17.25.12,Шумоизоляция и сюрприз в багажнике LADA Vesta SW Cross. Ободрали Audi S5 Олега Бородатая езда!,22,2017-12-24T08:34:27.000Z,117629,4233,431,279,False
Картавый Футбол,14,17.16.11,ЯТренер. Ник признается в ошибках и информация о доборе!,17,2017-11-15T13:45:26.000Z,70776,5151,123,352,False
Limfina,14,17.23.11,ОБНОВЛЕНИЕ БАЗОВОГО ГАРДЕРОБА | Новинки ОДЕЖДЫ из ФРАНЦИИ,26,2017-11-22T12:07:09.000Z,23904,1102,57,136,False
STAR MONEY,14,17.17.11,ЧТО НОСИТ L'ONE. СКОЛЬКО ДЕНЕГ ТРАТИТ НА ОДЕЖДУ,22,2017-11-16T18:43:55.000Z,41992,1587,162,256,False
Маша Деточкина,14,17.19.11,ДЕТИ ПУГАЧЕВОЙ И ГАЛКИНА: Лиза и Гарри на венчании родителей Аллы Пугачевой и Максима Галкина!,24,2017-11-18T09:52:57.000Z,33313,392,36,77,False
ГОТОВИМ ДОМА,14,17.24.12,"Новогоднее Меню из 12 блюд всего за 4 часа! Шикарный новогодний стол для тех, кто ценит своё время",26,2017-12-23T17:30:59.000Z,23251,1001,54,47,False
Битва екстрасенсів,14,17.20.11,Битва экстрасенсов. Сезон 17. Выпуск 8 от 19.11.2017,24,2017-11-19T21:44:17.000Z,18710,188,48,96,False
Бородатая Езда,14,17.21.11,Пытаюсь УТОПИТЬ свой новенький УАЗ,2,2017-11-20T08:25:12.000Z,221078,8033,3248,951,False
Маринкины Творинки,14,17.20.12,"Салат , как винегрет",26,2017-12-20T00:00:03.000Z,4111,441,8,26,False
Sayyod. Com,14,17.26.11,Муниса Ризаева 2017 концертидан реп+интервью,25,2017-11-24T22:11:49.000Z,56060,0,0,181,False
Pets World,14,18.09.02,СМЕШНЫЕ КОТЫ И ДРУГИЕ ЖИВОТНЫЕ  2018,15,2018-02-08T02:00:01.000Z,18368,260,15,20,False
CivilNet,14,18.05.01,Ներքին Կարմիրաղբյուր․ սահմանապահ գյուղի ամանորյա անցուդարձը,25,2018-01-04T15:10:53.000Z,8290,45,5,3,False
sergeymeza,14,17.15.11,ФОНБЕТ СТАВКИ НА СПОРТ: Серёжа и микрофон #18,23,2017-11-14T13:13:32.000Z,49863,3549,488,897,False
Life,14,17.29.11,Похороны Дмитрия Хворостовского,25,2017-11-28T11:42:31.000Z,45650,140,28,32,False
Блог Юридической Помощи,14,17.16.12,Выплаты Неработающим Пенсионерам Проиндексируют,27,2017-12-15T13:32:32.000Z,17871,322,18,18,False
АКАДЕМИЯ СМЕХА,14,17.17.11,ЛУЧШИЕ ПРИКОЛЫ 2017 НОЯБРЬ #51 | Лучшая Подборка Приколов | ТОПОВЫЕ ПРИКОЛЫ,23,2017-11-16T15:43:58.000Z,110539,4891,395,950,False
Семейная кухня,14,17.05.12,Товары для КУХНИ с Аliexpress/ Стоит ли покупать? ТЕСТ 5.,26,2017-12-04T06:00:02.000Z,62732,2156,66,109,False
ВЗГЛЯД ИЗНУТРИ,14,18.17.03,ГРУДUHUH УСТРОИЛ БYHT B KPEMЛЕ — (16.03.2018) — ПYTUH CAM HE УЙДЕТ,23,2018-03-16T08:30:00.000Z,188392,8999,1175,1474,False
Киножурнал Ералаш Официальный канал,14,17.14.11,Ералаш Столовая моей мечты (№297),1,2017-11-13T10:47:23.000Z,14294,471,30,126,False
TheBrainDit,14,17.06.12,ФИНАЛ. КТО ЖЕ МАНЬЯК? - Hidden Agenda #3,20,2017-12-05T05:00:01.000Z,50469,4585,53,364,False
Новости Кавказа,14,17.19.11,Прокуратуру Дагестана возглавит кандидат из центра,29,2017-11-18T14:04:22.000Z,3657,12,6,0,True
BBC Russian,14,17.15.11,Тереза Мэй обрушилась с критикой на Россию,25,2017-11-14T14:13:54.000Z,6767,227,100,96,False
Stark,14,17.30.11,🎯 Путинскую  ОПГ будут уничтожать по списку.,25,2017-11-28T14:35:36.000Z,50992,3620,49,751,False
Food for thought,14,18.06.01,"APECT П0P0ШEHK0 И ГP0ЙCMAHA, УKP@ИHA БУHTУET - ЕВГЕНИЙ МУРАЕВ 05.01.2018",29,2018-01-05T10:47:47.000Z,19478,138,19,31,False
Голос / The Voice Russia,14,17.18.11,Светлана Иванова и Мария Зиброва. «Бедный Лазарь» - Нокауты - Голос - Сезон 6,24,2017-11-17T20:22:11.000Z,13664,713,19,140,False
Artem Tarasov MMA,14,17.05.12,Разборки DRAGO и D.Masta после баттла / VERSUS BATTLE за кадром,17,2017-12-04T11:07:11.000Z,249649,3033,12401,1589,False
Pandafx,14,17.17.11,ДРАФТ НА ДВОИХ | STAVR,20,2017-11-16T14:01:43.000Z,152721,12539,167,385,False
Сегодня вечером,14,17.20.11,Сегодня вечером. Памяти Эльдара Рязанова. Выпуск от 18.11.2017,24,2017-11-19T00:30:01.000Z,35580,157,25,122,False
Mila Levchuk,14,18.22.01,Как защититься от манипуляторов и агрессоров,27,2018-01-21T16:43:08.000Z,36331,2255,104,345,False
AndreY WolF,14,17.25.11,"Голос. 6 сезон, 13 выпуск. (24.11.2017)",22,2017-11-24T13:50:04.000Z,7199,69,10,14,False
Правовед ТВ,13,17.25.11,Паника в Сбербанке по заявлениям о конвертации по коду 810,27,2017-11-23T16:48:00.000Z,35370,1697,30,413,False
Агния Огонек,13,17.02.12,РУКИ-БАЗУКИ или СИНТОЛ головного мозга. Кирилл Терешин,24,2017-12-01T10:56:36.000Z,214867,14152,759,1711,False
Канал Не Тормози,13,17.08.12,"Непростой ГАЗ 69 на жёстком бездорожье. УАЗ завидует!? Реальный оффроад, грязь, внедорожники 2017.",2,2017-12-07T15:30:00.000Z,32948,1320,42,139,False
Dasha Koshkina,13,17.24.11,Соня с Ромой ПОТЕРЯЛИ Дашину Любимую КОШКУ! Друзья ПРИНЕСЛИ ДРУГОГО ЗВЕРЯ kids children,24,2017-11-23T06:40:20.000Z,487916,4810,1473,1233,False
BobCat ТВ,13,17.19.12,Новые вольеры для рысей!,15,2017-12-18T20:55:17.000Z,10496,1419,42,163,False
Elena Matveeva,13,17.19.11,Как быстро омолодить лицо на 5-10 лет без шприца и скальпеля.,26,2017-11-18T06:25:00.000Z,14865,825,29,22,False
Алёна Венум,13,17.24.11,МОЁ УТРО Если бы нам было 80,22,2017-11-23T12:00:19.000Z,1076612,113381,1712,8615,False
Кэшбери,13,17.30.11,Кэшбери Якутск,27,2017-11-29T05:24:50.000Z,77736,88,409,92,False
ЧОЛПОН ТВ,13,18.20.04,Исаков кетти! Бул үч мырза премьер болууга татыктуубу?,22,2018-04-19T15:45:14.000Z,23368,121,56,192,False
Добрые советы,13,18.01.05,Чистое ЛИЦО! Уже Через Неделю!! ПОТРЯСАЮЩИЙ ЭФФЕКТ !!!,26,2018-04-30T16:00:06.000Z,30098,472,19,3,False
PostNews,13,17.31.12,За 5 минут до Нового Года,25,2017-12-30T16:40:42.000Z,200535,3642,1989,369,False
Сергей Николаевич Лазарев,13,17.12.12,"Нельзя осуждать любимого человека и нельзя мстить, даже мысленно!",22,2017-12-11T20:19:01.000Z,5021,528,4,37,False
ARTPODGOTOVKA,13,17.14.11,Viva la Révolution!,25,2017-11-13T20:06:09.000Z,43489,3570,1732,269,False
Osia,13,17.25.11,Самый ПРОСТОЙ и ЭФФЕКТНЫЙ макияж CAT EYES [OSIA],26,2017-11-24T15:15:07.000Z,25406,1948,81,178,False
navo.tv,13,18.03.02,Armon (uzbek kino) | Армон (узбек кино),1,2018-02-02T06:49:17.000Z,99668,1208,260,444,False
POLITICS GLOBAL,13,18.06.01,Михаил Делягин: Либеральному клaнy сказано - не сметь! 05 01 2018,25,2018-01-05T09:18:16.000Z,13813,173,24,93,False
NATALYA FALCONE from FLORIDA,13,17.14.11,"(1330) ОБЗОР ДОМА С ЛИЧНЫМ САМОЛЕТОМ ЗА $2,500.000!!!  АЖ ДУХ ЗАХВАТЫВАЕТ!",22,2017-11-13T06:00:01.000Z,9617,1118,21,289,False
KG TUBE MEDIA CHANNEL,13,18.19.04,Атамбаевди Кимдер САТЫП Кетти ? ЫЙЛАГЫСЫ КЕЛГЕН Атамбаев !,22,2018-04-18T20:58:38.000Z,42967,427,76,173,False
Семья В селе,13,17.22.11,Бараны и овцы/Стратегический запас в деревне/Хороший сарай-теплый сарай,22,2017-11-21T12:54:50.000Z,9086,391,26,87,False
Афоня TV,13,17.27.12,ВСЯ ПРАВДА О СВИДАНИЯХ С КРАСАВИЦАМИ! Признаюсь в постановах!?,23,2017-12-26T12:13:27.000Z,579326,50349,3907,3571,False
Мастер Сергеич,13,17.04.12,Шкатулка из бобины от скотча. Шкатулка своими руками,26,2017-12-03T06:52:08.000Z,10677,663,12,65,False
RusSmosh,13,17.15.11,КАЖДАЯ КОСТЮМИРОВАННАЯ ВЕЧЕРИНКА ТАКАЯ,23,2017-11-14T16:39:19.000Z,14734,1040,15,50,False
Kentron Channel,13,18.26.04,Ուրվագիծ 25.04.2018 Նիկոլ Փաշինյան,25,2018-04-25T20:45:11.000Z,86858,1668,105,0,True
УСЫ ЛАПЫ И ХВОСТ,13,17.07.12,ЗА ЧТО?!! КРАСНОЯРСКИЕ ПОДРОСТКИ ТАК ОБОШЛИСЬ СО ЩЕНКАМИ,15,2017-12-06T10:57:42.000Z,11119,854,11,275,False
ВЕСТНИК АПОКАЛИПСИСА,13,17.03.12,Алексей Венедиктов - НАВАЛЬНЫЙ ДАЛ KРЕМЛЮ ПPOСРАТЬСЯ!,22,2017-12-02T18:25:55.000Z,7103,110,20,11,False
Дальнобой-Life David KAMAZ,13,18.12.01,Дальнобой. США. Самый интересный груз. Последний рейс в 2017 году.,22,2018-01-11T05:16:33.000Z,82588,6172,56,553,False
Телеканал Ю,13,17.16.11,#ВТЕМЕ: Настасья Самбурская тайно вышла замуж?,24,2017-11-15T09:00:02.000Z,26689,164,17,12,False
Жасмина Рахимова,13,18.29.01,Дилшод новый,22,2018-01-28T16:11:36.000Z,3415,12,9,22,False
лиззка,13,17.23.11,"АНДРЕЙ, КОТОРЫЙ ВСЕ ЗНАЕТ",24,2017-11-22T14:00:02.000Z,238404,26451,3467,1288,False
Арслан Энн,13,17.20.11,механизм спаивания народов России [Арслан Энн],22,2017-11-19T06:21:14.000Z,43760,7054,228,1534,False
Hraparak Oratert,13,18.20.04,"Եթե ես ֆիզիկապես ներկա եմ այստեղ, ուրեմն դուք պարտավոր եք",25,2018-04-19T18:06:03.000Z,31221,755,8,42,False
чебурашка это мышь,13,18.03.01,Лучше бы я рожала - Отходняки жены после новогоднего корпоратива - Этот номер порвал зал до слез,24,2018-01-02T11:23:52.000Z,124460,886,100,18,False
BagaBoom,13,17.06.12,💯ГОТОВЫ К ТОПАМ?💯 (Жду ваши челленджи) . СМОЖЕМ 5000💜 ?,20,2017-12-05T15:32:57.000Z,38650,3274,127,0,False
Yeni Kanal,13,17.08.12,Xalq artisti adı erməni ilə hallanan qızının müdafiəsinə qalxdı: “Şərləməyin”- QALMAQAL,24,2017-12-07T16:03:55.000Z,34914,132,37,53,False
Dead Dynasty,13,17.29.11,"PHARAOH - LOLLIPOP (LIVE) @ GLAVCLUB, MOSCOW",10,2017-11-28T12:18:52.000Z,93626,5702,187,218,False
NHL Россия,13,18.14.04,Стычка Панарина и Кузнецова,17,2018-04-13T04:51:58.000Z,135535,261,136,162,False
Политика Россия - Украина,13,17.22.11,Владимир Соловьев: Речь школьника из России в бундестаге,25,2017-11-21T08:10:41.000Z,13068,120,73,159,False
АНТИПОНТ,13,18.16.01,Ольга Бузова и ЛОБНОЕ МЕСТО с обезьянами ► Оля и Тимур поднялись к БОЛЬШОМУ БУДДЕ,24,2018-01-15T13:35:04.000Z,10604,67,14,9,False
Отель Элеон,13,17.22.11,Отель Элеон - 3 серия 3 сезон (45 серия) - комедия HD,24,2017-11-21T17:00:02.000Z,691522,13239,495,1694,False
Red Lamp,13,17.20.11,Песня в стиле ROYAL BLOOD за 10 минут,10,2017-11-19T06:11:09.000Z,137578,7611,359,502,False
Максим Старосвитский,13,17.23.11,ТИПЫ ЛЮДЕЙ В ЛИФТЕ,23,2017-11-22T15:58:34.000Z,240855,10583,1086,1544,False
Душевный Гороскоп Павел Чудинов,13,17.14.11,гороскоп недели с 13 до 19 ноября Юпитер в скорпионе,22,2017-11-13T06:42:32.000Z,10298,0,0,71,False
MENTAL TV,13,17.17.11,Как Ксения Собчак уходит от вопросов у Дудя на интервью. Вербальный анализ,27,2017-11-16T14:01:15.000Z,92661,6880,284,563,False
Bubble™,13,17.14.11,"10 ЛЮДЕЙ, КОТОРЫЕ СИЛЬНО ОТЛИЧАЮТСЯ ОТ ОСТАЛЬНЫХ",24,2017-11-13T07:00:00.000Z,260279,16124,461,827,False
MAX ПОЯСНИТ,13,17.17.11,LIL PEEP | R.I.P | ПОЧЕМУ ?,10,2017-11-16T13:04:04.000Z,263386,18213,1261,1743,False
SMTOWN,13,17.17.11,Red Velvet 레드벨벳 '피카부 (Peek-A-Boo)' Teaser Part.2,10,2017-11-16T15:00:00.000Z,916731,83326,1052,6884,False
Julia Lanske,13,18.18.01,НЕ ТЕРЯЙТЕ ИНТЕРЕС МУЖЧИНЫ К СЕБЕ - РАСКРЕПОСТИТЕСЬ! Юлия Ланске,27,2018-01-17T15:00:00.000Z,6039,551,4,32,False
Tages spiegel,13,17.14.12,Трагическая новость!!! - Найден МЕРТВЫМ телеведущий...,24,2017-12-13T09:58:48.000Z,27007,46,28,2,False
Ледниковый Период,12,18.02.04,Ледниковый период. Дети. Выпуск от 01.04.2018,43,2018-04-01T19:15:32.000Z,8516,168,15,42,False
Штаб Навального,12,17.16.11,Беспредел и коррупция в Тамбовской области. Почему?,29,2017-11-14T13:00:02.000Z,61838,7140,7259,770,False
Дом 2 с Ириной,12,18.29.01,ДОМ 2 НОВОСТИ раньше эфира! (3.02.2018) 3 февраля 2018.Барзиков переспал с Мариной Тристановной,22,2018-01-28T21:54:37.000Z,2509,33,3,4,False
Netflix,12,17.27.11,Black Mirror - Arkangel | Official Trailer [HD] | Netflix,24,2017-11-25T14:30:01.000Z,1776191,21784,1286,2426,False
Школа Вязания Светланы Коломиец,12,17.18.11,"Обзор Malabrigo, ChiaoGoo, Prym. 1-я часть. Общаемся.",22,2017-11-17T17:38:02.000Z,8830,414,12,26,False
Анимационные сериалы,12,18.19.05,Наследники - Недобрый мир - Исполнение желаний | мультфильм Disney,1,2018-05-17T14:15:01.000Z,39114,748,63,57,False
LIFE | Новости,12,18.12.01,Что Семенов скажет Шурыгиной?,25,2018-01-10T13:42:18.000Z,1085308,17429,2517,2162,False
ТАСС,12,17.22.11,Что подарил Путину Асад,25,2017-11-21T14:06:49.000Z,5864,33,4,8,False
THAI LIFE,12,17.26.12,ИНОСТРАНЦЫ В ШОКЕ ОТ: LITTLE BIG - LOLLYBOMB. ИНОСТРАНЦЫ СЛУШАЮТ РУССКУЮ МУЗЫКУ.,22,2017-12-25T14:26:03.000Z,41685,2627,73,199,False
Sports Genius,12,18.11.03,10 НЕВЕРОЯТНЫХ ПАРАЛИМПИЙЦЕВ В СПОРТЕ,17,2018-03-10T11:33:20.000Z,11908,85,6,8,False
Hochland,12,17.14.11,Сочная кесадилья с курицей,22,2017-11-13T06:51:10.000Z,112851,3566,122,80,False
MeanMachins TV,12,18.12.01,КАК БАЛАНСИТ ПОЛУВЗВОД? 11.01.18 / ВДВОЕМ ПРОТИВ ВСЕХ #Погнали,20,2018-01-11T23:18:06.000Z,40886,3348,151,3,False
Disney Россия,12,17.18.11,Тайна Коко - Третий трейлер,1,2017-11-17T09:26:07.000Z,11768,255,7,6,False
Redenchen,12,18.16.02,КАК ЖИВЕТ КОРОЛЕВСКАЯ СЕМЬЯ БРИТАНИИ,23,2018-02-15T15:42:08.000Z,11859,260,39,51,False
Белая Рысь,12,18.29.01,Почему Путин победит на выборах,29,2018-01-28T09:35:40.000Z,96695,3843,6730,1674,False
Кыргызстан,12,18.04.05,Нурлан Насип суроолорго жооп бералбай такалып 😜😜😜 / Кыргызстан,22,2018-05-03T05:13:01.000Z,61758,405,104,84,False
Архитектор Муравей,12,17.02.12,СРОЧНО! МЕРЗКАЯ ТРОИЦА САТАНОВСКИЙ ПОЛНАЯ ВЕРСИЯ!  01.12.2017,25,2017-11-30T16:52:43.000Z,44092,224,42,106,False
FREA KING,12,17.17.11,"Иностранцы Слушают Русскую Музыку: ЛЕНИНГРАД, TATARKA, ДЕЛЬФИН, МОНЕТОЧКА",43,2017-11-16T05:20:56.000Z,27378,1467,138,426,False
ТНТ4 Телеканал,12,18.24.01,Деньги или Позор. Сезон 2. Выпуск №1. Александр Ревва. (15.01.18г.),23,2018-01-23T17:00:04.000Z,49763,1102,207,116,False
Страшилки от Дядюшки,12,18.19.02,СТРАШИЛКИ НА НОЧЬ - Женщина из ванны,24,2018-02-18T09:16:01.000Z,15995,1455,31,460,False
Реальная Россия,12,17.30.12,Мария Лондон Гады,22,2017-12-29T03:45:05.000Z,90050,5243,146,642,False
News Online,12,17.19.11,Галкин объяснил внезапное венчание с Пугачевой (18.11.2017),25,2017-11-18T10:56:10.000Z,26892,150,54,72,False
Sportfaza Перезагрузка,12,17.01.12,У кого больше БИЦЕПС? ТЕРЕШИН или ТКАЧУК,17,2017-11-30T13:26:10.000Z,118299,4671,327,492,False
Вкусное дело,12,18.15.04,Прижимаем тесто к форме для льда и запекаем. Невероятно!,26,2018-04-14T10:30:01.000Z,65728,3841,80,87,False
Романус,12,17.27.11,ЭТО ПИ*ДЕЦ! Школьница угрожает тюрьмой и вымогает деньги | Новая Диана Шурыгина | Миллер и Анисимова,25,2017-11-26T10:00:01.000Z,77349,7974,759,1328,False
Dunyo Yangiliklari,12,18.28.01,"Тезкор хабарлар,",1,2018-01-27T18:02:20.000Z,44702,375,67,53,False
Pravda GlazaRezhet,12,18.04.01,Русское лото 1212 тираж Новогодний миллиард - 100%  обман. Факты в прямом эфире,22,2018-01-03T17:08:24.000Z,19881,2408,39,506,False
Fancy smth.,12,17.01.12,LOFT PROJECT #10: Новогодний ДЕКОР КОМНАТЫ в стиле ЛОФТ,26,2017-11-30T15:51:24.000Z,48289,8905,39,1418,False
WylsaLive,12,17.23.12,"Итоги: PS4, One X, Mi Mix 2",28,2017-12-22T19:42:00.000Z,38277,2846,180,128,False
Natalina Mua,12,17.18.11,РАСПРОДАЖА КОСМЕТИКИ I 20.11 в 13:00 по Москве,26,2017-11-17T05:00:03.000Z,15189,1343,26,154,False
Дом 2 Новости и слухи,12,17.16.11,ДОМ 2 НОВОСТИ ЭФИР 21 НОЯБРЯ 2017 (21.11.2017),22,2017-11-15T14:22:17.000Z,13745,40,19,7,False
TOPINFORM,12,17.03.12,"Удар по созданию политической церкви в Украине. Андрей Золотарев, Павел Рудяков",25,2017-12-02T16:58:26.000Z,10196,291,15,37,False
Tим Тим,12,17.14.11,"КОРОЧЕ ГОВОРЯ, РЕПЕТИТОР - ТимТим.",23,2017-11-12T14:24:32.000Z,738654,38917,1724,2339,False
KinoKiller Reviews,12,17.02.12,KinoKiller - Тизер,24,2017-12-01T14:43:21.000Z,8710,1085,28,151,False
FloridaYalta,12,17.20.11,🔴 МОИ МАЛЬЧИКИ 🔴 ПОЛНЫЙ ДОМ КРАСОТЫ  АЛИ СЭМ АНДРЕЙ НИКИ 17.11.2017,24,2017-11-19T15:24:37.000Z,9570,244,69,54,False
Аник,12,18.20.04,Мои странные рисунки | Смысл,1,2018-04-06T09:14:20.000Z,17201,737,28,44,False
Barvina,12,18.18.01,"Короче говоря, ТАЙНЫЙ ПЛАН лучшей подруги",24,2018-01-18T03:32:36.000Z,77256,4799,259,1023,False
Sayonara Boy,12,18.14.02,"Элджей - Hey, Guys",10,2018-02-13T17:28:18.000Z,379822,26843,13478,4365,False
ВСЕ О ПОЛИТИКЕ,12,17.29.11,БЮДЖЕТ РОССИИ НА 2018 ГОД. ПОГРУЖАЕМСЯ В НИЩЕТУ,22,2017-11-28T15:06:14.000Z,3867,115,6,20,False
Артур Курильский,12,17.15.11,Доктор Рихтер 3 серия (2017) Мелодрама драма фильм сериал,1,2017-11-14T11:57:41.000Z,11189,26,10,4,False
Просто Озвучка,12,17.15.11,Студентские Мутки | 1 часть,23,2017-11-14T18:52:06.000Z,26641,2294,41,163,False
