channel_title,no_of_vids,trending_date,title,category_id,publish_time,views,likes,dislikes,comment_count,comments_disabled
Troom Troom FR,195,17.14.11,10 RECETTES DIY DE BAUME Ã€ LÃˆVRES Ã€ PARTIR DE BONBONS,26,2017-11-13T13:00:01.000Z,240158,6765,160,935,False
Elhiwar Ettounsi,181,17.14.11,Dimanche Tout Est Permis S01 Episode 08 12-11-2017 Partie 04,24,2017-11-12T22:40:33.000Z,118878,599,93,84,False
sam zirah,173,17.14.11,"Birdyy (Youtube): Agression, Humiliation, Argent, Relation avec des fans...Le roi du Prank se lÃ¢che!",22,2017-11-12T16:00:00.000Z,94634,2911,154,314,False
Lama FachÃ©,171,17.14.11,"10 FILMS que LES PARENTS CROYAIENT ÃŠTRE pour ENFANTS, ALORS que NON | Lama FachÃ©",24,2017-11-12T15:59:38.000Z,653398,27773,2778,3976,False
Marodi TV SÃ©nÃ©gal,169,17.14.11,Pod et Marichou - Saison 2 - Bande annonce - Episode 53,24,2017-11-13T16:01:59.000Z,182280,1894,91,262,False
VikatanTV,167,17.14.11,"Deivamagal Episode 1387, 13/11/17",24,2017-11-13T15:00:01.000Z,387221,2159,1214,711,False
Touche pas Ã  mon poste !,157,17.15.11,Le 20.45 de Camille Combal : spÃ©cial annÃ©es 80,24,2017-11-14T09:31:03.000Z,59115,1078,32,46,False
Ã‡ukur,151,17.14.11,CÌ§ukur 4. BÃ¶lÃ¼m,22,2017-11-13T20:52:13.000Z,35166,2386,125,494,False
Topito,150,17.16.11,Quand tu lis une histoire Ã  un enfant (Feat. Nicolas Berno),24,2017-11-15T16:44:34.000Z,139640,11011,195,263,False
RadaanMedia,147,17.14.11,à®µà®¾à®£à®¿ à®°à®¾à®£à®¿ - VAANI RANI -  Episode 1416 - 13/11/2017,24,2017-11-13T16:30:01.000Z,170707,1152,178,166,False
Lolywood,143,17.14.11,"Emilie, 10 ans, Coach De Vie",23,2017-11-12T15:00:03.000Z,1504950,108635,1562,2913,False
THIRU TV,139,17.14.11,Kuladheivam SUN TV Episode - 771 (13-11-17),24,2017-11-13T14:30:00.000Z,117022,466,135,24,False
Attessia TV,137,17.16.11,L'EMISSION - Ø§Ù„Ø­Ù„Ù‚Ø© 11 Ø§Ù„Ø¬Ø²Ø¡ Ø§Ù„Ø£ÙˆÙ„,24,2017-11-15T20:42:50.000Z,70493,584,125,111,False
France Inter,134,17.14.11,Breaking news politiques - Morin a fait un rÃªve,23,2017-11-13T12:07:32.000Z,3524,53,5,0,False
WatchMojo FranÃ§ais,133,17.15.11,Top 10 PERSONNAGES d'ANIMÃ‰S qui sont complÃ¨tement FOUS !,24,2017-11-14T14:30:00.000Z,86085,3031,137,714,False
BRICO SYMPA,128,17.03.12,16 BRICOLAGES POUR TON BUREAU DONT TU NE POURRAS PLUS TE PASSER,26,2017-12-02T19:00:01.000Z,3065,96,4,11,False
Un gars une fille | Officiel,128,17.15.11,Un gars une fille - et canaille,23,2017-11-14T17:30:00.000Z,46455,1705,30,108,False
Dr Nozman,125,17.15.11,L'OBJET QUI TE DONNE DES SUPER POUVOIRS !,28,2017-11-14T16:51:26.000Z,623627,47807,983,2279,False
Okay.africa,124,17.15.11,MBETTEL - SAISON 2 : Teaser EPISODE 21,22,2017-11-14T22:25:55.000Z,97250,631,39,137,False
NDEKO ELIEZER TOKOKOMA,123,17.14.11,TOKOMI WAPI DU13 11 2017 NINI ElAMUKI  LELO NA CONGO,22,2017-11-13T13:19:40.000Z,28578,445,38,201,False
Zap TÃ©lÃ©,120,17.14.11,[Zap TÃ©lÃ©] LA FIN DE L'INTELLIGENCE (13/11/17),24,2017-11-13T11:08:25.000Z,72519,689,23,362,False
Ã‡a Zap !,114,17.14.11,Carla Bruni-Sarkozy en larmes face Ã  Delahousse - ZAPPING TEÌLEÌ DU 13/11/2017,24,2017-11-13T15:00:01.000Z,9077,97,9,17,False
Wass Freestyle,112,17.16.11,CET ENFANT A BEAUCOUP DE TALENT!,17,2017-11-15T12:00:15.000Z,353142,45226,767,2971,False
TVLibertÃ©s,110,17.15.11,La petite histoire : Les Champs Catalauniques : la Gaule face Ã  Attila,25,2017-11-14T17:00:04.000Z,2597,210,0,12,False
AKRAMJUNIOR DAILY,109,17.19.11,Une Pontiac de folie ! ğŸ”¥,2,2017-11-18T13:38:35.000Z,23349,998,37,113,False
C dans l'air,107,17.14.11,13-Novembre : sommes-nous mieux protÃ©gÃ©s ? #cdanslair 13.11.2017,24,2017-11-13T18:13:04.000Z,2952,25,10,7,False
C Ã  vous,107,17.15.11,Dans la tÃªte d'Eric Cantona - C Ã  Vous - 13/11/2017,24,2017-11-13T19:04:13.000Z,42420,120,43,126,False
The Late Show with Stephen Colbert,105,17.15.11,Kim Jong-Un Hurt President Trump's 'Old' Feelings,24,2017-11-14T08:35:01.000Z,1025278,14065,593,1825,False
Guillaume Pley,105,17.15.11,CARLITO AVOUE DEVANT MCFLY QUâ€™IL A UN S**TOY CHEZ LUI !,24,2017-11-14T17:00:01.000Z,81481,4198,118,71,False
Quotidien,103,17.17.11,Ils sont tous FANS de de Gaulle ! - Quotidien du 10 octobre,24,2017-11-16T17:00:03.000Z,22647,360,34,43,False
EvenProd,103,17.19.11,"IDOLES - saison 3 - Ã©pisode 15 : WuudÃ©, na mu la gise, la lay Ã«wale",1,2017-11-18T20:30:00.000Z,72297,1410,55,670,False
Les Grosses TÃªtes,102,17.14.11,La cuisson des Å“ufs Ã  la coque diffÃ©rente au Mexique,23,2017-11-13T17:21:14.000Z,2042,27,0,1,False
Foot Mercato,96,17.14.11,Patrice Evra Ã©voque son avenir en tractant un 4x4,17,2017-11-13T12:09:13.000Z,48029,1897,173,277,False
SYMPA,94,17.16.11,Le Secret D'un Sommeil RÃ©parateur et D'un RÃ©veil en Douceur,22,2017-11-15T09:55:27.000Z,11158,1113,36,47,False
Les News,93,17.08.12,M.ort de Johnny HallyÂ­day : le lieu oÃ¹ le chanÂ­teur sera enterrÃ© rÃ©vÃ©lÃ©,25,2017-12-07T17:19:13.000Z,19171,92,11,26,False
The Daily Show with Trevor Noah,92,17.15.11,How the Right Politicized Roy Moore's Sexual Misconduct Allegations: The Daily Show,23,2017-11-14T04:30:00.000Z,1059267,21327,476,2119,False
YouCook Cuisine,89,17.15.11,Nouilles sautÃ©es vÃ©gÃ©tariennes - YouCook,26,2017-11-14T16:30:03.000Z,30302,2380,45,192,False
Snapchat RED,88,17.29.11,Ayem (MadMag) a COUCHÃ‰ avec Florent RÃ© (LVDCB3) !! ğŸ˜±ğŸ” LA VILLA DES COEURS BRISÃ‰S 3,22,2017-11-28T15:54:41.000Z,75799,650,56,93,False
LeGossipTube,87,18.23.01,LaetiÂ­cia HallyÂ­day : Ã  quoi ressemblent ses jourÂ­nÃ©es Ã  Los Angelesâ€¯?,17,2018-01-22T13:07:02.000Z,5089,26,7,2,False
atv,86,17.14.11,EÅŸkÄ±ya DÃ¼nyaya HÃ¼kÃ¼mdar Olmaz 80. BÃ¶lÃ¼m FragmanÄ± - atv,24,2017-11-12T17:50:30.000Z,716243,2981,170,302,False
Chouftv - Ø´ÙˆÙ ØªÙŠÙÙŠ,86,17.14.11,Ø´ÙˆÙÙˆ Ø§Ù„Ù„Ø¹Ø§Ø¨Ø© Ø¯ÙŠØ§Ù„ Ø§Ù„Ù…Ù†ØªØ®Ø¨ Ø§Ù„Ù…ØºØ±Ø¨ÙŠ Ø¨Ø¹Ø¯ Ø³Ù‡Ø±ØªÙ‡Ù…  Ø¨Ø¹ÙŠÙ† Ø§Ù„Ø°Ø¦Ø§Ø¨..Ø¨Ù†Øª Ø±ÙˆÙ†Ø§Ø± Ø±Ø§ÙƒØ¨Ø© Ù…Ø¹ Ø¨Ù„Ù‡Ù†Ø¯Ø© Ùˆ Ø¨Ù†Ø´Ø±Ù‚ÙŠ,25,2017-11-13T18:08:46.000Z,324910,2551,566,612,False
TÃ©lÃ©foot,85,17.14.11,"MbappÃ© humilie un partenaire, Evra revient - La Quotidienne #140",17,2017-11-13T17:05:08.000Z,41035,3070,38,3648,False
MLG Highlights,85,17.17.11,Golden State Warriors vs Boston Celtics Full Game Highlights / Week 5 / 2017 NBA Season,17,2017-11-17T03:47:03.000Z,685641,8971,398,4995,False
PanArmenian TV,84,17.14.11,"Õ†Õ¼Õ¡Õ¶ Õ°Õ¡Õ¿Õ«Õ¯, ÕÕ¥Ö€Õ«Õ¡ 46 / Pomegranate seed / Nran hatik",1,2017-11-13T18:30:01.000Z,54031,227,35,72,False
Poisson FÃ©cond,83,17.14.11,Et Si Tout Lâ€™air Disparaissait Pendant 30 Secondes ? (en 360s),27,2017-11-11T17:04:23.000Z,567108,36790,574,2495,False
Verino,82,17.14.11,Facebook lutte contre le revenge porn - VERINO #102 // Dis donc internet...,23,2017-11-11T09:59:12.000Z,233265,12464,266,282,False
Cocovoit,81,17.14.11,Cocovoit - M comme,23,2017-11-13T17:16:37.000Z,55313,4153,97,396,False
Alexandre Calvez,80,17.14.11,FAIRE UNE GLACE ROULÃ‰E (sans machine),26,2017-11-12T18:00:02.000Z,373013,23645,411,813,False
Ã‡a commence aujourd'hui,80,17.22.11,FrÃ¨res et sÅ“urs sÃ©parÃ©s : comment se retrouver ? - Ã‡a commence aujourd'hui,24,2017-11-21T15:00:02.000Z,8175,172,6,29,False
Trash,80,17.14.11,8 PIRES OBJETS de BATMAN,24,2017-11-12T15:30:00.000Z,294947,16263,294,1678,False
Tibo InShape,80,17.17.11,Tibo InShape - Papy InShape (clip officiel),17,2017-11-16T17:00:17.000Z,670446,95714,3103,6802,False
Cauet,80,17.17.11,ENCORE UN GROS MALAISE EN DIRECT !,23,2017-11-16T16:30:01.000Z,26121,865,40,42,False
Aliotop,79,17.16.11,12 Expulsions INJUSTES dans le Foot,17,2017-11-15T09:12:05.000Z,108129,5052,80,433,False
Ligue 1 Conforama,78,17.21.11,Girondins de Bordeaux - Olympique de Marseille (1-1)  - RÃ©sumÃ© - (GdB - OM) / 2017-18,17,2017-11-20T01:38:51.000Z,138309,1352,57,307,False
GameMixTreize,78,17.16.11,MOMO AFFRONTE LE VICE CHAMPION DU MONDE DE TRIAL - IL SAUTE AVEC SON VTT SUR LES COUI**** DE MOMO,20,2017-11-15T18:00:10.000Z,198891,25615,360,4498,False
BIZBIZ,77,17.14.11,LE BARCA VEUT ABSOLUMENT ANTOINE GRIEZMANN !! / LE REAL MADRID A DEJA FIXÃ‰ LE PRIX DE BALE ! ZI#315,17,2017-11-13T16:00:01.000Z,50204,3686,66,708,False
broudge03,76,17.15.11,GÃ©n. De Villiers contredit Macron cette guerre est loin d'Ãªtre gagnÃ©e 13/11,25,2017-11-13T19:21:03.000Z,23084,219,24,142,False
Golden Moustache,75,17.18.11,Papa Bad Buzz,23,2017-11-17T17:00:03.000Z,486287,31084,733,430,False
VDBUZZ,74,18.07.01,1 mot / 1 candidat : Que pense Marvin (LPDLA5) de Maeva ?,24,2018-01-06T11:19:18.000Z,154451,3327,79,172,False
VPM.TV.AlflamMaghribia,74,18.16.02,Samhini Ep 1360 Complet 2M Ù…Ø³Ù„Ø³Ù„ Ø³Ø§Ù…Ø­ÙŠÙ†ÙŠ Ø§Ù„Ø­Ù„Ù‚Ø© 1360 ÙƒØ§Ù…Ù„Ø©,22,2018-02-15T20:23:14.000Z,48848,411,41,17,False
AlloCinÃ© - la chaÃ®ne officielle,74,17.19.11,Les ERREURS dans STRANGER THINGS Saison 2 - Faux Raccord,1,2017-11-18T10:54:30.000Z,93852,4433,52,338,False
madmoiZelle,73,17.14.11,COMMENT BRODER UNE VULVEÂ ? â€” Le DIY de la teuch,24,2017-11-13T17:00:02.000Z,7782,667,24,95,False
WWE,72,17.15.11,"Kurt Angle & The Shield lead a Raw raid of SmackDown: SmackDown LIVE, Nov. 14, 2017",17,2017-11-15T04:22:08.000Z,612569,29520,641,5099,False
Les Anges - La chaÃ®ne officielle,72,17.17.11,ğŸ”¨ Les Vacances des Anges 2 (Replay) - Episode  37 : Vincent et Barbara toujours plus proches,22,2017-11-16T16:33:12.000Z,55892,1021,35,126,False
topvision1,71,17.15.11,"PRINCESSE CaleÃ§on pete  Ep1,Lava,Makambo,Baby,Ebakata,Daday,Darling",1,2017-11-14T11:38:52.000Z,15746,186,7,114,False
SÃ¶z Dizi,71,17.15.11,SÃ¶z | 21.BÃ¶lÃ¼m,1,2017-11-14T00:39:50.000Z,2420770,26900,1686,3621,False
CNEWS,71,18.03.01,Le Zapping des Matinales du 02/01/2018,25,2018-01-02T09:05:12.000Z,6227,16,9,35,False
PewDiePie,71,17.24.11,MEME REVIEW: Stolen Bike Meme,23,2017-11-23T17:51:12.000Z,1294899,139602,2040,14323,False
Malak World - Ø¹Ø§Ù„Ù… Ù…Ù„Ø§Ùƒ,71,17.14.11,Ø­ÙŠÙ„ Ù…Ø·Ø¨Ø®ÙŠØ© ÙˆÙ…Ù†Ø²Ù„ÙŠØ© Ø°ÙƒÙŠØ© Ù…ÙÙŠØ¯Ø© Ø¬Ø¯Ø§ Ù„Ù† ØªØ³ØªØºÙ†ÙŠ Ø¹Ù†Ù‡Ø§ Ø£Ø¨Ø¯Ø§ â¤â¤ Ù…Ù† Ø¹Ø§Ù„Ù… Ù…Ù„Ø§Ùƒ,26,2017-11-13T08:00:00.000Z,49667,4533,186,552,False
BFMTV,71,17.14.11,ScÃ¨nes de liesse et heurts avec la police sur les Champs-ElysÃ©es aprÃ¨s la qualification du Maroc,25,2017-11-12T13:35:30.000Z,13201,106,56,381,False
Pikini Production,70,17.16.11,"DON DIEGO : AÃ¯dara Patra, l'alcool et le chanvre...",24,2017-11-15T14:17:55.000Z,17668,44,3,1,False
douja monde,69,17.20.11,GÃ©ant pancake,22,2017-11-19T15:13:25.000Z,4028,515,21,25,False
HugoDÃ©crypte,69,17.14.11,"TRUMP, CHINE, ARABIE SAOUDITE... RÃ‰SUMÃ‰ DES 5 ACTUS DE LA SEMAINE #3",25,2017-11-12T19:27:44.000Z,35231,3317,39,406,False
AFTER FOOT,69,17.17.11,After Foot du jeudi 16/11 â€“ Partie 5/6 - L'avis tranchÃ© de Philippe Auclair sur Mauricio Pochettino,17,2017-11-16T23:23:13.000Z,2530,0,0,0,True
CoD Forlan,69,17.14.11,J'ai pas lavÃ© ma piscine depuis 30 ans...,24,2017-11-12T19:39:30.000Z,321090,36515,3354,13845,False
Late Night with Seth Meyers,69,17.15.11,Allegations Mount Against Roy Moore; Trump Cozies Up to Putin: A Closer Look,23,2017-11-14T02:09:55.000Z,1503131,20618,607,2676,False
Lexity,69,17.17.11,LES NOUVEAUX GROS TRANSFERTS DU MERCATO HIVERNAL ?!!,17,2017-11-15T17:30:03.000Z,34868,3189,64,308,False
Top Mercato,68,17.14.11,"NEYMAR craque, BENZEMA et les Bleus, RONALDO encore papa, EVRA...",17,2017-11-13T16:00:01.000Z,160173,6226,82,424,False
Jojol,68,17.15.11,iPhone VS Voiture : CarPlay !,28,2017-11-14T16:00:03.000Z,136343,6931,312,505,False
Parents mode d'emploi,67,17.17.11,Parents mode d'emploi - Episode du mercredi 15 novembre 2017,24,2017-11-16T09:16:44.000Z,28490,871,6,15,False
Studio 4,66,17.14.11,Une nouvelle lune - La Petite Mort #4,23,2017-11-12T14:00:02.000Z,172608,8163,95,237,False
SkyrockFM,65,17.25.11,[Titre InÃ©dit] Lacrim Tramontane Feat. SCH #PlaneÌ€teRap,10,2017-11-24T20:45:22.000Z,92563,2881,68,201,False
Ã‰lodieCrÃ©a,65,17.17.11,CRASH TEST DES NOUVELLES PÃ‚TES ANTI-STRESS PUTTEEZ DE CHEZ GIFI (J'ADORE),1,2017-11-16T16:13:23.000Z,8305,441,14,158,False
Booska-P.com,65,18.30.01,"MHD : le tournage d'Afro Trap 10, ses feat. U.S., sa collaboration avec Puma...",24,2018-01-29T18:47:09.000Z,44527,1496,21,102,False
News Studio,64,17.28.12,samhini ep 1324 2M Complete Ù…Ø³Ù„Ø³Ù„ Ø³Ø§Ù…Ø­ÙŠÙ†ÙŠ Ø§Ù„Ø­Ù„Ù‚Ø© 1324 ÙƒØ§Ù…Ù„Ø©,1,2017-12-27T20:18:31.000Z,39074,857,55,79,False
Mediapart,63,17.14.11,"Le fascisme, c'est pas bien, par Usul",25,2017-11-13T11:33:32.000Z,49188,4835,362,914,False
Pr. Rachid Eljay chaine officielle 1,63,17.22.11,Le matin je dois prier Al fajr ou Sobh ?  Rachid ElJay,27,2017-11-20T19:38:43.000Z,10476,707,6,0,True
Regenere / Thierry Casasnovas,62,17.14.11,Questions & rÃ©ponses nÂ°134- www.regenere.org,27,2017-11-13T07:20:17.000Z,8546,326,8,0,True
Al Aoula TV,62,17.17.11,Moummou aynia - Ep 6 - Ù…ÙˆÙ…Ùˆ Ø¹ÙŠÙ†ÙŠØ§ Ø§Ù„Ø­Ù„Ù‚Ø©,24,2017-11-16T00:01:31.000Z,116233,977,57,95,False
Acunn.com,62,18.16.02,Survivor 5. BÃ¶lÃ¼m TanÄ±tÄ±m | Survivor'da Hakan HatipoÄŸlu ÅŸoku!,24,2018-02-15T20:30:41.000Z,518457,3961,424,1493,False
FilmsActu,62,17.17.11,"HOTEL TRANSYLVANIE 3 Bande Annonce VF (Animation, 2018)",1,2017-11-16T15:29:56.000Z,87715,2349,55,91,False
dmc Ø¯Ø±Ø§Ù…Ø§,62,17.21.11,Ù…Ø³Ù„Ø³Ù„ Ø§Ù„Ø·ÙˆÙØ§Ù† - Ø§Ù„Ø­Ù„Ù‚Ø© Ø§Ù„Ø³Ø§Ø¨Ø¹Ø© ÙˆØ§Ù„Ø¹Ø´Ø±ÙˆÙ† - The Flood Episode 27,24,2017-11-20T19:34:58.000Z,404383,2613,210,789,False
koi de neuf? Buzz,62,17.14.11,Michel Sardou : Les rÃ©vÃ©lations inÃ©dit de Louane Emera,24,2017-11-13T00:04:15.000Z,7709,15,7,6,False
TrashTalkProduction,61,17.14.11,Top 10 Meilleurs 2nds tours de Draft All-Time,17,2017-11-13T10:53:54.000Z,23082,1432,17,322,False
CodFamilya _,60,17.14.11,LE CLOWN TUEUR NOUS OFFRE UNE PS4 ! WTF ğŸ˜±,23,2017-11-12T10:57:02.000Z,172561,8406,3015,1610,False
JEAN-LUC MÃ‰LENCHON,60,17.15.11,Â«IL FAUT RÃ‰GLER LA QUESTION DE LA DETTEÂ» - MÃ©lenchon,25,2017-11-13T17:06:25.000Z,29321,3015,18,283,False
On n'est pas couchÃ©,60,17.14.11,JÃ©rÃ©my Ferrari - On n'est pas couchÃ© 11 novembre 2017 #ONPC,24,2017-11-12T00:53:02.000Z,294065,0,0,0,True
RT France,60,17.18.11,Quand le service d'ordre d'Emmanuel Macron repousse un journaliste aux questions qui Â«dÃ©rangentÂ»,25,2017-11-17T10:34:24.000Z,5333,114,6,73,False
5-Minute Crafts,60,17.14.11,26 SIMPLE WAYS TO SPEED UP YOUR EVERYDAY ROUTINE,26,2017-11-13T16:30:00.000Z,803400,15547,1130,955,False
TAREKENIRL,59,17.14.11,LE CLOWN TUEUR VOLE LE McDonald's DE GAMEMIXTREIZE ET MOMO !!,22,2017-11-13T17:04:46.000Z,74384,6123,256,1221,False
"Parlons peu, mais Parlons !",59,17.16.11,Tu m'aimes tu me respectes ! (feat. JHON RACHID - AUDREY PIRAULT) - Parlons peu...,23,2017-11-15T17:30:03.000Z,186276,13990,251,367,False
Doozy,58,17.15.11,ILS RÃ‰AGISSENT AUX ANIMOJIS (iPhone X),24,2017-11-14T18:00:07.000Z,62864,4451,115,535,False
L'atelier de Roxane,58,17.18.11,â™¡â€¢ RECETTE GATEAU INSTAGRAM ARC EN CIEL | + CONCOURS â€¢â™¡,26,2017-11-17T16:00:07.000Z,194906,17177,141,2832,False
cuisinerapide,58,17.15.11,RECETTE DU POULET KFC A MA FAÃ‡ON FACILE (CUISINERAPIDE),26,2017-11-14T10:00:05.000Z,8900,649,17,102,False
VINSKY,58,17.16.11,LA CARTE FUT DE... EUGÃ‰NIE LE SOMMER,17,2017-11-15T16:00:04.000Z,172278,11958,129,636,False
Math se fait des films !,57,17.18.11,CINQ COIFFEURS SONT DÃ‰CÃ‰DÃ‰S PENDANT CE TOURNAGE - RAIPONCE,23,2017-11-17T17:38:57.000Z,215064,30257,124,2579,False
lephoceen,56,17.21.11,Talk Show : Sanson va-t-il prendre le dessus sur Payet ?,17,2017-11-20T18:46:38.000Z,3260,53,4,19,False
Le MÃ©dia,56,17.20.11,Le MÃ©dia fait son point d'Ã©tape,25,2017-11-19T18:49:56.000Z,8410,1025,12,41,False
Catherine et Liliane,55,17.15.11,Catherine et Liliane dÃ©noncent les gens malhonnÃªtes ! Catherine et Liliane  du 13/11 - CANAL+,24,2017-11-14T12:21:57.000Z,7585,211,4,6,False
congofrance,55,17.20.11,"PATSHO RFI CLASH KOFFI OLOMIDE ET FALLY , BOTALA AKOTELI FERRE GOLA et JB MPIANA",25,2017-11-19T11:12:14.000Z,8509,84,21,45,False
Sen Anlat Karadeniz,55,18.25.01,Sen Anlat Karadeniz 1.BÃ¶lÃ¼m,24,2018-01-24T19:31:31.000Z,124921,4706,117,724,False
Mcfly & Carlito,55,17.14.11,ON VOUS DÃ‰VOILE NOTRE VRAI SALAIRE,24,2017-11-12T08:59:25.000Z,2340941,200598,6018,7575,False
J'suis pas content TV,54,17.18.11,"J'SUIS PAS CONTENT ! #114 : Trump VS Asie, Vodka FrelatÃ©e et WW3 !",23,2017-11-17T16:22:08.000Z,33959,2988,37,346,False
MGR PRODUCTION,53,18.19.02,Episode 2 - Al-Beet Al-Kebeer | Ø§Ù„Ø­Ù„Ù‚Ø© Ø§Ù„Ø«Ø§Ù†ÙŠØ© 2 - Ù…Ø³Ù„Ø³Ù„ Ø§Ù„Ø¨ÙŠØª Ø§Ù„ÙƒØ¨ÙŠØ±,24,2018-02-18T17:48:07.000Z,88377,809,52,67,False
Greg Guillotin - Nou,53,17.15.11,Pranque : Le serveur amnÃ©sique,23,2017-11-14T16:04:08.000Z,527677,38597,416,1422,False
koi de neuf?,53,17.19.11,Qui est la fille cachÃ©e de Delon,24,2017-11-18T18:33:53.000Z,3682,12,0,3,False
Mohamed Henni,53,17.23.11,PSG VS CELTIC 7-1 DEBRIEF (REMONTADA),17,2017-11-22T22:06:34.000Z,47231,2892,202,669,False
Aurelien Fontenoy,52,17.14.11,QUI SAUTERA LE PLUS HAUT ? (VÃ‰LO SKATE ROLLER TROTTINETTE),17,2017-11-13T16:30:03.000Z,141695,8091,72,481,False
CokaÃ¯n.fr,52,17.28.11,Cette semaine sur CokaÃ¯n.fr #007,24,2017-11-27T14:56:12.000Z,145219,2617,148,324,False
FailArmy,51,17.14.11,The Best 29 Fall Fails: FailArmy Hall of Fame (November 2017),23,2017-11-12T15:30:01.000Z,1128693,20074,1330,1320,False
LE GRAND JD,51,17.24.11,L'EXPLICATION DU MANOIR HANTÃ‰,24,2017-11-23T20:07:46.000Z,621322,95054,1312,12169,False
Gu'Live,51,17.19.11,EVAN&MARCO CHANTENT BIGFLO ET OLI [DOMMAGE],24,2017-11-18T07:51:42.000Z,10435,507,25,37,False
FastGoodCuisine,51,17.16.11,COMMENT FAIRE UNE PIZZA VOLCAN !? (PÃ¢te Ã  pizza maison),26,2017-11-15T13:00:00.000Z,153121,10517,312,1121,False
TSHANGU TV1,51,17.20.12,Actu ExpliquÃ©e 19.12 : Quand un Policier donne de leÃ§ons de stratÃ©gie Ã  FÃ©lix Tshisekedi,25,2017-12-20T00:05:56.000Z,12187,283,39,196,False
Aperotube,51,17.16.11,Les plus gros COMPLEXES des YOUTUBEURS 2,22,2017-11-15T15:06:22.000Z,91956,3977,66,172,False
TechNews&Tests,50,17.16.11,Google Home Mini VS YouTubers feat. Anonimal et Mastu,28,2017-11-15T17:03:35.000Z,130215,8214,143,259,False
LinksTheSun,50,17.03.12,Qui est le plus con des trois ?,24,2017-12-02T17:00:07.000Z,151679,13680,210,741,False
Zap Koreus,49,17.18.11,Zap Koreus nÂ°256,23,2017-11-17T18:53:39.000Z,32846,234,20,34,False
FabienOlicard,49,17.18.11,DE NOUVEAUX MOTS NAISSENT POUR DE NOUVELLES EMOTIONS,24,2017-11-17T16:00:08.000Z,52715,4258,55,507,False
Tomahawktuning,49,17.15.11,Projet custom mob CafÃ© Racer Ã  vario,2,2017-11-14T11:45:02.000Z,4617,453,7,107,False
L'Effet Papillon,49,17.14.11,Malte : Je suis Daphne - Lâ€™Effet Papillon â€“ CANAL+,24,2017-11-12T15:06:39.000Z,15222,186,6,22,False
Ivan Bede,49,17.24.11,IVAN - QUAND T'ES EN BOIÌ‚TE DE NUIT ET QUE..,23,2017-11-23T18:00:16.000Z,251866,16964,165,233,False
RTL - Toujours avec vous,49,17.17.11,"Ã‰ric Zemmour : Entre Mediapart et Charlie Hebdo, c'est la guerre des gauches",25,2017-11-16T08:39:40.000Z,12722,138,27,68,False
FÃ©dÃ©ration FranÃ§aise de Football,48,17.14.11,"Equipe de France : Les Bleus Ã  Cologne pour Allemagne - France, reportage I FFF 2017",17,2017-11-13T14:42:02.000Z,50535,1930,21,178,False
Forlan TV,48,17.21.11,La cage n'a pas pu le sauver...,22,2017-11-20T17:28:33.000Z,26693,3235,138,2504,False
gamepley,48,17.14.11,COMMENT ASSOMMER UN POTE EN 4 COUPS ?,20,2017-11-12T16:00:05.000Z,207278,8984,482,283,False
GMK,48,17.14.11,Je change la ligne d'Ã©chappement de ma C63s AMG !!,2,2017-11-13T16:00:07.000Z,166132,13758,156,1042,False
Oum Walid,48,17.25.12,Ù…Ø·Ø¨Ø® Ø§Ù… ÙˆÙ„ÙŠØ¯ ÙˆØ¬Ø¨Ø© Ø´ØªÙˆÙŠØ© ØªØ­Ø¶Ø± ÙÙŠ 15 Ø¯Ù‚ÙŠÙ‚Ø© ( Ø´ÙˆØ±Ø¨Ø© Ù…Ù‚Ø§Ø±ÙˆÙ† ),22,2017-12-24T06:00:02.000Z,120622,6412,617,1139,False
GOLAZO TV,48,17.19.11,Leganes vs Barcelona 0-3 - All Goals & Extended Highlights - La Liga 18/11/2017 HD,17,2017-11-18T17:14:01.000Z,1875142,11395,685,1115,False
kifache.tv,48,17.18.11,Ø£Ø¯ÙˆÙ…Ø© ÙÙŠ Ù‚ÙØµ Ø§Ù„Ø§ØªÙ‡Ø§Ù….. Ø£Ù†Ø§ Ø±Ø¬Ù„ ÙˆÙ†Øµ!,25,2017-11-17T16:41:32.000Z,197128,1790,397,551,False
hasan mehdi,47,17.19.11,samhini 1296,1,2017-11-17T21:35:52.000Z,34985,307,30,33,False
France 24/7,47,17.07.12,"Mort de Johnny Hallyday : les mots de Laeticia, Laura, David",22,2017-12-06T10:20:57.000Z,78352,420,65,165,False
Non Stop Reality,46,17.15.11,Vanille s'tape l'incruste chez Julien Tanti : La Pizzeria des FratÃ©s ! (EXCLU VIDEO),22,2017-11-14T16:02:16.000Z,2410,41,0,0,False
BEST OF CULTES,46,17.21.11,Quand les soldats pÃ¨tent les plombs (fails/dodos/chants),23,2017-11-20T15:32:40.000Z,69885,1598,49,73,False
2MTV,46,17.17.12,Ø§Ù„ÙÙƒØ§Ù‡ÙŠ Ø±Ø´ÙŠØ¯ Ø±ÙÙŠÙ‚ Ø¶ÙŠÙ Ø±Ø´ÙŠØ¯ Ø§Ù„Ø¹Ù„Ø§Ù„ÙŠ - Ø§Ù„Ø­Ù„Ù‚Ø© Ø§Ù„ÙƒØ§Ù…Ù„Ø©,24,2017-12-16T11:31:21.000Z,145092,2183,221,167,False
SANTÃ‰ ZEVO,46,18.08.01,"Cancer, dÃ©cÃ¨s brutal : les difficiles Ã©preuves traversÃ©es par France Gall",22,2017-12-29T11:33:46.000Z,32729,64,18,14,False
å¤§åŠ‡ç¨æ’­,46,17.14.11,çŒåœº | Game Of Hunting 14ã€TVç‰ˆã€‘ï¼ˆèƒ¡æ­Œã€å¼µå˜‰è­¯ã€ç¥–å³°ç­‰ä¸»æ¼”ï¼‰,1,2017-11-13T16:00:02.000Z,48796,99,19,73,False
AstronoGeek,46,17.18.11,Une planÃ¨te plate. Vraiment. - AstronoGeek #26,28,2017-11-17T19:00:02.000Z,58576,9417,88,906,False
Le Woop,46,17.25.11,En TT #11 #BalanceTonPorc,23,2017-11-24T17:07:28.000Z,355264,29257,320,756,False
VodK,45,17.23.11,DUEL DE PÃ‰TANQUE,23,2017-11-22T17:01:25.000Z,522525,55422,1357,2196,False
Mamytwink,45,17.17.11,â€‹On a quelque chose Ã  vous dire !,24,2017-11-16T17:00:31.000Z,128547,11614,154,631,False
SQUEEZIE,45,17.14.11,LES PIRES DOUBLAGES FRANÃ‡AIS,23,2017-11-10T18:25:25.000Z,3641421,218587,5809,12649,False
FIRST TEAM,45,17.14.11,OKC THUNDER : QUELLE IDENTITÃ‰  ? First Talk NBA #32,17,2017-11-13T17:00:01.000Z,15580,1231,21,454,False
Dans Ton Corps,45,17.16.11,LE SYNDROME D'EHLERS-DANLOS (MARGOT),23,2017-11-15T17:00:05.000Z,103987,5959,108,535,False
RFM France,45,17.14.11,Le Bret Du Faux sur RFM / Lundi 12 Novembre 2017,22,2017-11-13T11:58:45.000Z,4547,81,6,4,False
CYR!L,44,18.17.01,CYR!L - MA PLUS BELLE ANNÃ‰E !,23,2018-01-16T18:14:31.000Z,295322,55802,210,3794,False
CLIQUE,44,17.17.11,"Clique x Ninho, partie 2 : Â« je rÃ´de sur YouTube, comme tous les autres ! Â»",24,2017-11-16T17:00:04.000Z,63417,3003,34,147,False
DieudonnÃ© Officiel,43,17.14.11,DieudonnÃ© et les commÃ©morations du 13 novembre / Marseille jean claude gaudin macron,23,2017-11-13T18:08:26.000Z,14830,875,35,153,False
MaÃ®tre GIMS,43,17.13.12,MaÃ®tre Gims - CamÃ©lÃ©on (Clip Officiel),10,2017-12-12T22:57:51.000Z,66940,8948,268,693,False
Montreux Comedy,43,17.16.11,"Rachid Badouri - Immigration, la douane",23,2017-11-15T17:00:05.000Z,37540,2292,77,73,False
LMDLT Le Meilleur de la tÃ©lÃ©vison,43,17.17.12,DÃ©couvrez qui a Ã©tÃ© Ã©lue Miss France 2018 ! zap tv,24,2017-12-17T00:30:06.000Z,7278,122,13,87,False
TV Replay,43,17.16.11,MALAISE TV & LES PIRES K-SOS DU NET ! #12,23,2017-11-15T17:20:01.000Z,39869,749,69,112,False
Nicolas RABEMANANJARA,43,17.22.11,VAOVAO DU 21 NOVEMBRE 2017 BY TV PLUS MADAGASCAR,25,2017-11-21T18:59:40.000Z,3465,19,6,8,False
INTHEPANDA,43,17.14.11,6 CRITIQUES OCT/NOV (Thor 3 / Carbone / Au Revoir LÃ  Haut),1,2017-11-12T12:59:45.000Z,102804,6306,179,421,False
"Amour, Gloire et BeautÃ©",42,17.15.11,"Amour, Gloire & BeautÃ© - Episode 7275",22,2017-11-14T10:00:55.000Z,4731,21,5,3,False
OKLMofficial,42,17.21.11,LACRIM - AUREVOIR MERCI,24,2017-11-20T15:57:38.000Z,152507,3602,88,177,False
Ch3Thailand,42,17.21.11,à¸šà¹ˆà¸§à¸‡à¸šà¸£à¸£à¸ˆà¸–à¸£à¸“à¹Œ BuangBunjathorn EP.7 à¸•à¸­à¸™à¸—à¸µà¹ˆ 4/9 | 20-11-60 | Ch3Thailand,24,2017-11-20T17:00:06.000Z,48340,128,12,16,False
RedsTech,42,17.10.12,Ù‡Ø¯Ù Ø¹Ø§Ù„Ù…ÙŠ Ù„Ù…Ø­Ø±ÙˆØ² Ø±ÙˆØ¹Ø© Ø¬Ù…ÙŠÙ„ Ø¬Ø¯Ø§ 09/12/2017 Ùˆ Ø¬Ù†ÙˆÙˆÙ† Ø§Ù„Ù…Ø¹Ù„Ù‚ Ø§Ù„Ø¬Ø²Ø§Ø¦Ø±ÙŠ,17,2017-12-09T18:34:49.000Z,178224,1078,51,192,False
JuniorTV,42,17.18.11,L'HOMME BIZARRE..,23,2017-11-17T16:58:19.000Z,94512,9033,147,673,False
Durendal1,41,17.26.11,Vlog - L'ExpÃ©rience Interdite - Flatliners,24,2017-11-25T11:00:08.000Z,30712,1167,27,161,False
Politique Francaise 2,41,17.24.11,Standing Ovation Pour DieudonnÃ©: Indignation de Valls ! 22/11,24,2017-11-22T12:39:59.000Z,48644,190,82,350,False
Le Sport avec CANAL,41,17.15.11,Qualifications Coupe du Monde 2018 - Italie / SuÃ¨de,17,2017-11-13T22:21:01.000Z,353422,2106,204,793,False
Rhematv Live,40,17.22.12,Operation Boma MOKONZI Boma tous les hommes politique congolais Corompus Traitre.,1,2017-12-21T19:09:20.000Z,7488,0,0,16,False
LE ROI DES RATS,40,17.18.11,Quand les YouTubers vous arnaquent ! (MISS BONGO),25,2017-11-17T16:02:07.000Z,351347,34911,348,2743,False
RTV KLAN,40,17.20.11,E diela shqiptare - Ka nje mesazh per ty - Pjesa 2! (19 nentor 2017),24,2017-11-19T14:07:08.000Z,75233,292,61,36,False
Footstyle TV,40,17.14.11,FOOTBALL VS VTT TRIAL (feat AURELIEN FONTENOY),17,2017-11-12T08:57:42.000Z,173226,7044,134,355,False
Europe 1,40,17.21.11,Emmanuel Macron : Qui c'est le nouveau prÃ©sident d'En Marche ? C'est mon Christophe !,25,2017-11-20T08:28:52.000Z,6036,54,5,18,False
PI-WAN,40,17.25.11,DEGUSTATION : RATION COMMANDO FRANÃ‡AISE !,22,2017-11-24T19:12:34.000Z,40249,2349,61,397,False
AuCinÃ©,40,17.18.11,A CHRISTMAS PRINCE Bande Annonce VF (2017) NETFLIX,1,2017-11-17T09:51:06.000Z,8022,122,6,4,False
HALIRIPA,40,17.14.11,Benzema balance ses dur vÃ©ritÃ©s Deschamps et Les bleus Dans le CFC !,22,2017-11-12T20:16:45.000Z,635236,5945,722,1483,False
Mr.Tom,39,17.17.11,4 Astuces incroyables Ã  faire avec une perceuse,26,2017-11-15T16:30:01.000Z,26673,435,97,30,False
YorgosToys TV,39,17.11.12,4 RECETTES SLIME SANS COLLE DE MES ABONNÃ‰S !!! ğŸ˜± | CRASH TEST #7 + SQUISHIES DE GEARBEAST !!!,24,2017-12-10T17:33:23.000Z,34622,1169,93,1231,False
NORMAN FAIT DES VIDÃ‰OS,39,17.25.11,GROSSE ANNONCE...,23,2017-11-24T16:00:01.000Z,1841835,282509,2616,9342,False
Mag Influenceurs,39,17.14.11,Jazz en PLEINE CRISE DE LARMES: son CHIEN A Ã‰TÃ‰ VOLÃ‰...,22,2017-11-12T20:56:14.000Z,30296,63,10,8,False
Nota Bene,39,17.14.11,L'incroyable Joyau de FranÃ§ois 1er,27,2017-11-13T11:00:23.000Z,53248,5164,43,234,False
Vision Time Tamil,39,18.19.04,Azhagu - Tamil Serial | à®…à®´à®•à¯ | Episode 124 | Sun TV Serials | 18 April 2018 | Revathy | Vision Time,24,2018-04-18T15:45:00.000Z,154729,772,131,59,False
IbraPlus,39,17.15.11,JETER 10.000 CLACS DOIGTS D'UN TOIT,24,2017-11-14T14:30:40.000Z,497087,71052,2617,2193,False
Nouvelles 24h,39,17.18.11,Johnny Hallyday hospitalis.Ã© d'urgence pour dÃ©tress.e respiratoire- [Nouvelles 24h],25,2017-11-17T06:25:07.000Z,21045,71,25,19,False
Le Tatou,39,17.14.11,LQC - Quelle est la rÃ©partition des lettres dans les pÃ¢tes alphabet ?,24,2017-11-11T16:00:02.000Z,430724,26557,323,1875,False
JustInCooking,39,17.21.11,Recette de PralinÃ© Amandes Noisettes Maison,26,2017-11-20T15:30:00.000Z,3082,418,4,116,False
Rapid Highlights,38,17.27.12,"Washington Wizards vs Boston Celtics - Full Game Highlights | Dec 25, 2017 | NBA Season 2017-18",17,2017-12-26T01:07:16.000Z,525055,1231,120,227,False
Le Sportif,38,17.10.12,Le sprint fou de Kylian MbappÃ© qui marque dans le but vide de Lille,20,2017-12-09T17:56:46.000Z,115862,865,57,152,False
Abdelmonaim BOUSSENNA,38,17.16.11,ELLE PORTE LE VOILE ? C'EST BON JE L'Ã‰POUSE ! - IMAM BOUSSENNA,27,2017-11-15T19:12:49.000Z,4237,187,3,13,False
ERTV Officiel,38,17.14.11,LES GAMERS [Version intÃ©grale] - Les Reportages de Vincent Lapierre,25,2017-11-13T14:31:33.000Z,14854,774,34,118,False
PEOPLE TV,38,17.14.11,Son mec lui disait que son engin eÌtait trop gros pour les preÌservatifs. Alors elle lui a envoyeÌ,22,2017-11-13T17:00:33.000Z,11132,50,10,16,False
esepelisa,38,17.14.11,RÃ©alitÃ© 3 Fatou Barcelon Herman Belvie Coquette Vue de Loin Sundiata Modero Mayo Bronly Zidane Souzy,1,2017-11-13T16:00:05.000Z,6708,98,4,31,False
KTOTV,38,17.16.11,Chapelet du 15 novembre 2017,29,2017-11-15T16:15:49.000Z,5606,90,1,15,False
ActualitÃ©s 24h,37,17.15.12,Laeticia Hallyday comment rÃ©agit-elle Ã  lâ€™infidÃ©litÃ© de son homme ?,25,2017-12-14T04:18:22.000Z,9352,10,11,0,False
RAZMO,37,17.14.11,J'ABANDONNE UNE PETITE FILLE DEVANT DES INCONNUS (Social Experiment),24,2017-11-12T18:00:01.000Z,335121,23410,2034,3004,False
Carl is cooking,37,17.14.11,JE FAIS UN HOT DOG XXL EN TROMPE OEIL ğŸŒ­ - CARL IS COOKING,26,2017-11-13T16:00:01.000Z,10052,981,15,201,False
Foot Familya,37,17.14.11,DÃ‰FIS TECHNIQUE INCROYABLE ! FOOTBALL SKILLS,17,2017-11-12T11:30:06.000Z,55916,3258,59,208,False
Panormal,37,17.14.11,JE SUIS PASSÃ‰ Ã€ LA TÃ‰LÃ‰ ! (VOS VIDÃ‰OS FOND VERT #2),20,2017-11-13T02:49:46.000Z,255349,20069,245,950,False
MakhPro boy kl,37,17.20.11,Makhpro boy kl - Immigration clandestine,23,2017-11-19T01:00:15.000Z,203306,5597,183,370,False
MoKeY,37,17.16.11,JE VOUS PRÃ‰SENTE MA COPINE !,24,2017-11-15T10:00:02.000Z,91492,8190,309,1692,False
Et tout le monde s'en fout,37,17.25.11,Et tout le monde s'en fout #16 - Les hommes -,26,2017-11-24T16:30:00.000Z,101257,13964,475,1017,False
DeTeNTe Tv Zap,37,17.14.11,LES PERLES DU NET: Quand la PRISON te rend FOU !!!,24,2017-11-12T20:00:01.000Z,160820,2453,162,323,False
Le Fossoyeur de Films,37,17.21.11,VIRÃ‰E DANS LE HOLLYWOOD ESPAGNOL,1,2017-11-20T16:00:57.000Z,61426,5968,14,337,False
Konbini,36,17.07.12,DÃ©fi Vitesse - Davodka bat le record d'Eminem et Bigflo & Oli !,24,2017-12-06T13:00:01.000Z,3259,185,3,18,False
TheEllenShow,36,17.22.11,Sofia Vergara Wants to See Ellen in Her Underwear,24,2017-11-21T14:00:00.000Z,1002132,16444,598,811,False
Ø§Ù„Ø·Ø¨Ø® Ùˆ Ø§Ù„Ø¨ÙŠØª Ù…Ø¹ Ø§Ù†ØªØµØ§Ø±Intissar's Channel,36,17.14.11,Ø§Ø¬ÙŠÙˆ ØªØ´ÙˆÙÙˆ ÙƒÙŠÙØ§Ø´ Ø¯ÙˆØ²Øª Ù†Ù‡Ø§Ø± Ø§Ù„Ø³Ø¨Øª Ù…Ø¹ Ø§Ø³Ø±ØªÙŠğŸ’• ØŒ ÙˆØ¬Ø¨Ø§Øª Ø³Ø±ÙŠØ¹Ø© ØŒ ÙÙˆØ² Ø§Ù„Ù…Ù†ØªØ®Ø¨ Ø§Ù„ÙˆØ·Ù†ÙŠ ğŸ‡²ğŸ‡¦ğŸ‡²ğŸ‡¦ Ùˆ Ø§Ù„Ù…Ø²ÙŠØ¯...,22,2017-11-13T08:29:45.000Z,59454,3447,241,682,False
FRANCE 24,36,17.18.11,"Toto Riina, le parrain des parrains de la mafia sicilienne, est mort",25,2017-11-17T12:55:16.000Z,8104,21,2,5,False
Reva Ytb,35,17.15.11,ExpÃ©riences fun et faciles Ã  faire Ã  la maisonâ”ƒReva ytb,26,2017-11-14T17:00:05.000Z,18224,1480,21,176,False
Tiboudouboudou,35,17.22.11,Choup'artiste - Des cartes sur nous et un Ponyta petit cochon :p,24,2017-11-21T05:30:00.000Z,17205,1366,15,375,False
VAHEM,35,17.27.11,JE RÃ‰USSIS UN GESTE DE FOU ! ENTRAINEMENT FOOT !,17,2017-11-26T10:01:47.000Z,48848,3795,63,247,False
Le Monde Ã  L'Envers,35,17.17.11,THUG LIFE 3 - Ã‰PISODE 1,23,2017-11-16T17:18:03.000Z,249045,24771,307,2760,False
CinÃ©ma CinÃ©mas,35,17.12.12,Stranger House - Film COMPLET en franÃ§ais,1,2017-12-10T16:30:01.000Z,65780,379,49,40,False
DADJU,35,17.18.11,DADJU - Comme si de rien n'Ã©tait (Clip Officiel),10,2017-11-17T11:17:05.000Z,456759,23279,375,997,False
Mathieu Sommet,35,18.05.02,REÌVEIL DIFFICILE - MATHIEU SOMMET,23,2018-02-04T18:30:01.000Z,400318,54823,5372,8283,False
Captain Popcorn,35,17.29.11,The Walking Dead saison 8 Ã©pisode 6 : avis et analyse,24,2017-11-27T20:42:31.000Z,32001,2683,56,382,False
Saregama TVShows,35,17.08.12,à®µà®³à¯à®³à®¿ | VALLI | Sun TV | Tamil Serial | Episode 1443 - 07th December 2017,24,2017-12-07T17:30:01.000Z,91354,736,89,65,False
TheiCollection,34,17.14.11,iPhone X VS iPhone 1,28,2017-11-12T15:59:17.000Z,142060,19718,455,805,False
Moha La Squale,34,17.20.11,Moha La Squale - RÃ©mi sans famille,10,2017-11-19T16:59:50.000Z,74773,6489,72,450,False
Multiprise,34,17.06.12,ON REVIENT !,22,2017-12-05T17:18:26.000Z,44698,4097,30,177,False
Daniil le Russe,34,17.14.11,DESSINS ANIMEÌS FRANCÌ§AIS VS RUSSES 2 - Daniil le Russe,23,2017-11-13T17:00:38.000Z,482153,76203,477,9580,False
Beni Affet,34,17.14.11,Beni Affet 1253. BÃ¶lÃ¼m,1,2017-11-13T14:18:16.000Z,123529,1370,180,255,False
Yoko-Nailart,34,17.30.11,LES PIRES MANUCURES 4 !,26,2017-11-29T16:00:00.000Z,143627,10971,104,717,False
VU France2,34,17.03.12,vu_du02122017.mov,24,2017-12-02T13:47:13.000Z,3809,36,0,4,False
TutoDraw,34,17.30.11,Je teste du matÃ©riel de DESSIN.. JAPONAIS !,26,2017-11-29T12:44:58.000Z,128543,7894,106,3642,False
BEST OF CULTES 2,34,17.09.12,"Les moments cultes de Johnny Hallyday (bÃªtisier, drÃ´le, blagues)",22,2017-12-07T12:46:44.000Z,37238,673,18,36,False
Dude Perfect,34,17.21.11,Water Bottle Flip 2 | Dude Perfect,17,2017-11-20T23:00:24.000Z,3914524,218330,3066,19437,False
TV congoeuro bis euro,34,18.21.01,20/01/2018 Pasteur Mukuna sort de son silence pona ba Combattants ya poto pe politique botika KABILA,22,2018-01-19T21:40:08.000Z,28486,130,43,53,False
DAYMOLITION,33,17.21.11,"Rentre dans le Cercle - Episode 9 (Georgio, Remy, Josman, Franglish...) I Daymolition",10,2017-11-20T15:00:01.000Z,271234,9862,161,2512,False
Wendy Gaming,33,17.15.11,"Les Marseillais VS le Reste du Monde 2 - Episode 52 HD, du 13 Novembre 2017",22,2017-11-13T23:29:05.000Z,5198,46,3,17,False
GMTV,33,17.15.11,Allemagne vs France 2-2 - RÃ©sumÃ© Complet & Buts - 14/11/2017,17,2017-11-14T22:07:31.000Z,59545,721,30,172,False
Fatemahisokay,33,17.15.11,ÙŠÙˆÙ…ÙŠØ§Øª Ø¥Ù…Ø±Ø£Ø© ÙƒØ§Ù„Ø³Ø© ÙÙŠ Ø§Ù„Ø¯Ø§Ø±: Ø¨ÙŠØµØ§Ø±Ø© Ø²Ø¹Ù„ÙˆÙƒ Ø²ÙŠØªÙˆÙ† Ù…Ø´Ø±Ù…Ù„ Ùˆ ÙƒÙ„Ù…Ø© Ù…Ù† Ø§Ù„Ù‚Ù„Ø¨  English Subtitles,24,2017-11-14T11:40:14.000Z,26832,2327,54,781,False
PSG - Paris Saint-Germain,33,17.15.11,"INTERVIEWS JUNIOR CLUB - Verratti, Marquinhos, Kimpembe, Kurzawa, Rabiot",17,2017-11-14T16:00:03.000Z,25863,1432,14,78,False
ActualitÃ©s People,33,17.01.12,"JOHNNY HALLYDAY : FORTUNE, SALAIRE, VOITURE",24,2017-11-30T08:17:16.000Z,8790,26,12,12,False
MA MISSION TV,32,17.19.11,TRISTRE:HERITIER WATA & CARINE MOKONZI BALELI CHARLY MOBUTU MAWA,22,2017-11-18T16:13:00.000Z,11197,117,18,63,False
MJ - FERMEZ LA,32,17.14.11,Kingsman : Le Cercle d'or (Mickael J Critique),1,2017-11-12T17:58:57.000Z,19487,1596,23,215,False
Le paranormal du 24,32,17.28.11,ğŸ‘» PARANORMAL URBEX - Ã‰PISODE 16 : LE PARC DE JEU HANTÃ‰ [MORGAN PRIEST & DAVID GARCIA],1,2017-11-27T16:00:02.000Z,4876,427,132,264,False
TÃ‰LÃ‰ NEWS,32,17.07.12,Mort de Johnny Hallyday : JoeyStarr tacle M. Pokora,22,2017-12-06T13:49:03.000Z,4015,3,8,3,False
Salut les terriens !,32,17.14.11,"T'es qui toi ? Squeezie, le youtubeur aux 4 milliards de vues - Salut les Terriens",24,2017-11-13T17:30:01.000Z,91051,1674,1903,701,False
Amixem,32,17.15.11,DUEL DE BLAGUES NULLES ! #2 (Vs Google Home),23,2017-11-14T18:00:01.000Z,990009,85649,1284,2266,False
France tv sport,32,18.05.02,"Lucas Chavanat, le nouvel espoir du ski de fond",17,2018-02-04T19:29:53.000Z,1720,20,0,2,False
Didi Chandouidoui,32,17.17.11,THEORIE - SPYRO de retour sur PS4,20,2017-11-16T16:00:51.000Z,39181,4089,59,589,False
6Medias,31,17.19.11,Claude FranÃ§ois n'est pas mort dans sa baignoire,22,2017-11-18T12:56:47.000Z,6843,0,0,0,True
Bodytime,31,17.14.11,LA MUSCULE : LE PATRON (EP9) - Bodytime,17,2017-11-12T17:00:09.000Z,161866,8459,292,193,False
Daily News,31,17.07.12,"Mort de Johnny hakim: Michel Sardou rompt enfin le silence, et lui rend hommage malgrÃ© leur amitiÃ©",24,2017-12-06T16:35:56.000Z,35609,74,27,11,False
Elengi Ya CongoTV Officiel,31,17.20.11,"Enterrement Charly Mobutu Arrivee Heritier Wata Et Vital Kamerhe, Fally Ipupa RepresentÃ© Par B52",22,2017-11-19T13:25:15.000Z,31850,283,38,131,False
SowDred,31,17.02.12,ğŸ”´ DIRECT / LIVE : TIRAGE DE LA COUPE DU MONDE // Club House,17,2017-12-01T16:50:44.000Z,80995,2902,98,166,False
ÙVideo World,31,17.15.11,"Ce mari a trompÃ© sa femme pendant des annÃ©esâ€¦ Mais un jour, il a reÃ§u une carte postale vraiment ...",22,2017-11-13T22:17:21.000Z,13648,33,9,10,False
MOR TV Toop,31,17.14.11,samhini 1292 Complete 2M Ù…Ø³Ù„Ø³Ù„ Ø³Ø§Ù…Ø­ÙŠÙ†ÙŠ 1292 ÙƒØ§Ù…Ù„Ø©,22,2017-11-13T20:38:52.000Z,25364,920,127,53,False
Break News TV,31,18.23.01,ğŸ”´â–¶â–¶Les menssonges des GG sur les femmes musulmanes de nouveau dÃ©voilÃ©s.,22,2018-01-22T17:36:36.000Z,3408,224,9,92,False
Clique Dz,31,18.07.04,Ø§ÙØªØ­ Ù‚Ù„Ø¨Ùƒ Ø§Ù„Ù…ÙˆØ³Ù… 2  Ø§Ù„Ø­Ù„Ù‚Ø© 15 Ù‚ØµØ© Ø³Ù…ÙŠØ± Ùˆ Ø³ÙŠÙ„ÙŠØ§  Ø§Ù„ØªÙŠ Ø§Ø¨ÙƒØª ÙƒÙ„ Ø§Ù„Ø¬Ù…Ù‡ÙˆØ± 04/06/2018 ÙƒØ§Ù…Ù„Ø©,22,2018-04-05T21:57:14.000Z,140349,2378,148,1246,False
Investigations et EnquÃªtes,31,17.23.11,Ces enfants dÃ©linquants volent plus de 1000 â‚¬ par Jour !,24,2017-11-21T16:30:01.000Z,23181,358,30,166,False
Ici Japon,31,17.17.11,Mise en garde sur le Japon (et pas que le Japon),24,2017-11-16T17:31:59.000Z,45239,3883,156,240,False
HervÃ© Cuisine,31,17.15.11,Gateau SAPIN 3D CHOCOLAT ! PremiÃ¨re recette de NOEL 2017,26,2017-11-14T07:00:00.000Z,16947,1221,21,135,False
Bon Apâ€™,31,18.19.01,Un gratin de viande Ã©picÃ©e prÃ©parÃ© en un rien de temps,26,2018-01-18T11:00:00.000Z,4375,223,2,9,False
Christophe Cros Houplon,30,18.08.01,Europe et vagues migratoires,22,2018-01-07T15:29:07.000Z,3330,276,6,119,False
AxoSkill,30,17.14.11,FUT 18 | ON COMMENCE FUT CHAMP EN 10-0 ?!,20,2017-11-12T21:00:21.000Z,63708,3567,65,201,False
L'Ã‰QUIPE,30,17.18.12,Biathlon - CM (H) - Le Grand Bornand : Martin Fourcade remporte la mass start,17,2017-12-17T15:20:11.000Z,5502,65,0,2,False
SNAP TV RÃ‰ALITÃ‰,30,17.04.12,AYEM Ã€ NOUVEAU EN COUPLE AVEC VINCENT MICLET SON EX ?! ğŸ’‘,22,2017-12-03T17:30:44.000Z,19531,92,29,53,False
Bazar du Grenier,30,17.17.11,Critique - Justice League - Avec ET sans Spoil (Spoilers Ã  partir de 12:56),20,2017-11-16T19:00:00.000Z,113172,5717,200,759,False
Snake Reptile,30,17.02.12,COUP DE GUEULE contre la poste ! Un colis explosÃ© ...,24,2017-12-01T19:00:04.000Z,13242,1708,36,465,False
FranÃ§ois Ruffin,30,17.15.11,MIRACLE : UN AMENDEMENT FI ADOPTÃ‰ Ã€ L'ASSEMBLÃ‰E !,25,2017-11-13T15:36:54.000Z,24974,1806,9,157,False
Dakarbuzz,30,17.23.11,Serigne Pape Malick Sy fait rire Le PrÃ©sident Macky Sall et son Ã©pouse MariÃ¨me Faye Sall,24,2017-11-22T19:04:41.000Z,52732,635,54,101,False
Maud Bettina-Marie,29,17.14.11,"ARGENT, HATER, PLACEMENT de PRODUIT : LE POINT SUR YOUTUBE / Maud Bettina-Marie",23,2017-11-12T18:00:00.000Z,117799,14369,95,860,False
e-penser,29,17.21.12,Le vaccin - 41 - e-penser,27,2017-12-20T17:00:04.000Z,141897,20707,621,3229,False
LastWeekTonight,29,17.14.11,The Trump Presidency: Last Week Tonight with John Oliver (HBO),24,2017-11-13T07:30:00.000Z,2418783,97192,6146,12703,False
LEUZTV,29,17.16.12,Entretien exclusif avec Maimouna Bousso sur la dÃ©molition de son domicile,24,2017-12-15T15:46:28.000Z,40087,422,26,229,False
Domino's Ligue 2,29,17.22.11,RC Lens - Chamois Niortais (3-1)  - RÃ©sumÃ© - (RCL - CNFC) / 2017-18,17,2017-11-20T23:41:06.000Z,29656,285,7,50,False
Hibapress,29,17.20.11,Ø´Ø§Ù‡Ø¯Ø© ØªØ±ÙˆÙŠ ÙƒÙŠÙ ØªÙˆÙÙŠØª ØµØ¯ÙŠÙ‚ØªÙ‡Ø§ Ø§Ù„Ù‚Ø§Ø¯Ù…Ø© Ù…Ù† Ø£ÙƒØ§Ø¯ÙŠØ± Ø¨ÙØ§Ø¬Ø¹Ø© Ø§Ù„ØµÙˆÙŠØ±Ø©,25,2017-11-19T19:19:13.000Z,108372,728,72,352,False
Monsieur Faucon,29,17.24.11,Il a voulu jouer avec de la lave... á—’ ÍŸÊ–á—•,24,2017-11-21T17:34:02.000Z,138230,3767,457,554,False
Disney Channel FR,29,17.25.11,Descendants 2 - Tuto danse : What's my name,24,2017-11-24T17:30:02.000Z,8131,626,4,35,False
e-dison,29,18.18.01,15 GADGETS DE SURVIE INCROYABLES QUE VOUS POUVEZ ACHETER SUR INTERNET,24,2018-01-17T16:00:04.000Z,2545,159,2,110,False
Thomas Gauthier,29,17.14.11,No hablo (VidÃ©oclip),23,2017-11-12T17:30:01.000Z,38245,6849,27,332,False
Amaury et Quentin,28,18.17.01,A&Q - LES BONNES RÃ‰SOLUTIONS,23,2018-01-16T16:56:32.000Z,57698,7692,43,154,False
Resumenes FUT,28,17.24.11,Anderlecht vs Bayern Munich 1-2 Resumen Highlights Goals UCL 22/11/2017,22,2017-11-23T00:59:27.000Z,772970,2470,249,323,False
Magnum Productions,28,18.18.05,Awalem Khafeya Series - Ep 01 -  | Ø¹Ø§Ø¯Ù„ Ø¥Ù…Ø§Ù… - HD Ù…Ø³Ù„Ø³Ù„ Ø¹ÙˆØ§Ù„Ù… Ø®ÙÙŠØ© - Ø§Ù„Ø­Ù„Ù‚Ø© 1 Ø§Ù„Ø£ÙˆÙ„Ù‰,24,2018-05-17T20:51:21.000Z,512884,5801,344,544,False
Morgan VS,28,17.19.11,Les PIRES ALCOOLS insolites ! Avec Dylan Del Rey,24,2017-11-18T13:30:01.000Z,106816,6052,126,270,False
Booska-p.com,28,17.14.11,On vous dit tout sur l'album TrÃ´ne de Booba !,24,2017-11-12T12:00:04.000Z,76278,2286,227,229,False
Haroun,28,17.04.12,Ta blague - Ã‰pisode 3 feat. Tim,24,2017-12-03T11:14:19.000Z,55810,2748,61,319,False
AlHayah TV Network,28,18.18.05,Ù…Ø³Ù„Ø³Ù„ Ø£ÙŠÙˆØ¨ | Ø§Ù„Ù†Ø¬Ù… Ù…ØµØ·ÙÙŠ Ø´Ø¹Ø¨Ø§Ù† â€“ Ø§Ù„Ø­Ù„Ù‚Ø© Ø§Ù„Ø£ÙˆÙ„Ù‰ (Ù¡),25,2018-05-17T02:52:04.000Z,1510385,15371,855,1825,False
News France,28,17.16.11,Mimie Mathy Â« pleure son compagnon Â» selon France Dimanche,24,2017-11-15T13:31:56.000Z,4883,6,12,0,False
Labes Ettounsia,28,17.21.11,Elhiwar Ettounsi Live Stream - Ø¨Ø« Ù…Ø¨Ø§Ø´Ø±,24,2017-11-21T03:32:46.000Z,21777,120,15,0,False
koi de 9,28,17.08.12,Johnny Hallyday : sa famille cachÃ©e dÃ©voilÃ©e au grand jour,24,2017-12-07T05:23:04.000Z,7026,40,3,6,False
Wrsh98,28,17.21.12,PSG vs Caen 3-1 - All Goals & Highlights - 20/12/2017 HD,17,2017-12-20T22:46:36.000Z,85441,626,43,68,False
Egyptian Arts Group,28,17.21.12,Ù…Ø³Ù„Ø³Ù„ Ø§Ù„Ø·ÙˆÙØ§Ù† - Ø§Ù„Ø­Ù„Ù‚Ø© 46 ÙˆØ§Ù„Ø£Ø®ÙŠØ±Ø© - Altofan Series Episode 46,24,2017-12-20T19:00:24.000Z,232549,2187,197,887,False
euronews (en franÃ§ais),27,17.26.11,Egypte : le bilan de l'attentat passe Ã  305 morts,25,2017-11-25T20:24:11.000Z,3460,33,12,26,False
S3 Freestyle,27,17.21.11,SOMMES NOUS MEILLEUR QUE: PAUL POGBA ? #Episode4,17,2017-11-20T17:01:27.000Z,59790,3801,51,546,False
ludovik,27,17.23.11,Les FranÃ§ais sont-ils des pigeons ? - Ludovik,23,2017-11-22T17:00:57.000Z,422604,28817,250,917,False
The Tonight Show Starring Jimmy Fallon,27,17.15.11,Jimmy Fallon Pays Tribute to His Mother Gloria,23,2017-11-14T04:55:24.000Z,1611093,58474,837,3294,False
REVOÂ®,27,17.19.12,REGARDEZ CE QUE J'AI TROUVÃ‰ EN VOLANT AVEC MON DRONE ! ğŸ˜±,24,2017-12-18T18:15:21.000Z,24196,2198,505,609,False
Julien ChiÃ¨ze,27,17.16.11,"Cher Thierry Ardisson, j'ai quelque chose Ã  vous dire...",20,2017-11-15T09:19:26.000Z,76624,9119,341,1533,False
Bengous Oueskon Va,27,17.05.12,Montpellier 1-1 OM Match en bois  : Le debrief de Bengous,23,2017-12-04T00:37:11.000Z,60215,1622,93,374,False
TÃ©lÃ© Maroc,27,18.19.05,Ù…Ø±Ø§Ø¯ Ø§Ù„Ø¹Ø´Ø§Ø¨ÙŠ ÙŠÙƒØ´Ù Ø§Ù„ÙˆØ¬Ù‡ Ø§Ù„Ø³Ø§Ø®Ø± Ù„Ù†Ø¹Ù…Ø§Ù† Ù„Ø­Ù„Ùˆ ÙÙŠ Ø¹Ù†Ø¯ÙŠ Ù…Ø§ÙŠÙÙŠØ¯ | telemaroc,22,2018-05-17T21:34:16.000Z,166585,3066,178,521,False
Fimbu na fimbunews,27,17.24.11,URGENT FABREGAS A REAGIR PONA ARRESTATION YA FERRE GOLA ALOBI KOFFI AZA PAPA MOKO MABE,23,2017-11-22T15:56:36.000Z,40216,193,68,119,False
Studio Danielle,27,17.22.11,LA GRANDE SPECIALITÃ‰ DE DANIELLE,23,2017-11-21T16:37:26.000Z,139071,10632,59,1253,False
Ramadan Al Aoula TV,27,18.19.05,Ø§Ù„Ø¯Ø±Ø¨ - Derb - Ep 1,24,2018-05-18T11:44:34.000Z,212492,0,0,124,False
Ø§Ù„Ø®Ø§ÙˆØ© Ù€ Ø§Ù„Ù‚Ù†Ø§Ø© Ø§Ù„Ø±Ø³Ù…ÙŠØ©,27,18.19.05,Ù…Ø³Ù„Ø³Ù„ Ø§Ù„Ø®Ø§ÙˆØ© Ø§Ù„Ø¬Ø²Ø¡ Ø§Ù„Ø«Ø§Ù†ÙŠ - Ø§Ù„Ø­Ù„Ù‚Ø© 1,1,2018-05-18T02:55:33.000Z,549055,11821,699,3739,False
Cyprien,27,17.19.12,PRESQUE ADULTES FIN - LE MARIAGE,23,2017-12-18T16:32:34.000Z,1424196,111414,1374,4415,False
KEES,27,18.17.01,LITerview de Raphou : Vincent Queijo se confie ! | KEES,22,2018-01-16T16:38:23.000Z,28673,799,39,59,False
Toopet,27,17.18.11,MON NOUVEL AQUARIUM D'EAU DE MER !!  - TOOPET,24,2017-11-17T15:00:02.000Z,33564,3063,25,319,False
æ¹–å—å«è§†èŠ’æœTVå®˜æ–¹é¢‘é“ China HunanTV Official Channel,27,18.13.01,ã€ENG SUBå®Œæ•´ç‰ˆã€‘ã€Šæ­Œæ‰‹2018ã€‹ç¬¬1æœŸ 20180112 ç»“å®å§Jessie Jéš†é‡ç™»å ´ï¼æ±ªå³°åŠ²çˆ†å¼€å”±è¶…ç‡ƒæ‘‡æ»šé£ å¼ éŸ¶æ¶µã€Šæ¢¦é‡ŒèŠ±ã€‹ä»™æ°”é£˜é£˜ The Singer 2 EP1ã€æ¹–å—å«è§†å®˜æ–¹ç‰ˆã€‘,24,2018-01-12T14:59:54.000Z,240336,1526,165,1880,False
Frank channel,27,17.08.12,"Mort de Johnny son ex-femme Adeline BlonÂ­dieau poste une image, les fans sâ€™inÂ­dignent",22,2017-12-06T19:15:23.000Z,47154,48,168,25,False
NURÃ‰A TV - Le mÃ©dia qui met les MystÃ¨res en LumiÃ¨re,26,17.15.11,13/11/17 Â« Que sait-on vraiment de lâ€™Egypte Ancienne ? Â» avec Jan Niedbala - NURÃ‰A TV,19,2017-11-13T21:58:23.000Z,11825,336,30,31,False
Maroc Akhbar Yawmia,26,17.05.12,Ù†Ø§ÙŠØ¶Ø© Ø¨Ø¹Ø¯ Ø§Ø¹ØªØ±Ø§Ù Ø­Ù…Ø²Ø© Ø¹Ù„Ù‰ Ø®Ø§Ù„Ùˆ Ù…Ø´ØªØ±ÙŠ ÙˆØ³Ø· Ø§Ù„Ù…Ø­ÙƒÙ…Ø©,25,2017-12-04T18:24:44.000Z,33974,97,23,16,False
NBA,26,17.14.11,"Top 5 Plays of the Night: November 12, 2017",17,2017-11-13T05:12:03.000Z,226660,2501,145,224,False
Cassandra Bardinal,26,17.24.12,Les trois visages d'Ana episode 39,22,2017-12-23T14:25:29.000Z,17171,348,10,72,False
iDir69Football,26,18.05.03,[CFC Debrief] OM 1-1 Nantes TOP et Les Flops,17,2018-03-04T23:03:00.000Z,2868,20,0,7,False
Promi 24h,26,17.26.11,Johnny Hallyday est conscient mais ne peut pas beaucoup bouger _ [ Promi24h],25,2017-11-24T16:26:55.000Z,3618,18,2,0,False
Le Monde,26,17.07.12,"Johnny Hallyday, une vie de rocker",22,2017-12-06T06:27:37.000Z,22423,540,19,65,False
Yesdakar,26,18.18.05,MandoumbÃ© Ak Koor Gui 2018 - Episode 01,24,2018-05-17T19:34:31.000Z,76030,1407,60,221,False
Kidi Fun,26,17.11.12,TUTO NOEL - IDEES DECO FACILES - DEFIS DE CLAIRE,26,2017-12-10T09:00:03.000Z,6224,329,8,55,False
ÙˆØµÙØ§Øª Ù‡Ù†Ø¯ÙˆØ´Ø© Recettes  Hindoucha,26,17.04.12,"ÙŠÙˆÙ… Ù…Ù† Ø­ÙŠØ§ØªÙŠâ¤â¤ Ø¹Ø±Ø¶Ø§ØªÙ†ÙŠ ØµØ¯ÙŠÙ‚ØªÙŠ ,Ù…Ø§Ø¦Ø¯Ø© ÙƒÙˆØªÙŠ Ù„Ù„Ø¶ÙŠÙˆÙ Ø±Ø§Ù‚ÙŠØ©  ,ÙˆØ¬Ø¨Ø© Ø¹Ø´Ø§Ø¡ Ø®ÙÙŠÙØ© , Ø£Ø´ÙŠØ§Ø¡ Ø±Ø§Ø¦Ø¹Ø© Ø±Ø®ÙŠØµØ© Ø¬Ø¯Ø§",22,2017-12-03T14:00:01.000Z,29931,2102,69,277,False
Deutsch Algerien,26,17.18.11,Ø´Ø§Ù‡Ø¯ ÙƒÙŠÙ Ø±Ø¯ Ø¨Ù† Ø´ÙŠØ® Ø¹Ù„Ù‰ ØªØµØ±Ù Ø±Ø§Ø¨Ø­ Ù…Ø§Ø¬Ø± Ù…Ø¹ Ø§Ù„ØµØ­ÙÙŠ Ù…Ø¹Ù…Ø± Ø¬Ø¨ÙˆØ±,17,2017-11-16T23:34:05.000Z,227469,0,0,475,False
LCI,26,17.17.11,Eric Cantona revient sur l'affaire Evra et son amour du Real Madrid de Zidane,25,2017-11-16T17:30:01.000Z,37519,277,19,40,False
01netTV,26,17.15.11,10 jours avec l'iPhone X : ce qu'on aime et ce qu'on n'aime pas,28,2017-11-14T17:00:09.000Z,42502,1215,217,422,False
Pierre Croce,26,17.14.11,Vos slides sur moi,23,2017-11-11T09:40:25.000Z,883257,53449,894,3225,False
Trailers FR,25,17.12.12,LES TUCHE 3 Bande Annonce Teaser (ComÃ©die 2018) Jean-Paul Rouve,1,2017-12-11T09:30:36.000Z,57173,1046,87,72,False
Lorenzo,25,17.05.12,DÃ©couvrez la toute nouvelle version de Snapchat ( Mise Ã  jour DÃ©cembre 2017 ),22,2017-12-03T19:32:12.000Z,36643,228,266,201,False
TV Promos,25,17.22.11,"Supergirl 3x08 Promo Crisis on Earth-X, Part 1 (HD) Season 3 Episode 8 Promo - Crossover Event",24,2017-11-21T02:08:04.000Z,220173,1967,46,395,False
Rikita Asmr FranÃ§ais,25,17.20.11,ASMR ğŸ‘‚ğŸ» 1h entiÃ¨re de dÃ©clencheurs massage oreilles - One Hour Triggers ear massage â™¡  3Dio,24,2017-11-19T17:00:01.000Z,18992,791,26,186,False
ELBILAD TV,25,17.16.11,Ø´Ø§Ù‡Ø¯ÙˆØ§ .. ÙƒÙŠÙ Ø§Ù†ØªÙØ¶ Ø±Ø§Ø¨Ø­ Ù…Ø§Ø¬Ø± Ø¶Ø¯ ØµØ­ÙÙŠ Ø§Ù„Ù‚Ù†Ø§Ø© Ø§Ù„Ø¥Ø°Ø§Ø¹ÙŠØ© Ø§Ù„Ø«Ø§Ù„Ø«Ø©:  Ø¨Ù„Ù‘Ø¹ ÙÙ…Ùƒ ÙˆØ§Ø±Ø­Ù„!,22,2017-11-15T06:32:44.000Z,17293,17,11,9,False
MOUSSOU Assane DIOUF,25,17.24.11,Assane diouf Saga na Serigne Bass Abdou Khadre,24,2017-11-23T04:00:25.000Z,99823,401,358,365,False
CYRIL /SUPERKONAR,25,17.14.11,J'AI VISITÃ‰ UN CENTRE SPATIAL !,23,2017-11-12T12:52:35.000Z,321860,28943,173,1528,False
Kyoh Productions,25,17.28.12,Brvmsoo - 60 Pez,10,2017-12-27T18:57:45.000Z,88006,8060,116,680,False
Paris-Turf TV,25,17.15.11,Paris-Turf TV - 100 %  QuintÃ© - 15/11/2017,17,2017-11-14T09:54:14.000Z,12026,31,7,5,False
Franck Nicolas,25,17.28.11,LA FRUSTRATION DU DÃ‰BUT,26,2017-11-27T15:27:42.000Z,7506,546,8,67,False
Samantha Oups !,25,17.02.12,Compilation spÃ©ciale NoÃ«l - Samantha Oups !,23,2017-12-01T14:00:02.000Z,7609,400,9,38,False
The Voice : la plus belle voix,25,18.24.01,"The Voice 7 : exclu, une version de Stayin Alive Ã  vous couper le souffle",24,2018-01-23T09:02:36.000Z,6882,121,11,7,False
france tv slash,25,18.18.04,SKAM FRANCE EP.2 S2 : Mardi 10h00 - Le hÃ©ros de la semaine,24,2018-04-17T08:00:00.000Z,5565,98,0,5,False
Les VidÃ©os de Riles,25,17.01.12,TORIYAMA DEVOILE L'IDENTITÃ‰ DU 1ER SUPER SAIYAN DE LA LEGENDE !,24,2017-11-30T20:45:36.000Z,84542,6492,89,733,False
Philip DeFranco,25,17.19.12,"We Need To Talk About Kim Jong-hyun, CDC Banned Words Controversy Explained, and More...",24,2017-12-18T23:07:11.000Z,970666,53811,1220,7048,False
TRT 1,25,17.23.11,DiriliÅŸ 'ErtuÄŸrul' 97. BÃ¶lÃ¼m 1. FragmanÄ±,24,2017-11-22T20:45:57.000Z,205727,0,0,0,True
TheKAIRI78,25,17.19.11,JE CUISINE POUR MES ABONNES,23,2017-11-18T21:01:16.000Z,111622,10054,251,1531,False
PRIME,25,17.26.11,JE TESTE LE LANCÃ‰ DE HÃ‚CHE ! #LAVIDE 058,23,2017-11-25T18:30:15.000Z,183872,22266,173,632,False
Pauleta,25,17.16.11,LES 90 | LE VRAI FOOT ITALIEN !,20,2017-11-15T20:17:46.000Z,109394,13819,122,890,False
Olivier Verdier,25,18.03.01,AVIS DE MENUISIER - LES ESSENCES DE BOIS - LES FEUILLUS 2/2,26,2018-01-02T17:11:03.000Z,2692,446,4,179,False
Union Populaire RÃ©publicaine Officiel,25,17.18.11,ENTRETIEN NÂ°53 - UniversitÃ©/CongrÃ¨s de l'UPR - 3% de dÃ©ficit ? - Plans sociaux - Autres actus,25,2017-11-16T14:00:23.000Z,28239,1215,39,359,False
Superconeri,25,17.14.11,Le PIRE Ã‰lectricien,23,2017-11-12T19:04:14.000Z,269993,15354,289,884,False
BatFlunch,25,17.09.12,J'AI FAILLI ME BATTRE: CREVER LES PNEUS D'UN INCONNUS,24,2017-12-08T16:05:35.000Z,227423,17462,1963,1874,False
L'Obs,25,17.07.12,Il n'y a que lui qui sait nous chanter 'L'Envie' : le tÃ©moignage dun fan de Johnny Hallyday,22,2017-12-06T12:15:45.000Z,47584,385,56,184,False
Coach SÃ©an Garnier,24,17.28.11,CES PETITS SONT-ILS A LA HAUTEUR ?! #TTC12 feat la urbanballance,24,2017-11-27T17:08:49.000Z,40667,2496,24,184,False
Ø¨ÙˆØ§Ø¨Ø© Ø§Ù„ÙÙ†,24,17.06.12,Ø§Ù„Ù‡Ø±Ø¨Ø© Ù…Ø¹ Ù‡Ø§Ø¯ ÙˆÙ„Ø¯ Ø§Ù„Ø¹Ø¨Ø¯ Ù‚Ø§Ù„ Ù„Ù…ÙˆÙˆ Ø²ÙˆØ¬ÙŠÙ†ÙŠ Ù‚Ù‡Ø±Ù†ÙŠ Ù„Ø¨Ø±Ø¯ Ù‡Ù‡Ù‡Ù‡Ù‡Ù‡Ù‡Ù‡ ÙˆÙ‡ÙŠ ØªØ¹Ø·ÙŠÙ‡ Ù‚ØªÙ„Ø© Ø¯Ù„Ø¹ØµØ§ Ù‡Ù‡Ù‡Ù‡Ù‡,10,2017-12-05T18:00:19.000Z,74128,1100,99,315,False
TVision,24,18.18.05,Ù…Ø³Ù„Ø³Ù„ Ø£Ø¨Ùˆ Ø¹Ù…Ø± Ø§Ù„Ù…ØµØ±ÙŠ - Ø§Ù„Ø­Ù„Ù‚Ø© Ø§Ù„Ø£ÙˆÙ„Ù‰ | Ø£Ø­Ù…Ø¯ Ø¹Ø² | Abou Omar Elmasry - Eps 1,24,2018-05-17T20:00:00.000Z,130861,1919,85,452,False
TheFragHD,24,17.08.12,5 PLUS GROSSES GAFFES EN DIRECT TV !,20,2017-12-07T16:49:50.000Z,30599,3807,110,215,False
Ninho,24,17.28.12,Ninho - Dita feat. HÃ¶s Copperfield (Clip officiel),10,2017-12-27T15:11:09.000Z,260156,18834,277,1018,False
RÃ©vÃ©lations & Aventures Web,24,17.20.11,Temples de Petra - Comment les Anciens ont-ils fait?,19,2017-11-19T07:00:00.000Z,6095,276,9,55,False
Comedy Central UK,24,17.29.11,Prince Harry Is Trevor Noah's Royal Ed Sheeran | The Daily Show,23,2017-11-28T12:45:33.000Z,191655,2891,72,185,False
Hugo Lisoir,24,18.02.02,Le TÃ©lescope Spatial James Webb - Les Dossiers de L'Espace,28,2018-02-01T17:00:09.000Z,13965,1730,5,215,False
David Laroche France,24,17.17.11,Quel est le pire qui puisse vous arriver ?,26,2017-11-16T05:00:01.000Z,16792,1600,19,131,False
MOHAMED FAWZY FILM,23,18.04.02,Ù…Ø³Ù„Ø³Ù„ Ø§Ù„Ø¯ÙˆÙ„ÙŠ Ø§Ù„Ø­Ù„Ù‚Ø© | 5 | EL Dawly Series Eps,24,2018-02-03T19:00:39.000Z,92686,604,40,83,False
FromHumanToGod,23,17.22.11,PAS DE COURBATURES = PAS DE MUSCLES ?,17,2017-11-21T18:40:16.000Z,40345,4307,117,557,False
MBC THE VOICE KIDS,23,17.03.12,Ø§Ù„Ø­Ù„Ù‚Ø© Ø§Ù„Ø£ÙˆÙ„Ù‰ Ù…Ø±Ø­Ù„Ø© Ø§Ù„ØµÙˆØª ÙˆØ¨Ø³ â€“ Ø³Ø§Ù…ÙŠ Ø£Ø´Ø±Ø§ÙŠØ·ÙŠ,24,2017-12-02T20:58:21.000Z,109564,1714,90,294,False
100% MOTOS,23,17.21.11,MOTARDS vs RACAILLES | FRANÃ‡AIS,2,2017-11-20T16:08:52.000Z,225007,5236,290,563,False
AdÄ±nÄ± Sen Koy,23,17.28.11,AdÄ±nÄ± Sen Koy 226. BÃ¶lÃ¼m,22,2017-11-27T16:20:31.000Z,236428,2169,281,448,False
Farod,23,17.16.11,LE BON UNBOXING DES FAMILLES (Hitek Box),23,2017-11-15T15:00:01.000Z,118540,10210,159,1690,False
Groland Le ZapoÃ¯,23,17.26.11,A la rencontre de la doyenne grolandaise - Groland Le ZapoÃ¯ du 25/11 - CANAL+),24,2017-11-25T20:54:15.000Z,2291,59,3,1,False
Yes vous aime,23,17.17.11,LA VIE DE BUREAU 2,23,2017-11-16T15:13:45.000Z,39420,2460,134,97,False
Jimmy Kimmel Live,23,17.15.11,Mean Tweets â€“ Jimmy Kimmel Edition,23,2017-11-14T08:30:01.000Z,2765121,35532,1705,2388,False
MrRevillz,23,17.18.11,Bang & Boysen - 1-800-273-8255 (Oli Hanson Remix),10,2017-11-17T11:32:03.000Z,20544,626,26,35,False
Mosaique FM,23,17.23.12,ØªÙˆÙ†Ø³ÙŠØ§Øª Ù…ÙÙ†Ø¹Ù† Ù…Ù† Ø§Ù„Ø³ÙØ± Ø¥Ù„Ù‰ Ø§Ù„Ø¥Ù…Ø§Ø±Ø§Øª ÙŠØªØ­Ø¯Ù‘Ø«Ù† Ù„Ù…ÙˆØ²Ø§ÙŠÙŠÙƒ,25,2017-12-22T13:05:37.000Z,31250,109,14,157,False
4KEUS Officiel,23,17.06.12,4Keus - Dans La Gova,10,2017-12-05T17:03:11.000Z,82449,11449,145,1078,False
Marie S'Infiltre,23,17.11.12,RIP JOHNNY,23,2017-12-10T21:06:04.000Z,6773,612,12,73,False
Gulli,23,18.14.01,SAFARI GO S2 #1 avec Carole Rousseau sur Gulli ! - Duel Orange vs Vert: Animal mystÃ¨re !,24,2018-01-12T21:29:57.000Z,7725,77,10,18,False
Potins.net,23,17.21.11,Miss Univers : Alicia Aylies jalouse d'Iris Mittenaere ?,22,2017-11-20T14:55:46.000Z,4335,92,5,21,False
Jeff Lang2VIP,23,18.03.02," PrÃªt Ã  tout pour le buzz, CrÃ¨ve la tÃ©lÃ©-rÃ©alitÃ©, Mendiant de tÃ©lÃ©  Hillary clashe les prÃ©tendants",1,2018-02-02T07:48:17.000Z,73340,299,196,116,False
LesmystÃ¨res,23,17.17.12,PremiÃ¨res minutes Ã©pisode 20 Saison 16 - Les MystÃ¨res De L'amour,1,2017-12-16T17:30:01.000Z,4209,98,2,2,False
Sananas,23,17.30.11,AUTOMNE OU HIVER JE RESTERAI STYLÃ‰E ! ğŸ¤šğŸ»ğŸ˜,26,2017-11-29T11:00:09.000Z,201879,12540,681,1706,False
LeCritiqueur TV,23,17.14.11,Je test et dissÃ¨que le Grand Veggie ! Action - RÃ©action,24,2017-11-12T19:00:31.000Z,49333,1909,179,1326,False
ENTV Ø§Ù„Ù‚Ù†Ø§Ø© Ø§Ù„Ø±Ø³Ù…ÙŠØ© Ù„Ù„ØªÙ„ÙØ²ÙŠÙˆÙ† Ø§Ù„Ø¬Ø²Ø§Ø¦Ø±ÙŠ - Ø¯Ø±Ø§Ù…Ø§,23,18.21.05,Ù…Ø³Ù„Ø³Ù„ Ø¨Ø§Ø¨ Ø§Ù„Ø¯Ø´Ø±Ø© Ø§Ù„Ø­Ù„Ù‚Ø© 3 - Bab Edechra,24,2018-05-20T07:20:18.000Z,136631,1983,85,523,False
MBC The Voice,23,18.11.02,#MBCTheVoice - Ù…Ø±Ø­Ù„Ø© Ø§Ù„ØµÙˆØª ÙˆØ¨Ø³ - Ø¹Ù„ÙŠ Ù‚Ø§Ø¶ÙŠ,24,2018-02-10T19:07:24.000Z,281729,1977,164,201,False
pvnova,23,17.23.12,ExpÃ©rience nÂ°27 - La Chill Funk New Disco,24,2017-12-22T15:58:25.000Z,75393,9236,37,321,False
MrMatador,23,18.12.01,Barcelona vs Celta Vigo 5-0 -Â All Goals & Highlights â—Â 11/01/2018 HD (First Half),17,2018-01-11T21:18:01.000Z,484639,5777,442,552,False
SET India,23,17.25.12,"Crime Patrol Dial 100 - Ep 675 - Full Episode - 22nd December, 2017",24,2017-12-24T16:11:25.000Z,172580,1169,161,175,False
The Late Late Show with James Corden,22,17.16.11,P!nk Carpool Karaoke,24,2017-11-15T06:42:14.000Z,3621389,141682,1289,8127,False
CinemaSins,22,17.15.11,Everything Wrong With Wonder Woman In 14 Minutes Or Less,1,2017-11-14T17:00:07.000Z,1032547,34751,1305,7375,False
LaLiga Santander,22,17.28.11,Resumen de Valencia CF vs FC Barcelona (1-1),17,2017-11-26T23:00:00.000Z,545402,3245,418,681,False
PRINCE,22,17.15.11,LE PLUS GROS PROJET DE MA CHAINE,20,2017-11-14T16:55:31.000Z,58168,8699,41,693,False
YouTunes,22,17.21.11,LA VERITÃ‰ SUR DISNEY ! Feat BOOSTEE (CHANSON),24,2017-11-20T17:00:00.000Z,370189,48822,228,2960,False
Motion Station,22,17.26.12,"3rd Quarter, One Box Video: Golden State Warriors vs. Cleveland Cavaliers",17,2017-12-25T21:54:56.000Z,46753,159,21,19,False
Alexandre CORMONT (officiel),22,17.15.11,Je n'ai pas besoin d'homme dans ma vie !,26,2017-11-14T12:25:26.000Z,5790,332,10,43,False
Khaled Freak,22,17.02.12,Han Ouais - Tribunal de Charleroi (REMIX),10,2017-12-01T16:06:11.000Z,95097,10325,122,1075,False
BOBO KOYANGBWA,22,17.01.12,RDC -DÃ©part de Kabila...En direct avec Ndeko Eliezer,25,2017-11-30T12:35:55.000Z,12817,104,25,100,False
Samia & NouveautÃ©s,22,18.04.02,Mort de Alpha dans PBLV: le pÃ¨re de Baptiste tuÃ© !,22,2018-02-03T16:00:01.000Z,8086,42,14,5,False
EchorouknewsTV,22,17.16.11,Ø¨Ø§Ù„ÙÙŠØ¯ÙŠÙˆ.. Ù…Ø¹Ù…Ù‘Ø± Ø¬Ø¨ÙˆØ± ÙŠØ±Ø¯Ù‘ Ø¹Ù„Ù‰ Ø±Ø§Ø¨Ø­ Ù…Ø§Ø¬Ø± Ø¨ØªØµØ±ÙŠØ­ Ù‚ÙˆÙŠ,25,2017-11-15T13:27:00.000Z,163413,576,290,568,False
Proximity,22,17.10.12,Axwell /\ Ingrosso - Dreamer (ft. Trevor Guthrie) [Lyric Video],24,2017-12-08T21:11:10.000Z,889955,17752,462,968,False
TRT Televizyon,22,18.18.01,DiriliÅŸ ErtuÄŸrul 103.BÃ¶lÃ¼m FragmanÄ±,1,2018-01-17T20:38:21.000Z,256541,2661,51,0,True
FlorianOnAir,21,17.14.11,On passe en CUISINE aÌ€ KFC! - VLOG #482,24,2017-11-11T11:00:01.000Z,153071,4919,315,619,False
Non Stop Hanouna,21,18.23.01,Le OFF de TPMP : Le duel Cyril Hanouna/Benjamin Castaldi,24,2018-01-22T09:12:59.000Z,5497,21,2,0,False
WALFADJRI Groupe,21,18.21.05,NDOGU LI Saison 9 Episode 04,25,2018-05-20T18:30:00.000Z,39007,694,29,198,False
Simo Daher,21,17.17.11,Ù†ÙŠØ¨Ø§ Ø®Ø§Ù„Ù‚ Ø§Ù„Ø³Ø¹Ø§Ø¯Ø© Ù…Ø¹ Ø§Ù„Ø§ØµØ¯Ù‚Ø§Ø¡ ÙØ§Ù„Ø­ÙŠ,22,2017-11-16T19:41:41.000Z,103890,3259,171,398,False
Soltana - Ø³Ù„Ø·Ø§Ù†Ø©,21,17.27.11,Ø§Ù„Ø«Ù†Ø§Ø¦ÙŠ Ø§Ù„Ù…ØºØ±Ø¨ÙŠ Ø§Ù„Ø±ÙˆØ³ÙŠ ÙŠØ­ÙŠÙ‰ Ùˆ ÙØ§Ù„Ù†ØªÙŠÙ†Ø§ ÙŠÙˆØ¶Ø­ Ø­Ù‚ÙŠÙ‚Ø© Ù…Ø§ Ø¹ÙØ±ÙØ¶ ÙÙŠ Ø±Ø´ÙŠØ¯ Ø´Ùˆ ÙˆÙŠØ±ÙˆÙŠØ§Ù† Ù‚ØµØ© Ø²ÙˆØ§Ø¬Ù‡Ù…Ø§,24,2017-11-26T00:27:08.000Z,311174,4182,274,1702,False
Fondation 30 Millions d'Amis,21,17.01.12,"LibÃ©rÃ©s de clapiers Ã  lapins, 21 chiens sauvÃ©s",15,2017-11-30T09:48:07.000Z,13768,873,6,90,False
SANAMAKEUP,21,17.25.11,"Night Routine || Maman et BÃ©bÃ© || ActivitÃ©s, Recette rapide, Soins ...",22,2017-11-24T17:10:04.000Z,23187,0,0,182,False
DMTV 3,21,17.16.11,SERGE KABONGO RECOIT CE 15 NOVEMBRE 2017 PASCAL OWONDJE ET ISRAEL MUTALA,25,2017-11-15T15:18:45.000Z,7271,60,9,7,False
Zap Actu Sport,21,18.16.02,DUGA - REAL-PSG: EMERY LE RESPONSABLE ? (15/02/18),17,2018-02-15T18:33:11.000Z,4583,34,3,21,False
new horizon,21,17.13.12,Enterrement de Johnny Hallyday :  de rares images des obsÃ¨ques ont fuitÃ©,22,2017-12-12T11:50:41.000Z,18927,32,16,3,False
Jero,21,17.20.12,Ninho feat. Sadek - Jamais,10,2017-12-19T11:35:42.000Z,140829,2875,118,126,False
Laazhar Tube,21,17.19.11,Ø§Ù„Ø­ÙˆØ§Ø± Ø§Ù„ÙƒØ§Ù…Ù„ Ù…Ø¹ Ø§Ù„Ù…Ù…Ø«Ù„ Ø§Ù„ÙÙƒØ§Ù‡ÙŠ Ù…Ø­Ù…Ø¯ Ø¬Ø¯ÙŠØ¯(Ø§Ù„Ù‡ÙˆØ§Ø±ÙŠ)ÙŠÙƒØ´Ù Ø­Ù‚ÙŠÙ‚Ø© Ù…Ø±Ø¶Ù‡ ÙˆÙŠØ´ÙƒØ± Ø§Ù„Ø¬Ø²Ø§Ø¦Ø±ÙŠÙŠÙ† Ø¹Ù„Ù‰ ØªØ¶Ø§Ù…Ù†Ù‡Ù… Ù…Ø¹Ù‡,10,2017-11-18T20:41:48.000Z,8275,183,4,111,False
Music GO Relaxing,21,18.28.01,Acoustic Guitar Love Song Instrumental â€“ Relaxing Music 2018 â€“ Love Songs Guitar Instrumental Music,10,2018-01-26T14:26:31.000Z,147367,245,92,7,False
Chasseur de FantÃ´mes,21,17.16.12,ENFERMER SEUL DANS UNE TOUR HANTÃ‰ ! (Chasseur de FantÃ´mes) [Explorations Nocturnes] Paranormal Urbex,24,2017-12-15T19:56:18.000Z,14615,1308,384,445,False
AFP,21,17.23.11,Images de la dÃ©fection d'un soldat nord-corÃ©en,25,2017-11-22T04:05:09.000Z,17931,45,11,10,False
BISONIOSO CONGO RDC,21,17.27.12,LA CENCO PRET POUR L'ASSAUT FINAL LE 31 DEC BOYOKA BA SECRET KABILA AZO KIMA,25,2017-12-26T16:45:18.000Z,15260,58,19,20,False
LA CAGOULE,21,17.19.12,Je deviens SDF car youtube a SUPPRIMÃ‰ ma chaine,22,2017-12-18T15:39:36.000Z,55159,15482,319,2206,False
4KEUS GVNG OFFICIEL,21,17.14.12,4Keus Gang - Attentif,22,2017-12-13T15:00:04.000Z,87709,3535,113,407,False
LeStream Replay,21,17.29.11,Le RÃ©cap #7.1 - La suite,20,2017-11-28T15:17:53.000Z,2705,86,0,3,False
OM,21,17.26.12,DOCUMENTAIRE EXCLUSIF SUR LUIZ GUSTAVO | OM ğŸ¥,17,2017-12-25T17:04:08.000Z,33888,2169,10,172,False
BuzzFeedVideo,21,18.02.02,$10 Game Day Food Vs. $456 Game Day Food â€¢ Super Bowl 2018,22,2018-02-01T19:00:03.000Z,1061869,38237,513,3231,False
SOUMA Ø³ÙˆÙ…Ø©,21,17.22.11,Ø²ÙˆØ¬Ù‰ ÙŠÙ†Ø¸ÙğŸ˜†ÙƒÙŠÙ Ø§Ù‚Ù†Ø¹ØªÙ‡?ØºÙŠØ±Øª Ø¯ÙŠÙƒÙˆØ± ØµØ§Ù„ÙˆÙ†Ù‰ ÙØ·ÙˆØ± Ø§Ù„ØµØ¨Ø§Ø­ Ø´Ù‡ÙŠÙŠÙŠÙŠ Ù…Ø´ØªØ±ÙŠØ§Øª Ù„Ù„Ø­Ù„ÙˆÙŠØ§Øªvlog m mari,22,2017-11-21T15:30:01.000Z,112871,5774,482,1720,False
CaseyNeistat,21,17.14.11,WE WANT TO TALK ABOUT OUR MARRIAGE,22,2017-11-13T17:13:01.000Z,748374,57536,2967,15959,False
La Villa des Coeurs BrisÃ©s,21,17.15.12,#LaVilla3 ğŸ˜± Une entrÃ©e fracassante pour Beverly en mode Â« Paris Hilton du guetto Â»,24,2017-12-14T16:47:54.000Z,2308,73,1,5,False
ÙƒÙØ§Ø­ - kifaa7,21,18.26.03,Ø§Ø®Ø¨Ø§Ø± ÙØ´ÙƒÙ„ 2 | Ø­Ù‚ÙŠÙ‚Ø© Ø·Ù„Ø§Ù‚ Ù…Ø­Ù…Ø¯ Ø§Ù„Ø³Ø§Ø¯Ø³ _ Ø§Ù„ØµÙŠÙ† ØªØ¹Ù„Ù… Ø§Ù„Ù…ØºØ±Ø¨ _ ÙˆØ¨ÙˆÙ„Ø³Ø§Ø±ÙŠÙˆ Ù‡Ù‡Ù‡Ù‡Ù‡,25,2018-03-25T20:42:27.000Z,74790,2772,325,501,False
BIRDYY,21,17.14.11,FAIRE UNE MUSIQUE EN 10 MINUTES ! Feat Medusa,24,2017-11-12T18:05:18.000Z,60057,5973,333,398,False
Akhbar Maghribiya,21,17.20.11,Ø¹Ø§Ø¬Ù„..Ø§Ù„Ù…Ù„Ùƒ Ù…Ø­Ù…Ø¯ Ø§Ù„Ø³Ø§Ø¯Ø³ ÙŠØ¹Ø·ÙŠ ØªØ¹Ù„ÙŠÙ…Ø§ØªÙ‡ Ø¨Ø®ØµÙˆØµ ÙØ§Ø¬Ø¹Ø© Ø§Ù„ØµÙˆÙŠØ±Ø©,25,2017-11-19T15:30:21.000Z,28817,0,0,31,False
Friends Trip - La chaÃ®ne officielle,21,18.17.01,Friends Trip 4 - Vincent dÃ©goÃ»tÃ© ! #Ã©pisode 11,22,2018-01-16T10:45:39.000Z,6513,56,0,5,False
Mahdi Ba,21,17.28.11,MAHDI BA VS TEAM S3,24,2017-11-27T17:30:34.000Z,127344,11208,82,308,False
SEB,21,17.20.11,Vivre avec son pÃ¨re (vu par Seb),23,2017-11-19T15:00:01.000Z,1566953,98393,1191,1274,False
Animaux 360,21,18.26.01,"HospitalisÃ©, il doit abandonner ses chiens mais nâ€™en revient pas de la surprise que lui fait...",15,2018-01-25T15:59:18.000Z,2548,64,2,4,False
Music Relaxing,21,17.31.12,Love Songs Piano Music Cover - A Very Magical And Beautiful Music - The Melodies Are Fantastic!,10,2017-12-30T06:00:01.000Z,203374,493,119,25,False
DZ TV,21,17.08.12,Ø£ÙˆÙ„ Ø±Ø¯ ØµØ§Ø¯Ù… ÙˆÙ„Ù‡Ø¬Ø© Ù…Ø±Ø¹Ø¨Ø© Ù…Ù† Ø§Ù„Ø¬Ø²Ø§Ø¦Ø± Ø¹Ù„Ù‰ Ø¥Ø¹ØªØ±Ø§Ù ØªØ±Ø§Ù…Ø¨ Ø¨Ø§Ù„Ù‚Ø¯Ø³ Ø¹Ø§ØµÙ…Ø© Ù„Ø¥Ø³Ø±Ø§Ø¦ÙŠÙ„...,22,2017-12-07T08:59:03.000Z,154876,1518,223,662,False
MOTOR LIVE,21,17.16.11,MOTO&CO s02e01 | NouveautÃ©s 2018 : on passe tous au trail ?,2,2017-11-15T11:35:02.000Z,7771,359,13,85,False
TOP 14 - Officiel,20,17.28.11,TOP 14 - RÃ©sumÃ© Agen-Paris: 29-13 - J11 - Saison 2017/2018,17,2017-11-26T23:00:00.000Z,4687,30,0,0,False
Road to Saiyan,20,17.14.11,J'AI PERDU LA MOTIVATION,17,2017-11-12T16:01:40.000Z,114014,8666,360,471,False
Djadja & Dinaz,20,18.24.03,Djadja & Dinaz - J'souris [Clip Officiel],10,2018-03-23T17:56:37.000Z,181287,19229,248,1206,False
SMTOWN,20,17.18.11,Red Velvet ë ˆë“œë²¨ë²³ 'í”¼ì¹´ë¶€ (Peek-A-Boo)' MV,10,2017-11-17T09:00:03.000Z,4340962,396800,11280,41890,False
VA10HD,20,18.18.01,PSG vs Dijon 8-0 All Goals & Extended Highlights - 17/01/2018,17,2018-01-17T21:58:56.000Z,855000,7529,821,798,False
Ô±Õ¦Õ¡Õ¿Õ¸Ö‚Õ©ÕµÕ¸Ö‚Õ¶,20,18.17.04,Ô¼Ô±ÕÕÔ±Ô¾ Ô»ÕÔ±ÕÔ»ÕƒÔ±Ô¿ Õ”Ô±Õ‚Ô±Õ”Ô» ÕÔ±ÕÔ²ÔµÕ Õ€Ô±ÕÕÔ±Ô¾Õ†ÔµÕÕˆÕ’Õ„,25,2018-04-16T00:52:08.000Z,1097109,8535,1108,1,False
The Slow Mo Guys,20,17.15.11,Slow Mo Katana Sword - 4K - The Slow Mo Guys,24,2017-11-14T18:31:20.000Z,1529652,63996,896,4697,False
Le RÃ¨glement,20,17.23.12,"LE RAP, NOUVEAU ROCK ? (Post Malone, XXXTentacion, Lil Peep ğŸŒ¹)",24,2017-12-22T16:59:47.000Z,139033,20675,152,1895,False
La BoÃ®te Ã  Questions,20,17.21.12,La BoÃ®te Ã  Questions de Charlotte Gainsbourg & Pierre Niney â€“  19/12/2017,24,2017-12-20T12:26:44.000Z,2663,33,0,0,False
Golden Line for TV Production and Distribution,20,18.21.05,Ù…Ø³Ù„Ø³Ù„ Ù‡Ø§Ø±ÙˆÙ† Ø§Ù„Ø±Ø´ÙŠØ¯ Ù€ Ø§Ù„Ø­Ù„Ù‚Ø© 4 Ø§Ù„Ø±Ø§Ø¨Ø¹Ø© ÙƒØ§Ù…Ù„Ø© HD | Haron Al Rashed,22,2018-05-20T20:00:01.000Z,74762,794,45,304,False
Georgette Mag,20,17.01.12,1 MINUTE INSIDE ~ Salon du cheval 2017 :  Meetup des Youtubeuses !,15,2017-11-30T13:27:49.000Z,3532,330,4,35,False
OUALID Sport 2,20,18.02.02,Ù…Ø¨Ø§Ø±Ø§Ø© Ù…ÙˆÙ„ÙˆØ¯ÙŠØ© Ø§Ù„Ø¬Ø²Ø§Ø¦Ø± ÙˆØ´Ø¨Ø§Ø¨ Ø¨Ù„ÙˆØ²Ø¯Ø§Ø¯// MCA VS CRB,17,2018-01-30T23:14:37.000Z,70060,669,63,6,False
jOsSpace,20,17.14.12,BOOBA EST IL TOUJOURS SUR LE TRONE ???,24,2017-12-13T17:00:37.000Z,53547,5223,78,279,False
Dzair 24,20,18.08.02,Ø§Ù„Ù†Ø§Ø¦Ø¨ Ø³Ù„ÙŠÙ…Ø§Ù† Ø³Ø¹Ø¯Ø§ÙˆÙŠ ÙŠØ±Ø¯ Ø¹Ù„Ù‰ ØªØµØ±ÙŠØ­ Ù†Ø¹ÙŠÙ…Ø© ØµØ§Ù„Ø­ÙŠ Ø­ÙˆÙ„ ØªØ¹Ù„ÙŠÙ… Ø§Ù„Ù„ØºØ© Ø§Ù„Ø£Ù…Ø§Ø²ÙŠØºÙŠØ©,25,2018-02-07T18:40:51.000Z,50715,397,143,373,False
SFR Sport,20,17.16.11,Le gros malaise crÃ©Ã© par Dhorasoo - LE VESTIAIRE 15/11/2017,17,2017-11-15T16:30:01.000Z,25120,175,8,38,False
robert 87000,20,17.14.11,FIFA 18 - UNE CARTE ARGENT A 150 000 CRÃ‰DITS ! CRISTIANO 74 MEILLEUR QUE LE 94 ?,20,2017-11-13T16:30:00.000Z,70994,3906,64,334,False
GREED,20,17.14.11,JE REFAIS DES PHOTOS ! #DÃ‰FI,24,2017-11-12T15:59:41.000Z,97976,7397,157,426,False
DZ akhbar,20,17.20.11,Ø´Ø§Ù‡Ø¯ Ù…Ø§Ø°Ø§ Ù‚Ø§Ù„ ÙˆØ²ÙŠØ± Ø§Ù„Ø¯Ø§Ø®Ù„ÙŠØ© Ø¹Ù„Ù‰ ÙÙŠØ¯ÙŠÙˆ Ø±Ø§Ù†ÙŠ Ø²Ø¹ÙØ§Ù† rani za3fane anes tina,25,2017-11-19T19:05:24.000Z,39768,71,122,76,False
Volmog 16,20,17.16.11,L'arrivÃ©e improbable de Dhorasoo en Bleu,17,2017-11-15T17:14:34.000Z,3422,9,0,1,False
Wooshes,20,17.06.12,QUAND on SORT la SAISON 2 #EN FAIT (Lea camilleri - Vincent scalera - Nicolas meyrieux),23,2017-12-05T17:35:24.000Z,83519,7863,35,288,False
Bapt&Gael,20,18.31.03,TEASER - B&G et les Aventures de la Couille Cosmique SAISON 2,23,2018-03-30T14:18:34.000Z,77122,7190,69,445,False
Jaymax VI,20,17.09.12,LES ANNEES 2000 VS AUJOURD'HUI - JAYMAXVI,23,2017-12-08T17:00:01.000Z,144115,12369,236,803,False
Gossip TÃ©lÃ©rÃ©alitÃ©,20,18.02.04,Jessica ENCEINTE OFFICIELLEMENT de THIBAULT ! ANNONCE EMOUVANTE (LMA),24,2018-04-01T09:00:03.000Z,534610,4267,1806,501,False
JOYCA,20,18.01.04,MA PLAYLIST DU MOIS #9 !,24,2018-03-31T16:00:01.000Z,198433,17472,273,764,False
Buzz News,20,17.20.11,Maroc : au moins 15 morts et de nombreux blessÃ©s aprÃ¨s une bousculade pour l'aide alimentaire,25,2017-11-19T18:41:13.000Z,7349,35,21,201,False
Screen Junkies,20,17.15.11,Honest Trailers - Batman Forever,1,2017-11-14T18:00:01.000Z,829132,25111,316,3428,False
JEREMSTAR,20,17.15.11,Tanya (Secret Story 11) dans le bain de Jeremstar - INTERVIEW,22,2017-11-14T16:52:59.000Z,286119,6089,310,1100,False
FBE,20,17.10.12,YOUTUBERS REACT TO YOUTUBE REWIND 2017,24,2017-12-08T22:00:01.000Z,2707816,75664,9614,21780,False
Joe Show - Ø¬Ùˆ Ø´Ùˆ,20,17.17.11,Ø¬Ùˆ Ø´Ùˆâ”‚Ø§Ù„Ù…ÙˆØ³Ù… Ø§Ù„Ø«Ø§Ù†ÙŠâ”‚Ø§Ù„Ø­Ù„Ù‚Ø© 18â”‚Ø§Ù„Ø±Ø¦ÙŠØ³ Ø§Ù„ÙÙŠÙˆØªØ´Ø±ÙˆÙ„ÙˆØ¬ÙŠ,23,2017-11-16T19:59:21.000Z,242933,7751,384,1102,False
Passion Slime,20,17.28.12,â˜… BEST-OFF DECOUPAGE BALLES ANTI-STRESS (12),24,2017-12-27T17:42:57.000Z,4553,149,5,55,False
La Luciole MÃ©lenchantÃ©e,19,17.22.11,A. Quatennens Ã  la ministre du travail : Vous prenez le problÃ¨me du chÃ´mage par le mauvais bout !,25,2017-11-21T19:13:42.000Z,1434,283,0,23,False
Parole de chat,19,17.14.12,CHAT PERCHÃ‰ - PAROLE DE CHAT,15,2017-12-13T10:41:00.000Z,186984,16678,162,681,False
L'Actu AnimÃ©e,19,17.02.12,Il s'en passe des choses ! - VLOG ANIMÃ‰ #4,23,2017-12-01T16:00:53.000Z,90976,11155,60,439,False
Top Channel Albania,19,17.14.11,"Portokalli, 12 Nentor 2017 - Policat e postbllokut dhe Kimikati",23,2017-11-13T13:33:26.000Z,100607,1159,48,35,False
NAZA,19,18.01.02,Naza - Pablo (Clip Officiel),10,2018-01-31T09:00:01.000Z,327479,14606,631,625,False
Doc Seven,19,17.31.12,7 frontiÃ¨res insolites dans le monde - partie 2,27,2017-12-30T19:12:28.000Z,289183,25101,447,1182,False
Actu France Foot,19,17.25.12,BUT INCROYABLE NEYMAR EN MATCH DE CHARITE,17,2017-12-24T07:39:07.000Z,8230,76,0,3,False
Marion et Anne-So,19,17.14.11,JEREMSTAR - LA PEUR DE SA VIE - Marion et Anne-So,10,2017-11-13T16:59:03.000Z,5210,316,8,17,False
Wooshes - Vincent Scalera,19,18.03.03,QUAND on EST un DESSIN ANIMÃ‰ (LÃ©a Camilleri - Vincent Scalera) EN FAIT #S02 Ep.7,23,2018-03-01T17:00:57.000Z,346723,21535,396,411,False
Les Parodie Bros,19,17.25.11,QUAND TU ES MALADE ! - LES PARODIE BROS,23,2017-11-24T17:02:04.000Z,264189,19232,180,2791,False
THE WORLD OF SISTERS,19,17.20.11,HAUL d'automne ğŸ‚ â”†TRY ON â”†ğŸ“LONDON,26,2017-11-19T08:00:04.000Z,33913,1884,32,82,False
Studio Vrac,19,17.20.11,C'est quoi ces placements de produits ? Ft. Le Tatou [QUIZZ MONETAIRE] #35,24,2017-11-19T04:30:02.000Z,128003,7609,128,189,False
SMGä¸Šæµ·ç”µè§†å°å®˜æ–¹é¢‘é“ SMG Shanghai TV Official Channel,19,17.18.11,ã€Fullã€‘ã€Šæé™æŒ‘æˆ˜IIIã€‹ç¬¬12æœŸ20171117ï¼šå­™çº¢é›·å¼ è‰ºå…´å›å¿†æ€ é»„æ¸¤åŒ–èº«æ¸¸å®¢æ‹ç…§ä¸åœ Go Fighting S3 EP.12ã€ä¸œæ–¹å«è§†å®˜æ–¹é«˜æ¸…ã€‘,24,2017-11-17T17:01:24.000Z,215746,1206,60,618,False
Nikola,19,17.29.12,LA HONTE DU PAYS #4 - NEXT MADE IN FRANCE,22,2017-12-28T18:03:51.000Z,38487,3062,84,295,False
Ennahar TV Compte Officiel,19,17.21.11,Ø¬Ø±ÙŠÙ…Ø© Ø§Ù„Ù…Ø¯Ù†ÙŠØ©/ Ø§Ù„Ù‚Ø§ØªÙ„ ÙƒØ§Ù† ÙŠØ±Ù…ÙŠ Ø£Ø´Ù„Ø§Ø¡ Ø§Ù„Ø¶Ø­ÙŠÙ‘Ø©  Ù…Ù† Ø¯Ø§Ø®Ù„ Ø§Ù„Ù…Ù†Ø²Ù„ Ø§Ù„Ù‰ Ø§Ù„Ø´Ø§Ø±Ø¹ !!,25,2017-11-20T15:24:51.000Z,78895,335,43,173,False
TAI REFLECTIONS / STARRYSKY,19,17.17.11,COMPOSER UNE MUSIQUE EN Ã‰TANT SOURD ? - Tai Reflections,10,2017-11-16T17:25:40.000Z,10934,2067,19,236,False
Stardust - La ChaÃ®ne Espace,19,17.06.12,Ces 2 semaines dans l'espace : Semaines du 20 et 27/11/17,28,2017-12-05T18:10:00.000Z,12802,1473,37,209,False
TONTON GIBS SNEAKERS,19,17.19.11,ADIDAS YEEZY BOOST 350 V2 YEBRA ğŸ”¥,26,2017-11-18T18:30:00.000Z,28894,2537,18,184,False
TFM (TÃ©lÃ© Futurs Medias),19,17.14.11,BERCY REK AK SANEX - Episode 5 - 12 Novembre 2017,24,2017-11-12T21:54:40.000Z,101010,1144,90,201,False
W Experiment,19,17.25.12,Les Meilleurs coiffeurs du monde â™¦Des maquillages et des coiffures incroyables #7,22,2017-12-24T17:02:14.000Z,3803,81,3,12,False
France 3 Hauts-de-France,19,17.30.11,RC Lens-Ajaccio 2-0,25,2017-11-29T09:43:23.000Z,2172,15,0,1,False
Thinkerview,19,17.17.11,Changement de Civilisation ? Marc Luyckx Ghisi [EN DIRECT],25,2017-11-15T19:26:42.000Z,22007,1027,68,276,False
People News,19,17.19.11,Johnny HallyÂ­day va sortir de lâ€™hÃ´Â­piÂ­tal ce samedi. Â« D matÃ©riel mÃ©dical Â» livrÃ© Ã ,24,2017-11-18T13:27:48.000Z,5159,0,0,5,False
iUmor,19,17.20.11,"Ozulusal Taylan, un turc pe scena iUmor! PrestaÅ£ia lui l-a consternat pe Bendeac",24,2017-11-19T18:58:36.000Z,184456,3494,212,1030,False
TV Ø¬Ø¯ÙŠØ¯ Ø§Ù„ÙŠÙˆÙ…,19,17.14.11,ØªØµØ±ÙŠØ­ Ù„Ù‚Ø¬Ø¹ ÙˆØ­ÙƒÙŠÙ…ÙŠ ÙˆØ§Ù„ÙŠØ§Ù…ÙŠÙ‚ ÙˆÙØ¬Ø± Ùˆ Ø­Ø§Ø±ÙŠØ« ÙˆØ§Ù„Ù…Ø²ÙŠØ¯,17,2017-11-11T21:07:24.000Z,299240,2594,240,325,False
EnjoyPhoenix,18,17.23.11,100 IDEÌES DE CADEAUX DE NOÃ‹L !,26,2017-11-22T11:00:04.000Z,363819,24665,1601,1893,False
Mont Corvo,18,17.27.12,L'HOMME QUI A CHANGÃ‰ ONE PIECE EN 2017 !,24,2017-12-26T16:00:07.000Z,21679,1283,52,154,False
Timal Official,18,17.09.12,Timal - 6eme Rapport (Clip officiel),10,2017-12-08T17:00:20.000Z,88104,9840,85,769,False
NugoBasilaiaa,18,17.24.12,Real Madrid Vs Barcelona 0-3 - All Goals & Highlights - Resumen y Goles 23/12/2017 HD,17,2017-12-23T14:01:09.000Z,1643957,11100,942,1389,False
Sissy MUA,18,17.12.12,GERER LES FETES - Plaisir sans grossir : 5 reÌ€gles d'or !,17,2017-12-10T17:04:00.000Z,73372,6182,78,357,False
Keblack,18,17.01.12,KeBlack - Vendeurs de RÃªves (Clip Officiel),10,2017-11-30T17:01:23.000Z,79301,8998,89,582,False
BrunoDansLaRadio,18,17.09.12,Demolition Party ! (08/12/2017) - Best Of Bruno dans la Radio,23,2017-12-08T14:32:45.000Z,3690,127,3,11,False
STEVEN,18,17.19.11,iPhone X : Test complet du meilleur smartphone de 2017,28,2017-11-18T16:30:01.000Z,108029,6071,399,1155,False
AFRICAFILMStv,18,18.20.05,Le Ramadan de ASS 2018 - Ã©pisode 2 : Macky,1,2018-05-18T19:27:30.000Z,73940,1488,62,196,False
MSN & BBC,18,18.07.01,Ecoutez le Discours de Mohamed Ali Bathily Ã  l'AssemblÃ©e GÃ©nÃ©rale des APM,22,2018-01-06T12:21:25.000Z,10393,426,11,51,False
C l'hebdo,18,17.14.11,"Elisabeth LÃ©vy, Natacha Polony : elles dÃ©noncent la chasse aux hommes. - C lâ€™hebdo - 11/11/2017",24,2017-11-11T19:06:46.000Z,48321,216,63,453,False
LacrimMusicVEVO,18,17.06.12,Lacrim - Noche (Audio) ft. Damso,10,2017-12-04T12:00:01.000Z,267508,13416,249,1039,False
Yeni Gelin,18,18.19.02,Yeni Gelin 37. BÃ¶lÃ¼m,22,2018-02-17T21:16:49.000Z,344893,3639,262,586,False
DossehVEVO,18,18.13.01,Dosseh - Tout est neuf ft. Sadek,10,2018-01-12T15:00:06.000Z,351930,18564,353,712,False
PlanÃ¨te Rap,18,18.30.01,PlanÃ¨te Rap - Vald Xeu #Lundi,10,2018-01-29T20:45:34.000Z,14578,439,6,92,False
Isadora et Marisa,18,17.20.11,REEQUILIBRAGE ALIMENTAIRE #3: NOS 3 P'TITS DÃ‰JEUNERS INCONTOURNABLES  â˜•,26,2017-11-19T08:31:24.000Z,8085,893,7,167,False
KisabacLusamutner,18,17.22.11,Kisabac Lusamutner eter 21.11.17 Erku Tarberak,29,2017-11-21T17:16:25.000Z,30007,124,20,0,True
Ø¬ÙˆÙ„Ø© ÙÙŠ Ø¨ÙŠØªÙŠ jawla fi bayti,18,17.24.11,Ø§Ø¨Ø´Ø±ÙƒÙ… Ø¨Ù…ÙˆÙ„ÙˆØ¯ Ø¬Ø¯ÙŠØ¯ Ø§Ù„Ø­Ù…Ø¯Ù„Ù„Ù‡,22,2017-11-23T17:10:41.000Z,8307,1318,4,1209,False
Sir Gibsy,18,17.07.12,"King of Play, le ROI de la CONTREFAÃ‡ON? - L'Analyse de VidÃ©o #1",24,2017-12-06T16:00:00.000Z,26576,3952,2066,666,False
Jadal Ø¬Ø¯Ù„,18,17.27.12,Ø§Ù„Ù…Ø±Ø£Ø© Ø§Ù„ØªÙŠ Ø­Ø±ÙƒØª Ù…Ø´Ø§Ø¹Ø± Ø§Ù„Ù…ØºØ§Ø±Ø¨Ø© ÙÙŠ Ø­Ø±Ø§Ùƒ Ø¬Ø±Ø§Ø¯Ø© Ø¨ÙƒÙ„Ù…ØªÙ‡Ø§ Ø§Ù„Ù‚ÙˆÙŠØ© Ø§Ù…Ø§Ù… Ø§Ù„Ø¬Ù…ÙŠØ¹ Ù…Ù† Ø§Ø¬Ù„ Ø§Ù„Ø¹ÙŠØ´ Ø§Ù„ÙƒØ±ÙŠÙ…,25,2017-12-25T13:18:38.000Z,128117,1443,166,261,False
"David, de la chaÃ®ne Ganesh2",18,18.09.01,GILBERT (prise alternative),23,2018-01-08T17:00:07.000Z,54142,7729,36,463,False
La Porte Ouverte,18,17.22.11,Bienvenue sur le culte en direct de La Porte Ouverte,26,2017-11-21T21:36:35.000Z,2166,67,1,0,False
extra goal,18,17.03.12,Ù…Ù„Ø®Øµ Ù…Ø¨Ø§Ø±Ø§Ù‡ Ù„Ù€ ÙŠÙÙ€ Ø±Ø¨Ù€ ÙˆÙ„ ÙˆØ¨Ù€ Ø±Ø§ÙŠÙ€ ØªÙ€ ÙˆÙ† 5-1 - ØªØ£Ù„Ù‚ Ù…Ù€ Ø­Ù€ Ù…Ø¯ ØµÙ€ Ù„Ø§Ø­ - Ø§Ù„Ø¯ÙˆØ±ÙŠ Ø§Ù„Ø§Ù†Ø¬Ù„ÙŠØ²ÙŠ,17,2017-12-02T16:55:19.000Z,831290,6073,563,219,False
Francetv Sport,18,17.22.11,Â«Â Fast but not furiousÂ Â». Aller vite mais rester prudent pour FranÃ§ois Gabart.,17,2017-11-21T14:09:44.000Z,1462,16,0,0,False
Tales From The Click,18,17.23.11,Van Damme ( feat. JHON RACHID et TEDDY ) - Videostore #9,24,2017-11-22T17:00:09.000Z,38715,4066,18,156,False
alyaoum24,18,17.14.11,Ø´Ø§Ù‡Ø¯..Ù„Ø­Ø¸Ø© ØªÙ„Ù‚ÙŠ Ø±ÙˆÙ†Ø§Ø± Ø§ØªØµØ§Ù„Ø§ Ù…Ù† Ø§Ù„Ù…Ù„Ùƒ Ù…Ø­Ù…Ø¯ Ø§Ù„Ø³Ø§Ø¯Ø³ Ø¨Ø¹Ø¯ Ø§Ù„ÙÙˆØ²,24,2017-11-11T20:21:32.000Z,2990802,23443,2244,3420,False
PTIT DELIRE,18,17.20.11,PRIMEâ€“ Bail 2 Sneakers,10,2017-11-19T18:00:03.000Z,107967,8606,100,327,False
Sofiane Officiel,18,17.28.12,Sofiane - #JesuispassÃ©chezso : Episode 11,10,2017-12-27T15:00:08.000Z,683400,46843,1448,3337,False
SUPREME SNAPCHAT,17,17.28.12,Benjamin CHOQUÃ‰ par les Ã‰PISODES des PRINCES de l'AMOUR 5 !,22,2017-12-27T11:23:19.000Z,10578,71,9,14,False
Riding Zone,17,17.22.11,Zap ExtrÃªme : il se coince la tÃªte en tombant avec son VTT ! Slider une Slackline en Ski...,17,2017-11-21T17:21:36.000Z,64729,2053,27,74,False
Abdelbaath,17,17.09.12,Ø¨Ø§Ù„ÙÙŠØ¯ÙŠÙˆ Ù‚Ù†Ø§Ø© ÙØ±Ù†Ø³ÙŠØ© ØªÙØ¶Ø­ ÙØ¨Ø±ÙƒØ© Ø§Ù„Ù‚Ù†Ø§Ø© Ø§Ù„Ø¬Ø²Ø§Ø¦Ø±ÙŠØ© Ù„Ù„Ù‚Ø§Ø¡ Ø¨ÙˆØªÙÙ„ÙŠÙ‚Ø© Ù…Ø¹ Ù…Ø§ÙƒØ±ÙˆÙ†,10,2017-12-08T15:30:04.000Z,259800,1153,356,862,False
Premium Sintesi,17,17.24.12,Real Madrid vs Barcelona 0-3 - All Goals & Highlights - 23/12/2017 HD,17,2017-12-23T13:56:33.000Z,3826984,42076,2595,3657,False
Kirby-54,17,17.14.11,Vide grenier LIVE - 12 Novembre 2017,20,2017-11-12T13:46:18.000Z,20744,1032,558,243,False
Ø³Ø§Ù…Ø­ÙŠÙ†ÙŠ beni affet,17,18.17.02,Ø­Ù„Ù‚Ø© Ø§Ù„ÙŠÙˆÙ… Ø§Ù„Ø§Ø«Ù†ÙŠÙ† 1362 Ù…Ù† Ù…Ø³Ù„Ø³Ù„ Ø³Ø§Ù…Ø­ÙŠÙ†ÙŠ Ø¹Ù„Ù‰ 2M samhini,22,2018-02-16T09:36:18.000Z,94451,539,105,18,False
Britain's Got Talent,17,18.15.04,Marc Spelmann gets the first Golden Buzzer of 2018 | Auditions Week 1 | Britainâ€™s Got Talent 2018,24,2018-04-14T19:53:33.000Z,727663,34109,547,0,True
Ø¨Ø±Ø§Ù…Ø¬ ++ Baramidj,17,17.17.12,Ø¹Ù†Ø¯ÙŠ Ù…Ø§ Ù†Ù‚Ù„Ùƒ Ø§Ù„Ù…ÙˆØ³Ù… 10 Ø§Ù„Ø¹Ø¯Ø¯ 15 Ù„ÙŠÙˆÙ… 15/12/2017 Andi Mankolik S10 Episode,22,2017-12-16T01:50:01.000Z,21214,118,24,14,False
Netflix,17,17.26.11,Black Mirror - Arkangel | Official Trailer [HD] | Netflix,24,2017-11-25T14:30:01.000Z,823882,13276,561,1735,False
Madame Patachou,17,17.16.11,Calligraphie DÃ©co âªCOLOUR HAPPY EDDING,24,2017-11-15T10:00:02.000Z,6898,561,9,123,False
Gabin et Lili,17,18.08.05,VLOG : UN MUSÃ‰E TRÃˆS SPÃ‰CIAL,1,2018-05-07T15:50:02.000Z,47868,1941,123,650,False
Disney FR,17,17.19.11,Les Indestructibles 2 - PremiÃ¨re bande-annonce,1,2017-11-18T15:49:35.000Z,96529,3861,34,323,False
Le PÃ©rave,17,17.26.12,IL AURAIT VOULU QUE SON ENTERREMENT SOIT UNE FÃŠTE...,22,2017-12-24T12:28:31.000Z,20423,2674,16,45,False
Kalash972,17,18.03.01,Kalash - Willie Lynch- InÃ©dit Janv 2018,10,2018-01-02T12:38:16.000Z,98002,6215,122,302,False
Brut,17,17.29.11,La familiaritÃ© d'Emmanuel Macron face au prÃ©sident du Burkina Faso,25,2017-11-28T18:05:16.000Z,51500,124,32,104,False
philippe jandrok,17,17.04.12,Monsatanique et ses suppÃ´ts!,22,2017-12-03T11:58:26.000Z,4475,390,14,0,True
AshComps7,17,18.16.01,Liverpool vs Manchester City 4-3 - All Goals & Extended Highlights - EPL 14/01/2018 HD,17,2018-01-14T20:46:28.000Z,2716575,13843,761,1156,False
PureBreak,17,17.09.12,NORÃ‰ (SECRET STORY 11) BIENTÃ”T PAPA ? - Purebreak,22,2017-12-08T17:15:52.000Z,7197,68,6,11,False
LE MONDE DES VIDÃ‰OS,17,17.15.11,Karim Benzema avec BOOBA DIT ENFIN pourquoi il ne chante pas La Marseillaise ! ZAPPING TV,24,2017-11-13T16:00:01.000Z,51798,286,44,164,False
AFRICA INFOS,17,17.19.11,GLORIA OLANGI NA HÃ‰RITIER WATA BA YINDISI NA MATANGA YA Charly MOBUTU NA MORGUE.,24,2017-11-18T17:22:15.000Z,17059,123,59,324,False
llebof,17,17.21.11,Je vous montre la derniÃ¨re moto que j'ai achetÃ© - 250 KTM ENDURO !!!,20,2017-11-20T16:00:03.000Z,74690,10082,114,396,False
Ù…Ø­Ù…Ø¯ Ø§Ù„Ù…Ù‡Ø§Ø¬Ø±,17,17.03.12,Ù…Ø³Ù„Ø³Ù„ Ø¹Ø±ÙˆØ³ Ø§Ø³Ø·Ù†Ø¨ÙˆÙ„ Ø§Ù„Ø­Ù„Ù‚Ø© 27 ÙƒØ§Ù…Ù„Ø© Ù…ØªØ±Ø¬Ù…Ø© Full HD,1,2017-12-02T15:08:05.000Z,176937,1530,136,304,False
Les As de la Jungle,17,17.24.11,Les As de la Jungle - Les As Du Volant (1x34),1,2017-11-22T07:00:01.000Z,28344,213,13,11,False
Alex & PJ,17,17.29.11,ON A CRÃ‰E UNE NOUVELLE MARQUE ! HADDES ğŸ›ğŸ¦…,24,2017-11-28T17:20:09.000Z,31240,2454,74,277,False
Nicocapone,17,18.11.02,la saint valentin avec ta copine portugaise,23,2018-02-10T17:10:51.000Z,2248,236,1,7,False
BlackMVEVO,17,17.23.12,Black M - Mais qui es-tu ? (Clip officiel),10,2017-12-22T17:00:06.000Z,113268,10969,462,1026,False
FOOTBALL PASSION,17,18.07.03,"GRAND DEBRIEF PSG-REAL(1-2) PARIS DECOIT,EMERY VIRE,LE CADRES DOIVENT PARTIR",17,2018-03-07T01:16:04.000Z,4842,96,9,39,False
ActualitÃ©s du jour,16,18.15.03,Johnny Hallyday :la fin de l'histoire de l'hÃ©ritage grÃ¢ce a cet enregistrement des derniÃ¨res volontÃ©,22,2018-03-10T16:20:07.000Z,62440,77,379,21,False
PUN,16,17.19.11,MES MEILLEURS PACKS SUR FIFA 18 !,10,2017-11-17T16:46:04.000Z,51911,2701,67,89,False
Rewmi Buzz,16,17.22.11,Khalass avec Mamadou M. Ndiaye et Ndoye Bane du Mardi 21 Novembre 2017,25,2017-11-21T09:57:29.000Z,21681,263,53,75,False
Jorian Ponomareff,16,17.19.11,ON RÃ‰PARE LE DAX - MÃ©canique de GalÃ©rien !,24,2017-11-18T17:53:12.000Z,270255,29332,124,2270,False
POTATOZ,16,17.25.12,P*TE en 20 LANGUES diffÃ©rentes !,23,2017-12-22T16:00:53.000Z,304932,35933,1036,1965,False
REACT,16,17.20.11,DO TEENS KNOW 2000s MUSIC? #10 (REACT: Do They Know It?),24,2017-11-19T20:00:01.000Z,498617,16751,257,3756,False
Niska Officiel,16,18.04.01,Niska - Tubalife Feat. Booba,10,2018-01-03T10:53:46.000Z,1280447,113117,2511,8618,False
Wankil Studio - Laink et Terracid,16,17.25.11,LE SECRET DE LA MEILLEURE RECETTE DU MONDE,20,2017-11-24T11:00:07.000Z,286779,52737,669,2394,False
MIND CONTROL,16,18.24.01,La mort programmÃ©e du Monde - Partie 3 (FR) 2018,25,2018-01-23T13:12:25.000Z,6989,231,14,106,False
Marvel Entertainment,16,17.29.11,Avengers: Infinity War Trailer Tease,24,2017-11-28T17:09:22.000Z,3111226,127081,12404,18233,False
Benjamin Verrecchia,16,17.23.11,Les inventions inutiles feat. Pierre Croce,23,2017-11-22T15:00:00.000Z,211521,15350,270,657,False
Matt Stonie,16,17.20.12,"Harold & Kumar White Castle Challenge (9,660 Calories)",24,2017-12-19T21:11:06.000Z,390821,26234,254,2368,False
LE CHRONISHIRT,16,18.14.01,LES 12 COUPS DE MIDI L'ETOILE ENFIN DEVOILEE,25,2018-01-13T12:27:37.000Z,37883,171,326,92,False
Bruno S.,16,18.19.01,Christophe Dugarry dÃ©truit Neymar puis se fait clasher en direct par un auditeur,17,2018-01-18T19:19:02.000Z,4213,21,6,38,False
VegedreamVEVO,16,18.27.01,Vegedream - Marchand de sable Part. 4 (Du SAal),10,2018-01-26T10:00:03.000Z,89013,5298,116,207,False
CHANNEL-TV,16,18.02.01,Ø³ÙƒÙŠØªØ´ Ø®Ø·ÙŠÙŠÙŠØ± Ø²Ù‡ÙŠØ± Ø²Ø§Ø¦Ø± ÙÙŠ Ø­ÙÙ„ Ø±Ø£Ø³ Ø§Ù„Ø³Ù†Ø© 2018,22,2018-01-01T01:00:09.000Z,209093,1670,333,152,False
Ghost'N'us Paranormal,16,17.24.11,[ TEASER - EXTRAIT ] EPISODE 14 - UNE VITRE SE CASSE !,24,2017-11-23T18:59:25.000Z,2069,152,6,10,False
Lord Esperanza,16,17.11.12,Lord Esperanza - Oh Lord,10,2017-12-10T17:00:01.000Z,40364,6981,58,533,False
Juliette Tresanini,16,17.02.12,La productrice (feat. AUDREY PIRAULT) - Mini-Court,23,2017-12-01T15:00:01.000Z,22140,2996,25,61,False
Natacha Birds,16,17.25.11,"Les Bonnes Choses de la semaine #15. (de la peinture, disney et un shooting)",26,2017-11-24T18:40:46.000Z,7216,1093,2,36,False
Rapelite.com,16,17.18.11,"Lacrim : R.I.P.R.O. 3, musique, Damso, Ninho, Gims, Mister You,qualitÃ©, dÃ©faut,dÃ©ceptions,souvenirs",24,2017-11-17T16:59:18.000Z,79309,1645,45,216,False
Dzair Now,16,18.18.05,Ù‚Ø§Ù„Ù„Ù‡Ø§ Ø±Ø§Ù†ÙŠ Ø±Ø§ÙŠØ­ Ø­Ø±Ø§Ù‚Ø© Ù‡Ù‡Ù‡Ù‡ Ø´Ø§Ù‡Ø¯ Ø±Ø¯Ø© ÙØ¹Ù„Ù‡Ø§ - Ø£Ù„Ùˆ ÙŠØ§Ø³ÙŠÙ† Ø§Ù„Ø­Ù„Ù‚Ø© 1 -,23,2018-05-17T18:23:42.000Z,72506,831,97,137,False
FF Rugby,16,17.14.11,France - Nouvelle ZÃ©lande : Le rÃ©sumÃ©,17,2017-11-12T11:57:52.000Z,23795,140,3,14,False
DirtyBiology,16,17.26.11,Le paradoxe des drogues agrÃ©ables - DBY #38,28,2017-11-25T16:50:41.000Z,194033,22212,272,1339,False
Ikram Bellanova,16,17.17.11,Ø£Ø®ÙŠØ±Ø§ Ø±ÙˆØªÙŠÙ†ÙŠ Ø§Ù„ØµØ¨Ø§Ø­ÙŠ Ù„Ø£ÙˆÙ„ Ù…Ø±Ø© /ÙƒÙŠÙ Ø­Ø¶Ø±Øª Ù†ÙØ³ÙŠ Ù„Ø¹Ø²ÙˆÙ…Ø© ØºØ°Ø§Ø¡ Ù…Ø¹ ØµØ¯ÙŠÙ‚Ø§Øª Ø§Ù„Ø¹Ù…Ù„ ğŸ˜¬ Ù…ÙƒÙŠØ§Ø¬ Ù„ÙƒÙ„ ÙŠÙˆÙ… ğŸ˜ğŸ˜ğŸ˜,24,2017-11-16T12:35:53.000Z,83919,5395,280,1405,False
Nicholas Hardin,16,17.18.11,LES MARSEILLAIS VS LE RESTE DU MONDE 2 â€ Ã‰pisode 56 Video du 17/11/2017 â€ En Direct HD,24,2017-11-17T21:09:18.000Z,4488,25,0,0,False
RTI Officiel,16,17.16.12,C'Midi SpÃ©ciale KEDJEVARA DJ de RTI 1 du 15 DÃ©cembre 2017 par Caroline DASYLVA,25,2017-12-15T15:10:16.000Z,18830,434,24,88,False
permaculture agroÃ©cologie etc...,16,17.18.11,les mares,27,2017-11-16T16:39:18.000Z,12285,1008,11,134,False
Mister Officiel,16,17.14.12,HASSAN - EN BOITE DE NUIT,23,2017-12-13T17:01:16.000Z,251572,36285,449,1635,False
ITV,16,17.16.11,#PARADISE PAPERS : Nigel Farage Nous Dit Tout !! - VOF - ITV / Gemini48,25,2017-11-15T13:10:48.000Z,3080,245,6,41,False
Baly et Capucine,16,17.28.12,ACE EST MONTÃ‰ POUR LA PREMIÃˆRE FOIS !!! - Ca passe ou Ã§a casse ?!,15,2017-12-27T10:00:00.000Z,24674,3052,19,351,False
Eurovision Song Contest,16,18.12.03,Netta - TOY - Israel - Official Music Music - Eurovision 2018,24,2018-03-11T19:07:42.000Z,212393,11783,2620,3476,False
orelsan,16,17.16.11,OrelSan - Tout va bien [CLIP OFFICIEL],10,2017-11-15T12:07:54.000Z,1267473,111445,1663,5994,False
RaparolesVEVO,16,18.28.02,Lartiste - Detaler (Officiel),10,2018-02-27T07:33:10.000Z,23427,556,13,16,False
PENTA FOOT,15,17.12.12,"GRAND DEBRIEF TIRAGE LIGUE DES CHAMPIONS: PSG-REAL,BARCA-CHELSEA",22,2017-12-11T15:31:52.000Z,32005,290,15,66,False
nicolas stavroguine,15,17.23.11,lilian thuram sur l'esclavage en libye   c'est l'histoire qui fait Ã§a ,25,2017-11-21T09:34:53.000Z,40354,639,39,738,False
Marwa Loud,15,17.23.12,Marwa Loud - Fallait pas,22,2017-12-22T17:24:46.000Z,274115,16893,1013,1063,False
Louis-San,15,17.23.11,Ma Nouvelle Vie d'APPRENTI YOUTUBEUR,24,2017-11-22T16:30:08.000Z,33806,4683,23,477,False
France 3 Auvergne-RhÃ´ne-Alpes,15,17.23.11,Vienne : un homme fauchÃ© par un train alors qu'il fuyait la police,25,2017-11-22T17:52:42.000Z,2307,18,1,0,True
ÙˆÙÙ„Ø¯Ù’ Ø§Ù„Ø´ÙÙ‘Ø¹Ø¨Ù’ Ø£ÙˆÙ†Ù’ Ù„Ø§ÙÙŠÙ’Ù†Ù’,15,18.12.03,Ø­ØµØ±ÙŠØ§..Ù‡Ø°Ù‡ Ø­Ù‚ÙŠÙ‚Ø© ØµÙˆØ±Ø© Ø§Ù„Ø£Ù…ÙŠØ±Ø© Ù„Ù„Ø§ Ø³Ù„Ù…Ù‰ Ø¨Ø³Ø±ÙˆØ§Ù„ Ù…Ù‚Ø·Ø¹ Ø¨Ø¨Ø§Ø±ÙŠØ³,22,2018-03-10T22:09:36.000Z,204501,503,240,221,False
Guizmo,15,17.23.11,Guizmo Les gens parlent d'amour / Amicalement VÃ´tre / Y&W,10,2017-11-22T17:02:50.000Z,53830,4708,36,298,False
MigosVEVO,15,17.08.12,"Migos, Nicki Minaj, Cardi B - MotorSport",10,2017-12-08T02:12:48.000Z,601001,67460,987,10252,False
Bokeseni Ezali TV,15,17.15.11,"MUNDELE Asaboli CARINE MOKONZI,GRÃ‚CE MBIZI,JAEL SWOH,GLORIA OLANGI Nani Aza Na SIDA Apanzi Bango MAB",24,2017-11-14T09:44:18.000Z,10799,106,11,49,False
LefaAuthentiqueVEVO,15,18.12.01,Lefa - Fais-le (Clip Officiel),10,2018-01-11T17:00:03.000Z,65649,6805,61,406,False
PLK TV,15,17.20.11,PLK - Yeux [Clip Officiel],10,2017-11-19T16:59:32.000Z,35052,4757,32,241,False
Fazilet HanÄ±m ve KÄ±zlarÄ±,15,17.26.11,Fazilet HanÄ±m ve KÄ±zlarÄ± 24. BÃ¶lÃ¼m,22,2017-11-25T21:05:51.000Z,256182,3509,898,1342,False
L'Ermite Moderne,15,17.17.12,Disney va dominer le Monde ! - Ermite VLOG (rachat de la Fox),24,2017-12-16T15:14:29.000Z,71538,6548,97,1296,False
RCLens,15,17.04.12,Le rÃ©sumÃ© de Lens - Reims en Coupe de France,17,2017-12-03T17:39:12.000Z,9457,132,1,6,False
20th Century Fox,15,17.16.11,Deadpoolâ€™s â€œWet on Wetâ€ Teaser,1,2017-11-15T14:01:03.000Z,3979891,151851,2378,8079,False
El Djazairia One,15,18.15.02,Ø§Ù„Ø´Ø§Ø¨Ø© Ø®ÙŠØ±Ø© ØªØ±ÙˆÙŠ Ù„Ø£ÙˆÙ„ Ù…Ø±Ø© ØªÙØ§ØµÙŠÙ„ ÙˆØ§Ù†ØªØ­Ø§Ø± Ø§Ø¨Ù†ØªÙ‡Ø§ .,25,2018-02-14T20:27:23.000Z,242410,2150,256,989,False
Ø¹Ø§Ù„Ù… ØºØ²Ù„Ø§Ù†,15,17.28.12,"Ù‡Ø±Ø¨Øª Ù…Ù† Ø¯Ø§Ø±ÙŠ Ø§Ù†Ø§ ÙˆÙ„Ø¯ÙŠ  Ù„ØªØºÙŠÙŠØ± Ø±ÙˆØªÙŠÙ†ÙŠ Ø§Ù„ÙŠÙˆÙ…ÙŠ, ÙŠÙˆÙ… Ù…Ù† Ø­ÙŠØ§ØªÙŠ ,Ø¹Ù…Ù„ Ù…Ø´ØªØ±Ùƒ Ù„Ø§ØªØ­Ø§Ø¯ Ø§Ù„ØµØ¯Ø§Ù‚Ø© Ù„Ù„ÙŠÙˆØªÙˆØ¨Ø±Ø²",22,2017-12-27T16:14:10.000Z,15188,958,67,227,False
JustJonathan,15,17.25.11,7 COUCHES DE SLIME ?!! JustJonathan,24,2017-11-24T17:00:02.000Z,66900,4224,275,574,False
- æ¬¢è¿è®¢é˜… -æµ™æ±Ÿå«è§†ã€å¥”è·‘å§ã€‘å®˜æ–¹é¢‘é“,15,18.14.04,ã€EP.1ã€‘è·‘ç”·å›¢çƒ­è¡€å›å½’ ç«Ÿåœ¨ç»´ä¹Ÿçº³é­é‡â€œå²ä¸Šæœ€éš¾æŒ‘æˆ˜â€ é¹¿æ™—å½¢è±¡åå¡Œè¢«å“ä¸¢é­‚ å­¦éœ¸é‚“è¶…å¤§é£šè‹±è¯­æƒŠçˆ†è”åˆå›½ ã€Šå¥”è·‘å§2ã€‹ 20180413 Keep Running S2 [ æµ™æ±Ÿå«è§†å®˜æ–¹HD ],24,2018-04-13T16:48:40.000Z,471471,6874,1021,2442,False
HBMONDEINFO TV,15,17.19.11,AHHH NON KISIDJORA AWUTI WAPI PO NIVEAU ASAMBUISI FERRE NA CARINE EHH PO KOZUA IDEE TE TOLANDA,22,2017-11-18T17:58:45.000Z,9075,102,32,76,False
EminemVEVO,15,17.14.11,Eminem - Walk On Water (Audio) ft. BeyoncÃ©,10,2017-11-10T17:00:03.000Z,17158579,787425,43420,125882,False
mehdi,15,18.09.03,samhini 1374,1,2018-03-07T21:48:31.000Z,97433,849,92,56,False
ibighit,15,17.17.11,BTS (ë°©íƒ„ì†Œë…„ë‹¨) 'MIC Drop (Steve Aoki Remix)' Official Teaser,10,2017-11-16T15:00:05.000Z,3483755,789767,2840,72376,False
The Film Theorists,15,18.20.01,Film Theory: How Star Wars Theories KILLED Star Wars: The Last Jedi!,1,2018-01-19T19:05:50.000Z,1680809,82526,6116,25932,False
La France insoumise,15,17.17.11,DÃ‰CRYPTAGE - Â«Paradise PapersÂ» - Les clÃ©s du paradis (fiscal) aux mains des riches - #DecryptageFi,25,2017-11-16T20:15:21.000Z,3365,709,2,36,False
Aboudrar Aziz,15,17.19.12,"ROUND 7 : TU RIS, TU PERDS .... SPÃ‰CIALE BEAUF !",23,2017-12-18T17:22:36.000Z,130256,8634,316,332,False
FrÃ©dÃ©ric JEAN,15,17.22.11,Bio/local - VÃ©gÃ©talien - Sans sucre* - Manger pour 3â‚¬ par jour - Jour 2 : Lasagnes vÃ©gÃ©tales,22,2017-11-21T16:30:00.000Z,9400,597,2,302,False
TÃ©lÃ© Star,15,17.07.12,Comment les chaÃ®nes info ont annoncÃ© la mort de Johnny Hallyday,24,2017-12-06T11:23:40.000Z,67049,292,33,112,False
COLORS,15,17.20.12,AminÃ© - Yellow | A COLORS SHOW,10,2017-12-19T19:00:03.000Z,73490,9050,64,469,False
ScienceEtonnante,15,17.25.11,Tous racistes ? Les biais implicites â€” CrÃ©tin de Cerveau #7,28,2017-11-24T16:00:02.000Z,67342,6163,117,809,False
Ù†Ø§Ø±ÙŠØ² I NAEIS,15,18.24.03,Ù…Ù„Ø®Øµ Ù…Ø¨Ø§Ø±Ø§Ø© ØªÙˆÙ†Ø³ ÙˆØ§ÙŠØ±Ø§Ù† 1-0 - ÙÙˆØ² ØµØ¹Ø¨ Ù„Ù„Ù…Ù†ØªØ®Ø¨ Ø§Ù„ØªÙˆÙ†Ø³Ù‰ - Ù…Ø¨Ø§Ø±Ø§Ø© ÙˆØ¯ÙŠØ©,22,2018-03-23T20:03:13.000Z,264280,1327,236,0,True
JC2R Officiel,15,17.25.11,LUCIS TRUST : Lucifer le MaÃ®tre de l'ONU #Antichrist 666 #New Age - Novembre 2017,25,2017-11-24T10:00:01.000Z,4745,408,9,248,False
INFO WORD TM,15,17.19.12,French Baloo rÃ©agit sur la photo d'Antoine Griezmann (BLACKFACE) | INFO WORD,23,2017-12-18T08:40:13.000Z,8138,95,74,102,False
Nouvelles 24,15,17.18.11,Johnny HallyÂ­day hospiÂ­taÂ­lisÃ© d'urgence pour dÃ©tresse respiÂ­raÂ­toire | Nouvelles 24,25,2017-11-17T12:03:08.000Z,9204,18,8,8,False
Dr Bot,15,17.14.11,"Si vous voyez ceci en forÃªt, courez vite et demandez de l'aide!",27,2017-11-10T18:36:15.000Z,1388115,17378,6835,1517,False
les replay Ã  la corsica,15,18.27.01,25/01/18 SKYROCK radio libre du jeudi 25 janvier 2018,23,2018-01-26T06:52:35.000Z,2339,0,0,2,False
Speedy,15,18.20.01,Ninho - Caramelo (Clip),10,2018-01-18T21:25:05.000Z,113099,3132,86,102,False
LEVY,15,17.26.11,QUELLE EQUIPE SERA LA PLUS PRECISE SUR COUP FRANC ?! (3 vs 3),17,2017-11-24T16:00:01.000Z,24542,1184,21,47,False
SpaceX,14,17.16.12,CRS-13 Hosted Webcast,28,2017-12-15T16:35:18.000Z,472573,13691,406,1355,False
SÃ©verine Jenny,14,17.19.11,DIY NOÃ‹L : Calendrier de l'Avent KAWAII (franÃ§ais),26,2017-11-18T08:02:22.000Z,23433,1997,16,418,False
Hassan El Fad | Ø­Ø³Ù† Ø§Ù„ÙØ¯,14,18.20.05,Kabour et Lahbib 2018 : Episode 02 | Ø¨Ø±Ø§Ù…Ø¬ Ø±Ù…Ø¶Ø§Ù† : ÙƒØ¨ÙˆØ± Ùˆ Ù„Ø­Ø¨ÙŠØ¨ 2018 - Ø§Ù„Ø­Ù„Ù‚Ø© 02,23,2018-05-18T20:41:41.000Z,447897,5967,2677,1242,False
INFIRES ME HOSEOK DAY,14,18.22.02,Le JIKOOK s'amuse ENFIN en compagnie de cette K-IDOL !,22,2018-02-21T22:40:24.000Z,1212,221,0,14,False
Vijay Television,14,17.05.12,Raja Rani - 4th to 8th December 2017 - Promo,24,2017-12-04T06:41:39.000Z,623493,3434,267,252,False
Eva lespetitsplats,14,17.22.11,Spaghettis Volognaise / VEGAN,23,2017-11-21T11:12:04.000Z,6141,999,2,147,False
Deja Vu,14,18.02.01,ğŸ” LES 10 FILLES DE TÃ‰LÃ‰ RÃ‰ALITÃ‰ QUI ONT LE PLUS DE CONQUÃŠTES ğŸ’,24,2018-01-01T21:20:18.000Z,43674,534,94,219,False
Le petit journal de Marseille pekos,14,17.30.11,Metz vs OM : Le RÃ©sumÃ© et Les buts !!,17,2017-11-29T20:58:54.000Z,29284,239,30,17,False
Ä°stanbullu Gelin,14,17.25.11,Istanbullu Gelin 26. BÃ¶lÃ¼m,22,2017-11-24T20:46:09.000Z,264341,2779,258,501,False
MoroccoTalksFootball,14,17.17.11,Ø§Ù„Ù…Ø¨Ø§Ø±Ø§Ø© Ø§Ù„ØªÙŠ Ø£Ø¨Ø¯Ø¹ ÙÙŠÙ‡Ø§ Ø­ÙƒÙŠÙ… Ø²ÙŠØ§Ø´ Ø±ÙÙ‚Ø© Ø§Ù„Ù…Ù†ØªØ®Ø¨ Ø§Ù„ÙˆØ·Ù†ÙŠ Ø§Ù„Ù…ØºØ±Ø¨ÙŠ,17,2017-11-16T13:17:18.000Z,92669,531,60,35,False
France 3 Bourgogne-Franche-ComtÃ©,14,17.15.11,Affaire Alexia Daval : Mon client est trÃ¨s touchÃ© par certaines rumeurs explique l'avocat du mari,25,2017-11-14T11:30:48.000Z,15481,8,5,23,False
HowToBasic,14,17.18.11,How To Make a Breakfast Pizza,26,2017-11-17T17:59:03.000Z,574332,49588,1913,5298,False
DAKARBUZZ TV,14,18.25.03,DIRECT - SUIVEZ LE DERNIER FACE A FACE BALLA GAYE 2 - GRIS BORDEAU,22,2018-03-25T00:46:04.000Z,70272,787,69,69,False
IbraTV,14,17.16.12,JE CRÃ‰E Lâ€™Ã‰MEUTE EN RE DONNANT Lâ€™ARGENT AUX ABONNÃ‰S,24,2017-12-15T17:07:37.000Z,365945,33823,3765,2805,False
VALDVEVO,14,17.26.12,Vald - Teaser Crowdfunding trilogie JE Tâ€™AIM3,10,2017-12-25T09:00:01.000Z,115772,11084,145,393,False
Hornet La Frappe,14,17.16.11,Hornet La Frappe - MaghrÃ©bin (Clip officiel),10,2017-11-15T15:00:04.000Z,403553,31761,584,2107,False
Nextplz,14,17.18.11,J'ai/Je n'ai jamais : Kaaris est plein d'humour !,24,2017-11-17T16:00:57.000Z,7779,174,8,3,False
Observateur,14,18.12.01,KOUAKOU SUR LE COUP-EPISODE 1-LE FOU,23,2018-01-10T16:00:02.000Z,30186,2523,20,94,False
Dj Traffix Officiel,14,18.25.02,Lorenzo feat Vald - Bizarre,22,2018-02-23T20:14:39.000Z,28455,1014,7,70,False
Margaret Kitson,14,17.15.11,MariÃ©s au premier regard - Saison 2 - Episode 2 - VidÃ©o du Lundi 13 novembre 2017,24,2017-11-14T02:12:53.000Z,19124,160,17,17,False
Thegrims TV,14,17.14.11,LE PETIT YAYA 8 ğŸ˜° Avec la participation de  Q.E Favelas et Tonton Marcel,23,2017-11-11T22:29:37.000Z,74564,2585,82,290,False
Fanta France,14,18.25.04,LA STORY DU JOUR EP #1 : LES 20 FINALISTES FANTAxYOU 2 !,23,2018-04-24T16:00:24.000Z,33063,2186,207,598,False
Maybelline New York FR,14,17.24.11,T'as Pas du Gloss ? #112 : Bien choisir son mascara avec EnjoyPhoenix et Perfecthonesty,26,2017-11-23T16:30:00.000Z,11854,704,15,32,False
DORETDEPLATINE,14,17.02.12,JuL - La tÃªte dans les nuages // Clip Officiel // 2017,10,2017-12-01T11:00:05.000Z,608548,34973,2432,2899,False
Audio Music,14,17.19.12,"Bruno Mars,Charlie Puth,Ed Sheeran Best Christmas Songs,Greatest Hits Pop Playlist Christmas 2018",10,2017-12-18T07:23:07.000Z,1360811,4973,1439,187,False
Warner Bros. Pictures,14,17.17.11,RAMPAGE - OFFICIAL TRAILER 1 [HD],24,2017-11-16T21:15:08.000Z,2585193,40779,3499,8834,False
JHON RACHID,14,17.14.11,Mes Sosies,23,2017-11-10T17:14:36.000Z,855508,50955,958,1104,False
OGC Nice,14,17.23.11,Le Zap'Gym nÂ°118,17,2017-11-22T14:19:56.000Z,3772,152,1,3,False
NIXBLACK,14,17.06.12,CSKA vs MNU 1-2 All goals & Highlights English Commentary (05/12/2017) HD/1080P,17,2017-12-05T22:16:55.000Z,907759,2413,233,172,False
NessmaTV,14,18.24.05,Nsibti la3ziza 8 - Episode 7 | Ù†Ø³ÙŠØ¨ØªÙŠ Ø§Ù„Ø¹Ø²ÙŠØ²Ø© 8 - Ø§Ù„Ø­Ù„Ù‚Ø© 7 - Partie 1,1,2018-05-23T19:06:44.000Z,43871,270,17,25,False
Football TV-2,14,18.27.04,Bayern Munich vs Real Madrid 1-2 - Highlights Extended - Resuemn (2018),17,2018-04-26T11:15:12.000Z,421481,2426,254,132,False
Odah_Dako,14,17.16.11,Les (petits) mythos dans un couple,23,2017-11-15T12:17:01.000Z,16164,1246,3,16,False
Hespress,14,18.17.01,ØªØ¹Ù„ÙŠÙ‚Ø§Øª Ø§Ù„Ù…Ø­Ø§Ù…ÙŠÙ† Ø¨Ø¹Ø¯ Ø§Ù„Ø­ÙƒÙ… Ø¹Ù„Ù‰ Ù‚Ø§ØªÙ„ Ù…Ø±Ø¯Ø§Ø³ Ø¨Ø§Ù„Ø¥Ø¹Ø¯Ø§Ù…,25,2018-01-16T08:48:32.000Z,47225,126,26,60,False
YoMax,14,17.17.11,VLOG | PANNE & DÃ‰SILLUSION | ITALIE - SUÃˆDE,20,2017-11-16T17:00:04.000Z,83687,6929,69,740,False
JC's Workshop,14,18.07.01,Comment faire une armoire murale avec porte en OSB - Partie 1 -  Travail du bois - #73,26,2018-01-06T18:00:01.000Z,1899,179,5,20,False
Blossom,14,18.18.01,SUPER COOL WINTER LIFE HACKS AND CRAFTS and MORE by Blossom,26,2018-01-17T11:21:00.000Z,960014,17741,731,468,False
La Biscotte,14,18.09.01,TPLM - Saison 2,24,2018-01-08T18:16:25.000Z,44809,6109,12,433,False
Pakgne Official,14,17.12.12,Mamy japapap,24,2017-12-11T18:39:21.000Z,19802,2161,27,180,False
L'histoire racontÃ©e par des chaussettes,14,18.12.03,L'histoire racontÃ©e par des chaussettes - STREET FIGHTER 2,23,2018-03-10T10:00:01.000Z,67048,5966,44,181,False
Would You React ?,14,17.14.11,ExpÃ©rience Sociale #49: ALTRUISME vs. IGNORANCE,27,2017-11-13T16:03:39.000Z,57030,4315,59,620,False
Mx18,14,17.14.11,FIFA 18 PENALTY VS PENALTY FOOT IRL VS MES FRERES - CHANTILLY CHALLENGE !!!,20,2017-11-12T09:30:01.000Z,55785,3216,82,237,False
ARTEplus7,14,17.19.11,Le mystÃ©rieux volcan du Moyen Ã‚ge - ARTE,1,2017-11-18T16:03:29.000Z,3153,71,1,4,False
PsYkO17,14,17.21.11,UNE DRAFT COMPLÃˆTE - FIFA18,20,2017-11-20T16:21:29.000Z,110863,7639,75,139,False
103 mob stories,14,17.17.11,Mettre un decompresseur sur cylindre sans decompresseur,2,2017-11-16T10:05:59.000Z,4018,218,5,36,False
Bruce & les Guez !,14,17.14.11,FIFA 18 - ESWC - LES PAPYS FONT DE LA RÃ‰SISTANCE !,20,2017-11-13T15:28:00.000Z,50862,6634,19,150,False
KILLUMINATY SMG OFFICIEL,14,17.20.11,Sofiane Molenbeek - Black M sa assume pas (KILLUMINATY SMG),10,2017-11-18T19:31:01.000Z,40729,1926,134,594,False
iProMx,14,17.20.11,ANNONCE URGENTE !,20,2017-11-19T18:35:57.000Z,25461,3438,88,690,False
Troll Et Humour,14,17.21.12,26 situations dÃ©lirantes qui vont vous arracher un sourire,22,2017-12-20T17:10:10.000Z,6175,242,5,54,False
HYCONIQ MAG,14,17.19.11,"Kris Jenner, La Visionnaire DerriÃ¨re l'Empire Kardashian  - LSD #33",1,2017-11-17T21:15:17.000Z,29236,2869,19,511,False
jbalvinVEVO,13,18.20.01,"J. Balvin, Jeon, Anitta - Machika",10,2018-01-19T05:00:01.000Z,17746785,585588,43239,53759,False
Instrumental Music Romantic,13,17.30.11,Most Popular Violin Covers of Popular Songs 2018 || Best Instrumental Violin Covers 2018,22,2017-11-28T16:00:05.000Z,238257,418,99,15,False
Closer,13,17.07.12,"Johnny Hallyday est mort : Philippe, le voisin de Marnes-la-Coquette, superstar des chaÃ®nes info",22,2017-12-06T09:13:04.000Z,108454,364,66,208,False
50 K Game Over,13,18.10.03,Ninho x MHD - BÃ©nÃ©fice (Clip officiel),22,2018-03-09T15:00:04.000Z,454493,26359,702,846,False
L'Express,13,17.23.11,Un sprint entre les balles: l'impressionnante dÃ©fection d'un nord-corÃ©en,25,2017-11-22T09:47:35.000Z,4273,0,0,0,True
Djena Della,13,18.31.01,Il m'a laisseÌ tomber - Djena Della (cover lalgerino),10,2018-01-29T17:01:56.000Z,32287,2278,17,346,False
Brulux Officiel,13,17.15.11,Brulux - Rec (Clip Officiel),10,2017-11-13T19:00:01.000Z,373583,15319,560,961,False
Baraka lBaraka,13,17.11.12,Ù‚Ø¯ÙˆØ± Ùˆ Ø¹ÙˆÙŠØ´Ø© - Ø´Ù€Ù€Ù€Ù€Ù€Ù€Ø§Ù„Ø§Ø¯Ø§,23,2017-12-10T11:50:26.000Z,275849,12885,526,825,False
Vida46 - Tests & Quiz,13,17.27.11,QUEL TYPE DE DRAGON ES-TU ?,24,2017-11-26T09:06:06.000Z,6513,625,9,349,False
Emy LTR,13,17.01.12,Notre Weekend en Amoureux (avec Daniil Le Russe),26,2017-11-30T16:10:36.000Z,206530,16795,266,271,False
Asa Medina,13,18.07.04,Les Marseillais Australia - Ã‰pisode 31 - 06 Avril 2018,22,2018-04-06T19:06:10.000Z,73999,788,55,169,False
ChainsmokersVEVO,13,18.18.01,The Chainsmokers - Sick Boy,10,2018-01-17T15:00:02.000Z,1448694,135017,4843,12116,False
TEPA,13,17.22.12,Abus bancaires - DÃ©fendez vous avec Franck,25,2017-12-21T12:50:12.000Z,3492,283,12,47,False
PARIScompsHD,13,17.03.12,Ligue 1 - Strasbourg vs Paris SG 2-1 - All Goals & Full Highlights (02/12/17),17,2017-12-02T18:31:38.000Z,112593,828,100,439,False
Laurette,13,17.15.11,CE QUE MES ABONNÃ‰S M'ONT FAIT ACHETER !,26,2017-11-14T16:00:01.000Z,45639,4560,51,830,False
consumer,13,18.20.02,John Oliver - Parkland School Shooting,23,2018-02-19T07:06:26.000Z,490044,7197,278,1291,False
VIVRE SANS STRESS - CÃ©dric Michel,13,17.21.11,MeÌditation minimaliste treÌ€s douce ğŸŒ¼ CeÌdric Michel,10,2017-11-20T19:00:02.000Z,2761,244,4,17,False
Cyrus North,13,17.27.11,JE DEVIENS UN CYBORG,28,2017-11-26T15:34:29.000Z,57239,7448,231,675,False
MyFuckinMess,13,17.05.12,LA VÃ‰RITABLE RUPTURE DE MISS JIRACHI ET DAVID LAFARGE,23,2017-12-04T16:00:02.000Z,14294,1940,18,100,False
juste Lomepal,13,17.18.11,Lomepal - 70 (Clip officiel),10,2017-11-17T14:16:37.000Z,110714,11602,43,487,False
Mary - Frozencrystal,13,17.10.12,SCP-087 | CREEPYPASTA,20,2017-12-09T15:30:00.000Z,23689,3637,44,1003,False
Taupe10,13,17.16.11,TOP 10 des THÃ‰ORIES DU COMPLOT les plus CRÃ‰DIBLES,24,2017-11-15T18:42:16.000Z,227565,16485,725,1912,False
VisionTimeTamil,13,17.14.11,Vamsam - à®µà®®à¯à®šà®®à¯ | Tamil Serial | Sun TV |  Epi 1333 | 13/11/2017 | Vision Time,24,2017-11-13T16:00:01.000Z,72309,599,90,43,False
KendrickLamarVEVO,13,17.22.12,Kendrick Lamar - LOVE. ft. Zacari,10,2017-12-22T05:00:05.000Z,469554,95904,725,11132,False
Gibi ASMR,13,17.31.12,[ASMR] Tapping with Fingertips (& Binaural Ear-to-Ear Whispers),24,2017-12-30T23:56:34.000Z,95830,5423,67,1213,False
Danse avec les stars,13,17.14.11,DALS S08 - Lenni-Kim danse un Tango avec Denitsa Ikonomova sur What do you mean ? (Justin Bieber),24,2017-11-13T12:00:02.000Z,19004,618,4,44,False
C'est mon choix - La chaÃ®ne officielle,13,17.23.12,C'est mon choix // Je suis revenu de l'au-delÃ ,24,2017-12-22T11:30:01.000Z,8865,301,20,87,False
Demo Sophie,13,18.02.01,"5 MAI, JOUR DE LA TRANSITION",25,2018-01-01T01:02:16.000Z,5322,463,8,133,False
WORLDSTARHIPHOP,13,18.16.01,6IX9INE Feat. Fetty Wap & A Boogie â€œKEKEâ€ (WSHH Exclusive - Official Music Video),10,2018-01-14T20:00:35.000Z,3248447,160932,7255,18551,False
GussDx Video,13,17.17.11,Une nuit dans un vrai Manoir HantÃ© : trouver la rÃ©ponse ensemble,1,2017-11-16T16:32:19.000Z,56656,5985,134,1052,False
Felckin,13,17.14.11,CE DJ AVEUGLE VA VOUS SURPRENDRE !!!,10,2017-11-12T16:59:40.000Z,59376,4865,31,366,False
Vap' Extreme,13,17.15.11,PrÃ©sentation de la DotSquonk de chez Dotmod,24,2017-11-14T10:51:35.000Z,3781,168,9,40,False
Anthox Colaboy,13,17.18.11,LE CLASH DES ABONNES,24,2017-11-17T14:29:43.000Z,106173,7781,369,755,False
France 3 Occitanie,13,17.07.12,Montpellier : Richy le sosie de Johnny Hallyday parle de son idole,25,2017-12-06T15:26:23.000Z,19387,0,0,0,True
Solary,13,17.29.11,1 MOIS DE SOLARY : ET APRES ?,20,2017-11-28T19:00:01.000Z,24985,1179,7,126,False
David LefranÃ§ois,13,17.15.11,Pourquoi sommes-nous jaloux ?,26,2017-11-14T15:49:42.000Z,2803,199,4,13,False
Tommy Desrochers,13,18.04.02,La meilleure surface pour l'impression 3D ! (fini le BuildTak),28,2018-02-03T18:00:00.000Z,2498,333,4,78,False
Absol VidÃ©os,13,17.21.11,L'homme le plus connu du Dark Web,27,2017-11-20T16:15:49.000Z,139860,11811,172,1356,False
Equidia,13,17.20.11,Valko Jenilat - Grand Prix de Bretagne - Vincennes - 19/11/17,24,2017-11-19T15:12:28.000Z,3430,13,1,0,False
Ed Sheeran,13,17.14.11,Ed Sheeran - Perfect (Official Music Video),10,2017-11-09T11:04:14.000Z,33523622,1634134,21082,85067,False
Juju Fitcats,13,17.14.11,NATURAL FITNESS SHOW (LE FINAL !),17,2017-11-10T17:00:12.000Z,531627,53063,698,3726,False
RomÃ©o Elvis,13,18.07.02,RomÃ©o Elvis x Le Motel - Dessert,10,2018-02-06T16:59:04.000Z,124891,12072,95,500,False
Anes Tina,13,17.18.11,"Anes Tina Rani za3fane , Ø±Ø§Ù†ÙŠ Ø²Ø¹ÙØ§Ù†",23,2017-11-17T16:57:32.000Z,704358,125902,1427,18814,False
cuisine Halima Filali Ø´Ù‡ÙŠÙˆØ§Øª Ø¯Ø§Ø±ÙŠ,13,18.07.01,Ø®Ø¨Ø² Ø§Ù„Ù†Ø§Ù† Ø¨Ø§Ù„Ø¬Ø¨Ù† Ø¨Ø¯ÙˆÙ† ÙØ±Ù† Ù…Ù† Ø§Ø³Ù‡Ù„ Ù…Ø§ÙŠÙƒÙˆÙ† Ø®ÙÙŠÙ ÙˆÙ„Ø°ÙŠØ° Ø¬Ø¯Ø§ ÙŠØ§Ø³Ù„Ø§Ù…,26,2018-01-06T11:35:47.000Z,43344,3289,78,241,False
Atelier amateur bois & mÃ©tal,13,17.19.11,Comment affuÌ‚ter les lames de scie circulaire,28,2017-11-18T11:56:02.000Z,2940,123,5,10,False
Ramez Galal,13,18.18.05,Ø±Ø§Ù…Ø² ØªØ­Øª Ø§Ù„ØµÙØ± | Ø±Ø¯ ÙØ¹Ù„ Ø¹Ù†ÙŠÙ Ù…Ù† ÙŠØ§Ø³Ù…ÙŠÙ† ØµØ¨Ø±ÙŠ Ø¨Ø¹Ø¯ Ø§ÙƒØªØ´Ø§ÙÙ‡Ø§ Ù…Ù‚Ù„Ø¨ Ø±Ø§Ù…Ø² Ø¬Ù„Ø§Ù„,23,2018-05-17T17:31:50.000Z,1971747,15768,1980,2596,False
Bruno Un Nouveau Message,13,17.17.11,#49 Bruno Ã  la maison !!,24,2017-11-16T16:16:05.000Z,5743,382,4,19,False
Dakaractu TV HD,13,17.13.12,La mÃ¨re de Khalifa Sall prie : Â« BarkÃ© Salatou Fatiyaâ€¦Que Macky Sall aille en prison un jour Â»,25,2017-12-12T18:54:09.000Z,53922,447,23,139,False
Maskey,13,17.16.12,COMMENT FAIRE DU NISKA ? - LA RECETTE #7 - MASKEY,23,2017-12-16T01:23:33.000Z,214698,34357,134,2291,False
Rapunchline,13,17.19.11,"Lacrim parle du cas Benzema, Mister You, la guerre des clashs ...",10,2017-11-18T10:00:14.000Z,114145,1248,71,184,False
L Lawliet,13,17.18.11,YOUTUBE DÃ‰TRUIT YOUTUBE ...,24,2017-11-16T17:30:31.000Z,134060,15628,1070,3847,False
Les astuces de Margaux,13,17.26.11,"ORGANISATION : le BULLET JOURNAL | 3 exemples (minimaliste, dÃ©coration facile, doodle)",26,2017-11-25T12:15:42.000Z,19155,2136,12,214,False
L'Antiseche,13,18.22.01,La fac - feat Lolywood (partie 1/2),27,2018-01-21T13:00:03.000Z,94394,4389,63,136,False
Best News Dz,13,17.06.12,Ø´Ø§Ù‡Ø¯ Ø±Ø¯Øª ÙØ¹Ù„ Ø§Ù„Ø´Ø§Ø±Ø¹ Ø§Ù„Ø¬Ø²Ø§Ø¦Ø±ÙŠ  Ù„Ø²ÙŠØ§Ø±Ø© Ù…Ø§ÙƒØ±ÙˆÙ† Ù„Ù„Ø¬Ø²Ø§Ø¦Ø±,22,2017-12-04T20:55:59.000Z,44056,169,58,211,False
VD M.A,13,17.24.11,ØªÙØ§ØµÙŠÙ„ Ø§Ù„ØªÙ„Ù…ÙŠØ° Ù„ÙŠ Ø´Ø±Ù…Ù„ Ø§Ù„Ø§Ø³ØªØ§Ø°Ø© Ø¯ÙŠØ§Ù„Ùˆ ÙˆØ¶Ø±Ø¨Ù‡Ø§ ÙÙƒØ§Ø²Ø§..Ø¹Ù„Ù‰ Ù‚Ù†Ø§Ø© Ù…ØºØ±Ø¨ÙŠØ©,25,2017-11-23T18:13:20.000Z,29518,181,41,25,False
Rire et chansons L'appel trop con de Martin,13,18.16.01,Canular Martin DEMI PLEIN ENTIER Appel trop c0n,23,2018-01-15T17:00:05.000Z,1912,64,5,6,False
Celebrity News,13,17.07.12,Mort de Johnny HallyÂ­day : son ex-compagne Linda Hardy lui rend un Ã©mouÂ­vant hommage,24,2017-12-06T15:47:28.000Z,25493,44,14,17,False
Sara'h Officiel,13,17.21.12,ANASTASIA - LOIN DU FROID DE DÃ‰CEMBRE ( SARA'H COVER ),10,2017-12-20T17:02:35.000Z,128424,14386,269,1125,False
