,channel_title,no_of_vids,trending_date,title,category_id,publish_time,views,likes,dislikes,comment_count,comments_disabled,Unnamed: 0,Category_name
1563,danisnotinteresting,5,18.18.01,WHAT TO LEAVE IN 2017,24,2018-01-16T23:02:42.000Z,168637,20515,71,1887,False,11,Entertainment
1564,Tina Nguyen,5,17.27.11,二贵摔跤 - tienghoa.net,27,2011-03-01T04:14:08.000Z,16823,93,275,172,False,14,Education
1565,LaToya Forever,5,18.20.01,CHIT CHAT GRWM WITH WINNIE HARLOW,24,2018-01-18T23:03:24.000Z,38355,2920,26,372,False,11,Entertainment
1566,Amber Liu,5,18.13.01,THINGS THAT ARE LOWER,24,2018-01-12T03:15:43.000Z,109642,21080,25,2033,False,11,Entertainment
1567,Wix.com,5,18.05.02,Wix.com Official 2018 Big Game Ad with Rhett & Link,1,2018-02-02T20:15:04.000Z,229709,783,20,93,False,0,Film & Animation
1568,Adam's Apple,5,18.04.02,"Conor McGregor talks about Floyd Mayweather in UFC, his future, Ronda Rousey on 1/31/18",22,2018-02-01T14:23:40.000Z,201784,940,39,442,False,9,People & Blogs
1569,The Ringer,5,18.13.01,"Kyrie Irving on Conspiracy Theories, Tightening His Handle, and Going to the Celtics (Ep. 4)",24,2018-01-12T11:00:05.000Z,14865,216,19,72,False,11,Entertainment
1570,David Windestal,5,18.24.01,ROCKET JUMP RC CAR - Worlds highest vertical jump with an RC car! (probably),28,2018-01-22T21:08:26.000Z,18744,951,27,198,False,15,Science & Technology
1571,The Sports King,5,17.23.11,Drake - Virginia Black commercial,22,2017-11-19T20:23:56.000Z,15117,165,4,28,False,9,People & Blogs
1572,Kingsley,5,17.15.12,17 of 2017: The Year in Pop Culture (ft. Damon and Jo) | Kingsley,24,2017-12-13T20:30:03.000Z,23187,2168,5,202,False,11,Entertainment
1573,Syracuse Orange,5,17.07.12,Jim Boeheim vs. UConn Postgame,17,2017-12-06T05:22:41.000Z,12994,37,8,14,False,4,Sports
1574,Oceana,5,18.05.01,Nina Dobrev wants to Save Sharks (30s),29,2018-01-03T16:01:48.000Z,4178,16,1,3,False,16,Nonprofits & Activism
1575,KTVU,5,18.14.01,Bird photobombs weather report,24,2018-01-12T00:46:11.000Z,78841,1706,19,125,False,11,Entertainment
1576,CrowsEyeProductions,5,18.06.01,Getting dressed in the 18th century - working woman,1,2018-01-05T14:36:12.000Z,61251,1291,60,233,False,0,Film & Animation
1577,British Vogue,5,18.10.06,Waking Up With Ariana Grande | British Vogue,24,2018-06-08T14:58:31.000Z,1092534,59225,1226,2014,False,11,Entertainment
1578,Kevin Noonan,5,17.31.12,Oh What a Feeling. Toyota! 1982,27,2013-05-28T00:02:49.000Z,12850,40,1,8,False,14,Education
1579,Kyle Gunderson,5,17.16.12,Welcome to Winter PUNderland,19,2017-12-12T17:07:53.000Z,49461,766,31,41,False,6,Travel & Events
1580,DonDiablo,5,18.26.01,Don Diablo - People Say ft. Paije | Official Music Video,10,2018-01-24T20:05:08.000Z,251014,25000,314,1218,False,2,Music
1581,Tryst Network,5,18.09.02,Jessica Biel and Chelsea Handler Take a Little Look-See (Full Video),24,2018-02-07T04:51:36.000Z,36744,128,96,0,True,11,Entertainment
1582,RawBeautyKristi,5,18.05.01,"IS IT EVER ENOUGH? | CHIT CHAT GRWM | NEW YEARS GOALS, NEW YOUTUBERS, HELPING EACHOTHER etc.",26,2018-01-04T01:00:00.000Z,75912,6804,247,2649,False,13,Howto & Style
1583,TimandFaithVEVO,5,17.18.11,"Tim McGraw, Faith Hill - Cowboy Lullaby (Audio)",10,2017-11-17T08:00:01.000Z,18346,544,28,20,False,2,Music
1584,TheVampsVEVO,5,18.13.01,The Vamps - Same To You (Acoustic),10,2018-01-12T13:27:11.000Z,91620,17706,46,1176,False,2,Music
1585,MandisaVEVO,5,18.17.01,"Mandisa - Bleed The Same ft. TobyMac, Kirk Franklin",10,2018-01-15T05:00:01.000Z,71574,3449,49,247,False,2,Music
1586,Ben Rohrbach,5,17.14.11,Dennis Smith Jr. and LeBron James go back and forth,17,2017-11-13T15:11:00.000Z,945,7,5,8,False,4,Sports
1587,SIRAH,5,17.15.11,Dead Beat Sirah ft. Skrillex (official video),10,2017-11-14T16:30:00.000Z,18317,1322,34,196,False,2,Music
1588,Carly and Erin,5,17.14.12,SURPRISED HER WITH THIS....,23,2017-12-13T02:07:16.000Z,79099,7607,74,526,False,10,Comedy
1589,Popcorn with Peter Travers,5,18.28.01,'Call Me by Your Name' star Timothee Chalamet on the time he embarrassed himself with Saoirse Ronan,24,2018-01-26T15:07:16.000Z,86360,3463,24,381,False,11,Entertainment
1590,Jalopnik,5,18.05.01,Tesla Model 3 First Drive and Impressions | Neat Stuff in Cool Cars,24,2018-01-02T18:57:20.000Z,37522,557,157,218,False,11,Entertainment
1591,NBA Stats All Seasons,5,18.18.01,Inside The NBA: Chuck and Shaq laugh uncontrollably over Rockets-Clippers fight,17,2018-01-16T07:42:34.000Z,122049,1501,44,234,False,4,Sports
1592,The Sydney Morning Herald,5,17.09.12,California wildfires prompt state of emergency,25,2017-12-08T02:59:17.000Z,2785,6,3,12,False,12,News & Politics
1593,Rella On the radio,5,18.13.01,We found the real Maui!!!,24,2018-01-10T02:02:02.000Z,720285,5515,100,481,False,11,Entertainment
1594,Shesez,5,18.30.01,Off Camera Secrets | Grand Theft Auto V - Boundary Break,20,2018-01-28T16:00:52.000Z,300203,9194,303,1245,False,7,Gaming
1595,JayZVEVO,5,18.06.01,JAY-Z - Family Feud ft. Beyoncé,10,2018-01-05T05:00:06.000Z,1722568,76678,4974,9509,False,2,Music
1596,TV One,5,18.15.02,Did Beyonce Have To Check An Actress Talking To JAY-Z? | Uncensored,24,2018-02-09T23:29:30.000Z,157494,0,0,161,False,11,Entertainment
1597,Bethany Mota,5,17.27.11,BLACK FRIDAY HAUL 2017 + TRY ON | Bethany Mota,26,2017-11-25T18:55:42.000Z,987801,63319,938,43678,False,13,Howto & Style
1598,HvdH-Plane-Spotter,5,18.22.01,Sturm Friederike - Grandiose Pilotenleistung am Airport Düsseldorf bei bis zu 110 km/h Seitenwind,2,2018-01-18T21:39:58.000Z,4361881,24008,906,2237,False,1,Autos & Vehicles
1599,Galantis,5,17.01.12,Galantis & Throttle - Tell Me You Love Me (Official Music Video),10,2017-11-28T15:00:58.000Z,197485,13811,177,783,False,2,Music
1600,emma chamberlain,5,17.15.11,funfetti is extremely fun,24,2017-11-14T20:28:53.000Z,126438,12229,86,1865,False,11,Entertainment
1601,lisbug,5,18.12.01,Recreating Princess Looks with Trendy Clothes!,23,2018-01-10T20:56:41.000Z,47287,3729,201,570,False,10,Comedy
1602,West Midlands Police,5,17.28.11,Relay attack Solihull,25,2017-11-26T10:13:26.000Z,167753,238,74,0,True,12,News & Politics
1603,rock on,5,18.25.02,Kylie Minogue - Dancing (Live Ant & Dec's Saturday Night Takeaway) HD,10,2018-02-24T20:00:39.000Z,21361,951,31,85,False,2,Music
1604,Cultaholic,5,18.14.01,Paige Forced To Retire From In-Ring WWE Competiton,17,2018-01-12T21:58:56.000Z,132395,4035,150,1488,False,4,Sports
1605,Lofty Pursuits,5,18.12.01,Forbidden Fruit Candy made at Lofty Pursuits,26,2018-01-09T19:49:57.000Z,229000,10210,256,2039,False,13,Howto & Style
1606,JamesAVEVO,5,17.03.12,James Arthur - Naked,10,2017-12-01T08:00:02.000Z,297306,24903,103,1236,False,2,Music
1607,DoodleChaos,5,18.12.01,"Marbles, Magnets, and Music (Synchronized)",24,2018-01-09T17:32:39.000Z,221145,6790,85,434,False,11,Entertainment
1608,TobyMacVEVO,5,18.06.01,TobyMac - I just need U. (Audio),10,2018-01-05T05:00:01.000Z,99535,6487,116,611,False,2,Music
1609,Amazon.co.uk,5,17.14.11,Amazon Christmas Advert 2017 - Toys & Games,24,2017-11-06T17:52:50.000Z,26000,119,69,0,True,11,Entertainment
1610,Abroad in Japan,5,17.14.11,Where is TOKYO'S GREATEST View?,24,2017-11-09T15:06:34.000Z,151709,9210,71,1103,False,11,Entertainment
1611,Adam Neely,5,17.18.12,I play the lick for 5 hours straight,10,2017-12-17T05:51:32.000Z,208289,10379,521,921,False,2,Music
1612,Lauren Elizabeth,5,17.18.11,Doing A Gift Exchange MY WAY! | Lauren Elizabeth,26,2017-11-17T02:34:43.000Z,50702,2718,145,98,False,13,Howto & Style
1613,This Morning,5,17.04.12,Prince Harry and Meghan Markle Get the Alison Hammond Experience! | This Morning,24,2017-12-01T13:33:16.000Z,198437,1512,230,0,True,11,Entertainment
1614,BreakingBenjaminVEVO,5,18.06.01,Breaking Benjamin - Red Cold River (Audio Only),10,2018-01-05T05:00:03.000Z,334173,23449,378,3606,False,2,Music
1615,End of Ze World,5,18.23.01,END OF ZE WORLD ...PROBABLY FOR REAL THIS TIME,22,2018-01-20T22:00:03.000Z,125897,2924,775,560,False,9,People & Blogs
1616,NinaNesbittMusicVEVO,5,18.02.02,Nina Nesbitt - Somebody Special (Official Video),10,2018-01-31T05:00:01.000Z,135517,10680,90,292,False,2,Music
1617,StoryCorps,5,17.14.12,Greg talks with  the school shooter who killed his son 25 years ago | StoryCorps,1,2017-12-12T19:00:02.000Z,26282,667,27,90,False,0,Film & Animation
1618,Peloton,5,18.12.01,Introducing the Peloton Tread™,28,2018-01-09T12:52:52.000Z,95174,549,1103,432,False,15,Science & Technology
1619,AT&T,5,18.26.01,Jennifer Lopez & David Dobrik FEAR BOX Challenge | #JLoNOW,28,2018-01-23T23:09:28.000Z,130858,7612,26,260,False,15,Science & Technology
1620,MARIO TESTINO,5,17.23.12,Becoming Plum with Sarah Lamb,24,2017-12-19T16:57:56.000Z,6271,68,2,3,False,11,Entertainment
1621,BeOurGuest,5,17.12.12,REST IN PEACE ANGRY GRANDPA,24,2017-12-11T00:33:31.000Z,85478,2918,334,782,False,11,Entertainment
1622,FILMWEBTV,5,17.07.12,Zendaya stops interview to fix reporters hair,22,2017-12-05T15:10:37.000Z,23433,529,4,106,False,9,People & Blogs
1623,Rainer Hilland,5,17.15.12,Corgi Snowplow,22,2017-12-14T14:10:36.000Z,19575,1046,11,60,False,9,People & Blogs
1624,TheKillersVEVO,5,18.12.01,The Killers - Rut,10,2018-01-10T05:00:00.000Z,177747,12450,262,1128,False,2,Music
1625,42Fab - Metalworking and Multi-Medium Fabrication,5,18.23.02,How to use DeWalt Batteries on Ryobi Tools for $30 | Building a DeWalt to Ryobi Adapter - 42Fab #16,26,2018-02-18T17:17:43.000Z,17812,230,26,54,False,13,Howto & Style
1626,Battlefield,5,18.10.06,Battlefield 5 Official Multiplayer Trailer,20,2018-06-09T18:07:15.000Z,2474393,135476,19609,33396,False,7,Gaming
1627,BBALLBREAKDOWN,5,18.03.05,Why MATH Says The PELICANS Can't Beat The WARRIORS,17,2018-04-26T13:39:55.000Z,247763,3486,603,1573,False,4,Sports
1628,UJ,5,17.31.12,John Cho - Wild World,22,2014-12-11T07:16:31.000Z,53942,578,6,34,False,9,People & Blogs
1629,COVERGIRL,5,18.17.01,Katy Perry in NEW! Katy Kat Gloss | #IAmWhatIMakeUp by COVERGIRL,26,2018-01-16T14:47:28.000Z,5193,222,17,28,False,13,Howto & Style
1630,Scott Manley,5,18.05.03,How Satellites Capture 400 Megapixel Images Of Earth's Globe - Himawari 8 & GOES-16,20,2018-03-01T18:24:00.000Z,48505,2504,17,350,False,7,Gaming
1631,Apple Support,5,17.29.11,How to take a screenshot on your iPhone or iPad — Apple Support,28,2017-11-27T17:41:38.000Z,25980,186,10,21,False,15,Science & Technology
1632,Philadelphia 76ers,5,17.17.11,"Ben Simmons | Highlights vs Lakers (10.15.17) 18 Pts, 10 Asts, 9 Rebs, 5 Stl, 1 Blk",17,2017-11-16T06:26:28.000Z,12831,86,5,35,False,4,Sports
1633,Unique Vibes,5,17.26.11,Carlie Hanson - Only One (Lyrics),10,2017-11-24T16:30:36.000Z,4938,122,9,22,False,2,Music
1634,Howl Of A Dog,5,18.29.01,Rescue of a Scared Homeless Dog with a Broken Heart,15,2018-01-26T18:18:18.000Z,462463,17726,213,1591,False,3,Pets & Animals
1635,Marteen Estevez,5,17.08.12,Marteen - We Cool (Official Music Video),10,2017-12-06T17:59:44.000Z,21437,1117,13,165,False,2,Music
1636,WeatherTech,4,18.05.02,WeatherTech Super Bowl® Commercial: American Factory,2,2018-02-01T14:09:46.000Z,179610,1120,77,134,False,1,Autos & Vehicles
1637,Daily Davidsons,4,18.06.01,OUR LIT NEW YEARS EVE!!,24,2018-01-01T17:59:47.000Z,25211,2372,34,184,False,11,Entertainment
1638,VideoGameAds,4,18.29.01,Sega Game Gear Commercial Creamed Spinach - Retro Video Game Commercial / Ad,20,2012-12-11T11:16:22.000Z,3791,13,0,4,False,7,Gaming
1639,Useless Duck Company,4,17.22.11,Rocket Powered Birthday Cake [short version],23,2017-11-18T17:56:32.000Z,42737,236,23,18,False,10,Comedy
1640,Define American,4,17.30.11,Tell Hollywood to stand with immigrants,29,2017-11-28T13:00:35.000Z,1456,0,0,0,True,16,Nonprofits & Activism
1641,TheBeatlesVEVO,4,17.19.12,The Beatles - Something,10,2017-12-15T16:14:30.000Z,300775,18859,105,1628,False,2,Music
1642,The Cincinnati Zoo & Botanical Garden,4,18.19.02,Baby Hippo Fiona's Special Moments:  Never-before-seen Videos from Care Team - Cincinnati Zoo,15,2018-02-14T17:00:05.000Z,50547,2343,18,198,False,3,Pets & Animals
1643,Squarespace,4,18.05.02,Super Bowl 2018 Commercial | Make It With Keanu Reeves,28,2018-01-31T16:11:56.000Z,378593,961,33,81,False,15,Science & Technology
1644,Nobrand,4,17.14.11,Me-O Cats Commercial,22,2017-04-21T06:47:32.000Z,98966,2486,184,532,False,9,People & Blogs
1645,Matt Steffanina,4,17.18.11,MOTOR SPORT - Cardi B x Migos x Nicki Minaj Dance | Matt Steffanina cover,24,2017-11-15T19:07:27.000Z,293758,20134,193,918,False,11,Entertainment
1646,Technology Connections,4,18.04.01,Trinitron: Sony's Once Unbeatable Product,28,2017-12-30T15:28:24.000Z,111825,6228,180,614,False,15,Science & Technology
1647,StanDrawsSpaceships,4,18.06.01,Ready To Fly!,22,2018-01-01T15:00:04.000Z,164800,3500,80,161,False,9,People & Blogs
1648,J Gasser,4,18.06.01,Inventing The Wheel,24,2017-11-08T22:27:53.000Z,987,1,1,0,False,11,Entertainment
1649,JAY,4,18.06.01,Michael Jackson's Dont Stop Till You Get Enough - By Jay,24,2017-11-19T01:10:12.000Z,48982,628,12,46,False,11,Entertainment
1650,Billions,4,18.07.01,Billions Season 3 (2018) | Official Trailer | Damian Lewis & Paul Giamatti SHOWTIME Series,24,2018-01-06T21:57:32.000Z,12523,462,7,76,False,11,Entertainment
1651,Vote The Process,4,17.04.12,Josh Gordon - I'm Coming Home,1,2017-11-30T01:29:36.000Z,88257,590,26,54,False,0,Film & Animation
1652,Rise,4,18.05.02,Rise - Super Bowl Commercial,24,2018-02-02T20:00:11.000Z,23819,128,8,17,False,11,Entertainment
1653,Spectrum Haleskarth,4,17.24.11,The Adventures of Ford Fairlane: Springloaded gun mishap,1,2015-09-21T23:40:45.000Z,5997,16,0,4,False,0,Film & Animation
1654,52 Skillz,4,17.19.12,Weak Guy Learns How to Rip a Phonebook In Half,26,2017-12-16T16:13:59.000Z,29469,418,18,50,False,13,Howto & Style
1655,Golden State Warriors,4,18.17.02,God of War – War On The Floor Event | PS4,22,2018-02-12T14:23:05.000Z,101590,1858,23,166,False,9,People & Blogs
1656,Halfway Anywhere,4,18.05.01,The Continental Divide Trail in Four Minutes,19,2017-12-25T11:00:00.000Z,49091,575,8,44,False,6,Travel & Events
1657,POPSUGAR,4,17.01.12,Saoirse Ronan Tries to Pronounce Difficult Celeb Names,26,2017-11-27T19:56:40.000Z,36588,653,6,39,False,13,Howto & Style
1658,Oscar Fury,4,18.29.01,American vs. Brit,20,2018-01-26T19:37:39.000Z,17068,136,11,12,False,7,Gaming
1659,Frank May,4,17.15.11,Review of the ION Bottleless Water Cooler,23,2017-11-12T00:01:11.000Z,399491,6240,326,287,False,10,Comedy
1660,Kevin Durant,4,17.14.11,JaVale McGee's Parking Lot Chronicles: Episode 3,17,2017-11-11T20:00:02.000Z,162597,5734,106,525,False,4,Sports
1661,MassMutual,4,18.05.02,The Unsung,27,2018-01-31T20:25:02.000Z,18336,0,0,11,False,14,Education
1662,The Modern Rogue,4,18.15.01,Making a Lemon Stun Gun,24,2018-01-12T19:06:42.000Z,151574,6432,89,1277,False,11,Entertainment
1663,Marcos Horacio,4,18.21.01,Urban opera singer,17,2018-01-19T17:26:11.000Z,13531,136,5,16,False,4,Sports
1664,NOVA's Secret Life of Scientists and Engineers,4,18.13.01,Laurie Santos: Monkeynomics,28,2013-11-15T15:36:28.000Z,2992,28,0,1,False,15,Science & Technology
1665,Kanimuna Kisaka,4,17.25.11,Pepsi Uses Aborted Babies to Flavor Test Soda- Alex Jones,25,2013-03-12T12:56:41.000Z,10283,49,23,25,False,12,News & Politics
1666,Noah Nicholls,4,18.04.01,I was in a wedding and smashed my face,22,2017-12-29T06:13:55.000Z,1288977,3808,120,510,False,9,People & Blogs
1667,Daniel Howell,4,18.18.01,The Top Dan Memes of 2017,22,2018-01-14T23:15:00.000Z,1757966,219393,921,37980,False,9,People & Blogs
1668,SR Trailers and Interviews,4,17.09.12,Star Wars: The Last Jedi Interview - Adam Driver,1,2017-12-06T21:29:23.000Z,9812,265,2,65,False,0,Film & Animation
1669,Nathan Robinson,4,18.10.02,What Martin Luther King Actually Thought About Car Commercials,22,2018-02-05T02:40:44.000Z,264408,5185,49,293,False,9,People & Blogs
1670,dope2111,4,17.14.11,iPhone X vs Makeup Transformation (Face ID TEST),26,2017-11-12T00:45:54.000Z,1456472,33505,1660,2160,False,13,Howto & Style
1671,Funny New Videos,4,18.25.01,When you and your mates go snow boarding for the first time.,22,2018-01-22T00:08:49.000Z,603894,5037,184,364,False,9,People & Blogs
1672,Prince Marcus,4,18.20.02,Jamie Foxx Awkward Interview SportsCenter Michael Smith,17,2018-02-16T23:50:32.000Z,5876,13,0,14,False,4,Sports
1673,Mark Ferris,4,17.15.11,UNISEX TRY ON/CLOTHING HAUL & GIVEAWAY!!!,23,2017-11-14T17:27:46.000Z,34138,4303,29,1399,False,10,Comedy
1674,Sesame Street,4,17.27.11,Sesame Street: Sharing Things (Stranger Things Parody),24,2017-11-23T05:00:03.000Z,318249,4145,110,438,False,11,Entertainment
1675,Shantell Martin,4,17.15.11,Casey Neistat made a video about me,1,2017-11-13T17:26:03.000Z,42336,4293,89,428,False,0,Film & Animation
1676,John Lewis,4,17.14.11,John Lewis Christmas Ad 2017 - #MozTheMonster,26,2017-11-10T07:38:29.000Z,7224515,55681,10247,9479,False,13,Howto & Style
1677,CS Dojo,4,17.28.11,"Top 5 Programming Languages to Learn to Get a Job at Google, Facebook, Microsoft, etc.",27,2017-11-25T22:44:41.000Z,124380,6042,119,713,False,14,Education
1678,Real World Records,4,18.04.01,Les Amazones d'Afrique feat. Nneka - La Dame et Ses Valises (Audio),10,2017-10-20T08:00:01.000Z,14311,261,6,43,False,2,Music
1679,Karim Jovian,4,17.11.12,New Yorkers Share their Story for a Dollar - Part 5,24,2017-12-08T23:37:22.000Z,20566,1746,47,314,False,11,Entertainment
1680,Intuit,4,18.05.02,Intuit | A Giant Story,28,2018-02-01T15:44:02.000Z,10008678,23091,7964,1754,False,15,Science & Technology
1681,jbalvinVEVO,4,18.26.02,J. Balvin - Ahora,10,2018-02-26T05:00:01.000Z,497116,68435,1274,8360,False,2,Music
1682,Ján Ilavský,4,18.23.01,Beat Saber Gameplay Teaser,20,2018-01-20T10:38:16.000Z,650855,13343,215,868,False,7,Gaming
1683,Livia Giustiniani,4,18.06.01,Kramer vs Kramer-Clou Scene,1,2008-04-05T18:22:40.000Z,49942,46,6,26,False,0,Film & Animation
1684,FaeryInLoveInc,4,17.14.11,Nick Andopolis: Drummer,1,2011-05-29T17:03:12.000Z,50867,715,238,246,False,0,Film & Animation
1685,Michael Rigsby,4,17.16.12,coin cell challenge,22,2017-12-06T00:56:56.000Z,1415,6,0,0,False,9,People & Blogs
1686,Shmee150,4,17.17.11,"The Crazy 5,000hp Devel Sixteen is REAL! | FIRST LOOK",2,2017-11-14T18:00:02.000Z,298744,5906,444,1502,False,1,Autos & Vehicles
1687,ARIKITCHEN (아리키친),4,18.04.02,힐링쿠킹♥ 빙글빙글 회오리젤리 만들기! - Ari Kitchen(아리키친),22,2018-02-03T01:09:48.000Z,250007,7854,133,2562,False,9,People & Blogs
1688,Xscape - Topic,4,17.04.12,Dream Killa,10,2017-11-30T10:36:01.000Z,24972,1576,25,386,False,2,Music
1689,TopClips247,4,18.06.02,"Amazon 2018 Super Bowl Commercial | Alexa Loses Her Voice (Cardi B, Gordon Ramsey)",24,2018-02-01T19:54:34.000Z,740553,5417,172,290,False,11,Entertainment
1690,joyner lucas,4,18.26.02,Joyner Lucas & Chris Brown - Stranger Things,10,2018-02-25T18:10:16.000Z,1032297,112580,2651,12285,False,2,Music
1691,Hillsong Worship,4,17.19.12,Seasons (Live) - Hillsong Worship,10,2017-12-16T07:23:01.000Z,106144,6488,81,290,False,2,Music
1692,Desus & Mero,4,18.06.01,ESPN's Katie Nolan (Extended Cut),24,2018-01-04T05:30:01.000Z,104785,1181,108,265,False,11,Entertainment
1693,"Cyprus Air Heating, Cooling and Fireplaces",4,18.05.02,Funniest Local Commercial With Kirk Cousins & Fake Donald Trump,22,2018-02-04T23:45:36.000Z,118344,363,83,69,False,9,People & Blogs
1694,Caravan Carolyn,4,18.30.01,Carolyn's RV Life Spots A Fluffy Kitty In Blythe,22,2018-01-27T22:12:08.000Z,23795,0,0,863,False,9,People & Blogs
1695,60 Minutes,4,17.17.11,Behind the Aly Raisman interview on 60 Minutes,25,2017-11-12T23:30:00.000Z,42422,243,8,58,False,12,News & Politics
1696,Popular Woodworking,4,18.06.01,Dovetails for Drawers – the European Way,1,2018-01-04T12:57:55.000Z,34650,743,4,61,False,0,Film & Animation
1697,colourpopcosmetics,4,18.23.01,Introducing Lux Lipstick,22,2018-01-20T01:05:07.000Z,64817,2865,32,326,False,9,People & Blogs
1698,Billboard News,4,17.30.11,Grammys 2018 Nominations Announced | Billboard News,10,2017-11-28T14:52:38.000Z,3696,81,12,80,False,2,Music
1699,CBS Films,4,18.06.01,"WINCHESTER - Official Trailer - HD (Helen Mirren, Jason Clarke)",24,2018-01-04T18:00:15.000Z,1786869,857,72,165,False,11,Entertainment
1700,Mike H,4,18.06.01,RC Jansen Strandbeest,22,2015-01-08T21:02:08.000Z,8502,42,0,4,False,9,People & Blogs
1701,Milkmen Design,4,17.24.11,DipClip | Chicken Nugget Rally Testing | How secure is your sauce?,22,2017-11-13T14:39:03.000Z,4387,6,0,0,False,9,People & Blogs
1702,David Jardine,4,17.30.11,How to DRAW ON COFFEE STAINS EP. 5!!!,23,2017-11-29T00:14:41.000Z,25084,395,10,35,False,10,Comedy
1703,Southwest Florida Eagle Cam,4,18.12.01,Southwest Florida Eagle Cam,15,2018-01-09T13:33:06.000Z,95988,1030,77,0,True,3,Pets & Animals
1704,Torm place,4,17.23.12,Louis CK dubbed out of Gravity Falls,1,2017-12-21T04:48:11.000Z,26495,61,34,39,False,0,Film & Animation
1705,startelegramvideo,4,18.08.01,Dallas Mavericks caoch Rick Carlisle sounds off on ESPN Lavar Ball article,25,2018-01-07T22:40:15.000Z,25108,107,5,51,False,12,News & Politics
1706,BehindTheSounds,4,17.25.11,Behind The Sounds: That's Not Me,10,2008-06-17T00:07:56.000Z,86744,469,4,105,False,2,Music
1707,MrMobile [Michael Fisher],4,18.12.01,This Phone's Fingerprint Sensor ... Is Its Display,28,2018-01-10T01:30:17.000Z,239189,11473,103,1103,False,15,Science & Technology
1708,The Current Source,4,17.23.11,31) Acrylic Bending for Electronics Enclosures,28,2017-11-17T21:18:38.000Z,3391,151,1,20,False,15,Science & Technology
1709,University of Rochester EEOC Complainants,4,18.13.01,"UR EEOC Complainants Press Conference (5pm Jan 11, 2018)",22,2018-01-11T22:55:37.000Z,884,11,5,2,False,9,People & Blogs
1710,JuJu Smith-Schuster,4,18.07.01,JuJu Smith-Schuster Pranks Steelers Fans - Undercover News Interview,24,2018-01-05T18:59:22.000Z,283692,10749,198,1809,False,11,Entertainment
1711,Car Commercials of the Past,4,17.05.12,1991 Pontiac Lineup Commercial - With Patrick Stewart Narrating,2,2015-09-03T06:01:12.000Z,4631,21,0,6,False,1,Autos & Vehicles
1712,RocketJump Film School,4,17.13.12,How Star Wars was saved in the edit,1,2017-12-11T22:57:31.000Z,22294,2001,15,90,False,0,Film & Animation
1713,Roadshow,4,18.17.01,Detroit Auto Show 2018: Press Day 1 - World debuts of new cars,2,2018-01-15T22:48:11.000Z,49536,503,127,20,False,1,Autos & Vehicles
1714,Outback Steakhouse,4,17.07.12,Outback Bowl is January 1st,24,2017-12-04T13:00:00.000Z,9387,10,1,6,False,11,Entertainment
1715,Choir! Choir! Choir!,4,18.02.02,Choir! Choir! Choir! Epic! Nights: David Byrne + NYC sing HEROES,10,2018-01-30T17:00:02.000Z,72339,1375,17,72,False,2,Music
1716,First Aid Kit,4,17.04.12,First Aid Kit - Fireworks (Official Lyric Video),10,2017-12-01T05:00:00.000Z,13128,536,3,46,False,2,Music
1717,It's a small world,4,17.25.11,All Star but it's an Origami,10,2017-11-22T01:59:57.000Z,22963,1934,75,307,False,2,Music
1718,Kortney Steury,4,18.17.01,When your Amish town is frozen,22,2018-01-13T21:13:26.000Z,303335,3546,92,352,False,9,People & Blogs
1719,Avocados From Mexico,4,18.03.02,#GuacWorld :60 | 2018 Big Game Commercial | Avocados From Mexico,24,2018-01-31T14:30:24.000Z,21278,54,5,4,False,11,Entertainment
1720,Carlos Campos,4,18.06.01,Physical Encoder for an Open Source Braille Embosser,22,2017-12-28T23:57:04.000Z,3551,1,0,0,False,9,People & Blogs
1721,RZSS Highland Wildlife Park,4,18.06.01,Polar bear cub audio,15,2018-01-03T08:12:37.000Z,3393,12,0,2,False,3,Pets & Animals
1722,Chevrolet,4,17.19.12,The Next Century of Chevy Trucks Starts Here | Chevrolet,2,2017-12-17T03:53:51.000Z,57915,565,66,178,False,1,Autos & Vehicles
1723,Goodwillsandusky,4,17.18.12,Goodwill Norwalk Store-The Spirit of Giving,1,2017-12-12T20:51:37.000Z,228745,1848,41,144,False,0,Film & Animation
1724,Navenanthen Gepardieu,4,18.06.01,Dazed & Confused - LIVIN Speech,24,2013-10-28T11:39:41.000Z,21063,72,2,1,False,11,Entertainment
1725,DJI,4,18.26.01,DJI Live - Adventure Unfolds,1,2018-01-23T16:30:38.000Z,82977,0,0,0,True,0,Film & Animation
1726,Max Hertan,4,18.17.01,Learn to Juggle 5 Balls in 1 Month || Max's Monthly Challenge,24,2018-01-03T21:11:54.000Z,9977,120,11,21,False,11,Entertainment
1727,NWSSanDiego,4,17.08.12,Strong Santa Ana Wind and Extreme Fire Danger - NWS San Diego,28,2017-12-06T00:07:53.000Z,4636,26,1,0,True,15,Science & Technology
1728,jeremiah johnson,4,18.22.01,old dodge stratus commercial,2,2016-05-13T20:47:57.000Z,2860,4,3,3,False,1,Autos & Vehicles
1729,The Bachelor Insider,4,18.01.02,"SPOILER ALERT! 🌹🏁 Krystal, Will You Accept This Ride? | The Bachelor Insider",24,2018-01-30T01:00:03.000Z,59833,571,65,185,False,11,Entertainment
1730,Rainsford,4,17.30.11,RAINSFORD - Intentions feat. Twin Shadow [Official Music Video],10,2017-11-28T19:00:01.000Z,6593,164,19,23,False,2,Music
1731,Sailing La Vagabonde,4,18.05.01,"Polish Girl buys Sail Boat for €1 !!      ......    Yes, that is ONE EURO. Ep. 122",19,2018-01-01T22:39:29.000Z,182778,6153,94,451,False,6,Travel & Events
1732,U.S. Navy,4,17.14.11,U.S. Navy Three Carrier Formation in Western Pacific Ocean,25,2017-11-12T13:13:33.000Z,105058,493,54,347,False,12,News & Politics
1733,CrazyLaughAction,4,17.19.12,Kid Steals Baby Jesus From Manger During Live Nativity Play,23,2017-12-15T17:36:06.000Z,95668,217,5,14,False,10,Comedy
1734,Movie'n'co UK,4,18.30.01,'Call Me By Your Name': Which fruit would Elio try on the sequels?,1,2018-01-28T16:03:14.000Z,27234,997,13,139,False,0,Film & Animation
1735,Wintergatan,4,18.03.02,Marble Demagnetizer - it's Mechanical! / Marble Machine X #24,10,2018-01-31T14:59:38.000Z,183331,11540,60,1112,False,2,Music
1736,Topic,4,18.16.02,Meet America's Oldest Interracial Newlyweds: Edith+Eddie,24,2018-02-08T15:08:28.000Z,11054,111,5,18,False,11,Entertainment
1737,Midnight Video,4,18.01.02,YOUR DATE IS HERE - Horror Short,1,2018-01-29T13:00:00.000Z,60262,4804,122,736,False,0,Film & Animation
1738,Hannah Meloche,4,18.17.01,room tour 2018,26,2018-01-15T23:42:31.000Z,69028,5653,35,447,False,13,Howto & Style
1739,MasterClass,4,17.17.12,Annie Leibovitz Teaches Photography | Official Trailer,27,2017-12-14T14:40:13.000Z,1513004,1025,8,52,False,14,Education
