channel_title,no_of_vids,trending_date,title,category_id,publish_time,views,likes,dislikes,comment_count,comments_disabled
Анатолий Шарий,197,17.14.11,Яценюк. НЕпопулист. Вернулся,23,2017-11-13T10:54:46.000Z,419835,27738,656,4681,False
Эхо Москвы,184,17.15.11,Особое мнение / Евгения Альбац // 14.11.17,25,2017-11-14T16:52:41.000Z,49670,930,85,157,False
Модные Практики с Паукште Ириной Михайловной,169,17.14.11,Экскурсия в прошлое Полный обзор пальто 1962 года Интересная модель пальто с высоким воротником,26,2017-11-13T17:00:01.000Z,14028,972,12,122,False
Wylsacom,167,17.15.11,Иммерсивный обзор iPhone X - 14 ноября в 20:00 по МСК,28,2017-11-14T20:50:11.000Z,886496,70814,4486,421,False
Россия 24,159,17.14.11,60 минут по горячим следам (дневной выпуск в 13:00) от 13.11.17,24,2017-11-13T11:04:43.000Z,157093,778,469,577,False
kamikadzedead,159,17.14.11,ЗАЧЕМ ПУТИН ПОЙДЕТ НА ВЫБОРЫ?,23,2017-11-13T11:48:14.000Z,210181,34370,26569,5828,False
Калнина Наталья,155,17.15.11,Рваный Пирог за пару минут. Удиви себя насколько это просто и Вкусно!,22,2017-11-14T16:28:43.000Z,49278,4265,68,116,False
След - новый сезон,155,17.14.11,След - Опека,1,2017-11-13T09:00:01.000Z,22000,78,11,10,False
PanArmenian TV,152,17.14.11,"Նռան հատիկ, Սերիա 46 / Pomegranate seed / Nran hatik",1,2017-11-13T18:30:01.000Z,54031,227,35,72,False
Трум Трум,144,17.14.11,12 лайфхаков с термоклеем для хендмейда,26,2017-11-12T08:00:02.000Z,2109573,39671,2899,5662,False
Конец близок или свидетели финансового апокалипсиса,140,17.14.11,Аркадий Бабченко - Персонально Ваш... 13.11.17,29,2017-11-13T13:04:22.000Z,12324,272,16,55,False
НТВ,138,17.14.11,Первая передача. Выпуск от 12 ноября 2017 года,2,2017-11-12T08:20:41.000Z,107385,612,227,197,False
Xəzər Media,136,17.19.11,"5də5 - Üzeyir Mehdizadə, Əlibəy Məmmədli (ELÇİLİK)  17.11.2017",24,2017-11-18T16:46:46.000Z,36504,707,62,226,False
DaiFiveTop,135,17.14.11,ЗАБЫТЫЕ ЗВЁЗДЫ 2000-ЫХ,24,2017-11-13T16:05:57.000Z,191348,10679,762,790,False
Акыркы Кабарлар - Санжар Калматай,132,17.14.11,Срочно!  Бабанов фракция лидерлигинен кетти | Акыркы Кабарлар,22,2017-11-13T13:34:08.000Z,21724,142,29,175,False
Yoll,132,17.16.11,Филин Ёль ничего не делает. Кот Мурлок ничего не делает. Жуколица в квакварии.,15,2017-11-15T18:44:48.000Z,21671,2334,10,215,False
telblog.net,130,17.14.11,FIFA — До Того Как Стала Известна!,24,2017-11-13T15:58:24.000Z,103824,6336,191,576,False
Лайки Соловьева Ю.В.,129,17.19.11,ЩЕНКИ  УЖЕ ПЫТАЮТСЯ ИГРАТЬ!!!,15,2017-11-18T15:19:52.000Z,5553,533,1,30,False
Первый канал,126,17.14.11,Прожекторперисхилтон - Выпуск от 11.11.2017,43,2017-11-11T21:14:30.000Z,658403,10368,1284,809,False
Русские сериалы,124,17.14.11,Морозова (2017). 1 серия. Ничего личного / Детектив @ Русские сериалы,1,2017-11-13T12:00:01.000Z,42381,128,26,12,False
Aleksandr Semchenko,124,17.27.11,Порошенко сболтнул об антиПутинском мятеже и наврал о голодоморе,23,2017-11-26T04:31:59.000Z,69668,2919,113,887,False
Saveliy Ad,120,17.15.11,Привет из Никополя Сумасшедший дом,22,2017-11-14T09:35:32.000Z,34026,1157,135,373,False
oblomoff,120,17.15.11,Друже пытается делать САМСУ В ТАНДЫРЕ! До успеха далеко....,24,2017-11-14T08:53:17.000Z,616177,27172,2127,3213,False
Sasha Sotnik,119,17.14.11,МОСКВИЧИ: МЕЖДУ ПРОТЕСТОМ И ТЕРПЕНИЕМ...,25,2017-11-13T16:00:03.000Z,56614,5298,86,835,False
Уральские Пельмени,117,17.14.11,Теща и морячок - По тещьему велению - Уральские Пельмени (2017),23,2017-11-12T15:00:04.000Z,237457,2957,353,195,False
Xəzər Film,112,17.14.11,İMTAHAN serialı - ANONS 42-ci seriya,1,2017-11-13T15:06:40.000Z,20744,349,9,92,False
Alex Boyko,108,17.16.11,Что если положить муравьям пенопластовые шарики? Реакция муравьев. Формикарий.,22,2017-11-15T10:00:01.000Z,368485,10478,641,1813,False
Мастерская Настроения,104,17.15.11,"7 ЖЕСТОВ, КОТОРЫЕ ЛУЧШЕ НЕ ПОКАЗЫВАТЬ В ДРУГИХ СТРАНАХ",24,2017-11-14T07:07:22.000Z,373430,18889,623,1098,False
Max Maximov,104,17.19.11,Наркоманская ДЕТСКАЯ азбука!!! ЛЮТАЯ КНИГА!!!,24,2017-11-18T08:27:04.000Z,59651,2431,120,206,False
Вечерний Ургант,104,17.17.11,Вечерний Ургант - Летиция Каста/Laetitia Casta и Такаси Мураками/ 村上. 892 выпуск от 16.11.2017,43,2017-11-16T22:05:40.000Z,19057,350,24,55,False
Красный квадрат,102,17.14.11,Давай поженимся! Неудачно женатый. Выпуск от 13.11.2017,24,2017-11-13T14:00:04.000Z,17800,51,15,23,False
БЕРИ И ДЕЛАЙ,102,17.28.12,"18 СУМАСШЕДШИХ ПОДЕЛОК, КОТОРЫЕ ВЫ ОБЯЗАНЫ УВИДЕТЬ",26,2017-12-27T17:00:03.000Z,13766,270,36,33,False
Алексей Навальный,102,17.15.11,Как мы для Усманова акции Фейсбука покупали,29,2017-11-14T11:53:49.000Z,807276,113898,43154,16719,False
Om TV,99,17.14.11,отоБРАТСКИЙ ПОЛУОСТРОВ,25,2017-11-13T13:39:17.000Z,117399,11781,304,1209,False
Ольга Матвей,98,17.14.11,"Ольга Матвей | Пирог на ФАНТЕ  Очень Высокий, а Какой Вкусный:) | FANTA CAKE | FANTAKUCHEN",22,2017-11-13T17:00:01.000Z,32014,2806,115,189,False
Матч ТВ,98,17.19.11,18.11.2017г. Краснодар - Спартак - 1:4. Обзор матча,17,2017-11-18T15:47:07.000Z,225126,2757,169,661,False
Урожайный огород,98,17.14.11,ВОЛШЕБНАЯ ПОДКОРМКА ДЛЯ ВСЕХ РАСТЕНИЙ!ВСЁ РАСТЕТ КАК НА ДРОЖЖАХ!,22,2017-11-13T15:01:20.000Z,12116,786,23,43,False
Вечер с Владимиром Соловьевым,97,17.14.11,Воскресный Вечер с Владимиром Соловьевым от 12.11.17,25,2017-11-13T02:49:37.000Z,159579,1352,403,661,False
Россия 1,97,17.14.11,Трейлер. Андрей Малахов. Прямой эфир от 13.11.17,29,2017-11-13T13:44:43.000Z,9920,15,4,0,False
Çukur,96,17.14.11,Çukur 4. Bölüm Ön İzleme,22,2017-11-13T14:59:10.000Z,419872,3365,175,585,False
Трум Трум СЕЛЕКТ,95,17.25.12,16 лайфхаков для ногтей и маникюра,26,2017-12-24T11:00:04.000Z,65520,3242,180,633,False
Трансформатор,94,17.16.11,Откровения Кати. Как открыть свою сыроварню. Бизнес на трендах.,22,2017-11-15T16:04:00.000Z,121289,7891,511,1239,False
Радио Свобода,92,17.14.11,Кандидат Путин,25,2017-11-13T17:06:24.000Z,25375,604,123,0,True
Вкусная минутка,92,17.15.11,Салат Мимоза  Вкусный Слоеный салат на Новогодний стол,22,2017-11-14T10:52:19.000Z,24684,1849,33,94,False
Dmitry Puchkov,92,17.14.11,Клим Жуков про сериалы Троцкий и Демон революции,1,2017-11-13T13:08:54.000Z,101402,6304,249,863,False
Мой мир,92,17.18.11,2 отрывок  к 23 серии Госпожа Фазилет и ее дочери  2017,1,2017-11-17T16:17:18.000Z,15755,124,2,17,False
Итальянцы by Kuzno Productions,92,17.14.11,Итальянцы VS русская народная медицина,24,2017-11-13T17:22:55.000Z,105116,9780,93,1184,False
KisabacLusamutner,91,17.14.11,Kisabac Lusamutner eter 13.11.17 Ushagnac Kaper,29,2017-11-13T17:34:04.000Z,18434,72,14,0,True
Жалбырак ТВ,91,17.14.11,КҮНБҮГҮН/ Бабанов РАЖдын лидерлигинен алынды,25,2017-11-13T15:28:17.000Z,35648,251,64,145,False
TimOn ChaveS,90,17.14.11,ЭКСПЕРИМЕНТ: РЕАКЦИЯ РЫБКИ на ВАКУУМ,28,2017-11-13T13:00:07.000Z,306619,39229,2207,4049,False
Гараж 54,89,17.14.11,Сколько МОЖНО ПРОЕХАТЬ на СТАРТЕРЕ?,2,2017-11-13T11:00:06.000Z,229809,8606,545,1164,False
Умные люди,87,17.16.11,Александр Невзоров - ОГOPЧУ! CБЫBAЮТСЯ XУДШИЕ OЖИДAHИЯ...,22,2017-11-14T15:53:56.000Z,63162,767,139,412,False
AcademeG,87,17.17.11,ОБЗОР для ТВОЕЙ МАМКИ,2,2017-11-16T17:00:43.000Z,455564,23002,12094,2751,False
24 SOAT TV,87,17.18.11,ДЕПОРТАЦИЯ ГА УЗГАРТИРИШ || ИЗМЕНЯТСЯ ПРАВИЛА ДЕПОРТАЦИИ,25,2017-11-17T08:02:50.000Z,66746,884,137,160,False
Политика сегодня: Россия США Украина,86,17.23.11,Умер Дмитрий Хворостовский. Редкое интервью каналу Россия 1,25,2017-11-22T09:39:20.000Z,63356,552,38,164,False
Навальный LIVE,86,17.14.11,Нападения на полицейских и большое турне Навального по России,25,2017-11-13T07:07:07.000Z,23345,2870,2494,688,False
Adını Sen Koy,85,17.15.11,Adını Sen Koy 217. Bölüm,22,2017-11-14T16:01:03.000Z,166146,1497,187,240,False
SokoL[off] TV,84,17.15.11,10 Загадок ЗВЁЗДНЫХ ВОЙН [ТОПот Сокола],1,2017-11-14T15:13:10.000Z,185303,14896,788,1143,False
Новости на Первом Канале,84,17.15.11,У границ России. Время покажет. Выпуск от 13.11.2017,25,2017-11-13T17:32:55.000Z,61305,269,116,0,True
Школа Таро. Консультации Golden Charm,83,17.15.11,НАМЕРЕНИЯ ЗАГАДАННОГО ЧЕЛОВЕКА ВО ОТНОШЕНИИ ВАС СЕЙЧАС/ ГАДАНИЕ ОНЛАЙН/ 4 расклада/ Школа Таро,22,2017-11-14T17:00:01.000Z,8373,429,23,29,False
Новости 24/365,81,17.20.11,СЕРГЕЙ ЛАВРОВ PA3ΗΟCИΤ УКΡАИΗУ- «3AБИΡAЙΤΕ ΗИЩИΧ И УБΟГИΧ CEБE» — 19.11.2017,25,2017-11-19T11:28:54.000Z,17216,179,20,48,False
Народовластие,81,17.09.12,ПЛОХИЕ НОВОСТИ в 21.00 8/12/17,29,2017-12-08T20:51:39.000Z,12047,2378,3238,223,False
ATV Cinema,79,17.15.11,Ögey ana (38-ci bölüm),1,2017-11-14T18:00:03.000Z,24929,358,35,136,False
atv,78,17.15.11,Senin lider seçilmeni sağlayabilirim! - Eşkıya Dünyaya Hükümdar Olmaz 80. Bölüm,24,2017-11-14T19:37:28.000Z,110212,241,30,13,False
Покашеварим,78,17.20.11,Доставка ресторана Бакинский бульвар | Где мои соусы и лаваш???,24,2017-11-19T05:00:01.000Z,86749,2723,405,350,False
2DROTS,77,17.14.11,МЯЧ ИЗ МАГНИТОВ НЕВЕРОЯТНЫЙ ЧЕЛЛЕНДЖ,20,2017-11-13T14:38:47.000Z,285049,25939,446,987,False
Room Factory,77,17.16.11,"Короче говоря, лотерейный билет",23,2017-11-15T16:05:41.000Z,715628,52663,697,1342,False
Ozodivideo,77,17.24.11,Дарди дили як зани танфурӯш: “Мардонро ҷарима накунед”,25,2017-11-22T08:37:18.000Z,94087,1280,344,0,True
Во саду ли в огороде,77,17.15.11,Какие Томаты Я Больше Не Буду Сажать! Семена Томатов.,26,2017-11-14T14:51:17.000Z,40269,1653,132,471,False
RapNews,76,17.14.11,KIZARU VS FACE И PHARAOH | ПОПЕРЕЧНЫЙ VS ПАНИН | ATL | ХЛЕБ #RapNews 238,24,2017-11-13T14:56:10.000Z,132061,4934,335,714,False
TheRelizzz / Дата Выхода,75,17.14.11,УЖАС!!! Омерзительная ПРАВДА о внуке Пугачевой ШОКИРОВАЛА всю страну!!! Новости #TheRelizzz,1,2017-11-13T17:14:00.000Z,30142,25,91,17,False
КИНОКРИТИКА,75,17.14.11,Убийство в Восточном экспрессе – ПРИТОРНЫЙ ФАРС (обзор фильма),1,2017-11-13T16:31:27.000Z,44339,3038,499,361,False
Пусть говорят,74,17.15.11,Пусть говорят - Специальный выпуск. В новом доме. Исповедь Армена Джигарханяна. Выпуск от 13.11.2017,43,2017-11-14T09:13:45.000Z,173466,551,316,596,False
Прямой эфир,73,17.15.11,Цымбалюк-Романовская не захватывала театр. Андрей Малахов. Прямой эфир от 14.11.17,24,2017-11-14T15:16:34.000Z,9904,19,9,10,False
ЮТУБЕР,73,17.16.11,ДЕВОЧКА ИЗ ЛАЙК ТВ ШОУ ОБОГНАЛА PewDiePie ПО ПОДПИСЧИКАМ,22,2017-11-15T19:13:29.000Z,232724,14065,1578,1268,False
Подборки Army Home,70,17.12.12,"ПРИКОЛЫ 2017 Декабрь #5 ЭТО РОССИЯ, ДЕТКА! РУССКИЕ ПРИКОЛЫ | Эту страну не победить!",23,2017-12-11T16:02:43.000Z,41627,328,117,46,False
Татьяна Бугрий,70,17.14.11,Дизайн ногтей Градиент/Гелевая Лепка 3D дизайн/ Аппаратный маникюр/ Самый красивый МАНИКЮР,22,2017-11-13T09:56:51.000Z,39637,3613,24,132,False
AdMe.ru - Сайт о творчестве,70,17.22.11,"Ешьте Чеснок Каждый День и Смотрите, Что с Вами Случится",24,2017-11-21T00:47:13.000Z,155616,6811,152,289,False
Готовим с Ириной Хлебниковой,70,17.14.11,Слоеный Салат Изумрудный с Киви и Курицей,26,2017-11-13T13:34:33.000Z,25610,2248,36,110,False
Borsch,69,17.17.11,Рёбра барбекю в домашних условиях | Нереальная вкуснямба,24,2017-11-16T18:25:59.000Z,37979,3443,89,598,False
iKakProsto2,69,17.14.11,800 000 рублей за рекламу и абсурдный Razer.,28,2017-11-13T14:26:08.000Z,35984,6634,2474,925,False
Юрий Хованский,69,17.14.11,ТОР: РАГНАРЁК [Ржака от Marvel],24,2017-11-13T07:03:51.000Z,136087,7843,1232,808,False
ПОЯСНИ ЗА MMA,68,17.11.12,СЛОВА ВАСИЛИЯ ЛОМАЧЕНКО ПОСЛЕ БОЯ С РИГОНДО! ЖЕСТЬ !,17,2017-12-10T05:11:46.000Z,121656,1633,286,354,False
Вести FM,67,17.14.11,"Путин ближе Трампу, чем собственные безумцы * Железная логика с Михеевым (13.11.17)",25,2017-11-13T12:31:36.000Z,4553,85,3,2,False
Сила Слова,67,17.15.11,60 минут 13.11.2017 │Вечерний выпуск│,25,2017-11-13T18:40:48.000Z,83554,228,94,255,False
Грильков,67,17.16.11,"Потрачено: ФАРШ (Мираторг, Рестория, Окей)",26,2017-11-15T07:22:07.000Z,50360,4254,114,543,False
БОЛЬШАЯ ПОЛИТИКА,66,17.14.11,Bpemя nokaжeт 13.11.2017 (ПРОДОЛЖЕНИЕ) Отношения Ykpaunы и России?!,22,2017-11-13T13:37:07.000Z,14518,47,15,42,False
БАРМАЛЕЙКА,64,17.14.11,"ОКРУЖЕНИЕ ПУТИНА УСТАЛО ОТ ЦАРЯ, ПОРА МЕНЯТЬ",25,2017-11-12T09:32:14.000Z,102205,3180,248,758,False
CheAnD TV - Андрей Чехменок,64,17.14.11,Инвалид хочет себе П0РНО звезду ► Половинки ► Ваня на коляске ► #1,1,2017-11-13T15:59:45.000Z,73050,5480,295,596,False
This is Хорошо,63,17.24.11,Atlas: Восстание машин,23,2017-11-24T04:00:01.000Z,83560,8065,293,509,False
Alexander Palienko,63,17.14.11,Готовность умереть и жить 10000 лет. Александр Палиенко.,22,2017-11-13T09:30:38.000Z,19934,1517,36,107,False
Veniamin Nikora,63,17.14.11,СЕГОДНЯ – НЕОБЫЧНЫЙ ДЕНЬ. УТРО с ВЕНИАМИНОМ. 13 НОЯБРЯ,29,2017-11-13T07:11:26.000Z,23293,967,54,175,False
Ellena Galant,62,17.14.11,"9 {НЕОБЫЧНЫХ} ЗИМНИХ АКССЕСУАРОВ, КОТОРЫЕ СОГРЕЮТ И РАЗУКРАСЯТ ЗИМНИЙ СТИЛЬ",22,2017-11-13T04:30:00.000Z,36396,2600,73,157,False
LudaEasyCook Позитивная Кухня,62,17.22.11,ЭФФЕКТНАЯ ОВОЩНАЯ ЗАКУСКА К НОВОГОДНЕМУ СТОЛУ ВКУСНО И ПРОСТО!!! | EASY CUCUMBER APPETIZERS,22,2017-11-21T13:30:01.000Z,32928,2312,50,99,False
ТРК НТС,61,17.17.11,#Жаңылыктар / 16.11.17 НТС / Күндүзгү чыгарылыш - 15.00 / #Кыргызстан,25,2017-11-16T09:44:26.000Z,80043,286,108,111,False
versusbattleru,61,17.14.11,АНОНС / Versus Fresh Blood 4: Война Стилей,24,2017-11-12T17:50:31.000Z,733936,47964,2545,3901,False
VOVA KESS,61,17.17.11,ФЕЙС УНИЖАЕТ МАРЬЯНУ РО?! УМЕР РЭПЕР ЛИЛ ПИП / Lil Peep | КОМКОВ ПРОСИТ ПРОЩЕНИЯ,24,2017-11-16T16:04:03.000Z,109738,6365,168,789,False
Дизель Студио,60,17.16.11,Подборка приколов за октябрь - самое смешные приколы из Дизель шоу | Дизель cтудио Украина,23,2017-11-15T16:26:04.000Z,29129,381,48,27,False
Таня Карацуба Сеид-Бурхан,60,17.20.11,АНГЕЛЫ ПОЯВИЛИСЬ В НЕБЕ,29,2017-11-19T18:58:28.000Z,3151,0,0,40,False
iVideos,59,17.18.11,Рэмпейдж — Русский трейлер (2018),1,2017-11-17T05:00:01.000Z,210084,6446,447,557,False
Реальный футбол,58,17.15.11,"РОССИЯ - ИСПАНИЯ: ЧТО ЭТО БЫЛО??? ОБЗОР МАТЧА, ГОЛЫ",17,2017-11-15T01:43:48.000Z,132928,6271,603,495,False
Алена Митрофанова,58,17.18.11,Сочное Мясное блюдо к празднику! Новогодний рецепт!,22,2017-11-17T06:34:57.000Z,29816,2789,28,152,False
Политика и Геополитика,58,17.16.11,"Место встречи 15.11.17 Отношения Ykpaunы, России и 3anaдa?!",22,2017-11-15T18:27:53.000Z,9260,38,13,42,False
Столото,58,17.19.11,Столото представляет | Русское лото тираж №1206 от 19.11.17,24,2017-11-19T04:27:27.000Z,6013,36,26,16,False
Независимый Эксперт,57,17.18.11,ВАЛЫЫЫЫЫЫ! ПРИЕХАЛИ!!!  -АнтиПыЧ#39,22,2017-11-17T09:50:31.000Z,77493,2873,124,304,False
Дима Масленников,57,17.18.11,Светящийся ЛЁД - Проверка Странных лайфхаков!,24,2017-11-17T13:48:55.000Z,590807,52433,2074,14596,False
Кузьма,55,17.07.12,ПЕСНЯ ПРО КАБАНА,23,2017-12-06T12:44:08.000Z,274950,54894,1390,3314,False
вДудь,55,17.06.12,Артемий Лебедев - магистр мата и отец 10 детей / вДудь,22,2017-12-05T06:57:20.000Z,1297631,67063,6693,12497,False
Оштв Каналы,55,17.14.11,Сайт кабар 13.11.2017 | Түрмөдө намаз окуганы үчүн жыныстык мүчөсүнө кайнак суу куйган,25,2017-11-13T12:02:42.000Z,28321,78,65,44,False
"САД, ОГОРОД,СВОИМИ РУКАМИ",54,17.19.11,КАК ВЫБРАТЬ ТОРФЯНОЙ СУБСТРАТ.,29,2017-11-18T12:11:54.000Z,4488,521,4,23,False
ILYA STREKAL,54,17.15.11,КАК ПРАВИЛЬНО ГОНЯТЬ НА БМВ / BMW M4 vs BMW M2,2,2017-11-14T14:34:28.000Z,173862,7902,1024,891,False
КЛИККЛАК,54,17.26.11,ТРЭШ ЛОТО: ВОКРУГ СВЕТА - ДИКИЙ ЗАПАД,23,2017-11-25T15:01:53.000Z,1143146,107466,5453,4371,False
Ольга Уютный уголок,53,17.17.11,Салат Объедашка на Новый год и не только.,22,2017-11-16T03:03:58.000Z,30917,1809,65,165,False
ЗВЕЗДНЫЕ НОВОСТИ,53,17.17.11,Тарасов не общается с дочкой из-за Анастасии Костенко,22,2017-11-16T11:40:20.000Z,6960,14,28,8,False
JoRick Revazov,53,17.15.11,BMW 220 вторая серия и Розыгрыш iPhone X!! Может ли она дрифтить? Броня и новые диски.,2,2017-11-14T15:48:01.000Z,272169,15795,1144,1412,False
Что если,52,17.18.11,"ЧТО, ЕСЛИ весь МИР В ОГНЕ",24,2017-11-17T10:51:25.000Z,564315,29569,978,1838,False
ПолитЭксперт,52,17.15.11,Михаил Соколов Андрей Пионтковский - Каков план Путина? ... Радио Свобода 13.11.2017,22,2017-11-13T17:12:09.000Z,49573,853,64,241,False
Дима Гордей,52,17.04.12,ЗА ЧТО МНЕ ДАЛИ ПО ЛИЦУ. Травма коленки,17,2017-12-03T16:01:23.000Z,457088,42787,917,2413,False
BozbashPictures,52,17.18.11,Bozbash Pictures Qayıdış Yeni (16.11.2017),24,2017-11-16T20:01:34.000Z,188973,3921,276,477,False
Е. М. Реальная Оппозиция,51,17.16.11,СР0ЧН0Е ЗАЯВЛЕНИЕ Мин0Б0Р0НЫ PФ - 16.11.2017!!! В0Т ЭТ0 П0В0Р0Т!!! Сергей Шойгу,25,2017-11-14T22:02:09.000Z,118574,420,121,69,False
АКАДЕМИЯ ПОРЯДОЧНЫХ ПАРНЕЙ,51,17.14.11,ТОП 10 ЗАЕДАЮЩИХ ПЕСЕН ОСЕНИ 2017,10,2017-11-13T17:00:01.000Z,61881,4627,197,492,False
Афиша,50,17.17.11,"Узнать за 10 секунд | MARKUL угадывает треки ЛСП, T-Fest, Yanix, Oxxxymiron и еще 31 хит",10,2017-11-16T07:30:00.000Z,889400,35441,1298,5107,False
PewDiePie,50,17.24.11,MEME REVIEW: Stolen Bike Meme,23,2017-11-23T17:51:12.000Z,1294899,139606,2040,14323,False
Миша Яковлев Кировск,50,17.14.11,Ответ ксенону. Как они так и мы.,2,2017-11-13T09:49:31.000Z,82382,3542,904,795,False
Непредсказуемая Предопределенность,50,17.17.11,Валентин Катасонов 15.11.2017,22,2017-11-15T19:14:30.000Z,33463,415,21,166,False
Официальный канал КВН,49,17.14.11,КВН 2017 Высшая лига Вторая 1/2 (12.11.2017) ИГРА ЦЕЛИКОМ Full HD,23,2017-11-12T22:00:03.000Z,442228,3194,5985,3218,False
MOGOL TV,49,17.14.11,САМЫЙ КОРОТКИЙ ТЕСТ НА ИНТЕЛЛЕКТ! ОТВЕТЬ НА 3 ВОПРОСА,22,2017-11-13T14:42:09.000Z,85162,5746,606,2234,False
Эра Водолея,49,17.15.11,Притча про свое и чужое,27,2017-11-14T17:27:30.000Z,7659,519,11,22,False
Тимур Сидельников,49,17.16.11,Apple Airpods или Sony WF-1000x? Сравнение,22,2017-11-15T11:00:03.000Z,181498,5937,1315,939,False
День ТВ,49,17.15.11,Александр Дугин. Химеры и чудовища выходят из тени,25,2017-11-14T11:18:01.000Z,11430,392,30,146,False
Россия - Украина,49,18.14.01,Скандал в ЦИК: Грудинин запутался в своих богатствах,25,2018-01-12T20:30:01.000Z,92560,926,1191,1927,False
Гена Острецов,49,17.14.11,Интересные  новости  № 263 / 17,22,2017-11-13T13:25:53.000Z,8864,737,15,36,False
REVOLUTION in Russia,48,18.04.01,"Ходорковский открыл правду о том, кто главный в Кремле",25,2018-01-03T07:09:14.000Z,56666,903,98,286,False
KINOKOS,48,17.16.11,Все киногрехи  Телохранитель киллера,24,2017-11-15T12:06:38.000Z,98299,5056,361,536,False
Лиса Рулит,48,17.14.11,10-летний японец нагибает ТАЗы?,2,2017-11-13T08:02:46.000Z,122061,3134,413,679,False
Телеканал Дождь,48,17.01.12,Медведев о фильме Навального «Он вам не Димон»: «Обормоты и проходимцы»,29,2017-11-30T15:29:16.000Z,123502,3695,842,1421,False
Cut The Crap,48,17.17.11,КИНОВСЕЛЕННАЯ DCEU ОТ НАЧАЛА И ДО ЛИГИ СПРАВЕДЛИВОСТИ | ПЕРЕСКАЗ ФИЛЬМОВ DC,1,2017-11-16T16:01:43.000Z,158779,11215,326,384,False
SOBOLEV,48,17.20.11,СОБОЛЕВ НА ВЕЧЕРНИЙ УРГАНТ / ЭЛДЖЕЙ ЗАБЛОКИРОВАЛ РОЗОВОЕ ВИНО,22,2017-11-19T15:57:39.000Z,1379936,118797,6376,7464,False
Chuck_review,47,17.16.11,Лига Справедливости — Приятная х*йня [Коротенько],1,2017-11-15T19:03:35.000Z,115122,9630,431,522,False
JUSTFUN,47,17.04.12,"ПАРА НАШЛА СКРЫТЫЙ СЕЙФ В СВОЁМ ДОМЕ, ТО ЧТО ОНИ ТАМ ОБНАРУЖИЛИ ПОРАЖАЕТ",24,2017-12-03T15:18:55.000Z,10988,188,21,10,False
ЗДРАВЫЕ МЫСЛИ,47,17.19.11,ЗАГОВОР ЗА СПИНОЙ ПУТИНА РАСКРЫТ (19.11.2017),22,2017-11-18T07:30:01.000Z,98569,667,101,404,False
ИЛЬДАР АВТО-ПОДБОР,47,17.14.11,Неожиданная встреча с подписчиком,2,2017-11-13T16:48:44.000Z,362255,13776,874,1331,False
PolitRussia,47,17.18.11,Европа жестко троллит Киев (Руслан Осташко),25,2017-11-17T16:12:20.000Z,38029,2731,38,169,False
TOP TIP TOP MMA,47,17.04.12,ФРАНСИС НГАННУ ПРОТИВ АЛИСТАРА ОВЕРИМА! ПОЛНЫЙ ОБЗОР БОЯ!,17,2017-12-03T05:59:50.000Z,89492,1708,55,606,False
Ксения Собчак,46,17.16.11,Собчак о миллионе полицейских и пытках «Звонком Путину»,25,2017-11-14T17:20:40.000Z,109002,2808,1101,882,False
RED21,46,17.20.11,Как стать крутым Видеоблоггером № 1,23,2017-11-19T10:56:08.000Z,312576,25606,3910,4456,False
KINOFABRIKA,46,17.19.11,"Беги, не оглядывайся! (2017). 1 серия. Мелодрама, премьера.",1,2017-11-18T16:30:00.000Z,38431,0,0,23,False
Masha Create,46,17.15.11,Маникюр звездное небо! Считаем звезды в космосе на ногтях  Дизайн ногтей гель лаком LEO,22,2017-11-14T23:30:34.000Z,7222,870,20,19,False
RizaNovaUZ,46,17.26.11,Janob Rasul - 2017-yilgi konsert dasturi | Жаноб Расул - 2017-йилги концерт дастури,10,2017-11-25T09:39:28.000Z,67165,1521,107,304,False
NEWSONE,46,18.19.01,"Червоненко: я надеялся на США, но они перестали нас понимать и хотят взять в ручное управление 18.01",25,2018-01-18T21:25:23.000Z,12775,221,57,182,False
Ազատություն,46,17.06.12,Գեներալ Բաղմանյանն ազատվել է ԶՈւ Գլխավոր շտաբի պետի տեղակալի պաշտոնից,25,2017-12-05T16:15:39.000Z,6642,50,4,7,False
Научпок,46,17.17.11,Можно ли доверять СВОИМ ВОСПОМИНАНИЯМ?— Научпок,28,2017-11-16T13:05:44.000Z,140316,9454,227,489,False
SlivkiShow,46,17.26.11,6 ЛАЙФХАКОВ от SLIVKI SHOW,24,2017-11-25T08:38:49.000Z,2591759,131799,14752,9740,False
UZBEK TV,45,17.06.12,ШАВКАТ МИРЗИЁЕВ МАТБУОТ АНЖУМАНИДА ҲАММАНИ ҚОЙИЛ ҚОЛДИРДИ,1,2017-12-05T12:06:22.000Z,37536,378,28,131,False
DUNYO TV,45,18.11.03,Хамза Умаров унинг фарзандлари хам актёр булишганми,24,2018-03-10T18:21:11.000Z,4440,104,2,14,False
Студия ДжоШизо,45,17.18.11,Ностальгирующий Критик - Бэнгарэнг,22,2017-11-17T16:55:32.000Z,34823,2943,63,81,False
Жекич Дубровский,44,17.22.11,НЕРЕАЛЬНО КРУТОЙ ТЮНИНГ за 4 тыс.р. Оторвало колесо,2,2017-11-21T15:02:48.000Z,413644,21574,1460,3631,False
Эдуард Адамян,44,18.07.01,В Беларуси на съемной квартире,22,2018-01-06T12:48:23.000Z,25280,1573,63,870,False
Я - ТОРТодел!,44,17.14.11,⭐Собираем двухъярусный кремовый торт⭐- Я - ТОРТодел!,22,2017-11-13T09:00:46.000Z,16408,1053,48,128,False
Söz Dizi,43,17.21.11,Söz | 22.Bölüm,1,2017-11-20T21:14:17.000Z,263217,7651,501,1122,False
Максим Шелков,43,17.16.11,Пежо - Автохлам или автомобиль? ч.3 - ФИНАЛ,2,2017-11-15T15:43:57.000Z,164247,8410,295,708,False
Kommentarii,43,17.24.11,Пенсионерам могут выплатить ЕДВ в размере 10 000 рублей,27,2017-11-23T16:19:26.000Z,10051,137,14,19,False
Игорь Негода,43,17.19.11,Реактивный самолет - краш аэродрома и запуск ракет с борта,28,2017-11-18T12:49:30.000Z,119726,20565,152,2448,False
GRANDENIKO VLOG,43,17.20.11,ГОТОВИМ С МАМОЙ ОБЕД,22,2017-11-19T12:52:19.000Z,10423,579,52,122,False
МЁD,43,17.15.11,"Что, если тупость была бы преступлением?",23,2017-11-14T14:29:50.000Z,352235,29932,674,1008,False
Sokolovsky!,42,17.17.11,"ЛАРИН ПРОХОДИТ ДЕТЕКТОР ЛЖИ / Versus, Джарахов, чайлдфри и любовь",24,2017-11-16T16:05:25.000Z,157651,16596,1611,1248,False
Телеканал СТБ,42,17.27.11,Школьница забеременела от 25-летнего насильника-армянина — Один за всех — 26.11.2017,24,2017-11-26T22:26:03.000Z,21130,255,69,270,False
Fox Uz,42,17.14.11,Хар куни Оч Қоринга Чеснок  Есангиз Мўъжизани Кўрасиз,22,2017-11-13T16:12:46.000Z,32720,934,27,59,False
112 Украина,42,17.18.11,"Дмитрий Гордон, журналист, в Вечернем прайме телеканала 112 Украина, 16.11.2017 (Часть 2)",25,2017-11-16T20:17:44.000Z,36509,192,121,279,False
ASK Turk,42,17.24.11,Adini Sen Koy / Ты назови 224 Серия (русские субтитры),1,2017-11-24T03:00:01.000Z,12653,111,35,42,False
LAПIN,42,17.20.11,15 НЕУДАЧ НА ВЕЛОСИПЕДЕ,24,2017-11-19T14:25:01.000Z,122474,10657,654,1191,False
Tasty food,42,17.15.11,"Рецепт НАСТОЯЩИХ ДРАНИКОВ Без Муки и Яиц! Этот вкус не передать словами, ПОПРОБУЙТЕ!",22,2017-11-14T10:34:36.000Z,41246,2454,53,95,False
Яковлев Миша,41,17.24.11,Как мы Ауди S6 перевозили. Делать и делать.,2,2017-11-23T08:57:39.000Z,124777,7583,228,644,False
Alex Vikodinov,41,17.23.12,"50 ВЕЩЕЙ С ALIEXPRESS, ОТ КОТОРЫХ ТЫ ОФИГЕЕШЬ / ЛУЧШЕЕ С АЛИЭКСПРЕСС + КОНКУРС",24,2017-12-22T14:00:05.000Z,28072,2283,65,1192,False
EvoNeon FIFA,41,17.17.11,"365 ДНЕЙ НА YOUTUBE. ДРУЗЬЯ, ДЕНЬГИ, ЛОЖЬ",22,2017-11-16T13:04:47.000Z,120079,15136,156,1209,False
Все по полочкам,41,17.15.11,ПРОНЬКО. Резкий рост банкротств предприятий в России 13.11.17,22,2017-11-13T17:07:21.000Z,30965,747,27,184,False
Антиплатон,40,17.19.12,ПАВЕЛ ГРУДИНИН - ЧЕ МНЕ ЕГО БОЯТСЯ!,25,2017-12-18T14:34:05.000Z,57553,5097,40,773,False
Семья в деревне!,40,17.15.11,✅ПЛАНЫ на ближайшее время // Как быть с Рыжухой // И всё таки мы туда съездим,22,2017-11-14T16:25:06.000Z,28033,1825,39,194,False
UzbekFilmsHD,40,17.15.11,Gazini bos Jamshid (o'zbek film) | Газини бос Жамшид (узбекфильм),1,2017-11-14T14:07:59.000Z,172364,2081,568,526,False
Нейромир-ТВ,40,17.18.11,Юрий Болдырев в Политкафе ч.1,25,2017-11-17T08:03:37.000Z,13750,770,48,381,False
TRT 1,40,17.16.11,Diriliş Ertuğrul 96.Bölüm Tanıtımı,24,2017-11-15T20:35:07.000Z,133748,0,0,0,True
Black & White Team,40,17.15.11,Lexus LX570 СМЕРТЬ МОТОРА. Лолы больше НЕТ.,2,2017-11-14T14:24:56.000Z,456449,18465,1462,3051,False
GopherVid,40,17.17.11,КАК СДЕЛАТЬ КУБИЧЕСКОЕ ЯЙЦО - DIY,28,2017-11-16T17:09:18.000Z,50083,2683,170,367,False
Константин Ответственный X,40,17.02.12,Волкова опять арестовали на 30 суток 1.12.2017,22,2017-12-01T13:53:29.000Z,2579,135,8,91,False
RT на русском,40,17.02.12,Финальная жеребьёвка ЧМ-2018 — спецэфир RT,25,2017-12-01T16:51:02.000Z,45123,299,85,36,False
Видео от SoLiDa,40,17.18.11,=Обзор ИРП= АМЕРИКАНСКИЙ сухпай. Что едят в USA армии. MRE №1,24,2017-11-17T13:36:59.000Z,271648,15441,718,1719,False
Евгений Ройзман,40,17.19.11,Посмотрел Матильду. Картина за $ 450 000 000. Законы арт-рынка.,22,2017-11-17T16:54:01.000Z,42845,3951,103,424,False
Реальная журналистика,39,17.07.12,ПУТИНСКАЯ СТАБИЛЬНОСТЬ: нищета VS зомбоящик,25,2017-12-06T07:59:44.000Z,58686,6796,90,840,False
tophype,39,17.20.11,7 ОТЛИЧИЙ ШКОЛ В РАЗНЫХ СТРАНАХ МИРА,24,2017-11-19T12:17:45.000Z,285638,15601,320,2551,False
Super Tamashalar,39,17.05.12,Москвада Аскар Акаевди Алмаз Шаршенович эмес Алмаз Шаадаев бетинен өөп кайтты,23,2017-12-04T10:38:04.000Z,27561,357,67,159,False
Yuliya Small,39,17.16.11,ЛЕДЕНЦЫ на палочке ☆ ВКУС из ДЕТСТВА ☆ Леденцовая фабрика,26,2017-11-15T11:27:10.000Z,12050,1186,7,96,False
Акыркы Жанылыктар,39,17.26.12,Актриса Алиша Диа жолдошу менен ажырашып кеттиби?,25,2017-12-25T12:19:33.000Z,14383,46,13,19,False
Орел и Решка,39,17.19.11,Бездомные коты и достопримечательности Рима! Орёл и Решка. Перезагрузка,19,2017-11-18T13:58:24.000Z,9211,325,14,31,False
kinomiraru,38,17.14.11,Все грехи фильма Звёздные войны: Эпизод 1 – Скрытая угроза - Часть 2,1,2017-11-13T18:27:25.000Z,50269,4229,150,398,False
NEWES RU,38,17.15.11,Новости на 5*тв канал 14.11.2017 Последний Выпуск 14.11.17,25,2017-11-14T02:45:27.000Z,59687,120,41,14,False
Евгений Ширманов,38,17.15.11,Департамент судей Краснодарского края. Тротуар для пешеходов? Часть 1,2,2017-11-14T16:00:09.000Z,71039,6886,145,1076,False
Siberian Beard,38,17.15.11,Топ 5 Японческих Тачек за 300 тысяч рублей,2,2017-11-14T11:35:18.000Z,115617,13268,282,658,False
Ridddle,38,17.19.11,НАСТОЯЩИЕ ПРЕДЕЛЫ ЖИЗНИ ЧЕЛОВЕКА,24,2017-11-17T12:07:02.000Z,352819,26699,1055,2126,False
Tema Flex,38,17.21.11,"О ЧЁМ ЧИТАЛ LIL PEEP? Он не умер, пока мы помним его.",24,2017-11-20T18:17:51.000Z,110378,8909,404,878,False
AcademeG DailyStream,38,17.14.11,Разведка маршрута под новые серии.,15,2017-11-12T20:40:36.000Z,305745,12160,954,721,False
Майни,37,17.14.11,ДОБРЯК - ASSASSIN'S CREED ORIGINS - МУЛЬТ ОБЗОР (Dobryak) | Реакция,20,2017-11-13T14:00:01.000Z,35358,1749,72,166,False
Kuplinov ► Play,37,17.15.11,РЕСТЛЕР МОЕЙ МЕЧТЫ,20,2017-11-14T12:00:05.000Z,165033,9704,381,721,False
"Ай, Как Просто!",37,17.14.11,Такой только у меня и у Ларри Кинга.,28,2017-11-13T17:21:04.000Z,56513,5668,305,579,False
Karabas Channel,37,17.29.12,Как Порошенко опозорился на обмене военнопленных,22,2017-12-28T19:50:26.000Z,102276,3815,531,907,False
Волшебная Россия,37,17.14.11,Путин Рассказал всем когда на Руси жить хорошо станет ждем 2018 Смотреть всем,22,2017-11-12T10:38:13.000Z,80179,3046,347,991,False
Наши пушистые друзья,37,17.14.11,"Грибники нашли в лесу собаку, которая угодила в охотничью удавку…",15,2017-11-13T13:38:38.000Z,19652,690,9,28,False
Алексей Столяров,37,17.15.11,ЖИМ 100 КГ НА 100 РАЗ - СТОЛЯРОВ И ВОЙТЕНКО ПОБЕДИЛИ / ВСЯ ПРАВДА,17,2017-11-14T11:02:40.000Z,209391,18309,1500,1119,False
Корпорация Зла,37,17.28.11,Приколы с котами - ТОПовая подборка!,23,2017-11-27T15:22:01.000Z,86434,3861,256,193,False
Юлик,37,17.14.11,ХАЙП КЭМП - СВОЙ СРЕДИ ЧУЖИХ,24,2017-11-13T16:11:31.000Z,424596,49854,714,2944,False
Максим Шевченко,37,17.23.11,Арест Керимова - атака на Россию,25,2017-11-21T19:52:36.000Z,33652,586,468,625,False
Alex&Milana,37,17.17.11,КОКОСОВЫЙ торт РАФАЭЛЛО / НЕРЕАЛЬНО ВКУСНЫЙ!!! / Raffaello Coconut Cake,22,2017-11-15T22:35:50.000Z,34050,2054,45,140,False
Live Today,36,17.26.11,"МУЧАЮ АНТИСТРЕССЫ УТЮГОМ, ЕНОТОМ, БЛЕНДЕРОМ и др  с сайта Gearbest",24,2017-11-25T07:30:00.000Z,60530,3807,100,1028,False
tanya leto,36,17.22.11,Самый бюджетный РЕМОНТ СТАРОГО ПОЛА.,22,2017-11-21T05:09:51.000Z,26324,2523,34,1206,False
Big Russian Boss Show,36,17.20.11,Big Russian Boss Show #36 | Пошлая Молли,24,2017-11-18T12:10:09.000Z,554346,33124,8771,3881,False
Галина Мительман,36,17.17.11,Госпожа Фазилет - 2 фраг к 23 серии ОЗВУЧКA,22,2017-11-16T12:27:33.000Z,22602,234,13,64,False
varlamov,36,17.29.11,"Вышний Волочёк: город, который повернул не туда",19,2017-11-27T12:03:20.000Z,41216,1738,77,530,False
СТС,36,17.14.11,Шоу Успех | Выпуск 2,1,2017-11-13T15:30:03.000Z,23316,699,160,217,False
Nikolay B.,36,17.10.12,Самое весёлое поздравление с Новым 2018 годом!!!,10,2017-12-10T03:24:17.000Z,4912,328,12,21,False
Дом 2 с Глорией Рай,36,17.14.11,ДОМ 2 НОВОСТИ раньше эфира! (19.11.2017) 19 ноября 2017,22,2017-11-13T16:42:03.000Z,18445,100,36,9,False
ТО Gazgolder,36,17.21.12,Баста - Папа What's Up,10,2017-12-20T10:58:10.000Z,546133,37311,3813,1949,False
Поззи,35,17.04.12,МОЗГУ КОНЕЦ!,24,2017-12-03T18:47:35.000Z,55937,3728,103,698,False
НОВОСТИ ЭКОНОМИКИ,35,18.26.01,ПАВЕЛ ГРУДИНИН ПРЕСС-КОНФЕРЕНЦИЯ В САМАРЕ ДОСТАЛОСЬ ВСЕМ (25.01.2018) СМОТРИТЕ НЕ ПОЖАЛЕЕТЕ,22,2018-01-25T09:05:00.000Z,77597,3118,5202,1339,False
Настоящее Время,35,17.30.11,Березники: жизнь в ожидании провала | НЕИЗВЕСТНАЯ РОССИЯ,29,2017-11-28T12:30:01.000Z,83840,3553,107,895,False
AdamThomasMoran,35,17.18.11,+100500 - Передёргивание На Первом,23,2017-11-17T15:15:57.000Z,992183,109366,3794,36390,False
NEWS,35,17.22.11,Переговоры Путина и Башара Асада в Сочи,25,2017-11-21T07:28:45.000Z,13156,0,0,60,False
Best VIDEOS Лучшее видео,35,17.20.11,BEST CUBE # 200,23,2017-11-19T16:34:54.000Z,87921,2929,245,305,False
Tanya StreLove,35,17.18.11,"7 ЛайфХаков, которые изменят жизнь девушек  BEAUTY LIFE HACKS  Tanya StreLove",26,2017-11-17T16:32:59.000Z,156937,11376,228,511,False
Телеканал ТНТ,35,17.24.11,Stand Up - Нурлан Сабуров о провинциальном роддоме,24,2017-11-22T13:29:32.000Z,65092,1103,62,28,False
ДИЗЕЛЬ ШОУ - ЮМОР ICTV - Официальный канал,35,17.30.11,МУЖ И ЖЕНА - СЕМЕЙНЫЕ ПРИКОЛЫ на отдыхе – Дизель Шоу лучшее | ЮМОР ICTV,23,2017-11-29T17:00:08.000Z,42561,445,38,32,False
Е. М.RealOp. Новости Сегодня,34,18.03.04,ГОВОРИТ МОСКВА!!! 03.04.2018 - РАЗГРОМНАЯ РЕЧЬ ЗЮГАНОВА по РОССИИ и ВЛАСТИ,25,2018-04-02T21:03:29.000Z,6746,0,0,24,False
Виталий Островский,34,17.22.11,КАК ПОХУДЕТЬ! Гормоны. Бессонница.,22,2017-11-21T12:03:19.000Z,5890,458,7,73,False
1in.am LIVE,34,18.16.04,Փաշինյանը փաստացի հայտարարում է՝ Հայաստանում ինստիտուցիոնալ ընդդիմությունը ճանապարհ չունի,24,2018-04-15T20:12:01.000Z,10142,49,38,22,False
Сергей Будков,34,17.02.12,Разбор Разведданных. Разделение на классы...30.11.2017 гг,22,2017-12-01T05:38:18.000Z,8850,431,14,51,False
ДА НИЛ,34,17.26.11,САМЫЙ ВАТНЫЙ КЛИП ШКОЛЬНИКОВ... (Песня о Путине Дядя Вова Мы С Тобой реакция),24,2017-11-25T14:12:47.000Z,42643,5545,314,564,False
Parfenon,34,18.20.02,"Парфенон #1: Леонид Парфенов о дагестанском деле, Берлине, Башлачеве и Березовском",22,2018-02-19T11:56:11.000Z,190079,23306,2098,2625,False
ДоЗа СчАсТьЯ,34,17.05.12,ЧЕМ ОНИ ЗАНИМАЮТСЯ В ШКОЛЕ НОЧЬЮ? stop motion / стоп моушен,26,2017-12-04T15:26:06.000Z,44802,2956,83,1309,False
100%,34,17.19.11,"Крымчанка из Херсона: Украинцы уже поняли, почему мы выбрали Россию",25,2017-11-17T17:30:00.000Z,37578,304,27,187,False
Антон Воротников,34,17.18.11,"Я думаю, этот автомобиль вам понравится!)",2,2017-11-17T15:53:47.000Z,189281,13829,921,1051,False
Durel,34,17.17.11,Даня Кашин подстригся | Новая стрижка D.K. Inc.,22,2017-11-16T11:15:49.000Z,11877,607,12,60,False
BEST of MMA,34,17.16.11,Роган и Шауб о бое Хабиба против Барбозы и Фергюсона [RUS],17,2017-11-15T09:25:33.000Z,18106,39,2,3,False
Darya Kamalova,34,17.14.11,ЧТО НАДЕТЬ НА НОВЫЙ ГОД | 15 ЛУЧШИХ ГОТОВЫХ ОБРАЗОВ НА ЛЮБОЙ КОШЕЛЕК | ПРАЗДНИЧНЫЕ НАРЯДЫ,22,2017-11-13T06:51:24.000Z,36807,2488,87,159,False
MORGENSHTERN,33,17.20.11,LIL PUMP - ТРЕК и КЛИП за 5 МИНУТ! [#ИзиРеп] / SONG and MUSIC VIDEO for 5 MINUTES! (Eng Subs),24,2017-11-19T18:00:02.000Z,279740,35404,1146,3741,False
Daniel Boy,33,18.19.02,ЭКСКУРСИЯ!!,22,2018-02-18T14:27:58.000Z,16093,1314,210,379,False
ИККЕРО,33,18.24.02,"КОРОЧЕ ГОВОРЯ, Я ПОЛУЧИЛ ПЯТЕРКУ [От первого лица]",22,2018-02-23T11:09:50.000Z,234998,8783,607,4747,False
DegraTube,33,17.27.11,ТРЕНДЫ ЮТУБА (ЗА 1 МИНУТУ),23,2017-11-26T15:03:13.000Z,137354,19157,692,898,False
Video Star,33,17.03.12,"Такой фильм еще нужно поискать! БЕДНАЯ LIZ Русские мелодрамы 2017 новинки hd, сериалы 2017",1,2017-12-02T18:13:22.000Z,24086,150,27,15,False
Utopia Show,33,17.15.11,А ТЫ ДОСТОИН? Тор с НАУЧНОЙ точки зрения,28,2017-11-14T14:38:51.000Z,303064,47783,465,3887,False
В гостях у Елены,33,17.14.11,САЛАТ РУССКАЯ КРАСАВИЦА.НОВОГОДНИЙ СТОЛ 2018 год.,26,2017-11-13T14:10:46.000Z,9168,430,67,46,False
Asekose am,33,18.18.02,"Հայտնի ռեմբո-լաչառներից մինչև անհայտ ահաբեկիչներ,քյառթու փոքրիկ երգիչից մինչև վաստակավոր յաիսնիցաներ",25,2018-02-17T18:36:35.000Z,11936,89,13,29,False
Топовый Пинск,33,18.01.01,"КОРОЧЕ ГОВОРЯ, НОВЫЙ ГОД",26,2017-12-31T07:00:03.000Z,44697,2794,86,972,False
НЕ ПЕРВЫЙ КАНАЛ,33,17.18.12,Павел Грудинин: Вся страна уже в истерике...(пресс- конференция Путина),25,2017-12-17T11:21:11.000Z,104976,5132,141,1000,False
SuperCrastan,33,17.15.11,Стабилизация древесины. Первые шаги.,28,2017-11-14T15:37:56.000Z,303369,29607,396,687,False
1 782 987 подписчиков,33,18.09.01,Ей Говорили- Давай НАГИБАЙСЯ!! Она Наклонялась НА РАБОТЕ и СОХРАНЯЛА МОЛОДОСТЬ! Секрет молодости.,23,2018-01-08T14:30:01.000Z,49046,1397,16,47,False
ArmLur.аm,33,18.17.02,"Զարուհին փառք էր, էդի ավելի ռեմբո էր. Սեյրան Սարոյան",25,2018-02-16T07:23:53.000Z,105920,1227,88,0,True
Factor tv,33,18.17.04,«Քայլ արա՝ մերժիր Սերժին» օր 4․ պայքարը թևակոխում է վճռորոշ փուլ. LIVE,25,2018-04-16T17:25:08.000Z,115871,1160,120,91,False
МастерШеф,33,17.15.11,МастерШеф. Сезон 7. Выпуск 23. Часть 2 из 5 от 14.11.2017,24,2017-11-14T22:50:43.000Z,14425,86,8,24,False
Кик Обзор,33,17.14.11,"Самое крупное поглощение. Что заменит Face ID? Microsoft Спасает 3,5мм Джек и другие новости!",28,2017-11-13T15:14:10.000Z,112171,7662,182,317,False
Bulkin,32,17.12.12,НОВЫЙ ПРОЕКТ! ЗИМНИЙ ДРИФТ КОРЧ! ИЖ ОДА!,2,2017-12-11T13:44:30.000Z,140079,19504,190,8199,False
Andro-news.com,32,17.17.11,ЭТО OnePlus 5T - смартфон который мы НЕ Заслуживаем!,28,2017-11-16T18:43:13.000Z,41615,2410,111,259,False
molodejjtv,32,17.14.11,Ивановы Ивановы - комедийный сериал HD - 16 и 17 серии,23,2017-11-13T18:00:46.000Z,55601,512,18,52,False
Садовый Мир,32,17.30.11,Супер ягода для здоровья  Калина красная,26,2017-11-29T13:33:05.000Z,5808,382,10,65,False
Andrey Antonov MMA,32,17.11.12,"ФОРМА ХАБИБА ЗА 20 ДНЕЙ ДО БОЯ, ФЕРГЮСОН НАТОЧИЛ ЛОКТИ, ВАЛЕНТИНА ШЕВЧЕНКО СЛЕДУЮЩИЙ БОЙ",17,2017-12-10T17:16:32.000Z,40019,787,38,101,False
Аналитика Мира,32,17.24.11,США Будут Валить Рубль в Декабре-Январе. Любые деньги будут отдавать за валюту - Валентин Катасонов,25,2017-11-22T09:26:04.000Z,66249,1016,82,304,False
"Rogandar NEWs - Новости, факты, события",32,17.07.12,Они смеялись над  «Адмиралом Кузнецовым»: F-35 начал рассыпаться в воздухе,29,2017-12-05T20:44:02.000Z,291757,1627,276,586,False
Студия Квартал 95 Online,32,17.24.11,Владимир Зеленский: Накипело!,23,2017-11-23T14:59:55.000Z,599289,58984,2877,7968,False
BULLSEYE,32,17.15.11,Обновление. Паркур. Баланс оружия - PUBG PLAYERUNKNOWN'S BATTLEGROUNDS,20,2017-11-14T11:43:09.000Z,79164,3303,183,1,False
Clickoncar,32,17.15.11,Чем Рио Х Лайн ХУЖЕ Веста Кросс? KIA Rio X line 2018 ПЕРВЫЙ тест драйв и обзор,2,2017-11-14T16:17:55.000Z,60989,2376,273,542,False
Говорить Україна,32,17.13.12,Четверо малышей из покинутого общежития (полный выпуск) | Говорить Україна,22,2017-12-12T22:03:52.000Z,17545,139,30,171,False
Аксиома,32,17.07.12,Рычаги давления очень мощные - Ультиматум для олигархов [06/12/2017],29,2017-12-06T01:17:21.000Z,38018,1308,54,245,False
DIAWANTED,31,17.26.11,Опасные Соседи ● Русский Дубляж,1,2017-11-25T10:27:40.000Z,60157,3353,43,199,False
Красавица и Чудовище Официальный канал,31,17.09.12,ЗАЛЕЗЛА НЕ ТУДА [Красавица и Чудовище](Выпуск 118),23,2017-12-07T13:57:24.000Z,439735,23347,939,1172,False
KREOSAN,31,17.24.11,✅На что способен Электро-Велосипед! 🚴 Все плюсы и минусы👍 Уникальные возможности Вело-Байка,28,2017-11-23T14:04:25.000Z,324471,19132,561,2479,False
Россия,31,17.14.11,Задорнов ПРОЩАЛЬНОЕ последнее Видео  Оказывается он знал и,25,2017-11-13T08:42:10.000Z,52419,2099,80,227,False
Светлана Чернова,31,17.02.12,Рёшти с Сельдью и Горчичным  Крем-Соусом.Отличная Закуска для Праздничного Стола.,26,2017-12-01T18:08:19.000Z,10334,1236,35,71,False
netstalkers,31,17.17.11,ФАБРИКА ТРОЛЛЕЙ НА САВУШКИНА 55 [netstalkers],24,2017-11-16T14:22:59.000Z,62338,10047,5111,692,False
STAR NEWS,31,18.28.01,РАССКАЗАЛА ВСЮ ПРАВДУ О ВЫБОРАХ и сняла свою кандидатуру с выборов! ВЫБОРЫ 2018! Россия,25,2018-01-27T15:40:04.000Z,55291,3501,2160,1871,False
Руслан Усачев,31,17.18.11,Новый зашквар BLACK STAR // Cмерть LIL PEEP // Битва за Розовое Вино,24,2017-11-17T14:26:12.000Z,512821,56159,3806,2137,False
Body Mania,31,17.14.11,Турникмен против Химика. Жим 100 кг на 100 раз!,17,2017-11-13T10:30:05.000Z,345569,16751,769,2630,False
Уголок Акра,31,17.01.12,БЛОГЕРЫ ПРОТИВ РОССИИ-24: Репортаж о ВИНИШКО-ТЯН!,24,2017-11-30T14:08:56.000Z,261710,25279,854,1848,False
Lily Milashka,31,18.03.01,Поздравляю с Рождественским Сочельником!,22,2018-01-03T04:00:00.000Z,3591,384,12,18,False
German *El Classico*,31,17.18.11,РОНАЛДУ В ПАКЕ ЗА 7500 / Ronaldo in a pack fifa 18,22,2017-11-17T14:39:26.000Z,185177,18106,173,815,False
World of Tanks. Официальный видеоканал,31,17.17.11,Проведи свой Гамбит!,20,2017-11-16T13:52:04.000Z,93665,2321,492,238,False
Armenian Public TV,31,18.25.02,Եկեք հասկանանք. Ուզում եմ հայտնի լինել,25,2018-02-23T20:12:55.000Z,108883,678,143,0,True
Кинокомпания «Русское»,30,17.25.11,▶️ Склифосовский 6 сезон (Склиф 6) - Выпуск 2 - За кадром,1,2017-11-24T12:00:03.000Z,6454,217,4,29,False
ДВИЖНОВ,30,18.12.01,СЕРГЕЙ СЕМЕНОВ ВЫШЕЛ ИЗ ТЮРЬМЫ. ЧТО ЖДЕТ ШУРЫГИНУ?,22,2018-01-10T13:45:25.000Z,1095560,20104,6137,3074,False
GOALNET,30,17.08.12,Кто НА САМОМ ДЕЛЕ заслужил ЗОЛОТОЙ МЯЧ?! Лучший футболист 2017 года это...,17,2017-12-07T17:41:59.000Z,73005,5469,519,962,False
MOUNT SHOW,30,17.15.11,Приключения Трампа и Медведева в Маниле. Доня и Димон - братья навек. MOUNT SHOW #118,23,2017-11-14T17:00:55.000Z,138119,16517,217,827,False
Палата 6,30,17.04.12,ТОП-6 САМЫХ ЗАЕДАЮЩИХ ПЕСЕН 2017,23,2017-12-03T15:08:29.000Z,67031,8174,341,1417,False
Данила Поперечный,30,17.25.11,🎙 Я ЗАБИЛ НА YOUTUBE?,23,2017-11-24T10:21:03.000Z,571809,52821,1836,1937,False
Шокирующие новости,30,17.18.11,Жена родила Андрею Малахова сына,25,2017-11-17T06:55:57.000Z,54767,368,30,34,False
КОТЫ ЮТУБЕРЫ,30,17.04.12,8 ЖУТКИХ ВЕЩЕЙ РАЗРЕШЕННЫХ В ПРОШЛОМ [Белый кот],24,2017-12-03T12:14:41.000Z,33738,2325,50,246,False
Дом 2 Новости с Микой,30,17.15.11,ДОМ 2 НОВОСТИ 15 ноября 2017 (Эфир 15.11.2017),22,2017-11-14T12:52:21.000Z,35871,133,27,27,False
ПОЛИТИКА ПЛЮС,30,17.18.11,Pocтиcлaв Ищeнкo - Paзгoвop Пyтинa c лидepaми ЛHP и ДHP: чтo зa этим кpoeтcя? (политика) 17.11.17 г.,22,2017-11-17T08:18:45.000Z,19426,262,19,75,False
Qewbite,30,17.19.11,НОВАЯ КОРОБКА MARVEL из США!,24,2017-11-18T17:04:18.000Z,85387,9226,87,872,False
Реакции стримеров,30,17.20.11,Даня Кашин смотрит: Lil peep - ГЕЛИК (prod. smokeasac),22,2017-11-19T18:00:29.000Z,16606,452,112,0,True
EugeneSagaz,30,17.21.11,ДЕТИШКИ НА ТОВАРНЯКЕ,20,2017-11-20T16:34:06.000Z,102921,7503,247,1328,False
BlackSerj Production / BSP Studio,30,17.15.11,"КЕННЕТ БРАНА, ДЖОННИ ДЕПП, ДЖУДИ ДЕНЧ, МИШЕЛЬ ПФАЙФФЕР, ДЖОШ ГАД [s22e06] | ШОУ ГРЭМА НОРТОНА",23,2017-11-14T14:31:13.000Z,21737,1638,9,133,False
Время-вперёд!,29,17.14.11,В России создан новый процессор. И не только (Время-вперёд! #267),25,2017-11-12T18:04:40.000Z,96057,7098,156,1682,False
Большой тест-драйв,29,17.14.11,ШЕСТЬДЕСЯТ РАЗ КУ!/INFINITI Q60/БОЛЬШОЙ ТЕСТ ДРАЙВ,2,2017-11-13T14:15:10.000Z,56044,1973,186,213,False
Ольга Шарий,29,18.20.03,Солнечное затмение Путина,25,2018-03-19T06:03:16.000Z,103109,12130,120,2288,False
Sen Anlat Karadeniz,29,18.26.01,Sen Anlat Karadeniz 1.Bölüm,24,2018-01-24T19:31:31.000Z,807356,15309,788,2118,False
Прыжки в воду,29,17.17.11,МАША МАЕВА ПРОТИВ ВЫШКИ | Прыжки в воду с огромной высоты,17,2017-11-16T14:00:02.000Z,138089,15896,94,758,False
Военное телевидение,29,17.18.11,"Русское оружие будущего: на море, на суше, в воздухе (17.11.2017)",27,2017-11-17T16:00:37.000Z,8178,80,12,11,False
ЛАРИН,29,17.19.11,ВИДЕООБРАЩЕНИЕ К ПАВЛУ ДУРОВУ (#пашавыручай),29,2017-11-18T10:41:08.000Z,276927,34416,1653,3741,False
Карина Таро,29,17.19.11,Онлайн гадание ЧТО ДУМАЕТ? ЧТО НА СЕРДЦЕ? ЧТО БУДЕТ? ЧЕГО ХОЧЕТ? ЧЕГО БОИТСЯ? ЧТО С НИМ?,22,2017-11-18T20:07:49.000Z,5217,380,15,58,False
Сергей Михеев,28,17.15.11,Сергей Михеев. Железная логика. Полный эфир Вести FM 13.11.17,25,2017-11-13T17:48:02.000Z,31327,787,30,125,False
НОВОСТИ HD,28,17.16.11,Утренние Новости РЕН ТВ 16.11.2017 Последний выпуск 16.11.17,25,2017-11-16T01:29:35.000Z,25636,71,57,18,False
oSporte TV,28,17.16.11,КТО КРУЧЕ | Мбаппе vs Дембеле,17,2017-11-15T17:00:00.000Z,113195,8021,203,1315,False
It's Mamix,28,17.23.12,ЮТУБ ПРИСЛАЛ МНЕ НЕОБЫЧНУЮ КНОПКУ С КОЛОЙ ВНУТРИ!,22,2017-12-22T14:37:05.000Z,414961,49730,2202,1556,False
vJOBivay,28,17.14.11,БОЛЕ ЧУДЕС / ЛЮТЫЙ КОКТЕЙЛЬ / 3 СЕРИЯ,24,2017-11-12T13:15:52.000Z,202600,10121,697,761,False
vogorode.pro,28,17.22.11,АКТИВНАЯ МУЛЬЧА КАК ПОВЫСИТЬ ПЛОДОРОДИЕ часть2,22,2017-11-21T13:30:00.000Z,6005,278,5,68,False
TV Center,28,17.19.11,Яков Кедми. Право знать!,29,2017-11-18T21:00:00.000Z,6678,253,13,65,False
StopXam,28,17.30.11,СтопХам - Мисс Ноябрь,2,2017-11-29T10:23:58.000Z,351127,15309,1402,2343,False
Super.kg,28,17.14.11,Улан Саляновду атайын буюртма менен өлтүрүшкөн деп ойлоп жатабыз дейт туугандары,22,2017-11-13T11:23:47.000Z,38937,138,38,106,False
ДальнобойTV,28,17.18.12,ВСЕРОССИЙСКАЯ ЗАБАСТОВКА ДАЛЬНОБОЙЩИКОВ.НЕТ ПЛАТОНУ!17.12.17,25,2017-12-17T18:01:05.000Z,3214,398,4,50,False
Black Horse,28,17.17.12,ПРАВДА vs ЛОЖЬ: ЭКЗАМЕН,23,2017-12-16T15:59:11.000Z,356699,22192,486,429,False
ПРИЯТНЫЙ ИЛЬДАР,28,17.28.11,5 ЛУЧШИХ КАНАЛОВ НА ЮТУБЕ,22,2017-11-27T15:56:39.000Z,301275,27712,943,5677,False
GlebaTV,28,17.14.11,"Американцы Слушают Русскую Музыку #36 MIYAGI, JAH KHALIB, КОРЖ, FACE, L'ONE, KIZARU, Т. Раут, VERSUS",24,2017-11-13T12:06:09.000Z,101081,4937,453,1140,False
ShovShuv,28,18.26.01,ШОШИЛИНЧ ХАБАР!ЎЗБЕКЛАРНИ ХУДОНИ ЎЗИ АСРАБ КОЛДИ.,24,2018-01-25T15:30:40.000Z,17121,93,10,35,False
Elli Di,28,17.26.11,Ночь в Доме Из Пленки НА ДЕРЕВЕ АЛИСА СЛЕДИТ ЗА МНОЙ 24 часа | Elli Di,24,2017-11-25T08:03:31.000Z,938470,38071,3108,8559,False
Денис Чужой,27,17.15.11,100-летие Революции | Класс народа,23,2017-11-14T09:35:19.000Z,36487,4580,108,338,False
Юлия Crazy Nails,27,17.18.11,Рисуем СИМВОЛ 2018 года/Новогодний пёсик на ноготках /Пришли мои любимые гель лаки,22,2017-11-17T07:00:01.000Z,16619,1980,13,91,False
ДНЕВНИК ХАЧА,27,17.15.11,Как живет Овечкин в США.  Сергей Полонский после тюрьмы.,22,2017-11-14T15:35:21.000Z,760233,44008,11827,5703,False
Новости Проекта,27,17.14.11,Дом 2 новости 14 ноября 2017 (14.11.2017) Раньше эфира,24,2017-11-13T16:39:19.000Z,5534,36,8,5,False
Хочу ПожратьTV,27,17.19.11,ЖЕСТЬ !!!!  4 ГОРШКА ОТВРАТИТЕЛЬНОЙ ЕДЫ / ОБЛЕВАЛИСЬ ВСЕ !!!,22,2017-11-18T19:54:50.000Z,38960,4321,1167,888,False
Андрей Тиртха,27,18.03.02,"Запретное устройство, для перемещения во времени и пространстве человек поделился секретом.",22,2018-02-02T23:28:28.000Z,3037,255,70,201,False
ШОУ ЛАКЕРА,27,17.22.11,СУПЕР ЛОНГШОТ ЧЕЛЛЕНДЖ vs. EVONEON | РЕВАНШ,22,2017-11-21T12:00:02.000Z,111641,6830,78,295,False
Неновости,27,17.25.11,Стыдный семейный танец и руки-базуки,25,2017-11-24T13:43:42.000Z,117702,10555,695,623,False
Адыл Акжол уулу,27,17.18.11,"Анжеликанын уф, уф дей бергени кимди чарчатты?",29,2017-11-17T11:46:44.000Z,7953,23,20,22,False
Follow Me,27,18.02.01,Настя уезжает НАВСЕГДА!!,22,2018-01-02T02:54:55.000Z,5154,582,24,176,False
LoveAliexpress,27,17.15.11,ALIEXPRESS УДАЧНЫЕ ЗАКАЗЫ,22,2017-11-14T08:45:01.000Z,28854,1617,30,94,False
Poleznoe TV,27,18.03.03,КОПЕЕЧНОЕ СУПЕР СРЕДСТВО КОТОРОЕ ОЧИСТИТ ЛЮБУЮ ПОВЕРХНОСТЬ,26,2018-03-03T04:00:01.000Z,1336,156,2,4,False
SOLO,27,17.24.11,ЖАНЫ КЫРГЫЗ КИНО 2017 / БАЖАРИКИ / КИНОКОМЕДИЯ / full HD,24,2017-11-23T05:40:59.000Z,64549,1002,90,297,False
Сыендук,26,17.21.12,"ВЫМЫШЛЕННАЯ ЕДА, КОТОРУЮ ХОЧЕТСЯ ПОПРОБОВАТЬ | Сыендук",24,2017-12-20T13:57:12.000Z,949178,78954,1663,5526,False
Alla Kovalchyk,26,17.16.11,ПЕЧЕНЬЕ ПЕРСИКИ,22,2017-11-15T14:19:09.000Z,11601,455,45,58,False
USARMENIA,26,17.07.12,MEXRAMIS 291,22,2017-12-06T16:32:01.000Z,28786,74,8,1,False
Druzhko Show,26,17.14.11,Биржа Мемов #29. Большой выпуск,22,2017-11-13T17:32:11.000Z,330043,43841,2244,2977,False
Аналитика и Политика,26,17.25.11,Пионтковский Ну что Путин  Все приехали,22,2017-11-24T18:21:40.000Z,19660,383,33,87,False
МЯЧ Production,26,17.29.11,Сколько зарабатывают футболисты Реала? | Эффект Бабла #1,17,2017-11-28T16:01:33.000Z,3310,368,2,74,False
Sergey KuvaevJP,26,17.08.12,Мана познакомила меня со своей девушкой? Начало истории Мидори,22,2017-12-08T04:59:57.000Z,20115,2121,115,377,False
Костя Павлов,26,17.23.11,Маленькая машина VS БОЛЬШАЯ на чем быстрей с Александр Муратаев,24,2017-11-22T11:40:22.000Z,365525,11709,1003,1210,False
Глас народа,26,18.08.01,✔ Новые производства России №5. Декабрь 2017,29,2018-01-07T10:26:45.000Z,8064,199,13,73,False
vlad pergler,26,17.16.11,Интервью Сергея Бобровского (15.11.17) после игры с «Монреаль Канадиенс»...,17,2017-11-15T07:00:06.000Z,5321,124,0,7,False
OffroadSPB,26,17.20.11,Уаз на 42 колёсах и порталах. Коваши целиком (часть 2),2,2017-11-19T10:54:42.000Z,98245,4340,102,280,False
RilShow,26,17.19.11,ПОДАРОК ЮТУБЕРУ! Как сделать подарочный набор YouTube! Мультик! Нубик Стив! Желейный медведь.,22,2017-11-18T06:19:07.000Z,64357,1972,73,307,False
EvgeniNEWS,26,17.18.11,"Недостроенная ТЭЦ в Крыму проблем с электроэнергией  не вызовет, Россия обеспечит Крым полностью.",25,2017-11-17T13:15:40.000Z,5437,90,20,54,False
"Знакомьтесь, Боб",26,17.17.11,Боб открывает магазин,1,2017-11-16T14:43:23.000Z,511595,39185,1723,4468,False
AlexGyver,26,17.24.11,Монитор железа ПК + автоматический реобас своими руками!,28,2017-11-23T14:45:34.000Z,71566,7889,126,761,False
Трудности Многодетной Семьи в Сибири,26,17.23.11,Все за столом\\Вася чистит снег\\Петюня очень серьёзный\\,22,2017-11-22T16:02:14.000Z,10947,491,57,186,False
Красная Линия,25,17.28.12,Почему Грудинин? (26.12.2017),25,2017-12-26T20:49:15.000Z,28598,750,64,644,False
Fantom,25,17.22.11,ОБЗОР ХХХ ФИЛЬМА УЖАСОВ | Fantom,1,2017-11-21T13:10:27.000Z,135323,14141,762,761,False
zona 71,25,18.26.01,Умерла ЗОЛУШКА - Людмила Сенчина,29,2018-01-25T11:11:30.000Z,18583,0,0,32,False
ДЕНИС ОПТИМИССТЕР,25,17.31.12,ХУДШИЙ ФИЛЬМ ПРО РОЖДЕСТВО GRUMPY CAT  [МУВИТОН],22,2017-12-30T13:21:51.000Z,22995,2694,139,173,False
LOUD SOUND,25,17.15.11,"Конец света, который ждали. Apocalypse by Alphard",2,2017-11-14T13:07:59.000Z,75970,4233,66,394,False
Авто Страсть,25,17.27.11,Новые Записи с Видеорегистратора за 26.11.2017 VIDEO № 782,2,2017-11-26T16:48:59.000Z,34485,1679,47,281,False
Milenia Кулинарные Pецепты,25,17.29.11,Быстрый Завтрак. Находка для Лентяев.ОЧЕНЬ ВКУСНО!,22,2017-11-29T03:13:51.000Z,4033,372,33,17,False
Константин Семин,25,17.19.11,Африканский вариант. Константин Сёмин «АгитПроп» 18.11.2017,22,2017-11-18T06:03:27.000Z,68392,3181,92,313,False
МУЗ-ТВ,25,17.14.11,«Новая Фабрика Звезд». Десятый отчетный концерт от 11 ноября 2017,10,2017-11-13T09:11:47.000Z,89293,881,91,577,False
"R G D NEWs - Новости, факты, события",25,18.10.03,"США резко поумнели, узнав о новом русском оружии",29,2018-03-09T13:52:38.000Z,103505,876,150,315,False
windy31,24,17.14.11,НЕ НУЖНО БЫЛО НАХОДИТЬ ЭТОТ ТЕЛЕФОН... - Simulacra,20,2017-11-12T16:48:51.000Z,261968,15171,300,3299,False
Meduza,24,17.21.11,Сборка Lego Technic в прямом эфире,26,2017-11-20T23:22:51.000Z,26975,666,43,8,False
РЕН ТВ. Новости,24,17.13.12,В Подмосковье изверг отрубил руки жене топором,25,2017-12-12T14:38:29.000Z,38757,137,109,306,False
Alexander Nevzorov,24,17.16.12,Паноптикум из студии Nevzorov.tv от 14.12.17,25,2017-12-14T17:36:05.000Z,42182,1088,132,178,False
Шамов Дмитрий,24,17.17.11,Япония VS Россия. ЯПОНСКИЕ ШКОЛЫ. В чем отличия и что нужно перенять. Проблемы образования,22,2017-11-16T08:17:45.000Z,50168,5948,140,1401,False
livecorner,24,18.24.01,"Астана, где это? Трамп технично перехитрил обиженного Назарбаева / Елбасы",25,2018-01-23T07:52:12.000Z,97922,283,154,419,False
D.K. Inc.,24,17.30.11,МИЛЛИОН ЛЮДЕЙ АККАПЕЛЬНО (Post Malone x 21 Savage– rockstar  cover),10,2017-11-29T10:00:00.000Z,717271,170110,2399,10461,False
Gena Miller,24,17.17.11,90 + РЕЙТИНГ | Я ЕГО ПОЙМАЛ !,20,2017-11-16T12:42:26.000Z,195118,15080,329,1158,False
Nasty Crown,24,18.21.04,ТИПЫ СЛАЙМЕРОВ,22,2018-04-20T16:16:29.000Z,26657,1692,96,405,False
Культас,24,17.16.11,ЛИГА СПРАВЕДЛИВОСТИ ВРОДЕ КАК ДАЖЕ НОРМ (почти),1,2017-11-15T14:32:00.000Z,54857,5030,328,293,False
Rozetked,24,17.21.11,Xiaomi Mi Band 2 vs «умные» часы,28,2017-11-20T18:54:11.000Z,85140,4388,412,547,False
ЮТУБ  ТРЕНДЫ,24,17.17.12,"УГАДАЙ ЮТУБЕРА ПО ПЕСНЕ / Даня Кашин, Хованский, Почему Марьяна Ро Мега-звезда?",24,2017-12-16T14:28:03.000Z,144439,19588,369,5682,False
YangiKulgu,24,17.17.11,Hojiboy Tojiboyev - Armiyada General ishlaydi lekin Ded va Denbil deganlari ishlamas ekan,23,2017-11-16T13:26:20.000Z,24824,251,20,12,False
DIPT,24,17.14.11,5 антиЛАЙФХАКОВ без которых жизнь невозможна!,22,2017-11-13T15:49:05.000Z,148974,5434,5247,1612,False
Это не Диалоги О Рыбалке,24,17.27.11,Рыбалка.Налим и снова мороз..26.11.2017г,26,2017-11-26T12:55:48.000Z,49021,3043,62,441,False
JaneFox,24,18.19.02,САМОЕ СМЕШНОЕ ВИДЕО В МИРЕ | ПОПРОБУЙ НЕ ЗАСМЕЯТЬСЯ С ВОДОЙ ВО РТУ ЧЕЛЛЕНДЖ,24,2018-02-18T17:54:10.000Z,106621,7499,237,728,False
КОМАНДА А,23,17.25.11,КУПИЛИ 2 МАШИНЫ НА КОМАНДУ А! Бэкстэйдж Свидания. Афоня Влюбился,22,2017-11-24T08:42:02.000Z,529722,38539,1304,2223,False
Angela Pearl,23,17.16.11,ОВЕН- ГОРОСКОП на ДЕКАБРЬ 🎄2017 года от Angela Pearl.,22,2017-11-15T13:11:36.000Z,17798,707,17,103,False
Голос країни,23,17.20.11,"Кристина Жуковская Ой ти, жаворонку – выбор вслепую – Голос. Дети 4 сезон",10,2017-11-19T19:56:31.000Z,47715,920,21,90,False
Движение,23,17.14.11,Вектор Движения №155 Разведка без боя,2,2017-11-13T11:46:52.000Z,63472,3969,231,425,False
101 Kыргызстан,23,17.14.12,НУРЛАН НАСИП УЙУНДО ЖАНА АЙЫЛДА ТОЙДО,22,2017-12-13T05:49:37.000Z,34426,217,27,74,False
Лена Алена,23,17.26.11,ДОМ-2 СВАДЬБА ЕВГЕНИЯ КУЗИНА И АЛЕКСАНДРЫ АРТЕМОВОЙ-Самые интересные видео и фото,22,2017-11-24T21:30:48.000Z,68606,365,191,76,False
Твой Футбол,23,18.04.01,"КОУТИНЬО УХОДИТ НЕ УХОДИТ В БАРСУ, РОНАЛДУ ВЕРНЁТСЯ В МАНЧЕСТЕР 10/1 | СВЕЖИЕ ТРАНСФЕРЫ ЗИМА 2018",17,2018-01-03T13:00:04.000Z,69751,3086,101,1418,False
Высокое Напряжение,23,17.18.11,Жириновский о разводе Джигарханяна с Цимбалюк!!!,25,2017-11-17T03:09:17.000Z,54951,248,35,65,False
serial,23,17.14.11,Ивановы Ивановы - 17 серия - комедийный сериал HD,24,2017-11-13T18:00:03.000Z,317094,6433,158,532,False
Я В ШОКЕ!,23,17.12.12,"ОН КУПИЛ СЕБЕ АВТОМОБИЛЬ И ОБНАРУЖИЛ ДЕФЕКТ В ДВЕРИ. УВИДЕВ, ЧТО НАХОДИТСЯ ВНУТРИ, МУЖИК ОСТОЛБЕНЕЛ!",27,2017-12-11T00:16:01.000Z,154355,976,134,176,False
Denis Igonin,23,17.18.11,11 ЛУЧШИХ ПРАНКОВ НАД БРАТУХАМИ И СЕСТРУХАМИ / ДЛЯ ШКОЛЫ / ШКОЛЬНЫЕ ЛАЙФХАКИ + КОНКУРС,19,2017-11-17T14:29:14.000Z,160184,5774,404,2562,False
Bilasizmi?,23,18.09.01,08.01.2018 Шавкат Мирзиёев Ҳафтанинг энг муҳим хабарлари Ўзбекистон Янгиликлар Хамма Курсин!,22,2018-01-08T06:22:56.000Z,73153,555,49,31,False
The Люди,23,17.15.12,"KIZARU: Пуля в горле застряла после выстрела / О выдвижении Путина, Собчак и ложках Кокаина",22,2017-12-14T21:28:26.000Z,103751,5943,655,816,False
Тихий Барин,23,17.21.12,"Российский сюр. Тихо шифером шурша, крыша едет...",25,2017-12-21T01:49:46.000Z,2992,505,3,138,False
OneTwo,23,17.25.11,"КОРОЧЕ ГОВОРЯ, Я В СССР",23,2017-11-24T12:00:02.000Z,519300,37666,1538,2951,False
Dobryak,23,17.20.11,Wolfenstein II: The New Colossus - МУЛЬТ ОБЗОР,1,2017-11-19T06:53:08.000Z,462375,41170,662,1876,False
Виндяй,23,17.14.11,ЗАСМЕЯЛСЯ - ПРОИГРАЛ - ПОПРОБУЙ НЕ ЗАСМЕЯТЬСЯ! ТЕСТ НА ПСИХИКУ НЕ ЗАСМЕЙСЯ ЧЕЛЛЕНДЖ,22,2017-11-12T17:47:09.000Z,539625,24904,3205,3803,False
Smetana TV,23,17.23.11,Парни пробуют ЭКОНОМИТЬ НА ОДЕЖДЕ ☑️,24,2017-11-22T13:20:21.000Z,140054,14570,76,635,False
TIP TOP TV,23,17.14.11,ИКЕА🎄 НОВЫЙ ГОД 2018❤ НОВИНКИ НОЯБРЬ IKEA❤ТИП ТОП ТВ,22,2017-11-13T09:57:27.000Z,14622,503,36,64,False
KTV,23,17.17.11,Непосредственно Каха -- ТРЕЙЛЕР 4 сезон 5 серия,23,2017-11-16T14:39:05.000Z,87165,3240,43,124,False
Постскриптум с Алексеем Пушковым,23,17.19.11,Постскриптум (18.02.2017),27,2017-11-18T13:22:05.000Z,132715,1376,170,644,False
Sergey Stilov,23,17.17.11,Учимся Дрифту. Слишком близко. #АльтезаЖиви,2,2017-11-16T22:33:38.000Z,30291,3603,48,449,False
True Gym,23,17.08.12,Емельяненко бьет только мешков / Бой Олейник vs Емельяненко,17,2017-12-07T11:35:37.000Z,70345,1464,122,280,False
EvRosTV,22,17.17.11,"ИНОСТРАНЦЫ СЛУШАЮТ РУССКУЮ МУЗЫКУ (FACE, KIZARU, OXXXYMIRON, MIYAGI, T-FEST, БАСТА)",24,2017-11-16T10:05:03.000Z,246253,10751,720,1148,False
Игорь Прокопенко,22,17.18.11,Самые шокирующие гипотезы с Игорем Прокопенко. Выпуск от 17.11.2017. Солнце вышло из-за ели!(HD),22,2017-11-17T11:14:48.000Z,11781,45,9,4,False
NewsamChannel,22,17.21.11,Սերգեյ Լավրովն այցելել է Ծիծեռնակաբերդ,25,2017-11-20T15:15:19.000Z,5079,0,0,0,True
ТЕМНАЯ СТОРОНА 2.0,22,18.08.01,ЛУЧШИЕ ПРИКОЛЫ 2018 Январь ржака до слез угар видео прикол - ПРИКОЛЮХА # 100,23,2018-01-07T13:00:04.000Z,21229,617,84,129,False
Чикен Карри,22,17.08.12,ЛИГА ПЛОХИХ ШУТОК #1 | L'One x Гудков,23,2017-12-07T07:00:01.000Z,164856,6567,2365,517,False
The Best Voices,22,17.30.11,Второе зрение 1-2 серия (2017) Детектив фильм сериал,10,2017-11-29T13:09:04.000Z,29938,64,27,9,False
Деревенская жизнь на хуторе. Дневник казачки.,22,17.18.11,ЖАРКОЕ  ПУПОЧКИ  в  ГОРШОЧКЕ,22,2017-11-17T13:48:44.000Z,3731,247,11,58,False
O'ZBEKCHA GAP,22,18.14.01,Бузилиб Кетган Кизини Улдириб Кумиб Ташлади,22,2018-01-13T07:35:42.000Z,136581,574,340,625,False
Mr. Moment,22,17.05.12,"Он жить-то будет? А то как же команде, да без талисмана. Мстители: Эра Альтрона. 2015.",1,2017-12-04T15:33:08.000Z,49011,1196,25,53,False
SPORT - LIFE (обзоры спортивных игр),22,17.19.11,Леганес - Барселона ОБЗОР МАТЧА HD.18.11.17.,22,2017-11-18T17:10:46.000Z,88300,986,50,131,False
LaLiga Santander,22,18.08.01,Resumen de RC Celta vs Real Madrid (2-2),17,2018-01-08T00:18:47.000Z,133607,1071,146,79,False
Гурам Нармания,22,17.30.11,ВАЛЕРИЯ feat FACE (Старые песни в новом исполнении),22,2017-11-29T13:42:09.000Z,31820,10031,297,907,False
КАЛЯН86,22,17.20.11,Запуск УАЗа после долгого простоя ) Ремонт ПЖД КАМАЗ .КАЛЯН86 ),22,2017-11-19T08:41:49.000Z,67743,2518,75,191,False
Андрей Тюняев,22,17.20.11,Конца света не будет: планета Нибиру - вымысел,22,2017-11-19T12:30:26.000Z,4844,170,3,36,False
Лучшее из Сети,22,17.19.11,Наташу Королеву назвали старухой и выгнали на пенсию!,24,2017-11-18T19:02:22.000Z,9614,37,10,8,False
Новий Канал,22,17.27.11,Топ-модель по-украински. Выпуск 13. 24.11.2017,24,2017-11-26T17:00:07.000Z,355259,6392,673,2432,False
BadComedian,22,17.11.12,[BadComedian] - Крым (#ФильмНаш),23,2017-12-10T08:45:06.000Z,2376157,285477,3847,28355,False
Телеканал 360,21,17.16.11,Воспитательница в Томской области пыталась насильно накормить ребенка,25,2017-11-14T11:17:59.000Z,57128,100,287,306,False
ПОТУСТОРОННИЕ,21,18.28.01,Вызов Духов - Вампир! Он Реальный! Вызов Вампира Потусторонние,22,2018-01-27T07:46:47.000Z,60371,4465,272,1380,False
ABRACADABRA TV,21,17.05.12,СЪЕЛ BLACK STAR BURGER - МЕГАБУРГЕР от ТИМАТИ за 5 МИНУТ,22,2017-12-04T12:14:12.000Z,61111,2810,851,1244,False
mosshow,21,18.22.01,Трагедия с внуком Аллы боль не унять #mosshow,1,2018-01-21T11:48:52.000Z,25767,0,0,14,False
BersReview,21,17.03.12,"Кукольный Дайджест #43: ПЕРВАЯ БАРБИ В ХИДЖАБЕ! Новое лицо Челси, новинки Monster High, Barbie,обзор",26,2017-12-01T23:14:02.000Z,419524,16231,287,2030,False
PastaTV - инстаграм вайны,21,17.29.11,"Новые Инста Вайны [Выпуск 35] Лев Шагинян, яжемать, Юфрейм, Абрамова Лилия, Андрей Глазунов",24,2017-11-28T11:34:28.000Z,4577,106,7,8,False
Secret TV,21,17.15.11,Загадки человечества. 85 выпуск (14.11.2017) HD,24,2017-11-14T15:18:54.000Z,7036,46,5,1,False
DANIK,21,17.16.12,"КОРОЧЕ ГОВОРЯ, ПОЛУЧИЛ ДВОЙКУ",23,2017-12-15T11:00:09.000Z,68511,2526,326,1138,False
PRO Hockey,21,18.04.02,"Columbus Blue Jackets vs New York Islanders – Feb. 03, 2018 | Game Highlights | NHL 2017/18 . Обзор",17,2018-02-04T04:44:34.000Z,935,17,1,3,False
Гражданская Оборона,21,17.26.12,📌НАВАЛЬНЫЙ: оглашение результатов заявления на участие в выборах! Прямая трансляция,25,2017-12-25T15:17:34.000Z,97394,2331,820,343,False
C Иринкой HD_TV,21,18.03.01,Новости утренние на 5/TV 02.01.2018 Выпуск 02.01.18,25,2018-01-02T04:27:12.000Z,46050,66,24,35,False
Fazilet Hanım ve Kızları,21,17.19.11,Fazilet Hanım ve Kızları 23. Bölüm,22,2017-11-18T21:06:25.000Z,232804,3022,254,1051,False
Лара Логинова-Таро,21,17.28.11,Как долго я тебя ждала.,27,2017-11-27T12:46:47.000Z,7486,428,23,270,False
Король ММА,21,17.15.11,18 Летний Русский Боец Продолжает Шокировать,17,2017-11-14T12:00:01.000Z,158234,0,0,434,False
Мартеллиада,21,17.27.11,Ультимативно не растерялся - [Бумага],23,2017-11-26T09:42:49.000Z,276587,31699,681,1605,False
ОЛЕЖЭ,21,18.14.02,|Как снимали| Ольга Бузова - Мало половин,23,2018-02-12T16:02:08.000Z,96328,5296,145,551,False
Москва 24,21,17.28.11,Церемония прощания с Хворостовским проходит в КЗ имени Чайковского в Москве,25,2017-11-27T08:51:21.000Z,23264,42,12,22,False
Евгений Кулик • Оfficial Сhannel,21,17.09.12,Артхаус Когда твоя девушка любит пазлы(#ЕвгенийКулик),23,2017-12-08T13:06:11.000Z,70242,4878,521,206,False
Новости СВЕРХДЕРЖАВЫ,21,18.12.01,Путина никто не поддержал,22,2018-01-11T14:11:49.000Z,69766,4932,275,1184,False
Лига Смеха,21,17.25.11,Звездный час - Финал Лиги Смеха от 24.11.2017,23,2017-11-24T20:11:51.000Z,216957,5102,451,1525,False
a1plusnews,21,18.17.04,16.04. Live,25,2018-04-16T19:16:51.000Z,176929,1061,68,0,False
Записи стримов Куплинова,21,18.15.03,"НА ТВИЧЕ СТРИМ, ТЫ ОПЯТЬ ОПОЗДАЕШЬ, ЕСЛИ НЕ ПОТОРОПИШЬСЯ",20,2018-03-14T14:39:01.000Z,33668,4848,24,450,False
Сергей Алексашенко,21,17.29.12,Подводим итоги,25,2017-12-29T01:30:45.000Z,6054,361,2,53,False
Александр Северный,21,18.01.01,✳️ ЧУБАЙСА ОБOКРAЛИ. ИЗ ДОМА ВЫНЕСЛИ 13 ТЕЛЕВИЗОРОВ И ... || Делягин | Грудинин Путин Медведев,22,2017-12-31T04:00:02.000Z,20055,267,80,171,False
РОЙ ТВ,20,17.26.11,"Кандидат национал патриотов – против «сирийского кандидата» (И.Стрелков, Ю.Болдырев, М.Калашников)",25,2017-11-24T15:55:06.000Z,42140,786,178,958,False
SupeR MasteR,20,17.14.11,Полнолуние 19-Серия! Лайк!,1,2017-11-13T06:10:47.000Z,56884,751,78,77,False
ТАБЛЕТКА для Памяти .,20,18.02.01,"КОММЕНТАРИИ ИНОСТРАНЦЕВ О РОССИИ, ПЕРЕВОД 37 ЧАСТЬ АМЕРИКАНЦЫ О РОССИИ Новогодний обзор",24,2017-12-31T16:12:51.000Z,55208,4961,91,369,False
Антон ЛАВ,20,17.04.12,ВЫИГРАЛ iPhone X в ПЕНАЛЬТИ CHALLENGE!?😱,24,2017-12-03T11:01:26.000Z,91606,4584,206,501,False
"Это Россия, детка",20,17.20.12,Живая Россия - Бионический глаз,22,2017-12-19T10:01:22.000Z,131843,5088,429,275,False
Новости РУ,20,17.16.11,КЕДМИ ЕВРОПА МАСКИ СОРВАНЫ! СЕНСАЦИОННЫЙ МАТЕРИАЛ 16 11 2017,22,2017-11-15T13:11:57.000Z,21367,100,16,45,False
TRT Televizyon,20,17.28.12,Diriliş Ertuğrul 101.Bölüm Fragmanı,1,2017-12-27T20:47:58.000Z,118762,694,18,0,True
О главном,20,18.31.01,Иностранцы не сдержались: «Русские испортили ОИ своим отсутствием»,25,2018-01-30T08:00:01.000Z,48173,402,30,145,False
Платье - терапия,20,17.03.12,Обзор ткани из интернет-магазина Измира,26,2017-12-02T14:59:58.000Z,8003,473,14,140,False
Фальшивый Критик,20,17.09.12,Треш Обзор Фильма Заклятие 2,1,2017-12-08T14:01:38.000Z,71275,6262,154,627,False
Woodmark,20,17.15.11,Обзор на плохое - Сериал Счастливы вместе,43,2017-11-14T16:04:18.000Z,45354,4567,262,1124,False
TerlKabot channel,20,17.01.12,ТРЕШ ОБЗОР фильма Особь [инопланетная нимфетка],1,2017-11-30T15:59:33.000Z,96307,15758,133,953,False
Кухня (сериал),20,17.16.11,Смотри новые серии финального сезона «Отеля Элеон» 17 ноября на START.ru,1,2017-11-15T15:00:08.000Z,47925,858,79,109,False
TheNafig,20,17.16.11,Игра трендов (Переозвучка) (спойлеры из сериала),23,2017-11-15T09:44:16.000Z,286234,32661,966,1616,False
Мастерская историй,20,17.18.11,СТРАШНЫЕ ИСТОРИИ - ТРИ СТРАШИЛКИ НА НОЧЬ [ДЕРЕВЕНСКИЕ ИСТОРИИ],22,2017-11-17T16:00:02.000Z,4697,363,9,31,False
VITDIV SHOW,20,18.04.03,НАБОР LIL PEEP / Лил Пип Awful Things BOX,22,2018-03-03T18:23:54.000Z,18354,1802,124,488,False
Штаб Коммандера,20,17.26.11,ЛУЧШЕ ЧЕМ ЭМОДЖИ МУВИ??? || ТАЙНА КОКО ОТ ПИКСАР,1,2017-11-25T12:09:31.000Z,70534,7270,178,422,False
Анекдоты от Алексеевича,20,17.22.11,Анекдот про дырку. Угар и юмор.,23,2017-11-21T14:14:03.000Z,67429,1454,101,70,False
ZO'R TV,20,17.12.12,The Cover Up (2-mavsum) 12-soni (Shoxrux),24,2017-12-11T12:16:18.000Z,62652,1543,84,385,False
YOUNG,20,18.12.02,"КОРОЧЕ ГОВОРЯ, 14 ФЕВРАЛЯ",23,2018-02-11T09:22:20.000Z,63411,5211,175,572,False
В ПЕРВЫЙ РАЗ,19,17.05.12,"Александр Ревва: Реакция на  Элджей & Feduk, Хлеб, АК-47, Клик Клак и Big Russian Boss",22,2017-12-04T11:51:08.000Z,61310,1249,378,141,False
Зуби МузЗайка,19,17.26.11,С Днём Матери! Красивое поздравление на праздник день матери ZOOBE Муз Зайка,22,2017-11-25T14:00:01.000Z,36467,665,63,37,False
UKRLIFE.TV,19,17.16.11,"Энрике Менендес: В Украине нет политических сил, защищающих интересы Донбасса",22,2017-11-15T12:14:50.000Z,4908,167,22,111,False
iling show,19,18.05.01,"BATON. Занизь УАЗ, или сдохни в попытках.",2,2018-01-04T10:06:45.000Z,62569,3372,291,367,False
Саранча,19,17.18.11,АШАН / Садитесь в тележку покатаю по Ашану :) 16.11.2017,22,2017-11-17T06:00:00.000Z,10726,259,80,56,False
ChebuRussiaTV,19,17.14.11,ЖЕСТКИЕ ПРЯТКИ В ОСОБНЯКЕ | СОБОЛЕВ И МУРАТАЕВ,29,2017-11-12T12:19:20.000Z,747459,94626,1737,1777,False
SNAIL MOMENTS,19,17.20.11,⭐ [SNAILKICK] СМОТРИТ ТРЕНДЫ 18.11.17,24,2017-11-18T18:44:14.000Z,13773,345,23,47,False
Звезды шоу-бизнес и Дом2 Мнения о доме2,19,17.06.12,Ольга Бузова не может купить квартиру и что её связывает с Лепсом. Последние новости шоу-бизнеса,22,2017-12-05T17:59:47.000Z,2798,43,3,3,False
Siyah İnci,19,17.17.11,Siyah İnci 8. Bölüm,22,2017-11-16T20:48:16.000Z,201587,2883,234,322,False
Alisa DIY,19,17.01.12,ЛИЗУН СВОИМИ РУКАМИ ПРОТИВ СЛАЙМ ИЗ МАГАЗИНА |НОВЫЙ РЕЦЕПТ ЛИЗУНА |КАНАЛ С ЛИЗУНАМИ |Alisa DIY slime,24,2017-11-30T14:23:17.000Z,78360,6459,318,3108,False
Соболев Илья,19,17.25.11,СОБОЛЕВ ИЛЬЯ - СОБОЛЕВ ИЛЬЯ ПРОТИВ НИКОЛАЯ СОБОЛЕВА,23,2017-11-24T07:58:13.000Z,60163,6229,768,583,False
ТИЛЭКС,19,17.24.12,"Элджей, KIZARU, Face, БАСТА, АК-47, ЛСП и другие переделывают POST MALONE - ROCKSTAR (ft. 21 Savage)",22,2017-12-23T11:39:10.000Z,177470,22119,2295,1087,False
Pressa kg,19,18.16.04,Сооронбай Жээнбековдун учакта жүргүнчүлөр менен бара жаткан тасмасы тарады,25,2018-04-14T19:46:47.000Z,98349,1641,49,364,False
ПОТРАЧЕНО,19,17.15.11,Сорвало башню | ПОТРАЧЕНО,23,2017-11-14T09:54:41.000Z,101191,3792,231,292,False
Пятое Измерение,19,17.30.11,Деньги могут приходить к вам легко,27,2017-11-29T17:15:22.000Z,9148,695,17,47,False
Azattyk,19,17.26.11,Отунбаева: Жээнбеков өз жолун тандашы керек,25,2017-11-25T09:18:07.000Z,53465,478,116,453,False
sotavision,19,17.24.12,Павел Грудинин ответил безумному единороссу,25,2017-12-23T15:39:34.000Z,85324,4553,92,1635,False
Stand-Up Club #1,19,17.18.11,Порараз Бирацца в Казани,23,2017-11-16T18:36:47.000Z,23585,1806,24,202,False
ВкусноПросто иПолезно,19,17.28.12,5 Самых Вкусных и НЕдорогих Салатов К Новому Году. Обалденные Салаты на Праздничный Стол,22,2017-12-27T05:17:36.000Z,46030,1195,48,29,False
Satyr,18,17.16.11,BIG RUSSIAN BOSS. ПАРОДИЯ #14,23,2017-11-15T16:53:03.000Z,327697,42684,2081,2732,False
Elli Di Pets,18,17.16.11,ИДУ К ПОДПИСЧИКАМ ОТДАЮ УЛИТКИ ОТ ЭЛЛИ | Elli Di Pets,15,2017-11-15T11:00:06.000Z,452895,23207,418,19231,False
Margarita Muradova,18,17.21.11,КАК ПОДОБРАТЬ ОБУВЬ ПОД ОДЕЖДУ ЗИМОЙ? ЧТО С ЧЕМ СОЧЕТАЕТСЯ?,26,2017-11-20T05:00:00.000Z,45500,2231,126,443,False
TOP NEWS: Новости шоу-бизнеса,18,17.10.12,"ЖИЗНЬ ЗВЕЗДНЫХ БЛИЗНЕЦОВ ЛИЗЫ И ГАРРИ ГАЛКИНЫХ: Распорядок дня, питание...",22,2017-12-09T13:31:12.000Z,17940,190,19,15,False
itpedia,18,17.12.12,МОЯ ЛУЧШАЯ ПОКУПКА - DJI Mavic PRO,28,2017-12-11T13:18:19.000Z,483246,54683,1475,3723,False
Svetoy Enot,18,18.05.01,Что ждет Путинскую систему в 2018 году,29,2018-01-05T03:00:01.000Z,2385,178,8,59,False
Denis МЕХАНИК,18,17.27.11,"Автомобильные ХИТРОСТИ, такие лайфхаки вы еще не знали!!",2,2017-11-26T06:13:58.000Z,77895,6623,178,222,False
Nastya Tyman,18,17.19.11,Массовое ДТП во Владивостоке выпал первый снег,2,2017-11-18T11:09:56.000Z,98398,3703,187,1187,False
Alena Pogrebnyak / RobinaHoodina,18,17.20.11,СТИЛЬНЫЕ УЖАСЫ + Мои кошмарные фото (часть 2),26,2017-11-19T22:31:04.000Z,22034,1499,139,266,False
Макс Брандт,18,17.15.11,"МАКС +100500 ОТКРЫЛ РЕСТОРАН / ЧЕСТНЫЙ ОБЗОР / СОРЯН, МАКСОН",24,2017-11-14T10:53:56.000Z,205319,10183,521,741,False
NHL,18,18.29.01,Nikita Kucherov scores No Shot goal to complete All-Star Game hat trick,17,2018-01-28T23:35:27.000Z,21094,604,8,75,False
Masha Zoom,18,18.22.02,ШАР LOL PETS И РАСКАЛЕННЫЙ НОЖ В 1000 ГРАДУСОВ ЭКСПЕРИМЕНТ УНИЧТОЖАЮ ШАР ЛОЛ ПЕТС LOL ПИТОМЦЫ,24,2018-02-21T12:00:03.000Z,25920,982,188,349,False
Про животных и не только!!!,18,18.04.01,"Он подъехал к кофейне и выпустил из машины собаку, делая вид, что не знает её!",19,2018-01-03T11:43:58.000Z,7297,299,9,28,False
Звездный Капитан,18,17.14.11,"Всё о гигантах из фильма Конг: Остров Черепа (виды, биология, способности)",24,2017-11-13T07:00:00.000Z,119602,7469,96,434,False
elena864,18,17.15.11,50 САМЫХ ПОПУЛЯРНЫХ ПОМАД MAC НА ГУБАХ + КОНКУРС,26,2017-11-14T14:06:50.000Z,33165,2871,93,229,False
GAZ,18,17.24.11,ТЕСТЫ ОХРАННИКОВ МИЛЛИАРДЕРОВ,24,2017-11-23T16:00:09.000Z,27375,721,69,37,False
THE MIR,18,17.26.12,Как Порошенко с Турчиновым на Рождество колядовали,25,2017-12-25T18:23:24.000Z,35900,1778,52,479,False
ДОМ В ДЕРЕВНЕ,18,17.07.12,Нашёл ТАЙНУЮ комнату! Даже бывший хозяин не знал о ней...,22,2017-12-06T10:40:32.000Z,42222,1062,78,299,False
ADINI SEN KOY ASK_ZEHOM_AİLESİ,18,17.25.11,Adını Sen Koy 226-227.bölüm fragmanı😲😲😲,22,2017-11-24T16:04:17.000Z,83775,565,14,120,False
RADIO TAPOK,18,17.09.12,Rammstein - Links 2 3 4 (Cover на русском | RADIO TAPOK | Кавер),10,2017-12-08T19:10:21.000Z,87605,17452,238,1450,False
SHOW NEWS,18,17.17.11,45-летний Малахов впервые стал отцом !,24,2017-11-16T23:11:13.000Z,23738,645,37,100,False
Top Five,18,17.14.11,10 СЛУЧАЕВ МОМЕНТАЛЬНОЙ КАРМЫ,24,2017-11-13T16:00:17.000Z,116081,8739,235,327,False
Zenit Football Club,18,17.21.11,Андрей Аршавин на «Зенит-ТВ»: «Золото-2007 стоит для меня на первом месте»,17,2017-11-20T08:37:26.000Z,21988,656,13,63,False
Хомки,18,17.04.12,Вечер наших хомячков. Пиратик пропал,15,2017-12-03T17:16:28.000Z,63226,3214,76,1684,False
ND Production,18,17.14.12,Пародия на MANS NOT HOT - BIG SHAQ (The Ting Go Skrra),10,2017-12-13T18:10:55.000Z,94594,10302,1501,588,False
Удивительные Факты,18,17.03.12,"Все, что произойдет до 2050 года",29,2017-12-02T08:01:13.000Z,133379,3604,264,555,False
AcademeG 2nd CH,18,17.23.11,Неожиданно прекрасный Лиссабон.,22,2017-11-22T17:54:50.000Z,88472,6881,632,531,False
Thoisoi,18,17.19.11,Ксенон - САМЫЙ ЯРКИЙ ГАЗ НА ЗЕМЛЕ!,27,2017-11-18T11:00:46.000Z,142024,9034,150,346,False
Ikotika,18,17.19.11,ТИЗЕР [Плохбастер Шоу] (feat. IKOTIKA) Звездные Войны: Скрытая Угроза,23,2017-11-18T11:03:32.000Z,17462,2437,56,172,False
News 7,18,17.02.12,"Три дня, девять километров – и Дания не у дел",25,2017-12-01T08:12:43.000Z,11258,115,3,21,False
Быть Или,18,17.08.12,Сравниваем МИЛЛИАРДЕРОВ РФ и США | Быть Или,29,2017-12-07T10:00:14.000Z,233220,53911,34484,18397,False
ТОПЛЕС,18,17.14.11,ЗАМОРОЗКА ЧЕЛОВЕКА + 1 К БЕССМЕРТИЮ — ТОПЛЕС,28,2017-11-12T17:19:59.000Z,1131851,78692,2427,4114,False
Zёбра,17,17.14.11,Многообещающий пистолет с интегрированным глушителем | Разрушительное ранчо | Перевод Zёбры,24,2017-11-13T06:49:42.000Z,129867,10906,70,526,False
HiMan,17,17.06.12,"СДЕЛАЛ АВТОМАТ ДЛЯ КОНФЕТ ( СКИТЛС, M&M's, ТИК ТАК, ФРУТЕЛЛА )",22,2017-12-05T14:10:33.000Z,550749,23465,686,3598,False
Ткачёв Проповеди Православие,17,17.15.11,ЗАЧЕМ всё ЭТО надо? Ткачёв Андрей,27,2017-11-14T08:35:44.000Z,10577,202,8,11,False
КиноТВ,17,18.17.04,"ПРЕМЬЕРА 2018 ВЫНЕСЛА ТРЕНДЫ - Симптом счастья / Русские мелодрамы 2018 новинки, фильмы 2018 HD",22,2018-04-16T14:36:08.000Z,77544,155,73,27,False
СТРЕКОЗА,17,17.16.11,Сын Спартака Мишулина предоставил доказательства родства.,29,2017-11-15T17:09:50.000Z,40753,153,29,58,False
Искусство харизмы,17,17.17.11,"5 Способов Быть Уверенным, Настойчивым и Энергичным",22,2017-11-16T15:00:00.000Z,20432,1637,83,130,False
STAVR,17,17.14.11,КТО СТАНЕТ ЧЕМПИОНОМ РОССИИ?,17,2017-11-13T15:00:02.000Z,132772,12053,262,873,False
Фонд Концептуальных Технологий,17,17.23.11,Вопрос-Ответ Пякин В. В. от 20 ноября 2017 г.,25,2017-11-21T15:22:37.000Z,53646,1071,25,276,False
PRO Hi-Tech,17,17.09.12,"Titan V вышел, теперь ждем GeForce Volta / Ampere",28,2017-12-08T17:37:40.000Z,38713,3858,48,461,False
Show TV,17,18.14.01,Çukur 12.Bölüm 2.Fragman,1,2018-01-13T17:35:10.000Z,114300,1070,45,121,False
Nik V.,17,18.21.02,Вот это песня!!! Послушайте!!!,10,2018-02-21T02:51:38.000Z,5065,316,10,22,False
NewsOne,17,17.16.11,Джангиров: контролируемые США антикоррупционные органы – это кнут для туземных элит 15.11.17,25,2017-11-15T15:52:46.000Z,6788,274,8,100,False
/ zaRRubin \,17,17.14.11,AUDI RS4 ИЛИ RS6? #ОДЕРЖИМЫЕ,2,2017-11-13T16:19:13.000Z,100674,8969,134,565,False
TRUE,17,17.25.11,Навальный про радиоактивное облако над Россией и молчание властей про это,23,2017-11-23T19:01:15.000Z,81123,3945,3144,759,False
Dalbek,17,18.14.01,Все грехи и ляпы аниме Тетрадь смерти (часть 3 из 7),1,2018-01-13T13:26:51.000Z,12187,1341,17,189,False
zasuverenitet,17,17.17.11,Закон о СМИ-иностранных агентах. Путин извинился перед народом? Евгений Федоров 15.11.17,29,2017-11-16T15:58:54.000Z,5464,212,14,209,False
#SLOVOSPB PRODUCTION,17,17.14.11,РВАТЬ НА БИТАХ - 495 SQUAD Х CODEKIEV (МЛЕЧНЫЙ / ВАРАБ Х GIGA1 / MARUL),24,2017-11-12T11:59:47.000Z,540442,31477,1668,3522,False
Домовой TV,17,18.16.03,"🔴Мужчина увидел кота на заборе, подойдя поближе он ужаснулся!",15,2018-03-15T06:59:57.000Z,29286,936,14,102,False
1.1TV,17,17.24.12,Эл Эмне Дейт? \ 3 сезон \ 1 ВЫПУСК,23,2017-12-23T15:00:03.000Z,59669,2232,64,433,False
Eurovision Song Contest,17,18.12.03,Julia Samoylova - I Won't Break - Russia - Official Music Video - Eurovision 2018,24,2018-03-11T19:35:37.000Z,166631,4663,4307,2522,False
ddKaba,17,17.17.11,Где живет Леонидыч? Едем за тюнячкой.,17,2017-11-16T22:02:55.000Z,25819,3381,37,1212,False
ЭфайШоу,17,18.18.04,ДОЧЬ МИЛЛИОНЕРА ОТКАЗАЛА ВЫХОДИТЬ ЗА БЕДНЯКА. И ВОТ ЧТО ОН СДЕЛАЛ!..,24,2018-04-17T12:09:12.000Z,31085,2113,56,78,False
VSRAP,17,18.03.02,BOOKER x MOZEE MONTANA - КАЖДЫЙ ДЕНЬ [Prod. by Cloudlight x Xvbirow],24,2018-02-02T12:00:03.000Z,135125,7959,1852,558,False
SportObzor HD,17,17.15.11,POCCИЯ - ИCПAHИЯ. ПОДРОБНЫЙ OБ3OP MATЧA. 14.11.2017 (HD),17,2017-11-14T20:51:07.000Z,233336,1546,182,551,False
Afinka DIY,17,17.18.11,5 очень быстрых и простых рецептов печенья / Проверяю рецепты из интернета / Фудхаки 🐞 Afinka,26,2017-11-17T13:01:13.000Z,313512,35070,378,2725,False
Ксюша Лебедева,17,17.15.11,ВСЕ О МОИХ ЕЛОЧКАХ!!!( 2 часть))Декор на НГ! На Рождество!,22,2017-11-14T12:47:30.000Z,6283,444,7,71,False
Екатерина Шульман,17,17.22.11,Проект закона о конституционном собрании и предвыборная турбулентность,22,2017-11-21T00:07:31.000Z,36055,1600,50,247,False
ХЛЕБ,17,17.18.11,ХЛЕБ - Плачу на техно,10,2017-11-17T18:19:20.000Z,424052,45855,2023,2124,False
TUMAN KG,17,18.28.04,"АСЕЛЬ КАЙНЕНЕСИН КОРУП,НУРЛАН МЕНЕН МОЩНЫЙ БИЙЛЕДИ,ОТО КЫЗЫДЫ",22,2018-04-27T16:03:12.000Z,145951,1592,171,337,False
Ваш Первый Канал,17,17.23.11,СРОЧНЫЕ НОВОСТИ! Умер Дмитрий Хворостовский! Подробности смерти!,25,2017-11-22T08:51:08.000Z,24323,122,15,72,False
Русские в Германии Germany live-tv,17,18.29.01,🔴СМОТРЕТЬ ВСЕМ ! Путин поставил в тупик Международный олимпийский комитет !,25,2018-01-28T07:00:01.000Z,92782,1176,402,411,False
Denis Rem,17,17.16.11,Обзор нового Audi RS5 2017,2,2017-11-15T15:44:03.000Z,128421,5977,269,458,False
VSRAP Digest,17,17.14.11,ATL —  ЛЮБИМЫЙ РЭПЕР ТВОИХ ЛЮБИМЫХ РЭПЕРОВ #vsrap,10,2017-11-13T17:30:44.000Z,78074,6005,156,390,False
Инстаграм Лучшее,17,18.09.02,Инстаграм Вайны Новинки [Выпуск 287] Подборка Вайны Недели,23,2018-02-09T06:22:32.000Z,1987,263,6,27,False
Jove,17,17.27.12,КРОВЬ ИЗ УШЕЙ? ● Новая музыка World Of Tanks!,20,2017-12-26T17:02:46.000Z,147126,9699,1329,1658,False
MARVEL Россия,16,17.30.11,Мстители: Война бесконечности – тизер-трейлер,24,2017-11-29T13:26:52.000Z,2538435,109010,2028,12998,False
Umeloe TV,16,17.23.11,"Я Такого Не Ожидал! Удивительно, на что способна Вафельница!",26,2017-11-22T13:59:35.000Z,63974,3409,85,250,False
ЕГОР,16,17.27.11,ТАЙНА ЗАСТОЯ YOUTUBE feat. ANOIR,23,2017-11-26T16:08:41.000Z,98226,18191,276,1109,False
1) Алексей Земсков (zems.pro),16,18.06.01,САМЫЕ ТУПЫЕ РЕШЕНИЯ В РЕМОНТЕ 2003-2018,27,2018-01-05T19:13:42.000Z,55451,3707,470,392,False
МАКСИМ ФАДЕЕВ,16,17.18.11,SEREBRO  - SECRET (Новая Эра. Тизер нового состава),10,2017-11-17T09:00:55.000Z,248180,5677,476,423,False
ДЗЕРЖИНСКИЙ,16,17.12.12,УБОГИЙ КЛИП МАРЬЯНА РО - МЕГА-ЗВЕЗДА [ОБЗОР И РЕАКЦИЯ] \ УКУСИЛ FACE?,24,2017-12-11T19:23:31.000Z,50070,4107,636,500,False
TheRelizzz / STUDIO,16,18.07.05,"Незнакомец СКАЗАЛ 8-летней девочке, чтобы она пошла с ним. Ответ малышки спас ей жизнь #TheRelizzz",29,2018-05-06T11:00:00.000Z,24258,228,16,5,False
Den Schmalz,16,17.27.11,Трусики - МЕЖДУ НОГ (НОВЫЙ КЛИП) prod. by ProoVY,10,2017-11-26T15:00:03.000Z,21960,2773,383,289,False
oxxxymironofficial,16,17.16.11,OXXXYMIRON - ОЛИМПИЙСКИЙ TEASER by ALT PAX,10,2017-11-16T05:41:13.000Z,39654,4350,60,216,False
ВПИСКА,16,17.05.12,"Вписка и Жак Энтони: конфликт с Boulevard Depo, клип за 2 миллиона, кто его настоящий отец",22,2017-12-04T08:00:10.000Z,110573,6044,251,950,False
О Главном TV,16,18.08.01,Гадание на картах. О КОМ ОН ДУМАЕТ СЕЙЧАС♤♡◇♧,26,2018-01-07T14:19:21.000Z,6957,206,14,25,False
Alan Enileev,16,17.02.12,ВСТРЕЧА С ЛЕГЕНДОЙ – КЕН БЛОК И ЕГО FORD FIESTA! GYMKHANA В АФРИКЕ. ПРОЕЗД С TERRY GRANT. KEN BLOCK.,2,2017-12-01T07:12:13.000Z,91216,2748,172,131,False
РИА Новости,16,17.11.12,Две гробницы возрастом около 3500 лет были найдены в городе Луксор (Египет),29,2017-12-10T11:19:31.000Z,4636,18,2,2,False
Ник Черников,16,17.17.12,RAVANNA - Всего Лишь Сон (OFFICIAL VIDEO),24,2017-12-16T15:57:39.000Z,286541,14478,2312,1200,False
Дмитрий ПОТАПЕНКО,16,17.20.11,Дмитрий ПОТАПЕНКО - Новости недели: У государства нет денег на пенсии?!,29,2017-11-19T06:00:01.000Z,83368,5523,91,726,False
TaLaNT TV SaGyNbAeV,16,18.04.04,Атамбаев сен бүттүң эми кет жогол| ЭРКЕКЧЕ СҮЙЛӨДҮ| Акыркы кабарлар 03.04.18,22,2018-04-03T10:15:13.000Z,122683,2179,199,594,False
Русское Кино,16,17.03.12,"ЭТОТ ФИЛЬМ СТОИТ УВИДЕТЬ! Сестренка (2017) Русские мелодрамы, новинки",1,2017-12-02T16:00:56.000Z,69157,162,47,15,False
Территория Непознанного,16,17.02.12,У моряков волосы зашевелились на голове.НЛО.Призраки моря.Документальный,22,2017-12-01T19:06:56.000Z,20152,93,19,6,False
Биржа Мемов,16,17.26.12,Новогодняя Биржа Мемов: Вассерман. Агния Огонёк. Дискотека Авария.,22,2017-12-25T18:01:41.000Z,62658,12204,393,910,False
Anastasiya Shuchalina,16,17.20.11,"Таро-Прогноз с 20-30 ноября 2017г. Карьера, отношения, здоровье! Таролог Наталья Качанова",1,2017-11-19T10:32:08.000Z,5626,237,20,19,False
Время Футбола,16,17.06.12,БАРСЕЛОНА - СПОРТИНГ | ОБЗОР МАТЧА | ЛУЧШИЕ МОМЕНТЫ 5.12.17,17,2017-12-05T22:07:27.000Z,21469,142,10,13,False
А ты знал?,16,18.13.02,"Основные ПРАВИЛА по выращиванию рассады,  главные ОШИБКИ",22,2018-02-12T12:21:07.000Z,4643,480,10,2,False
МАРМАЖ,16,17.27.12,МАРМАЖ: ГЕНИЙ МАТЕМАТИКИ,1,2017-12-26T20:38:49.000Z,39383,6296,37,331,False
Acunn.com,16,18.29.04,"Acun Ilıcalı, Turabi'nin cezasını açıkladı! | 57. Bölüm | Survivor 2018",24,2018-04-28T21:19:30.000Z,622250,7026,2053,3686,False
Царьград ТВ,16,17.02.12,Правда Делягина №10. На вопросы отвечает доктор экономических наук Михаил Делягин,25,2017-12-01T18:13:54.000Z,2728,232,13,43,False
Ольга Папсуева,16,18.14.01,"КАК НАКРЫТЬ ШИКАРНЫЙ СТОЛ ЗА 5 МИНУТ, КОГДА ГОСТИ НА ПОРОГЕ",22,2018-01-13T16:17:18.000Z,6541,352,22,36,False
Реакции Братишкина,16,18.12.03,Братишкин смотрит: Трум Трум -10 пранков и лайфхаков для школы / Как пронести гаджеты в школу,22,2018-03-11T16:57:46.000Z,45894,1189,80,236,False
60 минут,16,17.29.11,60 минут. Киев действует втайне от ОБСЕ: кого коснется закон О прощении? От 27.11.17,25,2017-11-27T17:57:09.000Z,60840,420,142,551,False
BlackStarTV,16,17.02.12,"L'ONE feat. Nel - Хоккеисты (премьера клипа, 2017)",10,2017-12-01T08:00:22.000Z,200053,9400,5049,1019,False
ТВ Таджикистан,16,17.21.11,Ахбори ВКД - Сипар (20.11.2017),25,2017-11-20T14:54:53.000Z,40123,199,53,21,False
Fedor Comix,16,17.25.12,"Рик и Морти - ЗАСТАВКА, ПОЛНАЯ ВЕРСИЯ (Мульт-Коллаб)",1,2017-12-24T15:55:04.000Z,147932,25379,401,2778,False
Алексей Знаков,16,17.24.11,НИКОГДА Не Делай ЭТО в Соцсетях! (Если Не Хочешь Проблем),22,2017-11-23T10:31:51.000Z,224336,12080,738,930,False
История Леонида Млечина,16,18.23.01,Банионис и КГБ. В кино и в жизни,22,2018-01-22T17:08:40.000Z,5756,371,6,23,False
ROBIN,16,17.22.11,"Экспресс Сегодня № 342, Дальше смотрите № 343",22,2017-11-21T13:29:43.000Z,4417,449,3,21,False
ДНЕВНИК ЕВРЕЯ,16,18.20.03,БОМЖ ОБЕД ЗА 8 РУБЛЕЙ САМЫЙ ДЕШЁВЫЙ ОБЕД В РОССИИ И НА YouTube,22,2018-03-19T12:56:46.000Z,51334,3429,205,1063,False
Morana Battory,16,17.18.11,Я попала в ролик к Соболеву / Ответка Коле Соболеву [некто не пришел на фан встречу],23,2017-11-17T20:16:14.000Z,36281,5237,1188,993,False
140 BPM BATTLE,16,17.04.12,140 BPM BATTLE: EDIK_KINGSTA X ISLA DE MUERTA,10,2017-12-03T13:39:44.000Z,242119,18941,1401,3978,False
Виталий Орехов,16,17.18.11,АВТОРАЗБОРКИ let's play,22,2017-11-17T15:05:55.000Z,180668,17901,1495,1282,False
TJ,15,17.28.12,Ахбори Точикистон(27.12.2017)Москва: Иштироки Э.Рахмон дар чаласаи ИДМ,25,2017-12-27T13:22:44.000Z,41196,271,68,63,False
Jane Rog,15,17.19.11,ВАМ ПОНРАВИТСЯ! ~ КРУТАЯ СУББОТА ♥ Моя неделя,22,2017-11-18T09:00:02.000Z,15069,1100,5,159,False
NataLime,15,17.30.11,Нормальные Люди VS Я ДВА ТИПА ЛЮДЕЙ Нормальные и Я,22,2017-11-29T13:13:49.000Z,175649,10610,203,12080,False
РУСЬ ПРАВОСЛАВНАЯ,15,17.12.12,КОСМИЧЕСКАЯ НЕМОЩЬ РУССКИХ РАКЕТ | космодром восточный неудачный запуск ракеты россии 19 спутников,25,2017-12-11T20:25:30.000Z,4716,293,9,42,False
А поговорить?,15,17.30.12,"Тина Канделаки о Дуде, Млечном, Собчак и как управлять сотней мужчин // А поговорить?..",22,2017-12-29T13:00:04.000Z,38952,761,179,188,False
HeyHelen ASMR,15,18.26.03,[RU/ENG] Праздничный стрим с котиками АСМР,22,2018-03-25T22:08:15.000Z,13066,564,21,5,False
FUT MAGAZINE,15,18.05.01,"РОНАЛДУ ПОЛУЧИЛ ТРИ ЗАПРОСА НА ТРАНСФЕР, ЛИВЕРПУЛЬ СУДИТСЯ С NIKE, ЛЕМАР ЗАМЕНИТ КОУТИНЬО!",17,2018-01-04T14:37:35.000Z,46978,1703,56,1507,False
LOBODA,15,17.04.12,LOBODA - Парень [AUDIO],10,2017-12-03T07:02:59.000Z,166188,4416,1165,322,False
FailArmy,15,17.17.11,A Boatload of Fails: Throwback Fails (November 2017) | FailArmy,23,2017-11-16T14:30:01.000Z,736556,14610,852,708,False
Короче Говоря,15,18.16.03,Кто популярнее Грудинин или Путин ?  За 3 дня до выборов Рейтинги кандидатов. Выборы президента 2018,22,2018-03-15T14:10:26.000Z,54417,0,0,1147,False
Дастархан - вкусные рецепты,15,18.09.02,ПАХЛАВА БЕЗ ЗАМОРОЧЕК ☆ Очень простой рецепт ☆ Быстрая пахлава ☆ Ленивая пахлава ☆ Турецкая пахлава,26,2018-02-09T05:54:16.000Z,3969,726,2,58,False
Alexander Polulyakh,15,17.14.11,Это устройство точно пригодится в домашнем хозяйстве(Хайджек),28,2017-11-13T13:48:13.000Z,148595,7504,450,665,False
АлоЯ Вера,15,18.13.03,ПРИЗРАК В МОЕМ ДОМЕ ЖУТКАЯ РЕАКЦИЯ КОШКИ МИСТИКА | АлоЯ Вера,24,2018-03-12T11:34:39.000Z,93659,4078,168,2933,False
Склад Чайки,15,17.19.11,Склад Чайки №87: Интервью с Полонским. Продолжение.,22,2017-11-18T19:45:28.000Z,100519,5134,3455,692,False
Татьяна Рева,15,17.25.11,НОВИНКИ в моей косметичке✦Парфюм и косметика+КОНКУРС! ТАТЬЯНА РЕВА,26,2017-11-24T10:44:52.000Z,8883,504,15,83,False
ZAMONA UZ tv,15,17.14.11,ХАЖДАГИ ИЛОН ВОКЕАСИ таъсирли ривоят,22,2017-11-13T17:07:00.000Z,14915,603,6,21,False
Абрам TV,15,18.31.01,Toyota Mark 2 АВТОХЛАМ или все ОК?!! Ремонт Тойота Марк 2!,2,2018-01-30T12:00:00.000Z,50430,2938,135,462,False
ЮМОР ICTV - Официальный канал,15,18.25.04,Как пара собирается на пикник – Дизель Шоу | ЮМОР ICTV,23,2018-04-24T09:36:16.000Z,16639,215,9,12,False
SNAILKICK,15,17.28.11,#ГОЛОВНЫЕМЮСЛИ: Про синтол и iPhone X,22,2017-11-27T13:53:04.000Z,575183,59096,1646,3649,False
Anton S,15,17.29.11,МУКБАНГ! Лосось и креветки. Как уехать в Норвегию? И зачем это вам надо?,22,2017-11-28T10:01:51.000Z,21994,1610,35,555,False
Чудо техники,15,17.23.12,Быстрый обзор | Samsung Galaxy A8 и A8+,28,2017-12-22T14:48:57.000Z,76784,4271,229,569,False
BORYMAN TV,15,18.20.01,НЕ ПРИХОДИ ЗАВТРА В ШКОЛУ - БУДЕТ МЯСО! ПОДРОСТКИ УСТРОИЛИ БОЙНЮ В ШКОЛЕ УЛАН-УДЭ!,24,2018-01-19T10:30:28.000Z,12189,441,19,124,False
HYPE CAMP,15,17.20.11,"HYPE CAMP // ИГРА НА ВЫБЫВАНИЕ #3 // Катя Клэп, ЯнГо, Anny May, Артем К, Даня Комков",22,2017-11-19T11:00:02.000Z,444399,19415,6477,4881,False
ItsMyNail_дизайн ногтей,15,17.16.11,❄ ЗИМНЯЯ ВИШНЯ на ногтях ❄ ЗИМНИЙ дизайн ногтей ❄ Дизайн ногтей гель лаком ❄ Nail Design Shellac ❄,22,2017-11-15T15:44:45.000Z,5453,990,5,23,False
Cennet'in Gözyaşları,15,17.27.11,Özlem'den Cengiz'e tehdit! - Cennet'in Gözyaşları 10. Bölüm,24,2017-11-26T19:06:12.000Z,13914,95,2,5,False
sonar2050.org,15,17.25.12,Кто загнал Украину в ловушку?,28,2017-12-24T17:25:22.000Z,93282,1533,149,587,False
Vilsa777,15,17.16.11,Таро-прогноз по кармическим кодам на ДЕКАБРЬ-2017 со ВСТУПЛЕНИЕМ,22,2017-11-15T09:55:39.000Z,8419,553,26,61,False
Рассмеши Комика - Официальный Канал,15,17.19.11,Новый Рассмеши Комика 2017 - 14 сезон - выпуск #11,23,2017-11-18T17:30:03.000Z,52810,544,48,77,False
PavlikPavlik,15,17.15.12,Я СЛЕЖУ ЗА ТОБОЙ ПРАНК / ПОДПИСЧИК МАНЬЯК СЛИЛ СЕКРЕТНЫЕ ФОТО АНАНАСТЕНЬКИ / СКОРЕЕ СМОТРИТЕ ИХ,24,2017-12-14T17:29:26.000Z,75591,6234,150,3363,False
Virtus.pro,15,17.28.11,"Solo about #ANTIHYPE, meeting Snax and playing against teammates",20,2017-11-27T10:34:22.000Z,52985,1775,13,87,False
Alina Charova,15,18.06.02,КАК КРАСИВО ПОЛУЧАТЬСЯ НА СЕЛФИ | ЛАЙФХАКИ МОДЕЛЕЙ ДЛЯ ФОТО,22,2018-02-05T17:24:44.000Z,14962,1267,39,108,False
The Voice Kids Russia/Голос Дети,15,18.01.02,Интервью с Наставником. Пелагея - Голос.Дети - Сезон 5,24,2018-01-31T11:06:04.000Z,8741,404,7,65,False
КРИМИНАЛЬНАЯ РОССИЯ,15,18.02.01,ПУТИН ОПОЗОРИЛСЯ НА НОВЫЙ ГОД,23,2018-01-01T21:01:53.000Z,74003,1066,637,470,False
Владимир Бучко,15,18.15.01,Паника в Кремле. Свержение режима Путина?,25,2018-01-14T15:34:59.000Z,94826,2617,2012,518,False
Смотрим TV с Брагиной,15,18.15.01,ДОМ 2 закрывается?,22,2018-01-14T13:27:39.000Z,9875,72,16,23,False
NHL.COM/RU,15,18.04.02,КОЛАМБУС БЛЮ ДЖЕКЕТС - НЬЮ ЙОРК АЙЛЕНДЕРЗ,17,2018-02-04T04:44:20.000Z,944,21,2,4,False
Духовный Маяк,15,17.17.11,Протоиерей Владимир Головин. Ответы на вопросы от 11.11.2017 г.,22,2017-11-16T13:58:21.000Z,5334,237,7,3,False
shok.uz,15,17.08.12,Дилноза Кубаева ва Озодбек Назарбеков ўртасидаги мухаббат ростми?,24,2017-12-07T14:34:43.000Z,33945,437,43,197,False
Nickelodeon Россия,15,17.18.11,Черепашки-ниндзя | 1 сезон 11 серия | Nickelodeon Россия,24,2017-11-17T16:00:04.000Z,84883,1254,73,190,False
DSC OFF,15,18.05.03,Баста ненавидит BMW? Мотор и подвеска на 600+ л.с. Волгу,24,2018-03-05T06:57:25.000Z,31951,3602,173,543,False
мой канал,15,17.18.11,"Алина Загитова. Гран при Франции, КП",22,2017-11-17T14:48:17.000Z,28746,228,30,119,False
Иван Kilin 125rus,15,18.21.02,"Авторынок2018, обвал цен, новый привоз, что творится?",2,2018-02-20T09:11:47.000Z,79662,2056,137,584,False
Anny Magic,15,17.31.12,Я РОЖУ РЕБЕНКА или УСЫНОВЛЮ в НОВОМ ГОДУ ВОПРОС ОТВЕТ Anny Magic,24,2017-12-30T10:50:47.000Z,386878,35255,623,12907,False
Merjvac Merjvac,15,17.28.11,Merjvace 407 anons 11 29 17/Մերժվածը 407 անոնս հայերեն/мержвац 407 индийский,22,2017-11-27T19:26:53.000Z,47147,219,11,17,False
İstanbullu Gelin,15,17.25.11,Istanbullu Gelin 26. Bölüm,22,2017-11-24T20:46:09.000Z,264341,2779,258,501,False
Limfina,14,17.23.11,ОБНОВЛЕНИЕ БАЗОВОГО ГАРДЕРОБА | Новинки ОДЕЖДЫ из ФРАНЦИИ,26,2017-11-22T12:07:09.000Z,23904,1102,57,136,False
Pro-Service Live,14,17.25.12,Шумоизоляция и сюрприз в багажнике LADA Vesta SW Cross. Ободрали Audi S5 Олега Бородатая езда!,22,2017-12-24T08:34:27.000Z,117629,4233,431,279,False
Маринкины Творинки,14,17.20.12,"Салат , как винегрет",26,2017-12-20T00:00:03.000Z,4111,441,8,26,False
Бородатая Езда,14,17.21.11,Пытаюсь УТОПИТЬ свой новенький УАЗ,2,2017-11-20T08:25:12.000Z,221078,8033,3248,951,False
Глеб Волин,14,17.11.12,Россия будет банкротить МОК,25,2017-12-10T07:08:49.000Z,77333,549,129,302,False
Сегодня вечером,14,17.20.11,Сегодня вечером. Памяти Эльдара Рязанова. Выпуск от 18.11.2017,24,2017-11-19T00:30:01.000Z,35580,157,25,122,False
Sayyod. Com,14,17.26.11,Муниса Ризаева 2017 концертидан реп+интервью,25,2017-11-24T22:11:49.000Z,56060,0,0,181,False
AndreY WolF,14,17.25.11,"Голос. 6 сезон, 13 выпуск. (24.11.2017)",22,2017-11-24T13:50:04.000Z,7199,69,10,14,False
АКАДЕМИЯ СМЕХА,14,17.17.11,ЛУЧШИЕ ПРИКОЛЫ 2017 НОЯБРЬ #51 | Лучшая Подборка Приколов | ТОПОВЫЕ ПРИКОЛЫ,23,2017-11-16T15:43:58.000Z,110539,4891,395,950,False
Food for thought,14,18.06.01,"APECT П0P0ШEHK0 И ГP0ЙCMAHA, УKP@ИHA БУHTУET - ЕВГЕНИЙ МУРАЕВ 05.01.2018",29,2018-01-05T10:47:47.000Z,19478,138,19,31,False
TheBrainDit,14,17.06.12,ФИНАЛ. КТО ЖЕ МАНЬЯК? - Hidden Agenda #3,20,2017-12-05T05:00:01.000Z,50469,4585,53,364,False
Pets World,14,18.09.02,СМЕШНЫЕ КОТЫ И ДРУГИЕ ЖИВОТНЫЕ  2018,15,2018-02-08T02:00:01.000Z,18368,260,15,20,False
Семейная кухня,14,17.05.12,Товары для КУХНИ с Аliexpress/ Стоит ли покупать? ТЕСТ 5.,26,2017-12-04T06:00:02.000Z,62732,2156,66,109,False
Голос / The Voice Russia,14,17.18.11,Светлана Иванова и Мария Зиброва. «Бедный Лазарь» - Нокауты - Голос - Сезон 6,24,2017-11-17T20:22:11.000Z,13664,713,19,140,False
Artem Tarasov MMA,14,17.05.12,Разборки DRAGO и D.Masta после баттла / VERSUS BATTLE за кадром,17,2017-12-04T11:07:11.000Z,249649,3033,12401,1589,False
sergeymeza,14,17.15.11,ФОНБЕТ СТАВКИ НА СПОРТ: Серёжа и микрофон #18,23,2017-11-14T13:13:32.000Z,49863,3549,488,897,False
ГОТОВИМ ДОМА,14,17.24.12,"Новогоднее Меню из 12 блюд всего за 4 часа! Шикарный новогодний стол для тех, кто ценит своё время",26,2017-12-23T17:30:59.000Z,23251,1001,54,47,False
Картавый Футбол,14,17.16.11,ЯТренер. Ник признается в ошибках и информация о доборе!,17,2017-11-15T13:45:26.000Z,70776,5151,123,352,False
BBC Russian,14,17.15.11,Тереза Мэй обрушилась с критикой на Россию,25,2017-11-14T14:13:54.000Z,6767,227,100,96,False
Mila Levchuk,14,18.22.01,Как защититься от манипуляторов и агрессоров,27,2018-01-21T16:43:08.000Z,36331,2255,104,345,False
Stark,14,17.30.11,🎯 Путинскую  ОПГ будут уничтожать по списку.,25,2017-11-28T14:35:36.000Z,50992,3620,49,751,False
CivilNet,14,18.05.01,Ներքին Կարմիրաղբյուր․ սահմանապահ գյուղի ամանորյա անցուդարձը,25,2018-01-04T15:10:53.000Z,8290,45,5,3,False
Маша Деточкина,14,17.19.11,ДЕТИ ПУГАЧЕВОЙ И ГАЛКИНА: Лиза и Гарри на венчании родителей Аллы Пугачевой и Максима Галкина!,24,2017-11-18T09:52:57.000Z,33313,392,36,77,False
ВЗГЛЯД ИЗНУТРИ,14,18.17.03,ГРУДUHUH УСТРОИЛ БYHT B KPEMЛЕ — (16.03.2018) — ПYTUH CAM HE УЙДЕТ,23,2018-03-16T08:30:00.000Z,188392,8999,1175,1474,False
Битва екстрасенсів,14,17.20.11,Битва экстрасенсов. Сезон 17. Выпуск 8 от 19.11.2017,24,2017-11-19T21:44:17.000Z,18710,188,48,96,False
Киножурнал Ералаш Официальный канал,14,17.14.11,Ералаш Столовая моей мечты (№297),1,2017-11-13T10:47:23.000Z,14294,471,30,126,False
Новости Кавказа,14,17.19.11,Прокуратуру Дагестана возглавит кандидат из центра,29,2017-11-18T14:04:22.000Z,3657,12,6,0,True
Pandafx,14,17.17.11,ДРАФТ НА ДВОИХ | STAVR,20,2017-11-16T14:01:43.000Z,152721,12539,167,385,False
Блог Юридической Помощи,14,17.16.12,Выплаты Неработающим Пенсионерам Проиндексируют,27,2017-12-15T13:32:32.000Z,17871,322,18,18,False
Life,14,17.29.11,Похороны Дмитрия Хворостовского,25,2017-11-28T11:42:31.000Z,45650,140,28,32,False
STAR MONEY,14,17.17.11,ЧТО НОСИТ L'ONE. СКОЛЬКО ДЕНЕГ ТРАТИТ НА ОДЕЖДУ,22,2017-11-16T18:43:55.000Z,41992,1587,162,256,False
NATALYA FALCONE from FLORIDA,13,17.14.11,"(1330) ОБЗОР ДОМА С ЛИЧНЫМ САМОЛЕТОМ ЗА $2,500.000!!!  АЖ ДУХ ЗАХВАТЫВАЕТ!",22,2017-11-13T06:00:01.000Z,9617,1118,21,289,False
Душевный Гороскоп Павел Чудинов,13,17.14.11,гороскоп недели с 13 до 19 ноября Юпитер в скорпионе,22,2017-11-13T06:42:32.000Z,10298,0,0,71,False
NHL Россия,13,18.14.04,Стычка Панарина и Кузнецова,17,2018-04-13T04:51:58.000Z,135535,261,136,162,False
Osia,13,17.25.11,Самый ПРОСТОЙ и ЭФФЕКТНЫЙ макияж CAT EYES [OSIA],26,2017-11-24T15:15:07.000Z,25406,1948,81,178,False
Максим Старосвитский,13,17.23.11,ТИПЫ ЛЮДЕЙ В ЛИФТЕ,23,2017-11-22T15:58:34.000Z,240855,10583,1086,1544,False
MAX ПОЯСНИТ,13,17.17.11,LIL PEEP | R.I.P | ПОЧЕМУ ?,10,2017-11-16T13:04:04.000Z,263386,18213,1261,1743,False
Отель Элеон,13,17.22.11,Отель Элеон - 3 серия 3 сезон (45 серия) - комедия HD,24,2017-11-21T17:00:02.000Z,691522,13239,495,1694,False
Арслан Энн,13,17.20.11,механизм спаивания народов России [Арслан Энн],22,2017-11-19T06:21:14.000Z,43760,7054,228,1534,False
Hraparak Oratert,13,18.20.04,"Եթե ես ֆիզիկապես ներկա եմ այստեղ, ուրեմն դուք պարտավոր եք",25,2018-04-19T18:06:03.000Z,31221,755,8,42,False
BagaBoom,13,17.06.12,💯ГОТОВЫ К ТОПАМ?💯 (Жду ваши челленджи) . СМОЖЕМ 5000💜 ?,20,2017-12-05T15:32:57.000Z,38650,3274,127,0,False
Телеканал Ю,13,17.16.11,#ВТЕМЕ: Настасья Самбурская тайно вышла замуж?,24,2017-11-15T09:00:02.000Z,26689,164,17,12,False
navo.tv,13,18.03.02,Armon (uzbek kino) | Армон (узбек кино),1,2018-02-02T06:49:17.000Z,99668,1208,260,444,False
Политика Россия - Украина,13,17.22.11,Владимир Соловьев: Речь школьника из России в бундестаге,25,2017-11-21T08:10:41.000Z,13068,120,73,159,False
KG TUBE MEDIA CHANNEL,13,18.19.04,Атамбаевди Кимдер САТЫП Кетти ? ЫЙЛАГЫСЫ КЕЛГЕН Атамбаев !,22,2018-04-18T20:58:38.000Z,42967,427,76,173,False
PostNews,13,17.31.12,За 5 минут до Нового Года,25,2017-12-30T16:40:42.000Z,200535,3642,1989,369,False
лиззка,13,17.23.11,"АНДРЕЙ, КОТОРЫЙ ВСЕ ЗНАЕТ",24,2017-11-22T14:00:02.000Z,238404,26451,3467,1288,False
УСЫ ЛАПЫ И ХВОСТ,13,17.07.12,ЗА ЧТО?!! КРАСНОЯРСКИЕ ПОДРОСТКИ ТАК ОБОШЛИСЬ СО ЩЕНКАМИ,15,2017-12-06T10:57:42.000Z,11119,854,11,275,False
Семья В селе,13,17.22.11,Бараны и овцы/Стратегический запас в деревне/Хороший сарай-теплый сарай,22,2017-11-21T12:54:50.000Z,9086,391,26,87,False
ЧОЛПОН ТВ,13,18.20.04,Исаков кетти! Бул үч мырза премьер болууга татыктуубу?,22,2018-04-19T15:45:14.000Z,23368,121,56,192,False
Bubble™,13,17.14.11,"10 ЛЮДЕЙ, КОТОРЫЕ СИЛЬНО ОТЛИЧАЮТСЯ ОТ ОСТАЛЬНЫХ",24,2017-11-13T07:00:00.000Z,260279,16124,461,827,False
Жасмина Рахимова,13,18.29.01,Дилшод новый,22,2018-01-28T16:11:36.000Z,3415,12,9,22,False
Dasha Koshkina,13,17.24.11,Соня с Ромой ПОТЕРЯЛИ Дашину Любимую КОШКУ! Друзья ПРИНЕСЛИ ДРУГОГО ЗВЕРЯ kids children,24,2017-11-23T06:40:20.000Z,487916,4810,1473,1233,False
Elena Matveeva,13,17.19.11,Как быстро омолодить лицо на 5-10 лет без шприца и скальпеля.,26,2017-11-18T06:25:00.000Z,14865,825,29,22,False
Добрые советы,13,18.01.05,Чистое ЛИЦО! Уже Через Неделю!! ПОТРЯСАЮЩИЙ ЭФФЕКТ !!!,26,2018-04-30T16:00:06.000Z,30098,472,19,3,False
Yeni Kanal,13,17.08.12,Xalq artisti adı erməni ilə hallanan qızının müdafiəsinə qalxdı: “Şərləməyin”- QALMAQAL,24,2017-12-07T16:03:55.000Z,34914,132,37,53,False
ARTPODGOTOVKA,13,17.14.11,Viva la Révolution!,25,2017-11-13T20:06:09.000Z,43489,3570,1732,269,False
Tages spiegel,13,17.14.12,Трагическая новость!!! - Найден МЕРТВЫМ телеведущий...,24,2017-12-13T09:58:48.000Z,27007,46,28,2,False
АНТИПОНТ,13,18.16.01,Ольга Бузова и ЛОБНОЕ МЕСТО с обезьянами ► Оля и Тимур поднялись к БОЛЬШОМУ БУДДЕ,24,2018-01-15T13:35:04.000Z,10604,67,14,9,False
Dead Dynasty,13,17.29.11,"PHARAOH - LOLLIPOP (LIVE) @ GLAVCLUB, MOSCOW",10,2017-11-28T12:18:52.000Z,93626,5702,187,218,False
MENTAL TV,13,17.17.11,Как Ксения Собчак уходит от вопросов у Дудя на интервью. Вербальный анализ,27,2017-11-16T14:01:15.000Z,92661,6880,284,563,False
Kentron Channel,13,18.26.04,Ուրվագիծ 25.04.2018 Նիկոլ Փաշինյան,25,2018-04-25T20:45:11.000Z,86858,1668,105,0,True
Канал Не Тормози,13,17.08.12,"Непростой ГАЗ 69 на жёстком бездорожье. УАЗ завидует!? Реальный оффроад, грязь, внедорожники 2017.",2,2017-12-07T15:30:00.000Z,32948,1320,42,139,False
Сергей Николаевич Лазарев,13,17.12.12,"Нельзя осуждать любимого человека и нельзя мстить, даже мысленно!",22,2017-12-11T20:19:01.000Z,5021,528,4,37,False
Кэшбери,13,17.30.11,Кэшбери Якутск,27,2017-11-29T05:24:50.000Z,77736,88,409,92,False
SMTOWN,13,17.17.11,Red Velvet 레드벨벳 '피카부 (Peek-A-Boo)' Teaser Part.2,10,2017-11-16T15:00:00.000Z,916731,83326,1052,6884,False
Julia Lanske,13,18.18.01,НЕ ТЕРЯЙТЕ ИНТЕРЕС МУЖЧИНЫ К СЕБЕ - РАСКРЕПОСТИТЕСЬ! Юлия Ланске,27,2018-01-17T15:00:00.000Z,6039,551,4,32,False
Агния Огонек,13,17.02.12,РУКИ-БАЗУКИ или СИНТОЛ головного мозга. Кирилл Терешин,24,2017-12-01T10:56:36.000Z,214867,14152,759,1711,False
Афоня TV,13,17.27.12,ВСЯ ПРАВДА О СВИДАНИЯХ С КРАСАВИЦАМИ! Признаюсь в постановах!?,23,2017-12-26T12:13:27.000Z,579326,50349,3907,3571,False
RusSmosh,13,17.15.11,КАЖДАЯ КОСТЮМИРОВАННАЯ ВЕЧЕРИНКА ТАКАЯ,23,2017-11-14T16:39:19.000Z,14734,1040,15,50,False
BobCat ТВ,13,17.19.12,Новые вольеры для рысей!,15,2017-12-18T20:55:17.000Z,10496,1419,42,163,False
Правовед ТВ,13,17.25.11,Паника в Сбербанке по заявлениям о конвертации по коду 810,27,2017-11-23T16:48:00.000Z,35370,1697,30,413,False
POLITICS GLOBAL,13,18.06.01,Михаил Делягин: Либеральному клaнy сказано - не сметь! 05 01 2018,25,2018-01-05T09:18:16.000Z,13813,173,24,93,False
ВЕСТНИК АПОКАЛИПСИСА,13,17.03.12,Алексей Венедиктов - НАВАЛЬНЫЙ ДАЛ KРЕМЛЮ ПPOСРАТЬСЯ!,22,2017-12-02T18:25:55.000Z,7103,110,20,11,False
Алёна Венум,13,17.24.11,МОЁ УТРО Если бы нам было 80,22,2017-11-23T12:00:19.000Z,1076612,113381,1712,8615,False
Дальнобой-Life David KAMAZ,13,18.12.01,Дальнобой. США. Самый интересный груз. Последний рейс в 2017 году.,22,2018-01-11T05:16:33.000Z,82588,6172,56,553,False
чебурашка это мышь,13,18.03.01,Лучше бы я рожала - Отходняки жены после новогоднего корпоратива - Этот номер порвал зал до слез,24,2018-01-02T11:23:52.000Z,124460,886,100,18,False
Мастер Сергеич,13,17.04.12,Шкатулка из бобины от скотча. Шкатулка своими руками,26,2017-12-03T06:52:08.000Z,10677,663,12,65,False
Red Lamp,13,17.20.11,Песня в стиле ROYAL BLOOD за 10 минут,10,2017-11-19T06:11:09.000Z,137578,7611,359,502,False
Страшилки от Дядюшки,12,18.19.02,СТРАШИЛКИ НА НОЧЬ - Женщина из ванны,24,2018-02-18T09:16:01.000Z,15995,1455,31,460,False
LIFE | Новости,12,18.12.01,Что Семенов скажет Шурыгиной?,25,2018-01-10T13:42:18.000Z,1085308,17429,2517,2162,False
BRIG man,12,17.27.11,ЖЕЛЕЗНЫЙ РЕВИЗОР / СБОРКА ПК У КОНСУЛЬТАНТОВ ДНС?,28,2017-11-26T14:56:14.000Z,109175,8776,816,2297,False
THAI LIFE,12,17.26.12,ИНОСТРАНЦЫ В ШОКЕ ОТ: LITTLE BIG - LOLLYBOMB. ИНОСТРАНЦЫ СЛУШАЮТ РУССКУЮ МУЗЫКУ.,22,2017-12-25T14:26:03.000Z,41685,2627,73,199,False
Pravda GlazaRezhet,12,18.04.01,Русское лото 1212 тираж Новогодний миллиард - 100%  обман. Факты в прямом эфире,22,2018-01-03T17:08:24.000Z,19881,2408,39,506,False
Hochland,12,17.14.11,Сочная кесадилья с курицей,22,2017-11-13T06:51:10.000Z,112851,3566,122,80,False
FloridaYalta,12,17.20.11,🔴 МОИ МАЛЬЧИКИ 🔴 ПОЛНЫЙ ДОМ КРАСОТЫ  АЛИ СЭМ АНДРЕЙ НИКИ 17.11.2017,24,2017-11-19T15:24:37.000Z,9570,244,69,54,False
MeanMachins TV,12,18.12.01,КАК БАЛАНСИТ ПОЛУВЗВОД? 11.01.18 / ВДВОЕМ ПРОТИВ ВСЕХ #Погнали,20,2018-01-11T23:18:06.000Z,40886,3348,151,3,False
Обо всем Интересном :3,12,17.19.11,ПСИХОЛОГИЧЕСКИЙ ТЕСТ / Узнай свои СТРАХИ и ФОБИИ !,24,2017-11-18T10:31:00.000Z,15017,1041,78,190,False
Вкусное дело,12,18.15.04,Прижимаем тесто к форме для льда и запекаем. Невероятно!,26,2018-04-14T10:30:01.000Z,65728,3841,80,87,False
FREA KING,12,17.17.11,"Иностранцы Слушают Русскую Музыку: ЛЕНИНГРАД, TATARKA, ДЕЛЬФИН, МОНЕТОЧКА",43,2017-11-16T05:20:56.000Z,27378,1467,138,426,False
PARA TV,12,18.21.04,#ԻմՔայլը նախաձեռնության քաղաքացիական անհնազանդության զանգվածային գործողությունները 20.04.2018,22,2018-04-20T12:49:04.000Z,128434,1040,108,27,False
Зробский MMA,12,17.31.12,ХАБИБ НУРМАГОМЕДОВ ПОБЕДИЛ ЭДСОНА БАРБОЗУ НА ТУРНИРЕ UFC 219 ! ПОРАЖЕНИЕ БАРБОЗЫ ДАЁТ ХАБИБУ 25-0 !,17,2017-12-31T05:00:08.000Z,95068,2543,191,792,False
Sayonara Boy,12,18.14.02,"Элджей - Hey, Guys",10,2018-02-13T17:28:18.000Z,379822,26843,13478,4365,False
KinoKiller Reviews,12,17.02.12,KinoKiller - Тизер,24,2017-12-01T14:43:21.000Z,8710,1085,28,151,False
Дух Проповеди Православие,12,17.19.12,Николай Чудотворец. Ткачёв Андрей,27,2017-12-18T22:57:59.000Z,3366,376,12,24,False
Natalina Mua,12,17.18.11,РАСПРОДАЖА КОСМЕТИКИ I 20.11 в 13:00 по Москве,26,2017-11-17T05:00:03.000Z,15189,1343,26,154,False
АНДРЕЕВ МОЯ ФАМИЛИЯ,12,18.04.01,Частное Общественное Место !  KГБ в тeмe ?  Краснодар,29,2018-01-03T23:53:33.000Z,3562,546,30,413,False
Артур Курильский,12,17.15.11,Доктор Рихтер 3 серия (2017) Мелодрама драма фильм сериал,1,2017-11-14T11:57:41.000Z,11189,26,10,4,False
Sports Genius,12,18.11.03,10 НЕВЕРОЯТНЫХ ПАРАЛИМПИЙЦЕВ В СПОРТЕ,17,2018-03-10T11:33:20.000Z,11908,85,6,8,False
Disney Россия,12,17.18.11,Тайна Коко - Третий трейлер,1,2017-11-17T09:26:07.000Z,11768,255,7,6,False
News Online,12,17.19.11,Галкин объяснил внезапное венчание с Пугачевой (18.11.2017),25,2017-11-18T10:56:10.000Z,26892,150,54,72,False
Дом 2 с Ириной,12,18.29.01,ДОМ 2 НОВОСТИ раньше эфира! (3.02.2018) 3 февраля 2018.Барзиков переспал с Мариной Тристановной,22,2018-01-28T21:54:37.000Z,2509,33,3,4,False
O'zbek Tilida Seriallar,12,17.27.12,SEVGI ISTIROBI (REKLAMASIZ) 85 - qism HD O'zbek Tilida,1,2017-12-26T17:13:58.000Z,22940,154,27,42,False
Архитектор Муравей,12,17.02.12,СРОЧНО! МЕРЗКАЯ ТРОИЦА САТАНОВСКИЙ ПОЛНАЯ ВЕРСИЯ!  01.12.2017,25,2017-11-30T16:52:43.000Z,44092,224,42,106,False
WylsaLive,12,17.23.12,"Итоги: PS4, One X, Mi Mix 2",28,2017-12-22T19:42:00.000Z,38277,2846,180,128,False
Tим Тим,12,17.14.11,"КОРОЧЕ ГОВОРЯ, РЕПЕТИТОР - ТимТим.",23,2017-11-12T14:24:32.000Z,738654,38917,1724,2339,False
Школа Вязания Светланы Коломиец,12,17.18.11,"Обзор Malabrigo, ChiaoGoo, Prym. 1-я часть. Общаемся.",22,2017-11-17T17:38:02.000Z,8830,414,12,26,False
ТНТ4 Телеканал,12,18.24.01,Деньги или Позор. Сезон 2. Выпуск №1. Александр Ревва. (15.01.18г.),23,2018-01-23T17:00:04.000Z,49763,1102,207,116,False
Деаф политика,12,18.19.02,75/18.Встреча Лаврова с Климкиным в Мюнхене.,22,2018-02-18T14:46:59.000Z,4559,677,13,33,False
SNICKET,12,17.15.11,Обзор Половинки - Черная Принцесса,22,2017-11-14T10:46:48.000Z,114864,4637,407,348,False
Dunyo Yangiliklari,12,18.28.01,"Тезкор хабарлар,",1,2018-01-27T18:02:20.000Z,44702,375,67,53,False
Штаб Навального,12,17.16.11,Беспредел и коррупция в Тамбовской области. Почему?,29,2017-11-14T13:00:02.000Z,61838,7140,7259,770,False
Реальная Россия,12,17.30.12,Мария Лондон Гады,22,2017-12-29T03:45:05.000Z,90050,5243,146,642,False
Кыргызстан,12,18.04.05,Нурлан Насип суроолорго жооп бералбай такалып 😜😜😜 / Кыргызстан,22,2018-05-03T05:13:01.000Z,61758,405,104,84,False
Ледниковый Период,12,18.02.04,Ледниковый период. Дети. Выпуск от 01.04.2018,43,2018-04-01T19:15:32.000Z,8516,168,15,42,False
Redenchen,12,18.16.02,КАК ЖИВЕТ КОРОЛЕВСКАЯ СЕМЬЯ БРИТАНИИ,23,2018-02-15T15:42:08.000Z,11859,260,39,51,False
Анимационные сериалы,12,18.19.05,Наследники - Недобрый мир - Исполнение желаний | мультфильм Disney,1,2018-05-17T14:15:01.000Z,39114,748,63,57,False
Sportfaza Перезагрузка,12,17.01.12,У кого больше БИЦЕПС? ТЕРЕШИН или ТКАЧУК,17,2017-11-30T13:26:10.000Z,118299,4671,327,492,False
Аник,12,18.20.04,Мои странные рисунки | Смысл,1,2018-04-06T09:14:20.000Z,17201,737,28,44,False
Просто Озвучка,12,17.15.11,Студентские Мутки | 1 часть,23,2017-11-14T18:52:06.000Z,26641,2294,41,163,False
Дом 2 Новости и слухи,12,17.16.11,ДОМ 2 НОВОСТИ ЭФИР 21 НОЯБРЯ 2017 (21.11.2017),22,2017-11-15T14:22:17.000Z,13745,40,19,7,False
Netflix,12,17.27.11,Black Mirror - Arkangel | Official Trailer [HD] | Netflix,24,2017-11-25T14:30:01.000Z,1776191,21784,1286,2426,False
ТАСС,12,17.22.11,Что подарил Путину Асад,25,2017-11-21T14:06:49.000Z,5864,33,4,8,False
Поиск Людей,12,17.03.12,Жди меня Россия 02.12.2017. 1 часть. Эфир 2 декабря 2017,22,2017-12-02T12:07:16.000Z,22716,80,20,15,False
Белая Рысь,12,18.29.01,Почему Путин победит на выборах,29,2018-01-28T09:35:40.000Z,96695,3843,6730,1674,False
Романус,12,17.27.11,ЭТО ПИ*ДЕЦ! Школьница угрожает тюрьмой и вымогает деньги | Новая Диана Шурыгина | Миллер и Анисимова,25,2017-11-26T10:00:01.000Z,77349,7974,759,1328,False
Звёзды шоу-бизнеса и знаменитости: знай обо всем,12,17.21.11,ВНЕБРАЧНЫЕ ДЕТИ ЗВЕЗД. Знаменитости у которых родились дети вне брака,22,2017-11-20T14:00:04.000Z,11140,265,8,20,False
TOPINFORM,12,17.03.12,"Удар по созданию политической церкви в Украине. Андрей Золотарев, Павел Рудяков",25,2017-12-02T16:58:26.000Z,10196,291,15,37,False
Fancy smth.,12,17.01.12,LOFT PROJECT #10: Новогодний ДЕКОР КОМНАТЫ в стиле ЛОФТ,26,2017-11-30T15:51:24.000Z,48289,8905,39,1418,False
ВСЕ О ПОЛИТИКЕ,12,17.29.11,БЮДЖЕТ РОССИИ НА 2018 ГОД. ПОГРУЖАЕМСЯ В НИЩЕТУ,22,2017-11-28T15:06:14.000Z,3867,115,6,20,False
Елена Пленкина,12,17.20.11,Как сшить варежки |TIM_hm|,26,2017-11-19T11:46:43.000Z,4716,525,4,29,False
Barvina,12,18.18.01,"Короче говоря, ТАЙНЫЙ ПЛАН лучшей подруги",24,2018-01-18T03:32:36.000Z,77256,4799,259,1023,False
UZBEKISTAN 24,11,18.19.02,СРОЧНО! В ДАГЕСТАНЕ УБИТЫ ЛЮДИ НА МАСЛЕНИЦЕ,25,2018-02-18T15:03:32.000Z,4581,18,7,45,False
Fight Night1,11,17.20.12,ЕМЕЛЬЯНЕНКО ОТВЕТИЛ НА САМЫЕ ГОРЯЧИЕ ВОПРОСЫ,17,2017-12-19T12:08:40.000Z,60924,958,113,270,False
ASMR KittyKlaw,11,17.23.12,❄ АСМР ЗАБОТА о тебе 🍪☕ | ❄ASMR ☕ CARE for you ✨,22,2017-12-22T16:03:33.000Z,38272,2441,70,358,False
Татьяна Кильмяшкина,11,17.28.11,Мужской кардиган (кофта) Тепло Норвегии / Начало процесса:)),22,2017-11-27T16:09:22.000Z,6900,339,11,89,False
Magnum Productions,11,18.18.05,Awalem Khafeya Series - Ep 01 -  | عادل إمام - HD مسلسل عوالم خفية - الحلقة 1 الأولى,24,2018-05-17T20:51:21.000Z,512884,5801,344,544,False
Vladus,11,18.18.02,"Vladus — Минимум (Премьера Клипа 2018, Пародия)",10,2018-02-17T15:31:12.000Z,185042,22889,1326,10550,False
Канал POKLONKA,11,17.15.11,Мальцев артподготовка прямой эфир 13.11.2017,22,2017-11-13T21:41:26.000Z,42507,616,354,533,False
Криминальная Россия 2017,11,18.17.01,Магомед Даудов о  въезде в Литву: «А где эта самая Литва?»,25,2018-01-16T15:32:17.000Z,6061,30,4,24,False
Павел Астапов,11,18.13.03,ВЫБОРЫ 2018,25,2018-03-12T14:01:24.000Z,12763,2010,67,322,False
Sveta Fresh,11,18.21.04,Прозрачные СКВИШИ НЕ из БУМАГИ 🔮 Антистресс игрушки! Squishy БРЕЛКИ,24,2018-04-20T13:00:04.000Z,146684,12357,260,813,False
Ленинград | Leningrad,11,18.08.03,Ленинград — Не Париж,10,2018-03-07T08:00:38.000Z,3335132,128677,18952,9913,False
Genderfluid Helisexual,11,17.23.11,NIXELPIXEL И ТАЙНЫЕ МЕНСТРУАЛЬНЫЕ ЧАШИ | Обзор и реакция,23,2017-11-22T09:52:08.000Z,57166,7527,1924,1605,False
Tajik Kelin,11,18.05.02,Обалденный ПЕРЕКУС Вкуснотища  ну невозможно оторваться,22,2018-02-04T06:23:18.000Z,26115,2300,36,131,False
†СТРАШНЫЕ ИСТОРИИ ОТ ВОРОНА†,11,17.25.11,История На Ночь - НЕУЛОВИМЫЙ РАЙОН.,24,2017-11-24T15:00:04.000Z,3474,336,6,50,False
FitStars,11,18.07.03,Сколько жмёт Виктор Блуд?  Дорога к Стронгу - часть 1  / Денис Вовк и Виктор Блуд,17,2018-03-06T17:40:06.000Z,107270,6365,109,616,False
KavkazTube Channel,11,18.23.05,Выпускной дочери Рамзана Кадырова Хадиджат. По всей Чеченской республике идут выпускные. 22.05.2018,29,2018-05-22T19:41:18.000Z,20223,354,28,82,False
ЖЕЛЕЙНЫЙ МЕДВЕДЬ ЛАКИ,11,17.24.12,Покебол из Желе для Желейного Медведя Лаки,24,2017-12-23T08:33:25.000Z,23817,250,27,87,False
ERKAKLAR MAKONI,11,17.16.12,Шавкат Мирзиёев - Туй Туйдай Булсин!!!,22,2017-12-15T11:06:05.000Z,168515,2900,203,411,False
Грудинин Мой Бро,11,18.08.01,"Главные отличия Грудинина от Путина! Сравни, сделай выводы, потом голосуй!",22,2018-01-07T15:39:57.000Z,4681,531,17,156,False
Сергей Трейсер,11,17.20.11,"АВАРИЙНОЕ ЗАТОПЛЕННОЕ ПОДЗЕМЕЛЬЕ , НА ЛОДКЕ ПОД ЗЕМЛЕЙ Сергей Трейсер",22,2017-11-19T14:58:44.000Z,243132,27110,805,1728,False
Flomd group,11,17.14.11,"СОБЕРИ ПЕСНЮ #2 | GERMAN, STAVR, FINITO, ROMAROY",20,2017-11-13T14:21:56.000Z,75839,6602,51,187,False
Must Go On Show,11,17.06.12,Время и Стекло - Тролль | ПРАНК,23,2017-12-05T14:00:04.000Z,41868,6820,72,285,False
ANNA CHI,11,17.19.11,ЛИЗУН ПОД МИКРОСКОПОМ | РАСПАКОВКА ОГРОМНОЙ ПОСЫЛКИ из Китая | ОЖИДАНИЕ И РЕАЛЬНОСТЬ,24,2017-11-18T14:24:44.000Z,147431,4949,132,4081,False
ToFight News,11,18.08.03,ЕМЕЛЬЯНЕНКО СИЛЬНО ОТВЕТИЛ КАДЫРОВУ! + РЕАКЦИЯ ДРУГИХ БОЙЦОВ,17,2018-03-07T21:06:23.000Z,4991,79,24,26,False
SonunTV СонунТВ,11,18.13.01,Болор бала.. ошосунан бир кулуп алыныз))),15,2018-01-12T13:09:15.000Z,24022,304,22,26,False
Serious Model,11,18.06.01,"В. Рыжков о том, что ждет Россию и россиян после Выборов в марте 2018 года! Прогноз!",25,2018-01-05T16:21:35.000Z,30658,368,155,309,False
ManicureAtHome Евгения,11,17.19.11,🤗Фикс прайс🤗 ноябрь 2017,22,2017-11-18T13:00:07.000Z,2846,136,4,22,False
UzBoom Tv,11,17.14.11,4 ЁШЛИ КИЗНИ УРГАН ОТАСИГА ОТВЕТ!,22,2017-11-13T04:33:12.000Z,77786,1769,290,1689,False
RuVine,11,17.07.12,ЛУЧШИЕ НОВЫЕ ВАЙНЫ 2017 / НОВЫЕ РУССКИЕ ВАЙНЫ | BEST VINES,23,2017-12-06T09:35:25.000Z,7111,153,125,32,False
Протоиерей Андрей Ткачёв,11,18.02.04,Вступаем в Пасху страстей Христовых. АУДИО. Прот.Андрей Ткачёв (01.04.2018г.),22,2018-04-01T12:08:25.000Z,23785,0,0,37,False
DontWorry :D,11,17.17.11,"КОРОЧЕ ГОВОРЯ, Я ПЫТАЛСЯ СНЯТЬ АНТИ-ГРИФЕР ШОУ !",20,2017-11-16T13:19:39.000Z,32434,2857,211,306,False
SPORT - LIFE 2,11,18.28.05,КАК РАМОС СЛОМАЛ САЛАХА! И ДРУГИЕ ЖЕСТОКИЕ ФОЛЫ!,17,2018-05-27T07:02:40.000Z,83151,740,270,630,False
Юрий Тот,11,17.28.11,Прощание с Дмитрием Хворостовским,22,2017-11-27T14:06:52.000Z,254187,1195,131,670,False
UZNAVO TV,11,18.09.03,UZBEK OGLONI MIXAIL GALLIVUODA VIDEO (CHEMPION ARNOLD CLASSIC),22,2018-03-09T03:11:10.000Z,2682,109,1,11,False
Угона.нет - защита от угона,11,17.16.11,Угон Форд. Спасет ли аэрография от угона ?,2,2017-11-15T16:04:33.000Z,105065,3496,376,275,False
ATV Show,11,18.03.01,ATV Yeni il konserti 2018,24,2018-01-01T21:29:08.000Z,45994,489,77,136,False
StarPro,11,17.18.11,Градусы & Кравц - Выходи за меня,10,2017-11-17T16:00:07.000Z,30040,592,88,28,False
SHUM BOLA,11,18.29.03,ТЕЗКОР ХАБАР! ДЕПОРТ ЙУК БУЛАДИМИ? УЗБЕКИСТОН ЯНГИ КЕЛИШУВ!,22,2018-03-28T11:19:46.000Z,136419,3040,619,529,False
Авторитетное Мнение,11,18.08.02,"Алексей Венедиктов - Этo cкpывaют, нo Kpeмль в пaникe: pacклaд yжacный!",22,2018-02-07T17:19:33.000Z,13895,172,42,99,False
АПОКАЛИПСИС СЕГОДНЯ,11,17.16.11,Юрий Пронько 14.11.2017 - НОВЫЙ ФИНАНСОВЫЙ СПЕКТАКЛЬ,25,2017-11-14T17:22:14.000Z,35507,513,37,89,False
Veronika Stepanova,11,17.07.12,Зависимость от психотерапии и психотерапевта,1,2017-12-06T11:36:50.000Z,15996,827,21,212,False
Шоу на Первом,11,17.20.11,Ирина Гладкая. Армрестлер. Я могу! Фрагмент выпуска от 19.11.2017,24,2017-11-19T15:57:38.000Z,77966,981,294,257,False
Теперь я Знаю,11,17.17.11,ДИМА БИЛАН НЕИЗЛЕЧИМО БОЛЕН? конфузы звёзд на сцене,22,2017-11-16T09:22:32.000Z,109218,4616,432,381,False
FROST,11,17.09.12,Палим СОСЕДА с Фростом -  Hello Neighbor РЕЛИЗ!,20,2017-12-08T23:13:49.000Z,147371,19251,362,454,False
Ms. Helen,11,17.21.11,"Фикс-Прайс. Крутые^Жемчужные^наборы⭐️Ноябрь,2017,fix-price",22,2017-11-20T10:39:07.000Z,10961,157,28,30,False
В поисках золота и старины,11,17.20.12,Копали котлован и обнаружили...В это сложно поверить!В поисках Золота и Старины с Дмитрием.,19,2017-12-20T03:00:01.000Z,2588,232,12,34,False
Репка Лихие 90-е,11,17.16.11,Репка Лихие 90-е 1 сезон 9 серия Как появились крыши? История крышевания,1,2017-11-16T04:19:07.000Z,67141,9518,77,546,False
Канал Кшиштовского,11,17.22.11,Кшиштан о фильме ЛИГА СПРАВЕДЛИВОСТИ,23,2017-11-21T19:50:15.000Z,104869,16924,681,1086,False
ТеоретиК,11,18.24.02,СКРЫТЫЙ МОТИВ ДЕВУШЕК ИЗ ДОКИ ДОКИ ЛИТЕРАТУРНЫЙ КЛУБ СЕКРЕТЫ И ПАСХАЛКИ - Часть 1,22,2018-02-23T13:23:04.000Z,94482,18793,224,4063,False
ibighit,11,17.17.11,BTS (방탄소년단) 'MIC Drop (Steve Aoki Remix)' Official Teaser,10,2017-11-16T15:00:05.000Z,3483755,789772,2840,72376,False
Михаил Шибанков,11,18.28.02,"Дебаты 2018 на ОТР (27.02.2018, 21:05)",25,2018-02-27T19:04:20.000Z,59383,1644,243,2493,False
ХУЗУР ТВ,11,17.28.12,НЕ НАЗЫВАЙТЕ своих детей ТАКИМИ именами,22,2017-12-27T06:51:07.000Z,23864,665,17,91,False
Novosti,11,18.05.02,Итоги недели на ННТ 04.02.2018 год.,25,2018-02-04T16:16:01.000Z,3842,203,9,21,False
Кулинарный Лайфхакер,11,17.06.12,Объедение на Ужин за 20 минут. Курочка с Шампиньонами в Сливках.,22,2017-12-06T03:09:37.000Z,2443,323,7,8,False
Мир 24,11,17.28.11,Дмитрий Хворостовский ушел навсегда под 10-минутную овацию - МИР 24,25,2017-11-27T13:59:59.000Z,7870,35,1,7,False
Little Big,11,17.10.12,LITTLE BIG - LollyBomb [Official video],10,2017-12-08T17:19:17.000Z,1434270,174746,7003,14173,False
Ольга Бузова,11,17.02.12,Ольга Бузова - Неправильная (Премьера клипа 2017),10,2017-12-01T10:30:06.000Z,575223,16656,5774,2165,False
Валерий Пякин Видеоархив,11,17.07.12,Вопрос-Ответ Валерий Пякин от 4 декабря 2017 г.,22,2017-12-05T10:53:09.000Z,63081,1562,61,488,False
Юмилия,11,17.07.12,КОШАЧИЙ ПЕРЕДОЗ СЫЕНДУК РЕАКЦИЯ на sndk,24,2017-12-06T15:39:11.000Z,19814,1851,73,387,False
Bubenitta,11,17.21.11,DIY СЛАДКИЙ ДЕКОР Комнаты * Копилка ПРЯНИЧНЫЙ ДОМИК * 5 Классных ИДЕЙ !! * Bubenitta,26,2017-11-20T13:00:06.000Z,56629,4393,251,703,False
New Rush Word,11,17.07.12,"Орден Святого Долбокентия: Виталий Милонов, Ольга Алисова, выборы 2018 | Новости 7:40, 05.12.2017",22,2017-12-05T16:52:33.000Z,26528,1327,55,220,False
OPTI MUS,11,17.18.12,Разве это отдых?,22,2017-12-17T16:20:32.000Z,255534,27495,601,1080,False
Покинутый Мир,11,17.14.11,Огромная заброшенная спецшкола. ВСЁ оставлено - Покинутый Мир,19,2017-11-12T15:21:18.000Z,102656,7928,137,1446,False
1xbet.tv,11,17.10.12,Картавый спорт. Золотой мяч Роналду и 7 голов Ливерпуля! А так же о патриотизме в тараканьих головах,17,2017-12-09T10:44:24.000Z,43654,3477,141,354,False
TheBrianMaps,11,17.04.12,ВОЛШЕБНЫЕ ДУХИ,23,2017-12-03T08:55:58.000Z,1759818,129483,4841,14925,False
Buzova Time,10,17.17.12,Бузова клип на песню WiFi ❤️Танцы на ТНТ,22,2017-12-16T19:08:15.000Z,6820,67,9,7,False
Breaking News - Ломаные Новости,10,18.10.02,Золотая Рыбка для доминирующих господ. Ломаные новости от 09.02.2018,23,2018-02-09T18:49:00.000Z,8489,950,35,169,False
Крикливый,10,17.03.12,ЭТО СЫН ДИКТОРА! БОБ ОТПРАВИЛСЯ В КОСМОС! ПАСХАЛКИ!,22,2017-12-01T13:18:17.000Z,24956,610,52,456,False
KinoRaй,10,18.20.02,▶️ Королева при исполнении (2018) 1 серия Русские мелодрамы сериалы 2018,22,2018-02-19T14:44:53.000Z,45084,204,42,10,False
Галина Кухня,10,17.29.12,Снежки Новогодняя закуска цыганка готовит. Закуска Снежный ком. Gipsy cuisine.,29,2017-12-28T14:00:03.000Z,20331,1965,12,105,False
AIBA FIGHT,10,18.01.01,РЕАКЦИЯ РАМЗАНА КАДЫРОВА НА ПОБЕДУ ХАБИБА НУРМАГОМЕДОВА НАД ЭДСОНОМ БАРБОЗОЙ !,17,2017-12-31T08:29:18.000Z,467824,6455,2632,714,False
time,10,18.09.02,Окуучу кыз селфи суротко тушом деп каза болду,24,2018-02-08T13:38:58.000Z,37100,128,21,27,False
Пикули,10,17.21.11,МУЛЬТ ЛИЧНОСТИ — Дом 2 со звёздами шоу-бизнеса,1,2017-11-20T22:03:23.000Z,10439,1932,33,151,False
CMH,10,18.15.02,ЖИРЕЮ - ШОУ ОБ ЭКСТРЕМАЛЬНОМ ОЖИРЕНИИ (худею пародия),24,2018-02-14T15:21:08.000Z,710832,126796,3396,4807,False
Удивительные Истории,10,18.06.03,Тайная личная жизнь Алины Кабаевой | Новая любовь и муж Алины Кабаевой Владимир Путин?,24,2018-03-05T14:40:53.000Z,26561,312,86,56,False
Star Media,10,18.28.03,"Тот, кто читает мысли. МЕНТАЛИСТ.  2 Серия. ПРЕМЬЕРА 2018! Детектив. StarMedia",1,2018-03-27T08:30:01.000Z,41790,101,27,29,False
Работа над ошибками,10,17.22.11,Как Навальный прибавил зарплату москвичам/Что делали коммунисты в Австро-Венгрии?,22,2017-11-21T07:03:39.000Z,75372,2529,1469,567,False
MrMatador,10,18.22.01,Real Madrid vs Deportivo La Coruña 7-1 - All Goals & Highlights ● 21/01/2018 HD (First Half),17,2018-01-21T16:06:09.000Z,1666100,8915,2786,1181,False
Стася Мар,10,17.16.12,ЛАЙФХАКИ ДЛЯ ТЕЛЕФОНА ( ДЛЯ АНДРОИДА И АЙФОНА) + DIY  + СНИМАЕМ КЛИП В Musical.ly,26,2017-12-15T15:01:04.000Z,252798,16739,508,4156,False
Нежный редактор,10,17.17.11,«Спать с Ди Каприо — дурной тон». Очень горячий Dj про хип-хоп | ИСТОМИНА,22,2017-11-16T13:51:34.000Z,26411,1023,155,169,False
# Жить,10,17.29.12,Твое решение может быть чьей-то мечтой! #ЖИТЬ,29,2017-12-28T12:39:21.000Z,253551,2557,161,65,False
СЛАВА КПСС,10,17.29.12,СЛАВА КПСС - ВЛАДИМИР ПУТИН,22,2017-12-28T16:36:27.000Z,429782,30476,28938,6566,False
YANGI KUN,10,18.13.01,SHAVKAT MIRZIYOYEV ILK BOR OCHIQ SUHBAT BO'LDI 12.01.2018 SELEKTOR,25,2018-01-12T16:39:12.000Z,164186,3195,139,507,False
SPORTSNET,10,17.16.11,Gotta See It: Blue Jackets' Bobrovsky with incredible blocker save vs. Canadiens,17,2017-11-15T03:03:56.000Z,42758,298,2,43,False
Мирби,10,18.23.02,Будто бы плыву,10,2018-02-22T14:00:26.000Z,311969,44060,2113,6605,False
Иван Эфиров,10,17.27.11,ДЕНЬГИ ИЗ ТРУСОВ - ПРАНК / КОНКУРС на Samsung Galaxy S8,23,2017-11-26T18:16:26.000Z,165930,14353,675,2240,False
Bodya,10,18.24.04,НЕ ЗАЛИПНИ ЧЕЛЛЕНДЖ | Do not get stuck challenge| Самое Приятное Видео в мире| Попробуй НЕ ЗАЛИПНУТЬ,22,2018-04-23T18:22:51.000Z,15412,1808,48,877,False
BostonDynamics,10,17.15.11,The New SpotMini,28,2017-11-13T20:09:58.000Z,3701763,56564,2495,11608,False
Маша Zолина,10,17.17.11,✿ LET`S COOK ✿ Голландский соус / Голландез / Топлёное масло ♥,27,2017-11-15T23:15:24.000Z,16565,1694,10,0,True
DW (Russian),10,18.25.01,Кремлевский доклад: США наносят удар по олигархам Путина - DW Новости (23.01.2018),25,2018-01-23T17:38:56.000Z,149985,3118,3591,1549,False
Anny May,10,17.14.11,НОЧЬ ПУГАЮЩАЯ ЗАГАДКА! ТБИ,24,2017-11-13T12:00:20.000Z,493894,39688,1358,69331,False
Новости в Мире,10,17.25.11,Страсть и Нежность: Две Жены Дмитрия Хворостовского,22,2017-11-24T12:00:03.000Z,69519,320,85,51,False
Alisa Dirilis,10,17.19.11,Эртугрул.96.2-ой анонс.на русском,1,2017-11-18T12:30:44.000Z,13234,104,16,8,False
Топовые Мысли,10,18.12.03,Александра Трусова затмила Загитову и Медведеву,17,2018-03-11T14:00:29.000Z,22245,0,0,56,False
Soderling,10,18.21.01,Этот Канал Был Украден!,1,2018-01-20T17:35:31.000Z,46400,6166,165,1009,False
Александра Киевская,10,18.15.01,ПОШЛА ОДНА В ЗАБРОШКУ НОЧЬЮ. ЧЬЯ-ТО КРОВЬ НА СТЕНЕ,22,2018-01-14T15:40:57.000Z,106424,9893,191,1777,False
SpaceX,10,17.16.12,CRS-13 Hosted Webcast,28,2017-12-15T16:35:18.000Z,472573,13691,407,1355,False
Асафьев Стас,10,17.09.12,Спорткар за 400 тыс. руб. из России. Как с ним жить?,2,2017-12-08T14:50:28.000Z,49212,3884,157,387,False
Нтс.Music Kyrgyzstan,10,17.16.12,"Айгерим Расул кызы: «Кайнатам бүгүн тойго кандай көйнөк киесиң, деп калат» / Таң Шоола / НТС",10,2017-12-15T09:44:09.000Z,88951,596,110,194,False
Rascheska TV,10,17.25.11,Мытье головы и тонирование волос,26,2017-11-24T13:54:25.000Z,5406,409,19,24,False
жёлтая газетка,10,17.02.12,громкое заявление Ольги Бузовой на премии Высшая Лига 2017 !!!   ПОДРОБНОСТИ !!!,24,2017-12-01T19:26:40.000Z,7843,654,14,195,False
intervyuTV,10,18.23.01,Anvar Sobirov va Nargiza Abdullayeva yig‘lab suhbatlashdi 50/50,22,2018-01-22T12:39:06.000Z,23723,769,25,310,False
КИНОКЛУБ,10,18.12.01,"ШИКАРНО! СУПЕР! Премьера 2018 [ ОН РЯДОМ ] Русские мелодрамы 2018 новинки, фильмы 2018 HD",22,2018-01-10T20:18:39.000Z,233072,651,176,34,False
Николай Стариков,10,17.20.11,Николай Стариков. Беседа  о революции,25,2017-11-19T10:15:57.000Z,5649,286,11,34,False
Angelina Lin,10,18.13.05,♡🎧 ASMR KittyKlaw СТРИМ 3Dio+Rode+Blue yeti ✨12.05.18 (АСМР мурашки для ваших ушек) ♥,22,2018-05-12T21:33:32.000Z,39093,3569,166,63,False
Усман Ватандош Баратов,10,18.06.03,Yordam bering oilasini topishga Samarkandan: Хужакулов Файзуллаев Гайрат,25,2018-03-05T23:17:28.000Z,1223,95,16,64,False
Стройхак,10,17.22.11,Крутая самоделка  из старого огнетушителя. Пригодится любому водителю. Автолайфхак. #Стройхак,26,2017-11-21T15:30:22.000Z,115890,6428,336,425,False
NEMAGIA-LifE,10,17.17.12,(ВАЖНОЕ ВИДЕО) ЧТО СЛУЧИЛОСЬ с НЕМАГИЕЙ???,22,2017-12-16T11:59:54.000Z,953396,70071,4955,8090,False
Uz Tube,10,18.02.01,Андижонлик укитувчи 1-синф кизга жинсий тажовус килди,24,2018-01-01T11:01:20.000Z,54467,91,287,142,False
IWB UZ,10,18.30.01,Шавкат Мирзиеев Чемпионларга Биттадан Машина Совға Қилди,22,2018-01-29T09:20:39.000Z,175380,1698,102,261,False
FightSpace,10,18.29.01,Усик-Бриедис: Пресс-конференция после боя | FightSpace,17,2018-01-28T07:17:48.000Z,243091,2071,167,759,False
Vaseslav,10,17.11.12,СУ-30 ЗАГЛЯНУЛ ВНУТРЬ ТРАНСПОРТНИКА - Комментарии иностранцев,29,2017-12-09T21:08:44.000Z,432822,21002,488,2821,False
Super,10,18.20.01,БОЙФРЕНД БУЗОВОЙ И БЕРЕМЕННОСТЬ ГЛЮКОЗЫ | Редакция | Выпуск 1,22,2018-01-19T08:33:44.000Z,61522,251,234,68,False
Дима Ковпак,10,17.19.12,Собственники автосервисов Вилгуд привезли новые товары из Китая,27,2017-12-18T11:12:34.000Z,60681,1199,299,68,False
MMM TV,10,18.22.04,Sevinch Muminova ukasini uylantirdi (2018),24,2018-04-21T05:46:19.000Z,147780,785,204,233,False
Шепот Вселенной,10,17.20.11,Что произошло на нашей Планете 19 ноября 2017,22,2017-11-19T19:06:43.000Z,8085,160,6,31,False
Павел Блюденов,10,17.22.11,Вот такого не ожидал! Самая большая и дорогая Мазда. Тест-драйв и обзор Mazda CX-9,2,2017-11-21T17:26:23.000Z,76784,3513,159,537,False
Bu O'zbekiston,10,17.23.12,Шавкат Мирзиёев Янги Видеоселекторда,25,2017-12-22T10:25:39.000Z,95059,2054,73,314,False
UzbekTeam,10,18.13.01,12-NOKOUT TULIQ JANG!! SHOHJAHON ERGASHEV - SONNY FREDRIKSON,22,2018-01-13T04:04:50.000Z,46125,3146,80,658,False
In Cor Cadit,10,17.05.12,История против Эрнесто Че Гевары[Ted Ed],27,2017-12-04T11:40:03.000Z,27130,2731,56,141,False
Watch Moments,10,17.02.12,ЮЛИК СМОТРИТ: 5 МИНУТ НАЗАД - by A4 - ШКОЛА,22,2017-12-01T16:11:45.000Z,28729,817,73,58,False
Oblomoff-stuff,10,17.07.12,Выбросить телефон подписчика? Что там с YOUTUBE? Кухонный Философ.,22,2017-12-06T09:46:49.000Z,46499,2761,239,379,False
СтопХамСПб,10,17.02.12,СтопХамСПб - Местный диалект,2,2017-12-01T07:59:20.000Z,165303,15397,714,2023,False
NIMAGAP TV,10,17.06.12,2 ЁШЛИ БОЛАСИНИ ШАВҚАТСИЗ ТЕПГАН ИФЛОС ТОПИЛДИ !,10,2017-12-05T17:22:41.000Z,38525,572,155,365,False
MrRissso,10,17.19.12,ДПС Гаишники продержали водителя три часа на морозе и составили 9 протоколов,2,2017-12-18T22:49:43.000Z,19575,942,102,222,False
POLITICS WORLD,10,17.30.11,Ростислав ИЩЕНКО: П0ЛЬШA ПPEДУПPEДИЛA YKPAUHY О PA3PЬIBE. 29.11.2017,25,2017-11-29T16:13:37.000Z,7568,109,3,11,False
Любовные истории 2017,10,17.19.11,"САМАЯ НОВАЯ ПРЕМЬЕРА 2017  НЕ ЛЮБИТЕ ЖЕНАТЫХ  Русские мелодрамы 2017 новинки, премьеры 2017",22,2017-11-18T12:04:53.000Z,93164,326,92,17,False
СПЛЕТНИКИ,10,17.19.11,ВЕНЧАНИЕ АЛЛЫ ПУГАЧЕВОЙ И МАКСИМА ГАЛКИНА!,24,2017-11-18T08:23:59.000Z,19705,66,35,86,False
Crestbook Шахматы,10,18.11.03,Турнир претендентов 2018 🤠 тур 1  🎤 Сергей Шипов ♕ Шахматы,17,2018-03-10T22:39:40.000Z,86692,2206,191,21,False
BAKU.WS,10,17.03.12,Anjelika: Anar Nağılbazın məndə hələ çox videosu var,24,2017-12-02T10:15:34.000Z,167618,1005,192,221,False
VA10HD,10,18.18.01,PSG vs Dijon 8-0 All Goals & Extended Highlights - 17/01/2018,17,2018-01-17T21:58:56.000Z,855000,7529,821,798,False
ExileShow,10,17.20.11,ДЕТЕКТОР ЛЖИ С ТОКОМ! COFFI ПРОВЕРЯЕТ МЕНЯ НА ПРАВДИВОСТЬ ЖЕСТОКИМИ ВОПРОСАМИ!,20,2017-11-19T15:19:12.000Z,173628,14706,179,843,False
Портье Дрогба,10,17.17.11,ЭДИНСОН КАВАНИ. Недооценённый топ-бомбардир,17,2017-11-16T13:14:21.000Z,58788,3178,50,139,False
ЮТУБ ХАТА,10,17.16.11,Купил ЖИГУ ДЛЯ ЗИМНЕГО ДРИСТА,2,2017-11-15T16:38:07.000Z,57140,5635,219,449,False
LizzzTV,10,17.24.11,Вызов (2 сезон) - 100 000 рублей,24,2017-11-23T11:58:47.000Z,151357,11429,738,653,False
TEXNO OLAM,10,18.15.03,ТЕЗКОР ХАБАР! Ш.МИРЗИЁЕВ  УСМАН БАРАТОВ ВА АЛИШЕР УСМОНОВГА МУРОЖААТ,25,2018-03-14T14:30:00.000Z,52141,3129,105,498,False
Easy Money,10,17.14.11,ЛЕГКИЕ ДЕНЬГИ | ВЫПИТЬ КУМЫС ЗА 60 СЕКУНД,22,2017-11-12T08:25:48.000Z,332741,8358,2228,966,False
Последние новости дома 2,10,17.17.11,БОРОДИНА ОТКРОВЕННО ПРО ЖУЖУ И БУЗОВУ (ondom2.com),22,2017-11-16T14:00:01.000Z,14157,25,11,7,False
Канал фактов и интересных фото,10,17.23.11,"Одичалый кот очень боялся людей, но доброта творит чудеса...",22,2017-11-22T11:10:58.000Z,17955,751,17,50,False
overbafer1,10,17.21.11,Курсор писюн | Навальный | спи нах*й,22,2017-11-20T16:40:14.000Z,90646,7256,286,981,False
Михаил Лидин,10,17.19.11,Юлий Далецкий (Ч.2) - интервью о фарсе Битвы экстрасенсов и разоблачение,29,2017-11-18T10:07:11.000Z,43210,2013,113,254,False
Что? Где? Когда?,9,17.20.11,Онлайн-трансляция из Нескучного сада 19 ноября 2017 года,24,2017-11-19T22:52:32.000Z,46132,391,117,139,False
Warner Bros. Pictures,9,17.17.11,RAMPAGE - OFFICIAL TRAILER 1 [HD],24,2017-11-16T21:15:08.000Z,2585851,40780,3499,8834,False
РАЙЗ,9,17.14.11,ЧТО Я УКРАЛ В ШАНХАЕ,20,2017-11-13T13:49:07.000Z,86058,9600,319,640,False
BELKA LIFE,9,18.15.01,"Бразильский предсказатель, который никогда не ошибается, о будущем Земли",22,2018-01-14T04:50:23.000Z,29450,111,44,16,False
Xeber Movqeyi,9,17.23.12,Röyadan Aygünə cavab Çalışsın qızının taleyi,24,2017-12-22T16:47:58.000Z,45380,300,68,188,False
Rustam Raxmonov,9,17.22.11,AMAK UYGA QAYTYAPTI.PASPORT EGASI TOPILDI,22,2017-11-21T00:42:54.000Z,21556,859,27,409,False
55x55,9,17.26.12,55x55 – ДУДЬ ИЛИ НЕ ДУДЬ (feat. Юрий Дудь),10,2017-12-25T19:19:05.000Z,555469,84623,6801,5954,False
MLG Highlights,9,18.19.04,Oklahoma City Thunder vs Utah Jazz Full Game Highlights / Game 2 / 2018 NBA Playoffs,17,2018-04-19T02:46:26.000Z,390899,2057,152,789,False
ДЖАРАХОВ,9,17.15.12,"T-fest, Jah Khalib, Markul & Obladaet рекламируют ТАНТУМ ВЕРДЕ ФОРТЕ",24,2017-12-14T18:43:38.000Z,508718,103094,2091,5064,False
Mewna comics,9,18.15.02,ВОСПОМИНАНИЯ.комикс.Стар против сил зла.SVTFOE comics,1,2018-02-15T12:51:47.000Z,2064,288,7,46,False
Гусейн Гасанов,9,17.20.12,Сергей Дружко хайпанул с Гусейном Гасановым. Проект Подстава.  Выпуск 6,22,2017-12-19T09:19:06.000Z,552593,37461,1474,2534,False
ДУНИК,9,17.12.12,АФЕРИСТ АНДРЕЙ ЧЕХМЕНОК - CheAnD TV 2,22,2017-12-11T13:48:40.000Z,23609,3850,61,403,False
Политика Геополитика и Экономика,9,17.14.11,Пyтun и Tpamп. Уkpauна и Европа. Что ждет мир? 12.11.2017,22,2017-11-12T15:29:57.000Z,33635,125,35,79,False
Nepeta Страшилки,9,17.11.12,ЗВОНОК АНГЕЛУ-ХРАНИТЕЛЮ... ИЗ ЗЕРКАЛА! ♠ Nepeta Страшилки,22,2017-12-10T09:12:02.000Z,344771,19590,1508,4688,False
Биатлон HD,9,17.27.11,Биатлон. Одиночная смешанная эстафета. КМ. Прямая трансляция. Эстерсунд,17,2017-11-26T15:13:58.000Z,23173,222,18,10,False
БесогонTV,9,17.21.11,БесогонTV «Изображая жертву»,25,2017-11-19T22:36:22.000Z,158203,7512,599,1801,False
Amway921WOT,9,17.14.11,Стрим - PUBG - Герои не умирают,20,2017-11-13T22:53:45.000Z,81431,7543,498,21,False
Shox Tv,9,18.27.01,МИГРАНТЛАР РОССИЯГА 2-ОЙ КЕРАК ЭМАС!,1,2018-01-26T18:01:36.000Z,20557,335,63,0,True
M EVERYDAY,9,17.15.11,ДО И ПОСЛЕ -  ОЧИЩАЕМ ЗОМБИ БАНАН ОТ ЧЕРНОТЫ,22,2017-11-14T16:44:50.000Z,271230,14929,543,1584,False
Mary Senn,9,17.07.12,КОГДА ПАРЕНЬ ТЕБЯ НЕ ЛЮБИТ / СКЕТЧ,24,2017-12-06T12:32:53.000Z,314200,49631,749,2193,False
КОЗЫРНЫЙ УГОЛОК,9,17.18.12,«УСПЕШНАЯ ГРУППА — Цок-Цок» голосом ЗУСА (Гравити Фолз) [Закажи Козырного #5],23,2017-12-17T11:00:01.000Z,112716,13409,228,849,False
Hayot Uz,9,18.14.04,АНДИЖОНДА УЗ АКАСИДАН ХОМИЛАДОР БУЛГАН КИЗ ХАКИДА,22,2018-04-13T03:52:32.000Z,125367,191,171,0,True
Чоткий Паца,9,17.24.12,Время и Стекло - Тролль (ПАРОДИЯ). Барселона - Реал Мадрид 23.12.2017,23,2017-12-23T15:00:54.000Z,100097,10830,564,583,False
GalileoRU,9,17.17.11,Галилео. Волос 💇 Hair,28,2017-11-16T05:00:01.000Z,15536,549,14,61,False
ПАВЛИКИ,9,17.14.11,НОВЫЙ ПАВЛИК ДЛЯ ВРЕДНОГО ЗМЕЯ И БАТИ СПИННЕРА / ЛАВОВЫЙ ПРАНК / ПАВЛИКИ,22,2017-11-13T12:57:52.000Z,17489,1859,28,819,False
Фильмы и Сериалы Дизель Студио,9,18.04.02,Учитель в законе: Школа - школьники на уроки каникулы закончились Дизель шоу  Дизель Студио,24,2018-02-03T14:30:00.000Z,11637,216,12,34,False
Интернет против ТВ,9,18.05.05,Интернет против ТВ. Стас Давыдов VS Роман Попов,24,2018-05-04T08:13:59.000Z,78659,4956,451,305,False
Հանրային հեռուստաընկերություն,9,17.18.11,"Լավ երեկո (Ելենա Եսենինա, Սեբու) 17.11.2017",23,2017-11-17T18:37:18.000Z,32256,816,26,0,True
Crafty Sound,9,17.17.11,КВН-Обзор. Вторая 1/2 Высшей лиги 2017,22,2017-11-15T21:46:31.000Z,29923,1509,103,346,False
Полит SUN 2.0,9,17.26.12,Навальный vs. Памфилова (после отказа ЦИК в регистрации). Часть 1,25,2017-12-25T14:59:08.000Z,48232,1709,1834,556,False
Интернет 24,9,18.17.01,Грудинин разнес журналистов! Пресс-конференция 16.01.2018,22,2018-01-16T12:21:19.000Z,46959,1929,1592,1219,False
CUBE MAN,9,18.29.01,BEST CUBE #87,23,2018-01-28T12:14:48.000Z,117836,2127,435,247,False
SportsFan LIVE,9,17.25.11,ЛЫЖНЫЕ ГОНКИ 24.11.2017 ~ СПРИНТ ~ МУЖЧИНЫ И ЖЕНЩИНЫ ~ КУБОК МИРА 2017-2018,17,2017-11-24T13:38:40.000Z,13529,98,4,11,False
FC ROSTOV,9,17.20.11,Обзор матча Ростов - Амкар (0:0),17,2017-11-19T16:08:34.000Z,2900,37,3,23,False
Телеканал ЗВЕЗДА,9,17.14.11,НЕФАКТ. Операция «Березино»,25,2017-11-13T08:58:53.000Z,14871,173,11,13,False
Ярослав Сумишевский,9,17.27.11,Зрители устроили сюрприз Я. Сумишевскому на концерте,10,2017-11-26T07:19:25.000Z,13152,885,11,33,False
Анастасия Lordi,9,17.08.12,Дом-2 Новости 7 декабря 2017 (7.12.2017),29,2017-12-07T11:13:24.000Z,8508,19,9,7,False
MovieMaker,9,17.01.12,Новый Грандиозный Спойлер 8 Сезона Игры Престолов! Что Станет с ДЕЙНЕРИС?,24,2017-11-30T10:26:46.000Z,49486,1451,222,404,False
ARB KEPEZ,9,17.15.12,"Məni həbs etsələrdə, mən üzr istəməyəcəm... - Təranə Qumral",24,2017-12-14T13:44:17.000Z,29558,192,54,124,False
Kyrgyz Music,9,18.03.01,Гулжигит Сатыбеков - Керемет | Көгүлтүр от - 2018 | #Kyrgyz Music,10,2018-01-02T18:55:16.000Z,22026,493,16,65,False
Пацаны вообще ребята,9,17.10.12,Элджей & ФИЗРУК - Розовое вино (ПАРОДИЯ 2017),24,2017-12-09T07:17:44.000Z,90045,2171,338,67,False
Школа Сушиста - Виктор Бурда,9,17.16.12,Набор для суши Сэн Сой. Ролл мозаика с упаковки.,22,2017-12-15T18:38:13.000Z,9374,573,22,83,False
Оксана Маляренко,9,17.16.11,►МАНИКЮР в домашних условиях: ОШИБКИ►Часть 1►Обрезной маникюр►Снятие гель лака дома - 3 способа,26,2017-11-15T19:23:38.000Z,8535,763,33,38,False
Евгений Вольнов,9,18.08.01,БИТВА ЗА ЛЮБОВЬ,23,2018-01-07T16:48:22.000Z,26767,2306,225,931,False
Алёна Sokololof,9,17.13.12,Обзор гель-лаков TNL | Комбинированный маникюр и покрытие на клиенте,27,2017-12-12T14:09:58.000Z,10051,630,20,149,False
Фильмы и сериалы Дизель Студио,9,17.20.11,Юмористический сериал На троих: 2 серия 4 сезон 2017 | Дизель Студио -  семейные приколы Украина,24,2017-11-19T11:30:20.000Z,22526,309,14,31,False
Экспертное мнение,9,17.11.12,"После этого интервью, ты зауважаешь Навального еще больше!",28,2017-12-10T13:12:30.000Z,39054,1196,149,337,False
БИЗНЕС Online,9,17.05.12,В Минобрнауки РТ проводили Энгеля Фаттахова: «После такой школы мне никакие испытания не страшны»,25,2017-12-04T13:14:30.000Z,4388,24,8,63,False
Точка Б,9,17.23.11,ВОДИТЕЛЬ от Бога 80 УРОВЕНЬ Экстремальные водители за рулем!,2,2017-11-23T03:00:33.000Z,2228,19,4,1,False
Кибербол,9,18.07.02,FIFA 19 НЕ ВЫЙДЕТ НА КОНСОЛЯХ,20,2018-02-06T09:53:32.000Z,64327,2895,401,766,False
Primitive Technology,9,17.25.11,Primitive Technology: New area starting from scratch,22,2017-11-24T21:03:09.000Z,1783347,111684,747,12315,False
Film,9,18.09.03,"Убийство на троих - (2018) Показ фильма РУССКИЕ СЕРИАЛЫ, КОМЕДИИ 2018 мелодрама 2018",1,2018-03-08T14:38:54.000Z,22794,145,34,11,False
Дом-2 Новости с Джулией,9,17.14.11,ДОМ 2 НОВОСТИ ЭФИР 18 НОЯБРЯ 2017 (18.11.2017),22,2017-11-13T11:53:12.000Z,21130,40,34,12,False
Rap Periscope,9,17.17.11,"Kizaru о Смерти Lil Peep, конфликте с Face, Rose 044, Dead Dynasty, Смоки Мо(16.11.2017)",24,2017-11-16T14:53:53.000Z,34194,765,59,137,False
SubTatiana,9,17.29.11,VLOG.Кошкин дом.Куда в отпуск?,26,2017-11-28T18:03:25.000Z,3652,238,6,95,False
Артур Шарифов,9,17.17.12,Запускаем ЕГЭ баттлы (beta) на НАУЧ.POINT,28,2017-12-16T19:28:00.000Z,22361,1396,70,27,False
Футбол с GOAL24,9,18.26.03,КОМАНДА МЕЧТЫ СЕРХИО АГУЭРО. НИ ОДНОГО ИГРОКА МАНЧЕСТЕР СИТИ!? - GOAL24,17,2018-03-25T06:58:01.000Z,77347,2674,85,546,False
GoryashchiyeKlyuchi,9,18.10.03,КАК СДЕЛАТЬ  БАГГИ из PUBG Своими руками Buggy from Playerunknown's battlegrounds,28,2018-03-09T12:11:19.000Z,299560,29728,453,1862,False
Yulduzlar Hayoti,9,18.19.01,2017- ЙИЛДА ВАФОТ ЭТГАН УЗБЕК ШОУ БИЗНЕСИ ВАКИЛЛАРИ...,22,2018-01-18T05:34:31.000Z,80658,394,203,0,True
golovinBolgar,9,17.17.11,"Ответы на вопросы от 11.11.2017 (прот. Владимир Головин, г. Болгар)",27,2017-11-16T14:00:01.000Z,8179,345,15,0,True
insta News,9,17.15.11,Бузова и Гриценко не скрывают свои отношения💕,22,2017-11-14T17:07:14.000Z,16648,142,12,15,False
ТАРО LIFE,9,18.07.02,ОНЛАЙН-ГАДАНИЕ *ЧТО ПРОИСХОДИТ В ЕГО СЕМЬЕ?!*,22,2018-02-07T02:52:51.000Z,2564,315,6,58,False
Фашион,9,18.01.04,Bang bang bang | MEME (Пародия),22,2018-03-31T09:00:09.000Z,40726,2704,280,726,False
СПС,9,18.13.03,10 САМЫХ ПОЗОРНЫХ МОМЕНТОВ В СПОРТЕ,24,2018-03-12T11:10:50.000Z,120764,1282,212,113,False
Jamshid Hasanovich,9,17.14.11,Sevgi istirobi 54 qism  O'zbek tilida HD,22,2017-11-13T16:35:14.000Z,23694,343,22,90,False
ДПС ГИБДД УМВД РОССИИ,9,18.03.02,"«ИДПС-Квасов: жалобы, что-то меняют …»",2,2018-02-03T05:35:46.000Z,1368,142,10,23,False
RedAutumn,9,17.05.12,ESSENCE: МОЯ КОЛЛЕКЦИЯ КОСМЕТИКИ! РАЗБИРАЕМ ВМЕСТЕ!,26,2017-12-04T04:00:02.000Z,34862,1713,39,181,False
FilmSelect Россия,9,17.20.11,НОВЕЙШИЕ РУССКИЕ ТРЕЙЛЕРЫ 2017 | Неделя #46,24,2017-11-19T12:26:14.000Z,70276,744,54,45,False
КИНОПРОКАТ,9,17.26.12,"ПРЕМЬЕРА 2017 ВЖАРИЛА ЮТУБ [ БОСЯРА ] Русские детективы 2018 новинки, фильмы 2018 HD",22,2017-12-24T19:09:38.000Z,185316,248,132,34,False
ItonTV1,9,17.09.12,Я.Кедми: Признание Трампом Иерусалима - это рекламный трюк,25,2017-12-07T20:13:12.000Z,69996,1647,73,642,False
TD TV,9,17.29.12,Крымчане не могут накрыть новогодний стол!,22,2017-12-28T21:35:50.000Z,3478,629,7,408,False
ША†ЕНЁВО,9,17.22.12,СКОРО! НОВЫЙ ГОД! в чём опасность!? прот. Андрей Ткачев,22,2017-12-21T04:08:13.000Z,36616,1085,42,0,True
Валентина Когут,9,17.09.12,Процесс Загрузки: Итоги Ноября - Беседа 11 с Валентиной Когут,22,2017-12-08T08:21:56.000Z,16585,1234,44,0,True
Russia Not Today,9,17.21.11,Сечин не явился в суд. Захоронение Ленина. RNT #61,23,2017-11-20T12:27:39.000Z,56257,7042,103,312,False
Жуткие Теории,9,17.04.12,"Жуткие Теории: Финальная Теория по Привет, Сосед! – ч. 2 | Фрагмент Второй",20,2017-12-03T07:00:02.000Z,64866,4252,110,369,False
FEDUK,9,17.15.11,Feduk & Элджей - Розовое вино (Official Video),10,2017-11-14T16:32:22.000Z,869974,52309,4654,3482,False
MAD SCIENCE,9,17.16.11,ЧТО ЕСЛИ СОЕДИНИТЬ ДВЕ МУРАВЬИНЫЕ ФЕРМЫ И ЗАСЕЛИТЬ МУРАВЬЁВ?,28,2017-11-15T15:00:00.000Z,107924,3916,335,2215,False
ПОЛИТИКА ОНЛАЙН,9,17.25.12,СРОЧНОЕ ВЫСТУПЛЕНИЕ ТАтьяна Монтян 24 12 2017,22,2017-12-24T02:26:31.000Z,83092,499,135,172,False
В поиске кладов!,8,18.02.01,ДОЧЬ НАШЛА КЛАД В ЛЕСУ! ПАПА В ШОКЕ!,19,2018-01-01T10:00:03.000Z,18444,594,69,231,False
Станислав Желтковский,8,17.15.11,Белковский. На самом деле. 13 ноября,25,2017-11-13T18:42:23.000Z,78289,825,569,349,False
СТАР РЕЙ,8,17.15.12,СТРАНИЦЫ МЕРТВЫХ ЛЮДЕЙ В ВК / САМЫЕ ГЛУПЫЕ СМЕРТИ В МИРЕ,22,2017-12-14T18:33:34.000Z,13528,1964,274,286,False
ТЕРРИТОРИЯ СМЕХА,8,17.23.11,LIKE A BOSS COMPILATION #7,23,2017-11-21T21:49:07.000Z,503589,9312,678,1090,False
Cartoon Network Россия,8,17.10.12,Удивительный мир Гамбола | Картофельная солидарность | Cartoon Network,24,2017-12-09T13:00:05.000Z,43562,1432,35,131,False
Anastasia Bulla,8,17.21.11,ЗИМНЯЯ ОДЕЖДА ☃️ ШУБА ИЗ ЭКО МЕХА ❤️ МОИ ЛУЧШИЕ ПОКУПКИ,26,2017-11-20T15:13:00.000Z,37626,2089,67,254,False
Doob's Tales,8,17.17.11,КОТ ПРОПАЛ!! (Часть 2) // Леди Баг и Супер-кот Комикс,1,2017-11-16T11:30:00.000Z,41819,8209,17,436,False
SPORT - LIFE,8,18.07.05,6APCEJlOHA - PEAJl MAДPuД 2:2 ОБЗОР МАТЧА HD,24,2018-05-06T20:40:55.000Z,20425,374,12,93,False
Все про все!,8,17.21.11,БЕШАННАЯ ЗАРПЛАТА В  МОСКВЕ,22,2017-11-20T15:03:34.000Z,6981,378,12,158,False
КРУТОЕ ВИДЕО,8,17.14.11,НАВАЛЬНЫЙ 2018:ОЛИГАРХИ ОБЪЯВИЛИ ЗАБАСТОВКУ!,25,2017-11-13T15:12:32.000Z,66883,4731,497,942,False
Валерий Медведев,8,18.07.04,Выращивание рассады. Почему я поздно сею семена,26,2018-04-06T16:00:48.000Z,8439,549,16,55,False
Фыр-Фыр Шоу,8,18.09.03,Фыр Фыр Шоу #5 ЙЕГЕНКЯНИС / Никита Златоуст и Тимоха Сушин,24,2018-03-08T14:08:25.000Z,50010,5470,47,1216,False
Muvad Video,8,18.18.01,Obid Asomov - Sizlarni sog'indim nomli konsert dasturi 2018,22,2018-01-16T18:35:46.000Z,133276,1733,389,508,False
Dasha Trofimova,8,17.21.12,УНИВЕРСАЛЬНАЯ И КРАСИВАЯ ВЕРХНЯЯ ОДЕЖДА. СОВЕТЫ СТИЛИСТА.,26,2017-12-20T14:39:20.000Z,21120,813,102,97,False
Oleg Larionov,8,17.30.11,новости 29 ноября для глухих! ziņas zimju valoda! deaf news!,25,2017-11-29T06:56:32.000Z,4452,551,2,103,False
7-канал Кыргызстан,8,17.15.11,13 11 2017   Кабар - 7-канал,29,2017-11-14T04:20:20.000Z,37560,113,36,66,False
Дедушка Ау,8,17.28.12,Виталина:  Горбатый младший хулиган .Новые планы.,20,2017-12-27T09:07:51.000Z,25926,47,69,234,False
AVTO CLASS,8,17.14.11,Сделай и себе это простое и незаменимое приспособление которое обязательно вам пригодится,28,2017-11-13T13:47:53.000Z,98920,1095,369,87,False
Dmitry Trotsky,8,17.07.12,«Хочу Денег» - Лекция Дмитрия Троцкого,27,2017-12-06T19:18:17.000Z,9125,490,14,0,True
Marie Novosad,8,17.13.12,Как Построить Пряничный Домик Трезвыми #бойсадули,26,2017-12-12T13:08:40.000Z,58812,3849,209,144,False
Blockchain TV,8,17.18.12,Эфир наносит ответный удар. Первая биткоин карта. Биткоин бьет рекорд ► Token News. Выпуск #3,28,2017-12-17T17:01:16.000Z,142624,2117,586,164,False
PLAYBOYZ TV,8,18.16.04,ШКУРА ПОВЕЛАСЬ НА ПОБЕДИТЕЛЯ ЛОТЕРЕИ И БЫЛА НАКАЗАНА,24,2018-04-15T14:24:06.000Z,88998,3523,142,369,False
Video News,8,17.14.12,Подруга рассказала о погибшей участнице Дома 2,22,2017-12-13T16:00:12.000Z,7811,11,3,6,False
Bukreev,8,18.07.02,27 ВЕЩЕЙ С ALIEXPRESS КОТОРЫЕ ТЕБЯ ШОКИРУЮТ! УНИКАЛЬНЫЕ ТОВАРЫ ALIEXPRESS!,24,2018-02-06T16:08:15.000Z,26555,2671,180,302,False
Канал Стинта :3,8,17.14.11,#МОЙ ОТЕЦ,28,2017-11-13T11:47:53.000Z,163041,25462,420,3210,False
БудниАквариумиста,8,17.20.12,КРИВЫЕ РЫБКИ!!!,15,2017-12-19T23:21:15.000Z,3666,396,27,84,False
Maryana Ro,8,17.12.12,Марьяна Ро & FatCat - Мега-звезда,22,2017-12-11T15:11:45.000Z,1581038,205157,92537,68596,False
Ai Mori,8,17.24.12,КОРПОРАТИВ | Ai Mori,10,2017-12-23T07:49:05.000Z,100627,2553,71,184,False
МАМА Отличника,8,18.20.03,Обзор моей ванной комнаты и туалета ! Делаю уборку в квартире !,22,2018-03-19T16:11:34.000Z,12434,564,25,97,False
Ислам Исмаилов,8,17.16.11,СтопХам-Опереточный злодей,2,2017-11-15T07:58:18.000Z,144596,4396,834,385,False
Время и Стекло,8,18.19.02,Время и Стекло - Золотая кнопка YouTube,24,2018-02-18T11:03:33.000Z,216202,19238,360,2592,False
MERRY TV,8,18.10.02,рисование акварелью рисование космоса и простые рисунки,26,2018-02-09T11:15:46.000Z,116989,5293,117,312,False
SonyPicturesRU,8,18.07.02,Антон Беляев - Лететь (OST фильма Лёд),1,2018-02-06T09:07:00.000Z,134194,635,63,30,False
МИРадио инфо,8,18.04.01,ЖЕНЩИНЫ и ДАДЖАЛЬ,29,2018-01-04T03:00:01.000Z,2790,306,5,15,False
FunTime Приколы,8,18.12.01,ЛУЧШИЕ ПРИКОЛЫ 2018 ЯНВАРЬ #3 | Лучшая Подборка Приколов | ТОПОВЫЕ ПРИКОЛЫ - Ржака до слез,24,2018-01-10T13:45:55.000Z,88460,857,291,84,False
MysteryForce,8,17.01.12,ЛУЧШИЕ СЕКРЕТЫ В СЕРИАЛАХ,24,2017-11-30T14:10:44.000Z,52326,4209,50,444,False
LandNews,8,17.18.12,Марш Саакашвили в Киеве 17.12.2017,25,2017-12-17T19:59:08.000Z,434910,5261,1891,796,False
Save Me,8,18.10.05,СРОЧНО! ПУТИН В ШОKE ОТ СЛОВ Сергея МИХЕЕВА! 10.05.2018,25,2018-05-07T19:05:34.000Z,15404,115,24,47,False
PutinTeam,8,18.20.01,Дарить радость – руководство к действию #ятожедоброволец,22,2018-01-19T05:55:18.000Z,175542,1609,6533,0,True
УГОЛ ЗРЕНИЯ,8,18.07.03,Абсолютно пьяная Цымбалюк-Романовская откровенно издевалась над Арменом Борисовичем,29,2018-03-06T08:29:23.000Z,33622,49,55,101,False
[В] БИАТЛОНЕ,8,17.26.11,"Интервью Сливко, Подчуфаровой, Цветкова, Бабикова, Домрачевой, Пайффера (Эфир от 25.11.2017)",17,2017-11-25T11:37:20.000Z,5745,124,3,8,False
TOP TV,8,17.14.11,"Ful Haus 7 eterashrjan seria 11 / Фулл Хаус 7 сезон серия 11 / Ֆուլ հաուս, 7-րդ եթերաշրջան, Սերիա 11",22,2017-11-12T18:50:42.000Z,105052,744,100,69,False
Milliy TV,8,18.01.03,Otalar So'zi - Pushaymon (24.02.2018),24,2018-02-28T13:40:50.000Z,43440,722,45,118,False
Виктория Гарсия-Берналь,8,18.02.02,Независимость СМИ. Познер и Собчак,22,2018-02-01T21:33:25.000Z,1881,205,28,168,False
News Mews,8,17.16.12,News Mews #2  Олимпиада и день котституции,22,2017-12-15T07:34:15.000Z,63566,654,342,140,False
СТРИМЕРША КАРИНА,8,17.07.12,МУЖИК НЕ ДОЛЖЕН: ОТВЕТЫ НА ВОПРОСЫ,20,2017-12-06T18:05:43.000Z,54071,9453,486,1299,False
ЭТНОМЕДИА - КИНО,8,18.04.03,ТАКСИСТ | Кыска Метраждуу Кино - 2017 | Режиссер - Мансур-Бек Канназар,1,2018-03-03T17:01:14.000Z,14752,349,7,50,False
Китай Мастер,8,17.20.12,Нереально крутая самоделка. Сделай и себе это простое приспособление,22,2017-12-19T12:59:22.000Z,174382,6514,258,296,False
Roman Milovanov,8,17.30.12,Сила Мысли (создание мыслеформы).,22,2017-12-30T01:54:23.000Z,3856,539,7,60,False
Еще Руслан Усачев,8,17.22.11,НЕУДАЧНЫЕ ДУБЛИ: Пора Валить в Казань!,22,2017-11-21T17:26:14.000Z,80608,10418,68,353,False
GMD13,8,17.11.12,ПОЛНЫЙ СЮЖЕТ ИГРЫ ПРИВЕТ СОСЕД?! ПРИВЕТ СОСЕД ПОЛНАЯ ВЕРСИЯ СЕКРЕТЫ ПАСХАЛКИ ТЕОРИИ HELLO NEIGHBOR,20,2017-12-10T19:17:47.000Z,5830,513,6,100,False
Джули По,8,17.27.11,РАСА ДРАКОНОВ - древние маги,22,2017-11-26T04:56:43.000Z,10473,610,27,124,False
LDPR_Russia,8,18.20.01,ШОК! ГРУДИНИНА ВЫВЕЛИ НА ЧИСТУЮ ВОДУ!,22,2018-01-18T05:20:34.000Z,155224,8163,8483,2222,False
Domino Show,8,18.06.04,10 УГАРНЕЙШИХ СИТУАЦИЙ,27,2018-04-05T14:50:10.000Z,56187,2014,117,443,False
Max TV,8,18.01.01,10 самых ГИГАНТСКИХ КОНСТРУКЦИЙ из ЛЕГО,24,2017-12-30T09:00:02.000Z,103130,1223,88,77,False
Бар в большом городе,8,18.08.03,"Бар в большом городе. Выпуск 3: Александр Гудков, Марина Федункив, Манижа",23,2018-03-07T08:14:13.000Z,55177,1838,102,201,False
NiceeTV - лучшие вайны,8,18.03.04,Новые вайны инстаграм 2018 | Ника Вайпер/ Не Мажоры/ Хоменко/ Александра Лукьянова [202],23,2018-04-02T10:00:03.000Z,113716,2311,185,133,False
Nataly Gorbatova,8,17.12.12,БЫСТРАЯ УБОРКА ДОМА! Порядок и уют ВСЕГДА! Nataly Gorbatova,22,2017-12-12T03:00:01.000Z,5599,466,25,94,False
PFC CSKA Moscow,8,17.27.11,Обзор матча: Рубин – ПФК ЦСКА – 0:1,17,2017-11-26T15:05:17.000Z,13358,268,4,25,False
Л.И.С.,8,18.20.01,ЛОЗАНСКИЙ ОТКРЫВАЕТ ГЛАЗА ГОРДОНУ I В СТУДИИ ШОК | ТАКОГО НА УКР ТВ НЕ ОЖИДАЛИ #4,25,2018-01-19T16:49:03.000Z,61572,565,170,733,False
VALERON 2%,8,18.19.04,"РОССИЙСКИЙ СМАРТФОН ЕЛДАК! КАК ТЕБЕ ТАКОЕ, ИЛОН МАСК?",22,2018-04-18T11:47:20.000Z,78414,15799,17514,4874,False
ZAMONA UZ LIFE,8,17.04.12,АГАР ЭРИНГ УРУШСА таъсирли хикоя,22,2017-12-03T14:17:07.000Z,4191,101,5,5,False
В Поисках Клада от Влада,8,17.04.12,НЕ ОЖИДАЛИ ЗАЦЕПИТЬ МОТОЦИКЛ В БОЛОТЕ  ПОИСКОВЫМ МАГНИТОМ! В Поисках Клада от Влада!,19,2017-12-03T05:00:00.000Z,66434,1928,239,427,False
Михаил Ходорковский,8,18.17.01,Выборы 2018: кот или бойкот?,25,2018-01-15T15:58:44.000Z,72384,4900,1969,1241,False
Nao Comics,8,18.24.02,ПОСПИ СО МНОЙ комикс Стар Против Сил Зла,22,2018-02-23T14:00:25.000Z,11865,1156,35,63,False
RozhinTV,8,17.09.12,Уборка в свинарнике // Время на очистку свинарника  // Жизнь в деревне,15,2017-12-08T16:21:21.000Z,5069,336,23,78,False
Северный ПроектЪ,8,18.02.01,Стандарты Плоской Земли постепенно взломают твой мозг и перекодируют его,22,2018-01-01T12:09:08.000Z,12827,244,40,95,False
Mr DeKart,8,18.09.01,ОЙ КАК НАМ ВЕСЕЛО!,20,2018-01-08T15:30:01.000Z,9680,821,15,387,False
Online,8,17.27.11,Привет от аиста 4 серия ( Мелодрама ) от 26.11.2017,1,2017-11-26T06:19:52.000Z,15154,49,12,4,False
Веб Рассказ,8,17.18.12,"Загадочные технические устройства, исчезнувшие в ХХ веке.",28,2017-12-16T17:22:59.000Z,53482,1948,124,300,False
NevexTV,8,17.17.11,Невзоровские Среды 15 11 2017,25,2017-11-15T23:09:09.000Z,90674,2797,178,597,False
Андрей Колесник,8,18.12.03,Моуриньо - актер больших матчей. Валенсия снова в ЛЧ. Роналду пойдет на бомбардира?,17,2018-03-11T17:07:56.000Z,59613,4947,78,265,False
А ну-ка Давай-ка,8,18.19.01,"ПОМОЖЕМ КАНАЛУ ПОЗНАВАТЕЛЬ ! СМЕШНОЙ КОТ МАЛЫШ, КОШКА МУРКА И ЖЕЛЕЙНЫЙ МЕДВЕДЬ ВАЛЕРА ПРОТИВ ЖУЛИКОВ",24,2018-01-19T05:00:00.000Z,24148,2355,62,846,False
Кухня на любой вкус с Еленой Ус,8,18.15.02,"Чудесный Салатик, который никогда не надоест! Мега вкусно и мега быстро!",26,2018-02-15T11:00:03.000Z,5592,687,12,11,False
OLESYAGES NAILS,8,18.05.01,Клюющие ногти/Поднятие гелем без форм и фрезера/Самы сложные ногти ДО-ПОСЛЕ,22,2018-01-04T13:42:10.000Z,7656,680,16,55,False
Булбул Кыргызстан,8,17.08.12,ЧАЛА СПОРТИК Азамат ЧУБАК Ажы жонундо эмне дейт?,24,2017-12-07T04:57:44.000Z,48486,2892,79,553,False
Зайка Julia ZOOBE,8,17.11.12,Зайка ZOOBE Для любимой подружки- И так каждый Новый Год!,23,2017-12-10T09:27:34.000Z,14770,290,16,7,False
Mari Link,8,17.24.11,ФИКС ПРАЙС КРУТЫЕ НОВИНКИ / НОЯБРЬ 2017 / Покупки и Обзор полочек + DIY Fix Price ✿ Mari Link ✿ #97,22,2017-11-23T18:13:51.000Z,10814,750,29,68,False
Капитал,8,17.21.11,"Николай Спиридонов и Дмитрий Джангиров, Работа над ошибками, выпуск #344",25,2017-11-20T10:03:49.000Z,15766,544,26,120,False
Андрей Половинкин,8,17.20.11,Керченский Мост 19 11 2017,22,2017-11-19T17:06:59.000Z,5794,125,1,71,False
Мировые НОВОСТИ,8,18.06.01,ЭТО ПРОИЗ0ШЛО 05 01 2018 СЛYЧuЛ0СЬ СТРАШН0Е,22,2018-01-05T06:00:01.000Z,29165,173,119,123,False
PRO АВТО,8,17.27.11,50 рублей за литр! Цена на бензин в 2018 испугает любого.,2,2017-11-26T15:48:26.000Z,2336,40,17,38,False
FC KEFIR,8,17.20.12,FIFA 18 - KEFIR VS STAVR | СПАРТАК VS ЛОКОМОТИВ,20,2017-12-19T11:25:29.000Z,170168,13993,816,470,False
История. Здравый смысл и никакой магии.,8,18.06.01,А был ли Питер??,22,2018-01-05T11:39:51.000Z,4884,200,8,103,False
ShowNews Online,8,18.23.02,Сенсационный поворот в жизни Цымбалюк Романовской  (22.02.2018),24,2018-02-22T14:54:13.000Z,40970,218,74,186,False
Movie Hall,8,18.14.01,"НОВАЯ премьера 2018! Я ЛЮБЛЮ СВОЕГО МУЖА 4 серия (2018 ) Русские мелодрамы 2018, новинки hd 2018",1,2018-01-13T15:00:00.000Z,51401,301,71,43,False
Тимати,8,17.25.11,Тимати - Главный хит ТВФ,10,2017-11-24T11:25:18.000Z,138779,6197,851,363,False
Resumenes FUT,8,18.28.01,Valencia vs Real Madrid 1-4 Resumen Highlights La Liga 27/01/2018,17,2018-01-27T17:14:23.000Z,1102708,9935,977,3239,False
Olga Shelest,8,17.01.12,Шелест. Откровенное интервью. Гость - модель и телеведущая Виктория Боня,22,2017-11-30T06:59:54.000Z,5581,128,9,20,False
Sobaka Fun,8,18.20.02,Искупал хулигана Валентина🐶🛁 Доброе видео❤️😊,1,2018-02-19T21:50:46.000Z,4384,863,3,132,False
TheBrun,8,18.16.04,КТО ЗАСМЕЯЛСЯ ИЛИ УЛЫБНУЛСЯ - ПРОИГРАЛ ! ) ) ) #3,23,2018-04-15T09:00:01.000Z,110220,5186,256,475,False
Полит OBOZ,8,18.05.01,Украину вытолкали из переговоров и приравняли к ЛДНР. Карасев.,25,2018-01-04T13:31:12.000Z,13820,73,10,39,False
Aimak Akipress,8,17.28.11,Жол кырсыгынан каза болгон бир тууган Марифовдор жерге берилди,22,2017-11-27T12:06:29.000Z,44137,99,45,125,False
NOVOSTI,8,18.15.02,"ΡOCCИИ ΗУЖHA ΗOBAЯ BΛACТЬ, ДAЮ ПУТИНУ 30 ДΗΕЙ, ЧТΟБЫ УЙΤИ — ПАВЕЛ ГРУДИНИН — 15.02.2018",29,2018-02-15T10:00:02.000Z,1784,222,9,61,False
К - Коминтерн,8,18.19.01,Грудинин опять врет,22,2018-01-18T06:06:31.000Z,244011,8043,7427,1930,False
JATELID UZ,8,18.26.02,ИИББ КУНДАЛИК ИШИ  КУРСАТИЛДИ,22,2018-02-26T03:26:46.000Z,6168,80,21,0,True
SUPER Мишка,8,17.20.11,15 КРУТЫХ ВЕЩЕЙ ДО 100 рублей с ALIEXPRESS И GEARBEST/ ОФИГЕННО КРУТЫЕ ТОВАРЫ С КИТАЯ (АЛИ),24,2017-11-19T15:13:19.000Z,35466,1578,91,246,False
РОССИЯ ЗАВТРА,8,17.19.11,"Сванидзе, Красовский, Белковский / Грани недели / 18 ноября 2017",25,2017-11-18T17:20:21.000Z,12326,143,14,24,False
KG TUBE media kanal,8,18.23.03,МЫНА САГА Москвада метродо орусстар КЫРГЫЗ ырына бийлеп интернет Жарышты !,22,2018-03-21T22:06:53.000Z,40265,616,244,189,False
ScortyShow,8,17.19.11,КАК ОСТАНОВИТЬ САМЫЙ БЫСТРЫЙ ПОЕЗД ЭКСПЕРИМЕНТЫ ГТА 5 МОДЫ ОБЗОР МОДА GTA 5 веселая игра как мультик,20,2017-11-18T07:00:05.000Z,76892,3572,367,444,False
justintimberlakeVEVO,8,18.03.01,Justin Timberlake - INTRODUCING MAN OF THE WOODS,10,2018-01-02T15:00:04.000Z,725305,21238,1053,2861,False
Огненное ТВ,8,17.26.11,"20 экспериментов с МИКРОВОЛНОВКОЙ, которые лучше не повторять.",28,2017-11-25T09:18:11.000Z,97068,4401,157,544,False
Peredelka TV,8,17.11.12,"Дачный ответ от 10.12.2017, Мансарда с ковром-самолетом",22,2017-12-10T09:55:05.000Z,10098,94,11,16,False
ТЕЗКОР ХАБАР,8,18.28.05,"Салохнинг юклиги ФИНАЛГА кандай тасир курсатди, уйиндан кейинги тулик интервюлар.",17,2018-05-27T08:24:34.000Z,31391,2042,129,634,False
НеСпойлер,8,17.21.11,Воландеморт возвращается? Разбор тизера Фантастические Существа 2,22,2017-11-20T10:25:53.000Z,64727,3481,97,307,False
ВАЛЕРОН 2%,8,18.30.01,МИТИНГИ 28 ЯНВАРЯ: КАК ЖИРИНОВСКИЙ МИМО ПРОЕЗЖАЛ!,22,2018-01-29T11:43:01.000Z,55489,4786,483,1878,False
Azazin Kreet,8,17.21.12,Ваши истории VK # 1 (by Azaзель),22,2017-12-19T16:20:43.000Z,355931,45598,2477,9521,False
"Привет, я Марк",8,18.18.01,ПОСТАРАЙСЯ НЕ ЗАЛИПНУТЬ - ЛИЗУНЫ (очень приятные видео включай и расслабься),23,2018-01-17T13:00:04.000Z,84736,8155,287,1432,False
FaktUra!,8,17.21.11,Сергей Михеев про CKАHДAЛ со школьником из Нового Уренгоя сожалеющего о cмepти coлдaт вepмaxтa,25,2017-11-20T12:50:27.000Z,58748,1017,106,1144,False
ArtPolitical Games,8,18.05.02,Тайна раскрыта! Почему Грудинин исчез с федеральных каналов?,25,2018-02-04T08:44:11.000Z,111313,3683,6159,1467,False
Открытый Диалог,8,18.12.02,ГРУДИНИН против ПУТИНА: рейтинг меняется ... Дмитрий Орешкин,29,2018-02-11T15:35:34.000Z,8367,249,41,144,False
ANOIR,8,17.18.12,Бездарность Зака Снайдера,24,2017-12-17T12:18:21.000Z,95866,15004,1165,1097,False
Суть Вещей,8,18.04.01,✅ Слово о Путине,29,2018-01-04T00:19:13.000Z,2854,289,35,145,False
20th Century Fox Russia,8,17.16.11,Дэдпул 2 | Уроки живо писи | HD,22,2017-11-15T14:00:03.000Z,386507,11694,985,576,False
Koffkathecat,8,17.21.11,"РАЗБОР КОСМЕТИКИ: ПРАЙМЕРЫ!!! Что выбрасываю, что оставляю?",26,2017-11-20T16:05:29.000Z,24798,1422,36,135,False
NewTV KG,8,18.24.01,Асель Турдалиева: Үйүбүздүн жабык турганы өкүндүрөт..\Ааламга жол,22,2018-01-23T08:17:16.000Z,40724,362,52,72,False
MarsOne,8,17.15.11,На самом деле - На детекторе лжи Гоген Солнцев и его мать: за что ты желаешь мне смерти? (14.11.17),25,2017-11-14T09:37:02.000Z,55454,78,59,131,False
BILLUR TV,8,18.02.01,Samandar Hamroqulov ASMAni uyaltirdi!,22,2018-01-01T17:25:39.000Z,28628,486,92,246,False
КОЛИЗЕЙ СОБЫТИЙ,8,17.23.11,Яков Кедми: Мировые лидеры аплодируют Путину. Ему удалось решить «нерешаемый вопрос» 22.11.2017,22,2017-11-22T15:14:16.000Z,10778,121,19,22,False
Евгений Бондаренко³,7,18.25.03,СОБРАЛ САМЫЙ СТРАННЫЙ КУБИК РУБИКА В МИРЕ | ГОЛОВОЛОМКА КОЛЕСО МУДРОСТИ,22,2018-03-24T15:22:54.000Z,56833,3343,55,919,False
Павел Раков,7,17.21.12,САМА СЕБЕ ВОЛШЕБНИЦА! новогодний курс Павла Ракова | УРОК 2,22,2017-12-20T17:30:48.000Z,5616,183,10,5,False
АТМОСФЕРА,7,18.11.02,"Воронеж в ИСТЕРИКЕ.НЛО сел прямо на детскую площадку,а 3-х метровые гуманоиды вели себя как хозяева",22,2018-02-10T15:35:29.000Z,20427,78,33,21,False
ЖИВОЙ ФУТБОЛ - freekicksRUS,7,17.27.11,СУХОЙ ЛИСТ. Челлендж vs ПРОФИ,17,2017-11-26T15:10:50.000Z,148765,9774,96,466,False
Политпрогноз,7,17.03.12,ПУТИНА ЖДЕТ КРАХ  ВЫБОРЫ 2018   Таро-прогноз,22,2017-12-02T18:52:59.000Z,2338,143,15,33,False
Prokaznik Show,7,17.18.11,Сделай и себе это нужное и простое приспособление из ОБЫЧНОЙ НАСАДКИ. Крутая самоделка. Советы. DIY,28,2017-11-17T14:30:46.000Z,130833,3642,197,228,False
Хайповый Бизнес,7,17.19.12,Cinemood стартап из России вышел в США | Культовые Lamborghini в Питере,22,2017-12-18T11:48:25.000Z,120876,1824,741,224,False
eralah987,7,18.17.03,Команда Собчак сняла подготовку провокации против Грудинина.,29,2018-03-16T14:53:17.000Z,298429,9842,6598,6925,False
ACE,7,18.23.04,РАЗЛОМ iPad Pro 12 9 !,24,2018-04-22T14:37:06.000Z,39880,1311,298,393,False
BlackSilverUFA,7,17.17.11,ЭТО ПРЯМ ПИЛА! КОНЦОВКА 1 ● Hidden Agenda #3 [Cкрытая повестка] PS4 Pro,20,2017-11-16T12:41:40.000Z,29035,2164,86,303,False
Скруджи,7,17.21.12,"Скруджи feat. Павел Мурашов — Пьяный (премьера клипа, 2017)",10,2017-12-21T05:05:43.000Z,33836,621,314,89,False
Life On The Road (судьба дорога),7,17.20.12,"439 Дальнобой США. Воскресенье,понедельник.вторник",2,2017-12-20T05:28:10.000Z,2299,281,8,40,False
KG video KYRGYZ,7,18.25.02,ПАЙГАМБАР МУХАММАД с.а.вГА АРНАЛГАН ЫР ЭКЕН ОТО МЫКТЫ🤗👍,22,2018-02-25T05:05:37.000Z,1378,186,0,14,False
Amazing channel,7,18.07.01,"Супер квест # 1 Аватары  (Дракон, генетические эксперименты)  .",28,2018-01-06T22:43:57.000Z,4928,359,20,70,False
it's time,7,18.15.02,КОГДА РАСКРАСКИ ПОПАЛИ К ВЗРОСЛЫМ 2Ч,24,2018-02-15T11:00:03.000Z,3347,348,24,200,False
darvoz show official,7,18.23.03,Фарзонаи Хуршед Фируза Хафизова Ситоари Кароматулло Мино - Навруз муборак,29,2018-03-22T06:15:13.000Z,32397,157,157,98,False
ЖИЗНЬ АНОНИМА,7,18.17.04,Пример неудачного собеседования,22,2018-03-26T15:18:16.000Z,9384,162,9,86,False
kraschp,7,17.14.11,Красноярский рабочий - 26 Бакинский Комиссаров 13.11.2017,22,2017-11-13T04:06:38.000Z,10659,8,3,2,False
SobiNews & WhotorTV,7,18.03.03,РАДЗИХОВСКИЙ: О Послании ПУТИНА и о его гипер-мега-ракетах. SobiNews & WhotorTV,29,2018-03-02T11:57:27.000Z,79959,2533,202,522,False
SportsFan,7,17.29.12,БИАТЛОН 28.12.17. POЖДЕСТBEHСКАЯ ГOHКА 2017. ГOHKA ПPECЛЕДОВАНИЯ,17,2017-12-28T18:59:27.000Z,9948,93,7,12,False
• Сильно сказано •,7,18.04.01,КУДА БЕГУТ УКРАИНСКИЕ ПАТРИОТЫ? Ростислав Ищенко. 03.01.2018 • СИЛЬНО СКАЗАНО •,25,2018-01-03T15:39:44.000Z,18623,125,34,65,False
Verakso,7,17.17.11,"наращивание ногтей, сама себе) Мрамор на ногтях. Дизайн ногтей 37",27,2017-11-16T16:00:05.000Z,6892,646,6,54,False
ТилльНяшка,7,17.13.12,КАК ПОДГОТОВИТЬСЯ К НОВОМУ ГОДУ?,26,2017-12-12T09:24:18.000Z,108758,12595,151,1980,False
Социальные Новости,7,18.23.01,Пловцы сняли клип Satisfaction Challenge в поддержку ульяновских студентов,25,2018-01-22T13:29:21.000Z,64668,3412,591,339,False
Садхгуру — официальный канал на русском,7,18.13.01,Не относитесь к жизни слишком серьезно — Садхгуру,22,2018-01-12T16:00:05.000Z,7099,546,3,22,False
BANGTANTV,7,17.16.11,[PREVIEW] BTS (방탄소년단) 2018 Season’s greetings coming,10,2017-11-15T15:00:10.000Z,1002924,237308,299,11933,False
Алексей Ковалев,7,17.29.12,Грудинин ПОБЕДИТ Путина  - Это нас ждет в 2018 году?! 28.12.2017,22,2017-12-28T17:09:53.000Z,8010,153,70,141,False
ГОЛОС МИГРАНТА,7,17.17.12,Каромат Шарипов: Сухбат дар самолёт бо Мухочирон.,22,2017-12-16T05:48:18.000Z,74360,2501,56,334,False
Вечное Лето (Жизнь в Тайланде),7,17.21.11,"День рождения Светы на Пхукете - подарки, Рок Бары и дискотека на Бангле, Таиланд",19,2017-11-20T09:40:56.000Z,26321,1517,194,266,False
SHANT NEWS,7,18.20.04,Ընդդիմադիր ակտիվիստների բողոքի ակցիա Երևանում. 19.04.2018,25,2018-04-19T21:05:39.000Z,177552,1083,76,1,False
Рыбалка с Romario Agro,7,18.31.01,Зимняя Рыбалка.Рыболовный Рай На Земле-Матушке. Ловля на Балансир.,26,2018-01-30T08:39:01.000Z,104578,5774,124,628,False
DICHARA,7,18.15.04,Мои родители сказали НЕТ! Но я сделал это в любом случае  История Ютубера Дэвида Пароди(Storybooth),1,2018-04-14T11:20:07.000Z,36649,1766,80,139,False
Валерий Виноградов,7,18.11.03,Да ни по кому мы не бахнем! О путинском маразме,22,2018-03-10T14:17:59.000Z,16595,0,0,739,False
Канал здравого смысла: блог Евгения Понасенкова,7,17.01.12,"Е. Понасенков: мельдоний, причина неудачи Украины, Райкин в Одессе, Египет, брак Пугачевой",24,2017-11-29T15:24:17.000Z,79863,4130,229,470,False
Ночной Контакт,7,18.19.01,Интернет-шоу Ночной контакт. Промо №2. Премьера с 25 января каждый четверг в 20:00.,24,2018-01-18T05:54:05.000Z,136660,2711,1295,248,False
GVR AUTO SHOW,7,17.24.11,ДЕЛАЕМ ПИКАП ИЗ ТАЗА! - БАНДИТКА ДЕВЯТКА #4,2,2017-11-23T12:15:54.000Z,112590,9094,3974,3664,False
Maxik,7,18.04.02,АРСЕНАЛ - ЭВЕРТОН 5:1 ОБЗОР МАТЧА 03/02/2018,17,2018-02-03T19:51:43.000Z,12087,117,9,15,False
Дарья Шулунова,7,18.13.02,дизайн ногтей. Весенние цветы. Готовимся к 8 марта. Цветы китайская роспись,26,2018-02-12T11:44:38.000Z,4112,687,11,53,False
Личное Мнение,7,18.27.01,ВАТНОСТИ №2,22,2018-01-26T21:10:52.000Z,3767,1536,7,333,False
TAMASHOW PRODUCTION,7,17.19.12,ТАМАШОУ ФИНАЛ 9-СЕЗОН ОЮН ТОЛУГУ МЕНЕН | КАНАЛГА ЖАЗЫЛ,23,2017-12-18T16:03:02.000Z,26562,867,46,269,False
Warface,7,17.22.11,Королевская битва в Warface: играй бесплатно!,20,2017-11-21T08:02:55.000Z,60406,1567,122,346,False
Дима играет,7,18.05.03,Важно! Смотреть всем! Болдырев Ю.Ю. на дебатах 05.03.2018 Первый канал,25,2018-03-05T02:54:44.000Z,35549,2491,69,1061,False
Илья Куликов,7,18.15.03,Полицейский с Рублёвки 3. Life 18 - 1.,1,2018-03-15T01:29:55.000Z,2331,85,3,12,False
"PROТанки - моды, игры, железо",7,17.21.11,ЭТИ ТАНКИ ЗАМЕНЯТ В 2018 ГОДУ? ● ОГРОМНЫЙ СПИСОК ТАНКОВ НА ЗАМЕНУ,20,2017-11-21T04:00:00.000Z,41272,4913,249,517,False
Сэм,7,18.18.02,МИФЫ FNAF - ПИЦЦЕРИЯ ЭЛИС - ПИЦЦЕРИЯ ПОСЛЕ FNAF SISTER LOCATION,20,2018-02-17T08:13:04.000Z,27594,1707,94,386,False
Elli Di Online,7,18.03.02,Коптер скрытая камера Где живет Элли Ди Карибы остров Кюрасао | Elli Di Online,22,2018-02-02T15:17:11.000Z,71818,6717,104,1504,False
Рейтинг Букмекеров,7,17.10.12,КОНКУРС! Выиграй iPhone X,17,2017-12-09T05:00:19.000Z,102887,1827,188,613,False
YouFact,7,18.18.02,"10 ШКОЛЬНЫХ ПОЕЗДОК, КОТОРЫЕ ПЛОХО ЗАКОНЧИЛИСЬ",24,2018-02-17T09:56:43.000Z,52529,1637,167,192,False
Russia Paver,7,18.05.01,Я ОГРАБИЛ ДОМ В ВИАР ХОРРОРЕ (ИГРАЮ В ВИАР ШЛЕМЕ),20,2018-01-04T17:01:35.000Z,38073,4779,112,506,False
WORLDSTARHIPHOP,7,18.15.01,6IX9INE Feat. Fetty Wap & A Boogie “KEKE” (WSHH Exclusive - Official Music Video),10,2018-01-14T20:00:35.000Z,1284781,98468,3174,12830,False
SIRLI OLAM TV,7,17.12.12,БУНИСИГА НИМА ДЕЙСИЗ? БУ РОЛИКНИ ХАММА КУРИШИ ВА БИЛИШ ШАРТ.,1,2017-12-12T02:25:03.000Z,2132,109,7,10,False
chpSaratov,7,17.15.11,ЧП-САРАТОВ. ЖЕНЩИНА СГОРЕЛА ПРИ ГОТОВКЕ ПИЩИ НА КУХНЕ,2,2017-11-14T13:16:11.000Z,3293,14,3,4,False
Русский фильм,7,17.28.11,Ментовские войны 11 сезон 1-2 серия (2017) Криминальный фильм сериал,1,2017-11-27T12:39:00.000Z,42640,128,23,26,False
Новости 24,7,18.15.03,"БУДЕТ ПРИКАЗ ПУТИНА, РАЗОРВУТ УКРАИНУ В КЛОЧЬЯ - Евгений Мураев - 15.03.2018",25,2018-03-14T22:31:32.000Z,65351,746,175,412,False
Lady Diana,7,18.30.01,Кто ПОСЕЛИЛСЯ у нас во дворе кого нашли дети,24,2018-01-29T06:27:05.000Z,350645,13963,485,3075,False
Невероятности,7,18.16.01,Хоккей на замёрзшем озере,22,2018-01-15T16:57:00.000Z,86352,1596,211,252,False
UzbekistaN INC,7,17.17.12,ТЕШИК ҚИЗНИНГ ТЎЙДАН КЕЙИНГИ ХАЁТИ ШОК ВИДЕО,23,2017-12-16T16:24:34.000Z,112935,370,887,288,False
ГвоздиShow,7,17.23.11,Когда батю вызвали в школу,23,2017-11-22T14:37:37.000Z,72443,6480,145,242,False
Positive Production,7,17.19.12,Дилноза Каримова барои чони фарзандаш бо марг дар набард аст.,10,2017-12-18T22:03:46.000Z,14342,424,24,104,False
Universal Pictures,7,17.19.12,Mortal Engines Official Teaser Trailer [HD],24,2017-12-18T16:01:09.000Z,868210,13299,614,2208,False
Дмитрий Гордон,7,18.20.01,Дмитрий Гордон на 112 канале. 18.01.2018,25,2018-01-18T20:22:00.000Z,112460,708,281,669,False
ФУТБОЛЬНИК,7,18.27.01,ПОЧЕМУ ДЕБЮТ КОУТИНЬО НЕРЕАЛЬНО КРУТОЙ | БАРСЕЛОНА ЭСПАНЬОЛ 2 0 | ОБЗОР МАТЧА,17,2018-01-26T16:47:49.000Z,57398,5391,175,2106,False
Nafisa UFA/УФА,7,17.16.11,Покупки Фикс прайс/Нужные покупки/Хотелки новинки/Ноябрь 2017/,22,2017-11-15T12:20:36.000Z,8905,250,19,57,False
Спорт-Экспресс,7,18.18.02,Суператмосфера матча Россия-США,17,2018-02-17T15:14:17.000Z,15134,138,7,32,False
Xoşqədəm Hidayətqızı / Bizə danış official,7,17.14.12,Səni axtarıram 13 dekabr 2017 saat 15.25 ANONS / Seni axtariram 13.12.2017 (canli),24,2017-12-13T07:32:05.000Z,14743,50,7,35,False
ИНФОРМАТИЗАЦИЯ,7,18.16.04,ПEНТAГ0Н ТPЯCЕТ! НОВОЕ 0РУЖИЕ РОССИИ НАНОСИТ С0КРУШИТЕЛbНЫЙ YДАР ПО УВЕРЕННОСТИ 3АПAДА!,29,2018-04-15T07:37:46.000Z,477298,3589,2707,1687,False
Dariya Rain,7,18.03.03,"ДАША РЕЙН - ПЛАСТИЧЕСКИЙ ХИРУРГ?! -The Sims 4 ЧЕЛЛЕНДЖ - Ugly to Beauty, #6",20,2018-03-03T05:00:00.000Z,14912,1658,24,263,False
GoB Channel,7,17.27.11,ЛУЧШАЯ и ХУДШАЯ форма в карьере Арнольда!,22,2017-11-26T10:36:06.000Z,113260,4869,179,268,False
Феникс Кино,7,18.16.01,Двойная жизнь. Сериал. Серия 2 из 8. Феникс Кино. Драма,1,2018-01-15T21:00:01.000Z,19789,86,18,18,False
News Prime,7,18.27.03,Пожар в Зимней вишне | Страшные итоги пожара в Кемерово Зимняя вишня,25,2018-03-26T21:39:59.000Z,19089,254,36,163,False
ФильмЛяндия,7,17.24.11,"ПРЕМЬЕРА 2017 ОТ КОТОРОЙ РЫДАЛИ ДЕВКИ [ НЕЖНАЯ ЖЕНЩИНА ] Русские мелодрамы 2017 новинки, фильмы 2017",24,2017-11-23T16:17:19.000Z,28863,110,26,3,False
Easy Humor,7,18.14.01,КАК ПОНРАВИТЬСЯ ПАРНЮ В ШКОЛЕ/УНИВЕРЕ,23,2018-01-13T16:20:08.000Z,80155,6184,477,471,False
KINOFILM TV,7,18.21.04,"ПРЕМЬЕРА 2018! Ищейка 2 сезон (1-4 серии) Русские детективы, новинки 2018",1,2018-04-19T16:10:52.000Z,33892,90,34,11,False
Трепанация,7,17.19.11,ВЛОГ: Окна приехали / Дом за 100 дней - DIY,22,2017-11-18T10:13:12.000Z,113244,4952,286,390,False
Fontanka Ru,7,17.15.11,Колесов: эта зима будет холоднее предыдущей,25,2017-11-14T09:35:50.000Z,6154,8,9,4,False
Усман Баратов,7,18.20.01,Холок булганларни хотирлашка таклиф! Автобусдаги ёнгиндан 52-та Узбекистон,25,2018-01-18T19:06:37.000Z,63356,1650,83,496,False
Keedes channel LIVE,7,18.20.01,ПОПРОБУЙ НЕ ЗАПЛАКАТЬ СПАСЕННАЯ КОШЕЧКА ВЫЖИЛА  Едем на перевязку,15,2018-01-19T06:00:01.000Z,97959,6430,44,2306,False
iLichShow,7,17.25.12,Как снимали клип LITTLE BIG - LollyBomb / Влог Ильича,22,2017-12-24T17:46:36.000Z,623227,57767,725,2848,False
Студия Рубеж,7,17.28.12,Юрий Болдырев - Игорю Стрелкову: кто же наш общий враг?,22,2017-12-27T22:45:46.000Z,4147,341,20,147,False
Zabirai TV,7,18.02.05,ЮЛЯ САМОЙЛОВА ВСЕ ТАКИ - ГОРА! ЭТО ФИАСКО? ИЛИ ФИШКА РОССИИ НА EUROVISION 2018? / FIRST REHEARSAL,24,2018-05-01T18:38:16.000Z,8482,308,39,148,False
Igor Korsakov,7,17.13.12,КрЫмский(13.12.2017)мост! СЛУЧИЛОСЬ! АРКИ и ПРОЛЁТЫ СОМКНУЛИСЬ!!! Красивые кадры!,2,2017-12-11T16:37:10.000Z,100244,1333,87,540,False
MARS MEDIA,7,17.04.12,Трюфельный пес -  Серия 1/ 2017 / Сериал / HD 1080p,1,2017-12-03T08:00:01.000Z,27944,63,14,2,False
КПРФ ТВ,7,17.15.12,Комментарий Г.А. Зюганова по итогам пресс-конференции В.В. Путина,25,2017-12-14T13:24:20.000Z,132151,1979,703,833,False
АЗИЯ ТВ,7,18.12.02,Жасмина Трансни танкид килайдиганларга ответ,23,2018-02-11T10:46:03.000Z,10125,72,26,97,False
Острый Угол,7,18.16.03,"Навальный предсказывает, что будет 19 марта после выборов или отправляем наблюдателей в Чечню",25,2018-03-15T19:40:04.000Z,152939,5461,750,1353,False
Антон Логвинов,7,17.04.12,"Зима пришла, игровой сезон закончен! Что дальше?",20,2017-12-03T13:52:14.000Z,57410,8587,1476,1103,False
ЗОМБИ ЧЕЗ,7,18.13.01,10 АНОМАЛЬНО БОЛЬШИХ КОШЕК В МИРЕ,24,2018-01-12T13:36:46.000Z,46433,3029,100,481,False
Edward Bil,7,18.22.05,ПОЛИЦЕЙСКИЙ ПРАНК / НЕАДЕКВАТНЫЙ КОП / РЕАКЦИЯ ЛЮДЕЙ,23,2018-05-21T11:00:00.000Z,118298,9210,656,1730,False
Lina Win,7,18.06.05,ЛИЗУН ИЗ 50 БАНОК ЛАКА ДЛЯ НОГТЕЙ | ГИГАНСКИЙ СЛАЙМ БЕЗ КЛЕЯ!,24,2018-05-05T16:26:22.000Z,164771,8631,407,10812,False
БУДЬ В КУРСЕ TV,7,18.13.02,3 СУПЕР загадки с Ответами | ЗАДАЧИ на логику и ГОЛОВОЛОМКИ | БУДЬ В КУРСЕ TV,24,2018-02-12T09:11:09.000Z,11998,383,42,78,False
NAVI Dota 2,7,17.31.12,Dendi: The Story of Dedication [EN/RU],20,2017-12-30T18:01:27.000Z,99873,10618,93,1097,False
Молодые Коммунисты,7,18.15.01,Как Грудинин свои деньги скрывает,22,2018-01-14T13:14:03.000Z,67886,2519,2751,867,False
Dazuki,7,18.31.01,2 СЕЗОН В РОССИИ УЖЕ ВЫШЕЛ! РУССКАЯ ОЗВУЧКА - РЕАКЦИЯ feat. Maruvie | Теории Леди Баг и Супер-Кот,24,2018-01-30T10:41:05.000Z,212806,23502,390,2369,False
ИнтересноеТВ истории спасения животных,7,18.24.02,"🔴«А нам мама сказала, чтобы вы его усыпили, потому что у него лапы кривые…»",22,2018-02-23T20:03:22.000Z,4076,256,2,36,False
HESUS STREAM,7,18.24.02,ХЕСУС ЗАКОНЧИЛ КОНФЛИКТ? || JesusAVGN #Конфликты,22,2018-02-23T19:25:31.000Z,9210,362,44,100,False
ДАМБО MUSIC,7,17.18.11,СЛЕНДЕРМЕН VS БЕНДИ И ЧЕРНИЛЬНАЯ МАШИНА | СУПЕР РЭП БИТВА | Bendy and the ink song VS Slenderman,27,2017-11-17T08:30:00.000Z,31055,2175,231,3716,False
Anton Sheptunov,7,17.15.11,ПОЛОСА ПРЕПЯТСТВИЙ В БАТУТНОМ ПАРКЕ! (СЛОЖНАЯ ВЕРСИЯ) TRAMPOLINE PARK SLIDE OBSTACLE COURSE,17,2017-11-14T12:36:44.000Z,138806,3444,190,170,False
Геннадий Острецов,7,18.23.04,Интересные новости 88/18,25,2018-04-22T07:53:46.000Z,11675,1180,35,70,False
MATCH DAY CLUB [СПОРТИВНЫЕ ОБЗОРЫ],7,17.24.12,РЕАЛ МАДРИД - БАРСЕЛОНА 0-3 | ОБЗОР МАТЧА [23.12.17] HD,17,2017-12-23T13:57:49.000Z,72541,638,69,149,False
Magic Five,7,17.18.11,ХУДШИЙ ФОКУСНИК В МИРЕ 2 | CЛОМАЛ ПАЛЕЦ | ПРАНК,24,2017-11-17T11:01:17.000Z,94763,3391,230,239,False
Политика: Россия Украина,7,18.24.03,Россия начала отвечать по-настоящему. Британия возмущена!,22,2018-03-19T16:30:00.000Z,27753,182,21,23,False
ЛЮДМИЛА ОЛИНА,7,18.17.02,Вибер...   прикольн    Новинка,23,2018-02-16T23:11:49.000Z,4084,0,0,22,False
Георгий Кавказ,7,17.28.11,"ПЕЧЕНЬ, СЕРДЦЕ, ПОЧКИ. КОЛБАСА по-Кавказски",24,2017-11-27T09:00:02.000Z,160441,14554,198,1151,False
В шлеме,7,17.17.11,Как ездить на мотоцикле зимой. Лайфхаки - В шлеме,2,2017-11-16T11:03:41.000Z,71880,7407,70,411,False
Владислав Усачёв,7,17.27.11,Дмитрий Пирог о боях Ковалев – Бивол и Бетербиев – Стивенсон,17,2017-11-26T10:00:00.000Z,5013,84,1,21,False
Документальные проекты. РЕН ТВ,7,17.14.11,"Астероид, который изменит все. Выпуск 187 (11.11.2017). Территория заблуждений.",25,2017-11-13T08:31:02.000Z,13457,57,11,11,False
GOBZAVR,7,17.07.12,"СПАИЛИ ФАНФУРИКА стрим с Людмила ЛЮДМУРИК, Андрей ГОБЗАВР и Жека ФАНФУРИК в ГОБЗ ШОУ GOBZAVR",24,2017-12-06T20:11:48.000Z,6189,110,312,7,False
Zafari Rahimzod,7,17.18.12,Мадина Давлатова ва Баходир Чураев - Нагу нагу | Madina Davlatova and Bahodir Juraev -  Nagu nagu,10,2017-12-17T17:34:52.000Z,21233,620,113,289,False
Самый сок 2,7,18.21.01,Моль вылезла из норы...Чует неладное.,22,2018-01-20T12:44:38.000Z,130054,5732,14805,1083,False
Совергон,7,17.14.11,КЛИПЫ РОДИТЕЛЕЙ НА ШКОЛЬНЫЙ ВЫПУСКНОЙ,24,2017-11-13T16:52:36.000Z,243469,36216,631,1692,False
В деревню!,7,18.10.02,Про газовую горелку и вообще \\ В деревню!,22,2018-02-09T10:00:07.000Z,7003,620,13,132,False
alternatio.org,7,18.25.01,"Андрей Ваджра. Всё, что надо знать об украинофобии 24.01.2018. (№17)",25,2018-01-24T12:43:59.000Z,7932,1187,12,486,False
Маша Маева,7,18.22.01,ВДУЛА БЫ СОБОЛЕВУ - МАСЛЕННИКОВ ПРОСТИ! / ВДУТЬ ИЛИ ПНУТЬ?!,24,2018-01-21T14:26:47.000Z,195308,11396,326,944,False
Нурбек Юлдашев,7,18.14.02,Нурбек Юлдашев/Кыска тамаша/ЖОЛ/,23,2018-02-14T03:59:06.000Z,1736,216,1,33,False
ЗАПАХ СТАМБУЛА,6,17.23.11,ПОЛНОЛУНИЕ / 21 СЕРИЯ / 1 ФРАГМЕНТ,22,2017-11-22T13:05:30.000Z,30541,88,6,1,False
McDonaldsRussia,6,17.26.12,Розыгрыш СУПЕРПРИЗА в Монополии в Макдоналдс,29,2017-12-25T17:29:42.000Z,13333,117,122,7,False
super_vhs,6,17.22.12,ЁЛКИ [super] честный трейлер [feat. 55x55],1,2017-12-21T06:00:00.000Z,227959,10425,210,363,False
Телеканал «СПАС»,6,17.24.11,ПРЯМОЙ ЭФИР. ПРОЩАЙТЕ! ПАМЯТИ ДМИТРИЯ ХВОРОСТОВСКОГО,29,2017-11-22T21:07:57.000Z,62590,516,35,83,False
Бэйкон,6,18.19.03,Я Учитель в Школе (анимация),1,2018-03-18T15:00:06.000Z,76359,4210,307,236,False
TabrizShakhidi,6,17.25.11,СОЛОВЬЕВ VS СОБЧАК - Вечер с Владимиром Соловьевым,10,2017-11-24T09:21:03.000Z,140193,2436,1740,3193,False
Diana Suvorova,6,17.18.11,ТЕСТИРУЮ НОВИНКИ MAYBELLINE💄,26,2017-11-17T13:00:01.000Z,70202,2614,72,280,False
О самом главном,6,17.21.11,"О самом главном: Опасности в салонах красоты, почему болит горло, цвет продуктов питания",22,2017-11-20T10:08:50.000Z,8351,114,9,18,False
Олёша,6,17.10.12,Дамы и господа: ИГРА ГОДА (ей всего неделя),20,2017-12-09T15:37:23.000Z,11821,1767,11,126,False
Zere gold,6,18.14.04,Как сделать слайм пюре ( или же слайм #18 из моей коллекции),26,2018-04-14T03:55:08.000Z,23925,1534,46,394,False
Max Barskih,6,17.05.12,Макс Барских —  Февраль  [TEASER #1],10,2017-12-04T09:36:34.000Z,10022,239,19,22,False
MigosVEVO,6,17.08.12,"Migos, Nicki Minaj, Cardi B - MotorSport",10,2017-12-08T02:12:48.000Z,601001,67467,986,10252,False
Stars Show News,6,18.19.02,Дмитрий Тарасов изменяет Анастасии Костенко со звездой шоу Пацанки (18.02.2018.),24,2018-02-18T11:09:44.000Z,13113,42,22,12,False
Кунг фу Панда 3 FUTURE Василий,6,17.25.11,Однажды в России Полный выпуск 60 - 72 - картункова-азамат мусагалиев-ольга картункова,1,2017-11-24T18:43:05.000Z,11368,52,18,6,False
Demədi Demə,6,17.15.12,Kasıb olduğu üçün evlilik təklifini rədd etdi - 10 il sonra oğlanla görüşəndə.. - OLMUŞ HADİSƏ,28,2017-12-14T15:41:29.000Z,66438,3356,159,246,False
UzTop TV,6,18.02.01,Bayram Hazillari Yangi Yil | Байрам Хазиллари Янги Йил,24,2018-01-01T17:22:53.000Z,76579,636,129,60,False
Игорь Востриков,6,18.17.04,Смотреть жутко. После этого ролика ты уже не будешь прежним.,22,2018-04-17T00:54:53.000Z,2842,362,44,110,False
Elvan Kutman,6,17.29.11,Adını Sen Koy 228. Bölüm Fragmanı,1,2017-11-28T16:53:24.000Z,211666,1136,49,75,False
TheBroadwayShow,6,18.03.01,#СИТКОМ ШИЗОФРЕНИЯ - СЕРИЯ ПРО МОТИВАЦИЮ (18+),23,2018-01-02T13:44:46.000Z,33024,6871,37,264,False
SmileFun,6,18.04.01,Смешные кошки и коты 2018 ДО СЛЁЗ  Приколы с котами и кошками Funny Cats compilation,15,2018-01-03T06:02:40.000Z,11319,502,15,217,False
Gorillaz,6,17.19.12,Thank You,10,2017-12-18T11:53:29.000Z,343876,64327,279,4590,False
VANO,6,18.22.05,Алфавит школьника,23,2018-05-21T16:17:59.000Z,107340,9203,369,257,False
STARTVSTAR,6,18.08.02,Siyah İnci 19. Bölüm Ön İzleme!,24,2018-02-07T09:35:37.000Z,134414,1007,55,75,False
BabyInfiniti,6,17.20.12,Болтовня. Из жизни сшитых ПЛАТЬЕВ. Платья к НОВОМУ ГОДУ.,26,2017-12-20T02:00:01.000Z,1435,154,8,22,False
POLITICAL EPOPEE,6,17.19.12,Станислав Белковский: Забит последний гвоздь в полuтuческий гpоб Путина 18.12.2017,22,2017-12-18T20:21:09.000Z,11900,244,32,37,False
TrashSmash,6,17.31.12,TrashSmash [НОВОГОДНИЙ],29,2017-12-30T23:00:53.000Z,36088,13437,54,926,False
Политика Путина,6,18.07.03,ЕГО ОТВЕТ ПОНИЗИЛ РЕЙТИНГ ПУТИНА! ОТВЕТЫ НА НАБОЛЕВШИЕ ВОПРОСЫ 07.03.2018,22,2018-03-06T09:00:09.000Z,24263,0,0,310,False
Bukreev Buy,6,17.05.12,58 товаров по 1$  с AliExpres! ДА ЧТО ЗА ТРЭШ?,24,2017-12-04T17:12:30.000Z,45655,3207,233,1041,False
Anna News,6,17.19.11,Сирийская армия прорвалась к Тишрину,25,2017-11-18T20:14:58.000Z,4730,158,3,11,False
Max Power,6,18.30.03,Трагедия в Кемерове: пиар без принципов!,23,2018-03-29T16:31:04.000Z,185656,21743,5219,6821,False
FlynnFlyTaggart,6,17.18.11,Что такое Dub?,29,2017-11-17T14:22:07.000Z,56410,7162,111,560,False
ВТРЕНДЕ,6,18.17.05,"ТОП ПЕСЕН РЭПЕРОВ С КРУТЫМ СЮЖЕТОМ И СМЫСЛОМ /  BOULEVARD DEPO, ХАСКИ, MNOGOZNAAL, OXXXYMIRON",10,2018-05-16T15:01:19.000Z,70345,4789,204,375,False
Droider.Ru,6,17.17.11,ЧЕСТНАЯ Распаковка Xiaomi Mix 2,28,2017-11-16T20:37:05.000Z,35554,2014,131,159,False
Милшу,6,18.09.05,Муравьиные истории (анимация),1,2018-05-08T12:00:01.000Z,63458,8212,221,950,False
MARGO TOPs,6,17.16.11,10 НЕОБЫЧНЫХ ДОМАШНИХ ЖИВОТНЫХ,24,2017-11-15T16:00:01.000Z,18201,842,18,80,False
MADRIDISTA CHANNEL,6,18.23.01,"Криштиану Роналду разбили лицо, а он забил гол 2018",17,2018-01-21T22:37:06.000Z,538975,7616,1137,1137,False
Epic Media,6,17.02.12,Война и мир супругов Торбеевых - Серия 2 (1080p HD),1,2017-12-01T15:30:01.000Z,6399,10,3,1,False
MLBC,6,17.10.12,Сюзанна - Встреча в сентябре,10,2017-12-09T10:01:00.000Z,51401,1826,135,102,False
Clash Royale,6,17.26.12,CLASH ROYALE: EPIC COMEBACK!,20,2017-12-25T13:54:09.000Z,7563532,85112,10261,5958,False
CTVBY,6,18.12.02,Все подробности крушения самолета Ан-148 в Подмосковье | Хронология событий и кадры с места падения,25,2018-02-11T18:37:25.000Z,10384,27,9,10,False
Мурвел,6,18.09.03,Будто Бы Плыву - MEME (Пародия),1,2018-03-08T11:00:04.000Z,16681,1432,82,599,False
NVLNY HLO,6,17.20.11,Навальный выбирает Мюнхен!,22,2017-11-19T07:18:05.000Z,129730,6018,4678,948,False
Дмитрий Куприн,6,18.06.01,"Путин-хороший, Грудинин-плохой. Диагноз доктора Федорова",25,2018-01-05T14:39:36.000Z,6418,102,35,200,False
УМНЫЕ НЕ МОЛЧАТ,6,18.22.02,CΡΟЧHЫЙ 3BΟHΟK ТРАМПА — ПУТИНУ — (21.02.2018),26,2018-02-21T04:00:01.000Z,109800,415,7957,811,False
"KILL ME, OBLADAET",6,18.12.03,OBLADAET – KENNY,10,2018-03-11T10:00:15.000Z,755473,61161,13294,4361,False
Игровые сериалы,6,18.31.05,Сериал Disney - Я ЛУНА - Сезон 1 серия 3 - молодёжный сериал,1,2018-05-31T15:00:02.000Z,15234,834,27,224,False
Fun DI,6,18.09.03,ЛИЗУН из плохого клея (жидкого клея) и НОВОГО ЗАГУСТИТЕЛЯ медового лосьона для лица на спирту,24,2018-03-08T14:23:47.000Z,15969,1124,50,777,False
Crazy MaksTV,6,17.18.11,УСАЧЁВСКИЙ РЫНОК-ГРАБЁЖ СРЕДЬ БЕЛА ДНЯ! ШОК!,10,2017-11-17T15:28:56.000Z,4744,735,7,134,False
Surman Live,6,18.10.03,майнкрафт спс за накрутку дизов,20,2018-03-10T04:04:47.000Z,85113,10344,1627,21,False
Hard Play,6,18.18.01,😈 СДЕЛАЕМ 150 КИЛОВ ЗА СТРИМ? DUO VS SQUAD 😈,20,2018-01-18T06:20:39.000Z,47695,4802,156,15,False
Вечный,6,18.22.01,"ОНИ ЕДЯТ ИЗ ПОМОЙКИ, ЧТОБЫ ВЫЖИТЬ",22,2018-01-21T16:00:05.000Z,7447,1998,18,445,False
SciOne,6,18.05.02,Страшно не знать: профилактика рака | Эксперт в ответе,28,2018-02-04T17:33:07.000Z,14693,1458,12,155,False
"Российская Дрифт Серия, RDS",6,18.06.05,Прямая трансляция 1 этапа RDS GP 2018. Квалификация,17,2018-05-05T14:54:44.000Z,57944,2251,40,116,False
Дмитрий Мартышенко За ГРУДИНИНА,6,18.20.03,Павел Грудинин после выборов ответил на вопросы журналистов,25,2018-03-19T18:27:22.000Z,101231,3304,255,1864,False
Игромания Кино,6,17.17.11,"Лига справедливости - Лучше, чем ожидалось (Обзор)",1,2017-11-16T17:39:02.000Z,40014,2410,168,322,False
Rikani,6,18.15.01,Защитите Землю-тян (Анимация),24,2018-01-14T13:26:14.000Z,95087,17957,171,1410,False
Ilya Football,6,17.24.12,РЕАЛ МАДРИД - БАРСЕЛОНА 0:3 Обзор матча Эль-Классико Чемпионат Испании 2017 23.12.2017,17,2017-12-23T14:01:58.000Z,184802,1494,237,541,False
Quantum Games,6,18.21.01,"Я ЭТО СДЕЛАЛ, НУ ПОЧТИ!!! НЕУЖЕЛИ ОКУП В CS:GO!!!",20,2018-01-20T17:18:12.000Z,79930,4363,151,332,False
Путин 20!8,6,18.19.01,Путин: Медовая повкусней будет!,22,2018-01-18T10:55:24.000Z,273323,0,0,0,True
newsbarca,6,18.08.01,Барселона - Леванте 3:0. Обзор матча. Чемпионат Испании 2017/18. 18 тур.,17,2018-01-07T17:37:59.000Z,49683,1016,19,131,False
Vano,6,17.14.12,Мысли перед свиданием,23,2017-12-13T15:02:43.000Z,83135,4203,82,170,False
ЛУНА,6,17.08.12,ЛУНА - Free Love,10,2017-12-07T11:11:27.000Z,160029,7695,871,552,False
Это чудо!,6,17.02.12,Это чудо! iPhone из 90х и музыка будущего,23,2017-12-01T07:05:19.000Z,94851,2381,480,123,False
AutoreviewRu,6,17.25.11,"Лада Веста SW 1.8: замеры динамики, тесты на управляемость, сравнение багажника с конкурентами",2,2017-11-24T15:16:07.000Z,69014,3061,246,823,False
DabiKrabik,6,18.04.01,Подарки (Русский Дубляж) - Domics,1,2018-01-03T15:05:39.000Z,39530,3502,51,433,False
FSone,6,17.19.11,Victory Ceremony Ladies 2017 Grand Prix France,24,2017-11-18T16:39:55.000Z,11351,155,11,65,False
Combat Crew,6,17.21.11,"Нива, Фронтера и Уаз. Маршрут к менту!",2,2017-11-20T12:48:25.000Z,47149,1941,59,271,False
EminemVEVO,6,17.16.12,Eminem - River (Audio) ft. Ed Sheeran,10,2017-12-15T05:00:00.000Z,5119790,412577,6242,31862,False
Русская Волна,6,18.22.02,Что будет если Путин не победит 18 Марта 2018,29,2018-02-21T15:06:12.000Z,39420,672,6864,1066,False
Magic Family,6,17.08.12,СОБАКИ в СНЕГОПАД первый раз ЩЕНОК плывет в СНЕГУ ЗИМНИЙ ЭПИК ВЛОГ Magic Family,15,2017-12-07T12:51:38.000Z,248643,23520,150,4988,False
ЗВЕЗДНАЯ ЖИЗНЬ,6,17.26.11,Евгений Кузин и Саша Артемова:  СВАДЬБА! ГОСТИ! ТОРТ! ПОЗДРАВЛЕНИЯ!,24,2017-11-25T09:18:44.000Z,46104,157,106,57,False
Madam Papaya,6,17.17.11,37200 РУБЛЕЙ ЗА ШАПКУ СЕКОНД ХЕНД ! ДОРОГО   ДЕШЕВО ШАПКА,26,2017-11-16T14:28:33.000Z,158626,13945,173,1834,False
Исцеляющие Медитации,6,17.28.11,"Галактическая Музыка Сил Света, Портал в Новую Жизнь | Через 7 Минут Ты Увидишь Совершенно Новый Мир",10,2017-11-27T16:15:05.000Z,10736,574,10,54,False
Курут Кыргызстан,6,17.31.12,Чубак ажы менен Дайыр Исмадияров аэропортто чогуу кандай көрүнүшкө туш болушту?,24,2017-12-30T13:51:04.000Z,12947,231,11,64,False
News-Front,6,17.23.11,В Луганске силовики разблокировали Генпрокуратуру и часть центра города,29,2017-11-22T18:37:35.000Z,41971,165,40,119,False
Охота за сокровищами!,6,18.05.01,НАШЛИ КЛАД ВРЕМЁН АННЫ ИОАНОВНЫ!,19,2018-01-04T15:27:20.000Z,5289,562,8,90,False
Алексей. Астафьев,6,18.14.02,"Десант за Грудинина по Колыванскому району. Пихтовка, Пономаревка, Королёвка.",29,2018-02-13T00:49:26.000Z,10285,1267,11,355,False
Миша Шевчук,6,17.23.12,МАСТЕР НА ВСЕ РУКИ,23,2017-12-22T15:57:35.000Z,123605,10081,303,335,False
TOK,6,18.14.02,Крушение самолёта Ан-148 Саратовских авиалиний. В чём причины авиакатастрофы?,29,2018-02-12T16:17:31.000Z,69211,150,112,130,False
atv ihsan,6,18.01.02,Через сон определи свою сущность,1,2018-01-31T08:48:32.000Z,4687,382,7,17,False
Соколовский & Дакота,6,17.08.12,Влад Соколовский - «Не потерять себя в тебе» (Official Lyric Video),22,2017-12-07T09:28:12.000Z,93374,6582,304,585,False
Dollish Fox,6,17.03.12,"ПОВТОРЯЮ ФОТО БЛОГЕРОВ КУКЛАМИ 2 / ИВАНГАЙ, БЕРСИК, МАРИЯ ВЭЙ, АНАСТАСИЯ ШПАГИНА, КАТЯ КЛЭП",26,2017-12-02T08:50:31.000Z,101878,9779,226,1094,False
ПЕРУН СЛАВЯНОВИЧ Андрей АРИЙСКИЙ Н.,6,17.27.11,Современная Перекись-ОТРАВА! Бензоат Натрия Ингибитор Е211 В Составе! Лечебные Свойства Уничтожены!,28,2017-11-26T13:48:51.000Z,11435,601,59,169,False
Hack News,6,17.28.11,ГС (Группировка Сарделя) - Шокирующая правда о Навальном!,22,2017-11-27T07:35:35.000Z,83481,3127,1616,512,False
Телеканал НТС,6,17.30.11,Кайчы Пикир: Көп АЯЛ алуу боюнча коомдо кызуу талкуу болуп жатат  / 28.11.17 / НТС / Кыргызстан,22,2017-11-28T18:16:41.000Z,26687,239,90,1094,False
optimisster,6,17.19.11,ЛИГА СПРАВЕДЛИВОСТИ - ОБЗОР,1,2017-11-18T15:57:46.000Z,41105,3258,263,357,False
War Thunder. Официальный канал,6,17.20.12,Обновление 1.75 «La Résistance»,20,2017-12-19T10:26:58.000Z,44270,2766,76,720,False
Slacker,6,17.15.11,ЧП - Кирилл Терешин,23,2017-11-13T18:19:59.000Z,787765,3708,1879,2188,False
Marvel Entertainment,6,17.29.11,Avengers: Infinity War Trailer Tease,24,2017-11-28T17:09:22.000Z,3111226,127081,12405,18233,False
KATO_Katosha,6,17.08.12,KATO_Katosha - Как заплести Д.Е ДРЕДЫ (безопасные дреды) Часть 2,22,2017-12-07T16:30:28.000Z,35205,1785,20,198,False
Yeni Gelin,6,18.29.04,Yeni Gelin 47. Bölüm,22,2018-04-28T21:15:55.000Z,48781,1289,42,234,False
Orxan Sirinli ŞO TV,6,18.22.04,Prezident İlham Əliyev yeni nazirləri təyin etdi - Hansı nazirlər vəzifəsindən atıldı?,22,2018-04-21T15:34:25.000Z,105260,352,271,177,False
katyakonasova,6,17.19.11,Оно мне надо? Распаковка и Проверка товаров с Алиэкспресс! + КОНКУРС,22,2017-11-18T10:56:37.000Z,18555,1904,22,1035,False
Доктор Комаровский,6,18.03.02,Обновленный набор доктора Комаровского «Первый зуб»,27,2018-02-02T15:03:02.000Z,5675,346,8,25,False
Cmh2,6,18.08.02,CMH - FLESH & LIZER DISS,22,2018-02-07T15:39:26.000Z,24507,6140,179,201,False
LOW CARS MEET,6,17.17.11,Сколько стоит построить ТОП стенс-проект в России? Golf GTI MK5 Вавы. ENGLISH subs. Vladimir's MK5,2,2017-11-16T18:06:00.000Z,38229,5313,78,431,False
СтопХам Мск,6,18.18.03,СтопХам-Сотрудник СПЕЦСВЯЗИ,2,2018-03-17T05:58:45.000Z,72684,4556,224,843,False
Уроки Медитации,6,18.15.01,Качества ученика - 3.  Скромность.  Винито.,27,2018-01-14T14:25:52.000Z,6332,616,5,83,False
Контекст Инфо,6,17.12.12,Сирия. Визит Путина на российскую авиабазу Хмеймим,22,2017-12-11T13:44:58.000Z,11104,244,21,70,False
Паша Пэл,6,18.17.04,ПОЙМАЛА ПОЛИЦИЯ В ГОРОДЕ! первый выезд пчёлки,24,2018-04-16T09:14:47.000Z,147110,6837,342,863,False
Инстаграм и Перископ ТВ,6,17.07.12,Дробыш о БЕРЕМЕННОСТИ Рады БОГУСЛАВСКОЙ и ОРИЕНТАЦИИ ДАНИ ДАНИЛЕВСКОГО,22,2017-12-06T05:00:45.000Z,17649,110,8,42,False
SNAIL PLAY,6,17.14.11,⭐ [SNAILKICK™] СМОТРИТ HYPE (БОЛЬ) CAMP 2 12/11/2017,15,2017-11-12T20:31:02.000Z,297604,16641,537,1353,False
Красавчик Тв Хит- парад,6,18.27.02,Самый лучший момент который я люблю.Хюррем и Ибрагим,22,2018-02-26T23:49:04.000Z,5021,99,4,8,False
20th Century Fox,6,17.09.12,Alita: Battle Angel | Official Trailer [HD] | 20th Century FOX,1,2017-12-08T19:30:09.000Z,2841875,18082,2484,7459,False
Darvin Studio,6,18.10.02,БЛЕВОТНЫЙ ЧЕЛЛЕНДЖ.Яйца ЭМУ и маринованные яйца.Brave Wilderness на русском,24,2018-02-09T11:03:09.000Z,39778,1743,79,145,False
МОЛЛИ беликова,6,18.24.04,ее зовут зехра 9 серия субтитры,1,2018-04-23T01:48:33.000Z,12860,130,15,27,False
InEx RYTP,6,17.21.12,ПРАВИЛЬНАЯ РЕКЛАМА 29 RYTP / ПУП,23,2017-12-20T15:47:26.000Z,56883,6586,354,584,False
Русская мелодрама,6,17.21.11,Большие деньги 1 серия (2017) Криминальная мелодрама сериал,1,2017-11-20T11:45:16.000Z,25735,54,13,2,False
Аниманьяк,6,18.29.01,Страна Самоцветов. Вселенная Стивена - моё любимое аниме,1,2018-01-28T16:46:58.000Z,31200,4853,130,1072,False
novayagazeta,6,17.15.11,"Дмитрий Муратов: «Не надо за нас волноваться, за нас надо порадоваться»",25,2017-11-14T14:21:54.000Z,12379,167,0,12,False
BOMBER SHOW,6,17.19.12,КАК ТЯНУТЬ ТОННЕЛИ | ИСПОГАНИЛ УХО ? | МОЯ история | УХОД за тоннелями,22,2017-12-18T15:05:03.000Z,41014,1989,77,474,False
MARINA IVANOVA VLOG ЖИЗНЬ С НУЛЯ В 40 ЛЕТ,6,18.03.01,ЖИЗНЬ С НУЛЯ В 40 ЛЕТ. ПОЧЕМУ ОДНА В НОВЫЙ ГОД 2018,22,2018-01-02T22:21:45.000Z,7018,541,54,194,False
Phalaenopsis. Вязание от Светланы Заец.,6,18.28.01,"Платье (туника, пуловер) спицами. Часть 1. Вяжем образец 1-20 ряды.",26,2018-01-27T15:19:28.000Z,10031,529,6,11,False
Versus Live,6,18.18.02,VERSUS: Guf VS Птаха (teaser),22,2018-02-17T15:36:50.000Z,360693,5205,2229,1120,False
Adı: Zehra,6,18.18.03,Adı: Zehra 5. Bölüm 1. Tanıtımı,22,2018-03-17T20:45:01.000Z,116237,926,24,166,False
Labrador Missy,6,17.29.11,Мисси уезжает,15,2017-11-28T13:53:24.000Z,13428,1681,16,108,False
AB&BA true,6,17.14.12,Про ингушку  так пошутили не просто так.,25,2017-12-13T18:12:52.000Z,18151,2019,177,387,False
Прикольная Рыбалка,6,18.15.03,РЫБАКИ НЕ ПОНЯЛИ ЧТО ЭТО ЗА КАРП МОНСТР !? Вот это рыбалка 2018 ты не поверишь Очень много рыбы !,24,2018-03-14T06:02:13.000Z,168357,1021,169,60,False
ЭКОНОМИКА БЕЗ ЦЕНЗУРЫ,6,18.30.04,Poccия бoльшe нe нyжнa нacтoящим ee xoзяeвaм... Юрий Пронько,22,2018-04-30T05:00:00.000Z,13593,0,0,67,False
Music Mix,6,18.05.04,"Nran hatik - Окутала меня (Miyagi, Эндшпиль Ft. Рем Дигга - I Got Love)",22,2018-04-04T19:48:05.000Z,21997,96,17,21,False
LollLady,6,18.13.02,Alina Zagitova 2018 - Смерч или бомба по имени Алина !!! произвольная программа,22,2018-02-12T09:09:28.000Z,9070,76,1,17,False
koZa doZa,6,18.02.02,"УЕХАЛИ.. СНЕГ, ЗИМА, СУГРОБЫ.. МОТОБЛОК..",26,2018-02-01T16:47:20.000Z,7364,614,32,112,False
Голова садовая,6,18.18.01,Голова садовая - Посев баклажан и перцев,26,2018-01-17T14:00:08.000Z,5360,315,13,52,False
Лесной Хутор,6,18.17.02,Последние новости. Февраль || Жизнь в деревне.,22,2018-02-16T19:01:17.000Z,5069,646,7,75,False
WrestRusRu,6,17.19.11,Alans 2017. Day 1. Mat A,17,2017-11-18T18:41:57.000Z,66627,98,16,0,False
КИНОМАН,6,17.25.11,Логан против Виктора / Люди Икс: Начало. Росомаха (2009),1,2017-11-24T14:00:02.000Z,4793,72,2,3,False
Ольга Картункова,6,17.12.12,Чувство Юмора полный Четвёртый выпуск,23,2017-12-11T15:23:59.000Z,12830,206,29,15,False
Кыргыз Шоу,6,17.17.11,Сайкал Садыбакасованын тойу УКМУШ өттү! Көрүнүз..Көрбөн арманда..,29,2017-11-16T14:25:42.000Z,66346,462,63,72,False
Барбоскины,6,18.16.05,Лохнесское чудовище 💥 Барбоскины 💥 Трейлер новой 181 серии,1,2018-05-15T09:04:07.000Z,82413,1230,76,200,False
MAXSUS CANAL,6,18.15.03,"4 к,исм ПОЛИЦИЯ УЗБЕКНИ УРДИ. Лайк Босинг Бутун РОССИЯ курсин! Обуна булинг",22,2018-03-14T09:34:15.000Z,164035,5957,367,706,False
VenyaPakTV,6,18.09.01,"АМЕРИКАНЦЫ СЛУШАЮТ РУССКУЮ МУЗЫКУ #19 (РОЗОВОЕ ВИНО, T-KILLAH, БИЛАН, ЛАЗАРЕВ)",22,2018-01-08T17:11:56.000Z,137702,8609,670,1074,False
Евгений Пупырин,6,17.10.12,Раскрыта афера Банка России! Полное разоблачение махинаций со счетами 810 и 643,24,2017-12-09T10:29:13.000Z,81180,2600,206,491,False
ARB TV,6,17.15.12,"Məni assalar da, həbs etsələr də Nazənindən üzr istəməyəcəm - Təranə Qumral - Seher-seher - ARB TV",24,2017-12-14T08:55:56.000Z,44497,185,56,104,False
Алиф ТВ,6,17.21.11,За что кавказцев так ненавидят в России?! Не молчи!,22,2017-11-20T08:17:49.000Z,12904,431,23,267,False
Sasha Spilberg,6,17.25.11,РЕАКЦИЯ ПОДПИСЧИКОВ НА МЕНЯ || Работаю На Кассе,10,2017-11-24T07:33:37.000Z,603093,49930,1837,6477,False
Alexandra Posnova,6,17.20.11,Какую Свадьбу Планируем? Наша Разница в Возрасте?,22,2017-11-19T13:00:03.000Z,90053,7431,83,664,False
Kino Serial TV,6,18.03.01,Kelin  Turk seriali O'zbek tilida 90-qism HD formatda,1,2018-01-02T17:25:48.000Z,3715,77,6,21,False
ГОРОД ГРЕХОВ,6,18.07.03,Город Грехов 86 - Пьяная дочь майора ФСБ,2,2018-03-07T05:00:01.000Z,20349,2185,78,1014,False
Newsader,6,18.27.01,"СЦЕНАРИЙ ДЛЯ РОССИИ. Худшее, что может случиться.",22,2018-01-26T21:49:41.000Z,4574,764,55,258,False
ViteC ► Play,6,17.27.11,ПОТУСТОРОННИЙ МОБИЛЬНИК,20,2017-11-26T11:10:41.000Z,78153,4714,88,482,False
Simon's Cat,6,17.17.11,DIY - Simon's Cat  | NEW BLACK & WHITE!,15,2017-11-16T15:03:23.000Z,178977,14355,87,429,False
Павел Грудинин,6,18.02.01,Грудинин против Путина. Разоблачение депутата Федерова | НОД |,25,2018-01-01T14:23:42.000Z,11418,395,49,149,False
Crafty,6,17.02.12,Отель Элеон 3 сезон 11 серия. АНОНС!!!,1,2017-12-01T16:04:25.000Z,3916,32,7,20,False
Современная Коммуна,6,18.20.01,Секрет наглого успеха Грудинина,22,2018-01-19T05:56:42.000Z,238575,12937,10944,2705,False
Дикий бой,6,17.28.11,"15 самых ожидаемых боев UFC, которые пройдут до конца 2017 года \ Хабиб Нурмагомедов, Эдсон Барбоза",17,2017-11-27T14:13:06.000Z,3800,55,3,16,False
Red Pen,6,17.25.11,Захарова о договоре Армении с Евросоюзом,25,2017-11-24T07:18:59.000Z,4657,66,6,48,False
ASATA channel,6,18.20.04,LADA GRANTA SPORT - спортивный ИШАК!,2,2018-04-19T16:37:15.000Z,94283,7995,429,1496,False
Sirius Eyes,6,18.23.05,◮ АСМР ◭ 10 триггеров и немного визуалки 🎧,26,2018-05-22T14:33:21.000Z,15137,1108,22,189,False
Project Humans,6,18.20.03,Иностранцы Смотрят Клипы на Русском,24,2018-03-19T11:00:03.000Z,14348,881,75,69,False
Anastasiz,6,17.28.12,ПОДАРКИ НА НОВЫЙ ГОД ДЛЯ СЕБЯ ЛЮБИМОЙ,22,2017-12-27T17:43:13.000Z,185398,23945,155,1668,False
OXUNOV TV,6,18.11.02,Узбекистан ва Тожикистон Чегарада АХВОЛ / САМАРКАНДЛИК ОПА,22,2018-02-11T02:41:08.000Z,2398,226,14,47,False
Русские романы,6,18.05.01,"Сальса 3-4 серия (сериал, мелодрама) Премьера фильма 2018",22,2018-01-04T12:49:07.000Z,37056,64,40,13,False
GAN_13_,6,17.30.12,Мама и бухло,22,2017-12-29T15:46:11.000Z,156199,12853,108,516,False
ПЕРСОНАЖ НОВОСТИ ДОМ 2,6,18.13.02,Дом 2 новости 18.02.2018 (раньше эфира). Слухи сегодня 18 февраля 2018,22,2018-02-12T10:33:11.000Z,3518,18,8,10,False
Бизнес Молодость,6,17.23.11,Финал РЕАЛИТИ-ШОУ Вызов или нет? Малышка облажалась или заработала миллион? Смотри финал реалити шоу,22,2017-11-22T08:14:16.000Z,87904,1210,53,238,False
Programas Teocraticos,6,17.22.11,Встреча в будние дни 2017-11-20,27,2017-11-21T05:23:57.000Z,8213,112,11,0,True
MANDARIN NEW,6,18.22.04,4 ЛАЙФХАКА ИЗ КИТАЯ,24,2018-04-21T16:32:39.000Z,75903,4256,191,714,False
Slith,6,17.21.11,BROFIST.IO ЧИТЫ! 100% ПРОХОЖДЕНИЕ ВСЕХ КАРТ BROFIST IO,20,2017-11-20T11:16:12.000Z,72992,1176,365,602,False
Deshnov,6,18.05.03,Как я Воровал в Детстве 2,24,2018-03-04T12:31:03.000Z,175968,14637,301,985,False
BEST of MMA UFC,6,17.31.12,ХАБИБ НУРМАГОМЕДОВ ПОСЛЕ ВЗВЕШИВАНИЯ О БОЕ С БАРБОЗОЙ НА UFC 219,17,2017-12-30T13:10:14.000Z,48301,617,10,87,False
Chef Odinahon,6,17.17.11,"NOGIRON KELIN, ORZU HAVASLI QAYNONA, E'TIBORSIZ ONA MASHMASHASI",27,2017-11-17T00:04:21.000Z,2914,30,3,0,True
Денис Косяков,6,17.16.11,Косяковобзор второй 1/2 КВН 2017,22,2017-11-15T15:08:30.000Z,55564,2125,451,777,False
MOPS БЭТЬ СТРИМ,6,17.20.11,В ГОСТЯХ У КЛИМА И АНДРЕЯ ЩАДИЛО ГУФ ИЗ ГОРЕМА,22,2017-11-19T17:34:30.000Z,23721,91,74,40,False
ARTEM MAER,6,18.05.01,Azizyanner - bocer 49 (BEST SITCOM) / Азизяннер - приколы 49 / Ազիզյաններ - բոցեր 49,22,2018-01-04T07:50:32.000Z,93565,689,86,62,False
ВЕДЬМА ВИВИЕНА,6,18.25.04,ГДЕ И С КЕМ ОН СЕЙЧАС ?,29,2018-04-24T09:02:42.000Z,12631,509,33,47,False
LeBwa | World of Tanks,6,18.01.01,Открытие 180 коробок. Новогодний стрим,20,2017-12-31T18:51:37.000Z,60870,4359,146,48,False
Merjvac Merjvace,6,18.16.01,Merjvace 444 anons 16 01 18 /Մերժվածը 444 անոնս հայերեն/мержвац 444,22,2018-01-15T19:31:26.000Z,46479,215,15,49,False
На Кухне,6,17.19.12,ЁЛОЧНЫЕ ШАРИКИ на закуску,26,2017-12-18T09:00:01.000Z,58705,4164,85,793,False
NL International,6,17.19.11,Звездный марафон NL International 2017 Moscow,22,2017-11-18T17:20:52.000Z,40502,1346,83,0,True
Nastia Cranberry,6,17.14.11,"ОГРОМНАЯ ДОЗА УЮТА 😍⛄ ДЕКОР, ЕДА, МУЗЫКА, АРОМАТЫ",26,2017-11-13T08:51:43.000Z,21509,1923,30,173,False
Юмор Ржач 2018,6,18.16.01,НЕДЕТСКИЙ детский утренник,22,2018-01-15T15:02:03.000Z,106657,964,1366,308,False
ROBIN POLYAKOV,6,18.13.02,Срочная новость № 1,25,2018-02-12T10:09:34.000Z,4070,955,4,56,False
Черная жемчужина 2017,6,17.25.11,Черная жемчужина 9 серия русские субтитры ПОДПИСЫВАЙТЕСЬ И ВЫ УВИДИТЕ САМЫМИ ПЕРВЫМИ НОВЫЕ СЕРИИ,1,2017-11-24T08:40:23.000Z,14203,143,11,24,False
WorldNews,6,17.18.11,31-летняя красавица стала последней музой Михаила Задорнова  (17.11.2017),25,2017-11-17T13:21:47.000Z,11437,30,13,16,False
Lady TV,6,18.02.01,МАКИЯЖ для ПРОБЛЕМНОЙ КОЖИ. 10 способов стать идеальной,26,2018-01-01T09:00:07.000Z,8522,160,24,67,False
Lysenkov TV,6,18.15.01,И в последние секундочки мы впендюрили им шайбу... Установка Сони Гудим для хоккеистов,17,2018-01-14T08:52:58.000Z,4903,21,14,4,False
Рецепты Бабушки Эммы,6,17.19.11,Простой Наполеон к новому году — рецепт Бабушки Эммы,24,2017-11-18T09:43:08.000Z,21268,2086,33,146,False
Наша Кухня,6,17.06.12,Торт Избушка без Выпечки! Когда нет времени на готовку!,22,2017-12-05T12:00:01.000Z,14843,862,29,24,False
Савельев Андрей,6,18.08.01,РН-Насущное. Грудинин или Путин? Голосовать или не голосовать?,25,2018-01-07T11:19:05.000Z,11921,599,75,632,False
#НаДонышке,6,17.14.11,"Доктор Рихтер 1 серия ( Мелодрама, Сериал )",22,2017-11-13T11:56:26.000Z,17895,48,31,39,False
Соеров Шоу,6,18.08.01,Новый Токийский гуль и кинопрокат аниме в России,24,2018-01-07T09:00:00.000Z,138194,15067,483,1293,False
Елена Tarocchi,6,17.07.12,ЧТО МЕНЯ ЖДЁТ В НОВОМ 2018 ГОДУ? ТАРО-ПРОГНОЗ НА 2018 ГОД | Online tarot reading,22,2017-12-06T16:54:27.000Z,6478,325,37,35,False
Ивангай,6,17.15.11,ИВАНГАЙ НАКРУЧИВАЕТ ?!,28,2017-11-14T04:28:19.000Z,133662,5663,7666,420,False
Кухня наизнанку,6,18.22.04,СКУМБРИЯ может удивить!,22,2018-04-21T16:37:37.000Z,8768,945,19,104,False
Тимур Gazi,6,17.29.11,Про принца Гарри и “Черную Мадонну“. #204,25,2017-11-28T17:28:37.000Z,3866,233,8,128,False
Igor Jumatov,5,18.21.02,Миллион долларов за год на ICO,22,2018-02-21T00:23:32.000Z,1937,219,36,121,False
Биатлон - Лыжные гонки,5,17.26.11,Лыжные гонки МУЖЧИНЫ 15км Классика  Кубок мира. Рука (Финляндия) 25.11.2017 ► Eurosport HD,17,2017-11-25T13:25:58.000Z,5988,70,6,1,False
музыченко,5,17.01.12,ВЛОГ МУЗЫЧЕНКО/НЕ ПЛАТЯТ ЗАРПЛАТУ/НОВЫЙ АЛЬБОМ/ТУР ПО РФ,22,2017-11-30T06:18:44.000Z,63341,4035,91,169,False
По-Братски,5,18.17.03,ЧАТРУЛЕТКА СТРИМ (я в шоке),22,2018-03-16T17:49:24.000Z,183108,22459,200,1478,False
ЛЕДИ БАГ И СУПЕР-КОТ - Россия,5,17.18.11,Леди Баг и Супер-Кот: Тайны – Вебизод 1 | «Двойная жизнь Маринет» (Канал Disney),1,2017-11-17T22:49:08.000Z,17982,2983,77,0,True
Mighty Car Mods на русском от BMIRussian,5,17.18.11,Преображение 350Z Часть 2 [BMIRussian],2,2017-11-17T19:03:55.000Z,40989,2853,33,83,False
AvtoDor,5,17.02.12,Быдло едет по встречке и как их нужно наказывать 2017,2,2017-12-01T18:02:44.000Z,4882,75,23,21,False
Муниципальные хроники,5,17.15.12,Прокуратура пришла в кабинет Яшина,25,2017-12-14T15:40:07.000Z,17318,1900,11,217,False
Anna Garyaeva,5,18.03.06,СЛАЙМ МОРОЖЕНОЕ И СКВИШИ ПАНДА!😋 ШОК!😱|@slime_rostowdon,26,2018-06-02T14:24:15.000Z,44773,2304,101,736,False
А можно по-другому,5,17.25.11,"Мои покупочки Фикс Прайс, Фамилия, Галамарт 💖💙💟 красота и милота на полочках Мо 😻",22,2017-11-24T15:13:46.000Z,6894,126,24,47,False
iKnow Channel,5,18.01.06,С 1970 года он собирал монеты и спустя 45 лет НЕ ПОВЕРИЛ услышанному,27,2018-05-31T13:15:00.000Z,196762,4220,309,846,False
Александр,5,17.14.11,"Кемерово, Кольцо, 13.11.2017",2,2017-11-13T10:23:35.000Z,2515,1,0,0,False
Очкастый Задрот,5,18.05.05,"КОРОЧЕ ГОВОРЯ, ВЕРНУЛИ АЙФОН",23,2018-05-04T07:00:12.000Z,130884,8394,964,1931,False
vanzai,5,18.13.05,3 лучшие закуски к фильму / снеки под просмотр фильма,22,2018-05-13T05:24:57.000Z,98005,6994,95,399,False
Skrip Skrep,5,18.29.03,Прощание в Кемерово,22,2018-03-27T10:04:10.000Z,204661,1912,1009,23,False
Зважені та щасливі,5,17.18.11,Зважені та щасливі. Сезон 7. Выпуск 12. Часть 3 из 4 от 16.11.17,24,2017-11-16T21:24:13.000Z,34736,78,10,52,False
Самое интересное на YouTube,5,18.01.04,Игорь Востриков показал видео с камер из прохода в кинотеатр Зимней Вишни. Про травлю в интернете.,22,2018-03-31T08:32:07.000Z,984298,9014,6097,8810,False
KatRen Play,5,17.11.12,БИАТЛОН 2017 КМ ЭСТАФЕТА. ЖЕНЩИНЫ. ХОХФИЛЬЦЕН,17,2017-12-10T13:18:15.000Z,29167,73,55,5,False
RaiderGame,5,17.23.11,Новое интро для Endertale (дата выхода в декабре),20,2017-11-22T13:24:02.000Z,7029,608,18,106,False
Джингл Джангл,5,18.14.02,Стас Давыдов - ДЕНЬ СВ. ВАЛЕНТИНА (Я БУДУ...) премьера клипа,10,2018-02-13T15:28:59.000Z,95202,21023,1011,1253,False
LitBoiCartier,5,17.31.12,(FREE) Travis Scott & Quavo Type Beat 2018 CACTUS HUNCHO (Prod LitBoiCartier),10,2017-12-29T23:30:35.000Z,40405,46,25,13,False
Кладоискатель Белый Копатель,5,17.26.11,РАЙ ДЛЯ КЛАДОИСКАТЕЛЯ - НЕТРОНУТЫЕ ДЕРЕВЕНСКИЕ ОГОРОДЫ!,19,2017-11-25T10:38:00.000Z,4065,281,18,82,False
Онтон Болотов,5,17.13.12,НОВЫЙ КЛИП МАРЬЯНЫ РО МЕГА-ЗВЕЗДА \ РЕАКЦИЯ,23,2017-12-12T08:19:48.000Z,23283,3436,126,358,False
NEMAGIA,5,17.19.11,ВидеоОбзор#3 - РЕСТОРАТОР,23,2017-11-18T12:29:04.000Z,1170020,142010,8928,14731,False
Андрей Хоров,5,17.15.11,Пусть говорят 14.11.17 Дмитрий Марьянов все-таки убит? 14.11.2017 Последний выпуск от 14 ноября 2017,22,2017-11-14T11:13:51.000Z,13813,34,13,35,False
ReSport KG,5,17.10.12,Новый бой: Мыктыбек Мамасалиев против Юрий Проценко / Полный бой!,17,2017-12-09T16:56:43.000Z,84655,572,441,743,False
Проект Магнит,5,17.05.12,Почему я всё ещё жива? | Трогательная история  Валерии Гордиенко,29,2017-12-04T18:52:00.000Z,16003,1764,19,191,False
1tvDance,5,17.23.12,Mikhail Kolyada FS 2018 Russian Nationals,17,2017-12-22T16:37:52.000Z,9585,108,19,24,False
Марифания,5,18.13.03,Егор Крид любовь Даши Клюкиной,22,2018-03-11T18:52:56.000Z,13130,50,6,9,False
Морфик,5,17.16.12,12 КРУТЕЙШИХ ФОКУСОВ! ПОПРОБУЙ НЕ ЗАЛИПНИ ЧЕЛЛЕНДЖ #17,20,2017-12-15T13:01:25.000Z,22025,557,32,63,False
TURK SERIALLARI OBUNA BO'LING,5,18.14.02,ICHKARIDA 51 QISM O'ZBEK TILIDA / ичкарида 51 кисм турк сериали узбек тилида,22,2018-02-13T15:29:27.000Z,15577,143,8,25,False
Дерзкие Бойцы,5,18.05.01,18 Летний Русский Боец Войдет В Историю За Этот Нокаут,17,2018-01-04T13:22:19.000Z,9208,104,5,5,False
Paramount Pictures,5,17.14.12,Annihilation (2018) - Official Trailer - Paramount Pictures,1,2017-12-13T14:00:03.000Z,2110582,15604,1254,2177,False
Лучшие Инставайны,5,18.15.03,ЛУЧШИЕ ВАЙНЫ 2018 | Новые Инстаграм Вайны | Подборка Лучших Вайнов Недели Русские и Казахские вайн,23,2018-03-14T14:39:01.000Z,23683,395,21,46,False
СЕРИАЛЫ ОНЛАЙН,5,18.26.01,Склифосовский 6 сезон 7 и 8 серия (НОВЫЙ СЕЗОН 2018) смотреть сериал онлайн,1,2018-01-24T20:27:36.000Z,23790,17,4,0,True
ВОТ ТАК,5,18.19.03,Президентские выборы в России 2018. Специальный выпуск Вот так,25,2018-03-18T19:22:51.000Z,74965,333,286,45,False
ASMR Tanya Shayk,5,18.04.05,"АСМР  стрим можно я буду не чудо женщиной,а чудо девочкой ? ха ха I ASMR stream",22,2018-05-04T02:15:09.000Z,38601,1406,332,3,False
Fast Food Music,5,18.27.02,"LIZER о распаде ЗАКАТ 99.1, копировании Trippie Redd и накрутке репостов + Конкурс",10,2018-02-26T16:43:40.000Z,83978,4319,688,654,False
"Огород, где все растет",5,17.01.12,"261. ✅ПОКУПАЕМ СЕМЕНА, которые никогда не подведут",22,2017-11-30T08:21:33.000Z,8123,542,14,92,False
ПОЛИТИКА 365,5,17.20.12,"Навальный, Путин, Грудинин и другие на выборах 2018!",25,2017-12-19T10:33:56.000Z,66143,2281,179,1446,False
Фильмы Навсегда,5,18.17.04,Ивановы-Ивановы - Серия 33,1,2018-04-16T18:00:00.000Z,130290,1781,120,200,False
Н А Г Л Ы Й к о т,5,18.05.02,"Люди проходили мимо умирающего котенка, пока одна женщина не сложила его в свою сумку…",15,2018-02-04T13:28:45.000Z,12715,652,5,56,False
The Tonight Show Starring Jimmy Fallon,5,18.27.04,Avengers: Infinity War Cast Sings The Marvel Bunch,23,2018-04-26T03:45:00.000Z,2597339,128764,1619,5123,False
Russia Hockey,5,18.13.01,WW U18. SF Sweden - Russia,17,2018-01-12T23:56:17.000Z,64686,371,73,25,False
GOOD WOOD,5,17.20.12,Сколько стоит дом в Америке? Ипотека и кредит в США. Бирюзовые компании. Часть 2,22,2017-12-19T15:56:28.000Z,144549,803,265,233,False
Семен Слепаков,5,18.03.04,Панамера,23,2018-04-02T14:12:10.000Z,134281,10755,339,680,False
Эркиндик,5,18.05.03,Митинг! 5-март. Бишкек,22,2018-03-05T04:59:33.000Z,38325,782,89,387,False
Доф,5,18.27.01,Делаем 3D-Саника и пытаемся не орать,23,2018-01-26T10:56:41.000Z,33339,2862,38,415,False
Флуффи,5,18.13.03,ФЕЙС испортил МАРЬЯНУ РО. FACE и Maryana Ro РАССТАЛИСЬ из-за ИВАНГАЯ,24,2018-03-12T11:00:02.000Z,52678,6212,786,1508,False
Katya Adushkina,5,17.22.12,Видео с НИКИТОЙ///Первое неловкое свидание???,24,2017-12-21T16:51:31.000Z,470140,55167,1483,5521,False
Светлана Божина,5,18.23.01,Паттайя🍍Домашние посиделки в Куала-Лумпур ☕Посылка для съёмок 🤗,19,2018-01-22T12:11:01.000Z,10312,397,62,62,False
Universal Pictures Russia,5,17.26.12,Я ХУДЕЮ в кино 8 марта. Трейлер,1,2017-12-25T08:36:15.000Z,77420,584,778,150,False
DJ RADIO,5,18.11.03,Международная пилорама с Тиграном Кеосаяном 10 Марта 2018,22,2018-03-10T15:20:27.000Z,80545,1312,317,280,False
Irina Yasinskaya,5,18.13.05,ПРИЗРАК В МОЕМ ДОМЕ ЧТО ТО ПОШЛО НЕ ТАК ВЕДЬМА НАПАЛА ШЕСТОЙ ДЕНЬ | КНИГА ВЕДЬМ #7,24,2018-05-13T06:45:01.000Z,8384,346,44,352,False
PostMaloneVEVO,5,17.22.11,Post Malone - rockstar ft. 21 Savage,10,2017-11-22T05:00:01.000Z,556200,123831,2070,20859,False
Юра Озаровский,5,17.26.11,"Первый полет на квадрике, на пляже Кавказ - Анапа 25.11.2017",19,2017-11-25T16:29:25.000Z,2898,543,4,182,False
Gagik SHAMSHYAN,5,18.09.01,"«Ճվճըվ Արոյի» որդին, ով BMW X6-ով բախվել էր ՃՈ Toyota-ին տեղափոխվեց քննչական վարչություն",25,2018-01-08T13:18:11.000Z,82783,0,0,0,True
GOLDEN SECTION,5,17.26.11,25/11/2017/СРОЧНО!! В США ПРОСЫПАЕТСЯ ВУЛКАН ЙЕЛЛОУСТОУН!!,29,2017-11-25T12:59:31.000Z,85156,255,134,130,False
Red Smiley,5,17.24.12,"10 СЕРИЙ популярных МУЛЬТФИЛЬМОВ, которые НЕ ПРОШЛИ ЦЕНЗУРУ",24,2017-12-23T07:26:01.000Z,42368,1205,159,333,False
Evelinushka,5,17.20.11,"Блоггеры, которые повлияли на меня",22,2017-11-19T09:53:33.000Z,64798,10887,282,496,False
Senya Miro,5,17.20.11,РЕМОНТ в ХРУЩЕВКЕ. ДО и ПОСЛЕ - Senya Miro,22,2017-11-20T05:00:00.000Z,8400,1174,26,351,False
Alina Rukodelie,5,17.17.11,Влог: в гостях у мамы:)/ вышивка,26,2017-11-16T15:00:03.000Z,3630,0,0,17,False
Знай Больше,5,18.06.06,"10 ВЕЩЕЙ, которые ВЫ УВИДЕТЕ РАЗ в ЖИЗНИ",24,2018-06-05T16:30:00.000Z,131763,3864,170,451,False
BLACKPINK,5,18.06.06,BLACKPINK - 'SQUARE UP' ROSÉ MOVING POSTER,22,2018-06-06T01:40:02.000Z,1289982,226254,1322,28344,False
KendrickLamarVEVO,5,17.22.12,Kendrick Lamar - LOVE. ft. Zacari,10,2017-12-22T05:00:05.000Z,469554,95911,726,11132,False
Воплощенные идеи,5,17.15.11,ИГРУШКИ АНТИСТРЕСС / ПОСЫЛКИ ОТ ПОДПИСЧИКОВ / ДЕШЕВЫЕ КУКЛЫ МОНСТЕР ХАЙ / ПОДАРКИ НА НОВЫЙ ГОД,26,2017-11-14T16:35:11.000Z,148298,9383,1165,939,False
Новые ВОЕННЫЕ.,5,17.10.12,ФИЛЬМ-СУПЕР! ОТЛИЧНОЕ КИНО - Тухлое дело БОЕВИК ФИЛЬМ 2017,1,2017-12-09T04:00:00.000Z,46587,67,27,5,False
Mirya Green Flame,5,18.19.02,~ТАНЦЫ В МОЕЙ КРОВАТИ~ MEME (FlipaClip),22,2018-02-18T23:02:13.000Z,4253,711,24,303,False
ФАКТОРИЯ,5,18.04.01,ЗАМЕРЗШИЕ ВО ЛЬДУ ЖИВОТНЫЕ,24,2018-01-03T10:30:02.000Z,14059,617,17,97,False
КХЛ,5,18.14.01,Матч Звезд 2018. Мастер-шоу. Круг на скорость,17,2018-01-13T13:23:46.000Z,7200,53,8,2,False
Кино1ТВ: сериалы и фильмы HD,5,18.15.02,Чужая дочь. 1 серия,1,2018-02-15T08:00:01.000Z,4928,53,5,5,False
Маш Милаш,5,17.17.11,"ТИМУР РОДРИГЕЗ - про РЭП, ЮРИЯ ДУДЬ и МАРТИРОСЯНА, Comedy Club",22,2017-11-16T18:05:36.000Z,26019,1871,119,126,False
BFIGHTER,5,18.01.01,ГОНОРАРЫ УЧАСТНИКОВ UFC 219! ХАБИБ ЗАРАБОТАЛ 9 МЛН!,22,2017-12-31T13:10:35.000Z,104415,1279,164,235,False
Наиль Порошин,5,18.07.01,Ремонт после  антиремонта на  СТО,28,2018-01-06T23:02:46.000Z,2941,365,11,71,False
САШКО ФОКИН,5,18.13.01,ВСЕ ДЕВУШКИ - ТЁЛКИ ► Саша Фокин ПОСЛЕ передачи КОХАНА МИ ВБИВАЕМО ДІТЕЙ,15,2018-01-12T07:00:03.000Z,63635,4395,397,894,False
В Рейтинге,5,17.11.12,Лучшие новые трейлеры фильмов 2017 (49-я неделя),1,2017-12-09T12:03:06.000Z,135446,1039,137,37,False
djvlad,5,17.13.12,"Oxxxymiron on Leaving Russia as Communism Fell, Starting to Rap at 13 (Part 1)",24,2017-12-12T20:59:34.000Z,44892,1966,40,435,False
GAP NADORM,5,17.14.12,КАРОМАТ ШАРИПОВ РОИ КАРДАН БА ТОЧИКИСТОН,23,2017-12-13T21:47:09.000Z,15884,325,137,197,False
Забитые Тв,5,18.14.01,ЗАБИТЫЕ РУКИ #8 — ПРОФЕССИОНАЛЬНАЯ ТАТУИРОВКА В ДОМАШНИХ УСЛОВИЯХ,24,2018-01-13T17:51:10.000Z,19248,1401,14,90,False
доктор Евдокименко,5,17.30.11,"Камни в желчном пузыре, симптомы, лечение. Удален желчный - последствия операции, и что делать.",28,2017-11-29T09:30:01.000Z,6005,641,8,139,False
Mr. Dim4ik,5,18.07.01,ТИПЫ ЛЮДЕЙ ПЕРЕД СНОМ,23,2018-01-06T11:59:49.000Z,127707,12686,732,2248,False
The Best,5,17.27.12,ТЕСТ НА ПСИХИКУ 2017! ПОПРОБУЙ НЕ ЗАСМЕЙСЯ! ЛУЧШИЕ ПРИКОЛЫ И ВАЙНЫ!,23,2017-12-26T09:16:26.000Z,10765,360,44,25,False
FACE FAMILY,5,18.31.01,FACE И МАРЬЯНА НА ФОТОСЕССИИ [29.01.18],10,2018-01-30T09:18:34.000Z,4704,264,22,89,False
ЖЕЛЕЗНАЯ СТАВКА,5,18.21.01,Реалити-шоу ПАН или ПОПАН. Стрим. День второй.,22,2018-01-20T23:03:48.000Z,41036,1190,165,44,False
Одесское Общественное Телевидение,5,18.06.02,Свобода бандитов на Украине,25,2018-02-05T15:22:04.000Z,13903,2061,6,358,False
ЛСП,5,17.15.12,ЛСП - Маленький принц,10,2017-12-14T14:26:51.000Z,496245,72288,1632,3706,False
Мефисто,5,18.31.01,ОМЕРЗИТЕЛЬНАЯ ВОСЬМЕРКА/ВЕЛИКОЛЕПНАЯ СЕМЕРКА (ковбойская арифметика),23,2018-01-30T12:08:08.000Z,8642,1397,25,80,False
Сrazy World,5,17.29.11,СМЕШНЫЕ КОТЫ И КОШКИ 2017 ПРИКОЛЫ С КОТАМИ И КОШКАМИ 2017 ПРИКОЛЫ ПРО КОШЕК 2017 #71,15,2017-11-28T15:08:25.000Z,6624,170,30,17,False
iNEWSmix,5,18.27.03,Пожар в Кемерово ТЦ Зимняя Вишня. Хронология событий,22,2018-03-26T21:05:15.000Z,145667,1041,894,954,False
RAMusic,5,17.28.11,РОССИЯ | Полина Богусевич НЕ ДОСТОЙНА победы? | ДЕТСКОЕ ЕВРОВИДЕНИЕ 2017,10,2017-11-27T10:17:02.000Z,44040,4756,198,387,False
Анастасия Флешка,5,17.15.12,"Бюджетный ПРАЗДНИЧНЫЙ стол. Готовлю 10 блюд! Закуски, салаты",22,2017-12-14T13:30:01.000Z,43981,2343,102,378,False
ДНЕВНИК ДИЗАЙНЕРА,5,17.19.11,"Правильный стык, между ВАННОЙ и ПЛИТКОЙ",27,2017-11-19T04:08:02.000Z,15744,1920,49,116,False
Наше! Телевидение,5,17.19.11,Своя игра 18.11.2017,24,2017-11-18T07:28:09.000Z,11076,75,14,14,False
Black Russian Mama,5,17.18.11,Black Russian Mama — Сонная (Премьера Клипа),10,2017-11-17T07:27:54.000Z,86151,6113,368,293,False
SVTV,5,18.02.02,ЧТО ДЕЛАТЬ НА ВЫБОРАХ?,25,2018-02-01T16:01:47.000Z,19300,4481,3700,582,False
Новости дома 2,5,17.26.11,Свадьба Кузиных ( 24 ноября ),22,2017-11-24T22:53:43.000Z,15518,88,12,22,False
Путин Лидер,5,18.26.01,День студента - Создавай свое будущее,22,2018-01-25T06:38:04.000Z,134661,7548,12127,2448,False
Андрей Фурсов ШАФ рекомендации,5,17.20.11,Что будет с элитами когда выродятся массы. Андрей Фурсов,22,2017-11-19T10:16:30.000Z,7989,282,3,30,False
SAINTSSHOW,5,17.30.11,"КИРИЛЛ ТЕРЕШИН, ШПАК И МАЛАХОВ НА ПЕРЕДАЧЕ ПРЯМОЙ ЭФИР\СИНТОЛ ГОЛОВНОГО МОЗГА",22,2017-11-29T11:00:10.000Z,92777,736,205,327,False
SAMYY KLASS,5,17.20.11,ЛУЧШИЕ ПРИКОЛЫ SAMYY KLASS (ВЫПУСК 535),23,2017-11-19T11:01:21.000Z,89538,1969,121,128,False
Mike Shinoda,5,18.26.01,Place To Start (Official Video) - Mike Shinoda,1,2018-01-25T15:03:19.000Z,225248,16885,31,1008,False
Войны Бездорожья War Off-Road,5,17.17.12,Зверская мощь легендарного танка т 72 Уникальная видео как Русский танк застрял в грязи,2,2017-12-17T01:29:00.000Z,2336,50,20,4,False
Алексей Кунгуров,5,17.29.11,Война Мексики и США.  1846 год.  Мифы и реальности.  Находки соратников .,28,2017-11-29T01:18:31.000Z,3356,325,13,42,False
Моя территория,5,18.28.02,Игра в президента...,22,2018-02-27T18:51:26.000Z,4002,288,184,357,False
Анатолий Вассерман - Лента Выступлений,5,17.03.12,Анатолий Вассерман - Открытым текстом 01.12.2017,25,2017-12-01T18:28:26.000Z,37039,1986,44,216,False
Регрессивный гипноз-инструмент или оружие?,5,18.02.02,Фильм № 27 от Автора! О кремации.,22,2018-02-01T20:03:11.000Z,3018,185,29,149,False
Roman Stepanov,5,18.03.01,В Российском бушлате по Америке,22,2018-01-02T03:32:21.000Z,82195,7314,273,976,False
СПЕЦ,5,18.31.03,У кемеровской трагедии есть имя и фамилия #АлександрПасечник,25,2018-03-30T05:34:22.000Z,229968,5949,6889,2190,False
Около Pit_Stop,5,18.03.02,"Ксюмобиль всё, Индиан - развод, мопед под клиента, глушитель тихо смеялся в сторонке",2,2018-02-02T20:23:56.000Z,20040,1279,51,268,False
Дом в Глуши,5,18.10.02,"ДЕДОВСКОЕ  ОТОПЛЕНИЕ + Современные технологии. Дрова, Вода, Электричество",22,2018-02-10T01:46:33.000Z,2023,209,19,121,False
Irina Belaja,5,17.25.11,ВКУСНЕЙШЕЕ БЛЮДО КАРТОШКА - ГАРМОШКА ЗАПЕЧЕННАЯ В ДУХОВКЕ | Irina Belaja,26,2017-11-24T14:00:04.000Z,7548,0,0,38,False
German Le Classique,5,17.18.11,ПРАВДА или ЛОЖЬ с ФУТБОЛИСТОМ СБОРНОЙ РОССИИ,22,2017-11-17T14:37:36.000Z,91689,12557,72,257,False
QOYIL UZ,5,18.09.01,' Келин Шарманда Бўлди! Кайнотасига Тухмат Килган Экан,1,2018-01-08T05:43:46.000Z,138235,595,465,0,True
UFC - Ultimate Fighting Championship,5,17.30.12,UFC 219: Official Weigh-in,17,2017-12-30T00:26:35.000Z,240792,3094,92,1327,False
MARFFA,5,18.14.04,ЛИЗУН из ТУАЛЕТНОЙ БУМАГИ и САЛФЕТОК | БЕЗ КЛЕЯ | ПРОБУЕМ СТРАННЫЕ ЛИЗУНЫ,24,2018-04-14T08:24:30.000Z,12803,1001,86,627,False
Спортивный Новости Спорта,5,18.21.01,Мхитарян попрощался с МЮ. Гвардиола поздравил Санчеса и Арсенал. Коутиньо не получит 7 номер.,17,2018-01-20T09:55:21.000Z,16276,185,13,18,False
Anna Chi DIY,5,18.30.04,ОГРОМНЫЙ IPHONE X СКВИШИ АНТИСТРЕСС | DIY IPHONE X SQUISHY,24,2018-04-29T07:00:16.000Z,423301,21428,615,3325,False
2MinNews ПОДПИШИСЬ!,5,17.15.11,ХАБИБ ПРОТИВ ТОНИ НА UFC219! ХАБИБ ВЫЙДЕТ НА ЗАМЕНУ КОНОРУ МАКГРЕГОРУ! ОФФИЦИАЛЬНО,17,2017-11-14T18:07:46.000Z,26980,403,99,70,False
турецкие сериалы,5,18.08.02,Эртугрул 106 серия. Анонс НА РУССКОМ!,1,2018-02-07T23:07:40.000Z,3130,76,2,3,False
SFoty поздравительные открытки и музыкальные видеоклипы,5,18.07.01,С РОЖДЕСТВОМ ТЕБЯ! музыкальная открытка для друзей,10,2018-01-05T20:49:42.000Z,157229,1820,83,36,False
Bizim Hikaye,5,17.18.11,Bizim Hikaye 10. Bölüm - Tek Parça - Full Bölüm,1,2017-11-17T07:00:02.000Z,623047,6232,396,1137,False
vangogh TV,5,17.18.11,Жена Малахова родила мальчика: вес 4 кг рост 54 сантиметра,24,2017-11-17T17:21:10.000Z,9624,0,0,0,True
Гараж Дубляж,5,17.01.12,Мечты Навального,23,2017-11-30T12:24:34.000Z,65330,2347,3653,635,False
NewTV Патруль,5,18.15.01,NewTV Патруль №37 12 миң АКШ долларым жоголду деген МАС кыз,22,2018-01-14T15:34:14.000Z,23007,284,46,216,False
РусоФобс TV,5,18.27.01,РусоФобс TV #2 | КТО ЗАХВАТЫВАЕТ АРКТИКУ,23,2018-01-26T04:03:41.000Z,101204,1073,462,347,False
Приколы TV,5,18.12.03,ОСТОРОЖНО ⛔ УБОЙНЫЕ ПРИКОЛЫ 2018 МАРТ Ржака Жесть Угар,23,2018-03-11T06:08:40.000Z,10819,84,30,1,False
Milan StudioHD,5,17.19.12,Sevgi istirobi 79.qism Uzbek Tilida HD,1,2017-12-18T16:04:21.000Z,6686,84,6,71,False
EviL GrannY | World of Tanks,5,18.21.01,ОБ. 263 - УСПЕТЬ ВЗЯТЬ 3 ОТМЕТКИ,20,2018-01-20T20:17:03.000Z,70993,4533,166,54,False
Alla Pogodaeva/Beauty Blogger,5,17.29.12,СЕЛЕДКА ПОД ШУБОЙ/КОТЛЕТЫ КУРИНЫЕ/МАКИЯЖ КОСМЕТИКОЙ ФАБЕРЛИК,22,2017-12-28T19:35:25.000Z,8250,586,12,60,False
Click on Life,5,18.08.03,Почему у САНТА ФЕ на потолке ТРЕНИКИ? Прощай СОРЕНТО ПРАЙМ!,22,2018-03-07T16:00:07.000Z,20437,504,28,55,False
TaylorSwiftVEVO,5,18.13.01,"Taylor Swift - End Game ft. Ed Sheeran, Future",10,2018-01-12T05:00:01.000Z,14089955,1065805,47841,96579,False
Turma da Mônica,5,18.05.04,"Mônica Toy |  Toys mil e Um - Assim falou toy, toy, toy (T06E08)",1,2018-04-04T18:02:08.000Z,300997,2385,301,186,False
Natalie Kisel,5,17.03.12,"DIY ЕДИНОРОГИ: Декор, KAWAII Вещи Своими Руками/Натали Кисель",26,2017-12-02T13:04:43.000Z,79455,8850,199,2262,False
Quad Theory,5,18.24.04,"LIVE Serzh Sargsyan RESIGNED! Սերժ Սարգսյանը հրաժարական է տվել. April 23, 2018",25,2018-04-23T17:36:29.000Z,67691,576,41,18,False
EvgenComedian,5,18.01.01,Новогоднее поздравление 2017,22,2017-12-31T20:00:03.000Z,119478,27930,103,1095,False
NugoBasilaiaa,5,17.15.11,Russia Vs Spain 3-3 - All Goals & Highlights - Resumen y Goles 14/11/2017 HD,17,2017-11-14T20:38:59.000Z,176533,842,147,249,False
Hoang Guan,5,18.15.03,"Осколки 5-6 серия Премьера 2018 Русские мелодрамы 2018 новинки, сериалы 2018 HD",1,2018-03-14T13:18:51.000Z,24726,55,26,12,False
УСПЕШНАЯ ГРУППА,5,18.02.02,Джарахов – Делориан,10,2018-01-31T13:03:26.000Z,2024592,272029,20432,17152,False
ProDrive,5,17.20.11,Купил Лада ВЕСТА СВ КРОСС Без Допа. Без наценок. Выдача,2,2017-11-19T06:07:34.000Z,160209,4005,566,645,False
Kanal24.az,5,18.06.01,Onlar 2018-ci ildə öləcək  GÜNDƏM XƏBƏR (05.01.2018),25,2018-01-05T19:58:16.000Z,28605,152,53,14,False
MoyGorod,5,18.26.03,Кемерово. хроника 25 марта 2018 пожар в ТРЦ Зимняя вишня,29,2018-03-26T03:37:41.000Z,6856,163,33,132,False
Ari Rang,5,17.19.12,KIM JONGHYUN (SHINEE) МИНУТА МОЛЧАНИЯ | ARI RANG,24,2017-12-18T20:00:18.000Z,23907,5679,11,512,False
Асхаб Алибеков,5,18.28.02,Путин...мстит..Асхабу,22,2018-02-27T06:36:40.000Z,311212,28441,39118,12796,False
Новости спорта 8NewsRu,5,17.29.11,Что на самом деле происходит с «Салаватом»? Хоккейная неделя с Алексеем Шевченко #16,22,2017-11-28T10:48:24.000Z,4099,96,2,7,False
GoodMax,5,17.05.12,ПОПАДИ ПОД ДРОП ЧЕЛЛЕНДЖ vs. ЛАКЕР,22,2017-12-04T15:05:52.000Z,90278,11675,321,541,False
Sergey Romanovich,5,17.06.12,БРАК И РАЗВОД. КИНО И ЖИЗНЬ.,26,2017-12-05T17:23:58.000Z,37173,2136,17,195,False
Андрей Угланов,5,17.16.12,ПАВЕЛ ГРУДИНИН БРОСАЕТ ВЫЗОВ ПУТИНУ,22,2017-12-15T07:25:40.000Z,67665,2842,2505,468,False
M Kim,5,17.20.12,Вигуки: скрытые моменты #8. Что сейчас происходит?,22,2017-12-20T02:42:10.000Z,3123,421,1,50,False
Ани Лорак,5,17.07.12,Ани Лорак - Новый бывший (Тизер),10,2017-12-06T09:43:46.000Z,15013,396,13,24,False
TM STUDIO,5,18.21.02,Документальный фильм о выпуклой Земле.,28,2018-02-20T17:41:05.000Z,7992,1027,31,241,False
Народный канал,5,17.28.11,Ментовские войны 11 сезон 1 серия (2017) Криминал детектив фильм сериал,1,2017-11-27T11:04:08.000Z,74659,189,32,32,False
GURYEV TIME,5,18.04.02,МУРАТ ГАССИЕВ vs ЮНИЕР ДОРТИКОС (ОБЗОР БОЯ WBSS)!,17,2018-02-04T00:53:09.000Z,14325,350,42,117,False
Пенёк ТВ,5,17.31.12,БЕЗДОМНЫЙ ДВА | RYTP,23,2017-12-30T06:43:50.000Z,204557,22720,587,1750,False
Никита Исаев,5,18.15.02,Выборы в России: может ли Грудинин составить реальную конкуренцию Путину?,25,2018-02-15T08:13:57.000Z,37118,1546,4114,860,False
7KUN TV,5,18.15.02,55 НАФАР УЗБЕКИСТОН ФУКАРОСИ БУЛГАН АВТОБУС КОЗОГИСТОННИНГ ПАВЛАДОР ВИЛОЯТИДА...,24,2018-02-14T15:22:55.000Z,2525,5,5,3,False
Irina Dybro Tarot Reading,5,17.18.11,"Выходные дни. Таро прогноз 17-19 ноября, 2017",24,2017-11-17T14:25:45.000Z,12743,499,44,40,False
Istoria Music,5,17.29.11,NOFUN - Все проблемы из-за баб (Премьера),10,2017-11-28T06:54:12.000Z,213377,6969,2536,551,False
NarMahor,5,17.20.11,В гостях у Лены Василёк,10,2017-11-19T11:33:50.000Z,7194,540,9,61,False
Концептуал ТВ,5,17.30.11,Зачем народ заставляют каяться. Евгений Спицын,25,2017-11-29T16:44:43.000Z,4299,276,7,41,False
ANACONDAZ,5,17.20.12,"Anacondaz — Ненавижу (Official Music Video, 2017) (14+)",10,2017-12-19T09:39:13.000Z,206571,14254,1497,961,False
Фрунзе Life,5,18.07.01,"Борченов Шоу 1-чыгарылыш: Нурлан Насип, Кайрат Кыргыз",23,2018-01-06T10:16:43.000Z,21485,1485,92,229,False
Aygun Samadova,5,17.05.12,"Что произойдет в 26 серии Госпожа Фазилет и ее дочери анонс 26 серии на русском, 9 декабря",10,2017-12-04T12:10:28.000Z,7736,35,3,0,False
Magic Pets,5,18.23.05,КАЖДЫЙ КОТИК ТАКОЙ | ПАРОДИЯ Magic Pets,24,2018-05-22T13:40:11.000Z,166636,18884,145,3772,False
Хаски,5,17.24.11,Хаски - Крот 17,10,2017-11-23T19:07:09.000Z,150427,16448,421,1027,False
Olga Kondratyeva,5,17.21.11,Вяжем с WickedLynx. Вяжем Кокон. Часть 2,26,2017-11-20T07:57:15.000Z,7874,428,8,34,False
BBC Uzbek,5,18.02.01,Ўзбекистон аэропортларида декларация тўлдирмай ўтиш имкони пайдо бўлди - BBC O'zbek,25,2018-01-01T13:37:03.000Z,82625,0,0,41,False
moskoritus,5,17.19.11,Невеста из Стамбула - 25 серия (русские субтитры),1,2017-11-18T14:23:47.000Z,47864,303,68,74,False
Anastacia Kay,5,18.04.01,Мой ЕЖЕДНЕВНИК - БУЛЛЕТ ДЖОРНАЛ 2018!,26,2018-01-04T04:00:01.000Z,7205,794,9,61,False
Ебурдей Гордеевич,5,18.05.03,После футбола с Черданцевым  Выпуск 04.03.18,17,2018-03-04T20:33:39.000Z,3869,73,11,26,False
Anna Sheina,5,17.20.12,НОВОГОДНИЙ МАКИЯЖ 2018 / NEW YEAR'S MAKE-UP,22,2017-12-20T03:00:01.000Z,1377,145,8,13,False
Евгений Алексеевич Фёдоров,5,17.19.12,ХАЗИН. Медведев начал ТОПИТЬ ПУТИНА?,29,2017-12-18T16:30:01.000Z,10655,115,28,49,False
Слуга народа,5,17.14.11,"Слуга Народа 2 - От любви до импичмента, 21 серия",43,2017-11-13T18:46:28.000Z,293205,6707,195,652,False
МОТ,5,17.13.12,"Мот - Звуки пианино (премьера клипа, 2017)",22,2017-12-12T08:13:59.000Z,137427,6102,116,275,False
"Обо всем, что интересно!",5,18.04.03,Реакция в мире на речь Путина. Послание Федеральному собранию,25,2018-03-03T06:43:16.000Z,476146,2245,1858,1800,False
CrimeTimeRU,5,17.19.11,Polislə atışmada öldürülən Qocanın heç yerdə görmədiyiniz görüntüsü,25,2017-11-18T18:24:21.000Z,45651,411,58,128,False
YuliKa,5,18.14.04,ХОЛОСТЯК 6  Чего ждать от 6 выпуска / АНОНС 15.04.2018,22,2018-04-13T12:25:54.000Z,16836,95,8,24,False
ASMR live,5,18.19.01,АСМР Юный археолог 2,24,2018-01-18T18:35:28.000Z,6634,399,15,74,False
XATO TV,5,17.20.11,4 ЁШЛИ КИЗНИ Онаси ФОХИШАЛИК Килгани РОСТМИ,22,2017-11-19T14:30:00.000Z,38468,960,100,614,False
Roman Popov,5,17.08.12,7 декабря 2017. Военная обстановка в Сирии. Террористы ИГИЛ заявили о сбитом сирийском самолете.,25,2017-12-07T18:07:22.000Z,17237,917,22,122,False
Ozodlik Radiosi,5,17.14.11,Чегара очилганидан бери Қорасув бозори бироз жонланди,25,2017-11-13T12:16:14.000Z,36166,164,22,59,False
ПУШЕР,5,18.24.03,ВЗЛОМАЛИ САМЫЙ БОЛЬШОЙ АВТОМАТ С ЖВАЧКАМИ!!! 🔴 НОВЫЙ СПОСОБ!!!,24,2018-03-23T05:30:01.000Z,81511,948,887,143,False
Samsung YouTube TV,5,17.23.12,Феликс Бондарев  | RSAC - Держи меня за руку (ft. Шура Кузнецова) | Samsung YouTube TV | (12+),28,2017-12-22T04:33:35.000Z,94267,3968,437,200,False
JesusAVGN,5,18.01.01,НОВОГОДНИЙ ПЕРЕПОЛОХ!,20,2017-12-31T13:34:50.000Z,109482,24661,349,2322,False
Stikle prod.,5,18.25.01,Самолет садится в ШТОРМ. Дюссельдорф,24,2018-01-24T11:51:33.000Z,213652,5055,204,315,False
"Степан, Наливай!",5,18.07.03,Станислав Белковский март 2018. Срочный Выпуск!  2 Самые Важные новости!,22,2018-03-06T14:24:52.000Z,26057,411,94,140,False
"Прогнозы, которые сбываются",5,18.04.01,Александр Невзоров - Путин нaкoнeц-тo пoнял вo чтo влип!,22,2018-01-03T19:13:43.000Z,47689,687,1590,328,False
Анти Каратель,5,18.23.02,БОЙ РУСЛАН ОСТАШКО - ТОМАШ МАЦЕЙЧУК,22,2018-02-22T18:40:28.000Z,9419,181,19,172,False
УЛИТКА,5,17.14.12,Научно технический прорыв! Три инструмента из одного! Сделай и себе этот инструмент Крутая самоделка,28,2017-12-13T13:00:03.000Z,12600,318,42,101,False
Ёшкин Крот,5,18.13.02,Как связан рейтинг Путина с ростом ВВП?,22,2018-02-12T09:18:08.000Z,5439,875,15,83,False
Leon Weinstein,5,18.26.03,174: А если Трампа и Путина поменять местами... что будет?,22,2018-03-25T23:04:41.000Z,8286,720,20,150,False
Ларин Против,5,18.15.03,ЛАРИН О РЕАКЦИИ КАШИНА И КЛИПЕ ХОВАНСКОГО | ЛАРИН ПРОТИВ | ВЫБОРЫ | ДК | ХОВАНСКИЙ,22,2018-03-14T04:54:03.000Z,22458,682,18,68,False
Boris Pranks,5,18.21.02,Угадай Кто Пранк / Guess Who Prank - Russia | Boris Pranks,23,2018-02-20T10:43:01.000Z,93391,6063,148,996,False
QGI Amazing,5,17.19.11,Лиза и Гарри. Максим с Аллой обвенчались в церкви 2017,22,2017-11-18T13:28:01.000Z,12367,134,6,20,False
Ляпота ТВ,5,18.15.01,КЕВА ИДЁТ НА РАБОТУ! ЧТО СЛУЧИЛОСЬ У КОТИКА? НОВЫЙ СЕРЬЁЗНЫЙ КЕВИН! ВИДЕО ДЛЯ ДЕТЕЙ,24,2018-01-15T06:00:00.000Z,14335,2356,70,563,False
Alina Rin,5,18.08.01,ВЕДЬМАК 3 - КАМЕННЫЕ СЕРДЦА,20,2018-01-08T06:43:09.000Z,65739,3994,245,46,False
KAMAZ-master,5,18.08.01,КАМАЗ-мастер на ралли «Дакар 2018» - 7-е января - Победа Эдуарда Николаева и авария Айрата Мардеева,17,2018-01-08T05:33:22.000Z,1824,223,5,24,False
Karina Nigay,5,17.17.11,"TAG: ФАКТЫ ОБО МНЕ: Отношения, Дети, Мотивация",1,2017-11-16T10:49:28.000Z,32774,1669,154,296,False
h3h3Productions,5,18.17.01,The Logan Paul Odyssey,24,2018-01-16T22:14:37.000Z,2318060,239156,5251,32921,False
Настоящие Новости,5,18.10.02,Настоящие Новости  Дагестана Сегодня 9 февраля 2018 г,22,2018-02-09T16:00:03.000Z,12358,47,17,11,False
Julia Efimova,5,18.31.05,Я ТАКОГО НЕ ОЖИДАЛА! СЛАЙМЫ ОТ @__sky.slime__,15,2018-05-31T12:29:02.000Z,19941,1860,184,0,True
Tatiana Yakush,5,18.08.03,8 Марта   яркий день! И я спешу тебя поздравить!,22,2018-03-06T08:57:59.000Z,35206,0,0,40,False
Nechyporenko Сhannel,5,18.02.02,ПУТИН ГOΤOBИТ AΡECΤ ПАВЛА ГРУДИНИНА — Геннадий Зюганов — 1/02/2018,22,2018-02-01T09:46:58.000Z,106641,2237,5014,1058,False
КоЛена Гадание на Любовь,5,18.23.04,ТЯНЕТ ЛИ ЕГО КО МНЕ 🍓🍒  ГАДАНИЕ онлайн на ЛЮБОВЬ,26,2018-04-22T14:24:56.000Z,9744,796,25,113,False
Sofi Lapina,5,17.24.11,Софья Лапина — «Castles». Eurovision 2018 version.,10,2017-11-23T07:19:08.000Z,189192,5448,601,444,False
Всероссийский конкурс юных талантов Синяя птица,5,17.20.11,"Ляйсян Золотарева. Народный башкирский эпос «Урал-батыр», башкирская народная песня «Поющий журавл…",24,2017-11-19T15:58:25.000Z,4265,153,2,23,False
Познаватель,5,18.19.01,ЖЕЛЕЙНЫЙ МЕДВЕДЬ ВАЛЕРА ПРОТИВ ЖУЛИКОВ,24,2018-01-18T17:35:57.000Z,1099791,157773,2685,94416,False
Арбалет,5,18.04.01,Мэтт Ли - Хизер Нойерт - обмен любезностями - обзор брифинга,22,2018-01-03T19:47:10.000Z,5370,294,7,91,False
Аналитика Событий,5,18.06.01,Запад Не Знает Что Делать с Путином - Яков Кедми - 05.01.2018,22,2018-01-05T12:00:03.000Z,23158,164,126,64,False
Türk dizilerini,5,18.18.02,Любовь не понимает слов: Сколько дней ты со мной в качестве Хаят Узун (20 серия),1,2018-02-17T19:58:33.000Z,4279,69,0,2,False
ВЕРЬЁМИН,5,17.23.12,"10 МИФОВ ИЗ УЧЕБНИКОВ, В КОТОРЫЕ МЫ ВЕРИМ!",24,2017-12-22T16:30:01.000Z,12935,1003,48,79,False
Temnaya FAZA,5,17.16.12,Обзор машины ЦЫГАНСКОГО ТЕХНАРЯ! #1,28,2017-12-15T13:35:12.000Z,82573,6765,375,868,False
Лейла Капустина,5,17.19.11,5 юных и сказочно богатых жен олигархов.,22,2017-11-18T14:30:00.000Z,13906,25,26,15,False
SuperChannel,5,17.12.12,"Премьера 2017 ВЗЛЕТЕЛА ВВЕРХ [ БЛАТНЯГА ] Русские детективы 2017 новинки, сериалы 2017 HD",22,2017-12-11T16:02:00.000Z,31151,43,25,9,False
ТВ КАЙГУУЛ / TV Kaiguul,5,17.04.12,"TV Kaiguul 141 / Таанышына, керек болсо Атасына ишенген Айдоочулар/ НТС",29,2017-12-03T14:18:42.000Z,48644,275,121,237,False
Моторкина,5,18.03.03,СОЖГЛА ФИКС ПРАЙС !!!! ПОЛНОЕ РАЗОЧАРОВАНИЕ И ТЕСТЫ ДЕШЁВЫХ ТОВАРОВ ИЗ FIX PRICE / ПРОСТО ЖЕСТЬ,26,2018-03-03T04:31:10.000Z,1340,84,26,29,False
AhtubaTV,5,18.26.03,Пожар в ТЦ Зимняя вишня в Кемерово,25,2018-03-25T12:43:05.000Z,32572,77,2189,130,False
Ярослав Брин,5,18.24.04,"Сорвался с Диеты? Смотри, что делать! Выбираем на сушке творог, фитнес хлебцы / диета похудание",17,2018-04-23T08:55:51.000Z,62965,5531,105,809,False
Comics Lab,5,18.29.05,Росомаха и Саблезубый против ошибки Супермена и Бараки. Люди Икс: Начало. Росомаха,1,2018-05-28T09:05:29.000Z,61852,606,93,155,False
Nash HOCKEY,5,18.17.02,РОССИЯ - СЛОВЕНИЯ.ОБЗОР МАТЧА 16.02.2018.ОЛИМПИЙСКИЕ ИГРЫ.,22,2018-02-16T10:24:36.000Z,22757,143,11,25,False
MARKOV,5,18.24.03,МАЖОР 3 СЕЗОН  — ТИЗЕР (2018),1,2018-03-23T15:33:17.000Z,30002,698,79,74,False
Инстаграм Популярных Звезд,5,18.07.02,Отрывки с Батла Guf'a и Птахи.,10,2018-02-06T15:24:30.000Z,33336,84,17,10,False
Cпартак Чемпион,5,17.25.11,Зенит-2 - Спартак-2  1:1. Голы,17,2017-11-24T13:24:04.000Z,3940,14,4,9,False
Uzbek uz Video tv,5,17.06.12,Sevgi iztirobi 69 qism Turk seriali O'zbek tilida,22,2017-12-04T15:58:43.000Z,23969,276,23,73,False
BEST РЖАКА,5,18.23.01,Этот номер Квартала разносит некоторых в хлам - чп в семье президента сын опозорил Порошенко,23,2018-01-22T09:50:08.000Z,61761,320,58,12,False
Pastime Time,5,18.25.03,Все смеялись надо мной из-за моей груди (Story booth на русском)Русская озвучка,22,2018-03-24T12:17:04.000Z,3827,131,4,38,False
Mr.Dioxide,5,18.10.03,САМАЯ КРАСИВАЯ КОМНАТА? ОТЕЛЬ ЭЛЕОН В МАЙНКРАФТ #38,20,2018-03-10T05:41:28.000Z,41752,5110,111,1086,False
Kumapa,5,17.31.12,The Review - Хабиб Нурмагомедов – Эдсон Барбоза / Edson Barboza vs. Khabib Nurmagomedov,17,2017-12-31T05:24:44.000Z,105374,7509,476,1572,False
M-1 Global,5,18.23.02,"Прямая трансляция турнира M-1 Challenge 88, Москва, 22 февраля",17,2018-02-22T23:50:02.000Z,230018,2136,201,19,False
Шелест,5,18.09.01,"ЧЕ ПАЦАНЫ, ПеКа за 350$? (19К руб.)",28,2018-01-08T21:17:40.000Z,49097,5027,263,1070,False
Популярные видео,5,18.17.04,Тамаев в Пятигорске.Конфликт,22,2018-04-16T15:05:26.000Z,57487,0,0,58,False
RhymesTV,5,17.23.11,"ТОП 10 РУССКИХ РЭПЕРОВ, СТАВШИХ МЕМАМИ",22,2017-11-22T14:55:21.000Z,26325,892,103,93,False
My Life is MMA,5,18.01.01,Хабиб Нурмагомедов - пресс-конференция после боя на UFC 219 [Русская озвучка от My Life is MMA],17,2017-12-31T10:28:51.000Z,61236,1236,33,116,False
Клава Кока,4,17.05.12,#КокаПелла - Тролль / Время и Стекло (acapella cover by Клава Кока),10,2017-12-04T07:04:41.000Z,587415,66368,1602,6063,False
Евгений Цапков MotoStream,4,17.20.12,Сколько времени мотоцикл сможет работать в полный газ?,2,2017-12-19T07:57:36.000Z,116050,6672,309,739,False
Обмани Меня,4,17.13.12,«Обмани меня» с Петром Каменченко. Пилотный выпуск,22,2017-12-12T06:27:22.000Z,83911,808,186,49,False
Высокоточный Расклад Событий,4,18.04.02,"БУДET ПEPEBOPOT, ECЛИ ПУTИH APECTУET MEHЯ — Пaвeл Гpyдинин — 03.02.2018",26,2018-02-03T07:00:01.000Z,49559,2005,10121,955,False
ПРЕКРАШЕВ КОНСТАНТИН,4,17.18.12,БЛОГГЕРСКИЕ ШАРАДЫ - НИК ЧЕРНИКОВ,24,2017-12-17T14:00:01.000Z,16842,1520,47,78,False
Greek Channel,4,18.05.05,ТАЙНА ВТОРОЙ АЛИСЫ?? КТО ОНА? ЭЛЛИСОН АНГЕЛ? СЕКРЕТЫ BATIM CHAPTER 4,20,2018-05-04T09:15:01.000Z,38743,1447,39,147,False
Comedy Radio,4,18.08.03,Вадим Галыгин и гр. Ленинград - 8 Марта,22,2018-03-07T13:54:18.000Z,1019533,31526,2787,2104,False
FC Spartak Moscow,4,17.17.11,"Роман Зобнин: «Только сейчас понял, насколько люблю футбол»",17,2017-11-16T08:10:06.000Z,18140,790,8,42,False
OPEN KIDS,4,18.09.05,OK VLOG #5: ПРЫГАЙ vs ЛИМОНАД II Open Kids и Катя Адушкина,22,2018-05-08T10:00:04.000Z,339672,25000,373,1828,False
Diplo,4,18.16.05,"Diplo, French Montana & Lil Pump ft. Zhavia - Welcome To The Party (Deadpool 2 Soundtrack)",10,2018-05-15T16:29:24.000Z,485690,35956,1093,3046,False
Anna Yakimenko,4,18.18.02,"Старомодные брюки, обувь и аксессуары в гардеробе.",26,2018-02-17T17:48:00.000Z,22587,2606,95,209,False
Katy LifeVlog,4,18.14.01,НАША СВАДЬБА! СВАДЕБНОЕ ВИДЕО! ВАНЯ + КАТЯ ❤ 14.07.2017,22,2018-01-13T10:00:04.000Z,561824,100106,429,13454,False
ДРУГОЕ МНЕНИЕ,4,17.23.11,Ксения Собчак Интервью на Эхо Москвы 22 ноября 2017,29,2017-11-22T16:29:03.000Z,6911,103,20,155,False
МИР НАИЗНАНКУ,4,17.18.11,"Секрет долголетия японцев и охота на змею. Япония. Мир наизнанку - 10 серия, 9 сезон",19,2017-11-17T07:00:01.000Z,93185,2807,77,393,False
AKIpress news,4,17.24.11,Инаугурация президента Сооронбая Жээнбекова,25,2017-11-24T05:00:29.000Z,10579,243,138,281,False
Провидец Рунета,4,18.16.01,"«Русский Колумбайн» - резня в школе №127 в Перми: преступники, пострадавшие, версии",22,2018-01-15T15:07:29.000Z,5201,32,4,15,False
Olga Filimonova,4,18.26.01,ЧТО БЫЛО - ЧТО БУДЕТ Таро-гадание про любовь,22,2018-01-25T18:54:22.000Z,7729,711,35,142,False
PrasDniK TV,4,18.01.03,С первым днем весны!  Весенний приветик тебе от меня! Начало весны!,22,2018-02-28T14:29:39.000Z,10885,119,6,50,False
Тиана Таро,4,17.22.11," Узнай! Что думает, что чувствует, что сделает? On-line гадание на картах Таро",22,2017-11-21T12:08:13.000Z,4817,247,15,23,False
UzGrant Tv,4,18.28.01,"ХАММА КУРСИН, ЯНГИЛИКНИ ЗУРИ АНДИЖОНЛИК ОНА БИРДАНИГА 4-ТА.......",1,2018-01-27T15:44:50.000Z,76825,3071,86,582,False
Голос Европы,4,18.24.03,Скрипаль: Английское гениальное доказательство,25,2018-03-23T12:10:05.000Z,67645,1567,167,472,False
PokerMatch FanPage,4,17.24.11,Победитель в автобусе,22,2017-11-23T17:35:39.000Z,108102,83,218,217,False
PrimeCrimeRu,4,18.07.02,вор в законе Георгий Модебадзе (Гега Озургетский) 02.02.18 Киев,29,2018-02-06T15:57:17.000Z,7247,31,9,13,False
Xuc,4,18.01.03,JesusAVGN смотрит- КАРИНА ПРОТИВ БЛОГЕРОВ: ХОВАНСКИЙ ИЛЬДАР НЕМАГИЯ,22,2018-03-01T08:00:02.000Z,8136,234,74,28,False
розовый вечер,4,18.08.03,"С 8 марта поздравляем Самых Милых, Любимых и Красивых!",10,2018-03-07T17:00:21.000Z,23153,119,4,3,False
Max Car,4,18.26.03,Пожар трц Зимняя вишня Кемерово,22,2018-03-25T21:46:57.000Z,103440,241,178,274,False
FLESH,4,17.20.12,FLESH - Колеса Любви (Prod. by Highself),10,2017-12-19T13:23:54.000Z,84773,4999,2064,643,False
The Only One Channel 2,4,17.27.11,Итоги недели с Ирадой Зейналовой. 26.11.2017г.,24,2017-11-26T10:44:27.000Z,20243,112,21,29,False
Stars Instagram,4,17.16.11,Ольга Бузова Быть Мне с Ромой Гриценко или Нет?,22,2017-11-15T09:41:09.000Z,16285,58,20,26,False
RTVI,4,18.02.02,"Ксения Cобчак о Навальном, кураторе из Кремля и почему Кадыров «зло»",25,2018-02-01T18:38:57.000Z,5131,117,29,91,False
Ольга Гладкова-ТАРО,4,17.25.12,Что же сегодня ты чувствуешь ко мне?,22,2017-12-24T15:09:41.000Z,9756,450,22,98,False
Поэт Сола Монова,4,17.26.11,"знаешь, любовь моя, всё это как-то мерзко",22,2017-11-25T18:44:05.000Z,2506,192,2,10,False
Kids CrazyShow,4,18.17.03,"Взбесившийся подъемник Эвакуация туристов Адская Канатная дорога в Гудаури, Грузия 16 марта 2018 ося",24,2018-03-16T18:45:44.000Z,23315,70,28,46,False
Alunika Dobrovolski,4,18.03.01,"Полезные привычки, которые приведут вас к здоровью!",27,2018-01-02T09:40:22.000Z,13543,1144,17,99,False
Максим Леонардович,4,17.08.12,Особое мнение Максима Шевченко 07.12.2017,25,2017-12-07T22:24:03.000Z,3678,118,13,36,False
КУРС ДОЛЛАРА / КУРС РУБЛЯ Максим Журавлёв,4,18.21.02,"Курс доллара прогноз Курс Рубля прогноз на 21 февраля, 2018 г. (доллар-рубль, Нефть)",22,2018-02-21T04:00:10.000Z,571,61,5,12,False
КиноСклад,4,17.26.11,Эту премьеру 2017 ждал весь интернет [ ЛЮБОВЬ БЕЗ С.Е.К.С.А. ] Русские мелодрамы 2017 новинки,22,2017-11-25T16:00:55.000Z,40983,131,53,10,False
Abu-Saddam Shishani [LIVE],4,18.25.02,Анонс к прямому эфиру,22,2018-02-25T02:32:57.000Z,589,56,2,28,False
MixNews,4,18.31.01,США опубликовали Кремлёвский доклад: Все российские миллиардеры объявлены «приближенными Путина»,25,2018-01-30T06:53:43.000Z,94521,2607,1528,1064,False
YanGo,4,17.04.12,ЧТО Я НИКОГДА НЕ НАДЕНУ? МОИ СТИЛЬНЫЕ НЕТ! **пародия**,24,2017-12-03T08:09:40.000Z,467037,54793,3188,4886,False
Матвей Ганапольский,4,18.25.04,"О статусе Фейгина, русских в Латвии и состоянии Telegram / Ganapolsky Feedback / 24.04.18",25,2018-04-24T21:08:24.000Z,11047,666,341,188,False
Анна Хоменко,4,18.21.02,РАСПАКОВКА ПОСЫЛОК С AliExpress,22,2018-02-20T23:18:18.000Z,1797,215,4,16,False
Телекомпания ТВК,4,18.19.03,Специальный выпуск Новостей ТВК: Выборы-2018 18:00,25,2018-03-18T11:42:56.000Z,30657,0,0,24,False
netd müzik,4,18.24.01,Hasan Azze - Kimisi Özledim Diyemez,10,2018-01-18T10:00:00.000Z,138437,620,65,141,False
I_am_puma,4,17.26.11,Как пума Месси и сфинкс Кира ходили в больницу Like Puma Messi and Sphinx Kira went to the hospital,15,2017-11-25T10:39:06.000Z,12264,1048,9,208,False
WOW TV,4,17.16.12,ГУФ - Маугли II | Official Video,10,2017-12-15T09:00:02.000Z,478718,24847,7051,2816,False
Готовим с ЛЮБОВЬЮ,4,18.01.03,Шоколадный торт на КЕФИРЕ ФАНТАСТИКА торт на 8 МАРТА рецепт шоколадного торта Торт рецепт,22,2018-03-01T04:30:00.000Z,5359,670,4,88,False
ЗСЛ Зернова А А,4,18.09.03,"Быть налажен, стая в сборе",23,2018-03-08T09:33:00.000Z,10683,981,6,323,False
Domi show,4,18.13.05,ПРИКОЛЫ с котами с ОЗВУЧКОЙ | Подборка приколов про кошек 2018 для детей,24,2018-05-03T02:20:07.000Z,16392,712,18,37,False
IlyaDrakon,4,18.13.05,"КОРОЧЕ ГОВОРЯ, GRANNY В РЕАЛЬНОЙ ЖИЗНИ 2 [От первого лица]",24,2018-05-13T09:40:33.000Z,27653,2883,71,311,False
ОруTV,4,17.15.12,Муж нетрадиционной ориентации возвращается к жене и реп реклама от Минипанков,23,2017-12-14T09:02:55.000Z,18269,124,24,0,False
Kseniya Vostrikova,4,17.22.11,Верхняя одежда осень-зима 2018 / ТОП 5,26,2017-11-21T14:03:39.000Z,27555,2335,23,161,False
ЛАЙК.А / LIKE.A,4,17.16.11,ЛАЙК.А / LIKE.A - СНОСИТ КРЫШУ / ПРЕМЬЕРА КЛИПА 2017,10,2017-11-15T07:00:02.000Z,204306,5598,5573,722,False
Overwatch RU,4,18.03.01,С Новым Годом от разработчиков Overwatch! (субтитры),20,2018-01-02T18:00:04.000Z,27193,1867,44,193,False
Kino.1tv.ru | Смотреть фильмы и сериалы,4,17.18.11,Троцкий. 2 серия,1,2017-11-17T09:00:02.000Z,12597,42,7,8,False
Игорь Ткаченко,4,17.19.11,"Эфир о Новом Обществе, 18.11.17",29,2017-11-18T18:20:39.000Z,2849,0,0,49,False
Секреты рукоделия Татьяны Лозовской,4,17.23.11,"Что нового? [Я пират, наконец то купила карту, вышила и оформила подарочный набор]",26,2017-11-22T08:27:31.000Z,8320,682,14,87,False
Gleb,4,17.31.12,GLEB - Эта Наша Ночь (ПРЕМЬЕРА ТРЕКА 2018),10,2017-12-30T07:50:32.000Z,214908,719,3090,342,False
Народный патруль Постовой,4,17.17.11,Народный патруль 125 СМОТРИ ПО ЗЕРКАЛАМ!,2,2017-11-16T17:19:54.000Z,1877,103,7,8,False
World of Tanks Blitz. Официальный канал,4,17.23.11,"WoT Blitz. Чёрная пятница. Скидки, камуфляж, контейнеры",20,2017-11-22T11:26:34.000Z,35362,793,160,192,False
Типичный Стас,4,17.29.12,VЕРSУСИЙ БАЯН: Стас Оксаний - Влад Симон [спец. выпуск],24,2017-12-28T16:49:28.000Z,53800,5005,153,156,False
ФЕДЕРАЛЬНОЕ АГЕНТСТВО НОВОСТЕЙ,4,18.05.02,Кандидат: Самое главное из недели участников предвыборной гонки,28,2018-02-04T20:00:01.000Z,123569,57,860,422,False
Физика от Побединского,4,17.09.12,Будет ли АРМАГЕДДОН в реальности?,28,2017-12-08T13:46:03.000Z,79830,11343,91,527,False
Vegabond100,4,18.25.03,Как в Америке отбирают деньги,22,2018-03-24T21:25:40.000Z,5246,463,12,236,False
bonapp,4,18.28.01,Торт Монстрик мохнатый и веселый,22,2018-01-27T17:53:16.000Z,9293,1240,15,129,False
acoolfifa,4,17.01.12,FIFA 18 - БИТВА СОСТАВОВ #4 С KEFIR - SANE 86,20,2017-11-30T12:00:00.000Z,139594,12787,143,541,False
TheWarpath,4,17.20.12,СТРИМ 🔴 НАРЯЖАЕМ ЁЛКУ В ПРЯМОМ ЭФИРЕ С КАТЕЙ И ОТВЕЧАЕМ НА ВОПРОСЫ,20,2017-12-19T21:11:38.000Z,123454,18612,267,468,False
Irina Irina,4,17.11.12,Черная жемчужина 11 серия русская озвучка,1,2017-12-10T17:25:58.000Z,5305,0,0,11,False
LIVE NEWS,4,18.26.03,Анатолий Шарий - Савченко про Шария,23,2018-03-25T13:52:34.000Z,78162,779,171,240,False
Silence Place,4,18.07.05,Каст Войны Бесконечности отвечают на каверзные вопросы,24,2018-05-06T17:04:40.000Z,8320,862,5,24,False
FitStars LIFE,4,18.02.05,Блуд и Вовк перестали ругаться матом?!,22,2018-05-01T16:50:55.000Z,13904,896,15,38,False
Света КЕМЕР,4,17.17.12,Двойка в школе ОЖИДАНИЕ и РЕАЛЬНОСТЬ,22,2017-12-17T05:30:00.000Z,19512,2056,115,303,False
Ольга Чернова,4,18.01.04,ЧТО НУЖНО ПОСЕЯТЬ В АПРЕЛЕ. Ольга Чернова.,22,2018-03-31T09:10:07.000Z,11367,317,10,20,False
Секреты Заработка,4,18.13.01,Две тысячи рублей за два клика,22,2018-01-12T11:50:54.000Z,192035,4432,13957,0,True
Коммерсантъ,4,17.21.11,Выступление школьника из Нового Уренгоя в Бундестаге,1,2017-11-20T14:46:40.000Z,13307,64,97,274,False
Qiziqarli Ma'lumotlar,4,18.11.03,ТЕЗКОР!ПАРКОВКАДА ПОРТЛАШ ЮЗ БЕРДИ,24,2018-03-10T13:09:42.000Z,34693,120,32,0,True
TVSmeshariki,4,18.31.03,Смешарики ДежаВю. Трейлер №3 | В кино с 26 апреля!,1,2018-03-30T14:00:03.000Z,90599,2907,125,463,False
Remonter,4,18.01.03,РЕМОНТ ДЛЯ ПОДПИСЧИКА: Не включается смартфон Prestigio Muze F3 (PSP3532),28,2018-03-01T07:00:01.000Z,25100,2462,48,187,False
Менеджер Антон,4,17.30.11,Как LADA XRAY наказал KIA RIO X-LINE и LADA VESTA SW CROSS на  бездорожье,2,2017-11-29T08:47:17.000Z,54344,573,294,485,False
NIKITA ZLATOUST,4,17.07.12,Я НА СТС//МЫ ПРОШЛИ В ШОУ УСПЕХ???//НОВАЯ ПЕСНЯ!||VLOG,24,2017-12-06T11:00:02.000Z,59127,5600,98,658,False
KanalD,4,17.01.12,Siyah Beyaz Aşk 8. Bölüm Fragmanı,24,2017-11-30T11:54:51.000Z,882933,13649,189,3424,False
Jimmy Kimmel Live,4,17.15.11,WORLD PREMIERE TRAILER – Jimmy Kimmel’s The Terrific Ten,23,2017-11-14T06:56:13.000Z,864242,20686,273,980,False
КиноКартины,4,18.17.01,Премьера! НЕВЕСТКА - Русские мелодрамы 2018,1,2018-01-16T05:25:53.000Z,35269,83,23,3,False
Внуки Ивана,4,18.09.01,"УГАДАЙ, ЧТО ПРИЛЕТЕЛО В ЛИЦО (НЕУДАЧНИК) внуки ивана / пирог в лицо челлендж",24,2018-01-08T11:55:10.000Z,32865,2385,277,318,False
Портал Технарь,4,18.28.02,ПОБЕДА БЛИЗКА   новый обзор рейтингов,22,2018-02-27T15:27:02.000Z,15056,1672,17,370,False
lil Beast,4,18.15.01,Trailer of The channel | Трейлер канала,22,2018-01-14T21:04:39.000Z,4659,1321,12,378,False
FIGHT NIGHTS TV,4,17.20.11,Kirill Sidelnikov vs. Sergey Pavlovich / Кирилл Сидельников vs. Сергей Павлович,17,2017-11-19T21:15:09.000Z,89874,1001,63,460,False
TE100STERON,4,17.28.11,TE100STERON#ХЗ: jaguar xjr x 308,22,2017-11-27T05:49:26.000Z,70116,598,87,95,False
Молодой Человек,4,18.24.04,СТОЯК НА ВСЕХ ПРАНК. Реакция людей,23,2018-04-23T11:23:42.000Z,471476,17627,2247,3178,False
LEZZA TV,4,18.25.04,ПЕСНИ КОТОРЫЕ СТАЛИ ИНТЕРНЕТ МЕМАМИ // ЧАСТЬ 2,10,2018-04-24T11:51:26.000Z,9974,509,30,43,False
Longines Watches,4,17.26.12,Best wishes from the Longines Ambassadors of Elegance,26,2017-12-24T15:30:01.000Z,33367,299,25,18,False
Каха и Серго,4,18.30.05,Каха - Кто здесь массажист?,22,2018-05-29T16:55:22.000Z,26108,1188,19,42,False
TGYM - лучший фитнес канал,4,18.13.03,#УСПЕТЬПОХУДЕТЬ №1 Программа Тренировок для Похудения. Фитнес Дома.,17,2018-03-12T05:00:01.000Z,47506,6189,36,671,False
Garage54 LIFE,4,17.29.11,"АКПП с ТОЛКАЧА, ЗАВЕДЕТСЯ или НЕТ?",2,2017-11-28T11:58:19.000Z,117382,3243,425,339,False
AmariLife_Vlog,4,17.19.11,ВЛОГ Собрались! В путь🌴🌴🌴  17.11.2017,22,2017-11-18T06:00:00.000Z,16085,471,81,201,False
Noize MC,4,18.28.04,Noize MC — Голос & Cтруны (Хипхопера «Орфей & Эвридика»),10,2018-04-27T08:00:25.000Z,318652,35709,1288,1683,False
Эдуард Давидович Ходос,4,18.13.03,Мобилизационный призыв: скачал и вбросил! Новости Хазарского каганата от Э. Ходоса №29 от 12.03.18,25,2018-03-12T11:28:43.000Z,14952,871,12,217,False
Blogger Money,4,18.12.01,ШУРЫГИНА прокомментировала освобождение Сергея Семёнова | РЕАКЦИЯ ШУРЫГИНОЙ,22,2018-01-10T18:55:34.000Z,300699,1628,5048,363,False
Волхонский ЛАЙВ,4,18.28.03,Митинг в Кемерово. Врач сказал правду про погибших.,22,2018-03-27T06:49:51.000Z,671660,13170,15097,4400,False
Х Мэн,4,18.19.03,Выборы 2018! Подписчик прислал видео.,24,2018-03-18T05:51:43.000Z,331322,2340,7220,1149,False
EVRplc,4,17.15.11,Защищенный взгляд.,22,2017-11-14T18:40:22.000Z,18118,18,11,8,False
Евгений Мураев,4,17.17.11,"Евгений Мураев в «Большом вечере» на телеканале NewsOne, 15.11.17",25,2017-11-15T21:36:35.000Z,45090,604,32,210,False
Живая Аналитика,4,18.26.03,"Евгений Сатановский   ситуация настолько критична, что Путин начал собирать резервистов",22,2018-03-25T13:00:06.000Z,142968,823,5213,567,False
Реакции  Братишкина,4,18.09.02,"Братишкин смотрит: Паша Техник #2: Реакция на Pharaoh, Lil Peep, ГУФ, Post Malone",22,2018-02-08T20:31:52.000Z,6677,169,11,8,False
BeST MoMeNTS v2.0,4,18.10.02,Барри Аллен и Мета-Заключенные пытаются сбежать с Тюрьмы Айрон Хайтс,1,2018-02-09T16:57:25.000Z,9973,80,2,11,False
Svetlana Bisyarina,4,17.22.11,ПОКУПКИ ЕДЫ НА МЕСЯЦ ✔ НОЯБРЬ  ✔ СКОЛЬКО Я ТРАЧУ? #светланабисярина,22,2017-11-21T13:09:31.000Z,9647,549,19,86,False
Елена Дзык,4,17.30.11,ВРАЧИ СОШЛИ С УМА ЛЕЧАТ МУЖИКОВ ОТ МОЛОЧНИЦЫ ДОЗА ПРЕВЫШЕНА В 270 РАЗ!,26,2017-11-29T15:32:53.000Z,13225,876,30,92,False
Поэзия Рэпа,4,18.15.05,ЛСП — Номера (запрещён в РФ),10,2018-05-14T14:45:41.000Z,14314,743,18,97,False
Нвлнй Хло 2.0,4,18.29.01,Навальный сдулся. Знали ли об этом его активисты??,22,2018-01-29T05:32:10.000Z,117,4,2,13,False
Из России с любовью,4,17.06.12,ОЛИМПИЙСКИЕ ЧЕМПИОНЫ РОССИИ – КТО ИГРАЕТ С ДОПИНГ ПРОБАМИ?,17,2017-12-05T06:11:05.000Z,84200,5678,1550,757,False
ArTvAZDARAR,4,18.28.04,Ադրբեջանում նախանձում են     27.04.2018,25,2018-04-27T13:11:32.000Z,29464,773,15,29,False
FootObzor HD,4,17.08.12,PEAЛ COCЬEДAД - 3EHИT. ОБЗОР МАТЧА. 07.12.2017,17,2017-12-07T22:31:00.000Z,63243,384,60,51,False
Свежий Взгляд,4,18.31.01,Навальный собрал рекордное количество людей на митингах,22,2018-01-30T06:01:24.000Z,402750,2984,21905,3064,False
ТопЧик,4,17.13.12,Промах года! Кокорин с метра не забивает в пустые ворота,22,2017-12-12T06:44:32.000Z,28564,33,4,20,False
БМ LIFE,4,18.02.02,Главные правила достижения цели,27,2018-02-01T18:38:21.000Z,10355,0,0,0,True
ФриОниз,4,18.24.05,АТЕИСТ В ЦЕРКВИ (анимация),24,2018-05-23T09:58:33.000Z,92839,7520,769,1019,False
l1zzka,4,17.27.12,эх видео бы снять,24,2017-12-26T19:24:10.000Z,35386,6622,175,367,False
НЕПРИЯТНЫЙ ИЛЬДАР,4,17.27.12,ФАДЕЕВ и ЛЕПС ЛЮБЯТ АНДРОИД - ИЛЬДАР РЕАГИРУЕТ,22,2017-12-26T17:06:03.000Z,119683,12071,420,439,False
TIME,4,18.06.06,Егор Крид прокомментировал слухи о свадьбе с Дарьей Клюкиной,24,2018-06-05T14:45:30.000Z,187387,1525,141,116,False
Школа Здравого Смысла ТВ,4,17.03.12,СИРИЙСКАЯ ЗАПАДНЯ.  А. ДЕВЯТОВ 30 -11-2017,25,2017-12-02T17:57:34.000Z,4754,203,16,53,False
zpsanek,4,17.14.11,Придорожные патрульные - вымогатели! Днепр проснись!,2,2017-11-13T16:58:23.000Z,96558,12369,139,1778,False
"Костян ,ЧТО ТАМ В MMA?",4,18.02.04,ОФИЦИАЛЬНО! ОТМЕНА БОЯ! ТОНИ ФЕРГЮСОН ТРАВМИРОВАЛ КОЛЕНО! РЕАКЦИЯ ХАБИБА!,17,2018-04-02T01:43:05.000Z,52005,1641,232,409,False
Dude Perfect,4,18.20.02,Football vs Soccer Trick Shots | Dude Perfect,17,2018-02-19T22:56:12.000Z,4151801,279562,2495,28691,False
Mr. Freeman,4,18.15.03,"Mr. Freeman, part 07 [посвящается Стивену Хокингу, RIP]",1,2018-03-14T10:00:00.000Z,1121965,90098,8191,9581,False
В кругу друзей,4,18.27.03,Путин прибыл в Кемерово,26,2018-03-27T03:17:45.000Z,9094,12,55,31,False
Заповедник,4,18.02.01,"Новогодняя тусовка с Путиным, Порошенко, Меркель, Трампом и другими – Заповедник, выпуск 9, 16+",24,2017-12-31T17:21:35.000Z,80140,1624,197,242,False
HypeTrain,4,17.22.12,ЧТО МОЖНО КУПИТЬ НА 1$ В РАЗНЫХ СТРАНАХ,24,2017-12-21T13:52:32.000Z,28646,5148,187,201,False
Каста,4,17.16.12,Piter by КАСТА | Официальный ТРЕЙЛЕР,10,2017-12-15T10:11:27.000Z,54919,3303,67,164,False
Pro100Gamer,4,18.01.05,Госпожа Фазилет 45 Серия 1 Анонс! ОЗвучка,22,2018-04-29T16:06:58.000Z,51708,158,18,65,False
Russian Films 6k,4,17.22.11,"ДОЛГОЖДАННАЯ ПРЕМЬЕРА 2017 [ ЧЕРНЫЙ ОЛИГАРХ ] Русские мелодрамы 2017, сериалы 2017,",22,2017-11-21T11:41:30.000Z,102964,221,91,24,False
Lana Svetlana,4,17.21.11,ПОКУПКИ В ФИКС ПРАЙС И УЛЫБКЕ РАДУГИ,26,2017-11-20T17:58:08.000Z,3779,224,8,34,False
Klymenko Time,4,18.19.01,Рада признала РФ агрессором: реакция киевлян без цензуры,22,2018-01-18T11:44:42.000Z,16371,74,35,124,False
Банда НИВАводов,4,18.08.02,"Нива, Шнива, УАЗ Патриот...",2,2018-02-08T05:30:00.000Z,2239,224,6,42,False
Alexander Kondrashov,4,17.15.11,Место Силы. Подводная Охота в Суровую Погоду с The Братья,19,2017-11-14T14:12:57.000Z,136549,6711,624,659,False
Кладовая Бэкста,4,18.21.01,Приколы ПРИВЕТ СОСЕД потная обувка Hello Neighbor полная версия,20,2018-01-20T07:49:56.000Z,56979,1254,192,209,False
Xan Шемахинец,4,17.04.12,В Грузии арестовали азербаджанцев-людей Лоту Гули,25,2017-12-03T15:39:51.000Z,6210,21,5,1,False
PRO BLOCKCHAIN,4,18.04.01,Капитализация криптовалют 710 миллиардов. Ripple почти 3$. Новый рекорд Ethereum. Форк Эфира будет?,22,2018-01-03T19:15:58.000Z,17350,829,26,65,False
mad rebel,4,17.24.12,Белое солнце пустыни!,22,2017-12-23T09:08:30.000Z,227556,408,6671,593,False
Лови Момент,4,17.31.12,6 УДИВИТЕЛЬНЫХ МАШИН КОТОРЫЕ СТОИТ УВИДЕТЬ,28,2017-12-30T08:04:14.000Z,191343,1703,176,62,False
Ярик Кент,4,17.09.12,КАК СДЕЛАТЬ ВУЛКАН В РЕАЛЬНОЙ ЖИЗНИ!? С НУБИКОМ ИЗ МАЙНКРАФТА! ЛАЙФАК MINECRAFT,20,2017-12-09T05:13:03.000Z,16282,2253,73,433,False
Игорь Рыбаков,4,18.26.01,Мое первое видео.,22,2018-01-25T08:02:17.000Z,221381,6165,13547,2559,False
Arko Men Russia,4,18.17.01,Колян Наумов - Ничего Обычного!,22,2018-01-16T06:53:39.000Z,815822,7625,3881,697,False
Левша,4,17.10.12,Бетономешалка маленькая или чашка большая? / Бетоно-кофемешалка ),28,2017-12-09T22:15:02.000Z,41707,10548,80,796,False
Galich Ida,4,17.15.12,Ида ищет парня на премии Высшая лига. Кто попал в старую лигу?,23,2017-12-14T07:01:04.000Z,111914,2909,64,106,False
Slidan,4,17.25.12,Мой зверь...,1,2017-12-24T12:06:20.000Z,323931,50153,619,2492,False
ToukaN,4,18.13.01,Ростислав Ищенко 12.01.2018 . Время Х для Украины.,28,2018-01-12T07:30:00.000Z,19352,103,9,48,False
ЮТУБЕРЫ,4,18.22.05,КАКАЯ ТЫ ПЕСНЯ ПО ЗНАКУ ЗОДИАКА! МАРЬЯНА! ВРЕМЯ И СТЕКЛО! ПОПУЛЯРНЫЕ ЮТУБЕРЫ! ТОП БЛОГЕРЫ!,24,2018-05-21T12:50:59.000Z,34507,6221,218,3032,False
Sam Jones,4,18.31.05,Смотрю 10 Часов - ЛОСЯШ КУ-КУ МИСТЕР ДУДЕЦ,19,2018-05-30T14:00:13.000Z,344339,21121,3020,5987,False
Tajik BLoG,4,17.18.12,ЛАЪНАТИ БЛОГЕРОИ ДУРУГГУ ВА Каромат Шарипов,22,2017-12-17T17:03:45.000Z,28584,1922,141,503,False
Kasper Show,4,17.22.11,Смена почетного караула в Эстонии и в Москве. Сравнение,10,2017-11-21T13:49:22.000Z,6577,236,15,69,False
Nickless,4,17.11.12,10 АНИМАЦИОННЫХ ПЕРСОНАЖЕЙ ПОГИБШИХ НА ЭКРАНЕ,1,2017-12-10T11:26:30.000Z,119504,3129,252,439,False
BEST CUBE 2.0,4,17.17.11,BEST CUBE #173 - RUSSIAN EDITION,23,2017-11-16T06:47:47.000Z,119535,2306,309,127,False
Бен 10 на русском - Ben 10,4,18.26.05,Бен 10 на русском | Семь футов под килем! | Cartoon Network,1,2018-05-26T03:00:01.000Z,23986,192,15,6,False
СМЫСЛЫ,4,17.22.12,СМЫСЛЫ - Выпуск № 31 Наши ценности и спортсмены,25,2017-12-21T06:37:38.000Z,166086,837,112,74,False
instagram эфиры,4,17.30.12,T-killah и Олег Маями прямой эфир 29.12.2017 ( Дневник Хача),22,2017-12-29T13:00:05.000Z,95104,1264,201,94,False
GEazyMusicVEVO,4,17.02.12,G-Eazy & Halsey - Him & I (Official Video),10,2017-12-01T16:15:00.000Z,1554273,146691,1600,7305,False
NOSFERATU,4,18.29.01,Истории на ночь - Как я сходил в бар,24,2018-01-28T16:55:21.000Z,13282,1131,19,122,False
vestikuzbass,4,18.26.03,Спасатели не могут добраться до третьего кинозала Зимней Вишни,25,2018-03-25T22:36:12.000Z,23915,29,6,0,True
Евгений Бондаренко,4,17.01.12,СОБРАЛ САМЫЕ НЕОБЫЧНЫЕ ГОЛОВОЛОМКИ | влог | Соревнования по сборке кубика Рубика,22,2017-11-30T17:23:13.000Z,57406,2192,75,463,False
Крутон - батон.,4,18.28.02,"ТВОРОЖНАЯ ЗАПЕКАНКА, КОТОРАЯ ВСЕГДА ПОЛУЧАЕТСЯ.",22,2018-02-27T09:38:08.000Z,9086,1234,15,67,False
Shamanenok,4,17.17.12,ИГРАЕМ ОТБОРОЧНЫЕ НА МАЙЛ ТУРНИР!!! (БЕЗ МАТА).PLAYERUNKNOWN'S BATTLEGROUNDS | PUBG | ПАБГ | ПУБГ |,20,2017-12-15T23:18:47.000Z,80525,4626,981,13,False
Руслан Кузнецов,4,18.18.03,KUZNETSOV - ПОСЛЕДНЯЯ ПЕСНЯ (memory video),22,2018-03-17T10:00:08.000Z,1132141,166874,1643,22018,False
Готовим вкусно cook delicious food,4,17.15.12,Как украсить торт. Выравнивание торта очень подробно. Готовим крем для торта и выравнивания,22,2017-12-15T04:00:00.000Z,2223,245,2,43,False
BestArm,4,18.04.01,"Azizyanner 3, Seria 24 | Ազիզյաններ 3, Սերիա 24",10,2018-01-03T17:59:19.000Z,36379,429,40,38,False
Братья Щербаковы,4,18.01.03,"Реакция стайных судаков на шум бура! Эксперимент как бы глупый, но очень интересный?! )",26,2018-02-28T20:19:57.000Z,4629,494,1,109,False
Bugungi KUN,4,18.18.02,"БУНИСИ ДАХШАТ! РОССИЯДАГИЛАР ЭХТИЁТ БЎЛИНГ,БУ ЖУДА ЁМОН ХАБАР.",1,2018-02-16T16:56:09.000Z,165483,541,182,249,False
РИСОВАЛОЧКА,4,18.31.05,ИДЕИ для  ЛИЧНОГО ДНЕВНИКА 2018 как оформить  ЛЕТНИЙ ДНЕВНИК,26,2018-05-31T11:37:49.000Z,45349,3704,65,693,False
Marina Mogilko,4,17.20.12,"ПРОИЗНОСИМ АНГЛИЙСКИЕ СЛОВА, КАК АМЕРИКАНЦЫ! 🇺🇸Регина Тодоренко vs Дима Пистоляко",27,2017-12-20T05:00:00.000Z,4082,443,11,71,False
Nikita Morozov,4,17.16.12,ТИПЫ ЛЮДЕЙ ЗИМОЙ / НА НОВЫЙ ГОД,24,2017-12-15T13:07:21.000Z,102152,15206,181,1727,False
Posnavatel TV,4,18.05.05,"ЛЮДИ БЫЛИ В ШОКЕ, КОГДА УВИДЕЛИ ЭТОГО ПРОДАВЦА НА РЫНКЕ",15,2018-05-04T14:42:00.000Z,12402,1174,10,87,False
ФУТБОЛ ТВ,4,18.28.01,VETNAM(U23) - O'ZBEKISTON(U23) 1-2 O'YIN MULOHAZA  FINAL 27.01.2018. OSIO U23 CHEMPIONATI 2018,17,2018-01-27T11:39:38.000Z,96645,1008,41,365,False
Татьяна Х,4,17.21.11,"УДАЧНЫЕ ПОКУПКИ! УХОД ЗА ЛИЦОМ, ГУБАМИ, ВОЛОСАМИ!",22,2017-11-20T10:05:23.000Z,10856,422,65,84,False
Сибдепо в Кузбассе,4,18.26.03,Очевидцы: в Кемерове пожарные потушили возгорание в ТРЦ «Зимняя вишня»,1,2018-03-25T17:17:26.000Z,88064,340,2294,639,False
Дагестан Инфо,4,17.24.11,О коррупции в системе МВД и ситуации в Дагестане: Магомед Шамилов,29,2017-11-23T07:00:01.000Z,11949,159,6,59,False
QW Lianora Swiss Consulting,4,17.18.11,Ольга Клейнард - Утро с Лианорой - QW Lianora Swiss Consulting 17.11.17,22,2017-11-17T08:47:30.000Z,17859,1301,67,64,False
Best movie,4,18.17.03,Осколки 11 серия! сериал 2018,22,2018-03-16T15:56:51.000Z,14566,51,10,9,False
Saturday Night Live,4,18.05.02,Natalie’s Rap 2 - SNL,24,2018-02-04T05:57:36.000Z,1894905,35668,1457,2436,False
Альтернативная История Причерноморья и Кавказа,4,18.27.02,"Тайна Глины, засыпавшей города - Раскрыта. #AISPIK #aispik #айспик",22,2018-02-26T20:09:35.000Z,3801,324,13,74,False
Beats4U - TYPE BEATS & RAP INSTRUMENTALS,4,18.02.01,DRAKE x CHRIS BROWN TYPE BEAT | ► R&B Instrumental 2018 - R&B Beat | Chris Brown Type Beat 2018,10,2018-01-01T17:03:44.000Z,42685,232,47,23,False
Vip Чечня,4,17.15.11,в Чечне с третьего этажа торгового центра упал ребенок,22,2017-11-14T11:54:29.000Z,4412,11,4,5,False
Highlight Heaven,4,18.16.01,Paul Allen's Radio Call of the Minnesota Vikings' Unbelievable Miracle Touchdown vs. Saints,17,2018-01-15T01:33:11.000Z,1676211,27625,1556,3700,False
EVAN,4,18.23.05,"КОРОЧЕ ГОВОРЯ, Я УБИЛ GRANNY И GRANDPA [От первого лица]",23,2018-05-22T13:15:04.000Z,111746,4887,377,626,False
YoruShika,4,18.05.06,Basically Baldi's Basics - animation,1,2018-06-04T19:50:35.000Z,165799,6596,117,874,False
Управляемый хаос. Чемпионат мира по футболу 2018,4,18.01.06,Сборная России опять облажалась. Сколько можно?,17,2018-05-31T17:55:01.000Z,38087,2050,57,450,False
Maroon5VEVO,4,18.09.02,Maroon 5 - Wait,10,2018-02-08T14:00:00.000Z,2455067,197040,3139,11350,False
YouDo,4,17.28.11,Бизнес на травке | Создатель фермы микрозелени о своем необычном бизнесе и помощниках c YouDo,29,2017-11-27T05:58:32.000Z,77004,1118,135,93,False
Good™,4,17.19.11,Клип Мультики про танки,20,2017-11-18T11:06:01.000Z,11207,102,8,32,False
Marshmello,4,18.13.02,Marshmello x Lil Peep - Spotlight (Official Music Video),10,2018-02-12T14:00:00.000Z,1427962,264994,4757,23195,False
Яна Федорова Популярное видео,4,18.02.03,ТОМАТЫ РАСТУТ В 2 РАЗА БЫСТРЕЕ ! УСКОРЕНИЕ РОСТА РАССАДЫ ! Фитильный полив томаты перец баклажаны,22,2018-03-01T21:18:18.000Z,4086,272,19,17,False
Андрей Скутерец,4,18.04.02,ДРОЧЕСКОП #4 делаем мини-байк красивым / сиденье из скейта и покраска рамы,2,2018-02-03T10:28:00.000Z,124295,5288,109,554,False
Домашние заботы,4,17.11.12,Закуски к праздничному столу/фуршету. 5 идей,22,2017-12-10T14:30:01.000Z,12238,892,51,86,False
FIGHT NIGHTS GLOBAL TV,4,18.23.02,Магомедсайгид Алибеков vs. Ахмед Алиев / Magomedsaygid Alibekov vs. Akhmed Aliev,17,2018-02-22T20:58:36.000Z,39550,611,32,215,False
SiliconValleyVoice,4,18.20.02,США 5106: Правила игры к открытому курсу Тестирование ПО на русском языке и вопрос к зрителям,22,2018-02-20T04:01:10.000Z,1936,238,4,112,False
NewTV Show KG,4,18.04.04,Нурлан Насип эфирде күйөрманы менен  жолукту/NewTv Show,22,2018-04-03T15:51:12.000Z,33166,814,58,206,False
The Russian Channel,4,18.04.02,Александр Усик интервью на бое Гассиев-Дортикос в эфире матч тв,17,2018-02-03T21:55:01.000Z,16586,198,16,86,False
Starikova T.V.,4,17.15.11,"Самые СТРАННЫЕ НОВОСТИ недели!!! Harry Styles, Iphone Face ID, и милый клип L'One",22,2017-11-14T09:51:23.000Z,25795,2883,21,207,False
ФИЛЬМЫ КОТОРЫЕ СТОИТ ПОСМОТРЕТЬ,4,18.25.03,ФИЛЬМ НА РЕАЛЬНЫХ СОБЫТИЯХ Выбор Грейси фильм драма,1,2018-03-24T09:44:14.000Z,48001,376,32,49,False
Вишенка Переводит,4,18.29.03,Шалость в Instagram // storybooth на русском,22,2018-03-28T12:19:58.000Z,65078,1850,149,212,False
Крамола,4,18.11.03,Кости гигантов на гравюрах Пиранези. Доказательства существования великанов до потопа в 18 веке,27,2018-03-10T14:45:33.000Z,7990,1174,14,45,False
Макс Беляев,4,18.18.02,Интервью и дискуссия по поводу АН-148,27,2018-02-17T21:15:47.000Z,6562,264,51,75,False
Тележопка,4,18.03.04,ХОЛОСТЯК 6 ТНТ Дарья Клюкина о ситуации с Соней. Много шокирующих подробностей,24,2018-04-02T16:17:28.000Z,45853,249,31,40,False
ТАТЬЯНА КОНКИНА - СЧАСТЬЕ И УСПЕХ ДЛЯ ВСЕХ.,4,17.27.11,Почему мы застреваем в негативности и как из этого выйти.,27,2017-11-26T18:09:40.000Z,6936,717,8,105,False
Ходос Авто,4,18.06.02,АКПП Ford Kuga 70т/км и в утиль.,2,2018-02-05T12:59:13.000Z,48498,2765,134,518,False
ЭФИР ВНОРМЕ,4,18.23.01,"Павел Пятницкий приехал к Сергею Семёнову, отдыхают, готовят мясо 22.01.18",10,2018-01-22T18:40:44.000Z,26221,880,35,195,False
Juran4ik ツ,4,18.17.03,ЗАШКВАРЫ ШКОЛЬНИКОВ В MUSICAL.LY,24,2018-03-15T15:36:33.000Z,648692,32456,2436,6926,False
Xəbər Var,4,18.07.04,Xəbər var: Mehriban Əliyeva yoxa çıxıb - Axtarışlar davam edir (06.04.2018),22,2018-04-06T16:00:13.000Z,67737,1438,92,377,False
Arti25,4,18.11.03,Пробуем пробиться в 1 лигу ... на арте,20,2018-03-11T00:47:40.000Z,28815,1737,143,12,False
Epress. am,4,18.20.04,Ապրիլ 19․ Ոստիկանները բռնություն են կիրառում խաղաղ ցուցարարների նկատմամբ,25,2018-04-19T09:42:31.000Z,110133,843,134,337,False
Салам Кыргызстан ТВ SHOW,4,17.26.12,"Салам, Кыргызстан! /  КАЙРАТ КЫРГЫЗ ЖАНА ГУЛЬНАЗ ЧЫНЫБЕК КЫЗЫ",24,2017-12-25T12:17:07.000Z,41336,593,96,663,False
MoranDays,4,18.25.01,Moran Day 163 - Голубые Горы (Австралия),19,2018-01-24T17:10:56.000Z,54569,5800,133,564,False
RNSNS,4,17.20.11,BOOKER x Домашний x Млечный x Warab - Антайтлед,10,2017-11-19T14:50:00.000Z,65526,3803,134,284,False
ToysforKids,4,18.05.03,ДАЗУКИ И КОТ НУАР КОМИКС 2 СЕРИЯ,24,2018-03-04T16:28:52.000Z,25386,1827,44,549,False
Ala-Too 24 /News,4,17.30.11,Жээнбеков Россиянын президенти Путин менен жолугушту,25,2017-11-29T16:30:16.000Z,97216,868,157,569,False
Just Thoughts,4,18.20.03,Люди Угадывают Татуировки Незнакомцев,23,2018-03-19T08:36:18.000Z,7556,285,5,16,False
Каниет Жыргалбеков,4,17.26.11,ЭКСКЛЮЗИВ! УРМАТ НЕЛЯ ЭФИРДЕН УРУШУП КЕТЕ ЖАЗДАП...СОЗСУЗ КОР! КЕЧКИ БИШКЕК,24,2017-11-25T15:00:03.000Z,40943,495,66,221,False
АНТИВОЙНА,4,17.30.11,ПУТИН ТРОЛЛИТ ЗАПАД КСЮШЕЙ СОБЧАК,25,2017-11-29T11:17:56.000Z,7501,399,9,71,False
AshComps7,4,18.19.03,Real Madrid vs Girona 6-3 - All Goals & Extended Highlights - La Liga 18/03/2018 HD,17,2018-03-18T21:51:26.000Z,993735,7803,734,852,False
PRAVADA,4,17.13.12,pravada - накроет (official video 2017),10,2017-12-12T05:44:42.000Z,117212,3063,1234,172,False
Project X,4,18.25.03,В сеть слили видео с iPhone SE 2 (2018)! Восстание машин уже началось. Презентации Huawei и Xiaomi,28,2018-03-24T15:18:44.000Z,134837,2131,341,250,False
CaucasianKnot,4,18.15.01,Первое требование в череде извинений перед Кадыровым,25,2018-01-13T17:52:03.000Z,116700,524,171,483,False
KG Live,4,18.16.03,АЯЛЫМ ДОСУМ МЕНЕН ЖАТЫП ЖYРYПТYР (болгон окуя) // Сезим сырлары,10,2018-03-15T18:34:22.000Z,19845,119,36,170,False
Виталина Таро,4,17.24.11,ТАРО. Онлайн гадание. Что между нами происходит?! Будем ли мы вместе?!,22,2017-11-23T17:58:33.000Z,4285,349,15,73,False
Death or Freedom,4,18.23.01,За что Путин убил Кадырова,25,2018-01-22T06:31:52.000Z,220257,2030,10813,1152,False
PAN4,4,18.12.01,ПАНЧ - Смешарики (Клип 2018),22,2018-01-11T14:59:49.000Z,47380,11360,368,2326,False
НОВЫЙ ЮТУБ,4,18.22.03,МАРЬЯНА РО ОБМАТЕРИЛА МАРИ СЕНН И ГЕРМАНА,24,2018-03-21T15:53:21.000Z,38142,1820,193,791,False
Інформаційне агентство Українські Новини,4,17.06.12,Задержание Саакашвили на крыше дома,25,2017-12-05T09:17:31.000Z,55289,112,18,193,False
REVOLUTION in Russia 5 november 2017,4,17.15.12,Навальный ответил Путину за бегающего Саакашвили,25,2017-12-14T18:27:45.000Z,78910,2304,2608,767,False
Сергей Зарвирог,4,18.18.02,Перевозчик 10 серия - Подмена.,22,2018-02-17T19:01:20.000Z,3725,46,4,5,False
Другой Нальчик,4,17.20.12,"Ты - нищий, ты - отброс! Стихийный митинг с кабельной удавкой на шее! КБР",22,2017-12-19T15:03:05.000Z,5298,296,2,124,False
Nastia Rizik,4,18.01.01,КАЖДЫЙ НОВЫЙ ГОД ТАКОЙ!!!,23,2017-12-31T10:55:52.000Z,120854,8267,190,2097,False
Сергей Косенко,4,18.08.01,АЛЕКСАНДР КОНДРАШОВ. Сколько зарабатывает тревел блоггер? Интервью с АЛЕКСАНДРОМ КОНДРАШОВЫМ,22,2018-01-07T20:44:20.000Z,87970,1218,36,242,False
АльпаЧина,4,17.04.12,ПОЧТИ ХАЛЯВА! ОБАЛДЕННЫЕ ТОВАРЫ ДО 5 ДОЛЛ С ALIEXPRESS ЗА ИЗ КИТАЯ 🔶 БОЛЬШОЙ КОНКУРС,22,2017-12-03T11:00:02.000Z,8966,296,30,97,False
Mega Family SONG,4,17.19.12,"Серебряный бор 9-10 серия ( Сериал, Мелодрама )",1,2017-12-18T13:07:48.000Z,109385,158,77,23,False
Auto Rami,4,17.30.11,"ДЕЛАЕМ LAMBORGHINI, BENTLEY И FERRARI СВОИМИ РУКАМИ",22,2017-11-29T07:19:13.000Z,68427,3683,339,144,False
ДА СКОЛЬКО МОЖНО. HOW CAN.,4,18.06.02,"Встреча Павла Грудинина с избирателями Ростов на Дону, 05 02 2018",25,2018-02-05T18:19:37.000Z,9264,610,34,196,False
Авто Скрежет 2.0,4,18.03.03,Торопыги и Водятлы 80 уровня! ( часть 80 ) Идиоты за рулем!,22,2018-03-02T07:14:51.000Z,8861,205,17,33,False
FAVOR1TE,4,17.07.12,47 КРАСНЫХ КАРТ И 12 ИНФОРМОВ В ПАКАХ! НАГРАДЫ WL,17,2017-12-06T15:58:40.000Z,94491,6728,140,126,False
Millenium,4,18.20.03,Камри 3.5  vs  Yamaha FZ 400 !!!  Байкеры атакуют !!!,2,2018-03-19T18:48:51.000Z,86693,3444,210,1277,False
Мадам Ирма,4,18.27.01,"КОРОЧЕ ГОВОРЯ, МЫ ОСТАЛИСЬ БЕЗ ДЕНЕГ | Мадам Ирма",24,2018-01-26T15:30:15.000Z,13206,1683,41,434,False
Watch me,4,17.10.12,Битва экстрасенсов 18 сезон 12 выпуск от 09.12.2017,1,2017-12-09T11:55:47.000Z,216000,991,675,388,False
СМИ России 24,4,18.20.01,Что на самом деле думает Грудинин о мигрантах,22,2018-01-19T15:19:59.000Z,196366,606,4437,1306,False
Minikotic ★ Play,4,18.18.02,🔴  ПИЛЯКАЮ КОГТИ ★ КОШАЧИЙ СТРИМ МАЙНКРАФТ ★,20,2018-02-17T13:37:43.000Z,63649,5504,318,172,False
Дмитрий Шилов,4,17.19.12,Украсил Каток во дворе за 100 000 рублей,22,2017-12-18T07:28:39.000Z,98054,4769,1024,991,False
Coffi Channel,4,17.03.12,COFFI - JUST A PRANK BRO ( КЛИП НА 3.000.000 ПОДПИСЧИКОВ ),20,2017-12-02T14:59:49.000Z,407491,78775,3456,14623,False
Всё по Маслу,4,18.08.01,"Всё по маслу... Ребята, очень важно!!!",22,2018-01-07T17:28:32.000Z,229237,27576,851,1472,False
Просто так бывает!!!,4,18.14.05,"Этот феномен уносит сотни жизней в год, но о нем знают немногие!",22,2018-05-13T15:32:08.000Z,74947,3800,370,175,False
Пресс-служба АКО,4,18.29.03,Обращение Амана Тулеева к жителям области в связи с трагедией (28.03.2018),25,2018-03-28T07:38:53.000Z,130740,0,0,0,True
Юрий Болдырев. Канал единомышленников,4,18.14.01,Ю. Болдырев. Грудинин - миллиардер: 20000% лжи (встреча  доверенных лиц Грудинина 13.01.18),25,2018-01-13T13:17:08.000Z,4811,426,18,254,False
DJEric,4,18.05.01,Лучшая Музыка 2018 ♫ Зарубежные песни Хиты ♫ Популярная Музыка 2018,10,2018-01-04T08:00:01.000Z,33256,223,26,11,False
FIGHTNEWS_INFO,4,18.01.04,Обзор боя Александр Поветкин - Дэвид Прайс 01.04.2018,17,2018-04-01T00:37:02.000Z,51754,265,173,96,False
JackBelozerov,4,17.11.12,Магнитные деньги | ПРОВЕРКА ЛАЙФХАКОВ с канала SLIVKI SHOW и 5-Minute Crafts,23,2017-12-10T07:00:04.000Z,180878,20828,427,1521,False
DSIDE BAND,4,18.10.02,Творческий путь в новом амплуа — продолжение | Сериалити DSIDE BAND |  4 серия,10,2018-02-10T03:57:30.000Z,18717,1859,26,437,False
Best Cube,4,18.18.03,BEST CUBE # 245 | ЛУЧШИЕ ПРИКОЛЫ МАРТ 2018,23,2018-03-17T09:51:17.000Z,147179,2354,656,312,False
Иван Наумов,4,17.16.11,15 ноября 2017. Военная обстановка в Сирии . Сирийская армия возвращает  боевиков в Северную Хаму,25,2017-11-15T16:40:00.000Z,6541,34,7,1,False
LIVELOVEASAPVEVO,4,18.06.04,A$AP Rocky - A$AP Forever (Official Video) ft. Moby,10,2018-04-05T17:00:00.000Z,1315821,128878,1151,8816,False
КАКИЕ НОВОСТИ ШОУ БИЗНЕСА ?,4,18.02.01,На Цымбалюк Романовскую завели новое уголовное дело.   Джигарханян будет мстить .,22,2018-01-01T17:47:28.000Z,10478,133,11,32,False
Mr X,4,17.11.12,Русский ниндзя 3 выпуск 10.12.2017,24,2017-12-10T09:51:08.000Z,6745,38,3,9,False
ARU TV,4,18.14.02,Как Дерипаска рыбку ловил. Артемий Троицкий,25,2018-02-14T04:19:32.000Z,2512,352,8,44,False
plaYboyZ tv,4,18.05.01,"СТРАХ-ПОНГ, СВИДАНИЕ ВСЛЕПУЮ (Алиса и Эрон)",24,2018-01-04T13:38:17.000Z,94227,3346,149,270,False
ISLAM. TV,4,17.19.12,КТО ИЗ ВАС СЕГОДНЯ ВОШЕЛ В РАЙ?,22,2017-12-19T04:00:01.000Z,1992,200,2,20,False
TRUST TV,4,17.15.11,4 ёшли қизалоқнинг отаси МИЛИЦИОНЕР экан!,25,2017-11-14T20:01:59.000Z,57079,546,69,414,False
Первый канал Евразия,4,18.27.01,52 адам тірідей жанып кеткен автобус жүргізушілері сотталуы мүмкін,25,2018-01-26T14:29:35.000Z,76108,196,131,377,False
Səni Axtarıram / Bizə Danış,4,17.15.11,Seni axtariram 13.11.2017 Tam verilis / Seni axtariram 13 noyabr 2017,24,2017-11-14T10:14:28.000Z,33743,245,55,78,False
Datamania,4,18.14.04,БЕРЁЗКА 9-16 серии - Россия-1 - Сюжет и содержание серий,1,2018-04-12T20:26:48.000Z,94559,566,66,15,False
Lega Play,4,18.13.03,PLAYERUNKNOWN'S BATTLEGROUNDS - 6 ТОП-1 НА ЭТОМ СТРИМЕ!! КИБЕРДЕДЫ ПРОТИВ ВСЕХ!!,20,2018-03-12T16:20:38.000Z,56321,3897,201,29,False
Доктор Карлов,4,17.26.11,Диагноз Алексею Навальному. Доктор Карлов #14 (часть 1),22,2017-11-25T07:08:38.000Z,104652,5591,1212,595,False
Звездные Дети,4,17.05.12,New! ДЕТИ ПУГАЧЕВОЙ И ГАЛКИНА: Лиза с мамой Аллой и Маруся!,22,2017-12-04T10:00:02.000Z,18242,406,23,33,False
Дмитрий Машков,4,18.16.04,НОВЫЙ HYUNDAI SONATA 2.4 ОБЗОР. ПРОВАЛ В ПРОДАЖАХ! ПОЧЕМУ ЕГО КУПИЛ ВЛАДЕЛЕЦ?,2,2018-04-15T16:11:50.000Z,38622,1348,113,554,False
ФАКУЛЬТЕТ ЮМОРА,4,18.21.03,ЛУЧШИЕ ПРИКОЛЫ 2018 МАРТ #2 | ЛУЧШАЯ ПОДБОРКА | ТОПОВЫЕ ПРИКОЛЫ,22,2018-03-20T09:16:29.000Z,12008,191,16,47,False
Хайп News,4,17.28.11,"ХайпNews#60: ВАДА и МОК «обокрали» русских олимпийцев. Трамп не «человек года». С праздником, Мамы!",22,2017-11-27T07:03:56.000Z,73939,2083,680,217,False
Жадан Исполняет Мечты,4,17.25.12,Жадан Исполняет Мечты: Предложение. Новогоднее настроение. Кабина машиниста.,24,2017-12-24T16:23:17.000Z,29216,4916,51,386,False
Ольга Фео,4,17.24.11,Елки в магазине ИКЕА (по вашим запросам) + покупки (какая рамка!!!!),22,2017-11-23T08:50:24.000Z,4248,245,9,97,False
Animator Snowman,4,18.10.05,День победобесия ( Countryballs ),24,2018-05-09T16:30:03.000Z,61770,4466,243,856,False
Акыркы Жаңылыктар,4,18.15.03,Дырдай жылаңач эки жаш иш үстүндө уктап калып шылдың болду,22,2018-02-17T15:10:41.000Z,71182,106,158,40,False
Газета Кемерова,4,18.27.03,Видео с камеры наблюдения Зимняя Вишня Кемерово,25,2018-03-26T11:13:01.000Z,30123,36,2,37,False
MMA UZBEKISTAN,4,17.19.11,Кадыров Узбекскому Бойцу Подарил Новый Мерседес,17,2017-11-18T15:36:01.000Z,97027,2377,97,507,False
Арт видео,4,18.15.02,"За Грудинина 45% россиян, кремль осознал фатальную ошибку",19,2018-02-15T01:11:33.000Z,1800,755,35,283,False
Karina Arakelyan,4,18.13.03,МЕНЯ ПЫТАЛИСЬ СОБЛАЗНИТЬ!! МОЙ ПЕРВЫЙ РАЗ В LIKE!,24,2018-03-12T11:33:28.000Z,66622,4778,337,1169,False
Kissy Slimes,4,18.16.05,НАШЛА БЕСПЛАТНЫЙ СЛАЙМ В ПОСЫЛКЕ 😱 Слаймы из Америки @martianmatterslime,22,2018-05-15T16:32:39.000Z,41495,2795,67,1536,False
PolitWera,4,18.10.03,Выбор мирового сценария с гл. редом журнала World economy АЛ.Сосновским,25,2018-03-09T18:32:44.000Z,14480,368,31,67,False
Radik Aibashev,4,18.01.01,Камчатка. Новогоднее поздравление Путина с Новым 2018 годом!!!,19,2017-12-31T12:33:03.000Z,183806,13742,4767,1895,False
EASYVISION,4,18.07.05,ПРАНК: ДЕВУШКА САДИТСЯ НА ПАРНЕЙ В МЕТРО,22,2018-05-06T10:23:12.000Z,76365,4100,153,628,False
YOUGIFTED - первый фитнес канал,4,17.19.12,НАКАЧАТЬ ПРЕСС - ПРОЩЕ ЧЕМ ТЫ ДУМАЕШЬ! Лера Махнюк,17,2017-12-18T17:38:31.000Z,27467,2058,78,175,False
Ka-Re Production,4,18.25.01,Ka-Re Prod... POLOVINA / ПРЕМЬЕРА /2018,10,2018-01-24T16:59:25.000Z,12465,1419,13,138,False
HBO,4,18.05.02,Westworld Season 2 | Official Super Bowl Ad | HBO,1,2018-02-05T02:01:07.000Z,2337600,10753,441,908,False
beelineru,4,18.23.04,День космонавтики 2018,28,2018-04-12T14:41:12.000Z,12054,101,52,5,False
PTXofficial,4,18.24.02,[OFFICIAL VIDEO] HAVANA - PENTATONIX,10,2018-02-23T15:00:09.000Z,1243076,136240,2458,9445,False
HD Трейлеры,4,18.03.02,"Пятьдесят оттенков свободы — Отрывки из фильма #2 (Субтитры, 2018)",1,2018-02-02T09:30:54.000Z,72596,489,14,7,False
Классные Тут,4,18.01.02,"ДОРТИКОС - КОГДА Я НОКАУТИРУЮ ГАССИЕВА, ВСЕ РОССИЯНЕ ЗАГОВОРЯТ ПО-ИСПАНСКИ / ИНТЕРВЬЮ",17,2018-01-30T13:01:27.000Z,16502,90,49,167,False
Ярослав Ефремов Live CH,4,17.17.11,BMW 650! Стоят ли остатки былой роскоши 850 тысяч рублей ?,22,2017-11-16T11:55:45.000Z,83787,1356,270,228,False
Кузница Тест Драйва,4,18.27.01,Москвич 403. Финишная прямая. Больше года реставрации за плечами. Серия 10.,2,2018-01-26T22:28:43.000Z,4654,939,5,89,False
Мегаплан - Двигатель бизнеса,4,17.24.11,"Канбан от Мегаплана. Доска визуальных карточек, которая сделает продажи прозрачными.",27,2017-11-23T07:02:03.000Z,52617,51,203,33,False
Central Partnership,4,18.03.01,Тренер — Официальный трейлер HD,1,2018-01-02T09:00:02.000Z,262787,1743,1809,434,False
Президент 2018,4,17.22.11,Богданов 2018. А когда вы по настоящему выбирали?,25,2017-11-21T07:03:42.000Z,103045,424,3546,801,False
Vost,4,17.30.12,Ю.Болдырев.Грудинину Стрелков и Удальцов не нужны.,25,2017-12-29T08:43:48.000Z,12394,350,24,151,False
Вечерний Юмор,4,18.23.03,Квартал 95 разрывает все что происходит в политической жизни - порвали Турцию ДО СЛЕЗ в 2017,23,2018-03-22T15:00:04.000Z,80896,413,86,51,False
ORJEUNESSE,4,18.03.05,ДТП Бухой сотрудник МВС Corvette Харьков  РЕПОСТ,2,2018-05-02T01:42:21.000Z,259459,29224,384,1388,False
Вика-Простые Рецепты,4,18.26.02,ЧУДО Пирог в ПОСТ/Манник апельсиновый Простейший,26,2018-02-25T18:32:46.000Z,4013,763,5,31,False
Islam Badurgov,4,17.07.12,ВЫЗОВ! ГАННИБАЛ КИНГ МАКСИМУМ ПОДТЯГИВАНИЙ 120 СЕКУНД,17,2017-12-06T06:24:59.000Z,129642,6087,155,626,False
Валерий,4,18.22.01,Даария Леля и Асгард,24,2018-01-21T22:20:46.000Z,4336,436,24,110,False
Скрытый Пул,4,18.12.03,🔥ПАПИЧ КОММЕНТИРУЕТ VP vs VGJ! ХУЛИ ТАК ИЗИ В ФИНАЛЕ?!,20,2018-03-11T20:31:07.000Z,56010,1265,88,115,False
Семья Светофоровых,4,17.14.11,Семья Светофоровых 2 сезон 24 серия Важный экзамен,1,2017-11-13T11:59:06.000Z,48210,1036,33,326,False
Юра Николаев,4,18.24.03,Снос башни в Екатеринбурге ( взрыв),22,2018-03-24T04:21:09.000Z,13423,179,27,69,False
KunUZ,4,18.22.01,11 OYLIK GO'DAK TANASIDAN 16 DONA IGNA TOPILDI,25,2018-01-21T15:24:39.000Z,78303,1813,116,1620,False
VEDI TAROT,4,18.13.02,КУДА ОН ПРОПАЛ - Общий расклад таро,22,2018-02-12T10:00:01.000Z,4804,443,7,85,False
КУРКУМА,4,17.14.11,ТОП 5 САМЫХ ЖУТКИХ МЕСТ НА ЗЕМЛЕ,24,2017-11-13T05:11:56.000Z,66129,1182,64,30,False
НУДЯТИНКА .ТВ,4,18.26.02,Россия - Германия голы 25.02.2018 Олимпиада 2018,22,2018-02-25T07:17:02.000Z,143699,845,343,438,False
Колян Питерский,4,18.11.03,СКОЛЬКО СТОИТ ТВОЙ ШМОТ? GUCCI ЗА ТРИСТА ТЫСЯЧ!,26,2018-03-10T14:02:21.000Z,59434,1746,380,417,False
Русский сериал,4,17.24.11,Большие деньги 7-8 серия (2017) Мелодрама криминал фильм сериал,1,2017-11-23T13:29:34.000Z,5892,10,2,1,False
Астрология с Ермолиной Татьяной.,4,18.03.01,🌪 Гороскоп на январь 2018 г. Затишье перед бурей ...,22,2018-01-02T18:08:08.000Z,6842,0,0,32,False
Elena Patrakova Krasnoyarsk,4,17.28.11,Собралась в Индию. Что в моей дорожной сумке,26,2017-11-27T13:40:36.000Z,5124,274,3,70,False
Kiricheshki News,4,18.27.03,Разъярённые кемеровчане требуют от властей правды о пожаре,25,2018-03-27T03:46:51.000Z,16192,910,44,546,False
Georgy Pranks,4,18.15.03,"Чувак, я тр*хнул её маму! / Странные Разговоры Пранк",23,2018-03-14T13:34:58.000Z,77453,9626,130,1062,False
Lragir AM,4,18.21.04,Ոստիկանը ցուցարարներին. դուք արժանի եք ծափերի,25,2018-04-20T16:06:58.000Z,79966,680,65,90,False
Ольга Шобутинская,4,18.31.01,Шоколадный  ТОРТ Сувенирный |  Сметанный Бисквит и Крем Огонёк Chocolate cake,22,2018-01-30T09:25:56.000Z,26560,2493,74,184,False
Yury MMA,4,18.15.01,КАКОВ МАНХУФ В ЯРОСТИ?,17,2018-01-14T21:37:29.000Z,5339,77,18,10,False
ЛЮБарская,4,17.31.12,ШОУ ПАРЕНЬ ОДЕВАЕТ МЕНЯ В... / РУСЛАН УСАЧЕВ/1 серия,22,2017-12-30T09:19:12.000Z,84733,9588,188,612,False
Мысли в слух,4,18.08.03,Чужая - 5 серия смотреть онлайн сериал 2018 Россия1,1,2018-03-07T11:42:40.000Z,42873,102,48,20,False
СаваИгнатич,4,17.24.12,СаваИгнатич Новый год,10,2017-12-23T07:00:27.000Z,90710,1522,561,220,False
voltNik,4,18.29.01,НЕ ЗНАЕТЕ ЧТО ВЫБРАТЬ? ВИДЕОРЕГИСТРАТОР НА AMBARELLA A12! JUNSUN H030,28,2018-01-29T02:00:01.000Z,1861,164,13,12,False
УБ ПРИКОЛЛАР,4,18.20.01,SAHNADA BALO BORMI SANGA SHARMANDA - YANGI TELEGRAM PRIKOLLAR #108 / UZBEK PRIKOL,23,2018-01-19T15:52:53.000Z,45248,553,87,206,False
Тоня Андреева,4,17.22.11,Импровизация 3 сезон 21 серия Сабуров (21.11.17 год) фотослайды,23,2017-11-21T18:09:33.000Z,4485,30,9,9,False
Вокруг Света,4,18.05.01,ЭKСТPEHHЫЙ ВЫПУCK 3  01 2018 ЕВГЕНИЙ МУРАЕВ,25,2018-01-03T14:37:23.000Z,118333,676,254,349,False
MixNews-TV,4,18.15.04,Этой ночью началась новая эпоха...,25,2018-04-14T10:08:16.000Z,361974,5361,4360,2354,False
Ош Пирим Телеканалы,4,17.20.11,Күйөөгө чыкса оорубай калат деп турмушка эрте беришкен. Күдөр 19.11.17,29,2017-11-19T13:13:55.000Z,56941,672,53,456,False
Anastasiya Shpagina,4,17.27.12,"ОТНОШЕНИЯ, ОТНОШЕНИЯ, ОТНОШЕНИЯ 😬",26,2017-12-26T14:11:21.000Z,439231,39014,3717,4011,False
Канал Смеха,4,17.15.11,Убойный танец - это нужно видеть! Ржал весь зал! УГАР,23,2017-11-14T15:33:17.000Z,11612,239,39,15,False
missAnnsh,4,17.07.12,11 ЛУЧШИХ ЛАЙФХАКОВ для девушек #missAnnsh,26,2017-12-06T15:20:40.000Z,20110,2133,30,1111,False
ПОШЛАЯ МОЛЛИ,4,18.05.02,ПОШЛАЯ МОЛЛИ — ТИПИЧНАЯ ВЕЧЕРИНКА С БАССЕЙНОМ,10,2018-02-03T10:42:25.000Z,776597,55150,11334,3785,False
10klass,4,18.13.01,Сергей Семёнов и Диана Шурыгина на Прямом Эфире!,22,2018-01-12T12:38:39.000Z,28689,88,40,17,False
hype trend,4,18.19.02,КАК ВЫГЛЯДЯТ ДЕВУШКИ В АРМИИ В РАЗНЫХ СТРАНАХ,24,2018-02-18T09:00:04.000Z,52928,1361,121,298,False
Приятного аппетита!,4,17.20.11,Салат Розовый. Без майонеза 🎄Новогоднее меню🎄 4к видео,26,2017-11-19T14:03:27.000Z,14223,775,55,37,False
Не будь инертным | НБИ,4,18.18.02,Воспитательная работа с охраной и Безопасником😀,29,2018-02-17T15:00:35.000Z,6607,448,29,161,False
Junior Eurovision Song Contest,4,17.23.11,RUSSIA 🇷🇺 - EXCLUSIVE REHEARSAL FOOTAGE - POLINA BOGUSEVICH - WINGS - JUNIOR EUROVISION 2017,24,2017-11-22T11:17:48.000Z,17592,850,131,382,False
T-Series Apna Punjab,4,18.26.05,Kudi: Arman Bhangu | Official Viideo Song | Groove Master | Raj Lehlan | Latest Punjabi Songs 2018,10,2018-05-25T04:45:00.000Z,375759,3451,134,225,False
League of Legends RU,4,18.02.02,ЭННИ: начало | League of Legends,24,2018-02-01T15:54:05.000Z,84472,6728,169,852,False
Телеканал 1+1,4,18.22.02,За три дні до кохання. 3 серія,1,2018-02-21T20:00:00.000Z,37604,319,59,45,False
MY DIMKA,4,18.01.01,Алла Пугачева - Я летала (Премьера!),25,2017-12-31T13:26:26.000Z,10114,293,14,25,False
Главные Новости,4,18.02.03,МАКСИМ ШЕВЧЕНКО: ЯДЕРНОЕ ПОСЛАНИЕ ПУТИНА АМЕРИКАНЦАМ!  ТАЙНЫЙ СМЫСЛ!,25,2018-03-01T22:00:00.000Z,2852,342,5,52,False
Nastya Hertz,4,18.17.04,"КОРОЧЕ ГОВОРЯ, Я НАЧАЛА ПЕТЬ",22,2018-04-16T14:03:50.000Z,61666,6571,261,642,False
Страна.ua,4,17.06.12,Как Саакашвили вытаскивали из машины СБУ,25,2017-12-05T11:56:06.000Z,554419,4611,913,4264,False
Real WeeL,4,17.15.11,Поющие анимоджи iPhone X,10,2017-11-14T05:49:22.000Z,28794,2702,301,104,False
7 канал Красноярск,4,18.27.03,"«Передай, что я ее любила»: дети в охваченном пламенем ТРЦ по телефону прощались с родными",25,2018-03-26T12:56:38.000Z,116803,546,78,294,False
Не может быть,4,18.28.01,7 САМЫХ БОГАТЫХ ДОЧЕК в МИРЕ. Как живут девушки - дочки миллионеров,29,2018-01-27T15:00:01.000Z,37418,1254,123,85,False
главный канал,4,17.23.12,Биткоин идет на 5000? Степан Демура декабрь 2017 новый прогноз. Последнее интервью.,22,2017-12-22T14:37:51.000Z,9008,97,43,78,False
Дом 2 - НАВСЕГДА,4,18.15.01,Дом 2 свежие новости - от 20 января 2018 (эфир 20.01.2018),22,2018-01-14T13:02:25.000Z,11113,21,13,7,False
Усман Баратов Ватандош,4,18.18.05,Oq uy  O'zbekiston: Шавкат Мирзияевга бакириб савол берилди.,25,2018-05-17T17:17:08.000Z,71607,805,154,432,False
Миша Марвин,4,17.20.12,"Миша Марвин feat. Bumble Beezy - Молчишь (премьера клипа, 2017)",10,2017-12-19T07:55:54.000Z,246085,10845,621,639,False
АДЕКВАТ ТВ,4,18.03.01,Пионтковский - В ШТАБЕ ПУТИНА ИСТЕРИКА!,22,2018-01-02T15:26:54.000Z,47333,640,170,297,False
Факт,4,18.05.01,СРОЧНО!!! Сирийцы накрыли мощным минометным огнем российскую военную базу Хмеймим,25,2018-01-04T10:33:52.000Z,17179,133,70,240,False
Sony Pictures Entertainment,4,18.24.04,VENOM - Official Trailer (HD),24,2018-04-24T03:45:03.000Z,2358881,220631,5949,29526,False
RadioLive,4,17.17.11,Вячеслав Мальцев | Плохие новости | Артподготовка | 16 ноября 2017,25,2017-11-16T23:10:51.000Z,4666,193,86,65,False
CRISP,4,17.12.12,ШАГАЕТ ПО ВОЗДУХУ / Invisible Box Challenge,22,2017-12-11T15:23:59.000Z,117459,17048,2365,2154,False
Rainbow_ Vika,4,18.10.03,С ПРОШЕДШИМ 8 МАРТА!,23,2018-03-10T05:01:42.000Z,22834,4140,29,1085,False
archecave,4,18.04.02,Зюганов и Грудинин. Митинг За социальную справедливость Москва. 03.02.2018,22,2018-02-03T16:08:21.000Z,28958,1488,5309,583,False
Политика Новости Мир,4,18.01.01,Новогоднее обращение президента России Владимира Путина 2018 (31.12.2017),25,2017-12-31T12:55:44.000Z,539390,40247,25616,0,True
TJ & RU,4,17.15.12,Каромат Шарипов жив!  12.12.2017,22,2017-12-14T12:27:50.000Z,34357,422,36,120,False
Sv.R Lana Roi,4,18.26.01,ОТКРЫТКА С Днем Татьяны! Красивое поздравление.,10,2018-01-25T03:36:03.000Z,31105,190,16,8,False
Ольга Брукман,4,17.11.12,🗽США🎈СКАНДАЛ🎈 ОТВАЛИТЕ ОТ МЕНЯ НЕУДАЧНИКИ🎈 РЕАЛИЗУЙТЕСЬ БЕЗ МЕНЯ И МОИХ ИДЕЙ,22,2017-12-10T15:50:25.000Z,11278,556,303,0,True
MrLololoshka (Роман Фильченков),4,17.20.12,Обращение Лололошки к Президенту,20,2017-12-19T17:51:16.000Z,211319,28883,1880,5811,False
Алексей AlexStitch,4,17.30.11,Вышитые новогодние украшения,26,2017-11-29T16:51:01.000Z,4891,632,4,96,False
Menua Harutyunyan,4,18.12.05,Վարչապետ Նիկոլ Փաշինյանը ոստիկանությանը ներկայացրեց նոր ոստիկանապետին,25,2018-05-11T10:04:47.000Z,251341,2438,211,351,False
Dizi Fragman,4,17.09.12,Adını Sen Koy 236 bölüm fragman😲😲😲,1,2017-12-08T15:55:55.000Z,107487,414,23,34,False
Doni,4,18.22.03,"Doni – Джин (Премьера клипа, 2018)",22,2018-03-21T08:08:18.000Z,361789,19810,3543,2119,False
Любимая Мелодрама,4,18.09.01,"ПРЕМЬЕРА 2018 ВЫНЕСЛА ИНТЕРНЕТ [ БОГАТАЯ МАТЬ ] Русские мелодрамы 2018 новинки, фильмы 2018 HD",22,2018-01-08T18:23:27.000Z,23778,106,34,3,False
VERTUHA,4,18.03.05,ПІКНІК. ОЧІКУВАННЯ vs РЕАЛЬНІСТЬ,22,2018-05-02T13:08:16.000Z,332717,20964,654,1318,False
Новости телеканала Царьград,4,17.28.11,Дмитрий Хворостовский: Прощальные аплодисменты,22,2017-11-27T15:02:59.000Z,46283,348,16,71,False
Алексей Казаков,4,18.14.02,Керлингистка Брызгалова сводит с ума весь мир // Алексей Казаков,22,2018-02-13T18:33:13.000Z,43329,1294,185,311,False
Тэнгу,4,18.20.02,Российская фигуристка не смогла сдать допинг-пробу.,25,2018-02-19T23:15:15.000Z,7267,806,11,153,False
MrUnfiny,4,18.12.03,ПОДПИСЧИКИ ПОМОГАЮТ СТРОИТЬ ПОДЗЕМНЫЙ ГОРОД! СТРИМ #3!,20,2018-03-11T21:16:49.000Z,60119,3227,108,31,False
KuTstupid - Студия анимации 2х2,4,18.19.04,Кит Stupid Show - Как уйти из ресторана не заплатив,1,2018-04-18T12:45:01.000Z,61468,3005,119,115,False
Все тайное становится ЯВНЫМ,4,17.05.12,Шувалов наносит новый страшный удар по России,25,2017-12-04T11:15:13.000Z,8836,230,10,68,False
N G,3,17.26.11,Забит Магомедшарипов vs Шеймон Мораес | Бой 25 ноября 2017,17,2017-11-25T13:04:14.000Z,4526,58,1,9,False
Нина Ши,3,18.06.01,ЛИРИКА ... не счастливый брак,22,2018-01-05T13:26:49.000Z,11634,635,76,0,True
The Bell,3,17.15.11,Автомобиль Улюкаева выезжает из гаража «Роснефти» перед задержанием,22,2017-11-14T15:24:14.000Z,108866,66,315,96,False
Юрий Шатунов,3,18.04.01,Юрий Шатунов - В Рождество (официальный клип),10,2018-01-03T09:56:09.000Z,34903,1939,92,194,False
2vmeste,3,17.27.11,Как НЕ разочароваться в мужчине?,27,2017-11-26T14:44:20.000Z,4627,258,9,23,False
Damon,3,18.13.03,Это вам не Minecraft ДОМ НА ДЕРЕВЕ это ROBLOX от DAMON и ИЛЮШИ,20,2018-03-12T13:00:02.000Z,57423,1245,33,210,False
Stanislav Morozov,3,18.03.03,ФСБ пытки в СИЗО. Куда пропал Камикадзе? ВЫБОРЫ 2018,22,2018-03-02T10:05:35.000Z,66728,4920,21196,919,False
Smash,3,17.19.12,СКОРПИОНЫ (не ГОРОСКОП),27,2017-12-18T18:17:39.000Z,58542,15756,81,992,False
CNL tv,3,18.12.05,Paşinyanı Şuşaya gətirən vertolyot niyə vurulmadı?,25,2018-05-11T11:16:22.000Z,104950,1072,146,402,False
Свободная Пресса,3,17.29.12,Юрий Болдырев: «От дебатов во втором туре Путин не отвертится»,22,2017-12-28T08:43:34.000Z,13885,600,43,291,False
Не Женское Дело,3,18.25.01,Не Женское Дело by Юлия Рыбакова (тизер- трейлер 2018),22,2018-01-24T06:53:44.000Z,91502,2187,1457,275,False
Bratishkin Videos,3,18.29.05,Братишкин Смотрит РЕАКЦИЯ ЛЮДЕЙ НА МОИ ВЫХОДКИ! (PRANK),24,2018-05-28T22:21:05.000Z,10630,639,15,33,False
Damla Official,3,17.27.11,Damla - Xosbext ol / 2018 (Official Klip Clip),24,2017-11-26T15:52:27.000Z,56042,4583,106,819,False
Humble Music,3,17.17.12,Teaser | Nai Shad Da | Gippy Grewal | Jay K | Jaani | Humble Music,10,2017-12-16T12:31:08.000Z,638509,10851,274,383,False
Ошуительное Хоу,3,18.31.05,Ошуительное Хоу - Александр Шпак,23,2018-05-30T15:57:37.000Z,540019,22775,8887,2255,False
Alex Derial,3,18.22.04,УРАГАН в Москве   мощный ШТОРМ 21.04.2018,25,2018-04-21T19:54:34.000Z,141384,1168,307,650,False
Александр Балу,3,17.24.11,Школьники в Бундестаге. Что это было? (разбор и мнение),25,2017-11-22T14:11:13.000Z,52169,5705,250,1360,False
топКино,3,18.19.05,Уилл поставил на ставку всё своё время - Время (2011) - Момент из фильма,1,2018-05-18T12:00:02.000Z,145187,1785,54,102,False
Super Girl,3,17.15.11,ОГРАБИЛИ БАНК!! Познакомились с МАЛЬЧИКОМ Дети совершили ОГРАБЛЕНИЕ Для детей KIDS Children,24,2017-11-14T05:52:58.000Z,415860,4164,1092,895,False
НАШ НАДЗОР,3,18.13.02,Честный участковый выручает беспомощное Воронежское ГИБДД. Часть 3. Тротуарные балаболы.,2,2018-02-12T07:16:18.000Z,4739,401,26,100,False
Muhsin Production,3,17.17.12,Охирон Суханхои Каромат.Ш -барои чи манро депорт кардан дар хавопаймо ?,10,2017-12-16T07:42:48.000Z,71166,1629,48,116,False
в Краснознаменске.ру,3,17.26.12,Автобус протаранил группу людей на Славянском бульваре в Москве,25,2017-12-25T12:43:32.000Z,240307,435,305,740,False
MediaProMusic,3,18.29.01,Zdob si Zdub feat. Loredana & Лигалайз - БАЛКАНА МАМА / BALKANA MAMA (official video 2018),10,2018-01-29T06:37:35.000Z,1932,248,28,16,False
STUDIO CHANNEL,3,18.12.01,Эртугрул 102 серия Анонс [Русский перевод],1,2018-01-11T09:58:01.000Z,6413,31,1,8,False
Play Uz,3,18.31.03,ISTANBULLIK KELIN 19-Qism | O'ZBEK TILIDA HD | ИСТАНБУЛЛИК КЕЛИН,1,2018-03-30T23:58:23.000Z,2670,46,3,9,False
bazar net tv,3,18.18.01,Слёзы Дженнет 15 серия РУССКАЯ ОЗВУЧКА,1,2018-01-17T18:13:31.000Z,2986,40,4,14,False
Открытый Канал,3,18.19.03,Выборы-2018. Мать пойманного с пачкой бюллетеней стала зампредом УИК,25,2018-03-18T12:37:50.000Z,29480,638,24,201,False
rastman15,3,17.10.12,"Мне с вами по пути 1,2,3,4 серия (сериал, мелодрама) Весь фильм 2017",10,2017-12-09T15:04:05.000Z,15926,84,19,4,False
Обо всЁм,3,18.19.03,Вброс Бюллетеней/ г  Ростов на Дону 18 марта 2018,23,2018-03-18T11:29:02.000Z,22129,43,9501,17,False
MYMJ ORIGINALS,3,18.27.01,Tendance Buzz,22,2017-11-28T19:15:13.000Z,49963,2,0,0,False
Даня Крастер,3,18.20.01,Шоппинг и производство военной формы и шлемов,22,2018-01-19T09:33:18.000Z,126604,6857,212,386,False
Roblox Mafia YTFMM Крутой Папа,3,18.17.03,"Роблокс Мафия на стриме, играем с подписчиками, в конце РРР + отборочный на чемпионат Мира",20,2018-03-16T19:36:44.000Z,28839,1361,84,75,False
KURAGA,3,17.16.11,TAG: СЛИШКОМ МНОГО ИНФОРМАЦИИ ОБО МНЕ | KURAGA,22,2017-11-15T10:57:52.000Z,60987,3362,51,331,False
ТОП ФУТБОЛ,3,17.01.12,КТО ПОЕДЕТ НА ЧМ-2018 В РОССИИ? |СБОРНАЯ РОССИИ,17,2017-11-30T14:35:23.000Z,3462,148,6,79,False
Голос UA,3,17.26.11,Что означает путч в Луганске?,25,2017-11-25T18:05:18.000Z,7452,11,100,62,False
Элина Камирен,3,18.13.01,Вся правда о Доме-2 - Разоблачение проекта от Элины Камирен - Часть 3,22,2018-01-12T14:44:48.000Z,18025,541,38,70,False
ИГОРЬ СИНЯК,3,18.16.01,ХУДЕЮ — ШОУ ОБ ЭКСТРЕМАЛЬНОМ ПОХУДЕНИИ (ТИЗЕР),22,2018-01-15T13:25:47.000Z,83850,2899,528,186,False
Лёха Медь,3,18.25.05,Сравниваем команды Fresh Blood 4. Окси VS Смоки. Что с ПиЭмом?,24,2018-05-24T13:50:18.000Z,61194,3282,302,273,False
LIUBCHENKO,3,18.15.01,Manchester United vs Stoke City 5-2 - All Goals & Highlights RÉSUMÉ (Last Matches) HD,17,2018-01-14T12:22:53.000Z,1251261,2947,1220,139,False
сыс тв,3,18.27.02,ШИЗОФРЕНИЯ В СМИ: О чём на самом деле говорил Якубович?,20,2018-02-26T12:16:18.000Z,85721,10176,147,487,False
Эмоциональные итальянцы by MilanTV,3,18.17.01,Итальянки и русские гадания,24,2018-01-16T17:19:39.000Z,12003,706,168,112,False
Джонник,3,18.24.02,Edu: Миф о Торе,24,2018-02-23T11:10:32.000Z,18409,1541,12,64,False
Red Cynic,3,17.01.12,«Законопослушный гражданин». Обзор «Красного Циника»,1,2017-11-30T17:37:06.000Z,43499,7893,368,1017,False
Tiger Trailers,3,17.27.11,Русский ниндзя - Выпуск 1 от 26.11.17.,24,2017-11-26T13:13:31.000Z,30786,300,117,128,False
Suro Arsenyan,3,17.11.12,"Ful haus 7-rd eterashrjan  19 seria Ֆուլ Հաուս 7-րդ եթերաշրջան, 19 սերիա Full House",22,2017-12-10T20:15:15.000Z,26927,378,35,11,False
wwwcar72ru,3,18.04.02,Пнул и уронил фоторадар КРИС-П!,2,2018-02-03T21:58:35.000Z,1468,70,1,9,False
Lincore,3,18.16.01,КОТ ИЛИ ДЕВУШКА,23,2018-01-15T14:20:33.000Z,76563,9232,205,3410,False
AlexGO,3,18.04.05,ШОК! МАЛЬЧИКИ ЛОЛ СУММЕРКИ и РАССВЕТ В РЕАЛЬНОЙ ЖИЗНИ ⭐ КОСПЛЕЙ КУКЛЫ ЛОЛ КОНФЕТТИ ПОП 2 ВОЛНА!,24,2018-05-03T16:25:00.000Z,33446,3470,136,2086,False
Супер Сус,3,18.25.02,Пубертат vs Полиция | Приняли прямо на станции,22,2018-02-24T16:06:20.000Z,82472,4855,121,775,False
Sinta,3,18.02.04,ЛУКА ИЛИ АДРИАН - КОГО ВЫБЕРЕТ МАРИНЕТТ? 12 СЕРИЯ 2 СЕЗОНА [ОБЗОР] | Теории Леди Баг и Супер-Кот,1,2018-04-01T07:00:03.000Z,188541,9148,307,1264,False
Возрождённый СССР Сегодня,3,17.02.12,Андрей Топорков про принтер за 17 руб. 19 копеек и кодах 810 и 643 | Возрождённый СССР Сегодня,22,2017-12-01T08:48:55.000Z,5334,493,11,112,False
Вот что НУЖНО знать!,3,18.21.04,"Девушка НАШЛА эту странную вещь на пляже. Вот что ПРОИЗОШЛО, когда девушка ее перевернула",29,2018-04-19T15:06:12.000Z,32476,72,121,8,False
Кино Филин,3,18.28.04,ПРЕМЬЕРА! СИДЕЛКА (3 серия) / ЛУЧШАЯ МЕЛОДРАМА - 2018 новинка,26,2018-04-25T18:14:19.000Z,77361,117,35,5,False
РЫЖИЙ ПЁС,3,18.05.02,УГАНДА НАКЛЗ В ВИРТУАЛЬНОЙ РЕАЛЬНОСТИ (АНИМАЦИЯ),23,2018-02-04T17:23:43.000Z,115023,7550,290,763,False
respectproduct,3,18.17.03,Макс Корж - Малиновый закат (official video clip),10,2018-03-16T15:51:16.000Z,740327,69344,2062,2666,False
Olyashaa,3,17.15.12,[10 фактов об Olyashaa] Как меня взломать? | Богиня симуляции,22,2017-12-14T15:43:28.000Z,51689,7995,230,733,False
ХАЙП,3,17.18.12,"МОЙ НОС СОПЛИВЫЙ, Я ПЕРЕСТАЮ ДЫШАТЬ [Пародия на Розовое Вино]",10,2017-12-17T12:45:49.000Z,117374,2675,1339,219,False
REDFURYMMA,3,18.16.01,Интервью с Нейтом Диазом о его возвращении,17,2018-01-15T10:00:03.000Z,5849,74,6,6,False
HawkGuruHacker,3,18.06.05,3 Simple Tricks,26,2018-04-16T13:18:26.000Z,3373672,5913,2136,350,False
svitlana potaychuk,3,18.01.04,С Вербным Воскресеньем! Очень доброе поздравление. Музыкальная видео-открытка,22,2018-03-26T11:40:44.000Z,26696,324,14,1,False
Turchik Tv,3,18.27.03,СТАС НЕ ВИНОВАТ!!!!! В ВОЗГОРАНИИ КЕМЕРОВСКАЯ ОБЛАСТЬ ТЦ ЗИМНЯЯ ВИШНЯ,22,2018-03-27T00:06:10.000Z,8631,446,11,68,False
ЗА ПРАВДУ,3,18.11.03,"ГРУДИНИН — ЕСЛИ ПУТИН НЕ УСПЕЕТ УБЕЖАТЬ, ТО ЕГО ЖДЕТ СРОК (11.03.2018)",22,2018-03-06T08:00:07.000Z,51351,3554,99,735,False
Раид,3,17.03.12,Отель Элеон 3 сезон 12 серия (серия в описание),22,2017-12-02T18:49:26.000Z,4501,103,1,44,False
МИР НОВОСТЕЙ,3,18.22.01,🔲 ВДРУГ ПУТИН РЕШИТСЯ ПЕРЕCAЖАТЬ ОЛИГАРХОВ // Максим Шевченко / Грудинин Путин Медведев,22,2018-01-21T11:23:51.000Z,6519,291,5,64,False
Proakca sa,3,18.01.01,В уфе горит елка,17,2017-12-31T17:25:01.000Z,94446,1531,1006,328,False
Председатель СНТ,3,18.18.01,Симонов монастырь свидетель Куликовской битвы,22,2018-01-17T14:04:52.000Z,5071,990,7,259,False
TANHO TV,3,17.21.11,Ko’sem / Косем 56-Qism (Turk seriali uzbek tilida),22,2017-11-20T17:02:38.000Z,4237,53,4,19,False
Продюсерская компания Среда/ Sreda Prod Company,3,18.27.01,Секретарша 1-я серия - русский детектив HD,1,2018-01-26T21:16:22.000Z,3602,80,3,5,False
Kono Pl`a,3,18.27.03,Кемерово 25.03.2018 Запись со стрима. Волна рации между МЧС и сотрудниками полиции.№ 1,22,2018-03-26T15:03:41.000Z,27589,213,43,43,False
AEURO TV,3,18.28.02,Кто убил индийскую актрису Шри Деви ?,22,2018-02-27T20:03:30.000Z,7257,59,15,21,False
Кирилл Мазилов,3,17.21.12,Крымский мост сомкнулся 20.12.2017 г.,22,2017-12-20T09:49:52.000Z,112006,2899,146,811,False
atsmin,3,18.15.01,Русский ниндзя 7 выпуск от 14.01.2018,24,2018-01-14T10:34:01.000Z,3986,48,1,6,False
CS.MONEY,3,17.16.12,Санта работает на CS.Money,20,2017-12-16T06:21:33.000Z,850,9,8,6,False
Австрийская Высшая Школа Этикета,3,18.06.04,"Как реагировать на хамство, если вы элегантная женщина",23,2018-04-05T12:59:18.000Z,19893,1192,30,58,False
Анжи Махачкала,3,17.20.11,«Анжи»  —  «Локомотив». Обзор матча,17,2017-11-19T17:45:05.000Z,2370,16,5,7,False
Боевые ботаники,3,18.02.01,Боевые ботаники — самый интеллигентный канал про единоборства! Трейлер БоБо-2018,17,2018-01-02T02:44:15.000Z,1941,194,14,7,False
Сергей Полонский,3,17.13.12,Говорим за всех: Михаил Хазин и Евгений Федоров. Часть 2,22,2017-12-12T15:00:00.000Z,5483,587,24,288,False
Derbent Live,3,18.17.03,Грузия на Горнолыжном курорте Гудаури сломался подъемник,22,2018-03-16T18:15:08.000Z,34865,96,15,123,False
БА ФИКР,3,18.12.03,Как провожали Шавкат Мирзиёев в Душанбе,22,2018-03-11T17:01:10.000Z,82887,2223,63,327,False
Секретный канал РПшеров,3,17.10.12,Биатлон 2017-2018 Гонка преследования Мужчины 09.12.17 Хохфильцен,17,2017-12-09T11:59:09.000Z,11344,3,25,5,False
Лёня ЗАМЕТКИ АГРОНОМА,3,18.16.02,О КОРЕЕ. ОТВЕТ-ВОПРОС. Работа. Медицина. Традиции. Виза. Кухня и т.д.,22,2018-02-16T03:43:58.000Z,1739,242,2,57,False
Guardian News,3,18.06.05,Alexei Navalny and scores more arrested at anti-Putin rally,25,2018-05-05T15:33:58.000Z,19213,546,36,334,False
AzadliqRadiosu,3,18.29.04,Trump Tower belə yandı - Kəmaləddin Heydərov hadisə yerində,25,2018-04-28T13:11:57.000Z,123299,1265,156,469,False
Народный Мульт,3,18.12.01,Как написать письмо Путину,25,2018-01-10T10:39:15.000Z,229760,2327,9074,2085,False
Ira Kovaleva,3,18.17.02,Adını Sen Koy 286-287  Bölüm fragmanı ❤💝💝,1,2018-02-16T16:05:09.000Z,216390,1232,36,65,False
Abu-Saddam Shishani,3,18.29.01,Где была Собчак во время чеченской мясорубки | Ответ кадыровскому патриоту,22,2018-01-28T23:41:14.000Z,22956,1876,401,1479,False
ExperT - Майнкрафт,3,18.11.03,НУБ НАШЕЛ ЧТО СКРЫВАЛ ПРО НУБИК В МАЙНКРАФТ ! ТРОЛЛИНГ НУБА ПРОТИВ ЛОВУШКА MINECRAFT,20,2018-03-11T05:30:01.000Z,7899,692,15,76,False
UNIVERSAL OSHXONA,3,18.28.02,ПАНЧО пиширилмайдиган /Панчо,26,2018-02-28T02:42:44.000Z,2520,279,5,91,False
Голос Страны,3,18.10.03,РОССИЯ - СМОТРЕТЬ ВСЕМ!! (10.03.2018) ВЫБОРЫ ПОД УГРОЗОЙ - АРЕСТ ГРУДИНИНА,1,2018-03-09T13:00:07.000Z,56815,2105,606,964,False
Биографии знаменитостей,3,17.20.12,Где сейчас Амалия Мордвинова? Биография актрисы,22,2017-12-19T09:30:10.000Z,34314,218,56,55,False
Наталья Старостина,3,18.23.01,Причина моего развода,22,2018-01-22T13:34:30.000Z,14143,449,35,192,False
Центр Тамары Глоба,3,17.30.11,Прогноз на Декабрь 2017 от Тамары Глоба,22,2017-11-29T16:36:31.000Z,5164,359,7,30,False
Хит -парад тв,3,18.26.05,Михримах Султан о Хюррем султан Ссор,22,2018-05-25T19:36:20.000Z,27344,529,22,84,False
StefaniЯ,3,18.05.04,"Красивое поздравление с Чистым Четвергом, Чистый Четверг",26,2018-04-04T21:28:44.000Z,11668,139,11,13,False
Экоплант - Дачный ответ.,3,17.22.12,Как посадить Ель? С Митей Фоминым на его даче посадили Туи Смарагд и Ель.,27,2017-12-22T05:28:57.000Z,7155,16,11,7,False
Крым Live,3,17.05.12,КРЫМСКИЙ МОСТ. С высоты. Коптер. Строительство сегодня 04.12.2017. Керченский мост.,22,2017-12-04T11:25:31.000Z,11392,147,11,34,False
"САМОЕ САМОЕ В МИРЕ! (ТОП-5, ТОП-10)",3,18.25.02,"10 НЕВЕРОЯТНЫХ ГАДЖЕТОВ И ИЗОБРЕТЕНИЙ ДЛЯ КУХНИ, КОТОРЫЕ ВАМ СТОИТ УВИДЕТЬ",24,2018-02-25T00:07:50.000Z,2457,251,10,11,False
ANTONplusANNA,3,17.29.11,#190 Влог! Готовим Шарлотку с Яблоками и Корицей!,24,2017-11-28T15:44:37.000Z,65403,5410,55,307,False
Polit tube channel,3,18.18.03,Реальный рейтинг кандидатов в Президенты России Выборы 2018 Финал. Узнайте кто №1!!!,25,2018-03-18T04:56:05.000Z,14276,1117,143,454,False
ArmeniaTV News,3,18.06.05,Ադրբեջանցիները զարմացած են` իրենց դատարկ և աղքատ Հայաստան էին ցույց տալիս,25,2018-05-05T06:59:03.000Z,153981,1212,57,0,True
Sasha Ice,3,18.21.01,"ТОП 10 НЕЛОВКИХ СИТУАЦИЙ, ЗНАКОМЫХ КАЖДОМУ",22,2018-01-20T09:46:15.000Z,448080,43262,831,4601,False
Евгений Синявский,3,18.28.03,Владимир Путин в КЕМЕРОВО,25,2018-03-27T06:38:14.000Z,92968,343,947,844,False
Ржач под столом,3,18.19.03,Как вбрасывают голоса на выборах 2018,23,2018-03-18T04:41:43.000Z,1084493,15036,36775,4098,False
Павел Крышин,3,17.10.12,Навальный - НЕ КАНДИДАТ в президенты! Признаёт даже Волков. ШОК ВИДЕО,22,2017-12-09T12:44:51.000Z,68213,14748,2345,372,False
KEL,3,17.29.11,KEL - Кайф (LIVE),22,2017-11-28T07:03:01.000Z,114592,4539,3161,446,False
Деревенский Горожанин,3,17.22.11,"❄ Готовимся к зиме // Жизнь Бука // Зернодробилка спустя 1,5 года",29,2017-11-21T15:32:04.000Z,3019,311,7,43,False
AkerMehanik,3,18.09.02,Mazda CX-5. Стоит ли покупать б/у за 1 млн,2,2018-02-08T16:31:41.000Z,10873,711,29,89,False
FATİMA HANIM-ЖИЗНЬ ТУРЕЦКОЙ ЖЕНЫ,3,18.23.04,в гостях у СВЕКРОВИ - что делают фото у нее на столе - ПРИДАНОЕ СВЕКРОВИ  !!! / Измир Турция,22,2018-04-22T14:27:16.000Z,16563,603,30,130,False
Pablo Taviani,3,18.12.05,Նիկոլ Փաշինյանը ոտքով գնում է աշխատանքի,25,2018-05-11T14:59:34.000Z,213128,4651,189,435,False
Дмитрий Крест,3,17.09.12,09 12 2017 СР0ЧН0 К ПР0СМ0ТРY!!! МИXЕЮШК@ М0ЧИТ!!!,22,2017-12-08T18:44:02.000Z,16267,204,9,26,False
Dennis Semenikhin,3,17.19.12,Дикий забег на Red Bull 400. Это было круто!,17,2017-12-18T08:40:39.000Z,106974,3518,208,187,False
Uzbekona Tv,3,18.02.02,Sevgi iztirobi 108.qism Uzbek Tilida HD,1,2018-01-31T16:01:54.000Z,17732,116,12,21,False
LaoWai,3,17.08.12,УЛИЧНАЯ ЕДА В КИТАЕ #6 🍖 ФЕСТИВАЛЬ ЕДЫ В ГУАНЧЖОУ. Guangzhou food festival 2017.,22,2017-12-07T13:38:59.000Z,11712,968,14,103,False
Артем Пивоваров,3,17.21.11,Артем Пивоваров - Полнолуние (VIDEO/AUDIO),10,2017-11-20T07:04:37.000Z,176685,5845,3153,545,False
VivaVideo,3,18.30.03,Кот говорит я обиделся :((,24,2018-03-23T16:00:00.000Z,30841,371,98,55,False
Shpendi10CFC,3,18.04.01,Arsenal vs Chelsea 2-2 (Highlights & Goals 2017) HD,17,2018-01-04T00:39:47.000Z,96186,860,53,191,False
Ах Астахова,3,17.29.12,Ах Астахова - Новогоднее,22,2017-12-29T05:20:34.000Z,50018,279,33,17,False
RapSoxBattle,3,17.02.12,RapSoxBattle: МИША КРУПИН vs. МАЙТИ ДИ / Сезон 2,10,2017-12-01T17:00:04.000Z,37108,539,615,305,False
Zak,3,18.08.05,"КОРОЧЕ ГОВОРЯ, GRANNY В РЕАЛЬНОЙ ЖИЗНИ [2] [От первого лица] / КОРОЧЕ ГОВОРЯ, ПОИГРАЛ В GRANNY",23,2018-05-07T09:00:00.000Z,45113,5635,89,646,False
SERIALS,3,18.23.04,Холостяк. Россия 6 сезон 8 выпуск 29.04.2018 - АНОНС | ДАТА ВЫХОДА,24,2018-04-22T20:16:13.000Z,17271,5,148,2,False
Kowiy,3,18.19.05,"КОВИ x ВЛАДУС — КОМП (Премьера клипа 2018, Пародия)",10,2018-05-18T12:04:38.000Z,133105,24350,877,5547,False
Tomatos,3,18.13.03,12 ПОБЕД НА ВОЛЬНОЙ АРЕНЕ,20,2018-03-12T09:46:58.000Z,90565,3019,73,218,False
Куки Френтизи,3,18.04.03,Пони страшилка урод,22,2018-03-03T10:18:21.000Z,12389,582,15,98,False
КЫЗЫК ТВ,3,18.26.04,Айгерим Расул кызы Нурлан менен Аселдин Кыз Узатуу Тоюнда,22,2018-04-25T09:06:21.000Z,58911,215,21,64,False
STOPFAKE,3,18.11.02,МРАКОБЕСИЕ НА БИТВЕ ЭКСТРАСЕНСОВ: ОБЗОР САМОГО ТУПОГО ШОУ СНГ (ЗА 11 МИНУТ),22,2018-02-10T09:30:46.000Z,30217,2228,109,186,False
JessLife-Pets,3,18.05.03,ОПРОС! КАКОЕ ВИДЕО ХОТИТЕ СЛЕДУЮЩИМ?,22,2018-03-05T10:25:11.000Z,1613,155,7,153,False
Bizarre World,3,18.21.03,Выживет ли простой ШКОЛЬНИК в Зомби апокалипсис?,24,2018-03-20T13:39:23.000Z,53216,2952,111,670,False
Politic World,3,18.18.03,Путин прошел точку невозврата,25,2018-03-17T19:53:52.000Z,6308,629,1848,70,False
Семья Теклиных,3,18.02.01,ФИКС ПРАЙС. Обзор покупок. Опять новинки!? Ура!,22,2018-01-01T14:47:30.000Z,5952,157,18,38,False
Дикий Digital,3,18.01.01,СМЕШНАЯ И АКТУАЛЬНАЯ НОВОГОДНЯЯ КОРОТКОМЕТРАЖКА,1,2017-12-31T06:30:20.000Z,186423,1380,150,41,False
Deaf SPB,3,17.27.11,Ответ критикам насчет кавычек к слову Чайник (DeafSPB),22,2017-11-26T09:03:23.000Z,4247,272,5,34,False
UFC review,3,18.03.04,ПРОГНОЗ НА UFC 223. Макс Холлоуэй vs Хабиб Нурмагомедов. Фергюсон травмирован. Замена главного боя.,22,2018-04-02T09:41:08.000Z,88284,1284,92,333,False
Еда на любой Вкус,3,18.04.03,"Лепешки с Капустой – Минимум продуктов, а так Вкусно! Постные лепешки.",22,2018-03-03T14:06:53.000Z,11400,936,12,47,False
Светофор (сериал),3,18.09.01,Светофор 10 сезон 3 серия  комедийный сериал HD,23,2018-01-08T17:00:04.000Z,15313,231,6,14,False
Alena Bardovskaya,3,18.19.03,Международные НАБЛЮДАТЕЛИ в Крыму: ВЫБОРЫ поставят точку РЕФЕРЕНДУМА в Крыму.,19,2018-03-18T17:21:32.000Z,43096,2576,165,816,False
Андрей Петров,3,18.06.04,ШОУ МЕЙКАПЕРЫ. КТО ПРАВ?,22,2018-04-05T15:30:08.000Z,104113,5712,245,1252,False
ArcticMonkeysVEVO,3,18.06.04,Arctic Monkeys - Tranquility Base Hotel & Casino,10,2018-04-05T13:45:01.000Z,800886,50337,793,4396,False
FSinsider,3,18.19.01,Евгения Медведева недовольна после КП на Чемпионате Европы,22,2018-01-18T15:50:01.000Z,13006,98,10,32,False
Sport go pro,3,17.18.12,"Биатлон. Масс-старт. Мужчины. Кубок мира. Annecy, France. 17.12.2017",17,2017-12-17T14:25:01.000Z,16284,65,9,24,False
Valera Vines,3,18.03.02,Valera.vines#4 Гори в аду эта работа,23,2018-02-01T13:15:04.000Z,31849,6,3,0,False
Mystical Buttons,3,18.07.05,ПЕРВЫЙ СКЕТЧ МАРКЕРАМИ нужны ли они?,26,2018-05-06T14:38:39.000Z,26278,3961,22,252,False
Тепло-вода,3,18.12.02,Котел из Франции. Дорогой и красивый.,28,2018-02-11T20:12:54.000Z,6676,456,21,159,False
Аяз Шабутдинов,3,18.20.01,У меня будет сын | Аяз Шабутдинов,22,2018-01-19T07:02:37.000Z,535607,2923,151,579,False
ЖИЗА,3,18.21.05,10 глупых вопросов РЕЖИССЕРУ | Алексей Нужный,24,2018-05-01T11:08:25.000Z,31444,1508,13,43,False
МеждоМедиа Групп. Политика,3,17.13.12,НОВЫЙ СРОК ПУТИНА | МеждоМедиа Групп,22,2017-12-12T16:00:05.000Z,26400,6438,145,655,False
Чечня Сегодня,3,18.15.03,Рамзан Кадыров один прогулялся по городу Грозный,29,2018-03-14T17:10:36.000Z,154429,4394,329,1121,False
Голос Германии,3,18.28.02,"Немецкий журналист: Меркель разрушила Германию, Европу и свою партию [Голос Германии]",25,2018-02-27T21:12:44.000Z,8659,847,13,113,False
Лидия Афанасьева,3,17.20.11,Эксперт 173,22,2017-11-19T08:54:14.000Z,5257,381,5,22,False
Поздравления LeoTV,3,18.23.02,Красивое поздравление С 23 февраля! Зуби зайка!,24,2018-02-22T06:20:26.000Z,93764,936,64,11,False
RUSAF TV,3,18.13.02,Чемпионат России в помещении 2018 - 1 день,17,2018-02-12T19:41:16.000Z,13860,61,7,2,False
PUDRA,3,17.20.12,ПАРНИ ПРОБУЮТ ТРЕНДЫ ИЗ ИНСТАГРАМА,26,2017-12-19T13:46:09.000Z,8121,411,30,39,False
Большой Брат,3,17.18.11,У телеведущего Андрея Малахова родился сын! 45-летний Малахов впервые стал отцом !,24,2017-11-17T13:48:24.000Z,22238,182,13,20,False
Clear Russian Youtube,3,17.14.11,Алексей Навальный в Смоленске. Часть выступления. Хорошее качество. (12.11.2017.),25,2017-11-12T18:52:29.000Z,50716,2322,2560,940,False
rusreklama,3,17.23.11,Реклама Ферреро Роше - Дмитрий Хворостовский (Тореадор),26,2014-04-06T23:29:42.000Z,21039,56,2,7,False
SportsNet Team,3,18.29.01,ОБЗОР БОЯ Александр Усик vs Маирис Бриедис,17,2018-01-28T05:36:55.000Z,382683,3738,302,1135,False
PressTube Russia,3,18.18.04,КАК СДЕЛАТЬ ИДЕАЛЬНЫЙ МЕТАЛЛИЧЕСКИЙ ШАР ИЗ АЛЮМИНИЕВОЙ ФОЛЬГИ,22,2018-04-17T07:44:49.000Z,2686762,55924,9430,7564,False
WOMANUR Ада Кондэ,3,17.22.11,Как поверить в исполнение мечты? Как повысить уровень веры?,27,2017-11-21T11:13:42.000Z,6957,432,4,18,False
KIR MomeNT,3,17.25.11,Что ты такой Серьезный? | Темный Рыцарь (2008),22,2017-11-24T13:54:30.000Z,4334,42,4,6,False
UNILATV1,3,18.17.03,"Взбесившийся подъёмник. Эвакуация туристов. Канатная дорога в Гудаури, Грузия 16 марта 2018",24,2018-03-16T13:16:17.000Z,281373,800,115,432,False
Дальнобой с Юлией Лазаревой,3,18.05.01,Надо поговорить... #1,22,2018-01-04T16:06:56.000Z,31969,1392,210,640,False
Булик,3,18.10.03,УВОЛЬНЯЕМ ДЕВУШКУ ИЗ МАГАЗИНА?! МЕНЯ УВОЛИЛИ?! ТОРГОВЫЙ ЦЕНТР В МАЙНКРАФТ #4,20,2018-03-10T04:06:06.000Z,3921,528,34,129,False
Valijon Shamshiyev,3,18.16.02,Valijon Shamshiyev - Bir aktyor teatri nomli konsert dasturi 2017,23,2018-02-16T04:58:07.000Z,2690,251,18,44,False
NEXT TV,3,17.12.12,Чубак Жалиловдун аялы милицияга арыз жазды,22,2017-12-11T13:42:24.000Z,24139,77,43,119,False
Warner Música,3,18.20.05,Natalia Oreiro - United by love (Rusia 2018) [Official Lyric Video],10,2018-05-17T19:58:33.000Z,432233,7856,567,1401,False
googledoodles,3,18.22.04,Earth Day 2018 Google Doodle,1,2018-04-21T15:00:50.000Z,141384,1168,307,650,False
Сардели России,3,18.30.01,Реакция нормального человека на пропаганду,22,2018-01-29T06:03:49.000Z,422528,5935,32885,5065,False
Алексей Клевакин BUGAY ALABAI,3,18.17.02,Бугай Алабай. Монопородная выставка САО. Благовещенск 17.02.18 судит Купляускас Евгений.,22,2018-02-17T05:32:23.000Z,1280,141,2,44,False
Estonianna,3,17.19.11,МАКИЯЖ КОШАЧИЙ ГЛАЗ - ДЕЛАЕМ ЗА 5 МИНУТ,26,2017-11-18T10:26:46.000Z,78074,6090,95,184,False
Bin's COMIX,3,17.10.12,Комикс Леди Баг и Супер-Кот // Всему есть ЦЕНА... #3 / Комикс #11 с русской озвучкой,1,2017-12-09T16:13:04.000Z,6059,511,14,31,False
TAJIK Show,3,18.01.06,Срочно👈 Отменить  👉ПАТЕНТА👈для ТАДЖИКОВ,29,2018-05-31T17:23:49.000Z,136359,1397,433,353,False
Unknown,3,18.16.01,"Что бывает, когда встречаются «Лайфньюс» и «Дом 2»",22,2018-01-15T19:05:34.000Z,60156,1015,36,238,False
BLACK MOVIE,3,17.26.12,Черное кино - Динамит,10,2017-12-26T05:35:18.000Z,54643,259,79,44,False
BALUNOVBET TV,3,18.25.02,Стрим. Хоккей. Олимпиада 2018. Финал. Россия 4-3 Германия.,17,2018-02-25T08:10:25.000Z,54577,1099,1975,46,False
Time of History,3,18.16.01,#36 Король Лев: Как гиены вернули Шрама?,1,2018-01-15T09:50:26.000Z,11607,709,16,170,False
Игорь Линк,3,17.25.12,ДЕБИЛ ПУТЕШЕСТВУЕТ #1 - Вильнюс,20,2017-12-24T15:01:54.000Z,77577,9554,505,1033,False
Сергей Лазарев,3,17.08.12,БИЛАН / ЛАЗАРЕВ - ПРОСТИ МЕНЯ (Official video) ЭКСКЛЮЗИВ!!,10,2017-12-07T08:57:58.000Z,388879,24170,1001,2166,False
Би-2,3,17.28.12,"Би-2 – Тема века LIVE (25/11/2017 @ ВТБ Ледовый Дворец, Москва)",10,2017-12-27T06:00:01.000Z,110588,1090,24,56,False
74ru,3,18.12.02,Разбился борт Москва — Орск,25,2018-02-11T13:43:41.000Z,32277,50,31,57,False
DANCE MUSIC CHANNEL,3,18.24.03,ТАКОЙ ТАНЕЦ НЕ ОЖИДАЛ НИ КТО !! ТЕМА ПОШЛА !!,22,2018-03-23T11:17:59.000Z,20195,62,19,10,False
Маленькие Большие Новости,3,17.21.11,Скорбь школьника из России по «невинным» солдатам вермахта возмутила Рунет,25,2017-11-20T10:36:33.000Z,5081,35,78,278,False
Dead By Daylight,3,18.18.01,Dead by Daylight – Time is running out!,20,2018-01-17T16:36:34.000Z,235382,8121,185,2751,False
The Seven,3,17.20.11,CP0ЧH0!!! P0CCUЯ BX0ДИT В YKPAИHY - ЛABP0B (20.11.2017),25,2017-11-19T08:00:01.000Z,28662,136,28,55,False
KrassboX,3,17.10.12,ВАСИЛИЙ ЛОМАЧЕНКО - ГИЛЬЕРМО РИГОНДО! БОЙ (ПОЛНЫЙ ОБЗОР БОЯ) + КОНКУРС,17,2017-12-10T05:06:30.000Z,47235,400,197,338,False
Школа Пахома,3,17.14.11,ВКурлык / интервью с Пахомом,27,2017-11-13T09:04:19.000Z,34858,934,52,133,False
BRAIN TIME,3,18.23.05,"КОГДА ВЛАСТИ ОСУШИЛИ ЭТОТ 200 ЛЕТНИЙ КАНАЛ, ОНИ НАШЛИ НА ДНЕ ТО, ЧТО ПОРАЗИЛО ЖИТЕЛЕЙ!",22,2018-05-22T07:01:22.000Z,321460,5691,565,378,False
Крым новости,3,17.21.11,Строительство Крымского моста. 20.11.2017г.,25,2017-11-20T08:33:49.000Z,9575,47,12,5,False
THE_BodYkE,3,18.13.05,"КОРОЧЕ ГОВОРЯ, GRANNY В РЕАЛЬНОЙ ЖИЗНИ [От первого лица] / КОРОЧЕ ГОВОРЯ, ПОИГРАЛ В GRANNY",22,2018-05-13T07:41:18.000Z,11090,1702,72,322,False
Андрей Дуйко/ Andrii Duiko,3,17.09.12,Бесплатный вебинар от Андрея Дуйко из Милана!,27,2017-12-08T18:13:34.000Z,6440,245,1,25,False
Andrey Miner,3,18.08.02,"ОН НЕ ЗАМЕТИЛ,ЧТО СТЕКЛО УЖЕ ТРЕСНУЛО...",24,2018-02-07T15:34:03.000Z,33933,2626,316,763,False
Globall Info 24,3,18.01.02,"РЕЙТИНГ ГРУДИНИНА НЕ ПРОСТО РАСТЁТ, ОН -  ВЗЛЕТАЕТ !!!",25,2018-01-30T21:16:00.000Z,232827,9396,7409,2474,False
Видеомемы,3,17.14.11,Осенний розыгрыш,23,2017-11-13T11:05:09.000Z,95171,1047,135,67,False
valeriyaofficial,3,18.16.01,"Валерия - С такими, как ты (Премьера клипа, 2018)",10,2018-01-15T07:00:50.000Z,235003,28647,2307,1145,False
24/24 Последние новости,3,18.27.03,"Отец трех сгоревших в Кемерово детей рассказал, как пытался их спасти - Происшествия - МК",25,2018-03-26T11:48:58.000Z,234839,830,525,408,False
NikiMoran,3,17.10.12,"РАСПАКОВКА 15 ПОСЫЛОК С ALIEXPRESS и UGEARS | Конкурс | пылесос, одежда, техника, кэшбэк | NikiMoran",24,2017-12-09T15:00:30.000Z,11989,639,21,194,False
Danzei Chan,3,18.30.04,Пони страшилка кто здесь,22,2018-04-30T08:22:59.000Z,1982,386,3,80,False
ArtemaS,3,18.04.05,"Счастливы вместе 1 сезон, 93, 94, 95 и 96 серия (Букины)",22,2018-04-30T22:11:18.000Z,20978,247,25,22,False
???? ????,3,17.22.11,Эрига Хиёнат Килган Келин - Денгиздан Томчи,24,2017-11-21T08:53:24.000Z,38987,198,23,31,False
КАК - Константин ака Костян,3,18.01.05,Обзор Том ям и Пад тай. Сравнение качества и цены ресторана и придорожной кафешки!,22,2018-04-30T15:40:53.000Z,37493,3609,153,251,False
Интересный Фикус,3,17.17.12,КОСТЮМ ЛЕГО РОБОТ  ИЗ КАРТОНА - DIY,28,2017-12-16T09:00:04.000Z,146654,8487,274,865,False
Rozetka.ua,3,17.23.11,Две недели с iPhone X: без восторгов,28,2017-11-22T08:51:09.000Z,194850,11181,1235,1399,False
Радіо Свобода онлайн,3,17.06.12,LIVE | Затримання Саакашвілі,25,2017-12-06T02:42:06.000Z,753379,4712,1909,65,False
Англо Sucks,3,18.29.01,Complete thrill snowboard,22,2018-01-28T17:35:43.000Z,162975,580,2436,558,False
Надежда Решетникова,3,18.14.01,"Зажигаем , друзья!  !",26,2018-01-13T01:12:28.000Z,65755,0,0,10,False
m.ti,3,17.14.11,Леха купил ВАЗ 2104 вслепую! M.TI БОЛЬШЕ НЕ БУДЕТ НА КАНАЛЕ?!,2,2017-11-13T12:12:05.000Z,46426,2550,75,176,False
Держи Передачу,3,18.26.02,Теперь будет хуже. День с Алексеем Шевченко 26 февраля,17,2018-02-26T03:32:33.000Z,1501,89,20,15,False
Muse,3,18.16.02,Muse - Thought Contagion [Official Music Video],10,2018-02-15T19:28:57.000Z,585170,43006,2024,6339,False
PaninVit,3,18.05.01,(!СРОЧНО!) ПОСЛАНИЕ КОНОРА ПЕРЕД ВОЗВРАЩЕНИЕМ В UFC,17,2018-01-04T19:03:50.000Z,55533,1303,155,315,False
Пирамида Козлоу,3,18.17.01,Трейлер сенсационного реалити шоу о Выборах Президента РФ,22,2018-01-16T07:20:17.000Z,175388,1459,9339,851,False
YAVOR Production,3,18.18.05,ЦВЕТ НАСТРОЕНИЯ СИНИЙ - ЕСЛИ БЫ ПЕСНЯ БЫЛА О ТОМ ЧТО ПРОИСХОДИТ В КЛИПЕ - YAVOR,24,2018-05-16T19:11:35.000Z,34147,2917,101,339,False
Repostim,3,18.26.02,Российские хоккеисты спели гимн РФ во время награждения на Олимпиаде,17,2018-02-25T08:49:16.000Z,350204,3415,1081,891,False
Natali 75.ИНТЕРЕСЫ НАШЕЙ СЕМЬИ,3,17.17.12,КОРОЛЕВСКАЯ СЕЛЕДКА ПОД ШУБОЙ ТАКУЮ ВЫ ТОЧНО НЕ ЕЛИ ОЧЕНЬ ВКУСНО,26,2017-12-16T06:27:07.000Z,76911,2266,156,145,False
Pavel Savenkov,3,18.10.06,"Казусы На Премии Муз ТВ 2018. Ляпы и Позор. Обзор премии. Бузова, Киркоров, Крид",22,2018-06-09T19:41:24.000Z,228449,2609,2547,432,False
Nadia,3,18.27.03,Камера сняла начало пожара в Зимней вишне Кемерово 26.03.2018,22,2018-03-26T13:36:49.000Z,329452,0,0,490,False
Политика Мира,3,17.21.12,ПPИБЛИЖAETCЯ CTPAШHЫЙ KOHEЦ  Ротсилав Ищенко   20 12 2017,22,2017-12-20T10:00:05.000Z,19236,83,35,6,False
Саша Кэт,3,17.06.12,ПЕРЕВОПЛОЩЕНИЕ В МАРЬЯНУ РО И FACE,22,2017-12-05T12:49:15.000Z,330054,34980,1129,2722,False
Интересный Канал,3,18.29.03,"Потерявший двух дочерей отец рассказал, что творилось в кинозале Зимней вишни",25,2018-03-28T14:12:54.000Z,1181551,5165,1448,2989,False
Aaleksful,3,18.17.02,Россия-Словения 8:2 Голы. Олимпиада-2018 в Корее 16 февраля 2018 г.,17,2018-02-16T22:33:15.000Z,2701,56,6,17,False
TalzGame,3,17.13.12,[ОБЗОР] Званый ужин Пауль Альбертович (САМЫЙ БЕЗУМНЫЙ ВЫПУСК),23,2017-12-12T06:00:04.000Z,27988,2025,42,218,False
Домик в Деревне,3,17.25.11,Супер посадка  14 белых орхидей /Закрытая система/Часть 2,22,2017-11-24T11:33:56.000Z,6692,544,22,83,False
ФУТЛОЛ ШОУ,3,18.27.05,РЕАЛ МАДРИД – ЛИВЕРПУЛЬ l ЧЕСТНЫЙ КОММЕНТАТОР,17,2018-05-26T23:21:25.000Z,153346,4175,622,896,False
THE HATTERS,3,18.17.01,THE HATTERS - FOREVER YOUNG FOREVER DRUNK (feat. Just Femi),10,2018-01-16T13:52:47.000Z,237534,33810,2277,1485,False
WebM,3,17.12.12,Dank WebM Compilation #42,24,2017-12-11T14:40:04.000Z,32669,1812,128,90,False
Tert.am News from all over the world,3,18.09.05,Նիկոլ Փաշինյանը ժամանում է Բաղրամյան 26,25,2018-05-08T12:21:35.000Z,233930,1474,381,281,False
MrsWikie5,3,17.22.11,"Style&Talk БЕРЕМЕННОСТЬ, ВЕС, МОРАЛЬНОЕ СОСТОЯНИЕ, ДЕВЯТЫЙ МЕСЯЦ",26,2017-11-21T15:07:58.000Z,28388,2760,23,252,False
Ximo Pierto,3,18.17.02,"2018 NBA All-Star Celebrity Game - Full Game Highlights | Feb 16, 2018 | 2018 NBA All-Star Weekend",17,2018-02-17T02:25:48.000Z,630316,8639,369,909,False
Андрей Зверев,3,18.16.02,Новости ГИМС,2,2018-02-15T20:33:22.000Z,2041,149,6,128,False
Вячеслав Мальцев,3,18.07.02,ВО ФРАНЦИИ СНОВА ПРОПАЛ МАЛЬЦЕВ Новости в 21.00 НАРОДОВЛАСТИЕ,29,2018-02-06T21:12:02.000Z,24439,703,88,56,False
Студия Сбитый Лось,3,17.03.12,София в России - 1 серия: Робот и шашлыки,23,2017-12-02T05:04:29.000Z,101282,1388,841,106,False
FACE,3,18.26.02,FACE - Я РОНЯЮ ЗАПАД (prod. by JuloOntheTrack),10,2018-02-25T16:37:52.000Z,898369,59510,54641,13795,False
Bazooka,3,17.16.11,Кирилл Терёшин. Хватит пыхтеть в тренажерке,24,2017-11-15T15:29:24.000Z,3174,20,39,43,False
olegcricket,3,17.12.12,Olegcricket -  Жив . Это не первая серия. Анонс запуска канала,17,2017-12-11T11:08:06.000Z,44754,1926,60,167,False
НОВИНКИ КИНО,3,18.07.03,"Чужая 3 серия Премьера 2018 Русские мелодрамы 2018 новинки, сериалы 2018",1,2018-03-06T11:37:47.000Z,19019,54,13,41,False
Дик,3,17.19.12,СНОВА ИГРАЕМ В АНИМЕ КРОКОДИЛА,24,2017-12-18T10:41:17.000Z,62263,6385,149,525,False
Планета Шоубиз,3,17.20.11,Бузова На дне рождения у общей подруги с Бородиной,22,2017-11-19T17:48:55.000Z,6801,19,6,0,False
Fosters,3,17.19.12,ЧТО БУДЕТ ЕСЛИ ЗАМОРОЗИТЬ КОМПЬЮТЕР,28,2017-12-18T13:59:09.000Z,105190,10924,842,1325,False
time XAK,3,18.12.05,"БОБ меня ЗНАЕТ разбор серии БОБ в параллельных мирах 'эпизод 20, сезон 3",1,2018-05-11T19:08:13.000Z,34254,1985,117,826,False
Shumbola Tv,3,18.13.02,УЗБЕК ПРОТИВ РУССКИЙ БУ БОЙНИ БИР КУРИНГ АЧИНМАЙСИЗ,22,2018-02-12T07:01:00.000Z,48599,0,0,108,False
mhzteams,3,18.28.03,признание медика о числе погибших в Кемерово тц зимняя вишня,25,2018-03-27T15:48:18.000Z,560563,5480,1652,2391,False
Arina Belaja,3,17.05.12,"ПОКУПКИ В АШАНЕ, ПРИМЕРКА В СПОРТМАСТЕРЕ | Arina Belaja",22,2017-12-04T17:21:09.000Z,6507,0,0,93,False
Александр Миллер,3,18.09.05,СЪЕЛ ЕДУ В МАГАЗИНЕ И УШЕЛ НЕ ЗАПЛАТИВ - ПРАНК / ПРИЕХАЛА ПОЛИЦИЯ реакция людей / ПОЕЛ ЕДУ БЕЗ ДЕНЕГ,24,2018-05-08T05:59:39.000Z,209743,10471,970,1022,False
Dua Lipa,3,18.13.01,Dua Lipa - IDGAF (Official Music Video),10,2018-01-12T12:00:07.000Z,5247220,528421,9357,28420,False
Qaynoq Xabarlar,3,18.13.02,Москвадаги самолётнинг кулаши кузатув камерасига тушиб колибти,22,2018-02-12T06:17:47.000Z,5139,29,6,5,False
Alpha Centauri,3,18.04.02,Космический телескоп Гершель,28,2018-02-03T22:20:49.000Z,2765,489,8,42,False
LIZER,3,18.14.01,LIZER - СЕРДЦЕ,10,2018-01-13T18:00:13.000Z,119127,8872,3517,1258,False
Kari,3,17.16.11,ТИПЫ ЛЮДЕЙ В МАГАЗИНЕ,22,2017-11-15T16:05:26.000Z,179075,11427,678,411,False
Family is...,3,18.07.02,"8 Фраз, Которые Не Стоит Говорить Мужчине. Что Нельзя Говорить Мужу  Family is...",26,2018-02-06T14:31:01.000Z,15734,1479,21,120,False
Stalingrad Fishers,3,18.18.01,Топ 5: лучшие виброхвосты для ловли судака,17,2018-01-17T13:20:36.000Z,5943,437,7,86,False
Олег Зубков,3,18.30.04,Выпуск шимпанзе из зимнего вольера в летний,22,2018-04-30T06:22:42.000Z,3250,227,3,13,False
Мой_протест,3,18.09.03,НА ВЫБОРЫ ИДЁТЕ??? СОЦ.ОПРОС.КОСТРОМА.70%ЗА ПУТИНА???,23,2018-03-08T22:13:19.000Z,48376,2855,853,3690,False
showaks,3,17.24.11,Путин уронил стул Эрдогана. Путин выхватил стул и уронил его.,22,2017-11-23T12:06:54.000Z,83217,113,409,172,False
YouTube Russiа,3,17.07.12,Дагестанец мощно ответил Чечнцу оскорбивший Имам Шамиля и Аварцев,24,2017-12-05T19:32:34.000Z,8399,86,31,158,False
Rickey F,3,17.23.12,Rickey F — Новая Москва (ft. hvy),10,2017-12-22T17:46:29.000Z,159948,19896,1771,1223,False
Кондрашов!,3,17.05.12,"КАКОЙ D.MASTA? ХОВАНСКИЙ, ЧТО С ТОБОЙ? (versus: D.MASTA vs DRAGO)",10,2017-12-04T11:00:12.000Z,65491,3957,332,354,False
starshipTV,3,18.19.02,[MIXTAPE] I.M - Fly With Me (Teaser),10,2018-02-18T12:00:01.000Z,127877,35338,25,2829,False
Azerbaycan online,3,18.09.01,Mədəsini kiçildən aşıq Əli tanınmaz halda,24,2018-01-08T12:42:08.000Z,48984,225,47,55,False
North Seven,3,17.02.12,Документальный спецпроект. Подземные тайны,1,2017-12-01T13:38:37.000Z,6090,41,3,3,False
stupidmadworld,3,17.17.11,MIUI 9 против MIUI 8. Стоит ли обновляться до девятки?,28,2017-11-16T16:00:27.000Z,51183,3442,153,721,False
Усы Пескова,3,17.25.12,Депутат Федоров и фермеры,25,2017-12-24T13:29:11.000Z,8615,129,4,44,False
ISU Junior Grand Prix,3,17.08.12,Alexandra TRUSOVA RUS - ISU JGP Final Ladies Short Program Nagoya 2017,17,2017-12-07T08:27:17.000Z,43060,645,35,176,False
Павел Балушкин,3,17.28.11,ПашАсУралмашА:-Ловля на блеснилку!,26,2017-11-27T10:10:55.000Z,5865,297,8,61,False
TheKateClapp,3,17.01.12,САМЫЙ НЕЛОВКИЙ МОМЕНТ!!! / MTV EMA 2017 #ЛОНДОН,10,2017-11-30T10:59:44.000Z,584166,49818,822,2147,False
NARAN_OFFICIAL,3,18.17.03,18+ ВИДЕО.  В ГРУЗИИ СЛОМАЛСЯ ПОДЪЕМНИК И ПЕРЕМАЛЫВАЛ ЛЮДЕЙ,22,2018-03-16T11:40:11.000Z,145375,431,211,283,False
Яндекс,3,17.29.12,Итоги года в поиске Яндекса,10,2017-12-27T06:29:30.000Z,326927,11942,12170,1439,False
Сообщество Онлайн Инвесторов iTuber,3,18.27.01,Китай Отменит Запреты? Завершение Фьючерсов На CME. Ежедневный Обзор Новостей от iTuber,27,2018-01-26T21:24:40.000Z,3579,291,10,24,False
АудиоОбзоры ЖЖ.ру,3,18.02.01,Взгляд из Киева Как живет Крым спустя три года исхода из Украины mikle1,25,2018-01-01T03:41:35.000Z,10318,74,12,8,False
CAR CAR TV,3,18.24.03,Испанец сходил на матч Россия 0:3 Бразилия,17,2018-03-23T19:41:23.000Z,4263,498,9,83,False
Stanislav Morozov Резервный Канал,3,18.28.03,Сколько на самом деле человек погибло в Кемерово ТРЦ «Зимняя вишня»? 50 или 400 детей?,22,2018-03-27T14:41:04.000Z,351155,9385,6597,2981,False
Jah Khalib,3,18.07.03,Jah Khalib - Медина  | Премьера Клипа,10,2018-03-06T10:04:25.000Z,1047672,73977,3079,5815,False
DJ WHOO KID,3,17.05.12,"OXXXYMIRON Talks EMINEM, Beating DIZASTER , Mumble Rap and More!",10,2017-12-04T16:16:35.000Z,179732,8390,272,759,False
Дмитрий Быков [Радиоэфиры],3,18.03.02,"Быков о конфликте Сванидзе и Шевченко [Один, 2 февраля 2018]",27,2018-02-02T11:43:59.000Z,21703,309,66,172,False
CoreshAndShkolotaVEV - Кореш,3,17.13.12,ПЕРЕПИСКА С УЧИТЕЛЬНИЦЕЙ ПОДПИСЧИКОВ ВКОНТАКТЕ (ЭТО НЕ Анти-Грифер Шоу MINECRAFT PE) вк,20,2017-12-12T12:43:41.000Z,102546,8522,946,4183,False
Призрак,3,18.24.04,ФИЛЬМ ОНО 2017 ПАРОДИЯ - ТЕСТ НА ПСИХИКУ CHALLENGE ОНО RYTP (РЕАКЦИЯ),23,2018-04-23T11:00:03.000Z,40219,3134,496,319,False
Ракета t8,3,18.06.02,💀 САМЫЙ МРАЧНЫЙ ПРОГНОЗ ОБВАЛА КУРСА БИТКОИНА 2018,27,2018-02-05T08:54:13.000Z,59839,5169,309,2949,False
Vspishka в World of Tanks,3,18.13.02,Объект 705. Дзен-прокачка до Об. 705А. #длиннострим,20,2018-02-12T14:53:07.000Z,38526,3468,96,117,False
Лудомания. Casino Streams,3,18.20.01,PlayFortuna казино онлайн,20,2018-01-20T06:02:37.000Z,185918,4299,859,30,False
Tatjana Zhidkova,3,18.08.03,✿✿✿КРАСИВОЕ ПОЗДРАВЛЕНИЕ С 8 МАРТА✿✿✿,22,2018-03-07T00:22:39.000Z,24241,137,8,12,False
YANGILIKLAR UZ,3,17.26.11,MIRZIYOYEV TANGEM BILAN UCHRASHDI,25,2017-11-25T11:23:04.000Z,152738,1035,71,133,False
Беседы у русской печки,3,18.19.02,Как русские нетолерантно наваляли европейским мигрантам,29,2018-02-18T13:39:44.000Z,87640,2753,294,600,False
Biotech School,3,18.07.01,4 ОСНОВНЫЕ ОШИБКИ В АППАРАТНОМ МАНИКЮРЕ. Почему не получается?!,26,2018-01-06T16:20:37.000Z,17074,2269,17,158,False
iowamusicband,3,18.15.03,IOWA - Падай. Премьера клипа!,10,2018-03-13T20:11:59.000Z,137686,7740,113,152,False
The Alex Super,3,17.16.12,"Проверка на Прочность [Сезон 2] #6 (Жуткие ОСТАНКИ в заброшенном ЛАГЕРЕ, Ночь полная Жести, ПОГОНЯ)",20,2017-12-15T06:06:28.000Z,71685,6370,310,671,False
КамедиСтор,3,17.30.11,Готовлю ПЕЛЬМЕНИ для СВОЕГО ПАРНЯ -  Дженна Марблс,22,2017-11-29T14:44:40.000Z,96707,6939,36,422,False
Доренко на #ГоворитМосква,3,18.31.01,Доренко: Минфин США представил «кремлевский список» (Подъем / 30 января 2018),28,2018-01-30T09:43:03.000Z,8445,100,23,79,False
PollmixaN,3,17.05.12,Анонс нового эксперимента от PollmixaN,27,2017-12-04T20:02:55.000Z,6402,881,6,201,False
HENNESSY,3,18.06.01,Выиграл IPHONE X в ИГРОВОМ АВТОМАТЕ за 20 рублей!,22,2018-01-04T13:50:21.000Z,538510,17771,11175,12059,False
Zaltir's Channel,3,17.21.11,ДЕВЯТЬ НОВЫХ КАРТ АДДОНА КОБОЛЬДЫ И ПОДЗЕМЕЛЬЯ HEARTHSTONE!,20,2017-11-20T20:36:57.000Z,45277,1685,54,285,False
DILLERON ★,3,17.09.12,ВРЕДНЫЙ ДЖЕЙК ЛАКИ СКАЙБЛОК С ЛАКИ БЛОКАМИ!!! #47,20,2017-12-08T11:00:03.000Z,371587,12329,839,1669,False
Stadium X,3,18.28.02,"Вольная грамота 9 серия (сериал, мелодрама)",1,2018-02-27T11:44:48.000Z,50656,123,43,37,False
WorkBench,3,18.21.01,ПОЧЕМУ СКАТИЛАСЬ ЛИЗЗКА?,24,2018-01-20T07:50:40.000Z,17631,207,89,50,False
ASMRmania,3,18.17.01,Мои откровения про АСМР / ASMR,26,2018-01-16T18:23:07.000Z,24363,2458,27,557,False
Keiran Black,3,18.03.01,KEIRAN TRUMP,22,2017-11-01T19:55:36.000Z,31005,42,450,77,False
Новости Нижнекамска,3,18.12.01,"«Она очень хорошей, светлой девочкой была! Красавица, умница…»",22,2018-01-11T14:45:50.000Z,4108,13,0,4,False
MasteR TV,3,18.18.03,Жириновский за Грудинина?! Правда о подставе Грудинина на дебатах ! Жириновский проболтался!,22,2018-03-17T07:40:50.000Z,228046,5554,10952,1938,False
Ulug'bek Tv,3,18.17.05,Бу Қиз 200та Итни Бир Гап Билан Стройся Сафга териб Қуйди,22,2018-05-16T13:35:41.000Z,122358,1117,137,0,True
NiKAS – АвтоЛаборатория,3,18.24.03,Снос башни. Екатеринбург (24.03.18) / TV tower demolishing. Yekaterinburg. Russia.,2,2018-03-24T05:09:28.000Z,16570,421,50,138,False
Nintendo,3,17.08.12,Bayonetta 3 Official Teaser Trailer - The Game Awards 2017,20,2017-12-08T03:16:22.000Z,199863,15928,157,3383,False
REFLEXMUSIC,3,17.06.12,Группа Reflex  Ирина Нельсон После тебя,10,2017-12-05T09:26:06.000Z,104163,3030,749,267,False
Даник Кек,3,18.21.01,КАК СКРАФТИТЬ МЕЧ ХЕРОБРИНА В МАЙНКРАФТ? КАК ПОЛУЧИТЬ СЕКРЕТНЫЕ ПРЕДМЕТЫ В MINECRAFT | ЗАЩИТА НУБА,20,2018-01-21T05:00:00.000Z,13906,1321,45,80,False
Dizayn Jamoasi,3,17.19.11,Dizayn jamoasi - Davron Kabulov muxlislarni mot xolatiga olib keldi,23,2017-11-18T18:23:23.000Z,58830,440,76,38,False
Dmitry Klokov,3,18.03.01,ТАЙСКИЕ КАНИКУЛЫ 3 / серия 4,17,2018-01-02T20:50:54.000Z,26158,2529,265,467,False
Денис Климов,3,18.14.02,Катастрофа АН 148 / Объективные данные и Упоротые журналисты,2,2018-02-13T16:33:25.000Z,31894,975,67,234,False
Мамкин майнер,3,18.04.02,Цена на биткоин НЕ ВЫРАСТЕТ? Как на этом заработать?,27,2018-02-04T05:00:01.000Z,840,71,13,25,False
Always Alone,3,18.25.05,Рыбалка на крупного карася и его друзей в селе)) Эксперимент: прикормка с чесноком. Вело - рыбалка.,19,2018-05-24T16:03:28.000Z,45373,4811,34,347,False
Молоко,3,18.23.04,"ШКОЛЬНИКИ УГАДЫВАЮТ ТРЕКИ 3 / DK, Lil Xan, Morgenshtern, Scarlxrd, Ghostemane, Tekashi69 и другие",22,2018-04-22T19:51:41.000Z,116492,4669,913,893,False
РЖАЧ ПОЗИТИВ,3,17.20.11,💥БОЛЬШОЙ  ФЕСТИВАЛЬ ЮМОРА. УМОРИТЕЛЬНОГО СМЕХА ДО СЛЕЗ!😂,23,2017-11-19T07:00:01.000Z,16347,112,22,6,False
ДианаЛёша Life,3,17.30.11,ЗАКУСОЧНЫЙ ТОРТ ПО-МАГНИТОГОРСКИ 🎄НОВОГОДНЕЕ МЕНЮ 2018🎄,22,2017-11-29T12:58:54.000Z,11334,876,37,93,False
Пьяный Повар Show,3,17.16.11,Пьяный повар Show,22,2017-11-15T07:00:53.000Z,130414,306,1946,280,False
Калматай Санжар: Элдик Видео-Роликтер,3,18.01.02,ЧолпонТВ | ЭРКИН МААЛЫМАТ | 30.01.2018 | Жалал-Абад,22,2018-01-30T18:07:07.000Z,6600,23,14,23,False
Radiant Records,3,18.28.05,DDLC animatic [Just Monika] Random Encounters musical ENG song #cover,10,2018-05-27T15:29:14.000Z,17065,2838,51,435,False
Globuzz TV Великолепный Век,3,18.23.03,Хюррем Cултан узнает о смерти своих сыновей [111-132-142],22,2018-03-22T10:41:51.000Z,9530,161,6,26,False
HOT NEWS TV,3,18.27.02,У Собчак напрочь отняло речь после простого вопроса о Путине!?,25,2018-02-26T18:27:29.000Z,8139,51,18,25,False
Телеканал Югра,3,18.24.03,Сегодня станут известны имена победителей викторины «Югре-900!»,25,2018-03-22T03:25:30.000Z,6183,15,1,0,False
Квестоман,3,18.28.03,Жириновский о пожаре в ТЦ Зимняя Вишня в Кемерове 27.03.2018,25,2018-03-27T12:44:23.000Z,648884,14243,1635,3071,False
GHOST,3,18.09.03,ОТКУДА ВЗЯЛСЯ ЭТОТ СТРАШНЫЙ МОНСТР РЕАЛЬНАЯ ЖИЗНЬ В ГТА 5 МОДЫ! GTA 5 ОБЗОР МОДА ГТА ИГРА,20,2018-03-08T12:15:18.000Z,34132,3446,314,601,False
Рассказы Сергея Шнурова,3,17.22.11,Сергей Шнуров: «Кризис пусть пиздует на хуй» в рекламе MediaMarkt!,22,2017-11-21T17:03:02.000Z,2110,20,2,3,False
ЧЕРНЫЙ КАБИНЕТ,3,18.17.01,ПРИШЕЛЬЦЫ В КИНО | UTOPIA SHOW И ИНОПЛАНЕТЯНЕ [СПЕЦВЫПУСК],27,2018-01-16T13:00:01.000Z,58411,5942,120,527,False
НЕПОЗНАННЫЙ МИР,3,18.02.01,Эти находки не вписываются в привычную картину мира!  Неожиданное заявление - тайна Ноя раскрыта,1,2018-01-01T19:46:06.000Z,11210,41,18,5,False
Marina Mikhina,3,17.01.12,Меню На Новый Год 2018! 5 рецептов - пальчики оближешь!,1,2017-11-30T04:00:01.000Z,23604,2263,30,146,False
TheBeSSTija,3,17.27.11,"ФАВОРИТЫ ОСЕНИ. САМОЕ ЛУЧШЕЕ. (Косметика, декор, ароматы для дома..) ЧАСТЬ 1",26,2017-11-26T11:07:21.000Z,20981,963,30,118,False
КиноПремьеры,3,18.15.02,Премьера 2018 | Крепость Бадабер 3 серия |  Русские военные фильмы 2018 HD,22,2018-02-14T13:54:03.000Z,418189,1130,234,235,False
MR.ROMEO,3,18.07.04,17 AWESOME CRAFTING LIFE HACKS & CREATIVE IDEAS,26,2018-03-19T12:58:15.000Z,7310563,13577,5886,699,False
FACEIT,3,17.17.12,"ECS CS:GO S4 Finals Day 2: Group Finals, Lower Bracket",20,2017-12-17T06:57:33.000Z,717581,7361,2081,26,False
Masha Timoshenko,3,17.15.12,"МОЙ ВЕЧЕР // РАБОТА, СЫН, УХОД",26,2017-12-14T16:56:07.000Z,94103,9475,204,387,False
Глаз Tv,3,18.04.01,Грудинин обманным путём захватил Совхоз,25,2018-01-02T23:59:10.000Z,7075,18,86,104,False
NAVI CS:GO,3,17.18.11,ОТКРОВЕННОЕ ИНТЕРВЬЮ С ELECTRONIC [RU/EN],20,2017-11-17T15:59:32.000Z,74358,5339,76,493,False
Krya Krya,3,18.28.01,Posin' - Meme,22,2018-01-27T23:23:18.000Z,5092,1428,17,165,False
YouTuber MiX,3,17.13.12,Yulduz Usmonovaning Tug'ilgan Kunida Erining Sovg'asi,22,2017-12-12T06:58:39.000Z,60691,234,70,0,True
Nicky Rush,3,17.27.12,Битва года. Hellcat vs GT-R. Что круче? V8 707 лс vs V6 565 лс.,2,2017-12-26T08:28:43.000Z,103798,2214,47,377,False
Дмитрий Таран,3,18.01.02,"Информационная война 31 января о санкциях, Донбассе и Сванидзе с участием Валерия Пякина",29,2018-01-31T09:27:54.000Z,9008,477,8,93,False
just enjoy,3,17.10.12,COUB лучшее за неделю декабрь 2017 | coub best,23,2017-12-09T19:34:02.000Z,82006,2067,204,149,False
гтнк,3,18.18.03,Беспредел УИК в Новокузнецке! (Выборы 2018) // ГТНК Новокузнецк,25,2018-03-17T17:02:39.000Z,7877,404,233,175,False
Pro Tech,3,17.21.12,Киев решил ответить России на пуск поездов в обход Украины,22,2017-12-20T06:12:10.000Z,8939,17,6,5,False
Профессор Преображенский,3,17.14.11,"Я КУПИЛ ДВА КАМАЗа NEO #2!!! КУЧА ПРОБЛЕМ?! 50 тысяч км спустя,  КАМАЗ НЕО.",2,2017-11-13T04:44:12.000Z,81309,4479,222,461,False
Лум Планет,3,18.10.02,ВАЛЕНТИНКИ - Открытки с сердечками | 3 простые и красивые идеи,26,2018-02-09T09:00:03.000Z,25633,2017,51,439,False
СМАЙЛИК,3,18.14.02,ЧТО ОНА ВАМ ПОКАЖЕТ ЛУЧШИЕ ПРИКОЛЫ 2018 Февраль  угар видео прикол - ПРИКОЛЮХА #97,23,2018-02-12T15:11:44.000Z,598752,1325,882,80,False
ЛАМПОВЫЙ RAP,3,17.22.11,"СКРИПТОНИТ УДАРИЛ ФАНАТКУ!, OXXXYMIRON НА РАДИО У EMINEM, ЭЛДЖЕЙ ЧЕРНОЕ КИНО - ДЭНСИМ",22,2017-11-21T16:42:59.000Z,102218,2340,184,381,False
Fenyastr CS:GO,3,17.25.12,СЕАНС РЕАБИЛИТАЦИИ | Lenovo Legion Y720,20,2017-12-24T13:57:12.000Z,58051,8965,371,930,False
NEWS Russian Channel,3,17.27.12,ОЧЕНЬ СМЕЛО!!! Зюганов о пресс конференции Путина!!!! КРАСАВЕЦ!!!,22,2017-12-26T09:18:51.000Z,79132,2113,151,549,False
"Татьяна огородница. Сад, огород, виноград.",3,18.11.02,"ПОСЕЯЛ И ЗАБЫЛ - РАССАДА ДЛЯ ЛЕНИВЫХ!!! ВЫРАЩИВАНИЕ ПЕРЦА БЕЗ ПИКИРОВКИ, БЕЗ ПОЛИВА!",22,2018-02-10T15:04:43.000Z,7612,606,12,55,False
Василий Олейник,3,18.09.02,Ещё одна паника и волна распродаж не за горами.,22,2018-02-08T19:58:24.000Z,6325,242,21,59,False
NakanuneTV,3,18.24.03,В Екатеринбурге взорвали телебашню,25,2018-03-24T05:06:53.000Z,1851,37,7,25,False
Только для Женщин,3,18.27.03,Дети звонили родителям из горящего ТЦ в Кемерово,22,2018-03-26T14:48:27.000Z,411803,3558,259,1381,False
Євген Лущиков,3,18.27.03,Пожар в ТРЦ Зимняя вишня Кемерово: паника внутри помещения - жуткие кадры,10,2018-03-26T05:25:32.000Z,1901595,9939,1652,7460,False
Проверь все сам!,3,18.17.02,"В паспорте ПРОПИСАНО, что ТЫ РАБ! Все по закону!",27,2018-02-16T16:00:01.000Z,8256,391,48,115,False
Doug DeMuro Русская Версия,3,18.25.02,Mercedes-AMG E63S Wagon 2018 года - семейный универсал за $120 000,2,2018-02-24T08:34:29.000Z,39978,2162,59,327,False
Мир Православия,3,18.02.04,Понедельник Страстной седмицы. Сретенский монастырь,29,2018-04-01T23:35:44.000Z,2365,188,7,5,False
Sport for you,3,18.05.05,Сборная России — сборная Франции 04.05.2018.\Все Голевые мометы\ Чемпионат мира по хоккею 2018,17,2018-05-04T16:58:14.000Z,37435,342,28,115,False
Виталий Сундаков,3,18.09.02,Анекдот про старого еврея - врача. Почему медицина не может нас вылечить. Виталий Сундаков,22,2018-02-08T14:56:52.000Z,10631,537,12,42,False
THE-FLOW,3,17.28.12,"Новый год с Бастой, ч.1 : «Олимпийский», Тиньков, Дудь, любимые блоги",22,2017-12-27T10:37:59.000Z,107225,2361,555,328,False
Vlad Scop,3,18.13.05,GAZIROVKA - Black (ШКОЛЬНАЯ ПАРОДИЯ) БЛЭК БАКАРДИ | Как снимался клип,23,2018-05-12T19:21:05.000Z,19286,813,32,66,False
NEWS BЕСТИ 24/7,3,18.15.03,Позор Путина в Махачкале Ты кто такой? давай до Свидания!,25,2018-03-14T11:50:10.000Z,140804,3302,628,822,False
ПЕРИСКОПЫЧ,3,17.18.11,"Kizaru о Lil Peep, о приезде Face и Pharaoh",22,2017-11-16T17:50:17.000Z,89749,1345,105,206,False
Əliəşrəf,3,18.01.05,"Səhər saatlarında zibilliyə getdi, həyatının şokunu yaşadı..",24,2018-04-30T19:47:46.000Z,13500,185,60,127,False
Три Кота,3,18.02.06,Три кота - Сила воли - 87 серия,1,2018-06-01T09:00:02.000Z,220312,1437,318,211,False
ISLAM NASHID TV,3,18.08.02,Мухаммад Хоблос  2018 / Зачем ты живёшь? / Напоминание братья и сёстры,22,2018-02-08T02:01:09.000Z,2598,332,2,13,False
Школа Ремонтника,3,18.09.03,🛠 ОРИГИНАЛЬНЫЕ И НЕРЕАЛЬНО КРУТЫЕ САМОДЕЛКИ ИЗ АВТОЗАПЧАСТЕЙ! ТОП 5 КРУТЫХ ИДЕИ!,27,2018-03-08T16:00:02.000Z,8023,380,38,42,False
Банк России,3,17.23.12,Новые купюры 2000 и 200 рублей странно действуют на людей,25,2017-12-22T07:09:58.000Z,360359,0,0,0,True
Skvell,3,17.26.11,Секрет на миллион - Виктор Салтыков 25.11.2017,24,2017-11-25T10:42:39.000Z,39761,79,115,220,False
Kuzno Live,3,17.24.11,Стрим с Алессандрой,22,2017-11-23T19:37:26.000Z,10380,1314,18,134,False
KUN YANGILIKLARI,3,18.05.03,Ш.МИРЗИЯЕВ ЯНГИ КАРОРИ 2018.МАРТ ОЙИДАН БОШЛАБ.,22,2018-03-04T13:25:52.000Z,105898,1344,119,301,False
Ukrop News,3,18.25.01,В России скандал из-за осквернения портрета Путина в Питере,25,2018-01-24T11:44:48.000Z,127086,7951,278,2486,False
Guseynov Tv,3,17.15.11,Китайцы были в шоке от Доброты сирийцев,24,2017-11-14T10:10:52.000Z,12721,453,13,92,False
ОК НЕ ОК,3,17.15.11,Тебя клонировали - [ОКнеОК],22,2017-11-14T05:10:13.000Z,92515,834,174,128,False
Elvin Grey,3,17.01.12,Elvin Grey | 3D шоу (2017) КАЗАНЬ,10,2017-11-30T16:20:50.000Z,6727,375,7,43,False
Yuvamdaki Düşman,3,18.16.02,Yuvamdaki Düşman 4. Bölüm,1,2018-02-15T20:33:06.000Z,98394,1216,119,232,False
SHANT TV Armenia,3,18.10.05,Սահմանին 2/Sahmanin 2 - Սերիա 15,24,2018-05-09T19:49:52.000Z,33089,474,22,13,False
CHECHEN WHATSAPP 3,3,18.23.03,Путин вай деда ву бах х1окх нак1осто.,22,2018-03-22T23:11:29.000Z,1703,48,17,29,False
Следственный комитет Российской Федерации,3,18.06.02,Задержание членов правительства Республики Дагестан,25,2018-02-05T11:27:35.000Z,347068,0,0,705,False
СТРЕМНЫЙ ОБЗОР,3,18.27.02,РАЗРЕЗАЛ NIKE AIR // ЧТО ВНУТРИ?  LUNAR FORCE 1 FLYKNIT,26,2018-02-26T13:03:30.000Z,48025,5748,142,803,False
Саша Шапик,3,17.19.12,ВЛОГ: ПРОСТО ПЕРЕЖИВИ ЭТО СО МНОЙ...,22,2017-12-18T15:18:14.000Z,230211,9803,1895,1382,False
HD Передачи,3,18.04.01,"Угадай мелодию 2018 - Родригез, Караулова, Барановская",24,2018-01-03T15:32:24.000Z,6881,113,4,8,False
5-Minute Crafts,3,17.17.12,50 TOTALLY CRAZY IDEAS YOU CAN ACTUALLY DIY,26,2017-12-16T16:30:00.000Z,1945444,21064,1836,1775,False
Фильмы& Сериалы,3,18.13.05,Победитель Евровидения 2018 - ИЗРАИЛЬ! Netta - TOY!,1,2018-05-12T22:53:45.000Z,40532,80,98,38,False
Lil Peep,3,18.14.05,4 GOLD CHAINS ft. Clams Casino,10,2018-05-14T04:00:01.000Z,225471,36922,232,6251,False
Enjoykin,3,18.01.01,Enjoykin — Москва - Ленинград,10,2017-12-31T20:59:29.000Z,531722,107712,3588,7432,False
Сергей Зимин,3,18.03.03,Грудинин выходит из кремлевской игры в выборы! Политические клоуны поставлены на место!,22,2018-03-02T12:12:54.000Z,8302,881,83,250,False
Любимая Усадьба,3,18.05.04,Никогда не сажайте это растение в своих цветниках   Очиток едкий -  культурный сорняк,22,2018-04-04T18:02:13.000Z,42686,953,88,129,False
Наталья Болденкова,3,18.22.04,Хозяйство как есть.,22,2018-04-22T01:06:12.000Z,1191,124,1,38,False
Хит -Парад Тв,3,17.29.12,Хюррем султан И Фирузе ссорятся перед Михримах,22,2017-12-28T18:15:34.000Z,14768,175,13,24,False
Lora_NI,3,18.17.02,Что такое ЛЮБОВЬ |Animation|,26,2018-02-16T14:39:49.000Z,8374,1470,11,121,False
Alexei Shredder,3,17.14.11,Красивая хитрость Игоря Войтенко в зарубе 100 на 100? Мои выводы после зарубы.,22,2017-11-13T13:10:05.000Z,50695,2599,5248,3119,False
ARTI,3,18.11.03,КАК Я РАЗВЕЛ МОШЕННИКА НА iPhone на olx/avito,29,2018-03-10T10:05:35.000Z,25266,2837,42,483,False
NOOBASHA,3,18.21.01,ОББИ ДЭШ с ПЭКСТЕБЕРОМ - ПАРКУР СОРЕВНОВАНИЯ НА СКОРОСТЬ в РОБЛОКС,20,2018-01-21T01:18:46.000Z,8059,778,21,286,False
kien hoang,3,18.31.03,野生動物の驚くべき瞬間！►► イーグルスネークバードウォーターシールオッター,15,2018-03-30T04:44:59.000Z,4664803,10907,4454,1220,False
RuHub Media,3,17.01.12,Держи в Курсе: Организаторы Мейджора Продают Инвайты,20,2017-11-30T15:15:54.000Z,46367,2092,124,104,False
МХЛ,3,18.18.01,Прямая трансляция матча. «Мамонты Югры» - «Сибирские Снайперы». (17.1.2018),17,2018-01-17T16:41:52.000Z,2931,23,2,1,False
CinemaShowbiz,3,17.28.11,Поклонников Хворостовского не пускают к  гробу,1,2017-11-27T13:09:56.000Z,39069,72,48,36,False
МОНСТРОВЕД,3,18.08.06,РАЗБОР ТРЕЙЛЕРА КАК ПРИРУЧИТЬ ДРАКОНА 3: СКРЫТЫЙ МИР,1,2018-06-07T20:09:21.000Z,27155,1337,127,474,False
TroyeSivanVEVO,3,18.12.01,Troye Sivan - My My My!,10,2018-01-11T05:00:01.000Z,1796354,260168,4282,26674,False
Audio Music,3,17.20.12,"Bruno Mars,Charlie Puth,Ed Sheeran Best Christmas Songs,Greatest Hits Pop Playlist Christmas 2018",10,2017-12-19T05:10:27.000Z,2993086,13495,3938,793,False
Denchik TV,3,17.23.11,Бузовой всегда зеленый свет,22,2017-11-22T17:07:57.000Z,4456,132,4,5,False
Русская Рыбалка,3,18.16.01,Вот это Рыбалка!!!Ты не поверишь!!!2018##210(часть22),24,2018-01-15T09:38:16.000Z,117249,461,133,33,False
YouTube Spotlight,3,17.05.12,Get Ready for YouTube Rewind 2017 | #RewindisComing,24,2017-12-04T18:00:04.000Z,144795,10948,1063,2880,False
Сериал След. Пятый канал,3,18.23.02,«След. Квест»,1,2018-02-22T09:22:42.000Z,17049,208,14,19,False
ccvify,3,18.22.01,Ты не поверишь! 21 01 2018,24,2018-01-21T12:14:18.000Z,13176,26,11,17,False
Hack Life,3,18.08.02,10 ПРОСТЫХ ЭФФЕКТНЫХ ФОКУСОВ ДЛЯ НАЧИНАЮЩИХ ИЛЛЮЗИОНИСТОВ,24,2018-02-07T15:00:04.000Z,24341,936,107,96,False
Alexandr Fonov,3,18.13.03,ЦИК признал клевету на Павла Грудинина,25,2018-03-12T06:02:40.000Z,13631,1277,12,326,False
Свалка Джарахова,3,18.31.01,Джарахов – Делориан (official audio),22,2018-01-30T11:58:41.000Z,74710,12742,364,1144,False
Elena Sadko,3,17.27.11,Елена Садко - Кровь за кровь,10,2017-11-26T06:28:09.000Z,97697,4411,1713,556,False
Angelofreniya,3,17.20.11,Ваше счастливое детство/Косметичка в дорогу,22,2017-11-19T05:54:16.000Z,10549,598,14,52,False
Тигровые Новинки,3,18.20.01,"СВЕЖАК 2018 [ СЛОМАННАЯ ЖИЗНЬ 2] ПРИХОТИ СУДЬБЫ КОНЕЦ Русские мелодрамы 2018 новинки, сериалы 2018",24,2018-01-19T15:04:09.000Z,180080,508,148,80,False
Pronorus News,3,18.11.06,Дернешься – ударю Путин испугал трусливого Порошенко,25,2018-06-10T17:01:09.000Z,58303,512,68,212,False
Видео Дня,3,17.15.11,БАНКИ УЖЕ ВЫВОДЯТ ВАЛЮТУ Юрий ПРОНЬКО 14.11.2017,29,2017-11-14T17:13:18.000Z,6580,89,10,11,False
Диана Анкудинова ex. Ira Irina,3,18.08.06,Диана Анкудинова. Поздравление от Главы г. Тольятти и песня (Cover)  Cher - Strong Enough - live,10,2018-06-07T22:30:33.000Z,16590,490,31,70,False
ViA TV,3,18.26.02,Умерла индийская актриса Шридеви,22,2018-02-25T09:58:29.000Z,18838,132,16,56,False
ИКСКОМ,3,17.08.12,Адекватный обзор Xiaomi A1 в 4k,28,2017-12-07T06:44:35.000Z,57889,1135,311,148,False
Лото Азартный,3,18.02.01,Русское лото 1212 тираж - проверить билеты новогоднего розыгрыша 2018 года,22,2018-01-01T13:26:54.000Z,300276,571,3350,967,False
Ruptly,3,18.27.03,LIVE: Protests in Kemerovo over lack of safety after shopping centre fire,25,2018-03-26T19:32:57.000Z,377526,0,0,0,True
Nikolay Usov,3,18.27.02,Укрепление рубля.  Спрашивали отвечаем!!!,25,2018-02-27T03:52:19.000Z,2624,287,19,0,True
Яндекс.Такси,3,17.26.12,"Deus Ex, режиссер Андрей Золотарев для Medialab Яндекс.Такси",2,2017-12-25T06:46:03.000Z,159514,5933,180,177,False
Сибирский Хаски Петербург,3,18.04.02,Реальная прогулка с Хаски БЕЗ ПОВОДКА,15,2018-02-03T23:34:47.000Z,2126,328,0,65,False
РУССКИЙ РОМАНС,3,17.14.12,"Серебряный бор 3,4,5,6 серия (сериал, мелодрама) 2017",22,2017-12-13T13:18:07.000Z,6728,25,4,0,False
Natali 75.ИНТЕРЕСЫ СЕМЬИ,3,18.01.03,ЧЕМ Я КОРМИЛА СВОЮ СЕМЬЮ В ТЕЧЕНИИ ДНЯ № 4//ЗАВТРАК ОБЕД И УЖИН,26,2018-03-01T05:00:01.000Z,1906,111,3,17,False
Murataev,3,17.27.12,Мотивация от Масленникова / Приют для собак,22,2017-12-26T15:21:00.000Z,49684,5000,194,1131,False
Левой правоЙ,3,18.20.01,За сколько Грудинин продаёт Россию?,22,2018-01-19T16:42:54.000Z,102217,136,3032,596,False
Smol News,3,17.15.12,#SMOLNEWS #2: Жириновский. Честный чиновник. Неуплата налогов. Проспал встречу. Александр Смол,22,2017-12-14T07:04:55.000Z,79284,1709,313,63,False
ValorMainStream,3,18.14.01,Такая прямая | RYTP,23,2018-01-13T18:29:46.000Z,142209,26888,447,2313,False
ХАЙПОВЫЙ ПЕРЕЦ,3,18.26.03,пожар в тц Зимняя вишня Кемерово. Дети выпрыгивают в окно. Слабонервным не смотреть. 18+,23,2018-03-25T17:13:34.000Z,9259,21,14,29,False
ToPUZ Tv,3,18.04.03,2018 ОГОХ БОЛИНГ КИЁМАТ ТЕЗЛАШМОКДА ОХИР ЗАМОН КЕЛМОКДА ДАЛИЛ ИСБОТДАР,1,2018-03-03T14:38:18.000Z,79342,3155,248,446,False
BadMMA,3,18.22.01,"UFC 220: ДО И ПОСЛЕ БОЯ (Миочич - Нганну, Кормье - Оздемир, Махачев - Тибау)",17,2018-01-21T12:35:46.000Z,65279,746,57,123,False
Денис Стяжкин,3,18.02.05,"1 мая в Петербурге: Telegram, задержания, дальнобойщики",22,2018-05-01T13:30:29.000Z,11555,389,39,211,False
Айдар,3,18.11.03,🔴 ВЫБИВАЕМ Маленькому БРАТИКУ ВТОРОЙ AWP DRAGON LORE!!! Отдаю НОЖ!,20,2018-03-10T13:28:00.000Z,85515,6512,915,28,False
Своим Ходом - Виталик и Лиза,3,18.28.05,Летим на Сейшелы. В шоке от цен на острове Маэ,19,2018-05-27T07:00:00.000Z,18852,2590,43,625,False
СФЕРА ПРАВИ,3,18.07.04,Говорите деревянная Русь? Значит имела высокие технологии!,29,2018-03-25T18:10:39.000Z,20501,0,0,141,False
Математикс,3,18.31.05,Разбор КИМа ЕГЭ 2018 по Математике из конверта Часть 1 из 2,27,2018-05-31T07:00:04.000Z,25704,759,18,132,False
Thomas Mraz,3,18.15.02,THOMAS MRAZ — LONO,10,2018-02-15T09:33:51.000Z,27904,5113,523,375,False
Google Россия,3,17.14.12,Google - Год в Поиске 2017 #годвпоиске,24,2017-12-13T08:08:58.000Z,239780,15814,1707,1064,False
Мари Говори,3,17.11.12,О встрече Собчак в Нижнем Новгороде,25,2017-12-10T18:17:29.000Z,33966,5147,235,835,False
ПВО. ТВ,3,18.18.01,ДЖОВАННИ САВИНО | МОСКВА | ЗДЕСЬ И ТАМ,22,2018-01-17T07:11:05.000Z,102465,2159,52,99,False
Fox Hockey,3,18.12.02,Топ-10 лучших вратарских драк в истории НХЛ,17,2018-02-12T02:00:00.000Z,3367,336,2,38,False
Константин Долгов,3,17.24.11,Видео прибытия Плотницкого в Москву,23,2017-11-23T19:00:20.000Z,203332,362,361,533,False
КРАСНЫЙ АВАНГАРД,3,18.19.02,Грудинин Киселев Вести Недели 18.02.2018,22,2018-02-18T20:50:35.000Z,5048,784,16,475,False
Саша Лимп - Хочу в Black Star,3,17.17.12,Пранк над ChebuRussiaTV - Бургер Макса +100500,22,2017-12-16T13:44:36.000Z,48002,3036,91,195,False
LaGGeR,3,18.18.01,5 ЛАЙФХАКОВ ДЛЯ ВЫЖИВАНИЯ В MINECRAFT,20,2018-01-17T14:00:05.000Z,29656,8666,173,950,False
"Герасим Шерп Охота, Рыбалка, Приключения!",3,18.09.02,Одни? Ночью? На льду?  Неее.. Мы с вами не поедем.. Страшно!,24,2018-02-09T06:00:00.000Z,1938,233,10,43,False
Layla time,3,18.15.02,"Ты расскажи Черное море,Карадениз.4 серия",1,2018-02-15T06:54:46.000Z,10811,166,15,41,False
Канал NEWS,3,18.10.03,Собчак и Жириновский снова вступили в перепалку на дебатах,29,2018-03-07T14:28:11.000Z,21952,151,25,189,False
Tom Hunger,3,17.22.11,Госпожа Фазилет и ее дочери 24 серия 1 фрагмент РУССКАЯ ОЗВУЧКА,22,2017-11-19T15:38:14.000Z,7943,17,0,1,False
Barvina Vlog,3,18.12.03,"Сквиши МОЯ КОЛЛЕКЦИЯ - единорог, котик, милые утята",24,2018-03-12T03:32:30.000Z,8624,1138,72,639,False
marshmello,3,18.17.01,SPECIAL ANNOUNCEMENT FROM MARSHMELLO,10,2018-01-16T18:00:05.000Z,634161,67205,1632,14093,False
Fazzer,3,18.19.03,Real Madrid vs Girona 6-3 All Goals & Highlights (FH) 18/03/2018 HD,17,2018-03-18T20:32:58.000Z,636373,0,0,261,False
UZ life,3,18.17.03,ТУРМУШ КУРГАНИГА 4 ЙИЛ БУЛГАН КЕЛИНЧАК ХАЛИ БОКИРА(КИЗ БОЛА)ЭКАН,22,2018-03-16T11:53:28.000Z,172265,676,442,573,False
SimShow,3,18.03.01,Квартальный тизер The Sims 4 (Зима-Весна 2018),20,2018-01-02T19:30:04.000Z,7134,566,6,89,False
Илья Тараскин,3,18.28.03,Зимняя вишня изнутри после пожара 26.03.2018 гибель детей,22,2018-03-26T19:31:41.000Z,185958,825,192,300,False
TheTalkingBro,3,18.27.02,Объяснение Концовки 9 Серии 8 Сезона Ходячих Мертвецов / TheTalkingBro,1,2018-02-26T20:31:52.000Z,5017,556,9,89,False
CHINASKI ON AIR,3,18.29.04,BOOKER - DK DISS CHALLENGE,20,2018-04-28T16:58:12.000Z,238963,15505,5885,1728,False
Смешные Кошки - МатроскинТВ,3,17.22.11,Смешные кошки приколы про кошек и котов 2017 #89 (Старенькое смешное видео МатроскинТВ ТОП приколы),23,2017-11-21T23:20:59.000Z,4252,100,12,10,False
Андрей Трофимов,3,18.10.02,Ветерана не пустили к губеру выставив на мороз!,25,2018-02-10T04:41:57.000Z,1692,184,4,44,False
WeiT Media,3,17.19.11,«Стена». 5 выпуск,24,2017-11-18T17:00:05.000Z,31672,302,35,95,False
SHAHIN ISMAYILOV,3,18.09.03,"Вот это песня 2018 ! Моя любимая жена, Ты половиночка моя (Александр Казак)",22,2018-03-08T16:12:46.000Z,36888,1201,34,61,False
Arthur Sahakyan,3,18.15.02,"Լոս Անջելեսի Հայությունը՝ Տարոն Մարգարյանի, Գոռ Վարդանյանի եւ Մյուսների Մասին",25,2018-02-15T10:25:44.000Z,3127,396,16,131,False
Юмор ФЕСТ,3,18.27.05,BEST CUBE #50,23,2018-05-26T16:30:00.000Z,91698,929,167,56,False
Mir Tv,3,18.05.03,Tahir Əkbəri qəbirdən çıxarıb yenidən dəfn etdilər - ŞOK FOTOLAR,22,2018-03-05T08:38:11.000Z,4627,74,12,20,False
Грустный Пакет,3,18.30.04,НОВАЯ НАГРАДА ЗА ЛУФФИ / ЛУФФИ СТАЛ ЙОНКО! / ПОЯВЛЕНИЕ ШАНКСА | One Piece 903 обзор / Ван Пис,24,2018-04-30T07:59:58.000Z,31632,5439,71,362,False
Citizen Cat Pranks,3,17.17.11,Пранк с бесконечным шампунем!,23,2017-11-17T04:07:23.000Z,25014,1806,175,176,False
BlinkovFPV - Волгоградсверху - RAWdrone,3,17.21.12,Волгоградсверху - полуОткрытие моста через Ахтубу | 20 декабря 2017,17,2017-12-20T15:29:33.000Z,6346,117,7,139,False
Наши забавные друзья,3,18.22.03,"ОН БЫЛ ПОХОЖ НА КРЫСУ, А СТАЛ КРАСАВЦЕМ",15,2018-03-21T15:00:01.000Z,26095,846,38,27,False
PoleznyiBes,3,18.01.02,"UFC 3 - Заценка: Новые Механики, Новые Бойцы",20,2018-01-31T08:35:40.000Z,36608,2721,132,278,False
HCT,3,18.02.04,"Надежда на справедливость (2018), новый русский сериал, мелодрама новинка, премьера 2018",22,2018-04-01T13:47:39.000Z,51947,198,59,26,False
pravdavideo,3,17.30.12,Павел Глоба о 2018 годе и пророчествах Ванги,29,2017-12-29T13:28:16.000Z,18402,138,31,16,False
Брандт Live,3,18.30.01,СВАРИЛ КАКАО ИЗ СССР 1991 ГОДА / СОВЕТСКОЕ КАКАО ИЗ БУНКЕРА,24,2018-01-29T11:06:39.000Z,20960,1639,55,119,False
Александр Обливин,3,18.31.01,Бензопилы Stihl 361 и Stihl 250 После работы в лесу Отзыв лесоруба...,2,2018-01-30T07:04:05.000Z,6973,359,17,182,False
Александр Левченко,3,18.27.03,"Пожар в ТРЦ Зимняя вишня, Кемерово, 25. 03. 2018 г. Данные на 6:00.",25,2018-03-26T05:17:35.000Z,1488948,9040,2439,5199,False
MARINA IVANOVA VLOG,3,17.22.11,VLOG▶️ Я разнервничалась▶️Плевать хотела:),22,2017-11-21T17:49:44.000Z,15166,812,81,447,False
Velvet Music,3,17.30.11,Burito - Штрихи,10,2017-11-29T10:53:36.000Z,150287,4838,315,139,False
Serebrennikov Life,3,18.02.01,Забираем Майбах . Запускаем каршеринг Карусель. Тестдрайв гранты от Алана Енилеева .,22,2018-01-01T14:00:03.000Z,354297,2431,1579,368,False
Andrey Glazunov,3,17.05.12,"КОРОЧЕ ГОВОРЯ, типы лучших друзей",23,2017-12-04T14:52:35.000Z,55910,3371,72,167,False
Bumble Beezy,3,18.24.02,С4 х Bumble Beezy х Bess х VeroBeatz - Ключи от улиц [prod. by RedLightMuzik],10,2018-02-23T12:24:18.000Z,53920,1974,408,251,False
Жизнь Замечательных Людей,3,17.26.11,Тело Дмитрия Хворостовского доставят в Москву,24,2017-11-25T15:04:17.000Z,13304,81,2,25,False
N. Masteroff,3,18.24.03,N.MASTEROFF x DK x MORGENSHTERN - МИЛЛИОН (КЛИП),24,2018-03-23T09:49:32.000Z,891097,150698,12013,15180,False
G.Ange1os TV World of tanks,3,18.19.03,ВЕЧНАЯ ПАМЯТЬ ...,20,2018-03-18T16:39:30.000Z,396497,43201,351,6021,False
PFC Krylia Sovetov Samara,3,17.19.11,Видеообзор матча Волгарь - Крылья Советов.ФНЛ 2017/18,17,2017-11-18T15:33:24.000Z,3405,46,4,8,False
Елизавета Мадрид,3,18.13.03,НАШИ РОФЛЯНОЧНЫЕ ИСТОРИИ,22,2018-03-12T10:06:12.000Z,140622,15600,1080,582,False
UZ NEWS,3,18.03.01,НОВЫЙ ЗАКОН ПУТИНА ПО МИГРАНТАМ!,25,2018-01-02T18:24:18.000Z,20870,80,76,48,False
Россия-Украина,3,18.08.03,На западе эта новость вызвала переполох. Нас никто не слушал. Послушайте сейчас.,25,2018-03-07T15:17:30.000Z,13962,422,23,79,False
Алиса Че,3,18.27.05,Золотой лизун и серебряный лизун от NATA LIME / Проверка рецептов,24,2018-05-26T06:30:00.000Z,51794,2690,136,2979,False
Дмитрий Крымский,3,18.11.03,WARFACE.ОНИ ВЕРНУЛИСЬ - КАК ТЕПЕРЬ ИГРАТЬ? #ЧИТЕРЫ2018,20,2018-03-11T00:27:02.000Z,78570,8161,238,1344,False
Dmitry Nem,3,18.23.02,Драка Норкина и Суворова. Место встречи 22.02.2018,22,2018-02-22T12:32:56.000Z,686089,3194,4522,3836,False
Google,3,17.14.12,Google - Year In Search 2017,28,2017-12-13T07:59:27.000Z,618753,38231,2290,4633,False
Just Life - канал про животных,3,18.18.03,"🔴У них волосы стали дыбом, когда они узнали, что этой собачке пришлось пережить",15,2018-03-17T09:06:58.000Z,20370,662,7,42,False
Людмила Светлова,3,18.19.01,Чудо-Люда «ПОДРУЖКИ-ДУРНУШКИ»,10,2018-01-18T16:03:11.000Z,4377,223,4,12,False
T-killah,3,17.29.11,"T-killah - Папа (Москва, ГЛАВclub, Live) 12.10.17",10,2017-11-28T08:59:12.000Z,37737,2483,146,114,False
Выдумщица Скиффи,3,18.02.01,Time Lapse - meme (feat. Sonya Lo),22,2018-01-01T19:26:36.000Z,4061,592,47,199,False
Татьяна Животворящая,3,18.20.04,ОНЛАЙН ГАДАНИЕ Что он/она чувствует к вам? (Оракул тайны любви),22,2018-04-19T21:55:53.000Z,2824,272,17,44,False
AZIMUTZVUK,3,17.15.11,"GUSLI (Guf & Slim) - Фокусы (Премьера, 2017)",10,2017-11-14T17:52:46.000Z,129474,5204,302,373,False
ZIJOY НОВОСТИ,3,18.06.01,БОЙКОТ НА ВЫБОРАХ или ПАВЕЛ ГРУДИНИН. Может НАВАЛЬНЫЙ устал?,25,2018-01-05T10:27:06.000Z,9049,463,55,262,False
HARDCORE MMA,3,18.05.02,ОБЗОР СЕГОДНЯШНЕГО МЯСА НА UFC! ВАЛЕНТИНА ШЕВЧЕНКО РАЗНОСИТ! ЛИОТО МАЧИДА ВЯЛО ВЕРНУЛСЯ,17,2018-02-04T18:02:10.000Z,72525,1269,51,177,False
Story booth rus,3,18.19.03,Моя учительница солгала обо мне|Story booth на русском|Русская озвучка,22,2018-03-18T15:11:47.000Z,27692,1221,115,140,False
Документальное TV,3,17.20.11,Сенсационная новость.На Марсе найден ТАИНСТВЕННЫЙ предмет искусственного происхождения,29,2017-11-19T19:50:29.000Z,9809,43,15,2,False
Радио ENERGY,3,17.27.12,Элджей & Feduk - Розовое вино. LIVE на Радио ENERGY,24,2017-12-26T13:01:05.000Z,248174,8250,897,1411,False
Я.Н.,3,17.20.11,"Таксист быдло-обочечник пошёл на таран, ДТП, ДПС, это он зачем так сделал.?",29,2017-11-19T18:03:39.000Z,56199,2903,344,1002,False
Start Cube,3,18.05.02,BEST CUBE # 220 | ЛУЧШИЕ ПРИКОЛЫ 2018 ФЕВРАЛЬ,23,2018-02-04T13:11:44.000Z,192000,3187,1019,396,False
Hanna,3,18.24.01,"Ханна - Не вернусь (Премьера клипа, 2018)",10,2018-01-23T08:29:44.000Z,534056,12572,2605,1291,False
Серж 13-й,3,18.11.03,"Про усыновление негритят, Алексей Серебряков и закон Димы Яковлева",22,2018-03-10T17:37:55.000Z,5461,416,64,284,False
Плюшевая Ксюша,3,18.04.02,"10 лайфхаков ТОЛЬКО ДЛЯ ДЕВЧОНОК, которые изменят жизнь",26,2018-02-03T16:21:28.000Z,48286,5019,248,2092,False
fir6t,3,17.19.11,Пугачева Алла Галкин Максим и дети Венчание Instagram Live,22,2017-11-18T07:37:50.000Z,21408,182,29,68,False
Бомбилка WOT,3,18.15.02,РАНДОМ СЛОМАЛСЯ! ВЫДАЮТ ГОЛДУ ВСЕМ НА ХАЛЯВУ В ЧЕСТЬ 23 ФЕВРАЛЯ!,20,2018-02-15T15:33:48.000Z,11850,1517,129,26,False
MAN HD,3,18.25.01,"ПРЕМЬЕРА 2018 КИНУЛА ПАЛКУ ЗРИТЕЛЯМ [ ТУХЛАЯ МАЛИНА ] Русские детективы 2018 новинки, фильмы 2018 HD",22,2018-01-24T16:04:56.000Z,29684,58,27,11,False
Kartinka Tv,3,18.09.02,Энг киммат рус автомобиллари | Eng qimmat rus avtolari | Bunga ishonish qiyin,1,2018-02-09T04:26:04.000Z,989,60,1,2,False
Vlad Sorokin,3,18.18.01,Песец и мойва,22,2018-01-16T18:00:17.000Z,155024,7710,140,532,False
Erofei Arena,3,18.02.02,BANDY WORLD CHAMPIONSHIP 2018. NORWAY - KAZAKHSTAN,17,2018-02-02T02:12:32.000Z,3114,27,1,4,False
Skyeng: онлайн-школа английского языка,3,18.06.03,"Оскар 2018. Шутки, скандалы и речь победителей на английском || Skyeng",27,2018-03-06T04:00:00.000Z,9130,892,21,45,False
AUTO PLUS VIDEO,3,17.26.11,Как завести грузовик если не работает стартер или сел аккумулятор,2,2017-11-25T09:04:27.000Z,9610,52,12,15,False
Elena Sheidlin,3,17.23.11,Тайна моих фотографий 7,26,2017-11-22T11:33:26.000Z,559648,67218,545,2381,False
Heghineh Cooking Show in Armenian,3,18.09.02,Թակած Կոլոլակ - Tacats Kololak in a Pan - Heghineh Cooking Show in Armenian,24,2018-02-09T05:43:09.000Z,2125,299,5,44,False
Всё как у зверей,3,17.22.12,Мат в большом городе // Всё как у зверей #80,15,2017-12-21T09:11:17.000Z,30333,3565,63,348,False
Дневник Карины СТРАШИЛКИ,3,18.30.04,СТРАШНАЯ ПЕРЕПИСКА С БАКУ,22,2018-04-29T18:09:29.000Z,11007,926,86,446,False
Тимка Сурикат,3,18.10.03,Сурикат Тимка кушает Картошку 😝,15,2018-03-09T17:13:25.000Z,18705,2961,40,388,False
Голос Приколы,3,18.15.04,"Голос Дети  5 сезон, 10 выпуск",23,2018-04-14T05:18:12.000Z,47735,0,0,149,False
Телеканал Интер (Inter TV channel),3,17.11.12,Василий Ломаченко vs. Гильермо Ригондо. Весь бой - Интер,29,2017-12-10T06:52:46.000Z,754329,6369,583,2324,False
Azattyq TV - Азаттық - Азаттык,3,17.24.12,Борис Джонсон пошутил над Сергеем Лавровым,25,2017-12-23T05:35:15.000Z,7992,163,2,35,False
TheWeekndVEVO,3,18.02.03,"The Weeknd, Kendrick Lamar - Pray For Me (Lyric Video)",10,2018-03-01T20:00:53.000Z,918806,94541,993,5207,False
Mnet K-POP,3,17.02.12,[2017 MAMA in Hong Kong] BTS_INTRO Perf. + Not Today,24,2017-12-01T14:51:39.000Z,2289723,199785,4451,10481,False
В гостях у Натали,3,18.15.03,Госпожа Фазилет и ее дочери 39 серия 2 анонс,1,2018-03-14T15:16:31.000Z,20956,129,11,15,False
ChildishGambinoVEVO,3,18.06.05,Childish Gambino - This Is America (Official Video),10,2018-05-06T04:00:07.000Z,546527,109216,1659,13800,False
Закон и Порядок ПРЯМОЙ-ЭФИР,3,18.08.01,"ТЕРРОР, ВЫШКИ, ТЕХНОГИПНОЗ,  ЗОМБИ ПРОСЫПАЮТСЯ!!! ВОЛОДЯ СЕРГЕЙ СВЕТЛАНА ИГОРЬ",29,2018-01-08T00:29:50.000Z,3572,250,13,24,False
JesusAVGN Twitch,3,18.15.02,SCP CONTAINMENT BREACH #6,20,2018-02-15T09:06:06.000Z,1894,168,6,0,True
Говорящие Головы,3,17.27.12,"Schokk о Децле, блогерах и Versus Battle",22,2017-12-26T07:09:15.000Z,75225,2860,215,247,False
Лапин Щоуз,3,17.11.12,КИРИЛЛ ТЕРЕШИН И АМПУТАЦИЯ| РУКИ БАЗУКИ ИЛИ ТЯПКИ ЛАПКИ|Реакция Специальный выпуск: Хайп любой ценой,22,2017-12-10T13:33:11.000Z,120592,1668,4255,308,False
TJK CLAP,3,18.01.04,пустой школа все дети умерли школа опять тц кемерово,22,2018-03-31T10:53:33.000Z,117993,709,107,191,False
Дом 2 - лучшие новости от Дианы,3,17.28.11,ДОМ 2 НОВОСТИ Эфир 3 декабря 2017,22,2017-11-27T16:32:35.000Z,4537,13,6,3,False
MONATIK Official,3,18.26.01,"MONATIK - «То, от чего без ума» (official teaser, 2018)",10,2018-01-25T07:57:33.000Z,55766,2930,155,558,False
Кирилл Огорелков,3,17.26.11,VLOG/Диана Мелисон/Мажоры догонялись/ Лишают меня девственности/ Жак Энтони,22,2017-11-25T15:30:52.000Z,77532,4724,350,459,False
Вероника Поливкина,3,18.24.04,Как приготовить компост,26,2018-04-23T11:35:10.000Z,4422,392,6,27,False
EL Мус Tv,3,18.19.01,НОВЫЕ НОВОСТИ ПРО СВАДЬБУ В ИНГУШЕТИИ ТЕПЕРЬ ВСЕ ПОНЯТНО!!!,22,2018-01-18T11:03:18.000Z,12650,97,19,40,False
В саду с Зинаидой Осиповой,3,18.22.04,Высадила первую партию томатов 21 апреля.  Чем заправила лунки.,23,2018-04-21T16:46:20.000Z,7332,281,7,54,False
ATV maqazin 10larla,3,18.14.05,"Aygünü uzaqlaşdıran Rəqsanə Baxıb ağladım Damla, Xatun və Cin Qalmaqalı",24,2018-05-13T11:17:55.000Z,23043,223,79,167,False
Сергей Яцкоборовский,3,18.26.04,БУТЕРБРОДЫ ПОД ФИЛЬМ ЗА 50 РУБЛЕЙ (24 ГРН),22,2018-04-25T15:00:00.000Z,47060,4141,115,743,False
Chi_Va_03 Чимит и Валера,3,18.28.04,Кофе Bodream,22,2018-04-28T02:38:12.000Z,758,28,1,1,False
Borsh Story,3,18.24.05,ШАШКИ НА GOLF R ШАШЛЫКИ И DRIFT,2,2018-05-23T11:28:01.000Z,43077,4676,149,454,False
Avşar Film,3,17.25.12,Fazilet Hanım ve Kızları 29. Bölüm Fragman,1,2017-12-24T15:06:34.000Z,807665,6889,173,1002,False
поздравления та привітання,3,18.01.04,"Поздравление с Вербным Воскресеньем, с Вербным Воскресеньем, поздравления, Вербное воскресенье",24,2018-03-25T02:00:01.000Z,23089,134,11,2,False
King Dm,3,17.11.12,🎄ТОП 35 ЛУЧШИХ ПЕСЕН 2017 ЗА ДЕКАБРЬ  +(ССЫЛКА НА СКАЧИВАНИЕ) 🎅,10,2017-12-10T17:30:02.000Z,168704,16394,789,2461,False
News Letters,3,18.27.03,кадры из сгоревшего торгового центра зимняя вишня (Кемерово),25,2018-03-26T11:41:50.000Z,284877,654,103,264,False
CelebUaTV,3,18.11.05,ЕВРОВИДЕНИЕ 2018 - как проголосовали жюри во втором полуфинале. ПРОЙДЁТ ЛИ УКРАИНА МОЛДОВА РОССИЯ?,24,2018-05-10T10:05:27.000Z,11415,38,10,11,False
FIFATV,3,17.17.12,Real Madrid CF v Gremio FBPA - FIFA CLUB WORLD CUP UAE 2017,17,2017-12-16T20:32:13.000Z,295807,4037,220,828,False
SM Sharipov,3,18.30.05,Шармандагии Блогери  ТОЧИК || SADOI UMED Кист? Ки бо мардум бози мекунад?,22,2018-05-29T15:26:22.000Z,14891,1234,73,1074,False
AMBIENT,3,18.26.02,МЕНТ ПРОБИЛ ДНО,2,2018-02-26T04:33:08.000Z,1074,118,11,38,False
Boyvachcha Tv,3,18.01.04,ХАСАНБОЙ ДОСМАТОВНИНГ ТУЛИК НИКОХ ТУЙИ,23,2018-03-31T09:12:06.000Z,101141,665,287,216,False
Вместе МИР,3,18.27.03,«Дело Скрипаля». Куда на самом деле ведет след «Новичка»?,25,2018-03-25T16:39:41.000Z,7190,38,5,11,False
ivanesis26,3,18.18.04,РЫБАКИ ПОЙМАЛИ РУСАЛКУ МОНСТРА РЫБАКИ НЕ ЗНАЮТ ЧТО С НЕЙ ДЕЛАТЬ!РЫБАЛКА 2018,23,2018-04-17T13:19:56.000Z,8244,39,7,14,False
bilanofficial,3,17.19.11,Команда Билана. Поединки,10,2017-11-18T12:09:03.000Z,10137,601,10,58,False
ShadowPriestok,3,18.24.01,ПЛАСТИЛИНОВЫЙ НУБ МАЙНКРАФТЕР РОДИЛ РЕБЁНКА!,20,2018-01-23T12:51:14.000Z,120780,11178,237,1589,False
Barnaul 22,3,17.16.11,Ушел от удара 12.11.2017,22,2017-11-15T16:40:55.000Z,3494,2,1,0,False
Блог Мусульманки,3,17.25.11,"Q&A | БИБЛИЯ, ПРЕДАТЕЛЬСТВО, БЕРЕМЕННОСТЬ",22,2017-11-24T09:56:21.000Z,18588,1492,54,359,False
Жёсткий кликбейт,3,18.19.01,ГРУДИНИН НАЗВАЛ СЕБЯ ОЛИГАРХОМ!,22,2018-01-18T06:00:02.000Z,185189,4613,5054,886,False
Дружба - это чудо!,3,18.17.05,Сборник мультиков Мой Маленький Пони. Странные гости,1,2018-05-16T13:03:28.000Z,31973,468,29,92,False
slavikmust [СлавикМаст],3,18.13.03,ВЗЯЛ ТОП-1! ЛЕГО FORTNITE КОРОЛЕВСКАЯ БИТВА В BRICK RIGS! ЛЕГО ФОРТНАЙТ В БРИК РИГС!,20,2018-03-12T10:59:38.000Z,6807,299,9,42,False
Mariya Bezhko,3,17.19.12,ТОП - 10 ПОДАРКОВ на НОВЫЙ ГОД,22,2017-12-18T17:00:01.000Z,7823,484,28,69,False
urbanturizm,3,17.11.12,Сталк с МШ. Станция-призрак Киевского метро – Львовская Брама / Abandoned station of Kiev metro,28,2017-12-10T15:03:40.000Z,55520,5284,129,427,False
Victoria Isaeva,3,18.25.01,Почему мужчина не тратит на меня деньги?,1,2018-01-24T15:00:01.000Z,7509,618,32,109,False
Parallelno,3,18.22.04,УРАГАН В МОСКВЕ | 21.04.2018 | ПОСЛЕДСТВИЯ |,22,2018-04-21T20:55:50.000Z,9748,63,84,65,False
Yeni Melumatlar,3,18.16.02,Ogey ana 78-ci bölüm ( ANONS ),22,2018-02-15T19:07:17.000Z,6494,56,2,9,False
Военное Кино !,3,17.18.11,Военные Фильмы про СЕКРЕТНЫЙ ОТРЯД НКГБ 1941-1945 ! Военное Кино HD Video !,1,2017-11-16T13:00:04.000Z,139166,0,0,29,False
FЯchannel,3,17.11.12,ТОП10 по-настоящему СТАДИОННЫХ песен!,10,2017-12-10T11:47:06.000Z,31612,4245,78,501,False
АНАНАСТЕНЬКА,3,18.09.01,Я ТЕБЯ НЕ ЛЮБЛЮ ПРАНК / ВСЕ ПОШЛО НЕ ПО ПЛАНУ ПАРЕНЬ БРОСАЕТСЯ В ОКНО / РАЗБИЛА ПАРНЮ СЕРДЦЕ,22,2018-01-08T14:31:23.000Z,92645,7604,360,3462,False
Гипотезы.Факты. Необъяснимое.Аномальное.,3,17.17.12,Из океана прислали ЧЕРНУЮ МЕТКУ человечеству.ЛЕВИАФАН.Другая цивилизация.Тайны Чапман,22,2017-12-16T09:53:57.000Z,18554,47,29,26,False
БРЫЩ,3,17.15.11,"Группы, которые снесли мне башню",22,2017-11-14T14:59:30.000Z,15054,1584,107,459,False
Радио Маршо,3,18.17.05,Венехь йоI ер толлуш лаьцначу кIентан дас дуьйцу,25,2018-05-15T12:27:14.000Z,96541,405,140,1888,False
Юра Потайчук,3,18.01.04,Поздравляю с Вербным Воскресеньем! Очень красивые поздравления. Музыкальная открытка.,2,2018-03-15T14:50:36.000Z,32727,352,30,3,False
ВСЁ БУДЕТ ХОРОШО!,3,18.26.03,Пожар в Кемерово Зимняя Вишня,22,2018-03-25T13:02:59.000Z,26977,47,36,24,False
Süreç Film,3,18.02.04,Cennet'in Gözyaşları 27.Bölüm Fragmanı,1,2018-04-01T21:18:11.000Z,30223,255,8,31,False
Sputnik на русском,3,17.24.11,"Владимир Путин случайно уронил стул, на котором сидел турецкий лидер Реджеп Тайип Эрдоган",25,2017-11-23T15:40:41.000Z,2561,12,6,13,False
Action Tube,3,18.04.02,В Сирии сбили российский Су-25/Russian Su-25 shot down in Syria,25,2018-02-03T17:51:41.000Z,69060,324,170,1035,False
ОНО ТЕБЕ НАДО,3,18.27.03,Немагия с место пожара в Кемеровской Зимней вишне. Михаил Печерский в перископе,25,2018-03-26T11:14:20.000Z,155823,688,584,435,False
STEP TV,3,18.11.02,СРОЧНО!!! ЗЮГАНОВ ДАЛ РЕЧЬ! 10.02.2018!!! ВОЛОСЫ ДЫБОМ! ВСЁ ЧЁТКО И ТОЧНО! ЗА ГРУДИНИНА!,29,2018-02-10T06:23:25.000Z,25677,1882,45,525,False
Google Spotlight Stories,3,18.03.05,360 Google Doodles/Spotlight Stories: Back to the Moon,1,2018-05-02T13:42:03.000Z,820475,30390,1062,1734,False
ДЯДЯ СЕРЕЖА,3,17.20.12,120 Суши/Роллов ЗА РАЗ. CheatMeal Challenge 2. 120 Sushi.,22,2017-12-19T05:47:07.000Z,58874,3297,252,547,False
BEST VIDEO,3,18.26.03,Эвакуация людей из ТЦ Зимняя Вишня г.Кемерово 25.03.2018,22,2018-03-25T18:46:33.000Z,158645,1419,194,1347,False
АНЖЕЛИКА ВОРОНЦОВА,3,18.09.03,Новяк 2018! ЛЮБОВЬ КАК ШОКОЛАД ВКУСНЕЙШИЙ Русские мелодрамы 2018 новинки HD,24,2018-03-08T13:01:04.000Z,21113,119,33,21,False
Марал радиосу,3,18.31.01,Ош базарынан чыккан өрттүн чоо-жайы,25,2018-01-30T07:35:37.000Z,21235,41,10,17,False
Moto Sancho,3,18.11.03,Удобный руль для мотоцикла Урал.,22,2018-03-10T21:38:02.000Z,3796,821,2,338,False
ЧТО БУДЕТ РАЗЫГРЫВАТЬСЯ? ПРОВЕРИТЬ БИЛЕТ ЛОТО,3,18.18.02,ЖИЛИЩНАЯ ЛОТЕРЕЯ 273 ТИРАЖ 18.02.18,24,2018-01-30T15:25:21.000Z,10558,30,18,6,False
США.Дикий Запад.Колорадо,3,18.13.03,Нас 20000 !!!!! Заканчиваю объект.,22,2018-03-12T04:41:43.000Z,8807,1544,8,294,False
Marvel/DC: Geek Movies,3,17.02.12,Война Бесконечности и Мстители 4 - конец киновселенной?,1,2017-12-01T14:09:09.000Z,233835,14493,464,7184,False
BEST of MMA TMZ,3,18.26.01,СОННЕН О БОЕ ХАБИБ - ТОНИ ФЕРГЮСОН НА UFC 223,17,2018-01-25T16:04:15.000Z,17430,234,8,21,False
Ложь путинского режима,3,17.16.12,Ложь Путина на пресс-конференции 2017,25,2017-12-15T12:45:18.000Z,179132,9663,3285,1963,False
Asinastra,3,18.03.03,Ibis paint | Плюсы и минусы,1,2018-03-02T13:35:04.000Z,97089,11445,54,1257,False
Informator Дом2,3,18.30.01,"Ольга Бузова призналась, что наконец то влюбилась, Дом2 новости и слухи",24,2018-01-29T15:00:59.000Z,19625,95,35,12,False
ЛДПР-ТВ,3,18.28.03,Жириновский о трагедии в Кемерове: во всем виновата администрация города!,25,2018-03-27T08:42:13.000Z,768654,9019,2242,3273,False
Игорь Войтенко,3,18.30.01,Войтенко ПРОТИВ Соколовой Маши (ЗАРУБА),17,2018-01-29T12:28:49.000Z,243816,22386,655,3379,False
НУДЯТИНКА,3,17.15.12,Цимбалюк На Конференции Путина 14.12.2017,22,2017-12-14T11:37:29.000Z,110575,516,160,506,False
Жизнь Обычных Ставочников Cleanbet,3,17.24.11,Локомотив - Копенгаген / 2:1 / Лига Европы / Обзор матча,22,2017-11-23T20:03:23.000Z,25602,524,52,0,False
PFEFO4KA,3,18.24.03,ФИКС ПРАЙС // ПАСХА // МОРЕ НАКЛЕЕК // КРАСКИ КИСТИ И ДРУГОЕ,22,2018-03-23T11:00:01.000Z,15852,750,26,160,False
Zoobe Зайка Music,3,17.25.11,Zoobe Зайка Поздравление для мамы в день матери!,10,2017-11-25T05:19:15.000Z,2380,312,14,14,False
OneNews24,3,18.02.05,БЛЕСТЯЩАЯ РЕЧЬ ПРЕЕМНИКА ПУТИНА 01.05.2018 Юрий БОЛДЫРЕВ,29,2018-05-01T03:00:00.000Z,55432,1172,112,407,False
"Афина-TV, Кошачий Рай",3,17.19.11,РАСШИРЕНИЕ ПИТОМНИКА Афина: новое помещение за 3000 долларов!,15,2017-11-18T14:46:50.000Z,7375,983,9,250,False
ЛАПИН,3,18.22.05,15 НЕУДАЧНЫХ ПОНТОВ,24,2018-05-21T11:30:01.000Z,90598,5877,253,3818,False
NataLime Life,3,18.07.02,DIY 3D РУЧКА  Рисуем 3Д Ручкой + КОНКУРС Ната Лайм Лайф,22,2018-02-06T14:09:15.000Z,76417,5438,189,1569,False
ДОМ КУКОЛ,2,17.30.11,"Часть 2 Топ 5 кукол родителей Эвер афтер хай Пуллип Дисней Лол сюрприз ,Блайз, Барби Монстер хай",26,2017-11-29T13:21:05.000Z,16348,432,20,248,False
Polina Gymnastika,2,18.21.03,Я допустила грубые ошибки // Мое первое выступление с булавами и лентой,22,2018-03-21T05:24:32.000Z,3087,323,20,107,False
Виктор Кирсанов,2,18.02.03,Реакция США и западных СМИ на Послание-2018 Президента РФ.,25,2018-03-01T17:05:33.000Z,41349,283,118,327,False
Dunyo Mo'jizalari,2,18.21.01,Улгили айби учун ХАЙДОВЧИНИ ОНАСИ УЗБЕК ХАЛКИДАН КЕЧИРИМ СУРАДИ,22,2018-01-20T17:17:54.000Z,33051,173,35,113,False
starhitvideo,2,18.20.01,Карина Мишулина после суда,25,2018-01-19T12:48:02.000Z,40330,21,129,189,False
Лео,2,18.18.02,СТРИМ ПО МАЙН МАЙНКРАФТ МАЙНУ МИНИ ИГРЫ MINECRAFT МИНИКРАФТ VIMEWORLD ВАЙМ СЕРВЕР ВАЙМВОРЛД С ВЕБКА,20,2018-02-18T00:37:11.000Z,10242,598,44,6,False
Davir Trucking,2,18.29.01,ДальнобойUSA/Купил второй прицеп...,2,2018-01-29T05:44:06.000Z,8254,1152,6,151,False
СЕКРЕТЫ БОЛЬШОГО ТЕННИСА,2,17.23.12,Песня о теннисе,10,2017-12-22T10:47:11.000Z,103002,2618,830,128,False
Allu Arjun,2,18.02.01,"Naa Peru Surya Naa illu India First Impact || Allu Arjun, Anu Emmanuel, Vakkantham Vamsi",1,2018-01-01T11:29:18.000Z,2398555,124008,24910,10637,False
Деревенский парень,2,18.23.02,Пакеты нужного железа! Первая 1000 на жигулях и пока нет время на видео,22,2018-02-22T19:31:21.000Z,3810,596,7,158,False
marconepolo,2,18.22.01,Питерские пенсионерки в поддержку курсантов летного училища,23,2018-01-21T14:11:11.000Z,16359,646,32,136,False
Вынос мозга,2,18.06.02,"Умираю, но не сдаюсь !! Роман Филиппов погибший летчик су-25   КОММЕНТАРИИ ИНОСТРАНЦЕВ",22,2018-02-05T18:32:18.000Z,15461,860,30,289,False
REDCHANNEL,2,18.22.03,Блондинка - о Макаревиче и злобных дебилах,22,2018-03-22T03:24:46.000Z,18709,3273,95,946,False
Dr Greg I JGeek,2,18.18.03,"ПОЧЕМУ ФИЛЬМЫ ОТ МАРВЕЛ СКОРО УМРУТ? | ВОЗМОЖНО, ПОСЛЕ ФИЛЬМА МСТИТЕЛИ: ВОЙНА БЕСКОНЕЧНОСТИ",20,2018-03-17T11:32:01.000Z,83582,5572,1114,1023,False
Dilya Nalune,2,18.24.02,первая любовь,22,2018-02-23T08:00:15.000Z,107350,24599,187,2286,False
МВД ЛНР,2,17.23.11,Пресс-конференция Министра внутренних дел ЛНР И.А.Корнет,22,2017-11-22T17:15:38.000Z,54410,194,231,219,False
Argamblogcom,2,18.13.05,ԱՄՆ-ում բոյկոտել են Հարութ Փամբուկչյանի ելույթը / ARGAMBLOG,22,2018-05-12T12:46:22.000Z,297517,1498,757,1009,False
ТВОИ НОВОСТИ,2,18.01.05,После этих слов стояла rробовая тишина! Жириновский выnалuл жесткачь! 27.04.2018,29,2018-04-27T05:00:00.000Z,9445,151,20,29,False
·Arstayl·,2,18.15.02,"HTC U11 Plus (пред обзор, короткое мнение) / Арстайл /",28,2018-02-15T08:35:59.000Z,3492,389,20,91,False
Freddy Paw,2,18.13.03,ПРИЗРАК ИЗ САМОЛЕТА  - LOST3 #1,20,2018-03-12T10:31:42.000Z,7553,902,39,202,False
Новая Кубань,2,18.30.01,Инцидент в Абинском районе,22,2018-01-29T07:54:40.000Z,107036,163,1263,1175,False
100ka sokolova,2,18.09.02,ПЕРЕКУП ГРЫЗ ТАЧКУ ЗУБАМИ ШОК#как работают перекупы,2,2018-02-09T05:07:39.000Z,883,84,6,21,False
Igor Bannikov,2,17.29.12,"Что-то здесь не так | Мешаю ANACONDAZ отличить от фейка Kizaru, Little Big, Serebro и еще 10 клипов",10,2017-12-28T13:00:02.000Z,23378,1317,23,74,False
KGZ FIGHT,2,18.06.03,Юрий Проценко в шутку нарвался  на Тилека Жээнбекова/ Дуэль взглядов,17,2018-03-05T13:23:03.000Z,19269,263,4,175,False
Coachella,2,18.14.04,Coachella 2018 LIVE Channel 1,10,2018-04-05T06:48:28.000Z,3598220,0,0,0,False
Авангард ТВ,2,18.01.02,"Максим Сушинский: Авангард для болельщиков - это икона, команду всегда хотят видеть в лидерах",17,2018-01-31T08:30:08.000Z,4785,113,3,11,False
Talking Tom and Friends,2,18.09.02,Tom and Angela - Stand By Me (NEW Music video from Talking Tom and Friends),24,2018-02-08T13:00:05.000Z,498907,6173,587,1354,False
Клевая рыбалка/Hot fishing,2,17.17.11,Рыбалка на Севере. Ловим ряпушку. Якутия Yakutia,22,2017-11-16T10:24:55.000Z,24200,1495,48,256,False
Телеканал МУЗЫКА КТРК,2,18.25.02,ONLINE ЖЫЛДЫЗЫ Анжелика Бекболиевадан эксклюзивдүү интервью,10,2018-02-24T13:09:54.000Z,43337,749,109,345,False
Dima RV Lomakin,2,18.01.01,Горит ёлка южно сахалинск 2018,22,2017-12-31T14:48:56.000Z,49084,275,10,86,False
Mega tv,2,18.29.04,BORIGA BARAKA 28.04.2018 SONI. DILSHOD SHEDRI BUGUN,22,2018-04-28T16:53:55.000Z,34133,498,36,93,False
JPOD Новости,2,18.17.02,Паника в кабине. Первые данные о переговорах пилотов упавшего Ан-148,25,2018-02-16T05:59:28.000Z,135555,0,0,806,False
КАйЛЫ Воскресший Эртугрул,2,17.28.11,Эртугрул 97  Анонс 2 на русском,22,2017-11-27T19:39:07.000Z,5551,50,0,8,False
Екатерина Комарова,2,18.26.03,Пожар в ТРК Зимняя вишня Кемерово 3,22,2018-03-25T15:07:00.000Z,75332,248,47,286,False
Mr Football,2,18.22.02,SHAKHTAR DONETSK VS AS ROMA 2 1 EXTENDED HIGHLIGHTS & GOALS 21/02/2018,17,2018-02-21T21:50:04.000Z,373110,1542,216,124,False
Fights without rules Лучшие Моменты и Бои!,2,17.05.12,САМЫЙ СЕРЬЕЗНЫЙ СОПЕРНИК ХАБИБА!!! Эдсон Барбоза.Edson Barbosa  Highlights.Knockout.  UFC .MMA.,17,2017-12-04T10:23:12.000Z,8282,359,12,32,False
Эрик Давидыч,2,17.08.12,Давидыч Закончился допрос главного свидетеля.,22,2017-12-07T18:28:44.000Z,18080,940,30,76,False
Приколы Чумовой канал,2,17.20.12,ЛУЧШИЕ ФЕЙЛЫ И ПРИКОЛЫ 2017 ДЕКАБРЬ | Чумовая Подборка #113,23,2017-12-19T13:07:30.000Z,83616,2142,207,194,False
Yung Lean,2,17.22.11,Yung Lean - Metallic Intuition,10,2017-11-21T13:58:22.000Z,145334,12396,167,1103,False
Владимир Порываев,2,18.01.03,Ответы Владимира Порываева на ваши вопросы № 21,19,2018-03-01T04:38:19.000Z,2044,222,6,61,False
Видео про,2,18.26.02,Хоккеисты сборной России поют гимн на награждении. Финал Олимпиады 2018. Корея. 25 02 2018,29,2018-02-25T10:44:34.000Z,116895,1688,62,300,False
Alpha Mods,2,18.26.05,💪🏼 Видео 3 в 1: Моддинг - Доработка - Самоделка [3D Печать],26,2018-05-25T16:48:12.000Z,71823,3916,88,240,False
Krasnova Natasha,2,17.17.11,Новый клип Black Russian Mama,22,2017-11-16T13:22:52.000Z,11717,484,17,39,False
CSGO TOURNAMETS - RUS,2,18.27.03,Узнаем всю правду с рации мчс. ОНЛАЙН РАЦИЯ МЧС КЕМЕРОВО ПОЖАР ЗИМНЯЯ ВИШНЯ ПОЖАР,29,2018-03-26T15:28:56.000Z,70864,266,189,48,False
MMA Today,2,18.09.02,КАК МЕНЯЛСЯ ХАБИБ НУРМАГОМЕДОВ В UFC! ЭВОЛЮЦИЯ  ЗА ДЕВЯТЬ БОЁВ!,17,2018-02-08T14:55:44.000Z,14276,652,20,162,False
Rickey,2,18.03.01,КВН Спарта - 2018(01.01.2018) Высшая лига. Финал. Стэм,22,2018-01-02T13:19:42.000Z,48548,350,28,27,False
АналитикТВ,2,17.25.11,Александ Невзоров - ПУТИНА СВЕРГНУТ ВНЕЗАПНО И БЫСТРО!,25,2017-11-24T15:37:50.000Z,19529,309,31,71,False
ВРЕМЯ,2,18.27.03,"Пожар в Кемерово, сколько людей погибло и почему власти приказали молчать",25,2018-03-26T18:19:42.000Z,120960,903,289,516,False
Dark Avenger,2,18.10.05,Неловкий момент на параде Победы 9 мая 2018 в Москве.,23,2018-05-09T08:25:04.000Z,106132,381,951,565,False
NUR ТВ АКЫРКЫ КАБАРЛАР,2,17.19.12,АКЫРКЫ КАБАРЛАР ТОПТОМУ 19/12/17 NUR TV АКЫРКЫ КАБАРЛАР,25,2017-12-18T17:30:30.000Z,9297,46,11,11,False
Это Фиаско,2,17.01.12,Пусть говорят: Богатые планы Виталины - Кто следующий? 30.11.2017,22,2017-11-30T15:13:31.000Z,77126,0,0,0,True
Fight News,2,17.31.12,ГДЕ СМОТРЕТЬ БОЙ ХАБИБ - БАРБОЗА / ВСЯ ИНФОРМАЦИЯ И ВРЕМЯ,22,2017-12-30T17:50:53.000Z,88602,835,77,85,False
TÜRKİYE KEP BİLGİ,2,18.03.01,ETBIS Kayıtlarında KEP(Kayıtlı Elektronik Posta) Adresi Şartı Aranıyor,22,2018-01-02T09:41:04.000Z,60354,0,0,0,True
I ❤ MUSIC,2,18.01.04,SUPPER  O'ZBEK KINO KOMEDIYA 2017,1,2018-03-31T16:10:32.000Z,28495,332,84,74,False
Miraculoves Bug,2,18.14.04,Miraculous Ladybug - Ms. Bustier or Marinette will be akumatized - Season 2 Episode 13,1,2018-04-14T04:41:11.000Z,37444,661,10,21,False
OverGames,2,18.26.03,Пожар в ТРЦ «Зимняя Вишня» Кемерово | Видео №4,29,2018-03-25T11:11:05.000Z,114154,288,2159,334,False
Yan Gromov,2,17.13.12,Ян Громов – Отчаянно – ПРЕМЬЕРА КЛИПА 2017,10,2017-12-12T06:24:24.000Z,99651,3365,990,196,False
ПОЛЕЗНЫЕ СОВЕТЫ MIX,2,18.04.02,"КАК ОЧИСТИТЬ СКОВОРОДУ, кастрюлю и любую посуду ОТ ДЕСЯТИЛЕТНЕГО НАГАРА и любого жира",22,2018-02-03T21:46:26.000Z,4313,299,18,42,False
Новости,2,18.17.04,"Трамп пришёл в ярость, узнав, сколько российских дипломатов выслали в ЕС",25,2018-04-16T07:29:16.000Z,220256,0,0,490,False
V-Play Violin duet,2,17.23.11,скрипичный дуэт V-Play / Зима,10,2017-11-22T06:35:45.000Z,102749,1646,524,321,False
Видео Студия -38,2,17.25.11,"Кубок России - Ростелеком 2017-2018 гг., 5-й этап, 24 ноября 2017г",17,2017-11-24T21:41:00.000Z,7990,62,6,0,False
MMORPG.SU. Онлайн игры,2,18.27.04,Роскомнадзор заблокирует весь Интернет. Слухи,20,2018-04-26T16:30:00.000Z,45543,4285,111,448,False
Jekaterina Sap,2,17.18.11,Вязаный страх и ужас. Что я вязала раньше :) Jekaterina Sap,24,2017-11-17T15:00:02.000Z,7220,325,14,73,False
finimor,2,18.22.03,За одну ночь исчезла целая деревня вместе с жителями!,25,2018-03-21T06:00:00.000Z,55378,307,73,119,False
Лотерея Столото от Счастливчика Ника,2,18.02.01,РУССКОЕ ЛОТО 1212 ТИРАЖ 1.01.18 НОВОГОДНИЙ МИЛЛИАРД,24,2018-01-01T16:53:25.000Z,94636,208,479,134,False
pringles,2,18.28.02,¿Adónde irás con Pringles Paprika?,24,2018-02-16T12:04:36.000Z,303071,71,103,20,False
"Tyler, The Creator",2,18.30.03,"Tyler, The Creator - OKRA",27,2018-03-29T16:07:11.000Z,1476311,164064,1092,10901,False
ONEDAH - Beats on Fleek,2,17.26.12,LAST CHRISTMAS wird zu TRAP CHRISTMAS | ► Making a Trap Beat FL Studio - Making a Beat || ONEDAH,24,2017-12-25T17:25:33.000Z,27925,368,1,64,False
Vse Goroskopu,2,17.23.11,САМЫЙ ТОЧНЫЙ ВОСТОЧНЫЙ ГОРОСКОП на 2018 ГОД ДЛЯ КАЖДОГО ЗНАКА,22,2017-11-22T16:40:01.000Z,10066,189,21,15,False
SANDR KAYNDRI,2,17.31.12,Mariama Barrie - Влюблена,10,2017-12-30T06:30:33.000Z,148509,1144,251,91,False
Saspens,2,17.17.12,"10 ИЗВЕСТНЫХ ДЕТЕЙ, КОТОРЫЕ РАЗРУШИЛИ СВОИ КАРЬЕРЫ",24,2017-12-16T10:00:15.000Z,257113,9092,1179,370,False
HAY TV,2,18.08.02,Кто что успел сказать о Мхитаряне,22,2018-02-07T20:02:25.000Z,11279,371,5,24,False
Yellow Music,2,18.15.01,Naa Bolda | Ninja | Video Song | Punjab Singh | Gurjind Maan | Latest Punjabi Songs 2018 | 19th Jan,10,2018-01-13T05:21:04.000Z,609432,5826,182,526,False
Райден,2,18.27.03,ПОЖАР В КЕМЕРОВО | ТЦ ЗИМНЯЯ ВИШНЯ |  О ЧЕМ МОЛЧАТ СМИ ?!,22,2018-03-26T18:07:08.000Z,16038,633,374,670,False
Alamira Games,2,18.13.03,Охомячительный обзор каталога «The Sims 4 Мой первый питомец»,20,2018-03-12T13:28:10.000Z,15283,883,21,26,False
LazizBek UZ,2,18.26.02,25.02.2018 Нархлар Мошина Бозор  (2-Кисм) (Самарканд) 25.02.2018 Avto Narxlar (2-Qism) (Samarqand),22,2018-02-26T01:03:43.000Z,1628,140,3,52,False
CAguileraVEVO,2,18.04.05,"Christina Aguilera - Accelerate (Official Video) ft. Ty Dolla $ign, 2 Chainz",10,2018-05-03T12:00:02.000Z,2465294,99974,17299,16813,False
SHIMOROSHOW,2,18.08.01,ШИМОРО НА ИЗИ ПРОХОДИТ Getting Over It with Bennett Foddy!,20,2018-01-07T10:10:04.000Z,151295,21996,404,3819,False
Kuba Ibra,2,17.13.12,ВСТРЕТИЛ ЗВЁЗД МИРОВОГО ФУТБОЛА!,17,2017-12-12T14:43:56.000Z,215376,1488,470,256,False
GAZgroup,2,17.27.12,Владимир Путин поздравил Горьковский автозавод с 85-летием,22,2017-12-26T11:07:04.000Z,273433,15365,13571,2641,False
sofiyabroyan,2,18.12.06,Ох уж этот очередной Ашотик @vaagmk 😂🤦🏽‍♀️,23,2018-06-11T16:00:06.000Z,17618,1980,25,140,False
LogicVEVO,2,18.18.04,"Logic, Marshmello - Everyday",10,2018-04-17T17:22:07.000Z,1202712,121022,1731,11648,False
Приколы с озвучкой PSO,2,18.12.06,ПРИКОЛЫ С КОТАМИ С ОЗВУЧКОЙ на русском – Озвучка животных от PSO,24,2018-06-11T15:32:24.000Z,21824,565,63,50,False
Victoria Portfolio,2,18.08.01,ROOM TOUR 2018 / МОЙ ДОМ / ГАРДЕРОБНАЯ / ДОМ Victoria Portfolio,24,2018-01-07T12:27:23.000Z,64751,4628,203,643,False
bu QIZIQ,2,18.04.03,Бунга ишониш кийин. Буни куриш керак! Бу дахшат - йулдаги ходиса. Гайритабиий,22,2018-03-03T12:08:32.000Z,101540,966,90,56,False
Фёдор Комикс 2,2,18.07.03,ПРОГИ ДЛЯ АНИМАЦИИ,22,2018-03-06T21:35:21.000Z,1928,333,4,30,False
ОбоВсёМыч,2,18.08.03,ПОЗДРАВЛЕНИЕ  С 8 МАРТА !!!,1,2018-03-07T10:46:44.000Z,232545,884,120,32,False
FC Krasnodar | ФК Краснодар,2,17.27.11,Раздевалка «Краснодара» после победного матча против «Урала»,17,2017-11-26T18:31:39.000Z,1879,48,0,3,False
WISE,2,17.13.12,ВАЙС Feat. 044 ROSE - Mandolina,10,2017-12-12T05:25:49.000Z,112313,5238,344,159,False
Сатисфайн,2,17.21.12,Самая острая конфета в мире! WORLD'S HOTTEST LOLLIPOP CHALLENGE! Испыталити.,24,2017-12-19T14:29:09.000Z,227428,2322,333,246,False
Семья Бровченко,2,17.02.12,"Утепляем фундамент, 10 миллионов, губернаторские и планы на 2 эт.... (12.17г.)  Семья Бровченко.",22,2017-12-01T13:19:38.000Z,62750,1623,166,288,False
Aydar Gaynullin,2,18.04.01,Российский баянист покорил немцев мировыми хитами под оркестр!!! (Германия 2017),10,2018-01-03T06:40:32.000Z,135999,1176,253,141,False
Дмитрий Левандовский,2,17.18.11,Вся правда о компании Кэшбери.,22,2017-11-17T05:00:01.000Z,84432,39,847,84,False
LEKAROK,2,17.18.11,ЧТО СТАЛО С АНДУИНОМ??? | Wow: Battle for Azeroth,20,2017-11-17T15:21:11.000Z,46300,5005,268,609,False
VSE42 Ru,2,18.26.03,Родственники пропавших на пожаре в ТЦ Зимняя Вишня кемеровчан предъявили претензии властям,22,2018-03-25T16:41:39.000Z,106150,1224,2260,699,False
Novinki 2017,2,18.07.04,"🔥ФИЛЬМ 2018 НАШУМЕЛ В КИНОЗАЛАХ! НА ВЕРШИНЕ СУДЬБЫ Русские мелодрамы новинки, фильмы HD1080",1,2018-04-06T17:14:25.000Z,24044,116,14,17,False
Bilgisayar Dersleri,2,18.25.01,#1           ANLATAMIYORUM,10,2017-12-03T19:41:14.000Z,22682,2,2,0,False
Мир познавательного видео,2,18.17.03,"Ей уже 65, в больницах не бывает! Всего лишь 3 раза в неделю пьет чай из обычной…",22,2018-03-16T06:43:30.000Z,23946,746,40,27,False
FCSKA,2,17.19.11,"СКА-Хабаровск - ЦСКА. Голы армейского дерби, слова капитана и бомбардира хабаровской команды.",17,2017-11-18T13:13:23.000Z,7693,38,5,5,False
Таро Натали,2,18.19.03,ЧТО НА СЕРДЦЕ У НЕГО ? ИСТИННЫЕ ЧУВСТВА К ВАМ СЕГОДНЯ..ОНЛАЙН ГАДАНИЕ НА КАРТАХ ТАРО,22,2018-03-18T15:10:39.000Z,9509,432,20,32,False
Какой-то парень,2,18.04.02,Гасиев - Дортикос. Стрим боя. Какой-то парень.,24,2018-02-04T00:57:55.000Z,250735,4270,551,318,False
Banana Kris,2,18.22.02,ОЧЕНЬ СТРАШНАЯ ПЕРЕПИСКА С МЕРТВЫМ ДРУГОМ В ВК 👻 | ПОПРОБУЙ НЕ ИСПУГАТЬСЯ (УЖАСНУТЬСЯ) CHALLENGE,22,2018-02-21T12:30:01.000Z,27821,2656,76,759,False
Таёжная тропа,2,17.28.11,До 3-его балагана и обратно. Охота,26,2017-11-27T09:56:08.000Z,5046,431,3,52,False
BBC,2,18.13.05,Netta (Israel 'Toy') wins Eurovision after dramatic public vote! - Eurovision Song Contest 2018,24,2018-05-12T23:48:30.000Z,1448839,16157,12687,8754,False
Dizoff,2,18.19.05,"МОЯ НОВАЯ VR ДЕВУШКА И ШАЛОСТИ (VR KANOJO, ВР, ВИРТУАЛЬНАЯ РЕАЛЬНОСТЬ)",20,2018-05-18T10:33:06.000Z,76880,6322,165,978,False
VIU VIU,2,17.05.12,VIU VIU - Пабличные Игры (Премьера клипа 2017),10,2017-12-04T06:22:52.000Z,121521,5091,4220,603,False
Екатерина,2,17.27.11,Онлайн гадание. Что у меня с ним будет?,22,2017-11-26T17:04:49.000Z,5162,290,17,24,False
Никита Ордынский,2,18.25.02,"PAPERS, PLEASE - The Short Film (2018) 4K SUBS",1,2018-02-24T15:59:25.000Z,282380,35095,303,1944,False
TheAnimeProduction,2,18.12.05,Великолепный парк АМАГИ | 2 серия,1,2018-05-06T07:01:46.000Z,14737,264,8,8,False
Илья Ширманов,2,18.08.03,Высокие ставки 2 сезон 1 серия Новый сезон.,19,2018-03-06T17:42:16.000Z,17727,89,7,38,False
Вечное Лето - Вокруг Света,2,18.22.03,Тайланд ПОДОРОЖАЛ? ЦЕНЫ 2018 на рынке МореПродуктов на Пхукете,19,2018-03-21T11:26:46.000Z,11562,655,62,107,False
ACB League,2,17.22.12,ACBlog: Preparation for weigh-ins,17,2017-12-21T13:30:56.000Z,5318,84,3,8,False
Каромат Шарипов,2,17.19.12,Каромат Шарипов встретился с Консулом России в РТ с Олегом Жуковым,29,2017-12-18T16:18:39.000Z,47980,1596,42,234,False
Kylie Jenner,2,18.05.02,To Our Daughter,22,2018-02-04T20:27:38.000Z,20921796,0,0,0,True
Первый канал юмора,2,18.06.05,4 ПОДБОРКА ЛУЧШИХ ВАЙНОВ / АНДРЕЙ ГЛАЗУНОВ 2017 - 2018,23,2018-05-05T08:20:55.000Z,7602,148,5,24,False
Yulduz Usmanova,2,17.29.12,YULDUZ USMONOVA-ILTIJO (Prem'era 2017),10,2017-12-28T15:30:00.000Z,42282,1118,51,0,True
EdisonPts,2,18.13.03,МАЙНКРАФТЕР НАШЁЛ СЕКРЕТНЫЙ ПУЛЕМЁТ СТРЕЛЯЮЩИЙ 100.000 ПУЛЯМИ В МИНУТУ!,20,2018-03-12T12:37:22.000Z,160160,21565,589,1318,False
TAJIK PRESENTS,2,18.16.02,ТАДЖИК  спас ✌Русскую женщину,22,2018-02-16T01:45:45.000Z,1513,78,27,23,False
neofitsialno,2,17.25.12,«Неофициально» с Марком Челищевым,17,2017-12-24T17:07:25.000Z,64030,397,13,48,False
YOUNG SKANK,2,17.17.11,LIL PEEP УМЕР / МЫ ПОТЕРЯЛИ ЛЕГЕНДУ!,22,2017-11-16T10:19:55.000Z,167711,2916,2701,754,False
WILSON SAM TV,2,18.08.03,"Ольга Бузова - Она не боится (Премьера песни, 2018)",22,2018-03-07T20:58:32.000Z,12109,582,51,42,False
Хам или Он,2,18.07.02,Как тестируют системы пожаротушения,22,2018-02-06T07:21:11.000Z,284602,3160,706,873,False
Оксана Ричман,2,18.18.01,ГОРОСКОП ДЛЯ ЖЕНЩИН 22.01.2018 - 28.01.2018г. ДЛЯ ВСЕХ ЗНАКОВ ЗОДИАКА. Онлайн Таро гадание.,22,2018-01-17T11:41:19.000Z,6443,356,13,61,False
Star Wars,2,18.05.02,Solo: A Star Wars Story Big Game TV Spot (:45),24,2018-02-04T23:45:12.000Z,2580817,74724,4678,14350,False
MatveyS,2,18.27.05,Hard Play смотрит: Филипп Киркоров - Цвет настроения синий (ПАРОДИЯ),20,2018-05-26T20:50:01.000Z,70388,2786,270,269,False
TonyRautofficial,2,17.14.12,Тони Раут & Talibal - Кровавая Мэри (EMPALDO BEATS),10,2017-12-13T12:46:31.000Z,82802,9837,205,865,False
ZuRus 95,2,18.10.06,Мама Тимати не любит его песни!,22,2018-06-09T14:25:56.000Z,27014,82,7,8,False
Насаат Медиа,2,18.20.02,Кыйынчылыктарыныз жонундо айтып бере аласызбы (СУРОО-ЖООП)-Шейх Чубак ажы.,27,2018-02-20T02:50:54.000Z,1966,174,5,16,False
"Слушай Коран, Заряжай Иманッ",2,18.16.03,"СЛУШАЙТЕ «АЛЬ КАХФ» - СКАЗАНО АЛЛАХ ДАЕТ УСПОКОЕНИЕ, ДУШЕВНЫЙ ПОКОЙ ТОМУ ЧЕЛОВЕКУ.(ПОЛНЫЙ ПЕРЕВОД)",27,2018-03-15T16:40:17.000Z,6226,310,8,28,False
CS:GO StarLadder,2,17.18.12,"Semifinals and Grand final, ECS Season 4 Finals",20,2017-12-18T08:21:56.000Z,241686,3645,165,11,False
Айтопер,2,18.29.01,Время ....,26,2018-01-28T13:15:19.000Z,241185,1287,1149,410,False
МОЁ! Online | Все новости Воронежа,2,17.14.11,Таранит маршрутку в Ворнеже,29,2017-11-13T07:12:25.000Z,3262,6,0,2,False
feeldaflava records,2,17.10.12,D E Y A Мне Жаль [ПРЕМЬЕРА],10,2017-12-09T06:47:42.000Z,77910,875,306,91,False
Лайк TV Шоу,2,17.17.11,Я на телеканале НТР,22,2017-11-16T16:51:57.000Z,135367,11063,1081,1201,False
КПРФ Ульяновск Партия Народа,2,18.13.03,Тайный штаб ЕДРА противодействует встрече Грудинина с жителями города Ульяновска?,25,2018-03-12T07:18:48.000Z,8005,637,3,206,False
Navy Catran,2,17.21.11,Страшный сон Евросоюза.М.Хазин,27,2017-11-20T14:35:58.000Z,7554,70,15,21,False
Киномания,2,17.18.11,"ТОП-10 АКТЕРОВ, КОТОРЫЕ НЕНАВИДЯТ СВОЮ РОЛЬ",22,2017-11-17T14:11:30.000Z,7707,350,9,27,False
ГлавТема | ГлавРадиоОнлайн,2,18.09.02,ГлавТема №133. Отставка чиновников в Дагестане. Предвыборная компания,25,2018-02-09T03:45:25.000Z,1797,142,40,109,False
Красный Политобзор,2,18.07.03,Выборы на Кубани 2: Обращаемся к Э.А. Памфиловой,25,2018-03-07T05:30:01.000Z,2243,426,3,96,False
Телеканал Звезда,2,18.30.04,30 апреля 1945 года в охваченном уличными боями Берлине в 22 50 над Рейхстагом было водружено Знамя,25,2018-04-30T06:03:39.000Z,2532,357,0,35,False
ВООТ !!!,2,17.23.11,с 1.01.2018 всех водителей кинут на 24000 руб/ЭРА ГЛОНАСС/нарушение ПДД и ОСАГО дорожает,2,2017-11-21T16:47:11.000Z,280870,20259,2776,2612,False
NVO1,2,18.29.05,Անպայման դիտեք։ Բաց նամակ Վարչապետ Նիկոլ Փաշինյանին,25,2018-05-28T04:21:30.000Z,171696,6809,277,604,False
DIANNA MUSIC,2,17.24.12,DIANNA - Губы,10,2017-12-23T07:02:08.000Z,174152,3705,1104,297,False
HEY kee,2,18.30.04,17 аниматоров ДО и ПОСЛЕ - 17 Animators BEFORE and AFTER(Russian Video),22,2018-04-04T19:23:37.000Z,16982,871,31,228,False
IdiotikShow,2,17.22.12,РЕЗИНОВЫЙ РОТ | ШОУ ПАДКИНАБАБКИ,23,2017-12-21T18:00:36.000Z,41115,2906,205,174,False
Room Factory LIVE,2,18.26.03,НОРМАЛЬНАЯ ДЕВУШКА VS МОЯ ДЕВУШКА / ЗА КАДРОМ,22,2018-03-25T13:39:13.000Z,157171,9642,354,352,False
AniChest,2,18.28.05,Аниме приколы под музыку #150 (18+),23,2018-05-27T17:28:24.000Z,42330,3293,98,487,False
RAPID,2,17.15.11,Люцифер — 3 сезон 8 серия (3x08) | Русский Трейлер/Промо,22,2017-11-14T02:41:12.000Z,5708,10,1,1,False
АнтиХламур / Дом-2 в Periscope,2,17.26.11,Свадьба Евгения Кузина и Саши Артёмовой. Букет невесты,24,2017-11-24T21:56:57.000Z,22267,50,17,9,False
Wrsh98,2,18.09.02,Real Madrid vs Real Sociedad 3-1 All Goals & Highlights 2018 (Last Match) HD,17,2018-02-08T23:35:32.000Z,717830,4285,650,227,False
Мутные Замуты,2,18.05.06,Тачка братвы из 90-х стояла в гараже с 1999года,22,2018-06-04T15:55:17.000Z,112024,1498,767,423,False
Josh Zaring,2,18.03.01,Create. Share. Repeat. Channel Motivation and Plans for 2018,27,2018-01-02T18:58:02.000Z,51010,7,7,3,False
Камила Алиева,2,18.02.05,Жасмина транс биго лайф 30.04.18. Инстагам блок,22,2018-05-01T20:46:00.000Z,5325,71,39,52,False
МихейTUBE,2,18.26.03,ПОЖАР В ТЦ ЗИМНЯЯ ВИШНЯ В Кемерово | СГОРЕЛО ВСЁ ЗДАНИЕ | 25.03.2018,22,2018-03-25T22:24:36.000Z,41253,478,124,348,False
Аид [VyacheslavOO],2,18.13.03,ЧТО МОЖЕТ СДЕРЖАТЬ СТОЛЬКО МОБОВ?! МАЙНКРАФТ,20,2018-03-12T15:01:19.000Z,316492,29202,513,4989,False
Кирилл Волчков,2,17.30.12,ЛИГА ПЛОХИХ ШУТОК НЕИЗДАННОЕ Ургант х Гудков,20,2017-12-29T11:07:09.000Z,117844,3148,372,92,False
Morflex TV,2,18.30.03,Пожар в Кемерово и Разговор детей во время пожара в Кемерово 25.03.18,22,2018-03-27T21:42:33.000Z,40162,143,56,46,False
Forcado NEWS,2,18.28.03,МИТИНГ В КЕМЕРОВО 2018  пожар в тц зимняя вишня,20,2018-03-27T10:42:11.000Z,258843,3666,654,254,False
Vlad Krasavin,2,18.21.02,ДРУЗЬЯ vs ЛУЧШИЕ ДРУЗЬЯ | Kirill Felix,24,2018-02-20T18:03:22.000Z,4486,1003,13,199,False
Sergey Arturovich,2,18.16.02,Золотая лихорадка 8 сезон 18 серия (эфир от 15.02.2018),24,2018-02-15T21:10:27.000Z,2384,81,4,19,False
Галина Крылова,2,17.11.12,О чем молчит Гринпис. Настоящая угроза жизни на Земле,22,2017-12-10T07:16:09.000Z,80273,433,857,161,False
Yulia Latynina,2,18.22.04,LatyninaTV / Код доступа/  21.04.2018 / Видео,25,2018-04-21T23:17:36.000Z,4067,228,13,33,False
ART Lover,2,18.01.02,🔥Лайфхаки для художников. Акварель|| ОБЗОР крутых КНИГ для рисования,26,2018-01-31T10:19:49.000Z,5557,698,3,64,False
Vesti Perm ONLINE,2,18.16.01,Шок! Вооруженное нападение на школу № 127 в Перми,29,2018-01-15T07:39:24.000Z,140668,600,494,568,False
XFANATIX,2,17.30.12,LEO - Голос Банши,10,2017-12-29T12:57:19.000Z,256424,1341,2565,359,False
LIFE ONLINE,2,18.28.03,Козловский назвал реальное число жертв в Кемерово,17,2018-03-27T07:55:49.000Z,294923,2860,626,504,False
"Это Владивосток, детка!",2,17.16.11,Где суша / Where is the earth ???,2,2017-11-15T02:11:14.000Z,94596,437,5,79,False
Daniil Karmanov,2,18.10.02,"Мужское/Женское - Памяти Вики! (Первый канал, 21.04.2015)",29,2018-02-09T12:00:08.000Z,29517,89,20,28,False
Tata Simonyan,2,18.30.04,Tata Simonyan - Hayastan Barev // Թաթա Սիմոնյան - Հայաստան  Բարև,10,2018-04-29T15:30:22.000Z,201909,8458,90,620,False
Yeah boy,2,18.20.02,Guf разносит Птаху во 2 раунде,24,2018-02-19T13:34:11.000Z,182989,4080,448,337,False
Vovan222prank,2,17.24.12,Пранк с Никки Хейли (Представитель США в ООН),23,2017-12-23T08:07:45.000Z,52517,1529,77,484,False
ЛПХ Кубик,2,18.26.03,Продолжение эфира. Пожар ТЦ Зимняя Вишня Кемерово,22,2018-03-26T01:12:35.000Z,165810,1436,258,201,False
sansaraTV,2,17.29.12,Сансара – Тянет в сторону тебя 😍,10,2017-12-28T11:49:34.000Z,177233,350,367,88,False
Народный КиноЛяп,2,17.26.11,31 ляп в мультфильме Три богатыря на дальних берегах - Народный КиноЛяп,1,2017-11-25T09:03:16.000Z,70676,1625,430,2001,False
Shaxrixan TV,2,17.19.11,Nokaut battle 10 soni Battleda Ozgarishlar kotta fikrlarni komentga yozamiz,22,2017-11-18T13:34:20.000Z,3342,61,18,96,False
WebBank21,2,17.31.12,WB21 - Celebrating 24 months of success,28,2017-12-29T12:48:32.000Z,169645,15,54,0,True
Сибирский Кедр,2,17.12.12,Быть счастливым - это просто,22,2017-12-11T06:31:21.000Z,158027,2919,630,313,False
CryptoManiac,2,18.03.01,How to Buy Bitcoins in Canada Instantly - Quick & Easy Method,28,2017-12-30T18:48:22.000Z,49307,581,0,36,False
Washington Post,2,18.20.05,Watch live: The royal wedding of Prince Harry and Meghan Markle,25,2018-05-19T14:26:17.000Z,5943011,35523,4268,2268,False
Путин может,2,18.27.01,Первые версии известных голливудских фильмов,22,2018-01-26T06:26:26.000Z,97577,2174,2472,730,False
Руки из плеч,2,17.14.12,Крутые самоделки.  Полезные приспособления.,28,2017-12-13T14:00:04.000Z,80801,3235,114,135,False
Eugene Sender,2,17.23.12,SENDER - ТАК БУДЕТ ЛУЧШЕ (Official Video),10,2017-12-22T06:39:56.000Z,96310,2319,1329,343,False
George Kosilov,2,18.04.03,НЕ ВЫБРАСЫВАЙТЕ МАСЛЯНЫЙ ФИЛЬТР,28,2018-03-03T04:26:18.000Z,388995,5498,898,224,False
ivi,2,17.27.12,Преимущества подписки ivi+,22,2017-12-20T09:28:53.000Z,501229,50,512,73,False
Новости ШОУ-БИЗНЕСА!,2,17.09.12,ПОДЛОСТЬ ДОЧЕРИ ВОЛОЧКОВОЙ ВЫБИЛА У БАЛЕРИНЫ ПОЧВУ ИЗ-ПОД НОГ,25,2017-12-08T15:32:53.000Z,10675,36,26,4,False
У Жоржа,2,18.21.03,Картофельный кябаб с овощным рагу,1,2018-03-20T19:42:31.000Z,9650,1628,13,543,False
SpaceX по-русски,2,18.07.02,Русская трансляция первого пуска Falcon Heavy,28,2018-02-07T02:10:29.000Z,122740,4016,105,116,False
Dadobro.com,2,18.03.02,Коробка храбрости. Короткий метр,22,2018-02-02T09:40:45.000Z,178891,6166,576,0,True
Три богатыря,2,18.02.01,Снежная королева 3. Огонь и лед,30,2018-01-01T09:00:13.000Z,100049,1732,138,196,False
ТОЛЯ,2,18.22.04,США предложили лишить российского золота,25,2018-04-21T13:56:59.000Z,48755,603,94,130,False
КИТАЙ УДИВЛЯЙ,2,18.03.05,20 ВЕЩЕЙ С ALIEXPRESS КОТОРЫЕ ТЕБЕ ЯВНО ПОНАДОБЯТСЯ ТОВАРЫ С АЛИЭКСПРЕСС + КОНКУРС,24,2018-05-02T17:00:02.000Z,5821,473,26,193,False
RUSSELL BLOG,2,18.09.05,Я В ШОКЕ!Моя реакция на результаты первого полуфинала Евровидения 2018,22,2018-05-08T21:29:35.000Z,12221,769,66,543,False
Finikland,2,17.01.12,ИНТУИЦИЯ С ОСОБЫМИ ПАКАМИ VS. ДЕНЧИК ФЛОМАСТЕРОВ,20,2017-11-30T12:00:01.000Z,86300,6746,250,159,False
InSammer,2,18.06.02,InSammer - Crazy Stupid Love (Live in Club Zal),10,2018-02-05T07:02:46.000Z,260063,1184,866,248,False
SiaVEVO,2,17.23.11,Sia - Santa's Coming For Us,10,2017-11-22T16:00:02.000Z,684778,62970,1492,6495,False
МолодёжкаОНФ,2,18.04.02,«Случайный вальс» Молодёжка ОНФ,22,2018-02-03T05:22:02.000Z,214830,1811,890,606,False
Штаб Навального в Нижнем Новгороде,2,18.04.02,Путинский митинг в Нижнем Новгороде,22,2018-02-03T15:26:23.000Z,109090,7780,11773,3235,False
Новатор,2,18.06.03,Грудинин отдал победу Путину,25,2018-03-05T16:00:49.000Z,127213,4693,4212,2904,False
Вячеслав Котляров •Социальный Авторитет•,2,18.20.03,Настоящая Атлантида 100% найдена.  Луна дала ответ 174 часть.,23,2018-03-19T03:52:39.000Z,17166,537,63,126,False
LORDAN Play,2,18.26.03,Рация!!Пожар в КЕМЕРОВО ЗИМНЯЯ ВИШНЯ,22,2018-03-25T23:48:08.000Z,11105,32,9,5,False
Plarium Games,2,17.24.11,Ask Plarium #7 - Defense Structures,20,2017-11-23T09:57:36.000Z,9246,111,15,60,False
Garnier Russia,2,17.03.12,Крем-масло Botanic Therapy против выпадения волос,26,2017-11-22T13:42:14.000Z,309409,154,151,10,False
Flips,2,18.01.03,Владимир Путин вручает награды победителям XXIII Олимпийских игр в Пхёнчхане 28.02.2018,25,2018-02-28T16:57:58.000Z,93450,0,0,1417,False
БАСЕ ИНФОРМАЦИОННЫЙ ПОРТАЛ,2,18.19.04,Назарбаев воткнул Путину нож в спину/ БАСЕ,25,2018-04-18T04:21:48.000Z,669607,4904,4377,4772,False
Дмитрий Шкляев,2,17.08.12,Афера века с кодом валюты 810 RUR просочилась на ТВ.,22,2017-12-07T13:56:13.000Z,65628,2152,64,285,False
Семейное дело. Столярная мастерская БУК,2,18.09.02,Guide for veneering veneer.      Шпон + фанера = просто !!!,22,2018-02-09T03:00:01.000Z,2004,259,6,34,False
Андрей Малахов,2,17.23.11,Преемник Путина 2018,25,2017-11-22T16:36:31.000Z,6689,217,13,31,False
OSHLIVE TV,2,18.02.01,Zo'r Yangi Yil (Musiqiy badiy film),23,2018-01-01T09:42:49.000Z,41265,346,53,37,False
ВОЛМА,2,17.22.12,Подарок маме на Новый год. ВОЛМА,22,2017-12-21T07:08:17.000Z,130932,2675,175,93,False
ПРИКОЛЫ НА РЫБАЛКЕ 2018,2,18.03.02,СОМЫ АТАКОВАЛИ ГНЕЗДО С МЯСОМ ЖИВЦА! ВОТ ЭТО РЫБАЛКА ты не поверишь 2018 зрелище не для слабонервных,24,2018-02-01T08:49:29.000Z,795254,2867,868,354,False
DragtimesInfo,2,17.12.12,DT_LIVE. Постройка 800 л.с. GT-R #1 + обзор BMW X4 M40i,2,2017-12-11T08:54:30.000Z,139515,5372,372,220,False
Inna Grytsyk,2,18.29.01,ПОКУПКИ ОДЕЖДЫ С ПРИМЕРКОЙ! ЧТО Я БУДУ НОСИТЬ ВЕСНОЙ 2018?,22,2018-01-28T21:49:27.000Z,5532,1062,10,116,False
Aaditya Pratap Singh Entertainments.,2,17.24.12,Teasure - Sir Rowland Hill & Postal Reform,22,2017-12-23T14:38:48.000Z,38490,5,1,0,False
Таролог ale handro,2,17.20.11,Что он себе думает? Его реальные мысли. Гадание на отношения ❤ Taro online ® Таролог Ale Handro,1,2017-11-19T15:27:18.000Z,6418,392,21,62,False
Hunny Bunny,2,18.12.03,11.03.2018 Спартак 1:0 ска Хабаровск [1:0] гол Фернандо,17,2018-03-11T18:08:48.000Z,48164,676,27,112,False
Матвей Балов,2,18.25.01,КАК ЗАТРОЛИТЬ ЯНДЕКС АЛИСА?,24,2018-01-24T13:00:09.000Z,104617,12353,225,2346,False
YouVideosRu,2,18.26.01,Когда снега много не бывает,22,2018-01-25T07:04:31.000Z,207307,5010,881,538,False
Топовский,2,18.10.03,ВЗЛОМАЛИ КАНАЛ ТРЕТИЙ КРАФТ АВП МЕДУЗА ЗА 250000,20,2018-03-09T13:53:49.000Z,48251,4071,1017,78,False
The key to life!!! !!!,2,18.01.01,"В Южно-Сахалинске  загорелась елка,замкнула проводка.",22,2017-12-31T17:13:39.000Z,13482,38,17,14,False
Movie Thread,2,18.30.04,Пойманная русалка. HD,1,2018-04-30T07:42:01.000Z,1527,21,1,1,False
Airen Tale,2,18.15.01,Lux & Funservis comic RUS DUB | Много-голосовая озвучка,26,2018-01-14T10:09:30.000Z,7787,963,7,136,False
Костя Белый,2,18.28.03,Начало пожара в Зимней вишне г.Кемерово 25.03.18,29,2018-03-27T16:06:24.000Z,65834,380,203,159,False
Otmarozhenyy,2,18.26.03,Пожар в тц зимняя вишня Кемерово погибли люди.,24,2018-03-25T15:22:18.000Z,155072,520,1374,625,False
TRYANGLE FILMS,2,18.14.01,Voldemort: Origins of the Heir - An unofficial fanfilm (HD + Subtitles),1,2018-01-13T19:59:20.000Z,1654919,142897,4073,14674,False
Мастерская Инги Таро,2,17.24.11,ПРОГНОЗ НА НЕДЕЛЮ 27.11-3.12 ДЛЯ ЗНАКОВ ЗОДИАКА,24,2017-11-23T14:20:47.000Z,6259,267,28,36,False
ACB TV,2,18.17.02,ACB 80: Альберт Туменов (Россия) – На Шон Баррелл (США),10,2018-02-16T22:35:57.000Z,2637,80,8,16,False
Denchiktv,2,18.13.01,Бузова в Ашане 😂😂😂,23,2018-01-12T12:27:36.000Z,10592,199,20,15,False
Mark Makarov,2,17.19.11,КТО ИЗ ВАС ? / БИНЕТ СЕНН / С КЕМ МУТИТЬ ?,23,2017-11-18T14:48:45.000Z,97163,10106,83,736,False
Liepota,2,17.24.12,Съемки клипа 30 лет / Лысый Ларин,24,2017-12-23T20:44:46.000Z,19107,1873,40,101,False
Профсоюз СОЮЗ ССР,2,18.02.02,Пресс-конференция по обыску у участника профсоюза. Только факты,22,2018-02-01T08:18:15.000Z,2967,326,3,173,False
Ocean High,2,17.14.11,"Ocean High: Blackbird album (pop dance/electro pop, 2017)",10,2017-11-13T11:40:00.000Z,1191,107,0,6,False
БИЗНЕС КЛАСС,2,17.27.11,"Ресторатор СЕРГЕЙ МИРОНОВ о сети «Мясо и Рыба», участник списка Forbes “30 under 30” ИЛЬЯ САЧКОВ",22,2017-11-26T06:45:40.000Z,71170,3980,116,82,False
my.uzbekistan uz,2,17.29.11,DENGIZDAN TOMCHI 11,24,2017-11-28T13:14:52.000Z,4325,38,4,0,False
Просрочка Патруль-Нижний Новгород,2,18.31.05,ПОЛИЦИЯ АРЕСТОВАЛА ДИРЕКТОРА ПЯТЕРОЧКИ / НАПАЛ НА ПОКУПАТЕЛЕЙ / ЗАПРЕЩЕНО СНИМАТЬ,22,2018-05-31T10:00:04.000Z,36227,3474,145,688,False
Пэнн,2,18.13.03,НУБ ПЛАСТИЛИНОВЫЙ ЧЕЛОВЕЧЕК ЗАТРОЛЛЕН БЕНДИ ! КАК СДЕЛАТЬ ПОРТАЛ В ПЛАСТИЛИНОВЫЙ МИР В МАЙНКРАФТ,20,2018-03-12T07:00:04.000Z,20951,732,19,88,False
Dynamo Moscow FC,2,17.31.12,"Панченко, Деды Морозы, новый стадион, Новый год!",17,2017-12-30T11:27:13.000Z,4916,206,0,11,False
MGKVEVO,2,17.23.12,Machine Gun Kelly - Habits,10,2017-12-22T05:00:01.000Z,693440,59548,809,3545,False
Ytmatik Panel,2,18.23.01,crazy dog,22,2018-01-21T12:31:32.000Z,22197,167,6,3,False
Кандидат юридических наук Абрамов Юрий Викторович,2,18.13.06,Семен Слепаков об успехах сборной России на ЧМ 2018. Олé-Олé-Олé!,24,2018-06-11T22:11:28.000Z,156154,5402,904,572,False
Футбол обзор,2,18.26.02,МЮ - ЧЕЛСИ  2-1 ОБЗОР МАТЧА 25.02.2018(HD),22,2018-02-25T17:41:22.000Z,6854,64,2,2,False
Ушакова Ксения,2,17.18.11,"Коля Соболев, это видео для тебя",22,2017-11-17T13:54:31.000Z,61899,6414,1022,627,False
Sanya Cos,2,18.24.02,Алина Загитова Произвольная программа Олимпийские игры,17,2018-02-23T05:25:22.000Z,243535,3524,238,1351,False
Infinitum music,2,17.04.12,Тони - На баре (ПРЕМЬЕРА КЛИПА 2017),10,2017-12-03T06:32:21.000Z,124831,642,4014,437,False
Muscle Metrix,2,17.31.12,Eric Kanevsky Parody,24,2017-12-31T00:24:56.000Z,18553,55,6,36,False
Авторадио,2,18.07.04,Живой концерт SEREBRO на Авторадио,10,2018-04-06T09:30:01.000Z,11757,259,16,41,False
foresterization1 стримы,2,17.04.12,Алексей Навальный в Самаре. 3 декабря 2017. Митинг,25,2017-12-03T13:54:25.000Z,16671,835,2913,81,False
ФК «Локомотив» Москва,2,18.16.02,Антон Миранчук: Нужно ещё больше работать,17,2018-02-16T02:32:39.000Z,1425,178,1,23,False
Lil pump,2,18.14.04,Lil Pump - ESSKEETIT (Official Music Video),10,2018-04-13T03:59:40.000Z,11500696,924180,48749,109506,False
FAKT tv,2,18.21.02,ВОЛЬНАЯ ГРАМОТА сериал 9-14 серии Анонс Содержание серий 9-14 серия,22,2018-02-20T18:10:08.000Z,12706,34,8,0,False
MMAnytt.se,2,18.05.04,Artem Lobov and Khabib Nurmagomedov Confrontation Ahead Of UFC 223',17,2018-04-03T22:26:08.000Z,850219,2562,348,3261,False
New Trends,2,18.19.03,РЕАЛЬНЫЕ ИТОГИ ВЫБОРОВ !!!,25,2018-03-18T16:55:12.000Z,419064,8819,2600,19392,False
Froyd,2,18.09.02,VK72.01(К) || MERCY,20,2018-02-07T16:10:49.000Z,1513,139,19,0,False
ARTPIX,2,18.21.01,Creation Bridges - Panache Collection - Visualization - Render,1,2018-01-20T05:54:06.000Z,116088,305,418,176,False
Ночь на Кладбище,2,18.13.03,ЗВОНОК НОЧНЫХ НАБЛЮДАТЕЛЕЙ В СКАЙПЕ - СТРАШИЛКИ НА НОЧЬ,24,2018-03-12T13:56:31.000Z,23755,2160,25,551,False
Cyberschool CS:GO [Official],2,17.20.11,"ZEUS LIVE #2: ELECTRONIC, EDWARD и FLAMIE ОБСУЖДАЮТ СТРАТЫ!",20,2017-11-19T12:33:19.000Z,109099,6302,126,522,False
КеК,2,18.13.03,КАК ВЫЖИТЬ НУБУ В МИРЕ ЛАКИ БЛОКОВ И ТНТ В МАЙНКРАФТ? КАК ВЫЖИТЬ В MINECRAFT? ТРОЛЛИНГ | МУЛЬТИК,20,2018-03-12T10:20:42.000Z,49861,1171,108,95,False
Bridget Suarez,2,17.19.11,Ни за что не сдамся 3-4 серия (2017) Фильм Мелодрама Сериал,22,2017-11-18T14:29:37.000Z,20096,39,16,10,False
AlisaFox,2,18.13.03,КТО УКРАЛ ЗОЛОТО У ЖИТЕЛЕЙ ДЕРЕВНИ В МАЙНКРАФТ! НУБ ДЕТЕКТИВ MINECRAFT ТРОЛЛИНГ Мультик для детей,20,2018-03-12T11:01:57.000Z,23271,1527,40,207,False
Its' Mamix,2,17.15.12,СДЕЛАЛ ИГРУ САПЕР В РЕАЛЬНОЙ ЖИЗНИ!,22,2017-12-14T15:39:54.000Z,199438,20608,918,894,False
Выбор 2018 Несерьёзно о серьёзном,2,18.08.02,5 самых интересных выступлений президентов,22,2018-02-07T07:49:16.000Z,243415,283,3097,1984,False
Battlefield,2,18.10.06,Battlefield 5 Official Multiplayer Trailer,20,2018-06-09T18:07:15.000Z,2474560,135481,19611,33403,False
АТН новости Беларуси и мира,2,18.26.03,Трагедия в Кемерово: четверо детей погибли при пожаре в торгово-развлекательном центре,25,2018-03-25T12:46:12.000Z,6036,12,5,11,False
За нами уже выехали,2,18.03.01,Финал КВН-2017/ Масляков был против чемпионства Спарты?,22,2018-01-02T14:02:33.000Z,237851,2893,1470,1230,False
DANIIL K1M,2,18.27.03,Кемерово ЗИМНЯЯ ВИШНЯ пожар ВСЕ ВИДЕО 25.03.2018,22,2018-03-26T14:47:16.000Z,113538,0,0,367,False
PonchikShow,2,18.02.03,Время и Стекло - Тролль (ПАРОДИЯ от СОБАКИ) / МС ПОНЧИК - СУПЕРСТАР,15,2018-03-01T15:18:34.000Z,48181,11857,115,1541,False
Большой Футбол,2,18.04.03,Реал Мадрид - Хетафе 3:1 | Обзор Матча & Лучшие Моменты 04.03.2018,17,2018-03-03T21:37:59.000Z,14017,659,10,19,False
Максим,2,18.14.05,Netta Barzilai TOY Israel Евровидение 2018 Победитель Израиль,22,2018-05-13T13:27:00.000Z,17234,211,206,171,False
bookspace,2,18.31.01,"5 КНИГ, КОТОРЫЕ... 😱 боятся чеснока! КНИГИ ПРО ВАМПИРОВ",22,2018-01-30T04:00:02.000Z,6426,576,2,131,False
ALMATY ONLINE,2,18.10.05,"Чайковская: Медведева сделала огромную ошибку, уйдя от Тутберидзе",17,2018-05-09T07:17:28.000Z,34962,161,40,82,False
Molly Rocket,2,18.30.01,Dancing Staffy Dog Branch Tango!,22,2016-11-04T13:29:51.000Z,49904,134,148,31,False
D47,2,18.05.06,D47- Pool Of Pain (Official Video),10,2018-05-24T19:25:04.000Z,347011,10320,737,402,False
Бизнесфилософ,2,18.06.02,Как мыслят киты на рынке криптовалют,22,2018-02-05T18:57:00.000Z,15788,1470,38,437,False
Познавательное ТВ,2,18.22.02,"Культурный код банкира (Познавательное ТВ, Михаил Величко)",27,2018-02-22T01:56:09.000Z,1808,189,14,26,False
•Голубая Star•,2,18.05.05,Игра Создай Свою Ос Ч.О,22,2018-04-26T09:55:14.000Z,26612,1053,109,262,False
Philip Marvin,2,18.24.01,Поругался с девушкой. Сломал кровать. По городу в калошах,22,2018-01-23T10:00:03.000Z,240629,22550,1407,1521,False
Дом.ru,2,18.10.02,Раздающая | Короткометражный фильм,24,2018-02-09T06:15:00.000Z,37258,3964,602,319,False
Лютая Студия - Lutaya Studio,2,18.02.01,"КВН ФИНАЛ 2017 | Как СПАРТА Стали Чемпионами | Раисы, Цирк, Плюшки, Радио Свобода",22,2018-01-01T14:30:58.000Z,100071,3015,216,514,False
Телекомпания ТВ2,2,18.28.03,В Томске убрали цветы в память о погибших в Кемерове,25,2018-03-27T05:59:17.000Z,39477,392,51,296,False
1theK (원더케이),2,17.14.12,[MV] B.A.P _ HANDS UP,10,2017-12-13T09:00:01.000Z,448967,93717,247,6328,False
Слушай Кайфуй,2,18.20.04,Классная песня!! Слушаем и Кайфуем!!! Диско группа Сердце Ангела - Расставание NEW 2018,10,2018-04-19T11:25:27.000Z,21538,1012,37,42,False
Jonny .E,2,17.14.11,13 11 17,1,2017-11-13T07:32:26.000Z,55554,52,7,69,False
Geheni Araqel,2,18.21.05,ՏԵՐՆ   ՈՒ  ԾԱՌԱՆ,22,2018-05-20T18:57:59.000Z,27843,167,86,117,False
Мадина Алиева,2,17.26.11,"Духтари Шабнами Сураё, Шарифамох- ты сама лучшая ❤💕😻",22,2017-11-25T00:27:51.000Z,111859,800,195,253,False
ВСЁ ИНТЕРЕСНО,2,17.31.12,Хабиб Нурмагомедов выиграл свой бой! 31.12.2017,22,2017-12-31T05:22:43.000Z,25123,347,34,68,False
ZLOYMAN,2,17.03.12,Мульт - День из жизни Кирилла Терешина (СинтолМэна),24,2017-12-02T11:05:43.000Z,48998,3167,202,201,False
Моя страница,2,18.11.03,БИАТЛОН 10.03.2018. СМЕШАННАЯ ЭСТАФЕТА. КУБОК МИРА. КОНТИОЛАХТИ,17,2018-03-10T17:51:03.000Z,23662,115,19,25,False
Nepeta Family,2,17.17.12,БАКУ- пожиратель снов и КРОЛИК Ляля стали союзниками!,22,2017-12-16T05:58:34.000Z,116819,5448,104,1578,False
Empire of Geese,2,17.16.12,[RUS COVER] Sans Can't Decide [SFM] (На русском),20,2017-12-15T14:00:04.000Z,18102,1577,80,268,False
КРУТИЛКИНЫ,2,17.11.12,Tasty Blue #8 ЗУБАСТАЯ АКУЛА СЪЕЛА ЗЕМЛЮ Игровой мультик для детей ФИНАЛ от КИДА #КРУТИЛКИНЫ #КИД,1,2017-12-10T09:01:58.000Z,35412,342,18,132,False
Профессор ГУГЛОВ,2,17.28.12,"ПЕРВОЕ, ЧТО ВЫ УВИДИТЕ, ОПИШЕТ ВАШ ХАРАКТЕР",24,2017-12-27T14:44:01.000Z,18782,831,86,135,False
HappyLime,2,18.13.03,"11 СЕКРЕТНЫХ ПРЕДМЕТОВ, КОТОРЫЕ ВЫ МОЖЕТЕ ПОЛУЧИТЬ В МАЙНКРАФТ | КРАФТ ТРОЛЛИНГ ВЕЩЕЙ В MINECRAFT",20,2018-03-12T14:23:19.000Z,39058,4606,57,922,False
Nicki Minaj,2,18.14.04,Nicki Minaj - Chun-Li (Music Video),10,2018-04-14T05:44:40.000Z,479511,61085,2273,6792,False
Крипто Столица,2,17.25.12,24 декабря 2017 г. Биткоин упадёт? А обезьяны останутся?,22,2017-12-24T13:15:57.000Z,270872,221,2559,306,False
Спорт FM,2,18.01.06,100% Футбола. В.Уткин об уходе Зидана и сборной России. 31.05.2018,17,2018-05-31T18:41:26.000Z,23667,454,69,146,False
Alphard Sound Technology,2,17.07.12,Поставили Самый Большой Сабвуфер в Крышу Классики (ВАЗ-2102),2,2017-12-06T11:27:00.000Z,74375,2804,139,201,False
Biathlon Sports HD,2,17.03.12,БИАТЛОН 02.12.2017. КУБОК МИРА. МУЖЧИНЫ. СПРИНТ. 10 КМ. БИАТЛОН 2017-2018 ПРЯМАЯ ТРАНСЛЯЦИЯ. LIVE,17,2017-12-02T15:30:36.000Z,69293,470,81,18,False
Panjsher media,2,18.15.05,Шабнами Сураё дует бо Фарзонаи Хуршед 2018,10,2018-05-14T15:01:58.000Z,45635,0,0,142,False
Kodak Black,2,18.16.01,Kodak Black - Roll In Peace feat. XXXTentacion [Official Music Video],10,2018-01-15T19:04:29.000Z,1390338,101545,1896,12527,False
Юни Голд UNI GOLD,2,17.09.12,"День честности. Детский фильм. И в шутку, и всерьез.",1,2017-12-08T12:17:26.000Z,8700,299,12,64,False
tv channel,2,17.15.11,mexramis  278 anons մեղրամիս,22,2017-11-14T11:46:43.000Z,20470,50,2,5,False
Pelagea ASMR,2,17.25.12,ASMR - All I wish for Christmas is you!,22,2017-12-24T18:06:05.000Z,133577,6011,144,1151,False
Психо Логика,2,18.06.01,Профессиональный психологический ТЕСТ! Выбери понравившегося человека!  Тест онлайн!,27,2018-01-05T14:00:03.000Z,13165,565,19,145,False
7Дней,2,18.12.05,Юлия Самойлова на Евровидении 2018 - I Won’t Break,22,2018-05-10T20:07:11.000Z,1357959,4777,28732,10614,False
Artur Sharifov,2,18.21.05,Cуперкомпозиты VS Глобальное потепление,28,2018-05-19T07:49:53.000Z,94188,12091,377,934,False
DJLsb Vapes,2,18.04.01,👉 Godria BOLT RTA Review & Giveaway with Coil & Wick Tutorial👈,24,2018-01-03T12:00:06.000Z,20283,440,25,306,False
DanaSYC Vlogs,2,18.13.03,Урааа Теперь у меня есть глиттерный ЛОЛ LOL surprise GLITTER SERIES Распаковка шаров ЛОЛ,24,2018-03-12T12:11:01.000Z,139360,4303,291,1546,False
RELIFE,2,18.30.03,Девичий 2D хайп,23,2018-03-28T18:24:59.000Z,58950,5831,165,638,False
Starshiy Brat TV,2,18.06.02,⚽ КРОССБАР ЧЕЛЛЕНДЖ С ПОДПИСЧИКАМИ ⚽ CROSSBAR CHALLENGE WITH MY SUBSCRIBERS,22,2018-02-06T05:00:00.000Z,2277,259,26,44,False
officialddt,2,18.02.03,[ПРЕМЬЕРА] ДДТ — Любовь не пропала,10,2018-03-01T10:59:07.000Z,235589,3490,61,273,False
"SEVELENIUM | Макияж, маникюр и DIY",2,17.17.11,ПОВСЕДНЕВНЫЙ МАКИЯЖ С ДЫМЧАТОЙ СТРЕЛКОЙ / Универсальный макияж на каждый день,26,2017-11-16T14:09:01.000Z,9115,1159,12,92,False
Иван Проценко,2,18.10.05,Киев. 9 мая. Без комментариев,25,2018-05-09T16:21:06.000Z,168021,828,296,1385,False
ANDECOR,2,17.30.11,Жена Хворостовского простилась с мужем,22,2017-11-29T11:23:58.000Z,56672,217,29,53,False
video video,2,18.18.03,Фабрисио Вердум против Александр Волков полный обзор боя,23,2018-03-18T01:35:37.000Z,37935,509,50,150,False
MovieScience,2,17.12.12,Почему Важно Понимать Кино?,1,2017-12-11T18:04:40.000Z,18902,4493,31,325,False
Александр Винников,2,17.27.11,iPhone X.  Неужели все стало так плохо? О чем молчит Wylsacom?,2,2017-11-26T11:43:33.000Z,56478,2798,242,399,False
Maddy MURK,2,18.29.01,Принесли разворованный ПК из сервиса / Восстановление старого ПК / Компобудни #13,28,2018-01-28T13:13:07.000Z,59853,3612,213,1028,False
21SavageVEVO,2,18.02.03,"21 Savage, Offset, Metro Boomin - Ric Flair Drip",10,2018-03-01T14:00:02.000Z,1023964,57542,666,3541,False
Джейк,2,18.03.04,"ДОБРЯК - О ЮТУБЕ,ДЕНЬГАХ,ЦЕНЗУРЕ и АНИМАТОРАХ/Мультервью[#1](Анимация)",22,2018-04-02T14:27:55.000Z,52866,5383,160,247,False
HINDALL,2,18.26.04,РОНАЛДУ О ПОБЕДЕ НАД БАВАРИЕЙ | БАВАРИЯ - РЕАЛ МАДРИД НОВОСТИ,17,2018-04-25T22:14:40.000Z,56451,1102,60,123,False
Гуфовский,2,18.11.06,МАЛЕНЬКАЯ ИНДИ-СТУДИЯ ELECTRONIC ARTS | E3 2018,20,2018-06-10T18:27:07.000Z,228873,34673,288,1224,False
Jofif ysdulc,2,18.14.04,Состоятельная невеста Гогена Солнцева оказалась актрисой,22,2018-03-26T13:43:24.000Z,30467,11,39,26,False
Russian YouTubers,2,17.30.12,МАРЬЯНА РО БЕРЕМЕННА! НОВЫЕ ФОТО С ЖИВОТОМ,22,2017-12-29T16:37:13.000Z,20761,874,77,216,False
Биатлон ТВ,2,18.08.01,БИАТЛОН. 07.01.18 Прямой Эфир. Эстафета. Мужчины,17,2018-01-07T14:35:03.000Z,20297,46,19,13,False
Mira One,2,18.20.02,ЧТО НОСИТЬ ВЕСНОЙ 2018?🌸ПОКУПКИ ОДЕЖДЫ | ЛУЧШИЕ ТРЕНДЫ,22,2018-02-19T12:22:38.000Z,20216,800,55,187,False
Лучшие и самые последние новости сериалов и фильмов,2,18.23.04,"Госпожа Фазилет и ее дочери 45 СЕРИЯ на русском языке, дата выхода.",1,2018-04-22T06:27:02.000Z,53459,85,12,21,False
Mark Markul,2,18.24.04,MARKUL — КОРАБЛИ В БУТЫЛКАХ,10,2018-04-23T11:54:32.000Z,395228,39803,3121,2353,False
TRUE DETECTIVE,2,18.09.02,"ПРЕСТУПНЫЙ ФИЛЬМ 2018 { ДЕТИ ВОРОВ } 2 СЕРИЯ. Русские детективы 2018 новинки, премьеры 2018 HD",22,2018-02-08T22:40:48.000Z,3917,29,5,1,False
Виктор ФЕДОРОВИЧ,2,18.06.01,АНДРЮЩЕНКО О ПУТИНЕ!!!,22,2018-01-05T12:17:50.000Z,12959,450,17,179,False
Иван Соловьев,2,17.21.12,Кабардино Балкария. Прыжок со скалы. Знакомство с лучшим ресторатором Краснодара.,22,2017-12-21T05:36:38.000Z,10286,25,14,12,False
Крик,2,18.10.06,100к На Канале! Ответы На Вопросы (анимация),22,2018-06-10T07:07:11.000Z,89649,9563,169,4557,False
NUR TV PRO,2,18.16.03,ЧИНОВНИКТЕР МЕНЕН МИЛИЦИЯГА БЕКЕР ДЕЙТ СОЙКУЛАР,22,2018-03-15T09:38:46.000Z,63461,123,162,167,False
Maxim Mernes,2,17.12.12,Crypto Boss 💰🌴 MAXIM MERNES 2.0 TRAILER Скоро будет разнос :D,28,2017-12-11T06:47:01.000Z,71989,43,215,83,False
Taraz Football,2,18.02.03,НОВЫЕ ФИНТЫ 2018,17,2018-03-01T18:00:01.000Z,12400,477,19,61,False
KURBONOV,2,18.03.06,"Мошинбозор 2018 / Нархи Трактор,Зил Камаз ва дигар мошинхо! (02.06.2018)",2,2018-06-02T19:41:42.000Z,13032,1033,28,120,False
Байки из Тьмы,2,18.02.02,"СТРАШНЫЕ ИСТОРИИ (3в1): 1.КОРЕНИХА, 2.ДОМ ПЕНСИИ, 3.ПОДВАЛЬНЫЙ ПЕРЕХОД",1,2018-02-01T17:30:01.000Z,2111,145,4,13,False
Хламурный Дом,2,17.21.11,"Ксения Бородина в прямом эфире о дружбе с Бузовой, Жужей, Пынзарь и др.",22,2017-11-20T05:22:10.000Z,6750,21,12,3,False
Frank Alvarez,2,17.27.12,Frank Álvarez - Entrenamiento y rodaje Escuela de especialistas,1,2017-12-26T08:57:43.000Z,28333,400,1,0,False
ROGOV LIVE,2,18.31.05,влог #10/2. В гостях у Рогова. Обзор гардероба. Обувь GUCCI YSL CHRISTIAN LOUBOUTIN PRADA,22,2018-05-31T00:04:15.000Z,21267,1241,52,201,False
Viacheslav Semenchuk,2,17.30.11,"Что такое токен BitCoen (от Рокфеллера, Эйнштейна и Фрейда)",22,2017-11-29T05:40:47.000Z,87696,1445,822,158,False
Vika Karter,2,18.13.03,ИВАНГАЙ ВЕРНУЛСЯ К ЭЛДЖЕЮ | ПЛАСТИЛИНОВЫЕ ТРЭШ ИГРЫ #4| ВИКА КАРТЕР,20,2018-03-12T13:00:06.000Z,58713,5769,136,878,False
Пожар в Кемерово 25 марта 2018,2,18.01.04,Востриков показывает машину жены после пожара в Кемерово,29,2018-03-31T16:54:21.000Z,6623,10,11,15,False
Mы United,2,18.18.02,Хаддерсфилд 0:2 Манчестер Юнайтед | Недоразгром,17,2018-02-17T21:25:01.000Z,4218,303,14,65,False
БУДУЩЕМУ БЫТЬ ТВ,2,18.08.02,Рейтинг Грудинина взлетел в 3 раза и обогнал Путина!,25,2018-02-07T03:00:01.000Z,25091,1494,32,260,False
Yana Stønewaalker,2,18.07.01,Yana Stonewalker / Coca -Cola Праздник к нам приходит ( COVER ),1,2018-01-06T06:32:48.000Z,165618,2114,7619,1625,False
Screen Junkies,2,18.07.03,Honest Trailers - Thor: Ragnarok,1,2018-03-06T18:00:00.000Z,1178642,50544,1015,6625,False
ME[NO]LIKE,2,18.30.04,"Такси 5 - плевок в лицо фанатам, или как уничтожить франшизу (обзор фильма)",1,2018-04-26T16:12:01.000Z,12199,266,29,93,False
ILand TV,2,18.07.01,Может ли Россия защитить базу Хмеймим?,25,2018-01-06T09:18:56.000Z,13353,53,26,41,False
Mozz Fifa,2,18.03.01,Самый читерский информ игрок FIFA 18,20,2018-01-02T20:36:17.000Z,28403,2772,36,115,False
Борис Фоминых,2,18.12.01,«Байкал-Энергия» Иркутск — «СКА-Нефтяник» Хабаровск,17,2018-01-11T13:05:08.000Z,14943,63,10,1,False
Русские мультфильмы,2,18.22.01,Сказочный Патруль - Серия 14 - Российский мультфильм о девочках-волшебницах,1,2018-01-21T10:10:13.000Z,18599,246,77,71,False
NickiMinajAtVEVO,2,18.05.05,Nicki Minaj - Chun-Li,10,2018-05-04T16:00:08.000Z,5294561,347658,22529,42155,False
oddlysatisfying videos,2,18.02.02,THE BEST LIKE A BOSS COMPILATION 😎😎😎 AMAZING 10 MINUTES 😁😵😲,24,2018-01-18T11:15:35.000Z,112472,526,53,43,False
NeuroTrend,2,17.22.12,Коммуникационная сеть Neurochat для общения силой мысли BCI,29,2017-12-21T07:52:30.000Z,239631,5504,656,592,False
Britain's Got Talent,2,18.30.04,FIRST LOOK: The weird and wonderful world of Baba Yega | BGT 2018,24,2018-04-28T09:00:03.000Z,257729,2883,597,0,True
nixelpixel,2,17.18.11,Менструальные чаши | nixelpixel,22,2017-11-17T10:27:58.000Z,140694,12425,1702,1380,False
ГОБЗ ШОУ,2,18.28.01,СМОТРИМ КЛИПЫ и ТАНЦУЕМ с Людмила ЛЮДМУРИК и Андрей ГОБЗАВР стрим ГОБЗ ШОУ GOBZAVR,24,2018-01-28T01:12:14.000Z,6765,0,0,5,False
KING'S PROD,2,17.17.12,"Артем Кинг - Пламя (Премьера клипа, 2017)",10,2017-12-16T05:28:36.000Z,82424,326,1286,162,False
Блокада,2,18.19.03,ВОРКУТА. Выборы без выбора.18/03/2018. Путин вместо Грудинина в аппарате для голосования!!!,25,2018-03-18T23:57:26.000Z,35446,0,0,828,False
Olga Sharij,2,18.15.03,Как украинцы в Польше Бандеру предали,25,2018-03-14T21:16:52.000Z,42513,5346,67,871,False
Lindsey Stirling,2,18.12.06,Stampede Trailer- Alexander Jean ft. Lindsey Stirling,10,2018-06-11T17:56:28.000Z,147522,11959,223,654,False
FreshLife28,2,18.05.03,гемоглобин. почему низкий и как повысить.,22,2018-03-04T19:32:22.000Z,4147,336,5,118,False
Мопс Официальный,2,17.20.11,Стрим МОПСА,23,2017-11-19T23:16:10.000Z,112248,4031,4853,206,False
SanGraf,2,18.27.03,Митинг 27.03.2018 Кемерово || Зимняя вишня,22,2018-03-27T03:47:59.000Z,22744,404,20,149,False
ПДСМ,2,17.24.11,Навальный качает права в Мюнхене,22,2017-11-23T07:03:58.000Z,128079,9255,7081,1018,False
EA SPORTS FIFA,2,18.10.06,FIFA 19 | Official Reveal Trailer with UEFA Champions League,20,2018-06-09T18:08:33.000Z,3366924,151342,6014,16118,False
Le na,2,18.09.01,ВЛОГ: ЛЮБОВНОЕ СООБЩЕНИЕ/ РОЖДЕСТВО/ ГОРЯЧАЯ ЗАКУСКА и САЛАТ за 5 мин Просто и Вкусно! 06-07.01.18,26,2018-01-08T18:49:03.000Z,8517,655,39,48,False
ИНТРИГИ - СКАНДАЛЫ - РАССЛЕДОВАНИЯ,2,18.10.05,Поведение Поклонской на инаугурации Владимира Путина стало мемом дня,25,2018-05-07T14:07:08.000Z,49076,253,95,269,False
DrakeVEVO,2,18.18.02,Drake - God’s Plan,10,2018-02-17T05:00:01.000Z,9528846,912443,6780,66263,False
Штаб в Тосно,2,18.31.01,Тосненский штаб о закрытии. Обращение к Навальному.,22,2018-01-30T13:11:18.000Z,268323,1212,6625,1229,False
MoMo,2,17.16.12,САМЫЕ УЖАСНЫЕ И СТРАННЫЕ ПОДАРКИ НА НОВЫЙ ГОД // МоМо,24,2017-12-15T13:00:03.000Z,7911,533,48,101,False
Dantekris TIME SHOW ツ,2,18.06.02,Я даже не знаю...,20,2018-02-05T20:39:54.000Z,8100,1124,19,141,False
Vedi TaroT,2,17.27.11,Его Мысли? Чувства? Намерения? - Общий расклад таро,22,2017-11-26T11:15:50.000Z,8190,445,24,109,False
Мария Соколова,2,18.30.03,ПОЧЕМУ Я ЗАВЕЛА КАНАЛ? / МАША СОКОЛОВА,17,2018-03-29T10:52:20.000Z,61115,10890,66,1999,False
AsapSCIENCE,2,18.17.05,Do You Hear Yanny or Laurel? (SOLVED with SCIENCE),28,2018-05-16T18:16:26.000Z,3852142,88289,3183,31092,False
Misty Voice,2,18.03.04,Хватит ограничивать возможности жизни | Садгуру,22,2018-04-02T09:30:04.000Z,18716,1220,17,55,False
Ed Sheeran,2,17.16.12,Ed Sheeran - Perfect Symphony (with Andrea Bocelli),10,2017-12-15T08:12:39.000Z,5988303,532902,5522,22643,False
Иван Зенкевич PRO автомобили,2,18.14.02,"ВАЗ 2101 & Москвич 415С | Копейка на прокачку – Тюнинг ВАЗ 2101 (Копейка, Пятерка) | Про Автомобили",2,2018-02-13T14:19:53.000Z,33579,3471,178,212,False
Алёшкин картон,2,17.29.12,Навальный: итоги предвыборной кампании,22,2017-12-28T07:45:52.000Z,210690,23702,21508,3022,False
NEWSBOX24.TV только горячие новости онлайн,2,18.12.01,"Твое лицо, когда ты случайно спалил БТР",25,2018-01-11T12:42:40.000Z,4493,60,1,33,False
Marina Freckle,2,18.17.03,Жесть на подъёмнике в Гудаури. Несчастный случай..,22,2018-03-16T10:16:32.000Z,662202,823,154,464,False
Uz MUSIQA TV,2,18.30.03,ДАХШАТ КЛИП ВА КУШИК  ХОТИН ХИЁНАТИ  ХАЁТИЙ ВА МАНОЛИ,10,2018-03-28T19:52:58.000Z,447914,8350,411,652,False
Кайф TV,2,18.23.04,лучшее из: полицейский с рублёвки 3 сезон 2 серия,22,2018-04-19T18:35:50.000Z,20451,138,8,0,False
История всего,2,18.31.05,Почему Германия проигрывала мировые войны ?,24,2018-05-31T13:13:02.000Z,55828,4392,105,1068,False
Вольнов Talks,2,18.28.03,Вольнов о цели звонков в Кемерово,22,2018-03-27T20:01:38.000Z,47080,2529,2466,1941,False
Misa Chan,2,18.10.05,Меня не принимают за мою религию ||Story Booth на русском|| Перевод и озвучка,24,2018-05-06T22:14:09.000Z,31563,800,37,135,False
WBRussia,2,18.15.03,Фантастические твари: Преступления Грин-де-Вальда - тизер-трейлер,1,2018-03-13T16:29:37.000Z,739231,14478,333,991,False
Начни С Себя,2,17.09.12,Россия будет Чемпионом мира по Футболу!,23,2017-12-08T07:16:58.000Z,82997,1703,1459,233,False
Mak,2,18.21.02,КАЖДЫЙ ШКОЛЬНИК ТАКОЙ 3,23,2018-02-20T14:00:42.000Z,630370,89942,3137,9952,False
G Film,2,18.02.05,СИДЕЛКА 12 СЕРИЯ - ПРЕМЬЕРА! / ЛУЧШАЯ МЕЛОДРАМА - 2018 новинка,1,2018-05-01T20:47:03.000Z,11440,67,4,11,False
Семья Фетистовых,2,18.28.01,Как справляемся с морозами// Семья Фетистовых,22,2018-01-28T03:08:27.000Z,1764,194,2,68,False
Chokoba1san,2,18.08.01,Player Two | Игрок Два [Русская Озвучка][Bastion Studio][Профессиональный Дубляж],24,2016-04-28T01:34:17.000Z,24967,16,10,5,False
Разумное рядом,2,18.05.02,Навальный нашел новых избирателей,22,2018-02-04T07:09:12.000Z,394440,8212,25583,5304,False
NILAMOP,2,17.20.11,№990: ОГРАБЛЕНИЕ ДОМА СОСЕДА В АНГЛИИ В ПРИВЕТ СОСЕД МОД КИТ(Hello Neighbor Mod Kit),20,2017-11-19T05:00:01.000Z,43036,415,30,80,False
Елена Морозова,2,18.13.01,Bass BPM,22,2018-01-12T17:01:36.000Z,19958,3,37,5,False
Иван Баев,2,18.20.02,"Банкетка и стремянка, два в одном.",26,2018-02-20T01:43:38.000Z,2427,308,0,117,False
Сейчас будет смешно!,2,17.09.12,"ТОП ШУТОК жюри КВН и Маслякова. Иногда они шутят смешнее команд. Лучшее, вошедшее в историю игры",23,2017-12-08T10:51:34.000Z,8326,319,13,62,False
TongTongTv 통통영상,2,17.21.12,"[SHINee 종현 발인] '음악에 열정 넘쳤던 가수' 영면…동료들 마지막 길 눈물로 배웅 (샤이니, JONGHYUN)",24,2017-12-21T00:15:04.000Z,2260491,52836,998,6661,False
MMA KAZAKHSTAN,2,18.22.02,ДЕТИ РАМЗАН КАДЫРОВА ОТВЕТИЛИ КАЗАХСКОМУ МАЛЬЧИКУ,17,2018-02-21T08:32:48.000Z,328067,4797,822,1402,False
Игровой канал HALO,2,18.27.03,"ШОК!!!НА САМОМ ДЕЛЕ ПОГИБШИХ В КЕМЕРОВО В РАЗЫ БОЛЬШЕ ,ЧЕМ ПОКАЗЫВАЮТ ПО ТЕЛЕВИДЕНИЮ!",20,2018-03-26T19:40:26.000Z,36161,1151,284,468,False
Телеканал ICTV,2,18.17.02,Антизомби — выпуск от 16.02.2018,25,2018-02-16T19:25:26.000Z,59685,2668,87,604,False
MultiFiks,2,18.09.03,УГАДАЙ ПЕСНЮ ЗА 10 СЕКУНД | ХИТЫ 2018-РУССКИЕ| ЯНВАРЬ - МАРТ |,24,2018-03-08T16:14:15.000Z,5302,216,8,32,False
chukkie tykunez,2,17.28.12,Siri can't keep up,23,2017-02-21T06:44:29.000Z,30686,10,155,27,False
Vladimir Galimov,2,18.09.05,Она не продукт. Почему Медведева ушла от Тутберидзе? Матч ТВ,22,2018-05-08T08:48:30.000Z,115199,1256,147,368,False
Rinaice,2,18.18.02,ЮРИ!!! НА ЛЬДУ и День Святого Валентина (КОНЁК TV),22,2018-02-17T17:04:49.000Z,4198,1105,3,190,False
Йошкин Кот,2,18.27.03,Фотографии из згоревшего ТЦ Зимняя Вишня Кемерово.,22,2018-03-26T18:57:34.000Z,25174,57,46,18,False
VOLKOFRENIA,2,18.08.01,РОЖДЕСТВЕНСКИЙ МАРАФОН! ПОЕХАЛИ! 🔥 PUBG В 1440p,20,2018-01-08T08:57:07.000Z,36365,2211,162,3,False
Hamaha Биткоин трейдеры на бирже криптовалют,2,18.17.01,"Биткоин, запомните этот прогноз!",27,2018-01-16T10:40:40.000Z,90985,3880,152,568,False
Lesha Suvorov,2,18.29.01,ИЛЬЯ БЕЛОВ И КАТЯ ВЭСТВУД ВМЕСТЕ УГАДЫВАЮТ БЛОГЕРОВ ПО EMOJI-СМАЙЛИКАМ,24,2018-01-28T11:18:51.000Z,33046,3394,97,176,False
Правда ТВ,2,18.21.03,Пророчество = Бог даст смерть антихриста Путина от Царя Руси в 2018 году.,27,2018-03-16T00:10:26.000Z,5193,131,16,48,False
Новости Дагестан,2,18.17.01,Новости Дагестан за 16.01.2018 год,25,2018-01-16T17:24:43.000Z,3255,313,2,41,False
Lola Kl.,2,17.15.12,Как это понимать?,22,2017-12-14T13:20:52.000Z,4263,184,16,107,False
Dasha Day,2,18.14.01,"Юлий Онешко, это видео для тебя",22,2018-01-13T07:26:04.000Z,223493,2547,99863,9090,False
РИА Новый День,2,18.14.02,"Близкие убитых в Сирии бойцов ЧВК «Вагнера» рассказали, как убивали их родных",25,2018-02-13T13:44:12.000Z,174420,2257,1303,3279,False
Kolj Mot,2,18.27.04,Сиделка 1 серия (2018) фильм мелодрама сериал НОВИНКА,24,2018-04-23T20:12:00.000Z,55170,145,24,4,False
РГВК Дагестан,2,18.20.01,В отношении мэра Махачкалы возбуждено уголовное дело о превышении должностных полномочий,25,2018-01-19T11:21:46.000Z,7781,77,2,29,False
Нет застройке без согласия,2,17.14.11,"РПЦ незаконно строит храм, полиция смотрит как бьют местных жителей",22,2017-11-13T06:29:09.000Z,97006,2259,330,887,False
Akemi Time,2,18.16.05,MATRANG - Медуза (школьная пародия),22,2018-05-15T11:43:57.000Z,67408,5680,339,1190,False
Mr Tigasim,2,18.01.04,Кто ты Игорь Востриков из Кемерово??????????,10,2018-03-31T11:44:55.000Z,394079,3286,8400,2468,False
FC Barcelona,2,18.08.03,FULL MATCH | #SupercopaCAT: FC Barcelona - RCD Espanyol (4-2),17,2018-03-07T20:42:28.000Z,1530449,27629,978,144,False
Первый Тульский,2,18.11.06,В Грузии из выброшенных на свалку яиц вылупились сотни цыплят,29,2018-06-10T12:50:07.000Z,399583,1703,74,506,False
Chronoscope,2,18.07.02,"Первые часы в космосе! Юра, мы исправляемся!",26,2018-02-06T07:24:59.000Z,452032,47,89,43,False
Journalist Today,2,18.10.05,9 мая в Киеве подрались возле Парка Вечной Славы,22,2018-05-09T12:47:03.000Z,88066,425,114,997,False
Sonchyk,2,17.21.12,Игровые педали по цене жигуля на максималках - обзор Fanatec ClubSport Pedals V3 inverted,22,2017-12-20T11:13:54.000Z,65614,3820,143,335,False
SPGOALS TV,2,18.01.04,Crystale Palace VS Liver pool  1-2 All Goals ⚽ Highlights 31/ 03/ 2018 HD⚽,17,2018-03-31T13:48:34.000Z,689113,2525,301,212,False
Sonata312,2,18.13.03,Гамбол и Пенни 1-ый поцелуй | Удивительный мир Гамбола,1,2018-03-12T10:28:43.000Z,15467,293,23,61,False
ZBS67,2,17.22.12,ЗБС - Хайпанем (Официальное Видео),22,2017-12-21T08:21:23.000Z,226763,7131,9937,971,False
Канал Надежды: понятно о непонятном,2,18.14.01,"ФИКС ПРАЙС КРУТЫЕ НОВИНКИ / ЯНВАРЬ 2018 / посуда, одежда, бытовая химия",22,2018-01-13T17:17:49.000Z,2795,96,8,36,False
Maugly,2,17.11.12,ОБЪЯСНЕНИЕ КОНЦОВКИ И МОЕ МНЕНИЕ ОБ ИГРЕ - ПРИВЕТ СОСЕД (прохождение финал Hello Neighbor) #66,20,2017-12-10T01:37:30.000Z,22143,773,19,190,False
AtmosferaSchastya,2,18.08.01,👍👍👍 КРУТЫЕ НОВИНКИ Fix Price | Покупки ФИКС ПРАЙС ЯНВАРЬ 2018,22,2018-01-07T13:13:31.000Z,8862,356,26,55,False
БОРИС ГРИМ и БРАТЬЯ ГРИМ,2,17.19.11,Борис Грим и Братья Грим - Самара (Премьера клипа 2017),10,2017-11-18T05:41:49.000Z,138962,1661,912,496,False
Вовремя,2,17.21.11,"Гоголь в чате. Господин, товарищ, барин.",23,2017-11-20T14:27:31.000Z,3599,303,6,23,False
zakadrom,2,18.03.01,С НОВЫМ ГОДОМ СУРГУТ! С НОВЫМ ГОДОМ РОССИЯ!,1,2018-01-02T16:37:03.000Z,4716,151,3,6,False
Vasili Azmaiparashvili,2,18.17.03,კატასტროფა გუდაურში საბაგიროზე Accident in ski lift Gudauri Georgia,25,2018-03-16T10:40:29.000Z,1003055,1061,324,611,False
супер Серж,2,18.12.02,Взлёт самолёта Ан-148 Орск-Москва!,22,2017-08-01T19:29:18.000Z,78319,679,491,0,True
Rakamakafo,2,18.08.06,Триллер в реальной жизни / ПСИХ С ОГНЕТУШИТЕЛЕМ,24,2018-06-07T15:58:58.000Z,121635,14795,1293,1035,False
ПАНК ШОУ,2,18.15.03,Дохлая баба,22,2018-03-14T17:21:57.000Z,93143,5872,740,332,False
OPERINA,2,17.03.12,Rockstar - Post Malone x 21 Savage | СОПРАНО КАВЕР (by Operina),10,2017-12-02T11:30:01.000Z,19817,2126,308,319,False
Смешные Видео,2,18.22.02,Реклама ДНС,22,2018-02-21T07:28:25.000Z,39120,955,604,467,False
Луиис,2,18.16.01,СЕРГЕЙ СЕМЕНОВ И ДИАНА ШУРЫГИНА ПУСТЬ ГОВОРЯТ! Встретились в прямом эфире ?,20,2018-01-15T11:59:11.000Z,82127,2782,338,543,False
Рыбалка в Устюге,2,18.09.05,Красивое поздравление С 9 МАЯ!С Днем Победы!,26,2018-05-08T21:05:46.000Z,27996,281,32,28,False
ChingizVideoChannel,2,18.04.02,Гассиев уничтожил Дортикоса 12 РАУНД! 04.02.2018,22,2018-02-03T23:13:32.000Z,33261,536,44,153,False
Toyota Russia,2,18.06.02,Toyota:  #cовершайневозможное,2,2018-02-05T07:37:27.000Z,585310,2154,1680,0,True
КОМЕДИАНТ,2,18.27.03,ПОЖАР В КЕМЕРОВО - ЛЮДИ В ОГНЕ,29,2018-03-26T10:47:06.000Z,157281,759,234,326,False
Egyptian Arts Group,2,18.03.06,مسلسل رحيم الحلقة 18 الثامنة عشر - بطولة ياسر جلال ونور | Rahim series - Episode 18,24,2018-06-02T23:13:10.000Z,802249,6422,573,1145,False
Юлианна Кобцева,2,17.29.12,Лучший подарок на Новый Год 2018. Муж в шоке!,23,2017-12-28T11:17:42.000Z,359509,6919,6810,1058,False
Purple Unknown,2,18.23.02,y u [ 8 6 ],24,2018-02-22T20:18:11.000Z,9052,1518,54,180,False
Другая Кухня,2,18.01.05,"Я просто взяла манку, добавила муки, воды и получилась. Самая слоеная лепешка в мире!",22,2018-05-01T03:00:01.000Z,4198,415,6,24,False
Антон Долгих,2,18.28.03,Кемерово. Митинг. Игорь Востриков. 27.03.2018,25,2018-03-27T10:50:18.000Z,50994,757,24,265,False
НОВОСТИ ЗНАМЕНИТОСТЕЙ,2,18.28.01,ВЕСЬ ИНТЕРНЕТ В ШОКЕ! Татьяна Навка опубликовала нелепое фото Аллы Пугачевой,24,2018-01-27T16:00:04.000Z,10568,22,17,16,False
Russian Top,2,18.02.02,ТОП 20 русских песен (1 февраля 2018),10,2018-02-01T15:42:47.000Z,10583,444,12,70,False
Dasha Tsenter,2,17.30.12,Русский предприниматель в Нью-Йорке | Dasha Tsenter,22,2017-12-29T17:19:18.000Z,29494,3157,29,126,False
AniJoy,2,18.09.02,Невероятно Эпичные Фэнтези Аниме 2018 Года!,22,2018-02-09T04:00:01.000Z,1999,198,3,22,False
404 Funny Moments,2,18.07.01,Приколы с котами - ТОПовая подборка! #116,15,2018-01-06T11:19:25.000Z,12482,367,26,188,False
SportsNews Go,2,18.26.02,РОССИЯ - ГЕРМАНИЯ (4-3) Хоккей ФИНАЛ ЗОЛОТО! /Олимпиада 2018/ Все голы/ + немецкие комментаторы!),17,2018-02-25T07:10:01.000Z,94040,1019,123,462,False
Ваш Мир,2,18.04.04,Запретный плод 3 серия русские субтитры новый 2018 г,1,2018-04-03T11:21:47.000Z,12402,213,10,35,False
Faine video,2,18.08.03,"Поздравления С 8 Марта,8 марта,открытки с 8 марта,С 8 Марта,8 марта картинки, Стихи На 8 Марта",22,2018-03-07T15:41:51.000Z,47273,146,31,2,False
Nepeta Story,2,18.14.04,Страшилка от Баку: Дух исполнения желаний приди! Nepeta Story,22,2018-04-14T04:51:02.000Z,130368,13761,325,2326,False
Асалча Марям,2,18.25.02,ЗА ЧТО МОСКВИЧКА ИЗБИЛА МАДИНУ !,22,2018-02-24T23:34:58.000Z,6000,451,63,244,False
Почитатели Фемиды,2,17.21.12,Спасать Анапу уже поздно!,22,2017-12-20T09:05:11.000Z,91249,1709,77,286,False
Павел Перец,2,18.08.02,ПБ 31 Как живется русской во Франции: тур в Париж,22,2018-02-07T19:19:59.000Z,4030,465,16,114,False
strikerperm,2,18.27.03,МИТИНГ В КЕМЕРОВО 27 марта 2018 [1],23,2018-03-27T03:03:08.000Z,46144,446,46,158,False
Glamour Russia,2,17.23.11,"МОТ и МАША МЕЛЬНИКОВА: 9 фактов, которые вы не знали о них",24,2017-11-22T12:43:38.000Z,18516,344,10,9,False
XALUS,2,18.31.01,ПРИВЕТ! ЭТО МОЙ КАНАЛ!,22,2018-01-30T13:18:49.000Z,106102,16160,104,488,False
TAuMCKBEP,2,18.12.05,ТАйМСКВЕР - Мой серый город (Official video),10,2018-05-11T18:17:55.000Z,53059,8319,562,721,False
ExperT-2020,2,18.02.03,Дебаты 01.03.2018. Россия 24. Собчак и Жириновский опять устроили скандал.,25,2018-03-01T19:05:32.000Z,7584,35,19,77,False
25 часов в сутках,2,18.06.03,"7 очень полезных БЫТОВЫХ ПРИБОРОВ, которые облегчают жизнь | 25 часов в сутках",26,2018-03-05T23:06:02.000Z,1747,217,3,21,False
Katya Lel,2,17.18.12,Катя Лель - Я не могу без тебя (Премьера клипа 2017),10,2017-12-17T06:59:37.000Z,108497,9318,1265,617,False
Крутой БОЕВИК 2016.,2,17.12.12,ОТЛИЧНО! СУПЕР! БОЕВИК 2017 Изверг РУССКИЕ ФИЛЬМЫ об ОСБ,1,2017-12-11T12:00:01.000Z,84707,152,38,11,False
ТолькоХитовые Новинки,2,17.18.12,"ПРЕМЬЕРА 2017 МАМА ВОЗЬМИ ВИНУ НА СЕБЯ СЕЛА ЗА СЫНА 2 Русские мелодрамы 2017 новинки, сериалы 2017",22,2017-12-17T14:20:42.000Z,22556,129,30,59,False
Iren Vladi,2,18.19.01,Я ОПЯТЬ ЗА СВОЁ. НОВОЕ ОБУСТРОЙСТВО КУХНИ.,22,2018-01-18T14:22:46.000Z,23270,1987,117,131,False
Философ Павел,2,18.06.05,"МИТИНГ 5 МАЯ В ПИТЕРЕ, МНОГО ЛЮДЕЙ И ЛОЗУНГОВ!",22,2018-05-05T14:25:30.000Z,116143,2147,4529,1367,False
Telegram Messenger,2,18.01.05,"Трансляция митинга против блокировки Telegram (Проспект Академика Сахарова, Москва)",25,2018-04-30T14:11:29.000Z,45429,2671,2249,224,False
Мастер Торт,2,18.15.01,Бесплатный вебинар: Бесплатный вебинар Легкий «йогуртовый» торт и зимний декор!,22,2018-01-14T20:20:07.000Z,5314,238,10,4,False
ТОЧКА ЗРЕНИЯ,2,18.24.01,Цимбалюк заткнул куклу путина. Абрамсы заправим и ракету направим на Москву.,25,2018-01-23T12:15:44.000Z,335225,4634,5350,3193,False
Спортивный Мир,2,18.01.01,● ХАБИБ НУРМАГОМЕДОВ ПРОТИВ ЭДСОНА БАРБОЗЫ ● КИБОРГ ПРОТИВ ХОЛЛИ ХОЛМ ● ТРАНСЛЯЦИЯ БОЯ,17,2017-12-31T08:55:33.000Z,109648,674,86,111,False
Юрий Корнеев,2,18.04.03,1 канал Юрий Корнеев - Павел Грудинин наш президент,29,2018-03-03T19:21:59.000Z,6826,944,1492,215,False
Kirill Babiev Rock Covers,2,17.28.12,Би-2 Feat. Oxxxymiron - Пора возвращаться домой (cover by Таймсквер),10,2017-12-27T12:22:09.000Z,362361,13227,3580,784,False
Cardi B,2,18.22.05,Cardi B - Be Careful [Official Video],10,2018-05-21T14:01:34.000Z,3985008,296917,13390,29827,False
Коллекция Рецептов,2,17.17.12,10 ГОРЯЧИХ БЛЮД НА НОВЫЙ ГОД 2018,22,2017-12-16T16:32:04.000Z,12402,1165,29,93,False
Джи Фильм,2,18.04.05,СИДЕЛКА 16 СЕРИЯ - ПРЕМЬЕРА! / ЛУЧШАЯ МЕЛОДРАМА - 2018 новинка,1,2018-05-03T20:49:01.000Z,47011,308,52,55,False
O'zMTRK O'zbekiston milliy teleradiokompaniyasi,2,18.11.03,O`zbekiston va Tojikiston san`at ustalari ishtirokidagi «Do`stlik kechasi» nomli konsert dasturi,25,2018-03-10T11:11:49.000Z,29466,766,27,141,False
КиноБазар,2,17.23.11,"ПРЕМЬЕРА 2017 ПЛЕНИЛА СЕРДЦА ЗРИТЕЛЕЙ [ ПОДЛЫЙ ОТЕЦ ] Русские мелодрамы 2017 новинки, фильмы 2017",22,2017-11-22T17:43:11.000Z,53969,164,53,6,False
Clash of Clans,2,17.20.12,Clash of Clans: Santa's Surprise Spell (Clashmas 2017),20,2017-12-19T08:00:37.000Z,1630872,26853,1187,624,False
Mansur RichTV,2,18.17.03,полное видео Смертельный отдыха / страшно смотреть,22,2018-03-16T12:05:29.000Z,172026,294,164,370,False
ХАЙПОВОСТИ,2,17.25.11,Хайповости патриотические,22,2017-11-24T05:00:02.000Z,118191,4307,738,649,False
releips007,2,17.25.12,Навальный.Предвыборная  пресс - конференция 24. 12. 2017,22,2017-12-24T16:12:18.000Z,44090,2809,12457,555,False
Hamnavo,2,18.24.03,ГУШТИН | Набимуҳаммад Хоркашов (Қисми 1),22,2018-03-23T14:50:40.000Z,52673,1886,98,182,False
Алло,2,18.31.05,Все про Xiaomi Mi 8/Mi 8 SE и Mi Band 3 с NFC,28,2018-05-31T11:21:21.000Z,39685,1444,127,326,False
Championika,2,18.08.02,Почему Россия точно выиграет ЧМ-2034,17,2018-02-07T06:48:44.000Z,109763,0,0,0,True
Rona Official,2,17.15.11,RONA - Дом [Official video],10,2017-11-14T07:56:37.000Z,181785,375,1972,263,False
VIDEO TRENDS,2,18.12.01,Диана Шурыгина об освобождении Сергея !,22,2018-01-11T14:13:09.000Z,26822,21,181,14,False
Александр Жестков,2,18.26.03,Кемерово Зимняя вишня пожар 25.03.18. Люди прыгают из окон.  Видео изнутри. Репортаж очевидца,25,2018-03-25T16:51:53.000Z,4609,18,2,6,False
Анекдоты от Эдуарда.,2,18.16.01,Нападение на школу в Перми! Задержание одного из нападавших!,29,2018-01-15T08:20:30.000Z,5197,5,5,16,False
Vadim Rash,2,18.22.04,УРАГАН В МОСКВЕ / ПОСЛЕДСТВИЯ / 21.04.2018,22,2018-04-21T15:26:22.000Z,153739,855,2158,951,False
Free Tv Shows,2,17.30.12,Черная жемчужина/Siyah ini 14 серия русские субтитры ПОДПИШИСЬ И ПЕРВЫМ УВИДИШЬ НОВИНКИ,22,2017-12-29T10:07:11.000Z,57824,321,67,38,False
NEWS HD,2,18.05.03,Новости РЕН ТВ 05.03.2018 Утренний Выпуск 05.03.18,25,2018-03-05T02:11:55.000Z,10994,73,33,15,False
Паша Игроман,2,17.28.11,Подарю  IPhone X первым 10 подписчикам!,22,2017-11-27T05:57:11.000Z,132552,0,0,639,False
Neutral News,2,18.28.03,"Горы обожженных тел: стало известно, как сгорели дети в ТРЦ Кемерово",22,2018-03-27T09:01:16.000Z,218479,848,119,225,False
Это стоит увидеть,2,18.16.01,"ПРЕМЬЕРА 2018 РВАНУЛА В ЮТУБЕ [ ВТОРАЯ ЖЕНА ] Русские мелодрамы 2018 новинки, фильмы 2018 HD",22,2018-01-15T15:06:39.000Z,83952,241,61,21,False
Arina SL,2,18.16.04,АСМР/ASMR Триггеры/ Итинг/ Первое видео на Blue Yeti/ Eating/ Triggers,22,2018-04-15T19:13:23.000Z,20655,1634,65,533,False
Sergei Sorokin,2,17.03.12,Щука на Балансир | Первый Лед | Зимняя Рыбалка 2017-2018,26,2017-12-02T12:37:17.000Z,4318,406,3,109,False
ЛСП / LSP / Official Fan Channel,2,18.05.01,ЛСП - Tragic Tour | Москва 2017 + Backstage,10,2018-01-03T19:37:01.000Z,28918,1528,9,171,False
LAmobile - аксессуары для мобильных устройств,2,17.07.12,Дешевые гироскутеры-убийцы,22,2017-12-06T07:04:14.000Z,87190,2823,1248,170,False
М 605,2,18.28.03,"ПУТИН В КЕМЕРОВО, ЧТО ОН СКАЖЕТ ?",22,2018-03-27T05:42:29.000Z,96051,280,257,0,True
Все о Звездах,2,18.18.03,Ольга Бузова закатила скандал жене Мота из за Тарасова,22,2018-03-17T13:00:03.000Z,16600,92,31,32,False
ТРЕНДЫ и ХАЙПЫ,2,17.17.11,ДИЗАЙНЕР ИДИОТ?!,24,2017-11-15T16:30:00.000Z,30296,439,84,70,False
Global Info,2,18.04.04,Следователи обнаружили высоковольтные провода в батутном зале «Зимней вишни»,25,2018-04-03T10:30:52.000Z,39212,191,144,286,False
Sasha Lee,2,17.21.11,"РЕАКЦИЯ КОРЕЯНОК НА FEDUK&ЭЛДЖЕЙ, FACE 🇰🇷| Бургер, Розовое вино",22,2017-11-20T14:08:42.000Z,200954,5533,280,808,False
ImagineDragonsVEVO,2,18.22.02,Imagine Dragons - Next To Me (Audio),10,2018-02-21T17:00:00.000Z,1313820,151065,1567,11847,False
НХЛ,2,17.20.11,Кессел и Бучневич возглавили топ-10 голов недели,17,2017-11-19T02:10:30.000Z,6958,23,2,1,False
Mikey Smalling,2,17.29.11,Дзюба наступил на шарф Спартака. Спартак - Зенит 27.11.2017,17,2017-11-28T10:13:05.000Z,86230,438,208,174,False
Skifolk,2,18.10.03,💀PUBG ► МАРАФОН 24ч+ ТОЛЬКО PUBG! БЕЗ ПЕРЕРЫВОВ! ВЫЖИВЕТ ЛИ?,20,2018-03-08T10:03:17.000Z,98196,6057,340,1,False
Dani Ochoa,2,18.12.01,Imperial March played on pencil,22,2018-01-11T06:44:58.000Z,117648,5896,80,160,False
New Russian Rap,2,18.13.05,ВСЕ ИЩУТ ЭТУ ПЕСНЮ !!!,10,2018-05-12T06:34:32.000Z,107161,2847,205,160,False
Домашний Очаг с Мариной,2,18.22.02,Что делать со старыми вещами ? ЭТО ОЧЕНЬ ВАЖНО !,26,2018-02-22T03:33:51.000Z,1440,128,16,21,False
Sanchez69full,2,18.26.05,S.T.A.L.K.E.R.: DEAD AIR[ЗБТ] - 36 часов,20,2018-05-25T22:49:27.000Z,38371,2039,77,2,False
CelineDionVEVO,2,18.04.05,Céline Dion - Ashes (from the Deadpool 2 Motion Picture Soundtrack),10,2018-05-03T12:45:00.000Z,3537505,120239,2514,9908,False
Болт,2,18.27.02,Новая мастерская и ТОКАРНЫЙ СТАНОК 1В62Г,2,2018-02-26T18:05:05.000Z,10250,720,30,149,False
"Hair Restoration Laboratories, LLC",2,17.18.12,The best shampoo for hair regrowth.  Hair Restoration Laboratories DHT Blocking Shampoo.,22,2017-12-16T23:57:36.000Z,16015,1155,52,0,True
GymFit INFO,2,18.03.06,"3 Правила, Которые Нужно Знать! (ЕСЛИ ТЫ НАЧИНАЕШЬ ЗАНИМАТЬСЯ!)",17,2018-06-02T15:17:14.000Z,25072,1645,22,68,False
Mariya_Sanzashi,2,17.21.11,В МАРКО таится ЗЛО?! (моя безумная теория) | Стар Против Сил Зла,22,2017-11-20T13:35:14.000Z,7952,492,25,183,False
Victor Aristov,2,18.02.01,Новогодний подарок от Порошенка шокировал всех,25,2018-01-01T15:35:22.000Z,85523,518,263,325,False
FollowMeTo,2,17.28.12,#FollowMeTo Bangkok,22,2017-12-27T05:18:47.000Z,167186,2859,423,129,False
soheib Mix,2,18.08.06,صدقني ستضحك رغما عنك مهما كان مزاجك سيئ !! مقالب أجنبية مضحكة,23,2018-06-07T18:41:50.000Z,1482705,5252,1454,545,False
THE BOYZ,2,17.18.12,THE BOYZ(더보이즈) `소년(BOY)` M/V Teaser #01,24,2017-12-01T09:00:02.000Z,192273,0,0,882,False
Лазарев Сергей Николаевич,2,17.26.11,Как влияют на жизнь и здоровье человека глубинные эмоции из прошлого?,22,2017-11-25T18:00:01.000Z,4156,283,1,4,False
Dima Chistov,2,17.31.12,Dima Chistov - Everybody's Changing (Keane cover),10,2017-12-30T11:49:12.000Z,323266,635,3739,502,False
Yazgı ZagroS,2,18.04.01,Youtubede İlk Videom :),20,2017-12-09T17:17:49.000Z,69118,184,416,186,False
v serukanov,2,17.25.12,Ответ старику Навальному,22,2017-12-24T05:38:15.000Z,319320,5702,25221,3641,False
СуперКот,2,18.29.04,КАК АКТИВИРОВАТЬ ЗВОНКИ В ВК!,24,2018-04-28T13:24:45.000Z,37154,1343,1695,224,False
Alina Gingertail,2,18.25.01,The Parting Glass - Assassin's Creed IV Black Flag (Gingertail Cover),10,2018-01-24T12:09:16.000Z,60162,12606,53,771,False
YuEl.81,2,18.13.01,Fedaye Lacının bacısı usyan etdi! Meni daha toylara cagırmırlar!,24,2018-01-12T14:07:52.000Z,79432,614,74,211,False
MarilynMansonVEVO,2,18.23.03,Marilyn Manson - Tattooed In Reverse (Music Video),10,2018-03-23T04:00:03.000Z,86901,13687,143,1547,False
Никита Петряев,2,18.23.01,НИКОГДА НЕ ЗАКАЗЫВАЙТЕ ЭТО В МАКДОНАЛЬДС,24,2018-01-22T13:53:12.000Z,23402,939,81,145,False
Клипы Шансона,2,18.08.03,ЛУЧШАЯ ПЕСНЯ НА 8 МАРТА! ДОРОГИХ ЖЕНЩИН С ПРАЗДНИКОМ,1,2018-03-07T12:33:45.000Z,261006,2563,173,39,False
ВЕСТИ СЛАВЯН,2,18.12.02,Огненный шар: Катастрофу Ан-148 сняла камера видеонаблюдения,22,2018-02-11T20:55:27.000Z,14468,21,26,17,False
BALMAY PRODUCTION,2,17.29.11,Әбри Хәбриев - Урталайга бүлдем / BALMAY PRODUCTION / 2017,10,2017-11-28T16:25:26.000Z,4944,148,26,24,False
ЕвгенБро,2,17.20.11,КАК СКРАФТИТЬ ГРАВИТИ ФОЛЗ ? КАК ПОЛУЧИТЬ СЕКРЕТНЫЕ ПРЕДМЕТЫ В MINECRAFT Защита нуба Для детей KIDS,20,2017-11-19T06:46:19.000Z,254515,18711,1634,1151,False
Канал Лучших Приколов,2,18.27.02,"СМЕШНЫЕ МОМЕНТЫ, НОВЫЕ ПРИКОЛЫ 2018, ЛУЧШИЕ РУССКИЕ ПРИКОЛЫ",23,2018-02-26T18:11:02.000Z,8115,178,29,27,False
Шапуля,2,18.05.04,ПРО ТОКИЙСКИЙ ГУЛЬ !  feat Dobryak .  3 сезон,22,2018-04-04T09:56:43.000Z,333212,40237,1638,4532,False
РБК Autonews,2,17.19.11,Сравниваем старый с новым. Тойота Ленд Крузер Прадо. Обзор и тест-драйв,2,2017-11-18T12:36:19.000Z,6459,42,26,11,False
Dezznot ЛУЧШИЕ ПРИКОЛЫ,2,18.26.02,Хоккеисты поют гимн России ОЛИМПИАДА 2018 ЗОЛОТО,24,2018-02-25T07:46:52.000Z,348590,3702,531,898,False
ScienceVideoLab,2,17.20.12,Александр Соколов. Было ли иго? Разбор ролика Данилы Поперечного,28,2017-12-19T08:12:36.000Z,63881,8975,275,2407,False
Time Knockout,2,18.06.04,ЗА ЧТО ХАБИБ НУРМАГОМЕДОВ УДАРИЛ ИСЛАМА БАДУРГОВА,17,2018-04-05T14:16:35.000Z,38042,396,82,516,False
Fonzy Time,2,18.19.03,Что это было?выборы 2018 участок 4416,20,2018-03-18T06:41:43.000Z,652642,5587,8762,2484,False
IC3PEAK,2,18.04.04,IC3PEAK - THIS WORLD IS SICK,10,2018-04-03T16:17:13.000Z,64809,4553,941,450,False
Sonya Timak,2,17.19.11,Chime meme collab,1,2017-11-18T15:34:42.000Z,3992,636,9,130,False
Oleksandr Yushchenko,2,17.18.12,НЕОЖИДАНAОЕ ПОЯВЛЕНИЕ DIZASTER НА КОНЦЕРТЕ ОКСИМИРОНА В КИЕВЕ!!!! + СОВМЕСТНЫЙ ТРЕК!!!! 2017!!,23,2017-12-17T01:06:29.000Z,283250,5291,1294,713,False
FreeDawkins,2,18.04.06,Golden State Warriors vs Cleveland Cavaliers Full Game Highlights | Game 2 | 2018 NBA Finals,17,2018-06-04T02:43:10.000Z,177670,1440,114,515,False
URMAN,2,18.03.03,"Многоквартирный или  частный дом, что выбрать ?",22,2018-03-03T03:54:11.000Z,896,0,0,0,True
ВОЕННОЕ КИНО ВОЕННЫЕ ФИЛЬМЫ !,2,18.29.05,Русские Боевики ПОБЕГ ИЗ КОЛОНИИ Детективы Криминальные Фильмы Военное Кино HD Video !,1,2018-05-28T09:00:08.000Z,191311,0,0,0,True
Kash,2,17.03.12,РУКИ-БАЗУКИ СКОРО АМПУТИРУЮТ? СИНТОЛОВЫЙ КАЧОК КИРИЛЛ ТЕРЕШИН ДОИГРАЛСЯ...,24,2017-12-02T13:50:13.000Z,50406,4162,210,876,False
Татар-информ,2,18.13.01,"Появилось видео из изолятора, где содержится предполагаемый убийца нижнекамки Гульшат Котенковой",29,2018-01-12T12:56:03.000Z,55490,50,281,130,False
Заветы Каутского,2,18.29.03,Александр Невзоров - Интернет-скорбь неплохо монетизируется... 28.03.18 /Невзоровские среды/,29,2018-03-28T19:37:17.000Z,10682,105,14,22,False
Mrs. Marple,2,18.02.05,Mrs. Marple | Lil: «С Virtus.pro мы даже не здороваемся на турнирах».,20,2018-05-01T19:47:55.000Z,104299,7833,323,947,False
NickyJamTV,2,18.26.05,Live It Up - Nicky Jam feat. Will Smith & Era Istrefi (2018 FIFA World Cup Russia) (Official Audio),10,2018-05-25T04:00:21.000Z,4673846,120940,22320,18984,False
UATV Russian,2,18.14.05,Финал Евровидения-2018,25,2018-05-13T12:09:06.000Z,43443,145,95,0,True
Its' M,2,17.30.11,САМОДЕЛЬНАЯ ПУШКА ИЗ ШПРИЦОВ И КОЛЫ!,22,2017-11-29T10:29:15.000Z,98343,12147,464,1461,False
Ezdi Channel,2,18.03.03,"Կարմիր բլուր, Սերիա 40,Red Hill / Karmir blur",10,2018-03-02T20:39:57.000Z,14728,74,18,0,True
Капа & Lady Diana,2,17.29.12,Капа НЕВЕСТА! Кто Жених! Диана учит танцы Серия 6,24,2017-12-28T07:35:57.000Z,515440,14793,1283,3189,False
WoT Fan - развлечение и обучение от танкистов World of Tanks,2,17.09.12,"Новогодний подарок, флаги на танках и альфа тест Калибра - Танконовости №168",20,2017-12-08T11:40:03.000Z,122179,4224,318,1755,False
RU HD 2017,2,17.10.12,Церемония награждения Алина Загитова и Мария Сотскова Гимн России,17,2017-12-09T11:41:10.000Z,15083,241,5,67,False
Роман Шевырин,2,18.26.02,Российские хоккеисты спели гимн России на награждение. Олимпиада 2018,22,2018-02-25T08:22:28.000Z,47496,418,157,208,False
Мс Ой Всё,2,18.27.03,Число погибших более 350 в Кемерово (записи) зимняя вишня. С места событий,22,2018-03-26T15:42:55.000Z,81137,750,110,246,False
Домашнее,2,18.26.03,Премьера 2018! Стилист - Русские мелодрамы 2018 фильмы 2018 HD,22,2018-03-25T09:39:10.000Z,60474,125,43,9,False
044 клан,2,17.16.12,044 ROSE - ТУЗ,10,2017-12-15T06:00:02.000Z,121194,3563,162,191,False
ОБИ Россия,2,17.16.12,Дон Собаконе встречает год Собаки,22,2017-12-15T14:01:17.000Z,287983,332,861,100,False
Влад Виселин,2,18.22.01,Новая Toyota Camry 2018,19,2018-01-20T19:31:34.000Z,478228,7488,2886,1077,False
Украина • РУ,2,18.18.05,Украина.ру на Крымском мосту,25,2018-05-17T08:15:48.000Z,161575,1590,436,690,False
Кутман Жолдошбаев,2,18.26.04,Нурлан Насип жана Асел Кадрбекава кыз узатуу тойу корунуздор,22,2018-04-25T18:03:00.000Z,29223,317,35,64,False
TV Promos,2,17.07.12,The Flash 4x10 Promo (HD) Season 4 Episode 10 Promo,24,2017-12-06T02:02:20.000Z,294262,2863,40,807,False
Денис Демешин,2,18.13.02,День траура. ЧП НТВ. В авиакатастрофе самолета АН-148 погиб рязанец,24,2018-02-12T11:19:14.000Z,43707,309,106,211,False
Блог Торвальда,2,18.24.02,Товары и услуги при капитализме,27,2018-02-24T00:39:54.000Z,2428,251,23,107,False
Следы Времени,2,18.06.01,Анатолий Вассерман 05.01.2018,22,2018-01-05T20:38:55.000Z,8734,434,22,74,False
Пятёрка,2,18.13.03,КТО ТАКОЙ СКЕЛЕТ? - МАЙНКРАФТ ТЕОРИЯ,20,2018-03-12T10:00:02.000Z,53492,3986,180,1122,False
Руки Вверх,2,17.20.12,Руки Вверх! - С Новым Годом! (молодыми) ПРЕМЬЕРА ПЕСНИ,10,2017-12-19T19:12:19.000Z,14085,2029,18,147,False
Журнал Игромания,2,17.14.11,"Игромания! Игровые новости, 13 ноября (Red Dead Redemption 2, FIFA 18, Ведьмак, Call of Duty)",20,2017-11-13T15:49:55.000Z,57913,3174,122,179,False
Фреш,2,18.13.03,Преступник против копа в тюрьме в Майнкрафт! Заключенный нуб и троллинг minecraft копы и преступники,20,2018-03-12T09:00:02.000Z,57993,2541,128,91,False
Актуальный Путин,2,18.28.03,Стали известны  причины пожара в Кемерове,22,2018-03-27T04:46:47.000Z,79725,134,104,73,False
auto_78,2,17.17.12,Питерские ржавые авто.Тойота Ленд Крузер 200 2013 года.  Авторынок в ноябре.,2,2017-12-16T22:06:33.000Z,2640,56,9,12,False
ТАРО- ПРОГНОЗЫ -ГОРОСКОПЫ,2,17.25.12,ПРОГНОЗ С 25 ПО 31 ДЕКАБРЯ 2017Г. Для ВСЕХ ЗНАКОВ ЗОДИАКА.,26,2017-12-24T17:35:04.000Z,11878,1198,45,240,False
iggyazaleamusicVEVO,2,18.01.03,Iggy Azalea - Savior ft. Quavo,10,2018-03-01T05:00:01.000Z,285984,34140,1627,4224,False
Avto-Blogger.ru,2,18.19.04,НИКОГДА НЕ ДЕЛАЙ ЭТО С ГЛУШИТЕЛЕМ. ПОТОМУ ЧТО,2,2018-04-18T11:29:51.000Z,183653,2867,904,705,False
Студия Натальи Шик. Обучение макияжу,2,17.25.12,Растушеванная стрелка. Вариант 4,26,2017-12-24T16:49:23.000Z,12648,733,40,60,False
Яндекс.Музыка,2,17.14.12,Музыканты пробуют нырять,10,2017-12-13T06:00:01.000Z,343530,903,746,115,False
Alter Animations,2,18.01.04,Bang Bang Bang (пародия),1,2018-03-31T19:09:11.000Z,39364,4815,230,327,False
Сквозь.,2,17.18.11,О Чём Мечтают Девушки? | Народный Гугл #2,24,2017-11-17T19:25:30.000Z,28386,2237,66,75,False
Dom-2 info,2,18.02.04,Ольга Рапунцель рожает  01 04 2018,22,2018-04-01T10:06:10.000Z,24302,86,56,15,False
Россия Сегодня - Russia Today,2,18.02.04,Ответ России Джонсону поразил британцев,29,2018-04-01T12:30:01.000Z,129590,1040,135,200,False
Канал BEAV!SE,2,18.10.06,ПЛЮСЫ И МИНУСЫ АРМИИ,23,2018-06-10T13:03:14.000Z,96557,13997,226,547,False
Aravot Daily,2,17.29.11,Ազգային հերոսին դատեցին,25,2017-11-28T13:07:47.000Z,8912,194,0,16,False
ЛОЖЬ на ТВ,2,18.27.03,Детей сожгли в  ЗИМНЕЙ ВИШНЕ - Жертвоприношение на Пурим | Опять детей принесли в жертву,22,2018-03-26T21:33:30.000Z,13035,179,73,59,False
Открытый регион Югра,2,18.24.03,МО Нижневартовск. Процедура определения победителей викторины Югре-900!,29,2018-03-24T08:18:43.000Z,4381,126,110,0,True
Osh Live,2,17.15.11,Сайкал ТУРМУШКА ЫЙЛАП кетти!,22,2017-11-14T18:52:58.000Z,48137,456,45,111,False
Андрей Коровин,2,18.22.02,Обзор индекса РТС на 22 февраля 2018 года,22,2018-02-22T06:15:30.000Z,935,186,0,34,False
Pentiumbitch,2,18.06.06,"НИКОЛАЙ СОБОЛЕВ, ТЫ МУДАК!",22,2018-06-06T09:45:23.000Z,51592,5164,470,353,False
МАКСИМ КАЗАРОВ,2,18.20.04,КРЫМСКИЙ МОСТ И УКРАИНСКАЯ ПРЕССА. МОСТ РАЗВАЛИТСЯ,25,2018-04-16T15:02:30.000Z,14190,228,5,103,False
SHOV-SHUV TV,2,18.04.02,11 ойли чақалоқ ҳақида биринчи прокуратура тахмини...,10,2018-02-03T09:11:04.000Z,27771,126,31,123,False
Billboard,2,18.21.04,Avicii In Memoriam: 1989-2018 | Billboard,10,2018-04-20T22:03:17.000Z,47851,6586,11,533,False
Asalcha Video,2,18.27.05,Шабнами Сурае танцует на день рождение Фарзонаи Хуршед,22,2018-05-26T19:10:49.000Z,29319,145,137,42,False
ALCATRACKZ,2,18.04.02,Уникальные ИДИОТЫ и ПРИДУРКИ!Таких ПРИКОЛОВ ты еще не видел,23,2018-02-03T12:57:46.000Z,30376,121,30,30,False
ArtistGerman,2,18.04.02,Я СЛОМАЛ НОГУ,24,2018-02-03T16:55:05.000Z,179327,19403,221,2662,False
SelenaGomezVEVO,2,18.06.06,Selena Gomez - Back To You,10,2018-06-05T14:00:07.000Z,7018402,649561,16766,43748,False
DakPlay,2,18.13.03,НУБ ПРОТИВ ЗОЛОТОЙ ЗОМБИ МУТАНТ В МАЙНКРАФТ ! Неудачник Нуб Мультик и ТРОЛЛИНГ ЛОВУШКА MINECRAFT,20,2018-03-12T06:00:00.000Z,420204,7550,2765,2511,False
edvardgysev777,2,18.22.02,Новости для глухих 22.02.2018 на РЖЯ,25,2018-02-22T04:01:05.000Z,1281,190,2,7,False
Anna Ceres Bar,2,18.26.03,Аватария || «У каждого человека свои звезды 2» || Одиннадцатая серия серия (СЕРИАЛ С ОЗВУЧКОЙ),1,2018-03-25T18:16:37.000Z,12634,3603,28,1412,False
E1.RU,2,18.24.03,E1.RU: Снос недостроенной телебашни в Екатеринбурге,22,2018-03-24T05:33:03.000Z,138698,463,1130,80,False
Ключи Мастерства,2,17.13.12,Медитация Новая энергетическая подпись,26,2017-12-12T11:24:26.000Z,10005,0,0,0,True
Beat Motion Productions,2,18.05.06,Brown Eyes I Param Randhawa I Rupan Bal Films I Latest Punjabi Song 2018,10,2018-06-01T12:23:59.000Z,209437,4124,21,60,False
Прямая Трансляция Тыва,2,18.09.05,Парад победы Кызыл 2018,29,2018-05-09T04:17:55.000Z,3138,88,3,3,False
Timelab Pro,2,18.04.02,"Winter Saint Petersburg Russia 6K. Shot on Zenmuse X7 // Зимний Петербург, аэросъёмка",19,2018-02-03T06:52:07.000Z,285426,14897,577,1356,False
Жизнь Петровского,2,18.21.05,Мой ответ на угрозы за КРЫМСКИЙ МОСТ,19,2018-05-20T11:02:54.000Z,149037,6294,687,2240,False
Muzy Frile,2,18.07.06,Пока Лена Проблем - meme,22,2018-06-06T20:54:45.000Z,36898,5184,317,696,False
Svetlana K,2,18.27.03,Путин в Кемерово Зимняя Вишня,22,2018-03-27T03:37:36.000Z,7436,96,91,150,False
KatyPerryVEVO,2,17.21.12,Katy Perry - Hey Hey Hey (Official),10,2017-12-20T20:00:02.000Z,2673454,244709,35086,24784,False
1337LikeR,2,18.12.01,ОБО ВСЁМ,20,2018-01-11T07:51:31.000Z,179849,24395,632,3314,False
A-proved Official,2,18.03.03,Nissan Leaf День #1 Не все так плохо как говорил AcademeG,22,2018-03-02T10:18:50.000Z,115339,2793,337,354,False
ABC Television Network,2,18.05.03,Sam Rockwell's Acceptance Speech for Best Actor in a Supporting Role | 2018 Oscars,24,2018-03-05T01:55:26.000Z,318092,3674,52,412,False
Дядя Юра,2,18.01.03,⭐Скины-Есть!Скилла-Нет!⭐400 Лайков=15 промо на BETS(ставки на киберспорт),20,2018-03-01T11:19:43.000Z,3083,462,15,0,False
LeadingCharter Technologies,2,17.22.12,Leading Charter Technologies - Для Тебя не существует границ,22,2017-12-21T10:47:40.000Z,152566,3266,402,102,False
Morty Mort,2,18.09.01,ЛИЛ МОРТИ - DIRTY MORTY (REMIX),22,2018-01-08T17:18:49.000Z,122139,5889,4014,811,False
PEOPLETALK,2,17.14.11,ПИПЛТØК - PARALON (дисс на PHARAOH),23,2017-11-13T08:44:23.000Z,64303,1864,1856,263,False
JenniferLopezVEVO,2,18.28.04,Jennifer Lopez - El Anillo (Official Video),10,2018-04-27T13:00:06.000Z,2436889,104692,11417,10178,False
1 000 000 просмотров,2,18.19.03,"☑️ Кто лидирует на выборах 2018? Информация ВЦИОМ. #Невыборы2018. Грудинин 71,5%",22,2018-03-18T13:11:41.000Z,238415,1104,751,658,False
RICK HAPET Деньги и Bitcoin из интернета !,2,18.12.02,Авиакатастрофа в Подмосковье 11.02.2018г ( Москва - Орск ),22,2018-02-11T13:44:19.000Z,12537,0,0,0,True
anfiska2208,2,18.08.05,Белка-неудачница,22,2018-05-06T15:23:26.000Z,162466,3623,861,465,False
Одни на Двоих,2,17.22.11,ПРЕМЬЕРА! Одни на двоих - Вдыхай меня,10,2017-11-21T06:19:27.000Z,127114,1080,2230,424,False
Ak Bars,2,18.16.01,Чем заняться между периодами - Топи за Ак Барс вместе с медведем!,17,2018-01-15T07:38:50.000Z,100619,1376,328,99,False
Сплетни Радиокидс Чикули СРЧ,2,18.26.04,СРЧ: Катя и Никита подробности с вечеринки //Ангелина и Тимоха,24,2018-04-25T17:43:39.000Z,24353,2032,27,219,False
Patriots of Russia,2,18.16.03,Анатолий Быков обратился к избирателям накануне выборов президента РФ,25,2018-03-15T02:55:51.000Z,7236,144,40,84,False
Влас Прудов,2,18.19.02,ВАЗ 2108 с ВЕРТОЛЕТНЫМ ДВИГАТЕЛЕМ,2,2018-02-18T06:00:00.000Z,97970,3199,551,540,False
Good™ Мультики про танки,2,18.10.05,Монстр из ада Мультики про танки,1,2018-05-09T12:45:55.000Z,38219,501,28,80,False
ARS Pro,2,18.07.01,Арм-кувалда своими руками,22,2018-01-06T16:40:35.000Z,8091,292,21,68,False
АНДРЕЙ ГОЛУБЬ,2,18.21.03,ДАЛЬНОБОЙ ОМСК-МОСКВА! ЧАСТЬ-2 (РБГ#7),2,2018-03-21T01:21:31.000Z,2115,0,0,64,False
Clean Bandit,2,18.31.05,Clean Bandit - Solo feat. Demi Lovato [Official Video],10,2018-05-31T09:00:13.000Z,471533,67589,702,3844,False
061.ua,2,18.12.01,Кто виноват в войне на Донбассе?: опрос на улицах Запорожья (видео 061.ua),25,2018-01-11T07:54:50.000Z,100401,582,186,1259,False
ZZone/Реал Мадрид,2,18.16.02,МОЯ РЕАКЦИЯ НА МАТЧ РЕАЛ МАДРИД - ПСЖ 3:1 | с Шюррле,17,2018-02-15T14:30:00.000Z,26818,1970,153,279,False
Leo Balanev,2,17.23.12,Посмотреть Россию в full HD,22,2017-12-22T06:00:00.000Z,199600,2409,277,149,False
Pin Drop Violence Films,2,17.18.12,Jigsaw | Official Trailer | Tanuj Virwani | Siddhant Chaturvedi | Tanya Jacob | Sanjeev Raj Bagga,22,2017-12-13T13:46:04.000Z,21161,66,16,35,False
Мишень в дым,2,18.26.03,ПОЖАР В КЕМЕРОВО ТЦ Зимняя вишня 25.03.2018,26,2018-03-25T13:32:35.000Z,507656,1052,4236,1399,False
APA TV,2,17.12.12,"Türkiyəyə ərə gedən azərbaycanlı qadın: “Ərim 8 bıçaq vurdu, qaynım yataq təklif elədi...”",25,2017-12-11T12:19:29.000Z,49527,110,77,177,False
Таня Ши,2,17.01.12,Таня Ши — Вспоминай (Премьера клипа),10,2017-11-30T05:50:26.000Z,187784,3720,1205,277,False
Диана Борисова,2,18.02.02,За стакан водки бомж разрисовал стену для Навального в Петербурге,22,2018-02-01T07:27:48.000Z,272045,302,4334,599,False
ПРИКОЛЫ И ЗАСВЕТЫ ПЕРИСКОПА,2,18.26.03,Переговоры пожарных в трц зимняя вишня кемерово,22,2018-03-26T02:19:23.000Z,7749,83,9,17,False
CHAIN YourLife,2,18.27.01,НОВЫЙ БАТЛ ГНОЙНОГО. Стрижка ANTIHYPE. Feat с Киркоровым,22,2018-01-26T13:45:21.000Z,48087,664,150,208,False
Real Fight,2,18.06.05,НОКАУТ HD ГОЛОВКИН - МАРТИРОСЯН ОБЗОР,17,2018-05-06T04:34:52.000Z,46182,917,56,353,False
Kyskacha KG,2,18.18.04,М.Бакиров Өкмөт мүчөлөрүн суроолору менен жарга такады,25,2018-04-17T19:21:21.000Z,40239,598,50,352,False
Best ProFit42,2,17.03.12,КЕШБЕРИ! С нами просто и прибыльно! СМОТРИ ДО КОНЦА!,22,2017-12-02T04:57:00.000Z,76270,3073,759,230,False
OLMAXON TV,2,18.27.01,АВТОБУСНИНГ ЁНИШИГА САБАБЧИ БЎЛГАНЛАР ҲИБИСГА ОЛИНДИ!,2,2018-01-25T21:46:52.000Z,139814,431,212,317,False
Mad Highlights,2,18.21.04,Мэддисон смотрит видосики - ЧЕ ТЫ ТАКОЙ ХМУРЫЙ?,20,2018-04-20T19:42:41.000Z,39752,2212,79,128,False
DenvasTV,2,17.30.11,Китайская уличная еда на фестивале продуктов питания - Жизнь в Китае #120,22,2017-11-29T18:28:57.000Z,23755,1887,60,243,False
UZBEK_VIDEO,2,17.29.11,Ozodbek Nazarbekovning Qizini Nikox To'yi Ko'rishni Tafsiya Qilaman,1,2017-11-28T13:45:25.000Z,115762,725,374,0,True
EMIL SHOW,2,18.17.04,Данил унизил Яну. Ивановы Ивановы 2 сезон 17 серия,1,2018-04-16T10:21:45.000Z,21276,108,66,13,False
Garage КАХОВКА,2,18.14.02,MERCEDES Vito.  ВСЕМ дверям быть!  Повреждение.   РАЗБОРКА.,2,2018-02-13T19:10:47.000Z,10977,758,19,224,False
Polit Ukraine,2,17.05.12,Юлия Тимошенко. Парубий в шоке! Погоджувальна Рада пошла не по плану!,25,2017-12-04T10:14:22.000Z,51630,823,56,385,False
SPhone Buff,2,18.15.01,How To Make Money Online - Fast Way,26,2018-01-14T11:55:26.000Z,32169,475,38,9,False
Дневник бабы Веры,2,18.01.02,Quest Pistols Show - Непохожие/ РЕАКЦИЯ,22,2018-01-31T11:12:18.000Z,12429,943,44,227,False
Rapid Highlights,2,18.08.05,"Toronto Raptors vs Cleveland Cavaliers - Full Game Highlights | Game 4 | May 7, 2018 | NBA Playoffs",17,2018-05-08T03:16:42.000Z,251714,1031,92,461,False
FilmCafe,2,17.01.12,Сериал Второе зрение 3-4 серия (2017),1,2017-11-30T13:02:29.000Z,25995,51,21,12,False
ДЕСТРОЙ!,2,18.30.01,УДАР В ЛИЦО от РУКИ-БАЗУКИ (проверка силы удара),24,2018-01-29T09:21:00.000Z,357482,1751,6261,704,False
Doka Doka,2,18.05.03,"Нападение на Собчак, облили водой за Жириновского",24,2018-03-04T18:18:51.000Z,23563,418,107,480,False
Роман НКВД,2,18.02.04,ПРОПАВШИЕ 4 МИНУТЫ ЗАПИСИ ПОЖАРА ТЦ ЗИМНЯЯ ВИШНЯ / НАКАЗАНИЕ ТУЛЕЕВУ / РОМАН НКВД,25,2018-04-01T10:56:11.000Z,59181,1169,281,499,False
ЛАМПОВЫЙ,2,18.25.05,ЛИЗЗКА УРОНИЛА ФЕЙСА! КОНФЛИКТ ЛИЗЗКИ И FACE | ДИСС НА ФЕЙСА - ЧТО ОН ОТВЕТИТ?,24,2018-05-24T12:42:28.000Z,22344,1399,133,191,False
MARDONG-PALAS,2,18.29.03,"В. Соловьев в СОВФЕДЕ, 28.03.18",22,2018-03-28T17:33:05.000Z,197988,8429,1489,3110,False
Ярик Лапа,2,18.13.06,"ЧТО ДЕЛАТЬ, ЕСЛИ ТЕБЕ ПОСТАВИЛИ ДВОЙКУ?",20,2018-06-12T16:26:37.000Z,87131,7771,530,1546,False
КиноПоиск. Официальный канал,2,17.12.12,«Психотроника». Премьера короткометражного фильма Хаски,24,2017-12-11T07:48:55.000Z,82009,2859,347,214,False
Политическая Арена,2,18.26.02,У Путина один выход.,25,2018-02-25T15:33:00.000Z,100037,1819,3965,1230,False
your fit,2,18.12.02,ПОЧЕМУ не получается убрать ЖИР С ЖИВОТА,22,2018-02-12T05:43:36.000Z,10555,1409,12,52,False
ALEKSEEV,2,18.30.01,ПРЕМЬЕРА! ALEKSEEV - Forever,10,2018-01-29T08:31:25.000Z,526442,7615,485,1031,False
Золотой,2,18.28.03,Стрим Митинг В Кемерово Памяти Погибших Детей 27.03.2018(часть 3),28,2018-03-27T09:55:40.000Z,65507,1358,52,198,False
"INDY TRAVEL. Жизнь, как сериал",2,18.31.01,Апгрейд байка на Пхукете. Завтрак и кофе. Ништяки и цены в 7-11 Seven Eleven в Таиланде,19,2018-01-30T07:09:57.000Z,10068,690,26,115,False
Октябрёнок,2,18.01.02,Грудинин договаривается с Зюгановым о президентской кампании.,22,2018-01-30T06:39:10.000Z,45211,1048,4300,1314,False
ТОЛПИН,2,18.06.02,ОПЕРАТОР ДАВИДЫЧА / ГУРАМ DRAGTIMES / МАРУАН СТОП-ХАМ,24,2018-02-05T09:02:53.000Z,328623,5147,904,327,False
Islam Global,2,17.16.11,Сура 93: Ад-Духа (Утро),29,2017-11-07T19:11:20.000Z,6179,63,53,15,False
Epic World,2,17.05.12,Драго батлит банду Димасты (Батл-Рэмбо),24,2017-12-04T10:19:04.000Z,84331,1655,54,231,False
MMA KING,2,18.09.03,КОНОР МАКГРЕГОР НАЕХАЛ НА КРИШТИАНУ РОНАЛДУ И ХАБИБА,17,2018-03-08T09:31:10.000Z,51583,1061,112,195,False
Vredina Life,2,17.21.11,VLOG Готовим вафли. Мои мысли.,22,2017-11-20T07:00:01.000Z,39165,2145,56,595,False
JayRockVEVO,2,18.16.02,"Jay Rock, Kendrick Lamar, Future, James Blake - King's Dead",10,2018-02-15T20:00:02.000Z,1332832,109887,1829,11691,False
SƏS TV,2,17.08.12,Ata arvadını və 4 qızının boğazını kəsib öldürdü,25,2017-12-07T10:23:37.000Z,46621,189,93,97,False
Prostory Music,2,17.25.12,Lx24 - Третий лишний (Премьера клипа 2017),10,2017-12-24T09:33:32.000Z,199723,3775,277,92,False
PoleZnaniy,2,18.24.05,"Фото, на которые невозможно смотреть без специальной подготовки",24,2018-05-23T15:00:03.000Z,53936,767,130,59,False
League of Legends,2,17.01.12,Varus: As We Fall [OFFICIAL MUSIC VIDEO] | League of Legends Music,20,2017-11-30T15:21:18.000Z,1294885,69686,3293,8903,False
Кликбейт 2,2,17.27.11,Навальный. Нижний Новгород. Не митинг. 25.11.17,10,2017-11-25T16:15:12.000Z,35002,1611,2018,492,False
Mac Win TV,2,18.26.02,Победный гол Капризова в Финале Россия 4 3 Германия Олимпиада в Пхенчхане 2018,17,2018-02-25T07:09:26.000Z,66389,633,98,63,False
ART.S,2,18.06.02,World of Tanks - Марафон к Grille 15 (Часть 1),20,2018-02-06T02:53:49.000Z,4277,368,22,4,False
ОБЗОРКИН,2,18.29.04,ОБЗОР НА ВЕТЕР! ЧУТЬ НЕ УЛЕТЕЛ!!,22,2018-04-25T10:46:30.000Z,5783,726,36,218,False
TuYasRecords,2,18.05.06,Sumo Attack! Good Dog Anderson Funny Moments - Detroit Become Human,20,2018-05-26T14:37:43.000Z,80119,239,13,18,False
Харчевников,2,18.14.05,ДАУНЫ ДАРКНЕТА (НЕОБЫЧНЫЕ ПРЕДЛОЖЕНИЯ И ТРОЛЛИНГ ПРОДАВЦОВ),22,2018-05-13T16:56:44.000Z,65287,4303,233,426,False
Кремлин Маша,2,18.13.01,Как готовятся к приезду Путина,22,2018-01-12T07:02:57.000Z,208840,4363,18775,4233,False
Demuan0,2,18.12.02,Самолет Ан-148 разбился в Подмосковье - Авиакатастрофа,29,2018-02-11T13:03:17.000Z,77778,176,427,283,False
Кавер группа Оп-Хлоп Оркестр Витамины,2,17.31.12,Кавер группа ВИТАМИНЫ - Витамины,22,2017-12-30T06:27:46.000Z,175338,1578,172,91,False
Sitora Tv,2,18.02.01,Лахзахои Гуворо - Карзи Падар 2018 | Соли Нави 2018,23,2018-01-01T13:06:52.000Z,60176,370,123,57,False
Nastya Miani,2,18.07.02,JUST DANCE // ТУЦ-ТУЦ С ЕВОЙ МИЛЛЕР И МАРКОМ МАКАРОВЫМ,22,2018-02-06T18:15:14.000Z,72536,11104,67,2719,False
Приколы и Юмор,2,18.05.02,Норка ворует щуку у рыбака,22,2018-02-04T14:18:12.000Z,44191,894,327,209,False
Darya Key,2,17.10.12,МАКИЯЖ БЮДЖЕТНОЙ КОСМЕТИКОЙ,22,2017-12-09T07:25:55.000Z,29618,2190,12,138,False
Анна Якименко,2,17.18.11,Девичник | Баста - Девочка моя,22,2017-11-17T16:50:21.000Z,4993,53,30,4,False
Deepikara,2,17.31.12,Секрет на миллион - Сергей Лазарев и Лера Кудрявцева в новогоднем выпуске - 30.12.2017,10,2017-12-30T09:55:38.000Z,12666,112,9,8,False
*Mr.Gens Best,2,18.25.04,УЧИТЕСЬ МЕНЬШЕ ГОВОРИТЬ! Как слова и мысли влияют на нашу жизнь.,27,2018-04-24T12:28:39.000Z,11410,699,24,26,False
Start Cube™,2,18.12.03,BEST CUBE #242 | ЛУЧШИЕ ПРИКОЛЫ 2018 МАРТ,23,2018-03-11T06:04:23.000Z,73628,918,210,154,False
Սուսիկ Նիկոլյան,2,18.18.01,Nran Hatik 89 Anons,22,2018-01-17T10:29:42.000Z,9824,22,8,10,False
Washington Capitals,2,18.08.06,Eller Game 5 Stanley Cup Final Goal,17,2018-06-08T02:58:53.000Z,38391,224,2,44,False
CaGArt,2,18.13.06,Мои Детские Травмы 2 (анимация),23,2018-06-12T09:38:38.000Z,48043,3053,225,567,False
Dizi ve Filmler,2,17.20.11,Dolunay 20. Bölüm - Öpüşme Sahnesi - Nazlı ve Ferit,1,2017-11-19T19:23:36.000Z,48005,319,7,14,False
YanixTV,2,18.19.02,"Yanix  - На Груди, На Запястье",10,2018-02-18T21:57:18.000Z,37163,5778,621,0,True
TURFA OLAM,2,18.11.02,ТУРФА ОЛАМДАН ЭНГ АНТИКА РЕКОРДЛАР ТОП 5,24,2018-02-11T03:31:07.000Z,2394,262,4,45,False
ArianaGrandeVevo,2,18.20.04,Ariana Grande - No Tears Left To Cry,10,2018-04-20T04:00:03.000Z,2014792,465997,8465,69300,False
Tierra Cali Real,2,18.05.06,Tierra Cali  UN HERMANO MEXICANO   ¡¡VIDEO OFICIAL!! 2018,10,2018-05-18T03:35:58.000Z,348058,1490,62,94,False
Anastasia Ostrovsskaya,2,18.21.05,"DUBAI 🏙 САМЫЙ ЛУЧШИЙ ОТДЫХ В HOTEL RIXOS 🌴 НАШ НОМЕР, ГОРОД , BURJ KHALIFA",26,2018-05-20T14:48:08.000Z,41718,2091,60,229,False
НАТАША ХОРОШАЯ,2,18.13.02,"Баба Валя о вере, церкви и людях!!!",22,2018-02-12T11:52:52.000Z,5250,305,13,120,False
Wild Mathing,2,18.31.05,1 ДЕНЬ ДО ЕГЭ ПО МАТЕМАТИКЕ! РЕШАЕМ ЗАДАЧИ ВТОРОЙ ЧАСТИ,27,2018-05-31T12:59:09.000Z,23028,947,38,26,False
NEW AUTO,2,18.09.02,МОК разрешил нашей стране российский флаг на Олимпиаде,25,2018-02-08T18:07:59.000Z,4996,95,27,17,False
ГТРК Оренбург,2,18.15.02,Что написали пассажиры лайнера Ан-148 в Интернете за несколько минут до своей гибели,25,2018-02-14T16:42:40.000Z,135912,570,1065,0,True
Новый Калининград.Ru,2,17.11.12,Полиция просит участников встречи с Алексеем Навальным в Калининграде разойтись,25,2017-12-10T12:50:47.000Z,3223,29,603,23,False
Ваня Карпов,2,18.19.04,Серия пенальти. Спартак Тосно. 1/2 финала Кубка России.,17,2018-04-18T18:28:15.000Z,35898,317,35,214,False
Simon,2,18.26.02,When you see that your ex has moved onDota2(Navi.Lil reacting to VP.Rodjer MVP),20,2018-02-25T18:51:38.000Z,71850,593,1049,320,False
Идеономика,2,18.03.02,"Владимир Яковлев о счастье в старости, развитии личности и жизненной стратегии",27,2018-02-02T07:02:45.000Z,311424,192,235,110,False
HayronUz,2,18.21.01,АВТОБУСДА ЁНГАН 49 ИНСОННИНГ ИСМИ ШАРИФИ ЭЪЛОН КИЛИНДИ,22,2018-01-20T12:18:25.000Z,32844,206,44,0,True
Midad News,2,17.18.12,مداد نيوز | الفرق بين السعودية والإمارات ودول الشعارات,22,2017-12-16T13:12:12.000Z,62763,103,1533,702,False
UzCine TV,2,18.21.05,УРРАА БАРЧА РОССИЯДАГИ УЗБЕКЛАР УЧУН УЗБЕКИСТОНГА АРЗОН ТЕЛЕФОН КИЛИШ,22,2018-05-20T20:03:56.000Z,49228,2929,201,264,False
ЦУРреализм,2,18.15.03,"Сечин: новые виллы, горный курорт и царская охота главы «Роснефти» | Фильм-расследование ЦУРа",22,2018-03-14T15:53:12.000Z,48754,3662,57,774,False
RIA56 Видео,2,17.03.12,Пожар на вьетнамском рынке. Оренбург,22,2017-12-02T11:21:48.000Z,14490,31,4,5,False
Организация Джем Momentik,2,18.12.05,"Я Агент Картер, Что с Акцентом Королева Виктория? Супер солдат. Отбор Солдат. Первый Мститель 2011",1,2018-05-11T11:23:57.000Z,153168,2346,88,142,False
Nastya Tropicelle,2,17.01.12,НОВОГОДНИЙ DIY ДЕКОР КОМНАТЫ // Украшаем комнату своими руками,26,2017-11-30T14:03:11.000Z,99996,20709,156,942,False
SAVABOXING,2,18.05.02,Гассиев - Дортикос Полный бой / Gassiev vs. Dorticos Full Fight HD 720,17,2018-02-04T00:14:14.000Z,272337,1834,171,946,False
Ольга Жаданова,2,18.18.01,Пожар на рынке Садовод видео с коптера,29,2018-01-17T19:39:38.000Z,21567,75,14,33,False
Андрей Максимов,2,18.20.02,Suzuki DT5 Пластмассовый мир победил!,2,2018-02-19T19:21:56.000Z,2117,241,5,62,False
Фильм Про,2,17.09.12,Бахубали: Рождение легенды. В кино с 11 января!,1,2017-12-08T06:24:16.000Z,68006,1024,174,167,False
Кот Баттерс,2,17.28.11,ГОВОРЯЩИЙ КОТЕНОК ГУЛЯЕТ ПО СНЕГУ НА УЛИЦЕ | РЕАКЦИЯ КОТЕНКА БАТТЕРСА НА СНЕГ | ОН В ШОКЕ,15,2017-11-27T07:00:00.000Z,35719,3066,44,331,False
Геополитика онлайн,2,18.14.02,Хронология уничтожения ЧВК Вагнера,25,2018-02-13T07:11:06.000Z,428000,0,0,4690,False
StarmeD,2,17.22.11,Фильм Последний провод Хороший Боевик,24,2017-11-21T14:00:04.000Z,16940,23,5,0,True
borch671games,2,18.05.02,ЮЛИК feat. ДА НИЛ - ТОП РЕАКТОР,23,2018-02-04T11:54:06.000Z,30215,5378,139,305,False
TechZone,2,18.15.02,"10 САМЫХ КРУТЫХ ИГРУШЕК, КОТОРЫЕ СТОИТ УВИДЕТЬ",22,2018-02-15T07:21:22.000Z,26595,1696,89,132,False
Строим вместе,2,18.13.03,THE SIMS 4 МОЙ ПЕРВЫЙ ПИТОМЕЦ (часть 2),20,2018-03-12T09:55:26.000Z,10152,379,6,80,False
Канал Макса,2,18.13.03,НУБ УМИРАЕТ 30 РАЗ В МАЙНКРАФТ ! НУБИК АНИМАЦИЯ РЕАЛИСТИЧНЫЙ МАЙНКРАФТ ТРОЛЛИНГ ЛОВУШКА Мультик,20,2018-03-12T13:31:03.000Z,13629,792,37,130,False
Panjsher Pro,2,18.19.01,Фариддуни Хуршед 2018 Дует бо Шабнами Сураё,10,2018-01-18T11:36:12.000Z,50339,380,80,78,False
Artur Muradyan,2,18.13.05,Նիկոլ Փաշինյանը բլոտ է խաղում Էրեբունու բնակիչների  հետ...,1,2018-05-12T07:29:12.000Z,90314,1602,30,142,False
NL Store,2,18.24.01,Солянка Energy Diet Smart,17,2018-01-24T04:41:35.000Z,2493,130,1,1,False
Анимационные сериалы MARVEL,2,18.02.06,Стражи галактики - мультфильм Marvel – серия 2 сезон 1,1,2018-06-01T11:30:00.000Z,37419,1307,24,150,False
KG YouTube,2,18.15.01,Мурат Жалиев||Тойду жарды го!!Корсон точна жыгыласын😂😂,22,2018-01-14T07:43:30.000Z,12395,198,17,48,False
Drugoi Lugansk,2,17.22.11,Луганск: заход военной колонны 21 ноября 2017,25,2017-11-21T16:44:09.000Z,314635,739,179,1647,False
Надежда Ангарская,2,17.01.12,Надежда Ангарская - Кукла (Премьера клипа 2017),10,2017-11-30T05:43:59.000Z,47304,800,128,52,False
VitoS CrazyShow,2,18.20.03,ТОП 20 ИСПОРЧЕННЫХ БЮЛЛЕТЕНЕЙ! ВЫБОРЫ В РОССИИ 2018!,25,2018-03-18T20:39:16.000Z,86900,1368,257,387,False
ЧОЛПОН ТВ телеканалы Жалал-Абад,2,18.22.03,Сегизбаев Текебаевге  60 миллион сом төлөшү мүмкүн,22,2018-03-21T17:30:14.000Z,45271,325,114,0,True
Spiny Wave,2,17.21.12,Spiny Wave - Ideal Romance,10,2017-12-20T06:48:44.000Z,91842,13523,591,256,False
Говорящий Том и Друзья,2,18.18.05,"Минимульты Говорящий Том, 31 серия - Битва с воздушным шаром",24,2018-05-17T10:47:21.000Z,26749,461,41,120,False
Хор Русской Армии | Russian Army Choir,2,17.30.11,Хор Русской Армии - Армия777 (Витя АК-47 Азино Три Топора),10,2017-11-29T08:07:46.000Z,74883,3873,797,141,False
قناة  أزهري الفضائية,2,17.21.12,قـناة أزهري الفضائـية  | AzhariTv,1,2017-12-19T18:18:00.000Z,20688,3,24,9,False
ЗАРЯ РОССИИ,2,18.18.03,Юлия Латынина / Код доступа / 17.03.2018 (ВИДЕО),25,2018-03-17T17:20:44.000Z,11898,268,20,60,False
IMALEX channel,2,17.26.12,ФИНАЛЬНОЕ РЕШЕНИЕ О РЕГИСТРАЦИИ НАВАЛЬНОГО КАНДИДАТОМ В ПРЕЗИДЕНТЫ.,25,2017-12-25T14:40:17.000Z,212484,5233,3432,3732,False
BobCat Lynx Live,2,18.15.02,Мейн-кун Миса просит кота / Female maine coon Misa in heat meows to male outsid,15,2018-02-15T08:04:18.000Z,5180,747,23,107,False
VN Smirnov,2,17.29.11,Вячеслав Смирнов. Кандидат за котиков!,25,2017-11-28T07:03:41.000Z,103436,3084,755,269,False
Телеканал Первый Ярославский. Ярославль,2,18.08.01,ЭКСКЛЮЗИВ: «Первый Ярославский» публикует момент ДТП пассажирского автобуса в Крестах,25,2018-01-07T18:31:27.000Z,3030,4,2,1,False
Стас Ёрник,2,18.20.04,ЖЕСТКИЙ ПРАНК НАД ДЕВУШКОЙ. ДОВЕЛИ ДО СЛЁЗ ( feat  Boris Pranks ),23,2018-04-19T10:06:49.000Z,55329,3850,147,433,False
Сергей Домогацкий,2,18.28.03,Сколько погибло в Кемерово? Пруфы. Зимняя вишня. [ Сергей Домогацкий ] Пожар в ТЦ. Торговый центр.,27,2018-03-27T09:49:07.000Z,334537,2277,710,1065,False
ZaynVEVO,2,18.24.05,ZAYN - Entertainer (Official Video),10,2018-05-23T16:00:03.000Z,2331335,270716,4421,22329,False
AKADO,2,17.23.12,AKADO - ДИСС на НОВЫЙ ГОД!,10,2017-12-22T09:07:53.000Z,191154,4768,4460,455,False
Кубанские новости,2,17.20.11,"Крестный ход против ДТП, 18 ноября, Краснодаре",29,2017-11-18T08:33:22.000Z,65617,199,1046,759,False
ТАНИРБЕРГЕН,2,18.12.01,Ураган в Астана сдул Шар в районе Экспо на дорогу! Казахстан метель! Буран Снег Сильный ветер Шторм,22,2018-01-11T10:24:37.000Z,126219,1741,280,589,False
OldSpiceRussia,2,18.17.01,Павел Воля - О современной науке (Comedy Club),23,2018-01-16T12:28:29.000Z,614624,11155,1805,381,False
World of Warships (WoWS). Официальный видео канал,2,18.09.02,Aigle — французский орел. Армада [World of Warships],20,2018-02-09T06:13:49.000Z,1576,184,13,21,False
Гузель Уразова,2,17.10.12,Это видео набрало в инстаграме guzelurazova 150000 просмотров  и свыше 300 комментариев,1,2017-12-09T10:58:24.000Z,4645,411,5,24,False
BEST OF SPORTS,2,18.25.01,Боец UFC Хабиб Нурмагомедов встреча с болельщиками (полное видео),22,2018-01-24T11:21:48.000Z,5300,67,2,13,False
PaparazziUZ,2,18.05.04,XASANBOY DO'SMATOV To'yi to'liq versiyasi 2-QISM,22,2018-04-04T09:25:01.000Z,43090,474,41,90,False
Спайк,2,18.13.03,НЕВИДИМКА ПОСТРОИЛ ДОМ С ЛОВУШКАМИ В Майнкрафт | НУБ НЕВИДИМКА ПРОТИВ ПРО ТРОЛЛИНГ ЛОВУШКА МУЛЬТИК,20,2018-03-12T13:03:08.000Z,29060,1999,45,171,False
Катя Никольских,2,18.03.02,«Можем Повторить» в Волгограде,25,2018-02-02T04:52:59.000Z,178822,579,3026,945,False
Valaybalalay,2,17.21.12,ОБЪЯСНЕНИЕ КОНЦОВКИ - Звездные Войны: Эпизод 8 - Последние Джедаи [Star Wars: The Last Jedi],24,2017-12-20T09:00:06.000Z,128090,10226,635,1637,False
7days новости повседневные,2,18.16.03,Первая жена Олега Табакова пропустила прощание с мэтром | StarHit.ru,22,2018-03-15T20:12:24.000Z,47073,96,60,85,False
Tupa Tipo,2,18.19.03,НАРУШЕНИЯ НА ВЫБОРАХ 2018! УЖЕ ДАЛЬНИЙ ВОСТОК НАРУШАЕТ,22,2018-03-17T21:34:59.000Z,276816,1618,4632,704,False
SLOVOproject,2,18.18.01,SLOVO BACK TO BEAT: МЛЕЧНЫЙ vs AR-SIDE (MAIN-EVENT) | МОСКВА,24,2018-01-17T11:23:00.000Z,57669,2130,410,468,False
Камеди Клаб New,2,17.17.12,[ТНТ HD]15.12.17-COMEDY CLUB/КАМЕДИ КЛАБ(ВЫСОКОЕ КАЧЕСТВО)-Последний выпуск,23,2017-12-15T19:41:32.000Z,81441,609,90,70,False
Paramount Pictures Россия,2,18.06.06,Бамблби - Официальный тизер-трейлер (HD),1,2018-06-05T07:01:02.000Z,1237117,19095,3524,3510,False
Atlantic Records,2,17.24.11,"Machine Gun Kelly, X Ambassadors & Bebe Rexha - Home (from Bright: The Album) [Music Video]",10,2017-11-23T11:08:00.000Z,270001,25779,169,1150,False
Антон Магникум,2,18.12.02,Подмосковная трагедия с Ан-148 в лицах (17 фото),22,2018-02-11T20:10:40.000Z,2000,10,4,23,False
Корпорация Смеха,2,18.01.03,ЛУЧШИЕ ПРИКОЛЫ 2018 МАРТ #2 | ЛУЧШАЯ ПОДБОРКА | ТОПОВЫЕ ПРИКОЛЫ,22,2018-03-01T09:04:41.000Z,460,71,6,19,False
Mammy TV,2,17.27.11,Стихотворение о любви к маме,22,2017-11-26T06:30:24.000Z,171724,7016,2339,1167,False
Talking Tom,2,18.24.05,Talking Tom Shorts 42 - Pearl Thieves,20,2018-05-23T14:09:19.000Z,356031,2260,422,160,False
DIANA  DI,2,17.14.12,ДИСС НА КЛИП Реакция на Марьяна Ро & FatCat - Мега-звезда ОБЗОР НОВОГО КЛИПА МАРЬЯНЫ РО 🎤,24,2017-12-13T13:24:38.000Z,170572,34769,15187,14132,False
ЫСЫК ТВ,2,18.30.05,Азамат Исмаиловдон жегичтерге эскертуу 29/05/2018,10,2018-05-29T14:07:15.000Z,14959,0,0,21,False
Weba,2,17.20.12,Новогоднее поздравление от WEBA 2018,24,2017-12-19T08:47:14.000Z,143586,162,752,145,False
Tatiana Andreeva-DIY и КРЕАТИВ,2,18.26.05,АНТИСТРЕСС СКВИШИ ИЗ СКОТЧА ЗА 5 МИНУТ ТЕСТИРУЮ СТРАННЫЙ СПОСОБ ИЗГОТОВЛЕНИЯ,26,2018-05-25T14:00:02.000Z,21000,1409,38,756,False
TArchive,2,18.06.01,ДЖЕСУС СМОТРИТ ВИДОСЫ И чуть-чуть СЛЕНДЕРА/JesusAVGN,24,2018-01-04T19:04:31.000Z,15412,331,24,29,False
Stephanie,2,17.13.12,Отель Элеон - 16 серия 3 сезон (58 серия),22,2017-12-12T17:38:05.000Z,14986,80,35,8,False
МАRУСЯ,2,17.13.12,Маруся Третьякова - Гори,10,2017-12-12T06:30:07.000Z,122630,2318,1810,250,False
Мой Ульяновск,2,18.21.01,Вечерний Ургант – Satisfaction,22,2018-01-20T16:02:02.000Z,19436,196,180,15,False
Кирилл Терешин,2,18.21.04,Разборка)) Кирилл Терешин. Руки Базуки. Асхаб Тамаев. Бой продолжение. Халк. Бицули.Фрик,22,2018-04-20T16:08:52.000Z,39716,365,65,157,False
Evriki Nevriki,2,17.07.12,Анжелика Протодьяконова в Москве,22,2017-12-06T08:18:15.000Z,61406,232,888,309,False
Платим Кредит. Суровые Будни,2,18.28.03,"Кемерово ТРЦ Зимняя Вишня... Парень на видео, которого МНОГО КТО ОБВИНЯЛ В ТЕРАКТЕ НЕ ВИНОВАТ !!",25,2018-03-27T15:45:42.000Z,24256,197,12,11,False
ПЯТОЕ ИЗМЕРЕНИЕ,2,17.15.11,Первый шаг к достатку,27,2017-11-14T17:34:19.000Z,8539,683,18,37,False
Омар в большом городе,2,18.26.01,ОМАР НА ШОПИНГЕ // Омар в большом городе,22,2018-01-25T09:25:33.000Z,29935,1767,60,146,False
RAP PORTAL,2,18.15.01,Баҳс Shon MC vs. Alone (RAP.TJ),10,2018-01-14T17:54:55.000Z,34837,1614,242,2346,False
Два Директора,2,17.21.12,Он вам Навалит | Выборы 2018 Навальный | Премьера клипа,10,2017-12-20T06:50:04.000Z,145276,17862,16354,2607,False
ЮТУБ ШОУ ТРЕНД,2,18.26.01,ЛЮДМИЛУ СЕНЧИНУ УБИЛ РАК/В ПЕТЕРБУРГЕ СКОНЧАЛАСЬ НАРОДНАЯ АРТИСТКА ЛЮДМИЛА СЕНЧИНА,22,2018-01-25T11:12:03.000Z,17861,77,7,17,False
КГБлог,2,18.28.03,Врач в Кемерове называет сколько погибших в Зимней вишне. С ИМЕНЕМ,22,2018-03-27T12:20:58.000Z,116792,1291,70,407,False
Оксана Дмитриева,2,17.01.12,DIY.СТИЛЬНЫЙ ЛИЧНЫЙ ДНЕВНИК и ДЕКОР КАНЦЕЛЯРИИ своими руками/NEWCHIC обзор товаров.,26,2017-11-30T07:44:22.000Z,18752,817,29,114,False
Sergey Smirnov,2,18.10.05,"Охрана Путина отшвырнула Ветерана, тот неловкий момент когда охрана перестаралась",25,2018-05-09T08:40:59.000Z,325645,447,1248,952,False
Сталик Ханкишиев Казан-Мангал,2,18.27.01,"Бозбаш с Шах-Гусейном, азербайджанские классические супы",26,2018-01-27T05:34:17.000Z,3062,274,68,98,False
Сергей Ощепков,2,18.28.03,Митинг 27 03 2018 Кемерово,29,2018-03-27T14:42:08.000Z,32514,213,19,127,False
Футбольные Трансляции,2,17.02.12,ЦСКА - Тосно 6:0. Полный Матч. 01.12.2017 HD,17,2017-12-01T19:18:26.000Z,40691,865,16,1,False
ГТРК ЛНР,2,17.22.11,ГТРК ЛНР. Вести-экспресс. 15.30. 21 ноября 2017,25,2017-11-21T11:53:29.000Z,48427,73,110,0,True
Наталия Власова: официальный канал,2,17.26.12,Наталия Власова - Люби меня дольше (Премьера клипа 2017),10,2017-12-25T07:02:05.000Z,191093,14532,609,314,False
GQ Russia,2,18.03.04,"PHARAOH отвечает на вопросы Смолова, Невзорова, Курпатова и других знаменитостей",24,2018-04-02T07:42:00.000Z,529301,18904,4108,1973,False
"Mix TV, проект портала Mixnews.lv",2,17.01.12,"Главред Эхо Москвы Алексей Венедиктов в программе Встретились, поговорили #MIXTV",25,2017-11-30T13:04:17.000Z,15733,176,14,16,False
Наши военные фильмы,2,17.17.12,ФИЛЬМ ПРОСТО ОБАЛДЕННЫЙ! Крысолов НОВЫЙ РУССКИЙ БОЕВИК 2017,1,2017-12-16T10:00:03.000Z,48256,66,24,3,False
БУДЬ В КУРСЕ,2,17.19.11,COMEDY CLUB 17.11.17 КАМЕДИ КЛАБ - Последний выпуск,23,2017-11-17T17:55:29.000Z,86478,308,126,42,False
Павел Семёнов,2,18.10.05,Инцидент с ветераном 9 мая 2018. Красная площадь. Путин.,25,2018-05-09T09:27:09.000Z,397207,1382,1904,1075,False
Реми,2,18.13.03,КТО ЖИВЁТ В ЭТОМ ЗАБРОШЕННОМ ДОМЕ УЖЕ 10000 ЛЕТ В МАЙНКРАФТ ТРОЛЛИНГ ЛОВУШКА MINECRAFT МУЛЬТИК,20,2018-03-12T07:00:03.000Z,32221,1040,42,69,False
svalka,2,18.12.02,Д̵͢У̡͜͠Д҉҉̷̢Ь͢͠͝Д̡̀У͏̡̕Д̧͟Ь͏̵̛̀Д̵͘͟͠У̨́͘Д͏̧Ь̴҉̀͘͜,22,2018-02-11T18:12:44.000Z,6773,1304,19,155,False
Cool News,2,18.13.02,Крушение АН-148. 11.02.2018,25,2018-02-12T03:13:15.000Z,144095,0,0,259,False
Anna Egoyan,2,18.10.06,Anna Egoyan _ «Друг без друга ...»,22,2018-06-10T14:31:02.000Z,40351,5039,8,107,False
ХИРО и ЛИСА,2,18.10.03,УГАДАЙ РИСУНОК - ПОЛУЧИ ЛИЦЕНЗИЮ MINECRAFT + БЕСПЛАТНЫЙ ПИАР,20,2018-03-09T11:56:54.000Z,45155,5270,445,82,False
One Fight,2,18.16.02,🔴САМЫЕ ЧЕСТНЫЕ ПРИЗНАНИЯ БОЙЦОВ MMA,17,2018-02-15T16:59:57.000Z,8297,850,18,74,False
SaMarinka,2,18.31.05,САМЫЙ РЕДКИЙ NINJA SLIME ||  Слаймы от @slime_shop_vlg_,22,2018-05-31T05:00:00.000Z,14234,583,56,270,False
Coilbook Russia,2,17.25.11,Мультики про #МАШИНКИ 🚒 Пожарная Машина - ВИЛЛИ Водовоз! Герои Нашего Города! Мультфильм для детей,1,2017-11-24T11:21:55.000Z,76102,159,66,19,False
Tapmoney,2,18.23.01,TAPMONEY - Мобильный заработок. Или как зарабатывать на установке игр Android,24,2018-01-22T10:18:31.000Z,81142,4134,637,1625,False
SMILE MUSIC,2,18.12.03,САМЫЕ ЗАПОМИНАЮЩИЕСЯ САУНДТРЕКИ ИЗ ФИЛЬМОВ; ЧАСТЬ -2,10,2018-03-11T14:24:55.000Z,9819,497,17,51,False
Dan,2,18.02.02,Воронины 17 сезон 10 серия,23,2018-02-01T14:35:52.000Z,14799,149,8,7,False
ШКОЛА НАСТРОЕНИЯ,2,18.13.03,ЛУЧШИЕ ПРИКОЛЫ 2018 МАРТ #10 | ЛУЧШАЯ ПОДБОРКА | ТОПОВЫЕ ПРИКОЛЫ,22,2018-03-12T05:59:29.000Z,37562,1067,80,226,False
Nikita Belyanin,2,18.28.03,КЕМЕРОВО ЗИМНЯЯ ВИШНЯ - О ЧЕМ НАМ НЕ ГОВОРЯТ,22,2018-03-27T13:44:00.000Z,168976,1240,1672,385,False
CalvinHarrisVEVO,2,18.03.05,"Calvin Harris, Dua Lipa - One Kiss (Official Video)",10,2018-05-02T23:01:00.000Z,1026868,124071,3074,7642,False
Shon mc life,2,18.14.01,Шон мс   Ответ да мастер исмайл да элон да рет тч да сапернико батл,22,2018-01-13T11:07:40.000Z,59870,7308,258,3305,False
SampleTerminator,2,18.07.02,SampleTerminator - Ядерная Война (feat. Utopia Show),10,2018-02-06T12:36:38.000Z,80789,8997,720,321,False
Cao Son Nguyen,2,18.05.06,SƠN TÙNG M-TP - CHẠY NGAY ĐI (RUN NOW) - GRAND PIANO COVER BY CAO SON | CHẠY NGAY ĐI VIDEO CONTEST,10,2018-05-21T10:42:40.000Z,278562,2930,174,202,False
КНИГА ТАЙН,2,18.04.01,"РАСКРЫТА ГЛАВНАЯ ТАЙНА НЛО, О КОТОРОЙ МЫ НИЧЕГО НЕ ЗНАЛИ!",1,2018-01-03T08:00:01.000Z,20911,94,21,12,False
Флорт,2,18.13.03,НУБ ЗАТРОЛЛЕН НЕВИДИМЫМ ПРО НУБИКОМ В МАЙНКРАФТ! ТРОЛЛИНГ ПРО НЕВИДИМКОЙ В МАЙН! 100% ТРОЛЛИНГ НУБА!,20,2018-03-12T11:00:08.000Z,19725,1295,92,1471,False
Кухня Продакшн,2,18.06.02,Хорошо ли ты знаешь своего президента?,23,2018-02-05T04:07:41.000Z,389666,5461,17145,3563,False
Shocadelic,2,18.25.01,Жена разбивает бошку неверному мужу,23,2018-01-24T07:44:27.000Z,330909,2118,24053,1205,False
Эрик Рикка,2,18.20.01,ГАЙД: ЧТО ДЕЛАТЬ НА КОНЦЕРТЕ? 7 СОВЕТОВ ДЛЯ НАЧИНАЮЩИХ,22,2018-01-19T13:44:47.000Z,11305,1156,45,116,False
The AFC Hub,2,18.28.01,Vietnam vs Uzbekistan (AFC U23 Championship 2018: Final),17,2018-01-27T12:54:53.000Z,675867,4213,2445,1964,False
koma life,2,18.08.03,Муроҷиати Фируза ба мардуми тоҷик / барои Модараш,22,2018-03-07T14:30:18.000Z,60930,1095,213,885,False
Геннадий Азаров,2,17.21.11,Жучков ГИБДД ЮЗАО. Операция не трезвый водитель. 20.11.2017,2,2017-11-20T09:19:25.000Z,5498,373,19,49,False
Мегаполис,2,17.15.11,Попытка автоподставы на КАД,2,2017-11-13T16:12:20.000Z,52836,25,10,9,False
GolosTV UA,2,17.12.12,Процесс над Саакашвили: Что происходит под Печерским судом,25,2017-12-11T14:40:33.000Z,51205,521,32,192,False
Open Ukraine,2,17.19.11,"СТЕНА МЕЖДУ КРЫМОМ И УКРАИНОЙ, ЗРАДА ЧИ ПЕРЕМОГА?",25,2017-11-18T12:51:25.000Z,4829,397,44,364,False
Папа Мама Сын,2,17.10.12,САША ХОТЕЛ РАССТАТЬСЯ?!,22,2017-12-09T10:58:26.000Z,111844,12760,82,386,False
Best Moments EVER,2,17.15.11,Top 5 Best auditions America's got talent 2017 ] Judges shocked !!Got talent global,10,2017-11-14T15:08:23.000Z,8955,160,12,10,False
Periscope TV,2,18.29.05,Сестра Крида - хотите правду?- получайте! Клюкина,22,2018-05-28T15:30:48.000Z,265652,3670,696,583,False
ЛЕСНЫЕ,2,18.19.05,ВЕРНУЛИСЬ В ДОМ НА ДЕРЕВЕ ПОСЛЕ СУРОВОЙ ЗИМЫ И ВОТ ЧТО ПОТОМ ПРОИЗОШЛО... | Bushcraft Tree Shelter,22,2018-05-18T10:10:59.000Z,86613,6606,141,439,False
Martina А - Практическая эзотерика,2,18.14.05,💣 САМЫЙ ОПАСНЫЙ ДЕНЬ МАЯ \\  14 МАЯ - ТЫ ДОЛЖЕН ЭТО ЗНАТЬ!,22,2018-05-13T19:20:41.000Z,5914,948,15,105,False
Политолог РФ,2,17.23.11,Валентин Катасонов - Что стоит за з@держанием Сулеймана Керимова 22.11.2017,29,2017-11-22T16:20:11.000Z,5883,114,4,26,False
ATT MUSIC Records,2,18.31.01,Teaser | One Girl | ATT-Anurag Tomar | Full Song Coming Soon | ATT MUSIC | 2016,22,2016-08-14T04:59:12.000Z,19397,31,1,4,False
Николай Дульский,2,18.04.03,Я поставлю раком Порошенко и поимею  Онищенко раскрыл суть Вальцмана.,25,2018-03-03T19:22:22.000Z,46633,1425,38,214,False
Deaf MuratoFF,2,17.14.11,Права работающего инвалида 3 группы по слуху.,22,2017-11-13T14:09:18.000Z,3587,186,2,9,False
Erich Hartmann,2,18.20.02,"Ответ Илону Маску. Спелый, сочный, запретный плод не пройдет! Россия вперде!",22,2018-02-19T15:04:46.000Z,3902,0,0,121,False
Новости СНГ,2,17.18.12,"ПУТИН ΗE ΧΟЧEТ CПACAΤЬ УΚΡAИΗУ, ΜΕP3ABΕЦ — Вадим Карасев — Последнее 2017 — Декабрь 2017",22,2017-12-17T04:00:01.000Z,25010,30,75,63,False
AmBer KlonDike,2,17.21.11,Полный Альбац - Путин после Вьетнама решил на выборы не идти! 20.11.17,22,2017-11-20T18:39:43.000Z,8552,105,25,26,False
KaverzZza,2,18.21.01,Пародия в поддержку ульяновских курсантов от конников.,19,2018-01-19T22:34:30.000Z,107389,3374,293,588,False
OKA FM,2,17.14.12,Инна Шейкина о ситуации с дочерью,25,2017-12-13T06:14:02.000Z,8113,16,2,8,False
Raiska fanvideo,2,17.06.12,Полнолуние 1 фрагмент к 23 серии русские субтитры,1,2017-12-05T14:15:09.000Z,7679,23,2,7,False
Goar Avetisyan,2,17.22.11,"Подстава в Нальчике, ошеломляющий мастер-класс в Бишкеке, Эльбрус, преображение труженицы Розы. Vlog",22,2017-11-21T18:14:58.000Z,20234,920,32,77,False
Love Romatic,2,17.29.12,Best Old English Love Songs♥♥♥♥Love Songs 80's 90's Collection♥♥♥♥Greatest Old Love Songs,10,2017-12-28T02:41:00.000Z,991246,2335,720,151,False
Dwarty,2,18.22.02,Зимние олимпийские игры 2018 Алина Загитова короткая программа мировой рекорд Олимпиада,17,2018-02-21T08:17:13.000Z,532164,8322,270,872,False
Ҝאygĩאya,2,18.05.01,"Мне сказали, что я переродилась дочкой короля○30",26,2018-01-04T20:37:26.000Z,12469,991,4,181,False
Xoşqədəm Hidayətqızı official,2,18.18.01,Könül Xasıyevanın həyat yoldaşı kimdir? Gecənin gəlməsini... Özəl müsahibə! / Seni axtariram,24,2018-01-17T09:14:50.000Z,47152,442,60,157,False
Blossom,2,18.25.02,Super Cool Clothing Revamps and More Life Hacks by Blossom,26,2018-02-24T11:11:10.000Z,2293127,26798,2370,1209,False
Галс-Девелопмент,2,17.30.12,Градусы и Галс-Девелопмент - Город наш с тобою,29,2017-12-29T06:00:04.000Z,185594,0,0,0,True
Anush Petrosyan,2,17.25.12,Anush Petrosyan - Achkes Chanaparit 2017 █▬█ █ ▀█▀,10,2017-12-23T22:37:45.000Z,157020,4830,183,357,False
OK Go,2,17.24.11,OK Go - Obsession - Official Video,10,2017-11-23T20:04:44.000Z,411462,14197,188,1018,False
Народная правда,2,18.05.01,Павел Грудинин - Вся правда о том кто говорит «правду о Путине»,22,2018-01-04T06:33:47.000Z,126876,2196,5467,1342,False
Телеканал ТВ-3,2,18.05.04,Гоголь. Вий 2018 — Официальный трейлер,24,2018-04-02T12:07:42.000Z,17018,148,32,17,False
DED FOOTBALL,2,18.18.02,СТАВКА 30 000 РУБЛЕЙ | ЧЕЛСИ-БАРСЕЛОНА | ЛИГА ЧЕМПИОНОВ | ДЕД ФУТБОЛ | ПРОГНОЗ |,17,2018-02-17T14:00:02.000Z,10475,1256,52,252,False
СТАРЫЙ В ОГНЕ,2,17.31.12,У Лиззки ЕСТЬ ПАРЕНЬ?💕/ Уроки Жизни от Дани Кашина🔪 / Ответы на наши вопросы❓,22,2017-12-30T18:32:55.000Z,73909,6694,246,348,False
Алексей Ильич Осипов,2,17.18.11,Выступление профессора Осипова А.И. в Екатерининском зале Кремля 15 ноября 2017 года,27,2017-11-16T19:13:10.000Z,17413,1609,33,175,False
ARTV ARTV,2,17.23.11,Козицын о ситуации в Луганске,25,2017-11-22T15:51:13.000Z,19024,175,47,134,False
КИСИМЯКА LIVE,2,18.16.01,Волан-де-Морт: Корни наследника – фильм по вселенной Гарри Поттера | Voldemort: Origins of the Heir,26,2018-01-15T10:30:01.000Z,24081,2082,90,169,False
Нина Озвучивает,2,18.24.04,Я попала во френдзону || Русская озвучка,1,2018-04-23T13:15:00.000Z,68510,7019,74,664,False
Вечерний Квартал fan,2,17.06.12,Самые богатые люди Киева - этот номер порвал зал! СТАРОЕ которое лучше НОВОГО! Ржу не могу!,23,2017-12-05T15:49:45.000Z,57802,326,62,15,False
Komissarov . DS,2,18.28.03,Чиновник хамит женщине Митинг в Кемерово 27.03.18,29,2018-03-27T07:06:00.000Z,91379,477,33,245,False
Байки Митяя,2,18.28.03,ЭКСКЛЮЗИВ! СТРАШНЫЕ КАДРЫ ВНУТРИ ТЦ Зимняя Вишня В КЕМЕРОВО!,22,2018-03-27T07:12:02.000Z,277099,658,352,338,False
Chuchi Kulobi,2,18.01.01,Табрикоти Чучи Кулби.Соли нав муморак хамватанони азиз!,22,2017-12-31T16:14:25.000Z,49968,1138,220,0,True
GamePlay NIGGA,2,18.06.04,"Премьера 2018 взорвала весь интернет! ВКУС ЖИЗНИ Русские мелодрамы новинки 2018, фильмы HD",20,2018-04-04T14:14:52.000Z,125326,285,133,15,False
Trend Tube,2,17.03.12,От судьбы не зарекайся 3-4 серия (2017) Сериал фильм мелодрама,22,2017-12-02T14:31:11.000Z,7542,9,4,1,False
Clown Show,2,18.21.01,БИАТЛОН 20.01.2018. ГОНКА ПРЕСЛЕДОВАНИЯ. МУЖЧИНЫ. КУБOK МИРА 2017-2018,17,2018-01-20T15:11:59.000Z,30654,200,36,22,False
AnTOnY GAMER,2,17.18.12,BRICK RIGS: НАШЛИ В КАНЬОНЕ ЗАБРОШЕННЫЙ БМВ ИЗ МОСТ ВАНТЕД! ЧТО С НИМ? РЕАЛЬНАЯ ЖИЗНЬ В БРИК РИГС,20,2017-12-17T12:00:00.000Z,41056,1413,143,81,False
Mshecin Msho ԲԱՑԱՌԻԿ,2,18.27.04,Գյուղապետի Ցնցող ելույթը Հանրապետության Հրապարակում 26․04․18,25,2018-04-26T19:14:59.000Z,28350,615,27,40,False
HappyTown - LeTSPLaySHiK,2,18.13.03,ВЕЧЕРНИЙ СТРИМ С МИСТИКОМ! МИНИ ИГРЫ - FunTime,20,2018-03-12T16:44:32.000Z,54418,5719,166,248,False
Anthem Game,2,18.10.06,Anthem Official Cinematic Trailer (2018),20,2018-06-09T18:58:37.000Z,1504564,32433,4317,6105,False
ДИЗАЙН ИНТЕРЬЕРА С SHELNAT,2,18.05.01,"МОИ СТИЛЬНЫЕ НЕТ В ДИЗАЙНЕ ИНТЕРЬЕРА, ДЕКОРЕ И РЕМОНТЕ или 7 ИНТЕРЬЕРНЫХ ТАБУ",22,2018-01-04T12:18:02.000Z,9143,845,23,367,False
ЗА ГРАНЬЮ,2,18.10.05,4 ТРУПА В ЗАБРОШЕННОМ ДОМЕ | НАШЛИ КАРТОЧКИ МЕРТВЫХ ДЕТЕЙ НА ЗАБРОШКЕ,22,2018-05-09T08:37:54.000Z,26023,2822,168,330,False
НОВОСТИ СЕРИАЛОВ,2,18.23.04,"Фазилет 44 серия ПОЧЕМУ перенесли, Когда выйдет",1,2018-04-22T05:00:03.000Z,18272,146,18,44,False
Oh Guys,2,18.04.03,БЕСИТ ЗИМА,22,2018-03-03T15:10:45.000Z,16449,772,11,53,False
Кино Пробка,2,18.07.03,ЧУЖАЯ 4 Серия - Смотреть онлайн / Премьера 2018 года @ Мелодрама новинка,1,2018-03-06T13:07:49.000Z,33203,74,18,3,False
Timofey KO,2,18.08.02,🔥 VERSUS: GUF VS ПТАХА - РЕЗУЛЬТАТЫ БАТЛА / ГУФ ПОБЕДИЛ?  (обязательно к просмотру),24,2018-02-07T05:33:17.000Z,349145,3088,1046,523,False
LinguaTrip TV,2,17.20.12,"ГОВОРИМ, КАК АМЕРИКАНЦЫ! БАТТЛ по английскому. Регина Тодоренко vs Дима Пистоляко (Часть 2)",27,2017-12-20T05:00:01.000Z,2250,249,1,11,False
Silvia Sahakyan,2,17.18.11,4 ВКУСНЫХ И ПРОСТЫХ САЛАТА 🥗 ПАРА МИНУТ И ГОТОВО!,26,2017-11-17T08:00:05.000Z,11846,1685,29,123,False
Столица Мира,2,18.27.01,ВАЖНАЯ ИНФОРМАЦИЯ ДЛЯ ВОДИТЕЛЕЙ ТАКСИ МОСКВЫ И ОБЛАСТИ,22,2018-01-27T03:27:14.000Z,952,102,17,76,False
Мой Домик в Деревне,2,18.09.02,"#43 Жизнь за кадром. Праздник живота Готовим лагман, шашлычок и фирменные МАКСБУРГЕРЫ!!!",22,2018-02-09T05:54:21.000Z,693,74,3,11,False
КОШКА ЛАНА,2,17.11.12,НОВЫЙ ПРИВЕТ СОСЕД С ЛЕО #1 Hello Neighbor ACT 1 КОШКА ЛАНА И КОТ ЛЕОНАРД играют,20,2017-12-10T08:54:54.000Z,61290,1414,38,480,False
Serafim Ymarov,2,17.03.12,Kawri's Whisper - The Hands Resist Me. Chorea,10,2017-12-02T05:41:54.000Z,101975,447,1852,265,False
Looks Show,2,17.14.11,Званый Ужин ТРЭШ-ОБЗОР (Беззубая Королева),23,2017-11-13T17:20:12.000Z,47457,4507,245,522,False
STEFF-A,2,17.16.12,STEFF-A - Среди миллионов глаз (Премьера песни),22,2017-12-15T05:31:58.000Z,119481,1364,446,170,False
AGAYAMUSIC,2,17.22.12,"AGAYA - Игра (Не надо слез) Chinkong Remix (Премьера клипа, 2017)",22,2017-12-21T07:05:19.000Z,106768,4740,398,57,False
NeYorick,2,17.30.11,У депутата бомбануло! | На правах стеба.,22,2017-11-29T05:59:59.000Z,105997,736,179,49,False
KDDK Rap,2,18.03.02,KDDK - Heroes (Official Music Video),22,2018-02-02T10:19:52.000Z,131601,169,533,94,False
scarlxrd,2,18.10.03,scarlxrd - FADED.,10,2018-03-09T16:59:47.000Z,282885,54248,439,7185,False
Big ideas,2,17.27.11,ЭТОТ ТЕСТ ПРОВЕРИТ ТВОЮ ПАМЯТЬ! Без ошибок пройдут только 5%,24,2017-11-26T08:11:55.000Z,20847,582,59,431,False
Анастасия Жданова,2,18.27.03,Страшный пожар в Кемерово ((( дети прыгают с окон,22,2018-03-25T14:32:09.000Z,19734,59,19,41,False
arigustv,2,18.20.01,Спецвыпуск вечернего «Восточного экспресса»,22,2018-01-19T13:53:36.000Z,6535,36,1,25,False
Official Carder,2,18.09.01,Paytm carding 2018 with refresh proof || official carder||,27,2018-01-08T08:48:48.000Z,23739,808,217,90,False
ЯРИК TRUMP,2,18.13.03,ЧЕЛЛЕНДЖ!!! ШОКОЛАД против НАСТОЯЩЕГО...!!!,24,2018-03-12T08:28:03.000Z,71107,1708,193,1103,False
Обзор TV,2,18.02.04,Под Путиным зашаталось кресло,22,2018-04-01T17:29:01.000Z,52842,1391,58,250,False
Farmik,2,18.05.01,"Реакция D.K. inc на: D.K VS STAVR - Я ФИФЕР (РЕАКЦИЯ, МНЕНИЕ)",20,2018-01-04T15:23:23.000Z,34162,938,51,57,False
Alexander S,2,18.20.04,"Мама и отец Игоря Вострикова в суде дают показания по делу Генина,  РЕДКИЕ КАДРЫ!",22,2018-04-15T17:16:40.000Z,24595,214,17,217,False
FAKEL,2,18.01.01,Мой дорогой профессор...,10,2017-12-31T06:41:27.000Z,177891,1967,583,80,False
News Front,2,17.16.11,Когда украинской будет Москва. Отака Краина с Дидом Панасом. Выпуск 19,29,2017-11-14T14:27:06.000Z,72572,152,282,76,False
DILLERON ★ Play,2,17.10.12,КОМНАТА МЫШОНКА - ПРЯТКИ МАЙНКРАФТ #139,20,2017-12-09T11:00:04.000Z,270234,9722,413,1865,False
Турецкие сериалы Перевод и Озвучка.,2,18.12.01,Чёрная жемчужина 15 серия 2 фрагман в озвучке от Ирины Котовой,22,2018-01-11T07:57:17.000Z,8851,73,1,24,False
HalBer,2,18.01.01,НАША РЕАКЦИЯ НА НОВОГОДНИЙ ОГОНЁК!  **бомбит** | HalBer,24,2017-12-31T12:15:51.000Z,87226,10573,221,483,False
Срочные известия,2,18.16.05,Зaявлeнue Путина пocтaвило на yши весь мир,22,2018-05-15T13:26:52.000Z,331050,2148,875,587,False
SAID D,2,18.10.03,Тоҷикбача  Китаянка ро ба зани гирифт! Чамшед Халим чи мегуяд,10,2018-03-09T11:06:26.000Z,35431,793,28,96,False
WOMAN INSIGHT Центр женского развития,2,17.07.12,7 поступков перед Днем Рождения-которые изменят твою Жизнь,22,2017-12-06T19:25:06.000Z,17215,1453,14,43,False
DIKAYA OFFICIAL,2,17.15.11,"DIKAYA - ВСЁ РАВНО (премьера клипа, 2017)",10,2017-11-14T06:30:08.000Z,130780,2048,2282,366,False
vestisochi,2,18.15.03,Отчим пропавшей девочки признался в убийстве,25,2018-03-14T18:14:07.000Z,11477,30,6,7,False
Алик Майт,2,17.15.12,Алик Майт - Упали в любовь (Премьера 2017),10,2017-12-14T05:06:02.000Z,177023,3754,752,215,False
Ozbek Gelin,2,18.15.02,САМСА РОЗОЧКИ /ATİRGUL SOMSA/ CHOKLİ SOMSA YOKİ TİKİLGAN SOMSA,24,2018-02-15T12:00:33.000Z,5112,547,21,131,False
Uzeyir Mehdizade Official,2,18.10.06,Uzeyir Mehdizade - Yaxsi Olar  ( Official Video Clip ) 2018,24,2018-06-10T11:30:01.000Z,116733,8300,122,1553,False
ПриЛучший о Павле,2,18.15.01,Неделя от Прилучных№39(Тимофею 5 лет!),23,2018-01-14T09:35:01.000Z,6425,188,7,17,False
Roman Kostomarov,2,17.15.11,КРИПТОВАЛЮТА НА ФОРЕКС: НАДЕЖНАЯ СТРАТЕГИЯ ТОРГОВЛИ И ЗАРАБОТКА,22,2017-11-14T20:19:15.000Z,10071,14,2,0,False
euronews (на русском),2,17.19.11,"Умер Малькольм Янг, гитарист AC/DC",25,2017-11-18T17:31:20.000Z,2880,53,0,44,False
Yardrey,2,17.18.12,Toyota LAND CRUISER 200 - КОНЕЦ ЛЕГЕНДЫ,2,2017-12-17T06:08:49.000Z,136918,1906,616,363,False
Yuriy,2,18.28.03,На митинге в Кемерове кричат Путина в отставку,25,2018-03-27T07:13:03.000Z,464600,6502,7985,3209,False
Друзья Глухих Friends Deaf FDeafcom,2,17.20.12,Скандальное видео-путь к славе? интервью с Вероникой Светловой,22,2017-12-18T23:56:48.000Z,14042,135,37,13,False
The Братья,2,17.14.12,Премия Vklybe.tv 2017. Розыгрыш от Курова: Щётка за 22.000 руб. Смешной Опрос.,22,2017-12-13T10:39:32.000Z,128705,5135,3141,793,False
Svetlana -obovsem про САД и ОГОРОД,2,18.12.06,СУПЕР СМЕСЬ ПРОТИВ ФИТОФТОРЫ.. СРЕДСТВО БОРЬБЫ И ПРОФИЛАКТИКА.. ФИТОФТОРЫ НЕ БУДЕТ!!!,26,2018-06-11T14:31:10.000Z,29433,1660,41,21,False
Музей НАРГИЗ,2,18.31.05,"Наргиз Закирова Там, где клен шумит Подольск, 28.05.2018.",10,2018-05-29T19:08:00.000Z,22041,362,65,14,False
Любовь Баландис,2,18.08.03,Скачать 8 марта. Поздравления с 8 МАРТА!!!,22,2018-03-02T14:00:02.000Z,21465,81,8,1,False
Кинотеатр,2,17.24.12,"Скромная провинциалка 2017 (новый сериал, мелодрама новинка 2017)",22,2017-12-23T18:53:04.000Z,99283,539,149,47,False
krupelgo,2,17.09.12,Навальный 2018 - единственный президент,22,2017-12-08T07:04:36.000Z,123675,3223,7953,1566,False
Татьяна Путинцева,2,18.02.04,Бесподобные Новинки ФИКС ПРАЙС //FIX PRICE апрель 2018// Обзор полочек,22,2018-04-01T06:59:21.000Z,13675,105,36,29,False
Red Cat,2,18.23.03,МАЛЬЧИКА НАЗВАЛИ ДЕВОЧКОЙ!!! ЛОЛ СЮРПРИЗ КОНФЕТТИ ПОП | L.O.L. SURPRISE CONFETTI POP | Братик LOL,24,2018-03-22T13:00:03.000Z,49518,930,94,200,False
Рыбалка 68,2,18.10.02,Они ломают крючки...! Ловля судака зимой на балансир. Зимняя рыбалка в Астрахани.,26,2018-02-09T14:57:33.000Z,9748,427,22,99,False
PRIME POLITICS,2,18.27.04,СВЕЖАК! ЗАЯВЛЕНИЕ ООН ОТ КОТОРОГО ВОЛОСЫ ВСТАЮТ ДЫБОМ (27.04.2018),25,2018-04-21T07:00:04.000Z,232388,1125,231,461,False
flamieFF,2,18.27.03,"ТЦ Зимняя вишня, Кемерово. Запись с камер наблюдения в детском зале. Это самое начало пожара",22,2018-03-26T11:11:49.000Z,157221,370,44,298,False
Жан Содель,2,18.10.05,ALEKSEEV за бортом... фальшь и дрожь? / Евровидение-2018 / Алексеев / Eurovision,22,2018-05-09T02:51:45.000Z,55738,445,355,586,False
MyGap,2,18.21.03,Устаревшая Система Образования,27,2018-03-20T16:00:03.000Z,65815,13115,329,1685,False
Swasti Ji,2,18.04.03,ОГРОМНЫЙ ЧокОпай! Нереально Вкусно!,24,2018-03-03T11:00:00.000Z,88116,8043,294,888,False
Fitonomy,2,18.06.06,HIIT CARDIO FOR WEIGHT LOSS - BIKINI BODDY,22,2018-06-05T13:38:32.000Z,159680,625,112,47,False
"Из города в деревню, опыт многодетной семьи",2,17.26.11,Как я отношусь к порядку? Какие приходят дети после прогулки.,1,2017-11-25T12:00:40.000Z,5017,444,13,118,False
Ĥúkķέλツ,2,18.13.03,"MAP | СОВЕРГОН - НАД ВАМИ | 22,23 part.",20,2018-03-12T11:40:24.000Z,2048,315,7,70,False
Love What Matters,2,18.13.01,When Your Girls Insist The Costco Clerk Is Maui from Moana,22,2018-01-10T00:04:29.000Z,194967,1499,240,201,False
Mehmet Ünlü,2,17.27.12,Boks makinesi rekoru,17,2017-12-01T15:00:00.000Z,14276,16,0,3,False
Legioner,2,18.05.04,ТЦ Зимняя Вишня новые кадры,22,2018-04-04T02:36:09.000Z,53438,350,63,187,False
HAUNTED FAMILY,2,18.02.03,KIZARU - Негодяй,10,2018-03-01T18:52:08.000Z,184732,19593,1871,2425,False
Хабархо/Habarho,2,18.02.01,Соли нав дар Тоҷикистон (01.01.2018),25,2018-01-01T01:44:24.000Z,181807,881,507,507,False
Yelaket Lratvakan,2,18.24.04,Արտակարգ թողարկում Վարչապետ Սերժ Սարգսյանը հրաժարական տվեց.,25,2018-04-23T13:16:35.000Z,166485,1694,436,804,False
Novosti_ Maks,2,17.22.12,♨️Бузова не верит больше мужчинам,22,2017-12-21T17:47:40.000Z,6860,44,6,8,False
Кукла для Души,2,18.14.01,Королева СКЕЛИТА! Как сделать ООАК на кукле МОНСТЕР ХАЙ СКЕЛИТА Как сделать ПАРИК,26,2018-01-13T07:41:37.000Z,33707,1938,45,672,False
Ильдар Уракаев,2,18.01.01,В Уфе на ГорСовете горит Елка.,22,2017-12-31T17:48:47.000Z,12743,53,92,28,False
Живая мишень,2,18.19.01,Кто контролирует русский YouTube?,22,2018-01-18T08:30:52.000Z,123426,0,0,0,True
MrHald,2,18.13.03,КОМУ ПОВЕЗЕТ БОЛЬШЕ?! САПЕР ИЗ ЛАКИ БЛОКОВ В МАЙНКРАФТ,20,2018-03-12T11:55:31.000Z,45881,3028,140,400,False
AlcoFunk,2,17.12.12,Где камбуля?),10,2017-12-11T11:03:20.000Z,76381,964,25,146,False
harekrishnazpinfo,2,18.30.03,Кемерово: жертвоприношение детей в пасхальную неделю,27,2018-03-28T10:12:15.000Z,31939,913,89,399,False
Зачетная Отборочка,2,18.27.01,"КОГДА УЗНАЛА, ЧТО У НЕГО 28 СМ  | ЗАЧЕТНАЯ ОТБОРОЧКА №162",24,2018-01-26T09:18:41.000Z,121014,1331,336,145,False
ПРО ПУТЕШЕСТВИЯ Travel TV,2,17.25.12,Как я проехал полмира на Toyota Land Cruiser 200,19,2017-12-24T07:16:24.000Z,87340,1379,59,81,False
Camila Cuevas,2,18.07.04,My Promise - Glitchtale S2 Ep #5,1,2018-04-06T20:22:44.000Z,272123,39450,231,22007,False
Alcotuber,2,18.12.02,Очевидцы сообщили о сильном хлопке перед крушением Ан-148,25,2018-02-11T17:15:36.000Z,7559,20,10,13,False
Навальный. Неофициально.,2,18.27.02,Честная реклама выборов,23,2018-02-26T14:02:19.000Z,119306,11384,36110,2798,False
やまなみハイウェイ観光連携協議会,2,17.29.12,やまなみ訪遊プロジェクト_九重編 / 九州/推荐观光/推薦觀光/규슈 추천 관광 명소,22,2017-12-04T04:17:54.000Z,34093,15,0,0,False
Нежданный Бойка,2,18.12.03,"CS:GO КЕЙСЫ - НАЕ**ЛИ НА 7К РУБ. (КЛАСС, СПАСИБО CSGONET И КАКОЙ-ТО ХУ*ЙСДРОП)",20,2018-03-11T23:04:54.000Z,24746,3023,364,7,False
политическая карта,2,18.25.03,"Дончанка, не сдерживаясь, оторвалась от всей души на брутальных экспертах!",25,2018-03-19T09:04:39.000Z,12289,123,19,49,False
СВАТ,2,18.24.05,"КОРОЧЕ ГОВОРЯ, УБИЛ GRANNY! [От третьего лица] КОРОЧЕ ГОВОРЯ, GRANNY В РЕАЛЬНОЙ ЖИЗНИ!",22,2018-05-23T14:10:32.000Z,42239,2145,252,188,False
ALI OSMANOV,2,18.15.05,Парни и Малыш Танцуют Красиво С Девушкой На Кавказе 2018 Lezginka ALISHKA SEVCAN ELCHIN UMID,22,2018-05-14T13:20:25.000Z,103250,1248,396,174,False
Интересные факты,2,18.24.02,"ЕДА ШКОЛЬНИКОВ В СОВЕТСКИХ СТОЛОВЫХ, КОТОРУЮ ПОМНЯТ НАШИ РОДИТЕЛИ",22,2018-02-24T01:06:20.000Z,2669,249,18,46,False
ПРОГРЕССОР,2,17.19.11,"100 СПОСОБОВ ЗАРАБАТЫВАТЬ 5000 В ДЕНЬ. БЕЗ ВЛОЖЕНИЙ, ПРЯМО СЕЙЧАС.",22,2017-11-18T06:04:17.000Z,117641,0,0,0,True
LF City. TV,2,17.17.12,Юлия Рыбакова - Ищу тебя (премьера клипа 2017),22,2017-12-16T07:04:34.000Z,150059,5827,7179,1156,False
MadCap Internet,2,17.15.11,GROWER HIDES FROM SWAT IN WAREHOUSE CLOSET,22,2017-11-14T01:01:16.000Z,194067,932,99,128,False
Tony!,2,18.13.03,НУБ ПРОТИВ НЕВИДИМКА В МАЙНКРАФТ ! НУБИК И ТРОЛЛИНГ ЛОВУШКА MINECRAFT НУБ Мультик,20,2018-03-12T08:00:01.000Z,102170,2676,151,104,False
UzLiveTV,2,17.25.12,ҚАЙНОТА ЎЗ КЕЛИНИНИ СЕВИБ ҚОЛИБТИ ИШОНМАСАНГИЗ ЎЗИНГИЗ КЎРИНГ,25,2017-12-24T12:49:05.000Z,6676,77,22,74,False
SkyShips,2,18.14.02,"Ту-204 - не в то время, не в том месте. История и описание лайнера",28,2018-02-13T16:19:08.000Z,19267,2204,29,275,False
КУЗНЕЦ ПРИКОЛОВ,2,18.01.03,ЭТИ ПРИКОЛЫ РВУТ ИНТЕРНЕТ. 10 МИНУТ ОТБОРНЫХ РУССКИХ ПРИКОЛОВ 2018.  ЛУЧШАЯ ПОДБОРКА # 33,23,2018-03-01T07:23:48.000Z,705,22,9,3,False
Ворота въ Крымъ,2,17.09.12,Крымскій мостъ 4K: ТП «Керчь» и сносъ Верхней Цементной слободки (мини-роликъ),28,2017-12-08T14:48:38.000Z,4219,97,2,31,False
Meladze Music,2,18.19.02,Вера Брежнева - Ты мой человек (Official video),10,2018-02-19T04:44:42.000Z,14161,1887,136,187,False
Черный Волк,2,18.31.01,Тренировка Шаолиньского МОНАХА в РЕАЛЬНОЙ ЖИЗНИ - Shifu Yan Lei Кунг Фу мотивация,17,2018-01-30T07:00:00.000Z,13095,0,0,32,False
Roy Woods,2,18.05.06,Roy Woods - Something New (Official Video),10,2018-05-29T15:59:03.000Z,325666,5567,165,437,False
Diana Naikova,2,18.13.03,ЧТО НЕ ТАК С ЭТИМ МИРОМ В МАЙНКРАФТ?!,20,2018-03-12T11:00:03.000Z,75193,6765,147,1302,False
Lil Skies,2,18.03.05,Lil Skies - Lust [Official Video] (Dir. by @NicholasJandora),10,2018-05-02T22:00:08.000Z,332444,47233,148,3750,False
RCNTEC channel,2,18.13.01,RPCM. Smart PDU. Управление электропитанием. Первое знакомство.,28,2018-01-12T05:58:37.000Z,227555,2477,1467,434,False
Китай Г.,2,17.05.12,БАТАРЕЯ ИЗ СВЕТОДИОДОВ ИЛИ СВЕТ ИЗ АДА🔥1000w led ФОНАРЬ НА 1000 ВАТТ,22,2017-12-04T11:53:32.000Z,60661,3219,156,336,False
Саша Тилэкс,2,17.08.12,Перепел ЗЕМФИРУ под Havana - Camila Cabello ft. Young Thug (cover by Тилэкс),22,2017-12-07T10:02:02.000Z,82163,9199,562,598,False
Алия Авзалова,2,18.21.05,"Короче говоря, GRANNY новые правила игры",22,2018-05-20T13:00:03.000Z,19168,2513,40,182,False
Кино Огонь,2,18.06.03,"ЛОУРЕНС СТАНОВИТСЯ МЕМОМ, ФОРМА ВОДЫ - ФИЛЬМ ГОДА [КРАТКИЙ ПЕРЕСКАЗ ОСКАРА]",1,2018-03-06T02:18:37.000Z,11505,1106,45,73,False
Жёлтый Instagram,2,17.25.11,Свадьба часть2 Евгения Кузина и Александры Артемовой Дом 2,22,2017-11-24T16:05:12.000Z,38082,106,109,30,False
Ёгурт,2,17.02.12,Арсенал 0-1 Спартак Обзор матча HD 01.12.2017,22,2017-12-01T19:10:02.000Z,19558,127,7,10,False
Ekaterina Saibel,2,18.09.01,VLOG: Готовлюсь к Рождеству / Сельдь под шубой / Мы в телевизоре,22,2018-01-08T14:00:08.000Z,147735,5648,193,957,False
Видео Поздравления,2,18.08.03,Красивое поздравление с 8 Марта 🌹 Миллион алых роз 2018,22,2018-03-07T21:41:09.000Z,13287,67,6,2,False
Информатик БУ,2,18.28.05,"Большой Стрим #57-2. ЕГЭ по информатике 2018, 11 класс",27,2018-05-27T15:16:36.000Z,59281,2095,93,71,False
Общественный контроль,2,17.26.11,Бесстрашный инспектор Богданов без нагрудного значка,2,2017-11-25T19:52:13.000Z,2771,209,12,93,False
HammAli & Navai,2,18.23.01,"HammAli & Navai - Хочешь, я к тебе приеду (OFFICIAL VIDEO)",22,2018-01-22T11:06:48.000Z,243462,2996,426,154,False
Дом 2 Новости и Слухи Проекта,2,18.18.04,ДОМ 2 НОВОСТИ раньше эфира! (22.04.2018) 22 апреля 2018.,22,2018-04-17T19:57:51.000Z,3670,13,7,1,False
Elimination,2,18.18.03,"[18+] трагедия в гудаури - грузия  | Accident in Gudauri, Georgia Ski",23,2018-03-16T19:13:34.000Z,696827,3793,367,1291,False
Tarber Haxordumner,2,18.02.01,Full House Show Nerkayacum 2017-2018,22,2018-01-01T14:30:00.000Z,96199,1492,102,66,False
Anis Milad,2,18.06.06,The Bucket - By A I Milad [[with lyrics]],10,2018-05-30T07:58:11.000Z,222411,2032,973,350,False
UTV Oren,2,18.12.02,Что происходило в аэропорту Орска после авиакатастрофы в Подмосковье,27,2018-02-11T20:08:29.000Z,4427,15,5,8,False
RusGameTactics,2,18.29.05,Прохождение Detroit: Become Human — Часть 20: Стать человеком [ФИНАЛ],20,2018-05-28T17:00:10.000Z,68073,8037,60,1204,False
Football Highlights & Goals,2,17.22.11,APOEL FC vs REAL MADRID 0-6 ● All Goals & Highlights HD ● 21 Nov 2017 - Champions League,17,2017-11-21T23:43:15.000Z,265723,2090,131,294,False
IrinaVard ШитиЁ моЁ,2,17.04.12,ШЬЁМ СТИЛЬНЫЙ  САРАФАН ИЗ ИСКУССТВЕННОЙ КОЖИ/КРОЙ/Часть 1/IRINAVARD,22,2017-12-03T10:25:11.000Z,5957,397,7,39,False
SNIL TURKDIZI,2,18.17.04,Ты Расскажи Карадениз 13 серия 2 фрагмент (русские субтитры),22,2018-04-16T10:47:40.000Z,10533,45,3,9,False
Докуч,2,17.12.12,РУКИ БАЗУКИ ЛОПНУЛИ,22,2017-12-11T14:46:23.000Z,32470,172,221,31,False
SunnyDays,2,18.13.03,"РОДЫ: от начала до конца. Схватки, роддом и встреча с малышкой. Sunny Days Family",19,2018-03-12T11:29:18.000Z,25107,2553,73,303,False
:::::::::: Половинка,2,17.24.11,Дмитрий Щербина его жены и дети!!!,22,2017-11-23T16:31:35.000Z,5337,29,2,1,False
LilPak100VEVO,2,18.05.06,Pakman Jitt - Perfect Timin (Official Music Video),10,2018-06-03T01:45:00.000Z,219080,21352,344,276,False
LM42,2,18.26.03,пожар зимняя вишня   Кемерово. переговоры пожарных,24,2018-03-26T05:46:16.000Z,74955,988,97,187,False
Mikky Music,2,17.21.12,MIKKY feat. NATY — НЕБО (Премьера 2017),10,2017-12-20T07:02:55.000Z,106301,3473,775,181,False
Хочу Жить,2,18.28.03,400 погибших в Кемерово! Правда о пожаре  25.03.2018,19,2018-03-26T12:10:30.000Z,1124693,6039,3843,2119,False
2kOfficial,2,18.25.01,Kevin 2k X D.Masta - Дикий Ди и Krazy K (Prod. By RedLightMuzik),10,2018-01-24T05:09:13.000Z,100706,123,1836,115,False
Информатор 1.0,2,17.04.12,04 12 2017 ЛЮДИ МЕРЗНУТ КИЕВ В ПАНИКЕ,22,2017-12-03T13:00:04.000Z,13189,24,30,0,True
hemisphere,2,17.06.12,МОК отстранил Россию от ОИ-2018,22,2017-12-05T18:36:46.000Z,5212,39,11,89,False
AKA KASYAN,2,17.24.12,Не выбрасывайте старый принтер! ЭЛЕКТРОШОКЕР ИЗ ПРИНТЕРА.,28,2017-12-23T17:35:07.000Z,72355,5106,97,387,False
WWE,2,18.27.02,Ronda Rousey puts Triple H through a table at her contract signing: WWE Elimination Chamber 2018,17,2018-02-26T05:25:58.000Z,2788033,39292,2447,5223,False
RusProNews,2,18.04.04,В.Путин ПОЛНАЯ ВЕРСИЯ СЛЁЗЫ Эрдоган на лице ВОСХИТИЛИ ВСЕХ ВО ДВОРЦЕ Турция 3 04 2018,25,2018-04-03T18:58:15.000Z,10155,121,11,99,False
Новости из Дурки,2,17.04.12,У РАПЫ ЖИВОТ ВЫРОС В 3 РАЗА! НОВОСТИ 04.12.2017,22,2017-12-03T14:35:57.000Z,5243,25,9,8,False
Настя Эй,2,18.25.03,Ивановы-Ивановы комедийный сериал HD 2 сезон 1 серия,22,2018-03-20T07:55:44.000Z,22763,253,13,0,True
Reutovsos,2,18.22.03,Воробьева в отставку! ЦРБ  ВОЛОКОЛАМСК,22,2018-03-21T15:53:47.000Z,33487,1091,15,519,False
ДВА РОЯЛЯ,2,18.11.03,🚀 ХОВАНСКИЙ ИЗОБРЁЛ КОЛЕСО,22,2018-03-10T09:07:46.000Z,11596,921,102,103,False
Журналистская Правда,2,17.21.11,Школьник из Нового Уренгоя кается в Бундестаге за невинноубиенных бойцов Вермахта,22,2017-11-19T21:06:29.000Z,149072,470,1788,2864,False
Yasak Elma,2,18.29.05,"Zeynep, Cem yakınlığı Alihan’ı hasta etti - Yasak Elma 11. Bölüm",24,2018-05-28T22:57:35.000Z,304657,2237,186,238,False
INSIDER FINANCE,2,18.25.02,ГРУДИНИН. О ВОРОВСКОЙ ШАЙКЕ ОЛИГАРХИИ,22,2018-02-24T15:31:08.000Z,69167,3681,15312,3381,False
catcHDevidsonn,2,18.30.04,"30 seconds to mars - Иван Ургант, Live in Moscow (28.04.2018)",10,2018-04-29T06:07:21.000Z,25153,361,9,8,False
The Best Video,2,18.17.03,"ЧП на канатной дорожке в Грузии 2018, осторожно МАТ",22,2018-03-16T15:37:56.000Z,25090,113,22,76,False
Данил Дрозденко,2,18.01.01,Новогоднее обращение Президента России В.В. Путина - 2018 (31.12.2017 г.),10,2017-12-31T13:15:26.000Z,90166,3344,1661,0,True
PhotohunterRu,2,18.08.03,Допрос инспектора ДПС Климанова. Солнечногорский суд. Арсентьев VS Климанов,29,2018-03-07T20:02:48.000Z,4665,359,10,206,False
ЭмДжей,2,18.27.03,ВСЯ ПРАВДА В ТЦ ЗИМНЯЯ ВИШНЯ В КЕМЕРОВО,22,2018-03-26T15:52:00.000Z,284249,3143,373,1728,False
Broksh,2,18.27.03,ПОЖАР В КЕМЕРОВО | О ЧЕМ МОЛЧАТ СМИ ТЦ ЗИМНЯЯ ВИШНЯ,22,2018-03-26T07:00:40.000Z,1831921,78182,7237,11883,False
basir71,2,18.12.02,Видео крушения самолёта Ан-148 в Мособласти.,25,2018-02-11T20:26:55.000Z,46542,41,26,22,False
Luckyman,2,18.12.06,Подарил Афоне DUCATI Panigale V4,22,2018-06-11T10:40:12.000Z,265582,75765,539,143810,False
HobbyArt,2,17.03.12,Вышивка. Все процессы Ноября 2017. / Мое мнение о турецких пяльцах.,26,2017-12-02T15:54:20.000Z,3799,322,7,29,False
Дмитрий Америка,2,18.05.01,НЕ ДАЛЬНОБОЙ ПО РОССИИ!!!! РАБОТА НА ТОНАРЕ!!!!,2,2018-01-04T13:52:21.000Z,3742,306,8,110,False
ВЯЗАНИЕ- стиль Жизни!,2,17.30.11,НАВЯЗАЛА в ноябре// Готовые работы//Текущие процессы//Планы//,26,2017-11-29T06:13:47.000Z,6014,375,7,114,False
Комсомольская Правда,2,17.29.11,Видео похорон Дмитрия Хворостовского в Москве,22,2017-11-28T12:25:59.000Z,107364,200,108,77,False
ԳԱԼԱ Հեռուստաընկերություն,2,18.19.04,Մոսկվայում ՀՀ դեսպանատան մոտից Հայաստանի քաղաքացիներ են ձերբակալվել,25,2018-04-18T12:40:31.000Z,71817,796,71,212,False
informare,2,18.03.04,"Виктория Скрипаль о лжи Британии: Меня отфутболили, они врут, я забираю их в РФ.",25,2018-04-02T13:48:37.000Z,329575,1800,712,545,False
ZELENO,2,18.26.01,ZELENO - Без Тебя [Премьера Клипа],10,2018-01-25T06:14:15.000Z,369863,6087,391,120,False
Реальный Факт,2,18.27.03,Выжившая девочка рассказала подробности трагедии в ТЦ в Кемерово,25,2018-03-26T10:54:28.000Z,62725,478,27,168,False
MarinaStar81,2,17.02.12,ФИКС ПРАЙС ДЕКАБРЬ 2017!!! НОВОГОДНИЙ ОБЗОР  FIX PRICE !!! ОГРОМНЫЕ ПОКУПКИ !!! НОВИНКИ FIX PRICE,22,2017-12-01T05:00:00.000Z,4322,45,4,14,False
Людмила Кравченко,2,18.01.03,ФИКС ПРАЙС / МАРТ 2018. Крутые новинки в магазине FIX PRICE.Для сада и огорода.Орск.,22,2018-03-01T07:20:02.000Z,2796,95,12,33,False
Artem TOP MLM,2,18.08.02,ПУТИНА CHИМAЮТ C BЫБOPOB  ГРУДИНИН — HOBЫЙ ПPE3ИДEHТ  — Геннадий Зюгано,1,2018-02-07T21:09:30.000Z,18006,1322,161,201,False
МеждоМедиа Политика,2,17.04.12,НАВАЛЬНЫЙ: ИТОГИ МИТИНГА В САРАТОВЕ | МеждоМедиа Групп,22,2017-12-03T15:00:02.000Z,21213,5854,56,472,False
Gennady M,2,18.03.03,Как сохранить и приумножить крипто-капитал (короткая версия),28,2018-03-02T19:57:43.000Z,7912,829,20,125,False
СМЕШНЫЕ КОТЫ И КОШКИ ПРИКОЛЫ 101 MEDIA,2,17.20.11,Приколы с животными Подборка приколов Ноябрь 2017 Смешные собаки Смешные коты 2017 и Попугаи,15,2017-11-19T08:02:21.000Z,8792,76,3,53,False
Omer Menashe,2,18.04.06,HOW TO TRAIN YOUR DRAGON 3: The Hidden World Trailer (2019) HD Movie (Unofficial),22,2018-06-02T20:06:26.000Z,304195,2911,1899,509,False
ПЛАН ЛОМОНОСОВА,2,17.09.12,План Ломоносова Резкая как нате!,10,2017-12-08T09:12:38.000Z,63563,830,139,140,False
Голос. За честные выборы,2,18.19.03,"Вброс бюллетеней, выборы 18 марта 2018, Люберцы",29,2018-03-18T11:41:22.000Z,329057,5502,7881,2914,False
Филиал ВГТРК ГТРК Башкортостан,2,18.08.02,В Уфе судмедэксперты устанавливают причину смерти 22-летней студентки медуниверситета,25,2018-02-07T16:19:43.000Z,6756,8,4,1,False
Farik ʕ ᴖᴥᴖ ʔ,2,18.28.03,МИТИНГ В КЕМЕРОВО 2018 ПРЯМАЯ ТРАНСЛЯЦИЯ 27.03.2018 СКОРБИМ,20,2018-03-27T12:46:28.000Z,165049,2418,1419,119,False
Сарказмошная,2,18.17.05,ЕСЛИ БЫ В ПЕСНЕ ПЕЛОСЬ О ТОМ ЧТО ПРОИСХОДИТ В КЛИПЕ НАСТЯ КАМЕНСКИХ — #ЭТОМОЯНОЧЬ,23,2018-05-16T12:54:03.000Z,30126,2802,185,169,False
Kupidon,2,18.13.03,ПЕРВАЯ НОЧЬ — НУБ УЧИТ НУБА КАК ИГРАТЬ В МАЙНКРАФТ #2 — НУБ ПРОТИВ ЗОМБИ MINECRAFT— ШКОЛА МАЙНКРАФТА,20,2018-03-12T13:00:11.000Z,39242,2358,65,316,False
Максим Ляхов,2,17.26.11,212. Чудо-МАМА,22,2017-11-25T13:49:34.000Z,3257,335,4,15,False
Александр Буш,2,17.17.11,Офигенный голос. Девушка очень красиво поет Новый день (SONIKA - Новы дзень).,24,2017-11-16T07:16:30.000Z,260645,20684,2342,1011,False
kz film,2,18.31.05,KZ FILM -  Миллион,22,2018-05-13T19:26:09.000Z,326395,2860,397,0,True
AromaFortuna,2,18.14.04,Стильные casual образы весна-лето 2018 💎 Модный кэжуал лук в одежде для женщин фото Casual look,22,2018-04-14T05:46:35.000Z,6169,179,14,8,False
Михаил Алфёров Кемерово,2,18.31.03,тулеев отставка тулеев день III,22,2018-03-30T09:52:22.000Z,12579,749,21,446,False
Ростов-на-Дону Главный,2,18.24.03,Драка в Магните за кружки с игрушками,25,2018-03-23T14:19:16.000Z,21954,335,70,430,False
Byte Conveyor Studios,2,17.15.11,AC-130 Gunship Simulator - Convoy engagement,20,2015-03-25T07:17:42.000Z,1010639,1992,482,1033,False
OVO Sound,2,18.17.02,Drake - God's Plan (Official Music Video),10,2018-02-16T16:03:41.000Z,4569886,380252,4084,33602,False
Заметки бизнесмена,2,17.21.12,Владимир Соловьев - Жесткие переговоры (документальный фильм),22,2017-12-20T12:00:04.000Z,132458,192,3061,459,False
Dmitry America,2,17.10.12,ЖАЖДА СКОРОСТИ ИЛИ ФОРСАЖ ПО РУССКИ. БЛОГ О ЖИЗНИ В АМЕРИКЕ,22,2017-12-09T06:09:38.000Z,69551,1612,134,38,False
topordybenko,2,18.06.03,"Гарри Топор (при уч. Тони Раут, PLC) – Аспирин (муз. NZT)",10,2018-03-05T16:20:10.000Z,74086,4842,918,560,False
Сергей Росси,2,17.05.12,Сергей Росси - Папа,10,2017-12-04T05:51:47.000Z,124337,1302,1906,493,False
ФиБ - прогнозы на спорт,2,18.08.02,СТРАТЕГИЯ СТАВОК НА ФУТБОЛ 70% ЗАХОДА / ТЕОРИЯ НА ФУТБОЛ / УГЛОВЫЕ,17,2018-02-08T00:12:31.000Z,2817,487,43,55,False
Yuframe,2,17.21.11,Братухи - Все серии,24,2017-11-20T15:55:44.000Z,51489,2015,24,194,False
DANYA TV,2,17.15.11,Danya Драже (Официальное видео 0+),10,2017-11-14T14:25:30.000Z,71918,2151,1022,198,False
Женек Хм,2,18.13.03,11.03.2018 Спартак - СКА Хабаровск. 1-0. Гол Фернандо.,22,2018-03-11T20:31:27.000Z,6961,49,5,2,False
lomonosovclub.com,2,18.31.05,ЕГЭ 2018 МАТЕМАТИКА✏️,27,2018-05-31T17:49:45.000Z,21574,1639,28,11,False
ВАСЬКА ВАСЬКИН запаска,2,17.24.11,Путин уронил стул Эрдогана,29,2017-11-23T17:11:13.000Z,54422,99,62,172,False
MISS NATALI 55 OMCK TB,2,18.16.04,моя гуппа,22,2018-04-16T02:02:46.000Z,2052,135,89,194,False
SIDELNIKOV,2,17.28.11,Сбербанк и Центробанк дали ответы по кодам и счетам 643 и 810.,22,2017-11-27T16:40:39.000Z,6309,317,9,129,False
Дмитрий Завьялов,2,18.27.04,Полностью новый КамАЗ 2018,2,2018-04-27T03:01:10.000Z,1144,48,3,6,False
АВТОТУТ,2,18.02.02,Ауди или Субару? В снегу против внедорожников!!!,2,2018-02-01T15:21:03.000Z,34645,1248,50,183,False
Nezumi,2,18.09.03,Сладкие следы укусов... 26 глава [Озвучка манги],1,2018-03-08T11:52:52.000Z,28078,3501,8,816,False
Мама Туся,2,18.01.05,Мама Туся смотрит Филипп Киркоров - Цвет настроения синий,22,2018-04-30T13:50:11.000Z,27070,1374,115,313,False
Ser Gamer,2,18.16.03,Cover Feduk Хлопья летят наверх,22,2018-03-15T15:08:20.000Z,376448,30830,2834,7424,False
Mis Gibi,2,17.02.12,Adını Sen Koy 230. Bölüm - İlk Sahne,22,2017-12-01T15:21:34.000Z,21272,65,3,3,False
Linkin Park,2,17.17.11,One More Light Live (Live Album Trailer) - Linkin Park,10,2017-11-16T18:06:39.000Z,272730,38520,113,2106,False
Polina Gagarina,2,17.22.12,Полина Гагарина - Обезоружена,10,2017-12-21T07:30:04.000Z,358426,8318,1084,593,False
NFL,2,18.05.02,Justin Timberlake’s FULL Pepsi Super Bowl LII Halftime Show! | NFL Highlights,17,2018-02-05T01:51:53.000Z,2032080,50255,15239,14413,False
tvumma,2,17.06.12,5 правил приема пищи,29,2017-12-05T08:10:12.000Z,7981,598,10,32,False
Old School Combat MMA,2,18.28.04,ФЕДОР ЕМЕЛЬЯНЕНКО VS. ФРЭНК МИР - ОБЗОР ЗАБЫТЫХ БОЕВ!,17,2018-04-27T11:36:25.000Z,49171,3055,50,317,False
comedoz,2,18.21.05,ПАВЛИК 4 сезон 8 серия,23,2018-05-20T15:56:11.000Z,247014,8827,910,499,False
Максим Халанский,2,18.06.05,Митинг Санкт Петербург прорыв баррикад 05.05.18,22,2018-05-05T16:42:04.000Z,85057,1900,3416,1654,False
Виталий Жуков Trade Blog,2,18.17.02,Биткоин . Ripple . Тем кто по 3$ купил. Тренируем выдержку.,22,2018-02-16T21:31:59.000Z,2336,303,11,55,False
ToPic,2,17.14.11,Мощное землетрясение Ирак и Иран 12.11.2017 первые кадры. Earthquake on Iran-Iraq border. زلزله,29,2017-11-13T06:43:32.000Z,25075,118,10,49,False
PeReC - KLygeR,2,18.25.01,24 ЧАСА В ЗАКРЫТОЙ ГОРНОЛЫЖКЕ - [#2] ПРАНКИ НАЧИНАЮТСЯ | ОДИН НА ПОДЪЁМНИКЕ,22,2018-01-24T11:06:20.000Z,131705,25750,190,2105,False
Великая Россия,2,18.31.03,По щучьему велению (2018) - Мелодрама фильмы 2018 - Новые фильмы,22,2018-03-19T17:10:33.000Z,64861,264,69,21,False
Vika Moseevskix,2,18.05.02,😲Истории из лагеря.😱 Описалась в лагере... Воровки в лагерях . 2 Часть .,22,2018-02-04T16:09:28.000Z,38152,3213,168,645,False
Игорь Бурцев,2,17.18.11,Тестировал Lada Vesta SW Cross Разбил Коптер. Как?!? Игорь Бурцев,2,2017-11-17T16:53:18.000Z,36228,1748,104,514,False
TOP MUSIC,2,18.31.05,НОЧНОЙ ЗАПОР (ПОСЛЫШАЛОСЬ),10,2018-05-30T08:18:01.000Z,512837,13954,1871,1348,False
Виктория Авдеева,2,18.14.05,ОЧЕНЬ ЭФФЕКТНЫЙ ВЕСЕННИЙ ДИЗАЙН НОГТЕЙ ЦВЕТЫ  | ИДЕИ МАНИКЮРА 2018,26,2018-05-13T17:28:10.000Z,5195,605,15,34,False
Victoria Koroleva,2,17.29.11,Как похудеть,17,2017-11-28T16:34:59.000Z,105499,1180,348,239,False
дерни с лоусоном!,2,17.29.12,Дернули как следует!,22,2017-12-28T06:51:33.000Z,118290,1193,250,27,False
Последние новости 24H,2,18.26.03,Что случилось в кемерово,25,2018-03-25T23:56:23.000Z,7165,25,36,11,False
Гаспар Авакян,2,18.18.02,Ростов-на-Дону мк-р Левенцовка борьба за тротуар,22,2018-02-17T17:38:23.000Z,3908,280,22,66,False
Opershop D,2,18.22.04,"Ураган в Москве, 21.04.2018. Сильный ветер 21 апреля 2018 Москва",24,2018-04-21T14:40:14.000Z,233064,433,516,399,False
Санкт-Петербург / Saint Petersburg,2,17.16.12,St Petersburg - Родина футбола (официальный клип),10,2017-12-15T06:30:00.000Z,232383,13213,1638,595,False
SkyBek,2,17.19.11,3 Simple & Fun Life Hacks,24,2017-11-18T12:33:32.000Z,194530,2359,626,257,False
Лев Вожеватов,2,18.18.04,5 признаков навязчивой девушки,27,2018-04-17T11:00:01.000Z,12140,1007,22,65,False
Ярослав Левашов,2,18.14.02,"Тачки, лодка, два часа. Наш испанский гараж в [4k/UHD]",2,2018-02-13T18:36:14.000Z,12295,1126,35,201,False
Lena Krupina,2,18.11.02,МИХАИЛ КОЛЯДА ПРОВАЛИЛСЯ НА ОЛИМПИАДЕ 2018 | Фигурное катание без медалей?!,17,2018-02-10T10:42:29.000Z,20930,469,48,180,False
Jung Hyun Ran,2,18.22.05,[LIVE] BTS 'FAKE LOVE' - 2018 Billboard Music Awards,22,2018-05-21T02:57:09.000Z,6813271,472528,5733,24481,False
Life is Good,2,18.21.01,On-Line трансляция Конгресса-2018 холдинга Life is Good,27,2018-01-20T17:28:17.000Z,10503,193,11,0,True
CCTV春晚,2,18.15.02,正在直播：2018中央电视台春节联欢晚会 | 2018 CCTV Spring Festival Gala,24,2018-02-01T03:05:29.000Z,98921,8034,1197,0,False
YANGI KANAL,2,18.26.01,AFTOBUSDA QURBON BO'LGAN YIGITNING XOTINI XOMLADOR EDI...,25,2018-01-25T10:39:20.000Z,13562,156,14,37,False
Rina Тян,2,18.20.02,комикс Undertale |Что если бы...Тори убила фриск| (Rinaider),22,2018-02-19T21:09:25.000Z,1601,322,3,64,False
Sergey Tselikov,2,18.20.01,Наша поддержка курсантов Ульяновского летного училища,1,2018-01-18T15:02:14.000Z,125178,2418,190,258,False
E1.RU - резервный канал,2,17.14.11,Конкурсная работа студентов РГППУ Начало,29,2017-11-13T06:51:16.000Z,3011,3,2,0,False
Sasha Chistova,2,18.06.05,ДЛЯ ЧЕГО ТЫ ЖИВЕШЬ?,26,2018-05-05T15:30:00.000Z,137712,30078,366,2392,False
Tabula Rasa,2,17.18.11,Жестко о правительстве Медведева.М.Делягин,22,2017-11-17T11:21:49.000Z,7804,159,28,30,False
The Country Cook,2,17.27.12,How to make: Easy Pumpkin Pie Bars,22,2017-12-03T18:32:03.000Z,14086,11,0,1,False
SHEEPKIN,2,17.06.12,Обзор на Любовь Онлайн - ОПЫТНАЯ МАЛОЛЕТКА,22,2017-12-05T16:30:00.000Z,5093,591,6,89,False
Artem Gorbunov,2,18.01.01,"Южно -Сахалинск , площадь Ленина Новый 2018 год сгорела ёлка!",22,2017-12-31T15:26:13.000Z,107533,1623,84,672,False
ZAKATOON,2,18.20.05,ОТНОШЕНИЯ,23,2018-05-18T13:00:08.000Z,48611,4252,85,402,False
Андрей П,2,18.17.03,Землетрясение на Байкале 16.03.2018,22,2018-03-16T13:07:22.000Z,38622,350,151,60,False
HowToBasic,2,17.18.11,How To Make a Breakfast Pizza,26,2017-11-17T17:59:03.000Z,574332,49589,1913,5298,False
Demura Channel,2,18.07.05,Инаугурация Путина 2018 - позорный провал!,25,2018-05-06T18:47:09.000Z,76461,1263,227,766,False
ODIS,2,18.25.05,ДРУЗЬЯ - анимация,22,2018-05-24T11:54:04.000Z,87329,15330,139,677,False
Vladimir Alene,2,18.08.03,Сборник женщинам 8 марта - Для вас поют мужчины - Красивые песни о любви,10,2018-03-06T17:17:18.000Z,27792,272,20,17,False
Позитивный Ванька,2,18.13.05,Евровидение 2018 Выбежал И Забрал Микрофон! Eurovision 2018 ran to the stage and took the microphone,10,2018-05-12T20:27:22.000Z,78169,941,139,356,False
FreeCards Hub,2,18.06.01,FREE XBOX GIFT CARD CODES|HOW TO GET FREE XBOX CODES 2018,26,2018-01-05T13:06:51.000Z,22443,1062,51,38,False
Bona Ladies,2,18.24.01,Ульяновские курсанты Satisfaction в поддержку от швейного цеха,26,2018-01-23T08:37:52.000Z,43607,613,27,69,False
Александр Иваницкий,2,18.04.01,Живи Осознанно! Правила Осознанной Жизни!,22,2018-01-03T19:21:53.000Z,5576,541,7,33,False
Sprite Russia,2,18.02.04,ХЛЕБ — Sprite,24,2018-03-31T20:46:50.000Z,1655401,42760,8846,1038,False
POPxoDaily,2,18.05.06,Date Night feat. Uber - POPxo,23,2018-05-29T12:30:00.000Z,385012,4671,252,283,False
Наталья Данилович,2,18.12.05,Дочь стала тираном матери  Актриса Харитонова,22,2018-05-11T14:53:30.000Z,66731,393,39,141,False
Hiiki Omori,2,18.18.05,МОЯ РЕАКЦИЯ НА ЯОЙ,22,2018-05-17T13:42:23.000Z,15778,2960,45,374,False
BOOME,2,17.30.11,Тимати подал в суд на Немагию за этот мульт.  Собчак и Скруджи тоже.  Boome,22,2017-11-29T16:25:14.000Z,32900,907,184,103,False
Gleb Kornilov & Chubaka,2,17.13.12,В Германию с собакой/Обман при прокате авто/World Dog Show/Chubaka Vlog!,22,2017-12-12T14:01:46.000Z,8911,693,12,51,False
TennisVIPclub,2,18.10.03,Заход на четверной! Александра Трусова - новая соперница Загитовой и Медведевой,17,2018-03-09T11:18:53.000Z,32214,150,10,18,False
ARB Sheki,2,17.30.11,Konul Kerimovanin qizinin toyunda bash verenler (Gune son),24,2017-11-29T08:48:50.000Z,18700,81,8,4,False
НОВОСТИ ДНЯ,1,18.10.05,Путин спас ветерана на параде Победы,25,2018-05-09T10:41:22.000Z,12453,45,21,50,False
YOGURT,1,18.11.03,🔥ИГРАЕМ ТУРНИР 2Х2 НА 500$? ВОЗВРАЩАЕМ БОЛЬШОЙ БАЛАНС НА САЙТЕ? НАБЕРЁМ 3000 ЛАЙКОВ?,20,2018-03-10T13:50:55.000Z,92958,8770,592,23,False
Radiocat,1,17.14.11,"КТО Я? Вебкам, мотики, бывший муж, общая инфа.",22,2017-11-13T09:58:09.000Z,3856,247,75,45,False
Елена Авдеева,1,18.19.01,С Крещением Господним,22,2018-01-18T05:07:54.000Z,39451,131,15,2,False
ВИДЕО ТОП КАНАЛ,1,18.02.05,Копия видео яковлев рассказывает про соседа дядю колю прико 2018 смотреть всем угар,22,2018-04-27T18:37:05.000Z,9772,143,4,2,False
GTRby RedGP,1,18.16.02,"Сцены с Яковлевым не попавшие на экран  Полицейский с Рублевки 1, 2 сезон",23,2018-02-15T17:45:13.000Z,59763,435,48,15,False
Katw Kold,1,18.04.04,Даня + Эля | танцы на стёклах [ 2 сезон 10 серия ] | Ивановы-Ивановы,1,2018-04-03T15:24:23.000Z,8241,239,8,53,False
Natalia Finik,1,18.01.02,Эпизод эфира программы 60 минут по горячим следам от 15.01.2018,22,2018-01-15T12:24:13.000Z,11332,109,7,22,False
AniCoubS,1,18.24.02,AniCoubS #76 | Аниме приколы | Anime COUB | VRChat НА РУССКОМ,24,2018-02-24T03:06:35.000Z,1437,247,2,58,False
Gentle Whispering ASMR,1,18.30.04,Adventure in Nature 🌲 ASMR 🌲 Soft Spoken,26,2018-04-30T01:24:21.000Z,142432,11044,130,1579,False
Gain Genetics,1,18.03.01,40´painful seconds [MOTIVATIONAL],17,2018-01-02T15:30:01.000Z,6623,195,2,6,False
Vine Video,1,17.11.12,Лучшие ролики недели #134 Идеально!,29,2017-12-10T17:48:26.000Z,33931,898,48,26,False
LATEST STATUS,1,17.27.12,Naah ||Hardy SandhuPhotos|| Whatsapp Status,22,2017-12-17T07:54:58.000Z,18955,6,0,0,False
Артемий Лебедев,1,18.09.01,Переплетные работы в Индии,19,2018-01-08T22:06:20.000Z,9530,86,3,10,False
Виталий Пиганов,1,18.05.02,Хаски Капелла и говяжий мосол. Как чистить зубы собаке естественным путем,22,2018-02-04T15:01:54.000Z,12362,975,11,196,False
Afro Blue,1,17.14.11,お昼寝の前にお話しないと眠れない猫♥♥猫との会話を楽しむ動画 Conversation with a cat,15,2016-07-12T08:38:30.000Z,1390596,9816,246,554,False
Léo Nascimento,1,18.25.05,Léo Nascimento - Eu Caso (DVD),10,2018-05-10T20:04:45.000Z,451594,10205,370,927,False
Elena Varankina,1,18.02.05,Tutorial ВИНТАЖНЫЕ КУКЛЫ FACE AWARDS RUSSIA 2018 //#FaceawardsRUSSIA2018 #nyxcosmeticsrussia,22,2018-04-30T20:54:17.000Z,11169,1029,9,56,False
MisterKey,1,18.13.05,FORZA HORIZON 3 - ПЕРВЫЙ ВЗГЛЯД и ПЕРВЫЕ ГОНКИ в АВСТРАЛИИ!,20,2018-05-13T11:58:12.000Z,18490,1961,95,45,False
Training World,1,18.07.01,Quinton Jackson was knocked down preparing for the fight on Bellator 192,17,2018-01-06T23:21:35.000Z,6344,4,1,2,False
Телекомпания АКТИС,1,18.25.03,Штраф за отсутствие жилета,25,2018-03-14T15:25:42.000Z,18174,23,16,53,False
E1 MUSIC Новая Музыкальная Компания,1,18.03.01,ID Project - Царь на месте - Ай Ди Проект Премьера видео,10,2018-01-02T06:31:20.000Z,114714,1230,763,171,False
AVENUE PRODUCTION,1,17.04.12,Горки Город открытие зимнего сезона или вакханалия на трассе.,17,2017-12-03T05:32:48.000Z,3511,220,1,126,False
BNews Kz,1,18.23.05,Буран в Астане 22 05 2018,25,2018-05-22T10:25:34.000Z,366243,1826,304,1051,False
Алекc Fish,1,18.13.05,ОГРОМНЫЙ КАРП и МАЛЕНЬКИЙ ПОДСАК!!!,22,2018-05-06T11:54:16.000Z,34095,190,31,10,False
La Roche-Posay Portugal,1,17.28.12,La Roche-Posay | Save Your Skin | Nic Von Rupp recomenda Anthelios,22,2017-06-05T10:04:55.000Z,83878,14,35,9,False
videos i like,1,17.29.12,Tareya de des || Prabh gill || cover by Seerat,22,2017-12-28T03:48:08.000Z,26872,35,158,24,False
camobodia kubota,1,17.14.12,google play gift cards-free google play-free google play codes,22,2017-11-17T11:24:11.000Z,7724,5,1,0,False
UzXit TV,1,18.05.02,Ш.Мирзиёев Каламуш Рахбарларни Курашга Чакирди! Аламим Бор Мани...,22,2018-02-04T12:56:02.000Z,52059,1019,20,91,False
БЕЛЯНКИН,1,18.25.02,(НЕ ПОЛОВИНКИ) ЖЁСТКАЯ ЛЕДИ   [Чё в телике],24,2018-02-24T15:00:04.000Z,11379,1082,21,71,False
PolinaRepik,1,18.31.05,Как подготовиться к ПОЯВЛЕНИЮ МАЛЫША | Что необходимо иметь дома для НОВОРОЖДЕННОГО,26,2018-05-31T08:00:04.000Z,16866,1112,20,169,False
PhysioFeel,1,17.26.12,PhysioFeel,27,2017-12-15T04:49:22.000Z,12457,11,0,2,False
ZAMIN UZ TV,1,18.15.02,Сиз кутган Nexia Lacetti Cobalt нархлари. 15.02.2018.,24,2018-02-15T10:50:30.000Z,960,91,5,21,False
Vesti Irkutsk,1,17.14.11,Автомобиль наехал на автомеханика прямо на СТО в Ангарске,22,2017-11-13T07:51:20.000Z,2036,2,0,0,False
rharris01,1,18.01.04,Need For Speed No Limits Hack-Free Gold & Cash 2018 for iOS & Android,20,2018-03-31T15:14:38.000Z,61651,1004,2,0,False
Simon Khorolskiy,1,18.07.03,О МОЛИТВА - Simon Khorolskiy,10,2018-03-07T05:00:03.000Z,5955,777,10,140,False
Denis Larin,1,18.27.03,Вся правда про Кемерово:Сколько погибших:Что случилось,22,2018-03-26T12:32:59.000Z,467149,3516,1125,1110,False
Rhyz The Gamer,1,17.17.12,Xbox One New Update,20,2017-12-06T17:05:14.000Z,15872,5,10,9,False
NiceguyTheILLIAN,1,17.28.12,#VIRAL - Stefflon Don - Hurtin Me  FREESTYLE (VIRAL FACEBOOK VIDEO),10,2017-12-08T20:31:00.000Z,25893,45,1,0,False
Константа Народный Репортёр,1,18.16.01,Альфа Страхование - Жесть! Каждый с Этим Сталкивался...,29,2017-02-10T10:10:50.000Z,16549,117,75,3,False
Хороший выбор!,1,18.20.04,Ryzen 2700x - разрывает intel в клочья?,28,2018-04-19T13:00:19.000Z,82900,5097,549,1187,False
лерыч к,1,18.25.02,Как сделать лавочку? Да легко.,26,2018-02-24T23:37:33.000Z,1872,311,1,35,False
Fleet Fleet,1,17.27.12,New Music Release Date,22,2017-11-10T03:51:43.000Z,30720,2,0,0,False
Air Cake - Десерты и вкусняшки,1,18.01.03,Торт ОПЕРА рецепт 【легендарная классика】,26,2018-03-01T05:00:01.000Z,4640,622,5,47,False
Чарли Качает,1,17.30.12,Чарли качает в новогоднем клипе,23,2017-12-29T07:02:34.000Z,102537,2282,335,62,False
Oxygen1um,1,18.12.05,РЭП БЕНДИ CAN'T BE ERASED JT MUSIC ПЕСНЯ НА РУССКОМ BENDY AND THE INK MACHINE RAP КАВЕР SFM АНИМАЦИЯ,20,2018-05-11T07:27:34.000Z,46487,2997,95,603,False
TripDelta,1,17.24.12,¡FELIZ NAVIDAD! 🎄 | #SorteoDelta 🎁,20,2017-12-23T20:45:32.000Z,14637,7,0,11,False
Yerevan.Today,1,18.20.04,Սերժ Սարգսյանը հրաժարվել է իրեն հատկացված առանձնատան սեփականության իրավունքից,25,2018-04-19T16:09:33.000Z,43669,115,343,67,False
NashErmak,1,18.01.03,Массовая драка на матче Южный Урал - Ермак - 28 февраля 2018,17,2018-02-28T16:30:51.000Z,16542,42,1,13,False
Озвучка Skaigi,1,18.02.01,Новогодний Комикс Микс Undertale #4 RUSDUB.,24,2018-01-01T03:16:52.000Z,6164,506,10,48,False
КОРТ,1,18.06.06,КАК ОКУПИТЬСЯ НА САЙТЕ 1dice.net (РЕАЛЬНО!),20,2018-06-03T14:43:06.000Z,40320,3344,718,0,True
MT PRODUCTION,1,18.08.01,Super Mama 2 / Սուպեր Մամա 2 / Супер Мама 2 (2017/Фильм Full),23,2018-01-07T13:10:46.000Z,393435,8037,360,1013,False
Фатима Янбаева,1,17.26.12,СВАДЬБА ГОДА 2017. НАША ИДЕАЛЬНАЯ СВАДЬБА ЭТО КРАСИВАЯ ТРАДИЦИОННАЯ СВАДЬБА,22,2017-12-25T18:35:45.000Z,31880,12,0,7,False
"Новокузнецк – город-сад! (город, которого нет)",1,18.20.02,Полиция препятствует законной агитации за Грудинина,22,2018-02-19T08:41:14.000Z,21790,256,6319,178,False
Sarah Snef,1,18.01.05,Пони страшилка Передай мне свою душу/от Эви Го/,1,2018-04-30T11:00:40.000Z,13912,881,29,112,False
Messeblick TV,1,18.13.01,Spielwarenmesse 2017 auf Messeblick.TV,24,2017-02-08T21:55:56.000Z,19888,5,0,0,False
LIVE SHOW,1,18.06.05,Головкин - Мартиросян6.05.2018,22,2018-05-06T04:23:57.000Z,7576,332,39,91,False
ACHINSKOE TV,1,18.21.03,ДА НИЛ - VORONEZH POWER RYTPMV,23,2018-03-20T13:07:24.000Z,11581,1482,25,62,False
Юрий Рогоцкий,1,18.08.02,"Заводим Газ-63 зимой ,немного прокатились.",2,2018-02-08T02:48:58.000Z,1497,164,4,29,False
монеточка,1,18.05.06,Монеточка - Запорожец (prod. Витя Исаев),10,2018-06-04T07:00:04.000Z,276610,16214,1056,660,False
T8C Fashion,1,17.24.12,T8C PV,1,2017-12-24T03:11:22.000Z,5519,0,0,0,True
MILLER,1,18.25.01,КАК ДОСТАТЬ МОНЕТЫ В ФИФА 18,20,2018-01-24T17:20:11.000Z,42079,4285,111,166,False
